,title_x,publish_time_x,abstract,authors,journal,url,category
12717,Normalization cancer immunotherapy: blocking Siglec-15!,2019-04-19,"INTRODUCTION: Acute spinal cord injury is associated with an increased risk of thromboembolic events. Low-molecular-weight heparins are first-line medications for both the treatment and prevention of venous thromboembolism. Pharmacological prophylaxis may be indicated for high-risk patients and low-risk patients may be managed with non-pharmacological measures. CASE PRESENTATION: We report two cases of gluteal hematomas that occurred in patients with chronic spinal cord injury who were under prophylactic doses of enoxaparin at a tertiary rehabilitation hospital. There was no local trauma. The patients needed multiple surgical interventions and rehabilitation treatment was delayed. DISCUSSION: There is a lack of evidence to correctly estimate the thromboembolic risk in chronic spinal cord injury and the duration of prophylaxis. Over-prescription of pharmacological prophylaxis may expose patients to unnecessary risks. These patients frequently present with polypharmacy and reducing the amount of prescribed medication may begin with reducing prophylactic treatments for venous thromboembolism, which may be an overtreatment based on risk overestimation.","de Almeida, Rodrigo Lanna; Gonzaga, Bruno Pissolati Mattos; Beraldo, Paulo Sérgio Siebra; Amado, Veronica Moreira",Spinal Cord Ser Cases,https://www.ncbi.nlm.nih.gov/pmc/articles/PMC6474234/,637
12724,Epigenetic drug library screening identified an LSD1 inhibitor to target UTX-deficient cells for differentiation therapy,2019-04-26,,"Sasaki, Keita; Shiba, Kogiku; Nakamura, Akihiro; Kawano, Natsuko; Satouh, Yuhkoh; Yamaguchi, Hiroshi; Morikawa, Motohiro; Shibata, Daisuke; Yanase, Ryuji; Jokura, Kei; Nomura, Mami; Miyado, Mami; Takada, Shuji; Ueno, Hironori; Nonaka, Shigenori; Baba, Tadashi; Ikawa, Masahito; Kikkawa, Masahide; Miyado, Kenji; Inaba, Kazuo",Commun Biol,https://www.ncbi.nlm.nih.gov/pmc/articles/PMC6609717/,637
12764,"The proatherosclerotic function of indoleamine 2, 3-dioxygenase 1 in the developmental stage of atherosclerosis",2019-07-19,"BACKGROUND: Hyperbaric oxygen (HBO(2))—oxygen at pressures higher than atmospheric—is approved for 14 indications by the Undersea and Hyperbaric Medical Society. HBO(2)’s main effect is to increase oxygen content in plasma and body tissues, which can counteract hypoxia or ischemia. Laboratory studies show that HBO(2) has effects beyond relieving hypoxia (eg, promoting angiogenesis in irradiated tissue, anti-inflammatory effects, radiosensitization of tumors, hypoxia preconditioning, and fungal growth inhibition) and has potential to treat conditions such as inflammatory bowel disease and pyoderma gangrenosum. Lack of consistently collected outcome data on a large cohort of individuals receiving HBO(2) therapy limits its use for both established and new indications. A course of therapy often involves 30-40 visits to a hyperbaric chamber, so the number of patients seen at any given center is constrained by chamber capacity. As a result, published HBO(2) outcome data tend to be from small case series because few patients with a particular condition are treated at a given center. To solve this problem, a registry that collects and pools data systematically from multiple institutions has been established. OBJECTIVE: The aim of this study is to collect consistent outcome data across multiple hyperbaric centers to assess treatment effectiveness and establish a research consortium. METHODS: A consortium of hyperbaric centers who have agreed to collect consistent outcome data on all patients seen has been assembled. Data are collected at each participating center using Research Electronic Data Capture (REDCap), a web-based, data collection system used frequently for research. Standard outcome measures have been defined for each condition, which are programmed into the REDCap data collection templates. Governance is through a consortium agreement that defines data security, data sharing, publications, liability, and other issues. Centers obtain Institutional Review Board (IRB) and ethics approval to participate, either from their own institutions or by relying on the IRB at the coordinating center at Dartmouth College. Dissemination will occur through a yearly report and by publications based on the data in the registry. RESULTS: Early results from some common indications show significant pretreatment to posttreatment changes. Additional indications and outcome measures are being added using the procedures outlined in the consortium agreement. CONCLUSIONS: The registry collects consistent outcome information for a therapy that needs further study and a stronger evidence base. It also overcomes the challenge of collecting data from an adequate number of patients for both established and emerging indications by combining data collection from multiple centers. The data entry requirements should be within the capabilities of existing staff at any given hyperbaric center. By using REDCap, the registry can be expanded to include detailed information on particular indications and long-term follow-up on selected patients without significantly increasing the basic data entry requirements. Through the registry, a network of enrolled hyperbaric centers has been established that provides the basis for a clinical trial network. INTERNATIONAL REGISTERED REPORT IDENTIFIER (IRRID): DERR1-10.2196/18857","Harlan, Nicole P; Ptak, Judy A; Rees, Judy R; Cowan, Devin R; Fellows, Abigail M; Kertis, Judith A; Hannigan, Pamela M; Peacock, Janet L; Buckey, Jay C",JMIR Res Protoc,https://www.ncbi.nlm.nih.gov/pmc/articles/PMC7459436/,637
13111,The effect of selective serotonin reuptake inhibitors on cognitive function in patients with Alzheimer’s disease and vascular dementia: focusing on fluoxetine with long follow-up periods,2019-08-30,"Metastasis is a major cause of chemotherapeutic failure and death. Degradation of a specific component of the extracellular matrix (ECM) by matrix metalloproteinases (MMPs) affects the physical barrier of the tumor microenvironment (TME) and induces metastasis. Here, lysolipid-containing thermosensitive liposomes (LTSLs) were prepared to deliver an MMP inhibitor, marimastat (MATT), to the TME to inhibit MMP activity and expression. LTSLs rapidly released their payloads at 42 °C. Compared with the saline control, MATT-LTSLs exhibited enhanced accumulation in the tumor and a 20-fold decrease in tumor growth in 4T1 tumor-bearing mice; moreover, MATT-LTSLs reduced MMP-2 and MMP-9 activity by 50% and 43%, respectively, and downregulated MMP-2 and MMP-9 expression in vivo by 30% and 43%, respectively. Most importantly, MATT-LTSL treatment caused a 7-fold decrease in metastatic lung nodules and a 6-fold reduction in microvessels inside the tumor. We believe this study provides an effective approach for the suppression of metastasis, and the use of a cytotoxic agent in combination with MATT is a potential strategy for metastatic cancer treatment.","Lyu, Yaqi; Xiao, Qingqing; Yin, Lifang; Yang, Lei; He, Wei",Signal Transduct Target Ther,https://www.ncbi.nlm.nih.gov/pmc/articles/PMC6799847/,637
13115,Potent delivery of an MMP inhibitor to the tumor microenvironment with thermosensitive liposomes for the suppression of metastasis and angiogenesis,2019-08-09,"OBJECTIVES: To examine and adapt a conceptual framework of the working alliance (WA) in the context of a low-intensity blended (psychological well-being practitioner (PWP) plus computerised program) cognitive behavioural therapy intervention (b-CBT) for depression. DESIGN: Patient involvement was enlisted to collaboratively shape the design of the project from the onset, before data collection. In-depth semi-structured interviews were carried out with participants who experienced b-CBT as part of the E-compared trial. A thematic analysis was conducted using a constant comparative method informed by grounded theory. SETTING: Recruitment was carried out in four psychological primary care services across the UK. PARTICIPANTS: Nineteen trial participants with major depressive disorder who completed at least one computerised program and face-to-face session with a PWP in the b-CBT arm were recruited to the study. RESULTS: Qualitative interviews that were guided by WA theory and patient involvement, revealed four themes: (1) a healthcare provider (PWP and computerised program) with good interpersonal competencies for building a working relationship with the client (‘bond’); (2) collaborative efforts between the client and the provider to appropriately identify what the client hopes to achieve through therapy (‘goals’); (3) the selection of acceptable therapeutic activities that address client goals and the availability of responsive support (‘task’) and (4) the promotion of active engagement and autonomous problem solving (‘usability heuristics’). Participants described how the PWP and computerised program uniquely and collectively contributed to different WA needs. CONCLUSIONS: This study is the first to offer a preliminary conceptual framework of WA in b-CBT for depression, and how such demands can be addressed through blended PWP-computerised program delivery. These findings can be used to promote WA in technological design and clinical practice, thereby promoting engagement to b-CBT interventions and effective deployment of practitioner and program resources. TRIAL REGISTRATION NUMBER: ISRCTN12388725.","Doukani, Asmae; Free, Caroline; Michelson, Daniel; Araya, Ricardo; Montero-Marin, Jesús; Smith, Sarah; Cerga-Pashoja, Arlinda; Kakuma, Ritsuko",BMJ Open,https://www.ncbi.nlm.nih.gov/pmc/articles/PMC7513595/,637
13568,Local delivery of arsenic trioxide nanoparticles for hepatocellular carcinoma treatment,2019-09-06,,"Finsterer, Josef; Scorza, Fulvio A.; Garg, Divyani; Sharma, Suvasini",Indian Pediatr,https://www.ncbi.nlm.nih.gov/pmc/articles/PMC7605474/,637
15953,Oral berberine improves brain dopa/dopamine levels to ameliorate Parkinson’s disease by regulating gut microbiota,2021-02-24,,"AlKarim, Tayseer; Abbara, Aula; Attal, Bothaina",BMJ Glob Health,https://www.ncbi.nlm.nih.gov/pmc/articles/PMC7907850/,637
18042,The STING1 network regulates autophagy and cell death,2021-06-02,"BACKGROUND: Plasmodium vivax is the most prevalent malaria parasite in many countries. A better understanding of human immunity to this parasite can provide new insights for vaccine development. Plasmodium vivax Reticulocyte Binding Proteins (RBPs) are key parasite proteins that interact with human proteins during erythrocyte invasion and are targets of the human immune response. The aim of this study is to characterize the human antibody response to RBP2P1, the most recently described member of the RBP family. METHODS: The levels of total IgG and IgM against RBP2P1 were measured using plasmas from 68 P. vivax malaria patients and 525 villagers in a malarious village of western Thailand. The latter group comprises asymptomatic carriers and healthy uninfected individuals. Subsets of plasma samples were evaluated for anti-RBP2P1 IgG subtypes and complement-fixing activity. RESULTS: As age increased, it was found that the level of anti-RBP2P1 IgG increased while the level of IgM decreased. The main anti-RBP2P1 IgG subtypes were IgG1 and IgG3. The IgG3-seropositive rate was higher in asymptomatic carriers than in patients. The higher level of IgG3 was correlated with higher in vitro RBP2P1-mediated complement fixing activity. CONCLUSIONS: In natural infection, the primary IgG response to RBP2P1 was IgG1 and IgG3. The predominance of these cytophilic subtypes and the elevated level of IgG3 correlating with complement fixing activity, suggest a possible role of anti-RBP2P1 antibodies in immunity against P. vivax.","Hietanen, Jenni; Chim-ong, Anongruk; Sattabongkot, Jetsumon; Nguitragool, Wang",Malar J,https://www.ncbi.nlm.nih.gov/pmc/articles/PMC8173506/,637
207791,DHODH tangoing with GPX4 on the ferroptotic stage,2021,"OBJECTIVES: To describe long-term care services and supports (LTSS) in the United States, note their limitations in serving older adults post-incarceration, and offer potential solutions, with special consideration for the Coronavirus Disease 2019 pandemic. DESIGN: Narrative review. SETTING AND PARTICIPANTS: LTSS for older adults post-incarceration. METHODS: Literature review and policy analysis. RESULTS: Skilled nursing facilities, nursing homes, assisted living, adult foster homes, and informal care from family and friends compose LTSS for older adults, but their utilization suffers from access and payment complexities, especially for older adults post-incarceration. A combination of public-private partnerships, utilization of health professional trainees, and unique approaches to informal caregiver support, including direct compensation to caregivers, could help older adults reentering our communities following prison. CONCLUSIONS AND IMPLICATIONS: Long-standing gaps in US LTSS are revealed by the coronavirus (severe acute respiratory syndrome coronavirus 2) pandemic. Older adults entering our communities from prison are particularly vulnerable and need unique solutions to aging care as they face stigma and access challenges not typically encountered by the general population. Our review and discussion offer guidance to systems, practitioners, and policy makers on how to improve the care of older adults after incarceration.","Boucher, Nathan A; Van Houtven, Courtney H; Dawson, Walter D",J. Am. Med. Dir. Assoc,,637
210425,Proteome-wide epitope mapping identifies a resource of antibodies for SARS-CoV-2 detection and neutralization,2021,,"Olayide, O. E.",Covid-19 in the Global South: Impacts and Responses,,637
215063,Adapt or perish: SARS-CoV-2 antibody escape variants defined by deletions in the Spike N-terminal Domain,2021,,"Tang, J",Osteoporos Int,,637
215064,Adapt or perish: SARS-CoV-2 antibody escape variants defined by deletions in the Spike N-terminal Domain,2021,"In early 2020, the world experienced an unprecedented health crisis. When the pandemic of coronavirus was declared by the World Health Organization, it brought with it sudden and dramatic changes to everyday life. In the UK, the key message from the Government was to 'Stay at home, protect the NHS, save lives', sending out a clear warning that failing to stay at home would put other lives and the ability of the NHS to cope at risk. This editorial discusses COVID-19, how society responded and the vital role that health literacy plays in saving lives during a global health emergency.","Spring, Hannah",Health Info Libr J,,637
220131,Battle at the entrance gate: CIITA as a weapon to prevent the internalization of SARS-CoV-2 and Ebola viruses,2020,Detecting severe acute respiratory syndrome coronavirus 2 in deceased patients is key when considering appropriate safety measures to prevent infection during postmortem examinations. A prospective cohort study comparing a rapid antigen test with quantitative reverse transcription PCR showed the rapid test's usability as a tool to guide autopsy practice.,"Zacharias, Martin; Stangl, Verena; Thüringer, Andrea; Loibner, Martina; Wurm, Philipp; Wolfgruber, Stella; Zatloukal, Kurt; Kashofer, Karl; Gorkiewicz, Gregor",Emerg Infect Dis,,637
227242,Targeting multiple epitopes on the spike protein: a new hope for COVID-19 antibody therapy,2020,,"Lippi, Giuseppe; Favaloro, Emmanuel J",Thromb Haemost,,637
244796,An integrative drug repositioning framework discovered a potential therapeutic agent targeting COVID-19,2021,"Since making its debut on the global stage in December 2019, coronavirus disease 2019 (COVID-19) has afflicted nearly 4 million people and caused hundreds of thousands of deaths. Case reports and case series depicting the clinical effects of the causative virus-severe acute respiratory syndrome coronavirus 2 (SARS-CoV-2)-have been published, yet few demonstrate the cytopathologic alterations of this disease. We present a clinical-pathologic correlation report of a previously healthy Hispanic woman with laboratory-confirmed COVID-19 who had typical features of acute respiratory distress syndrome (ARDS) and also showed cardiac abnormalities thought to represent fulminant viral myocarditis. Congruent with the ARDS clinical impression, autopsy findings were remarkable for extensive and markedly severe acute lung injury consistent with viral pneumonia, characterized by diffuse alveolar damage, pulmonary infarction, severe pulmonary edema, desquamation of pneumocytes with intra-alveolar aggregation, and pneumocyte morphologic alterations suggestive of viral cytopathic effect. However, there was incongruence between the clinical impression and the cardiovascular pathology findings in that viral myocarditis was not detected on histopathologic evaluation. This case highlights the importance of pathologic corroboration of the clinical impression and, in addition, illuminates the key role autopsy plays during a pandemic by providing valuable insight into viral pathology in tissues.","Yan, Lei; Mir, Mahnoor; Sanchez, Paloma; Beg, Moeezullah; Peters, Jay; Enriquez, Omar; Gilbert, Andrea",Arch Pathol Lab Med,,637
249600,D614G and SARS-CoV-2 replication fitness,2021,,"Cooper, David S.",Clinical Thyroidology,,637
249601,D614G and SARS-CoV-2 replication fitness,2021,,"Thiagarajan, Kamala",BMJ,,637
256647,A suspicious role of interferon in the pathogenesis of SARS-CoV-2 by enhancing expression of ACE2,2020,"OBJECTIVES: To investigate which were the most relevant sociodemographic and clinical variables associated with COVID-19 severity, and uncover how their inter-relations may have affected such severity. DESIGN: A retrospective observational study based on electronic health record data. PARTICIPANTS: Individuals &#8805;14 years old with a positive PCR or serology test, between 28 February and 31 May 2020, belonging to the Basque Country (Spain) public health system. Institutionalised and individuals admitted to a hospital at home unit were excluded from the study. MAIN OUTCOME MEASURE: Three severity categories were established: primary care, hospital/intensive care unit admission and death. RESULTS: A total of n=14 197 cases fulfilled the inclusion criteria. Most variables presented statistically significant associations with the outcome (p<0.0001). The Classification and Regression Trees recursive partitioning methodology (based on n=13 792) suggested that among all associations, those with, age, sex, stratification of patient healthcare complexity, chronic consumption of blood and blood-forming organ, and nervous system drugs, as well as the total number of chronic Anatomical Therapeutic Chemical types were the most relevant. Psychosis also emerged as a potential factor. CONCLUSIONS: Older cases are more likely to experience more severe outcomes. However, the sex, underlying health status and chronic drug consumption may interfere and alter the ageing effect. Understanding the factors related to the outcome severity is of key importance when designing and promoting public health intervention plans for the COVID-19 pandemic.","Vrotsou, Kalliopi; Rotaeche, Rafael; Mateo-Abad, Maider; Machón, Mónica; Vergara, Itziar",BMJ Open,,637
259361,Gender associates with both susceptibility to infection and pathogenesis of SARS-CoV-2 in Syrian hamster,2021,,"Lee, Jia-Jung; Lin, Chun-Yu; Chiu, Yi-Wen; Hwang, Shang-Jyh",J Formos Med Assoc,,637
259362,Gender associates with both susceptibility to infection and pathogenesis of SARS-CoV-2 in Syrian hamster,2021,,"Zhao, Bing; Ni, Chao; Gao, Ran; Wang, Yuyan; Yang, Li; Wei, Jinsong; Lv, Ting; Liang, Jianqing; Zhang, Qisheng; Xu, Wei; Xie, Youhua; Wang, Xiaoyue; Yuan, Zhenghong; Liang, Junbo; Zhang, Rong; Lin, Xinhua",Protein Cell,,637
262936,Is smaller better? Vaccine targeting recombinant receptor-binding domain might hold the key for mass production of effective prophylactics to fight the COVID-19 pandemic,2020,"DISCLAIMER: In an effort to expedite the publication of articles related to the COVID-19 pandemic, AJHP is posting these manuscripts online as soon as possible after acceptance. Accepted manuscripts have been peer-reviewed and copyedited, but are posted online before technical formatting and author proofing. These manuscripts are not the final version of record and will be replaced with the final article (formatted per AJHP style and proofed by the authors) at a later time. PURPOSE: To assess pharmacy technician learning preferences using the VARK tool and through self-identification. METHODS: The VARK (visual, aural, read/write, kinesthetic) questionnaire was incorporated into a larger survey, which was distributed during live staff meetings and a continuing education session held by the state Pharmacists Association attended by 204 pharmacy technicians across various practice settings. RESULTS: A 90% response rate was achieved. Most respondents (78.8%) self-identified a single predominant learning preference, with 60.3% indicating a preference for kinesthetic learning methods. In contrast, after assessment with the VARK questionnaire 37.9% of survey participants were categorized as having a quadmodal learning style incorporating all VARK modalities. With regard to the Pharmacy Technician Certification Exam, a large majority of participants (96.2% of those providing a response) indicated that they had taken the exam in the past, with 17 participants (9.3% of those providing a response) indicating more than 1 attempt to pass the exam. Furthermore, experiential (on-the-job) training was identified by a large majority of survey respondents (79.3%) as the preferred way to learn new information. CONCLUSION: Learning preferences of pharmacy technicians vary amongst individuals, with many found to have multiple learning preferences through VARK questionnaire assessment. Incorporating experiential training and establishing learning preferences of pharmacy technicians may aid in development of accredited training programs that cater to the needs of pharmacy technicians.","Stanley, Erin R; Hafford, Amanda; Naseman, Ryan; Li, Junan; Worley, Marcia; Mehta, Bella H",Am. j. health system pharm,,637
273414,COVID-19 vaccines: progress and understanding on quality control and evaluation,2021,"There is increasing evidence that the 2020 COVID-19 pandemic has been influenced by variations in air temperature and humidity However, the impact that these environmental parameters have on survival of the SARS-CoV-2 virus has not been fully characterised Therefore, an analytical study was undertaken using published data to develop a psychrometric model to assess the biological decay rate of the virus in aerosols This revealed that it is possible to describe with reasonable accuracy (R2 = 0 718, p &lt; 0 001) the biological decay constant for the SARS-CoV-2 virus using a regression model with enthalpy, vapour pressure and specific volume as predictors Applying this to historical meteorological data from London, Paris and Milan over the pandemic period, produced results which indicate that the average half-life of the virus in aerosols outdoors was in the region 13–22 times longer in March 2020, when the outbreak was accelerating, than it was in August 2020 when epidemic in Europe was at its nadir However, indoors, this variation is likely to be much less As such, this suggests that changes in virus survivability due the variations in the psychrometric qualities of the air might influence the transmission of SARS-CoV-2","Beggs, Clive B.; Avital, Eldad J.",PeerJ,,637
273415,COVID-19 vaccines: progress and understanding on quality control and evaluation,2021,,"Lima, William G; Barra, Ayslan; Brito, Júlio César M; Nizer, Waleska S C",Blood Coagul Fibrinolysis,,637
276596,Omics study reveals abnormal alterations of breastmilk proteins and metabolites in puerperant women with COVID-19,2020,"INTRODUCTION: The aim of this study was to describe the rate and types of community-acquired respiratory infections observed in a pediatric ED during the SARS-CoV-2 related lockdown in Italy and to compare data with the same period of previous year. METHODS: A retrospective analysis of medical charts of patients arrived at the ED of Gaslini Children's Hospital from 10th March 2020 to 30th April 2019 and the same frame of 2020 were performed. We compared two groups by demographics, duration of fever before ED admission, triage code, number of patients hospitalized after ED evaluation. We calculated proportion and incidence rate for airborne infections, fever, and urinary tract infections (UTI), appendicitis, and gastroenteritis for control. RESULTS: 1362 children arrived at the ED during the lockdown compared to 5628 in the same period of 2019 (-75,8%). No difference was noticed (27.7% vs 28.4%) in the total amount of infectious episodes. A significant reduction in rate of incidence and proportion were observed for upper respiratory tract infections (21,4% vs 28%), otitis (2,6% vs 16,2%), streptococcal infections (0,5% vs 5,2%) and bronchiolitis (2,1% vs 5,7%). Conversely, FUO (27,8 vs 11,1%), infectious mononucleosis (2,6% vs 0,4%), UTI (7,4% vs 2,9%) and appendicitis (6,8% vs 1,1%) significantly increased. Median time from the onset of fever and arrival in ED was significantly lower in 2020 group. CONCLUSION: Our results demonstrated a reduction in community-acquired respiratory infections during the lockdown for COVID-19. The increase in rate of FUO and febrile conditions, together with the short time from fever onset and ED visit could be related to the fear for a SARS-CoV-2 infection.","Rotulo, G. A.; Percivale, B.; Molteni, M.; Naim, A.; Brisca, G.; Piccotti, E.; Castagnola, E.",American Journal of Emergency Medicine,,637
