,index,Unnamed: 0,title_x,x,y,publish_time_x,abstract,authors,journal,category,cluster
305020,305020,305020,Spatio-temporal characteristics and control strategies in the early period of COVID-19 spread: a case study of the mainland China,23.15638,6.9366636,2021,"Severe acute respiratory syndrome coronavirus 2 (SARS-CoV-2, previously 2019-nCoV) is suspected of having originated in 2019 in China from a coronavirus infected bat of the genus Rhinolophus. Following the initial emergence, possibly facilitated by a mammalian bridge host, SARS-CoV-2 is currently transmitted across the globe via efficient human-to-human transmission. Results obtained from experimental studies indicate that animal species such as cats, ferrets, raccoon dogs, cynomolgus macaques, rhesus macaques, white-tailed deer, rabbits, Egyptian fruit bats, and Syrian hamsters are susceptible to SARS-CoV-2 infection, and that cat-to-cat and ferret-to-ferret transmission can take place via contact and air. However, natural infections of SARS-CoV-2 have been reported only in pet dogs and cats, tigers, lions, snow leopards, pumas, and gorillas at zoos, and farmed mink and ferrets. Even though human-to-animal spillover has been reported at several instances, SARS-CoV-2 transmission from animals-to-humans has only been reported from mink-to-humans in mink farms. Following the rapid transmission of SARS-CoV-2 within the mink population, a new mink-associated SARS-CoV-2 variant emerged that was identified in both humans and mink. The increasing reports of SARS-CoV-2 in carnivores indicate the higher susceptibility of animal species belonging to this order. The sporadic reports of SARS-CoV-2 infection in domestic and wild animal species require further investigation to determine if SARS-CoV-2 or related Betacoronaviruses can get established in kept, feral or wild animal populations, which may eventually act as viral reservoirs. This review analyzes the current evidence of SARS-CoV-2 natural infection in domestic and wild animal species and their possible implications on public health.","Sharun, Khan; Dhama, Kuldeep; Pawde, Abhijit M; Gortázar, Christian; Tiwari, Ruchi; Bonilla-Aldana, D Katterine; Rodriguez-Morales, Alfonso J; de la Fuente, José; Michalak, Izabela; Attia, Youssef A",Vet Q,367,20
305021,305021,305021,Spatio-temporal characteristics and control strategies in the early period of COVID-19 spread: a case study of the mainland China,23.149752,7.076563,2021,"Severe acute respiratory syndrome coronavirus 2 (SARS-CoV-2, previously 2019-nCoV) is suspected of having originated in 2019 in China from a coronavirus infected bat of the genus Rhinolophus. Following the initial emergence, possibly facilitated by a mammalian bridge host, SARS-CoV-2 is currently transmitted across the globe via efficient human-to-human transmission. Results obtained from experimental studies indicate that animal species such as cats, ferrets, raccoon dogs, cynomolgus macaques, rhesus macaques, white-tailed deer, rabbits, Egyptian fruit bats, and Syrian hamsters are susceptible to SARS-CoV-2 infection, and that cat-to-cat and ferret-to-ferret transmission can take place via contact and air. However, natural infections of SARS-CoV-2 have been reported only in pet dogs and cats, tigers, lions, snow leopards, pumas, and gorillas at zoos, and farmed mink and ferrets. Even though human-to-animal spillover has been reported at several instances, SARS-CoV-2 transmission from animals-to-humans has only been reported from mink-to-humans in mink farms. Following the rapid transmission of SARS-CoV-2 within the mink population, a new mink-associated SARS-CoV-2 variant emerged that was identified in both humans and mink. The increasing reports of SARS-CoV-2 in carnivores indicate the higher susceptibility of animal species belonging to this order. The sporadic reports of SARS-CoV-2 infection in domestic and wild animal species require further investigation to determine if SARS-CoV-2 or related Betacoronaviruses can get established in kept, feral or wild animal populations, which may eventually act as viral reservoirs. This review analyzes the current evidence of SARS-CoV-2 natural infection in domestic and wild animal species and their possible implications on public health.","Sharun, Khan; Dhama, Kuldeep; Pawde, Abhijit M; Gortázar, Christian; Tiwari, Ruchi; Bonilla-Aldana, D Katterine; Rodriguez-Morales, Alfonso J; de la Fuente, José; Michalak, Izabela; Attia, Youssef A",Vet Q,367,1
306984,306984,306984,COVID-19 and municipal solid waste (MSW) management: a review,23.309072,7.0619154,2021,"We describe the timely adaption of both published WHO E-gene protocol and commercially available LightMix Modular E-gene assay to the test platform (ABI 7900 Fast real-time analyzer and TaqMan Fast One-step Virus Master Mix) available in an accredited tertiary hospital laboratory with an on-going evaluation to ensure the provision of quality service within the time constraint. The LightMix Modular E-gene was slightly more sensitive when compared to the WHO E-gene, both analytically and diagnostically. The assay was recommended for screening of SARS-CoV-2 infection. With the availability of technically competent staff through continuous training, the provision of round-the-clock service is feasible despite the test is of high complexity. The thermal cycling duration of the adapted LightMix E-gene and WHO E-gene is shortened by half and one hour respectively and allows the number of runs to double when 24-h round-the-clock service is provided. An increase in testing capacity could support surges in testing demand, which is essential to control the current SARS-CoV-2 pandemic, to prevent potential overwhelming of the healthcare system, and to optimize utilization of the isolation beds.","Ho, Yolanda I I; Wong, Ann H; Leung, Eddie C M; Wong, River C W; Lai, Raymond W M",J Med Virol,367,16
312187,312187,312187,Nature and climate change effects on economic growth: an LSTM experiment on renewable energy resources,23.235292,7.0912952,2021,,"Subbaraman, Nidhi",Nature (Lond.),367,16
317820,317820,317820,"Urban air quality, climate, and pollution: from measurement to modeling applications",23.043837,6.7285175,2020,"CONTEXT.­: The pandemic of a novel coronavirus, termed severe acute respiratory syndrome coronavirus 2 (SARS-CoV-2), has created an unprecedented global health burden. OBJECTIVE.­: To investigate the effect of the SARS-CoV-2 infection on maternal, fetal, and neonatal morbidity and other poor obstetrical outcomes. DESIGN.­: All suspected cases of pregnant women with coronavirus disease 2019 (COVID-19) admitted into one center in Wuhan from January 20 to March 19, 2020, were included. Detailed clinical data of those pregnancies with COVID-19 were retrospectively collected and analyzed. RESULTS.­: Twenty-seven pregnant women (4 early pregnancies included) with laboratory or clinically confirmed SARS-CoV-2 infection and 24 neonates born to the 23 women in late pregnancy were analyzed. On admission, 46.2% (13 of 27) of the patients had symptoms, including fever (11 of 27), cough (9 of 27), and vomiting (1 of 27). Decreased total lymphocytes count was observed in 81.5% (22 of 27) of patients. Twenty-six patients showed typical viral pneumonia by chest computed tomography scan, whereas 1 patient confirmed with COVID-19 infection showed no abnormality on chest computed tomography. One mother developed severe pneumonia 3 days after her delivery. No maternal or perinatal death occurred. Moreover, 1 early preterm newborn born to a mother with the complication of premature rupture of fetal membranes, highly suspected to have SARS-CoV-2 infection, was SARS-CoV-2 negative after repeated real-time reverse transcriptase polymerase chain reaction testing. Statistical differences were observed between the groups of women in early and late pregnancy with COVID-19 in the occurrence of lymphopenia and thrombocytopenia. CONCLUSIONS.­: No major complications were reported among the studied cohort, though 1 serious case and 1 perinatal infection were observed. Much effort should be made to reduce the pathogenic effect of COVID-19 infection in pregnancies.","Yang, Hui; Hu, Bin; Zhan, Sudong; Yang, Li-Ye; Xiong, Guoping",Arch Pathol Lab Med,367,16
327498,327498,327498,Les complications cardiaques de la maladie COVID-19 sont-elles associées à une mortalité plus élevée ?,23.017689,7.197215,2020,,"Boehringer, Michael",Journal of Austrian Studies,367,1
337181,337181,337181,"Effects of the COVID-19 lockdown on criteria air pollutants in the city of Daegu, the epicenter of South Korea's outbreak",23.315878,6.948188,2020,"With the logistic challenges faced by most countries for the production, distribution, and application of vaccines for the novel coronavirus disease~(COVID-19), social distancing~(SD) remains the most tangible approach to mitigate the spread of the virus. To assist SD monitoring, several tech companies have made publicly available anonymized mobility data. In this work, we conduct a multi-objective mobility reduction rate comparison between the first and second COVID-19 waves in several localities from America and Europe using Google community mobility reports~(CMR) data. Through multi-dimensional visualization, we are able to compare in a Pareto-compliant way the reduction in mobility from the different lockdown periods for each locality selected, simultaneously considering all place categories provided in CMR. In addition, our analysis comprises a 56-day lockdown period for each locality and COVID-19 wave, which we analyze both as 56-day periods and as 14-day consecutive windows. Results vary considerably as a function of the locality considered, particularly when the temporal evolution of the mobility reduction is considered. We thus discuss each locality individually, relating social distancing measures and the reduction observed.","Silva, Gabriela Cavalcante da; Almeida, Fernanda Monteiro de; Oliveira, Sabrina; Bezerra, Leonardo C. T.; Wanner, Elizabeth F.; Takahashi, Ricardo H. C.",,367,10
351299,351299,351299,Design and performance evaluation of a photocatalytic reactor for indoor air disinfection,23.231413,6.9018774,2020,,"Tzukert, Keren Abel Roy Mor Yosef Levi Iris Gork Ittamar Yosha Orpaz Liron Azmanov Henny Dranitzki Elhalel Michal",The Israel Medical Association journal : IMAJ,367,16
366785,366785,366785,Reductions of migrant population reduces the number of COVID-19 epidemic: a case study in China,23.106087,6.870012,2021,,"Battineni, Gopi; Kumar, Shailender; Mittal, Mamta; Amenta, Francesco",Int Marit Health,367,1
376201,376201,376201,Supplementing politics-based with risk-based management in the COVID-19 outbreak,23.145037,7.121166,2021,"As the coronavirus spread from Asia to Western Europe and North America, healthcare institutions in the Middle East, Africa, South Asia, and Latin America prepared for the COVID-19 pandemic. Interprofessional task forces were established to coordinate institutions' responses, inventory supplies of personal protective equipment, educate staff and patients, develop procedures for triaging patients and prioritizing care, and provide support to nurses to mitigate their stress. Despite challenges, nurses continued to deliver quality care to patients with cancer.","Galassi, Annette; Augustinho Teixeira, Tamara Otsuru; Lopes De Domenico, Edvane Birelo; Al-Ruzzieh, Majeda; Oyoe Ohene Oti, Naomi; Sukumaran, Surya",Clin J Oncol Nurs,367,23
377643,377643,377643,Remdesivir and COVID-19: Negative results but (finally) appropriate research method!,22.91854,7.2336316,2020,"Challenging periods like the COVID-19 pandemic require fast and efficient adaptations of the healthcare system. It is vital that every patient has access to nutritional care as a part of primary healthcare services, even if social distancing measures are adopted. Therefore, we propose a simple remote nutritional screening tool and practical guidance for nutritional care in primary practice, and their implementation into telemedicine processes and digital platforms suitable for healthcare providers. The acronym for the tool is R-MAPP, as for Remote - Malnutrition APP, while the tool will be available also as an app. This protocol consists of two simple validated clinical tools for identifying nutritional risk and loss of muscle mass and function -Malnutrition Universal Screening Tool ('MUST') and SARC-F (5-item questionnaire: Strength, Assistance with walking, Rise from a chair, Climb stairs and Falls) - and additional practical guidance on nutritional interventions for family physicians.","Krznaric, Zeljko; Bender, Darija Vranesic; Laviano, Alessandro; Cuerda, Cristina; Landi, Francesco; Monteiro, Rosario; Pirlich, Matthias; Barazzoni, Rocco",Clin Nutr,367,30
381197,381197,381197,Effect of COVID-19 lockdown on noise pollution levels in an Indian city: a case study of Kanpur,23.178036,6.7572327,2021,"The impact of the COVID-19 pandemic on families is currently unknown. Parents and children have experienced a variety of changes as public health interventions have been implemented to slow the spread of the virus. The current exploratory qualitative study recruited parents (n = 365) in early (ages 20-34), middle (ages 35-64), and late (ages 65 and older) adulthood to understand how the early weeks of the pandemic influenced their parent-child relationships. Participants completed an online survey between March 21 and 31, 2020. Three themes emerged through qualitative content analysis: (1) relational steadiness, (2) navigating COVID-19 challenges in relationships, and (3) relational enhancement.","Vaterlaus, J Mitchell; Shaffer, Tasha; Patten, Emily V; Spruance, Lori A",J Adult Dev,367,31
381198,381198,381198,Effect of COVID-19 lockdown on noise pollution levels in an Indian city: a case study of Kanpur,23.178764,6.7999096,2021,"From the Key Points: [1] This is the fifth report in the 'School District Responses to the COVID-19 [coronavirus disease 2019] Pandemic' series, covering changes that occurred in public school districts between April 24 and May 8, 2020 [2] For the first time since we began collecting data for AEI's [American Enterprise Institute] COVID-19 Education Response Longitudinal Survey, many education-related services offered in schools have plateaued, meaning they were offered by similar percentages of schools two weeks earlier [3] Only 6 percent of schools in districts we surveyed changed the date of their last day of school--most of which moved up the last day of school by one or two weeks [4] To determine students' final report card grades, 22 percent of schools implemented a pass/fail policy to replace traditional letter grades Similarly, policies in more than a fifth of schools ensure student grades 'can only go up' from when the pandemic started COVID-19 (Disease);Schools;Disaster response--Plans","Malkus, Nat Christensen Cody American Enterprise Institute https www aei org",,367,31
405952,405952,405952,Pandemie de COVID-19 : aspects cardiologiques,22.833002,7.1741734,2020,,"Marx, Brian P; Schnurr, Paula P; Friedman, Matthew J",JAMA Psychiatry,367,1
421711,421711,421711,Epidemic interventions: insights from classic results,23.06351,7.2131014,2021,"BACKGROUND: Hand eczema (HE) has increased among healthcare workers (HCWs) working in coronavirus disease-2019 (COVID-19) units, and was associated with increased hand hygiene practices. OBJECTIVES: To compare the prevalence and clinical characteristics of HE, and hand hygiene practices in HCWs working in COVID-19 and non-COVID-19 units. METHODS: A total of 244 HCWs working in COVID-19 (n = 118) and non-COVID-19 patient care units (n = 126) were examined by dermatologists with regard to demographic parameters and hand hygiene practices. The COVID-19 and non-COVID-19 groups were matched at a 1:1 ratio according to age, atopy, and generalized dry skin. RESULTS: HE was more frequent in the COVID-19 group (48.3% vs 12.7%, P < .001), whereas working years (P < .05) and additional housework at home (P < .001) were longer in the non-COVID-19 group. After the development of HE, moisturizing creams were reported to be more frequently used in the COVID group (P < .001). Topical corticosteroids were used in a minority (40% in the COVID group and 26.7% in the non-COVID group). CONCLUSIONS: HCWs in COVID-19 units developed HE more frequently. A majority increased the frequency of moisturizer use, instead of using topical corticosteroids, after the development of HE for the purpose of treating eczema. New approaches are needed for the prevention and management of HE in HCWs, especially by facilitating access to dermatologists.","Erdem, Yasemin; Inal, Sena; Sivaz, Onur; Copur, Sevkiye; Boluk, Kubra N; Ugurer, Ece; Kaya, Hazel E; Gulsunay, Ilayda E; Sekerlisoy, Gul; Vural, Osman; Altunay, Ilknur K; Aksu Çerman, Asli; Özkaya, Esen",Contact dermat,367,25
421712,421712,421712,Epidemic interventions: insights from classic results,23.149773,6.9718823,2021,"The COVID-19 pandemic has not only had a negative impact on people's health and life behavior, but also on economies around the world. At the same time, laboratories and institutions are working hard to obtain a COVID-19 vaccine, which we hope will be available soon. However, there has been no assessment of whether an individual and society value ââa vaccine monetarily, and what factors determine this value. Therefore, the objective of this research was to estimate the individual's willingness to pay (WTP) for a hypothetical COVID-19 vaccine and, at the same time, find the main factors that determine this valuation. For this, we used the contingent valuation approach, in its single and double-bounded dichotomous choice format, which was based on a hypothetical market for a vaccine. The sample used was obtained through an online survey of n = 566 individuals from Chile. The main results showed that the WTP depends on the preexistence of chronic disease (p&#8804;0.05), knowledge of COVID-19 (p&#8804;0.05), being sick with COVID-19 (p&#8804;0.05), perception of government performance (p&#8804;0.01), employment status (p&#8804;0.01), income (p&#8804;0.01), health care (p&#8804;0.05), adaptation to quarantine with children at home (p&#8804;0.01) and whether the person has recovered from COVID-19 (p&#8804;0.10). According to our discrete choice model in double-bounded dichotomous format, it was concluded that the individuals' WTP is US$184.72 (CI: 165.52-203.92; p < 0.01). This implies a social valuation of approximately US$2232 million, corresponding to 1.09% of the GNP per capita.","García, Leidy Y; Cerda, Arcadio A",Vaccine,367,18
422993,422993,422993,Modelling that shaped the early COVID-19 pandemic response in the UK,22.862164,7.0838094,2021,,"Vatson, J. S.; Nahass, T. A.; Weber, A.; Regunathan, A.; Hussain, S.",American Journal of Respiratory and Critical Care Medicine,367,22
422994,422994,422994,Modelling that shaped the early COVID-19 pandemic response in the UK,22.799847,6.9175205,2021,"Background: Among a multitude of factors contributing to the current COVID-19 pandemic is a high known rate of human-to-human transmission. This effect is magnified in hospitals by the high-risk environment when treating COVID-19 patients. Healthcare systems have attempted to address exposure risk with infection control policies with unknown benefit. Yet few reports describe hospital-acquired COVID-19 (HAC). Examining a select few cases could give insight into the incidence, mechanism, and diagnosis of HAC. Methods: Bulk EHR data was acquired for all patients who tested positive for COVID-19 at our institution from 03/01/2020 to 06/01/2020. Data were analyzed using R v4.0.0 and RStudio v1.2.5042. Positive tests with high probability of nosocomial infections were identified as patients with two initial negative COVID-19 tests who then tested COVID-19 positive no sooner than 48 hours after the initial negative test result along with a documented change in clinical status. Patient charts were then reviewed to examine possible etiologies of nosocomial infection in context of infection control policies. Demographics, hospital stay data, and outcomes were also reviewed. Results: Nine patients were identified on initial data extraction with high likelihood of HAC. Four of nine after chart review had a significant documented clinical change confirming HAC. Six of nine patients (66%) expired during their hospital stay. Five of the six patients became positive on the same unit and floor (non-COVID), with three of these patients during a four-day timespan. Chart review revealed flaws in patient and provider cohorting, PPE allocation, and COVID-19 testing resources. Discussion: The goal of this project was to identify a subset of patients with HAC and systematically map points of failure throughout the hospital course. Key points of failure in the identified patients include lapses in cohorting (no Person Under Investigation stratification, lack of resources to support proper cohorting) and lack of COVID-19 care provider cohorting (ED and ICU personnel treating all categories of patients). Decreased access to PPE also coincided with nosocomial infection in certain units. Limited COVID-19 testing and retesting could have increased exposure. Reviewing database testing and chart review, three parameters were found to have good value for selecting patients with HAC: an initial negative test, a positive test after set number of days, and an associated change in clinical status during the time period of new positive test result. Further studies should be done to determine the criteria with the best characteristics to identify HAC.","Vatson, J. S.; Nahass, T. A.; Weber, A.; Regunathan, A.; Hussain, S.",American Journal of Respiratory and Critical Care Medicine,367,25
424771,424771,424771,The population attributable fraction of cases due to gatherings and groups with relevance to COVID-19 mitigation strategies,23.10343,6.9717965,2021,"BACKGROUND: This study will explore the effect of advanced nursing care (ANC) on psychological disorder (PD) in patients with Coronavirus Disease 2019 (COVID-19). METHODS: This study will search the following electronic databases up to June 30, 2020: Cochrane Library, PUBMED, EMBASE, PsycINFO, Web of Science, OpenGrey, Cumulative Index to Nursing and Allied Health Literature, CNKI, and WANGFANG. We will not impose any language limitations. Two authors will independently identify titles/abstracts and full-text of all potential studies, and will collect data from eligible studies. Additionally, study quality will be assessed by Cochrane risk of bias. If necessary, we will conduct meta-analysis if sufficient trials are included. RESULTS: This study will explore the effect of ANC on PD in patients with COVID-19 through outcome indicators. CONCLUSION: The findings of this study may supply summarized evidence of ANC for the management of PD in COVID-19. PROSPERO REGISTRATION NUMBER: PROSPERO CRD42020187610.","Fan, Wen-Juan; Liu, Xiao-Ling",Medicine (Baltimore),367,23
424772,424772,424772,The population attributable fraction of cases due to gatherings and groups with relevance to COVID-19 mitigation strategies,22.98881,7.0544596,2021,"BACKGROUND: This study will explore the effect of advanced nursing care (ANC) on psychological disorder (PD) in patients with Coronavirus Disease 2019 (COVID-19). METHODS: This study will search the following electronic databases up to June 30, 2020: Cochrane Library, PUBMED, EMBASE, PsycINFO, Web of Science, OpenGrey, Cumulative Index to Nursing and Allied Health Literature, CNKI, and WANGFANG. We will not impose any language limitations. Two authors will independently identify titles/abstracts and full-text of all potential studies, and will collect data from eligible studies. Additionally, study quality will be assessed by Cochrane risk of bias. If necessary, we will conduct meta-analysis if sufficient trials are included. RESULTS: This study will explore the effect of ANC on PD in patients with COVID-19 through outcome indicators. CONCLUSION: The findings of this study may supply summarized evidence of ANC for the management of PD in COVID-19. PROSPERO REGISTRATION NUMBER: PROSPERO CRD42020187610.","Fan, Wen-Juan; Liu, Xiao-Ling",Medicine (Baltimore),367,23
428029,428029,428029,"A spatial model of COVID-19 transmission in England and Wales: early spread, peak timing and the impact of seasonality",22.99199,7.010789,2021,,"Mehr, Soheeb; Amin, Pajam; Ashraf, M",Int J Surg,367,13
428030,428030,428030,"A spatial model of COVID-19 transmission in England and Wales: early spread, peak timing and the impact of seasonality",23.065258,7.1702685,2021,"Coronavirus disease 2019 (COVID-19) is a major public health challenge, and the current antiviral arsenal for treatment is limited, with questionable efficacy. Major efforts are under way for discovery of new effective agents, but the validation of new potential treatments for COVID-19 may take a long time. Therefore, the repurposing of existing drugs for new indications is needed. In this article, we argue for the potential benefits of using doxycycline with either hydroxycholoroquine or other putative agents for COVID-19 treatment, as doxycycline has antiviral and anti-inflammatory activities by dampening the cytokine storm and to prevent lung damage.","Malek, Alexandre E.; Granwehr, Bruno P.; Kontoyiannis, Dimitrios P.",IDCases,367,1
