,title_x,publish_time_x,abstract,authors,journal,url,category
6368,Sommergrippe: Mehr als ein Mythos!,2019-06-22,"Viral and microbial constituents contain specific motifs or pathogen-associated molecular patterns (PAMPs) that are recognized by cell surface- and endosome-associated Toll-like receptors (TLRs). In addition, intracellular viral double-stranded RNA is detected by two recently characterized DExD/H box RNA helicases, RIG-I and Mda-5. Both TLR-dependent and -independent pathways engage the IκB kinase (IKK) complex and related kinases TBK-1 and IKKɛ. Activation of the nuclear factor κB (NF-κB) and interferon regulatory factor (IRF) transcription factor pathways are essential immediate early steps of immune activation; as a result, both pathways represent prime candidates for viral interference. Many viruses have developed strategies to manipulate NF-κB signaling through the use of multifunctional viral proteins that target the host innate immune response pathways. This review discusses three rapidly evolving areas of research on viral pathogenesis: the recognition and signaling in response to virus infection through TLR-dependent and -independent mechanisms, the involvement of NF-κB in the host innate immune response and the multitude of strategies used by different viruses to short circuit the NF-κB pathway.","Hiscott, J; Nguyen, T-L A; Arguello, M; Nakhaei, P; Paz, S",Oncogene,https://www.ncbi.nlm.nih.gov/pmc/articles/PMC7100320/,507
10527,Mitteilungen des Berufsverbands der Pneumologen in Baden-Württemberg,2020-04-23,,"Wright, Jesse H.; Caudill, Robert",Psychother Psychosom,https://www.ncbi.nlm.nih.gov/pmc/articles/PMC7179517/,507
13371,Mitteilungen des BDI,2020-10-22,,,Br Dent J,https://www.ncbi.nlm.nih.gov/pmc/articles/PMC7582415/,507
14219,Kongresse des BDI,2020-11-26,"Voice changes may be the earliest signs in laryngeal cancer. We investigated whether automated voice signal analysis can be used to distinguish patients with laryngeal cancer from healthy subjects. We extracted features using the software package for speech analysis in phonetics (PRAAT) and calculated the Mel-frequency cepstral coefficients (MFCCs) from voice samples of a vowel sound of /a:/. The proposed method was tested with six algorithms: support vector machine (SVM), extreme gradient boosting (XGBoost), light gradient boosted machine (LGBM), artificial neural network (ANN), one-dimensional convolutional neural network (1D-CNN) and two-dimensional convolutional neural network (2D-CNN). Their performances were evaluated in terms of accuracy, sensitivity, and specificity. The result was compared with human performance. A total of four volunteers, two of whom were trained laryngologists, rated the same files. The 1D-CNN showed the highest accuracy of 85% and sensitivity and sensitivity and specificity levels of 78% and 93%. The two laryngologists achieved accuracy of 69.9% but sensitivity levels of 44%. Automated analysis of voice signals could differentiate subjects with laryngeal cancer from those of healthy subjects with higher diagnostic properties than those performed by the four volunteers.","Kim, HyunBum; Jeon, Juhyeong; Han, Yeon Jae; Joo, YoungHoon; Lee, Jonghwan; Lee, Seungchul; Im, Sun",J Clin Med,https://www.ncbi.nlm.nih.gov/pmc/articles/PMC7692693/,507
14220,Mitteilungen des BDI,2020-11-26,"BioMEMS, the biological and biomedical applications of micro-electro-mechanical systems (MEMS), has attracted considerable attention in recent years and has found widespread applications in disease detection, advanced diagnosis, therapy, drug delivery, implantable devices, and tissue engineering. One of the most essential and leading goals of the BioMEMS and biosensor technologies is to develop point-of-care (POC) testing systems to perform rapid prognostic or diagnostic tests at a patient site with high accuracy. Manipulation of particles in the analyte of interest is a vital task for POC and biosensor platforms. Dielectrophoresis (DEP), the induced movement of particles in a non-uniform electrical field due to polarization effects, is an accurate, fast, low-cost, and marker-free manipulation technique. It has been indicated as a promising method to characterize, isolate, transport, and trap various particles. The aim of this review is to provide fundamental theory and principles of DEP technique, to explain its importance for the BioMEMS and biosensor fields with detailed references to readers, and to identify and exemplify the application areas in biosensors and POC devices. Finally, the challenges faced in DEP-based systems and the future prospects are discussed.","Çağlayan, Zeynep; Demircan Yalçın, Yağmur; Külah, Haluk",Micromachines (Basel),https://www.ncbi.nlm.nih.gov/pmc/articles/PMC7693018/,507
14791,Kongresse des BDI,2021-01-20,"Allowing students to voluntarily ask and answer questions in front of the whole class are common teaching practices used in college science courses. However, few studies have examined college science students’ perceptions of these practices, the extent to which students choose to engage in these practices, and what discourages students from participating. In this study, we surveyed 417 undergraduates at a research-intensive institution about their experiences asking and answering questions in large-enrollment college science courses. Specifically, students answered questions about to what extent they perceive voluntarily asking and answering questions in large-enrollment science courses is helpful to them and why. They also answered questions about to what extent they engage in asking and answering questions in large-enrollment college science courses and what factors could discourage them from participating. Using binary logistic regression, we examined whether there were differences among students of different demographic groups regarding their opinions about asking and answering questions. We found that overwhelmingly students reported that other students voluntarily asking and answering instructor questions is helpful to them. Notably, compared to continuing generation students, first-generation students were more likely to perceive other students asking questions to be helpful. Despite perceiving asking and answering questions to be helpful, over half of students reported that they never ask or answer questions in large-enrollment college science courses during a semester, and women were more likely than men to report never asking questions. We identified fear of negative evaluation, or students’ sense of dread associated with being unfavorably evaluated, as a primary factor influencing their decision to answer instructor questions. This work adds to a growing body of literature on student participation in large-enrollment college science courses and begins to uncover underlying factors influencing student participation.","Nadile, Erika M.; Alfonso, Emilie; Barreiros, Briana Michelle; Bevan-Thomas, William D.; Brownell, Sara E.; Chin, Megan R.; Ferreira, Isabella; Ford, Sariah A.; Gin, Logan E.; Gomez-Rosado, Jomaries O.; Gooding, George; Heiden, Alyssa; Hutt, Airyn E.; King, Meagan L.; Perez, Shannon G.; Rivera Camacho, Yasiel I.; Salcedo, Flor; Sellas, Christopher F.; Sinda, Krystian A.; Stahlhut, Katherine N.; Stephens, Michelle D.; Wiesenthal, Nicholas J.; Williams, Keonti D.; Zheng, Yi; Cooper, Katelyn M.",PLoS One,https://www.ncbi.nlm.nih.gov/pmc/articles/PMC7802933/,507
15210,Kongresse des BDI,2021-02-04,,"Abdulla, Ra-id",Pediatr Cardiol,https://www.ncbi.nlm.nih.gov/pmc/articles/PMC7861155/,507
15211,Mitteilungen des BDI,2021-02-04,,,Abdom Radiol (NY),https://www.ncbi.nlm.nih.gov/pmc/articles/PMC7861162/,507
15594,Mitteilungen des BDI,2021-02-25,"BACKGROUND: Healthcare-associated infections (HAIs) are relevant in developing countries where frequencies can be at least 3 times higher than in developed countries. The purpose of this research was to describe the intervention implemented in intensive care units (ICUs) to reduce HAIs through collaborative project and analyze the variation over 18 months in the incidence density (ID) of the three main HAIs: ventilator associated pneumonia (VAP), central line-associated bloodstream infections (CLABSIs) and catheter-related urinary tract infections (CAUTIs) and also the length of stay and mortality in these ICUs. METHODS: A quasi-experimental study in five public adult clinical-surgical ICUs, to reduce HAIs, through interventions using the BTS-IHI “Improvement Model”, during 18 months. In the project, promoted by the Ministry of Health, Brazilian philanthropic hospitals certified for excellence (HE), those mostly private, certified as excellence and exempt from security contributions, regularly trained and monitored public hospitals in diagnostics, data collection and in developing cycles to improve quality and to prevent HAIs (bundles). In the analysis regarding the length of stay, mortality, the IDs of VAP, CLABSIs and CAUTIs over time, a Generalized Estimating Equation (GEE) model was applied for continuous variables, using the constant correlation (exchangeable) between assessments over time. The model estimated the average difference (β coefficient of the model) of the measures analyzed during two periods: a period in the year 2017 (prior to implementing the project) and in the years 2018 and 2019 (during the project). RESULT: A mean monthly reduction of 0.427 in VAP ID (p = 0.002) with 33.8% decrease at the end of the period and 0.351 in CAUTI ID (p = 0.009) with 45% final decrease. The mean monthly reduction of 0.252 for CLABSIs was not significant (p = 0.068). Length of stay and mortality rates had no significant variation. CONCLUSIONS: Given the success in reducing VAP and CAUTIs in a few months of interventions, the achievement of the collaborative project is evident. This partnership among public hospitals/HE may be applied to other ICUs including countries with fewer resources. SUPPLEMENTARY INFORMATION: The online version contains supplementary material available at 10.1186/s12879-021-05896-0.","de Melo, Ladjane Santos Wolmer; de Abreu, Maria Verônica Monteiro; de Oliveira Santos, Bernuarda Roberta; das Graças Washington Casimiro Carreteiro, Maria; de Souza, Maria Fernanda Aparecida Moura; de Albuquerque, Maria Carolina Andrade Lins; de Lacerda Vidal, Claudia Fernanda; Lacerda, Heloisa Ramos",BMC Infect Dis,https://www.ncbi.nlm.nih.gov/pmc/articles/PMC7905768/,507
15595,Kongresse des BDI,2021-02-25,"[Image: see text] Strain engineering as a method to control functional properties has seen in the last decades a surge of interest. Heterostructures comprising 2D-materials and containing van der Waals(-like) gaps were considered unsuitable for strain engineering. However, recent work on heterostructures based on Bi(2)Te(3), Sb(2)Te(3), and GeTe showed the potential of a different type of strain engineering due to long-range mutual straining. Still, a comprehensive understanding of the strain relaxation mechanism in these telluride heterostructures is lacking due to limitations of the earlier analyses performed. Here, we present a detailed study of strain in two-dimensional (2D/2D) and mixed dimensional (2D/3D) systems derived from mica/Bi(2)Te(3), Sb(2)Te(3)/Bi(2)Te(3), and Bi(2)Te(3)/GeTe heterostructures, respectively. We first clearly show the fast relaxation process in the mica/Bi(2)Te(3) system where the strain was generally transferred and confined up to the second or third van der Waals block and then abruptly relaxed. Then we show, using three independent techniques, that the long-range exponentially decaying strain in GeTe and Sb(2)Te(3) grown on the relaxed Bi(2)Te(3) and Bi(2)Te(3) on relaxed Sb(2)Te(3) as directly observed at the growth surface is still present within these three different top layers a long time after growth. The observed behavior points at immediate strain relaxation by plastic deformation without any later relaxation and rules out an elastic (energy minimization) model as was proposed recently. Our work advances the understanding of strain tuning in textured heterostructures or superlattices governed by anisotropic bonding.","Zhang, Heng; Yimam, Daniel T.; de Graaf, Sytze; Momand, Jamo; Vermeulen, Paul A.; Wei, Yingfen; Noheda, Beatriz; Kooi, Bart J.",ACS Nano,https://www.ncbi.nlm.nih.gov/pmc/articles/PMC7905873/,507
16344,Kongresse des BDI,2021-03-25,"Comparing the pathogen genomes from several cases of an infectious disease has the potential to help us understand and control outbreaks. Many methods exist to reconstruct a phylogeny from such genomes, which represents how the genomes are related to one another. However, such a phylogeny is not directly informative about transmission events between individuals. TransPhylo is a software tool implemented as an R package designed to bridge the gap between pathogen phylogenies and transmission trees. TransPhylo is based on a combined model of transmission between hosts and pathogen evolution within each host. It can simulate both phylogenies and transmission trees jointly under this combined model. TransPhylo can also reconstruct a transmission tree based on a dated phylogeny, by exploring the space of transmission trees compatible with the phylogeny. A transmission tree can be represented as a coloring of a phylogeny where each color represents a different host of the pathogen, and TransPhylo provides convenient ways to plot these colorings and explore the results. This article presents the basic protocols that can be used to make the most of TransPhylo. © 2021 The Authors. Basic Protocol 1: First steps with TransPhylo Basic Protocol 2: Simulation of outbreak data Basic Protocol 3: Inference of transmission Basic Protocol 4: Exploring the results of inference","Didelot, Xavier; Kendall, Michelle; Xu, Yuanwei; White, Peter J.; McCarthy, Noel",Curr Protoc,https://www.ncbi.nlm.nih.gov/pmc/articles/PMC7995038/,507
16481,Mitteilungen des Berufsverbandes der Deutschen Radiologen,2021-03-31,"A homeostatic balance exists between the resident microbiota in the oral cavity and the host. Perturbations of the oral microbiota under particular conditions can contribute to the growth of non-oral pathogens that are hard to kill because of their higher resistance to antimicrobials, raising the probability of treatment failure and reinfection. The presence of these bacteria in the oral cavity has been proven to be associated with several oral diseases such as periodontitis, caries, and gingivitis, and systemic diseases of importance in clinical medicine such as cystic fibrosis, HIV, and rheumatoid arthritis. However, it is still controversial whether these species are merely transient members or unique to the oral cavity. Mutualistic and antagonistic interactions between the oral microbiota and non-oral pathogens can also occur, though the mechanisms used by these bacteria are not clear. Therefore, this review presents an overview of the current knowledge about the presence of non-oral bacteria in the oral cavity, their relationship with systemic and oral diseases, and their interactions with oral bacteria. SUPPLEMENTARY INFORMATION: The online version contains supplementary material available at 10.1007/s00203-021-02300-y.","Zaatout, Nawel",Arch Microbiol,https://www.ncbi.nlm.nih.gov/pmc/articles/PMC8012020/,507
17290,Corona-Splitter,2021-05-10,"Population pharmacokinetic/pharmacodynamic (PK/PD) analysis was performed for extensive data for differing dosage forms and routes for dexamethasone (DEX) and betamethasone (BET) in 48 healthy nonpregnant Indian women in a partial and complex cross-over design. Single doses of 6 mg dexamethasone phosphate (DEX-P), betamethasone phosphate (BET-P), or 1:1 mixture of betamethasone phosphate and acetate (BET-PA) were administered orally (PO) or intramuscularly (IM) where each woman enrolled in a two-period cross-over study. Plasma concentrations collected over 96 h were described with a two-compartment model with differing PO and IM first-order absorption inputs. Overall, BET exhibited slower clearance, similar volume of distribution, faster absorption, and longer persistence than DEX with BET acetate producing extremely slow absorption but full bioavailability of BET. Six biomarkers were assessed over a 24-h baseline period with four showing circadian rhythms with complex baselines. These baselines and the strong responses seen after drug dosing were fitted with various indirect response models using the Laplace estimation methods in NONMEM 7.4. Both the PK and six biomarker responses were well-described with modest variability likely due to the homogeneous ages, weights, and ethnicities of the women. The drugs either inhibited or stimulated the influx processes with some models requiring joint inclusion of drug effects on circadian cortisol suppression. The biomarkers and order of sensitivity (lowest IC(50)/SC(50) to highest) were: cortisol, T-helper cells, basophils, glucose, neutrophils, and T-cytotoxic cells. DEX sensitivities were generally greater than BET with corresponding mean ratios for these biomarkers of 2.86, 1.27, 1.72, 1.27, 2.69, and 1.06. Overall, the longer PK (e.g. half-life) of BET, but lesser PD activity (e.g. higher IC(50)), produces single-dose response profiles that appear quite similar, except for the extended effects from BET-PA. This comprehensive population modeling effort provides the first detailed comparison of the PK profiles and six biomarker responses of five commonly used dosage forms of DEX and BET in healthy women. SUPPLEMENTARY INFORMATION: The online version of this article (10.1007/s10928-021-09755-y) contains supplementary material, which is available to authorized users.","Krzyzanski, Wojciech; Milad, Mark A.; Jobe, Alan H.; Peppard, Thomas; Bies, Robert R.; Jusko, William J.",J Pharmacokinet Pharmacodyn,https://www.ncbi.nlm.nih.gov/pmc/articles/PMC8099395/,507
17322,Corona-Splitter,2021-05-12,"Background: Pain in patients with hemophilia is common and usually a result of arthropathy. Clinicians should, however, consider a wide range of etiologies for pain in patients with hemophilia including infection, osteoporotic fractures, arthritis, and osteomalacia. Aims: This case demonstrates an instance of poorly localized back and hip pain, severe enough to prevent ambulation, caused by hypophosphatemic osteomalacia due to tenofovir treatment for blood transfusion acquired Human Immunodeficiency Virus (HIV) in a patient with hemophilia A. Methods: Case Report. Results: With termination of tenofovir treatment, this patient returned to baseline function. Conclusion: This report serves to emphasize the need for accurate diagnosis of pain in hemophilia patients, especially among the aging demographic of people with hemophilia in which there is a significant likelihood of an HIV infection and among patients who may be on Pre-exposure Prophylaxis (PrEP) or clinical trials involving tenofovir.","Woo, Emma; Kumbhare, Dinesh; Winston, Paul",,https://www.ncbi.nlm.nih.gov/pmc/articles/PMC7951154/,507
17786,Corona-Splitter,2021-05-27,,"Zimmermann, Gerd W.",MMW Fortschr Med,https://www.ncbi.nlm.nih.gov/pmc/articles/PMC8146186/,507
17792,EBM: Corona-Impfberatung solo?,2021-05-27,"Oxygen is essential for the maintenance of the body. Living organisms have evolved systems to secure an oxygen environment to be proper. Hypoxia-inducible factor (HIF) plays an essential role in this process; it is a transcription factor that mediates erythropoietin (EPO) induction at the transcriptional level under hypoxic environment. After successful cDNA cloning in 1995, a line of studies were conducted for elucidating the molecular mechanism of HIF activation in response to hypoxia. In 2001, cDNA cloning of dioxygenases acting on prolines and asparagine residues, which play essential roles in this process, was reported. HIF-prolyl hydroxylases (PHs) are molecules that constitute the core molecular mechanism of detecting a decrease in the partial pressure of oxygen, or hypoxia, in the cells; they can be called oxygen sensors. In this review, I discuss the process of molecular cloning of HIF and HIF-PH, which explains hypoxia-induced EPO expression; the development of HIF-PH inhibitors that artificially or exogenously activate HIF by inhibiting HIF-PH; and the significance and implications of medical intervention using HIF-PH inhibitors.","Hirota, Kiichi",Biomedicines,https://www.ncbi.nlm.nih.gov/pmc/articles/PMC8146675/,507
18071,Corona-Impfung: Honorar 100% sicher,2021-06-10,"ABSTRACT: Attenuated Listeria monocytogenes could be a potential vaccine vector for the immunotherapy of tumors or pathogens. However, the lack of reliable promoters has limited its ability to express foreign antigens. In the present study, 21 promoters were identified from Listeria monocytogenes through RNA-seq analysis under two pH conditions of pH 7.4 and pH 5.5. Based on the constructed fluorescence report system, 7 constitutive promoters exhibited higher strength than P(help) (1.8-fold to 5.4-fold), a previously reported strong promoter. Furthermore, the selected 5 constitutive promoters exhibited higher UreB production activity than P(help) (1.1-fold to 8.3-fold). Notably, a well-characterized constitutive promoter P(18) was found with the highest activity of fluorescence intensity and UreB production. In summary, the study provides a panel of strong constitutive promoters for Listeria monocytogenes and offers a theoretical basis for mining constitutive promoters in other organisms. KEY POINTS: • Twenty-one promoters were identified from L. monocytogenes through RNA-seq. • Fluorescent tracer of L. monocytogenes (P(18)) was performed in vitro and in vivo. • A well-characterized constitutive promoter P(18) could improve the expression level of a foreign antigen UreB in L. monocytogenes SUPPLEMENTARY INFORMATION: The online version contains supplementary material available at 10.1007/s00253-021-11374-z.","Ma, Junfei; Ji, Qianyu; Wang, Shuying; Qiu, Jingxuan; Liu, Qing",Appl Microbiol Biotechnol,https://www.ncbi.nlm.nih.gov/pmc/articles/PMC8175932/,507
18074,Die erste Seite,2021-06-10,"BACKGROUND: Artificial Intelligence has the potential to revolutionize healthcare, and it is increasingly being deployed to support and assist medical diagnosis. One potential application of AI is as the first point of contact for patients, replacing initial diagnoses prior to sending a patient to a specialist, allowing health care professionals to focus on more challenging and critical aspects of treatment. But for AI systems to succeed in this role, it will not be enough for them to merely provide accurate diagnoses and predictions. In addition, it will need to provide explanations (both to physicians and patients) about why the diagnoses are made. Without this, accurate and correct diagnoses and treatments might otherwise be ignored or rejected. METHOD: It is important to evaluate the effectiveness of these explanations and understand the relative effectiveness of different kinds of explanations. In this paper, we examine this problem across two simulation experiments. For the first experiment, we tested a re-diagnosis scenario to understand the effect of local and global explanations. In a second simulation experiment, we implemented different forms of explanation in a similar diagnosis scenario. RESULTS: Results show that explanation helps improve satisfaction measures during the critical re-diagnosis period but had little effect before re-diagnosis (when initial treatment was taking place) or after (when an alternate diagnosis resolved the case successfully). Furthermore, initial “global” explanations about the process had no impact on immediate satisfaction but improved later judgments of understanding about the AI. Results of the second experiment show that visual and example-based explanations integrated with rationales had a significantly better impact on patient satisfaction and trust than no explanations, or with text-based rationales alone. As in Experiment 1, these explanations had their effect primarily on immediate measures of satisfaction during the re-diagnosis crisis, with little advantage prior to re-diagnosis or once the diagnosis was successfully resolved. CONCLUSION: These two studies help us to draw several conclusions about how patient-facing explanatory diagnostic systems may succeed or fail. Based on these studies and the review of the literature, we will provide some design recommendations for the explanations offered for AI systems in the healthcare domain. SUPPLEMENTARY INFORMATION: The online version contains supplementary material available at 10.1186/s12911-021-01542-6.","Alam, Lamia; Mueller, Shane",BMC Med Inform Decis Mak,https://www.ncbi.nlm.nih.gov/pmc/articles/PMC8176739/,507
