,index,Unnamed: 0,title_x,x,y,publish_time_x,abstract,authors,journal,category,cluster
591721,591721,591721,"Transmission Dynamics of COVID-19 Outbreaks Associated with Child Care Facilities — Salt Lake City, Utah, April–July 2020",21.90912,11.229037,2020-09-18,"Cardiovascular diseases (CVD) (such as occlusion of the coronary arteries, hypertensive heart diseases and strokes) are diseases that generate thousands of patients with a high mortality rate worldwide. Many of these cardiovascular pathologies, during their development, generate a state of oxidative stress that leads to a deterioration in the patient’s conditions associated with the generation of reactive oxygen species (ROS) and reactive nitrogen species (RNS). Within these reactive species we find superoxide anion (O(2)(•–)), hydroxyl radical ((•)OH), nitric oxide (NO(•)), as well as other species of non-free radicals such as hydrogen peroxide (H(2)O(2)), hypochlorous acid (HClO) and peroxynitrite (ONOO(–)). A molecule that actively participates in counteracting the oxidizing effect of reactive species is reduced glutathione (GSH), a tripeptide that is present in all tissues and that its synthesis and/or regeneration is very important to be able to respond to the increase in oxidizing agents. In this review, we will address the role of glutathione, its synthesis in both the heart and the liver, and its importance in preventing or reducing deleterious ROS effects in cardiovascular diseases.","Matuz-Mares, Deyamira; Riveros-Rosas, Héctor; Vilchis-Landeros, María Magdalena; Vázquez-Meza, Héctor",Antioxidants (Basel),804,16
594671,594671,594671,"Notes from the Field: Rebound in Routine Childhood Vaccine Administration Following Decline During the COVID-19 Pandemic — New York City, March 1–June 27, 2020",21.838615,11.1788025,2020-07-31,"Objectives Little is known about how the COVID-19 pandemic has affected rehabilitation care in post-acute and long-term care. As part of a process to assess research priorities, we surveyed professionals in these settings to assess the impact of the pandemic and related research needs. Design Qualitative analysis of open-ended survey results. Setting and Participants 30 clinical and administrative staff working in post-acute and long-term care. Methods From June 24 through July 10, 2020, we used professional connections to disseminate an electronic survey to a convenience sample of clinical and administrative staff. We conducted an inductive thematic analysis of the data. Results We identified four themes, related to (1) rapid changes in care delivery, (2) negative impact on patients’ motivation and physical function, (3) new access barriers and increased costs, and (4) uncertainty about sustaining changes in delivery and payment. Rapid changes: Respondents described how infection control policies and practices shifted rehabilitation from group sessions and communal gyms to the bedside and telehealth. Negative impact: Respondents felt that patients’ isolation, particularly in residential care settings, affected their motivation for rehabilitation and their physical function. Access and costs: Respondents expressed concerns about increased costs (e.g., for personal protective equipment) and decreased patient volume, as well as access issues. Uncertainty: At the same time, respondents described how telehealth and Medicare waivers enabled new ways to connect with patients and wondered whether waivers would be extended after the public health emergency. Conclusions and Implications Survey results highlight rapid changes to rehabilitation in post-acute and long-term care during the height of the COVID-19 pandemic. Because staff vaccine coverage remains low and patients vulnerable in residential care settings, changes such as infection precautions are likely to persist. Future research should evaluate the impact on care, outcomes, and costs.","Reddy, Ann; Resnik, Linda; Freburger, Janet; Ciolek, Daniel E.; Gifford, David R.; Whitten, Margarite J.; Baier, Rosa R.",J Am Med Dir Assoc,804,24
605227,605227,605227,"Potential Indirect Effects of the COVID-19 Pandemic on Use of Emergency Departments for Acute Life-Threatening Conditions — United States, January–May 2020",21.951826,11.337938,2020-06-26,"The new coronavirus disease (COVID-19), pneumonia, tuberculosis, and breast cancer have one thing in common: these diseases can be diagnosed using radiological studies such as X-rays images. With radiological studies and technology, computer-aided diagnosis (CAD) results in a very useful technique to analyze and detect abnormalities using the images generated by X-ray machines. Some deep-learning techniques such as a convolutional neural network (CNN) can help physicians to obtain an effective pre-diagnosis. However, popular CNNs are enormous models and need a huge amount of data to obtain good results. In this paper, we introduce NanoChest-net, which is a small but effective CNN model that can be used to classify among different diseases using images from radiological studies. NanoChest-net proves to be effective in classifying among different diseases such as tuberculosis, pneumonia, and COVID-19. In two of the five datasets used in the experiments, NanoChest-net obtained the best results, while on the remaining datasets our model proved to be as good as baseline models from the state of the art such as the ResNet50, Xception, and DenseNet121. In addition, NanoChest-net is useful to classify radiological studies on the same level as state-of-the-art algorithms with the advantage that it does not require a large number of operations.","Luján-García, Juan Eduardo; Villuendas-Rey, Yenny; López-Yáñez, Itzamá; Camacho-Nieto, Oscar; Yáñez-Márquez, Cornelio",Diagnostics (Basel),804,28
619177,619177,619177,"Effectiveness of COVID-19 mRNA Vaccines Against COVID-19–Associated Hospitalization — Five Veterans Affairs Medical Centers, United States, February 1–August 6, 2021",21.866135,11.188459,2021-09-17,"Abstract In this study, an experiment was used to examine the effects of employee norm-violations in the service encounter with respect to what was considered appropriate behavior (e.g., social distancing) during the 2020 corona pandemic. The participants were exposed to a grocery store employee whose behavior was manipulated (norm-violating vs. norm-confirming). Norm-violating behavior resulted in lower perceived employee warmth, lower perceived employee competence, higher disgust, and more dehumanization of the employee. These responses mediated the impact of employee behavior on customer satisfaction, so that satisfaction was attenuated when norms were violated. The mediators, however, typically also instill a hostile, avoidance-seeking mindset for those who are subject to norm-violations, which is likely to result in problems when transgressors are to be persuaded to change their behaviors.","Söderlund, Magnus",Journal of Retailing and Consumer Services,804,16
619655,619655,619655,"Mental Health, Substance Use, and Suicidal Ideation During the COVID-19 Pandemic — United States, June 24–30, 2020",22.009346,11.028841,2020-08-14,"School closures during the coronavirus disease 2019 (COVID-19) pandemic have been outlined in studies from different disciplines, including economics, sociology, mathematical modeling, epidemiology, and public health. In this review, we discuss the implications of school closures in the context of the current COVID-19 pandemic. Modeling studies of the effects of school closures, largely derived from the pandemic influenza model, on severe acute respiratory syndrome coronavirus 2 produced conflicting results. Earlier studies assessed the risk of school reopening by modeling transmission across schools and communities; however, it remains unclear whether the risk is due to increased transmission in adults or children. The empirical findings of the impact of school closures on COVID-19 outbreaks suggest no clear effect, likely because of heterogeneity in community infection pressure, differences in school closure strategies, or the use of multiple interventions. The benefits of school closings are unclear and not readily quantifiable; however, they must be weighed against the potential high social costs, which can also negatively affect the health of this generation.","Cho, Eun Young; Choe, Young June",Clin Exp Pediatr,804,28
623760,623760,623760,"Mental Health and Substance Use Among Adults with Disabilities During the COVID-19 Pandemic — United States, February–March 2021",22.060377,11.180236,2021-08-27,"Plasma of COVID-19 patients induces pulmonary microvascular barrier failure which increases with disease severity. Here, we report a versatile high-throughput screening platform to test for involved plasma mediators and the therapeutic potential of barrier stabilising compounds.","Michalick, Laura; Weidenfeld, Sarah; Grimmer, Benjamin; Fatykhova, Diana; Solymosi, Philip Daniel; Behrens, Felix; Dohmen, Melanie; Brack, Markus C.; Schulz, Sabrina; Thomasch, Elisa; Simmons, Szandor; Müller-Redetzky, Holger; Suttorp, Norbert; Kurth, Florian; Neudecker, Jens; Toennies, Mario; Bauer, Torsten T.; Eggeling, Stephan; Corman, Victor Max; Hocke, Andreas C.; Witzenrath, Martin; Hippenstiel, Stefan; Kuebler, Wolfgang M.",Eur Respir J,804,13
636518,636518,636518,"COVID-19 Vaccine Second-Dose Completion and Interval Between First and Second Doses Among Vaccinated Persons — United States, December 14, 2020−February 14, 2021",22.12512,11.373669,2021-03-19,,"Blachman, Nina L.; Lee, Yi Shan; Arcila‐Mesa, Mauricio; Ferris, Rosie; Chodosh, Joshua",J Am Geriatr Soc,804,0
647046,647046,647046,"Public Health Responses to COVID-19 Outbreaks on Cruise Ships — Worldwide, February–March 2020",22.084373,11.415261,2020-03-27,"Abstract Background Coronavirus disease 2019 (COVID-19), caused by severe acute respiratory syndrome coronavirus 2 (SARS-CoV-2), involves multiple organs. Testicular involvement is largely unknown. Objective To determine the pathological changes and whether SARS-CoV-2 can be detected in the testes of deceased COVID-19 patients. Design, setting, and participants Postmortem examination of the testes from 12 COVID-19 patients was performed using light and electron microscopy, and immunohistochemistry for lymphocytic and histiocytic markers. Reverse transcription-polymerase chain reaction (RT-PCR) was used to detect the virus in testicular tissue. Outcome measurements and statistical analysis Seminiferous tubular injury was assessed as none, mild, moderate, or severe according to the extent of tubular damage. Leydig cells in the interstitium were counted in ten 400× microscopy fields. Results and limitations Microscopically, Sertoli cells showed swelling, vacuolation and cytoplasmic rarefaction, detachment from tubular basement membranes, and loss and sloughing into lumens of the intratubular cell mass. Two, five, and four of 11 cases showed mild, moderate, and severe injury, respectively. The mean number of Leydig cells in COVID-19 testes was significantly lower than in the control group (2.2 vs 7.8, p < 0.001). In the interstitium there was edema and mild inflammatory infiltrates composed of T lymphocytes and histiocytes. Transmission EM did not identify viral particles in three cases. RT-PCR detected the virus in one of 12 cases. Conclusions Testes from COVID-19 patients exhibited significant seminiferous tubular injury, reduced Leydig cells, and mild lymphocytic inflammation. We found no evidence of SARS-CoV-2 virus in the testes in the majority (90%) of the cases by RT-PCR, and in none by electron microscopy. These findings can provide evidence-based guidance for sperm donation and inform management strategies to mitigate the risk of testicular injury during the COVID-19 disease course. Patient summary We examined the testes of deceased COVID-19 patients. We found significant damage to the testicular parenchyma. However, virus was not detected in testes in the majority of cases.","Yang, Ming; Chen, Shuo; Huang, Bo; Zhong, Jing-Min; Su, Hua; Chen, Ya-Jun; Cao, Qin; Ma, Lin; He, Jun; Li, Xue-Fei; Li, Xiang; Zhou, Jun-Jie; Fan, Jun; Luo, Dan-Ju; Chang, Xiao-Na; Zhou, Ming; Nie, Xiu",Eur Urol Focus,804,20
657863,657863,657863,"Interim Estimates of COVID-19 Vaccine Effectiveness Against COVID-19–Associated Emergency Department or Urgent Care Clinic Encounters and Hospitalizations Among Adults During SARS-CoV-2 B.1.617.2 (Delta) Variant Predominance — Nine States, June–August 2021",21.808992,11.331774,2021-09-17,"The recent emergence of divergent SARS-CoV-2 lineages has raised concerns about the role of selection within individual hosts in propagating novel variants. Of particular concern are variants associated with immune escape and/or enhanced transmissibility. Though growing evidence suggests that novel variants can arise during prolonged infections, most infections are acute. Understanding the extent to which variants emerge and transmit among acutely infected hosts is therefore critical for predicting the pace at which variants resistant to vaccines or conferring increased transmissibility might emerge in the majority of SARS-CoV-2 infections. To characterize how within-host diversity is generated and propagated, we combine extensive laboratory and bioinformatic controls with metrics of within- and between-host diversity to 133 SARS-CoV-2 genomes from acutely infected individuals. We find that within-host diversity during acute infection is low and transmission bottlenecks are narrow, with very few viruses founding most infections. Within-host variants are rarely transmitted, even among individuals within the same household. Accordingly, we also find that within-host variants are rarely detected along phylogenetically linked infections in the broader community. Together, these findings suggest that efficient selection and transmission of novel SARS-CoV-2 variants is unlikely during typical, acute infection. One Sentence Summary Patterns of SARS-CoV-2 within hosts suggest efficient selection and transmission of novel variants is unlikely during typical, acute infection.","Braun, Katarina; Moreno, Gage; Wagner, Cassia; Accola, Molly A.; Rehrauer, William M.; Baker, David; Koelle, Katia; O’Connor, David H.; Bedford, Trevor; Friedrich, Thomas C.; Moncla, Louise H.",bioRxiv,804,22
658308,658308,658308,"Decreases in COVID-19 Cases, Emergency Department Visits, Hospital Admissions, and Deaths Among Older Adults Following the Introduction of COVID-19 Vaccine — United States, September 6, 2020–May 1, 2021",21.961355,11.274886,2021-06-11,"To promote the environmental sustainability of rural sanitation, a soil moisture controlled wastewater subsurface drip irrigation (SDI) dispersal system was field tested in the Black Belt Prairie of Alabama, USA. The soil moisture control strategy was designed to regulate wastewater disposal timing according to drain field conditions to prevent hydraulic overloading and corresponding environmental hazard. CW2D/HYDRUS simulation modeling was utilized to explore difficult-to-measure aspects of system performance. While the control system successfully adapted hydraulic loading rate to changing drain field conditions, saturated field conditions during the dormant season presented practical application challenges. The paired field experiment and simulation model demonstrate that soil biofilm growth was stimulated in the vicinity of drip emitters. Although biofilm growth is critical in maintaining adequate COD and [Formula: see text] removal efficiencies, the efficient removal of biodegradable COD itself by soil biofilm limits denitrification of formed [Formula: see text] . Furthermore, stimulated soil biofilm growth can create soil clogging around drip emitters, which was discerned in the field experiment along with salt accumulation, both of which were verified by simulation. Comparable modeling of system performance in sand and clay media demonstrate that the placement of soil moisture sensors within the drain field can have pronounced impacts on system hydraulic performance, depending on the soil permeability. Overall, the soil moisture control strategy tested is shown as a viable supplemental technology to promote the environmental sustainability of rural sanitation systems.","He, Jiajie; Dougherty, Mark; Chen, Zhongbing",Chemosphere,804,22
682035,682035,682035,"Knowledge and Practices Regarding Safe Household Cleaning and Disinfection for COVID-19 Prevention — United States, May 2020",21.949236,11.153467,2020-06-12,"The authors of this review both served on the National Academy of Science, Engineering, and Medicine Committee that produced the report, “Social Isolation and Loneliness in Older Adults: Opportunities for the Health Care System”. In 2018, the AARP Foundation commissioned the National Academies to establish a committee to research and develop a report on social isolation and loneliness in persons 50 years of age and older. Emphasis was placed upon the role of the health care system in addressing this fundamental public health problem. The committee released the report in February 2020 as the COVID-19 pandemic was beginning to spread to North America. In this review, the authors share central findings and conclusions from the report as well as how these findings may be relevant to the care and well-being of older adults during this historic pandemic. The health protective benefits of social distancing must be balanced by the essential need for sustaining social relationships.","Donovan, Nancy J.; Blazer, Dan",Am J Geriatr Psychiatry,804,20
687306,687306,687306,"Exposures Before Issuance of Stay-at-Home Orders Among Persons with Laboratory-Confirmed COVID-19 — Colorado, March 2020",21.947538,11.276644,2020-07-03,,"Kaushik, Ashlesha; Gupta, Sandeep; Sood, Mangla",Indian J Pediatr,804,24
687987,687987,687987,"Public Attitudes, Behaviors, and Beliefs Related to COVID-19, Stay-at-Home Orders, Nonessential Business Closures, and Public Health Guidance — United States, New York City, and Los Angeles, May 5–12, 2020",21.854168,10.944421,2020-06-19,"We suggest that the exuberant blood clotting and immune hyper-reaction seen in patients with COVID-19 may be exacerbated by depletion of the same regulator. This agent is protein S, which is both an anticoagulant in the blood coagulation cascade and an activating ligand for the immunosuppressive TAM family of receptor tyrosine kinases.","Lemke, Greg; Silverman, Gregg J.",Nat Rev Immunol,804,17
