,title_x,publish_time_x,abstract,authors,journal,url,category
494008,The Impact of the COVID-19 Pandemic on Immunization Campaigns and Programs: A Systematic Review,2021,"Background: COVID-19 has been the catalyst for a quantum shift in our professional and personal lives, literally and figuratively within the blink of an eyelash Healthcare workers (HCWs) have been profoundly impacted by this disruption at all levels, especially those working in high-stress specialties, such as cardiology, in resource-deprived and population-dense areas in developing countries, such as India We studied the impact of COVID-19 on a cohort of HCWs working in a high-stress, high-turnover cardiac intensive care unit (CICU) of a tertiary care center in India Questionnaires, results, and conclusions detailed in this presentation Considering the fact that India has not even reached the peak of the pandemic, the negative psychosocial impact of COVID-19 on HCWs of the cardiovascular community is highly concerning and disheartening Simplistic, sustainable long-term action plans are the need of the hour We must use the cataclysm wrought by COVID-19 to plug our broken healthcare systems For that, our frontline warriors should be in the best state of physical, mental, and emotional well-being to face up to this challenge The time to take action is NOW!! Methods: Evaluate the psychosocial impact of COVID-19 on HCWs working in a highly-stressed environment with high patient burden and turnover rates (45 bedded CICU including 15 step-down beds;average occupancy 90% to 100%) Understand perceived psychological burden and risk of post-traumatic stress disorder [PTSD] in these HCWs [Formula presented] Delineating Stressors for this HCW Cohort A Public Healthcare System and Bureaucratic Policies 1 Population-dense and resource-scarce developing Country 2 Despair at the inadequacy of the public healthcare system 3 Inability to understand and / or keep pace with fast-changing bureaucratic policies B Updating knowledge on COVID-19 1 Stress of updating oneself on explosion of knowledge on COVID-19 2 Ambiguous / continuously-evolving admission guidelines and treatment algorithms on: i COVID-19 patients with cardiac manifestations ii COVID-19 patients presenting with an cardiac ailment iii Patients presenting with decompensation of previous cardiac ailments due to COVID-19 Defining Stressors for this HCW Cohort C Personal Protective Equipment [PPE] 1 Training on Donning and Doffing 2 Efficacy 3 Quality 4 Availability D Workplace Disruption 1 Disruption of the existing workspace to incorporate demands of the pandemic 2 Redeployment to COVID-19 ICU 3 Creation of a separate cardiac ICU for COVID-19 cardiac patients 4 Revising process flows for admission / discharge / follow- up for cardiac patients E Direct Psychological Impact of the Pandemic 1 Fear of getting infected by the virus 2 Fear of being an asymptomatic carrier for friends and family 3 Fear of job security 4 Jeopardy of future professional goals / growth / goals due to pandemic 5 Feelings of inadequacy / hopelessness / helplessness burn-out F Societal Stigma / Ostracization due to Professional Hazard Snapshot - Questionnaire 1 to Assess Psychosocial Impact of COVID-19 * A Personal Sphere: 1 Fear that you / your family are infected by COVID-19 2 Your likelihood of getting infected by COVID-19 3 Your fear regarding possibility of becoming infected by COVID-19 4 Increased familial responsibilities / load 5 Inability to destress as leisure and / or social activities impacted 6 Preventive measures at home to protect relatives during pandemic [ shift to another place - 10/ separate room - 6 / PPE at home while in common places – 4/ not possible to distance - 0] * Scale of 01 – 10 [01 – lowest / least;10 – highest / maximum] B Professional Sphere – Impact of COVID-19 on Daily Workload 1 Tense working environment 2 Scarce social support from team 3 PPE usage a burden ( gloves, aprons, long-sleeved gowns, surgical masks, eye goggles) ? 4 Willingness to get redeployed to COVID-19 ICU, if required at peak of pandemic 5 Willingness to transit to remote / virtual consults for follow-up patients [post-discharge] 6 Increa ed bureaucracy 7 Extended working hours * Scale of 01 – 10 [01 – lowest / least;10 – highest / maximum] Snapshot - Questionnaire 2 to Assess Psychosocial Impact of COVID-19 ** 1 Emotionally drained from work 2 Fatigued in morning at prospect of going to work 3 Working with people all day – strain 4 Burnt – out / frustrated 5 Trouble sleeping 6 Reminder of negative work situations pertaining to pandemic 7 Irritable / angry 8 Surreal / unreal 9 Denial that in midst of a pandemic 10 Numb 11 Jumpy 12 Trouble with concentration ** Rate – 01 - Never / 02 - rarely / 03 - sometimes / 04 - frequently / 05 – always Snapshot - Questionnaire 3 to Assess Psychosocial Impact of COVID-19 *** 1 Feeling nervous, anxious or on the edge 2 Not able to stop / control worrying 3 Little interest / pleasure in doing things 4 Feeling down, depressed, or hopeless 5 Asked for psychological support 6 Heading for burnt – out syndrome 7 Afraid of suffering from burnout 8 Afraid of asking for help Timeframe: April – June 2020 *** Scale: 01 – Never / 02 – less than 10 days / 03 - less than 1/4th of three months / 04 – more than 50% of timeframe / 05 – Nearly everyday Results: Based on the preliminary data accumulated from this HCW cohort, COVID-19 has had a major negative psychosocial impact on it 40% of HCWs are fearful of getting infected with COVID-19 and /or infecting family with it 5% resigned from fear of contracting the virus 35% faced social ostracization / discrimination to some extent since the pandemic onset 3% came in contact with suspected COVID-19 patients and were quarantined, which has led to PTSD-like symptoms in that subset Based on the preliminary data accumulated from this HCW cohort, COVID-19 has had a major negative psychosocial impact on it 60% feel that their stress levels are higher by 50% or more due to direct / indirect impact of the pandemic 70% opine that their workloads are higher since pandemic onset due to additional bureaucratic demands / PPE burden / reinforcement of infection control protocols / ambiguous admission / treatment criteria 80% believe that they / their family members are at heightened risk of getting infected with COVID-19 60% have symptoms of burnout However, 80% of these hesitant to seek help for symptoms of burn-out Conclusion: Action Plan: Simplified admission / discharge / follow-up protocols Emphasis on virtual / remote follow-up visits for patients Education / awareness on COVID-19, especially for nursing staff Addressing PPE usage, its gaps and emphasizing adherence to it Addressing gaps in infection control protocol Reducing viral load by staggered workhours / breaks Anonymous in-house psychologist counseling options Categories Other: COVID-19 Lectures","Chauhan, H.",Journal of the American College of Cardiology,,426
494595,Social Support and Optimism as Protective Factors for Mental Health among 7765 Healthcare Workers in Germany during the COVID-19 Pandemic: Results of the VOICE Study,2021,"The trajectory and impact of the severe acute respiratory syndrome coronavirus 2 (SARS-CoV-2) pandemic in sub-Saharan Africa are unclear, but they are seemingly varied between different countries, with most reporting low numbers. We use the situation in Zimbabwe to build an argument that the epidemic is likely to be attenuated in some countries with similar socioeconomic and cultural structures. However, even an attenuated epidemic may overwhelm weak health systems, emphasizing the importance of prevention. These prevention strategies should be tailored to the unique social and cultural networks of individual countries, which may facilitate the spread of SARS-CoV-2. It is also equally important to maintain services for the major infectious diseases in the region, such as tuberculosis and malaria. A breakdown of treatment and prevention services for these conditions may even overshadow the projected morbidity and mortality from coronavirus disease 2019 (COVID-19).","Katsidzira, Leolin; Gwaunza, Lenon; Hakim, James G",Clin Infect Dis,,426
494597,Social Support and Optimism as Protective Factors for Mental Health among 7765 Healthcare Workers in Germany during the COVID-19 Pandemic: Results of the VOICE Study,2021,,"Miscione, Horacio",Revista de la Asociación Argentina de Ortopedia y Traumatología,,426
494747,The Impact of the COVID-19 Pandemic on the Spectrum of Performed Dental Procedures,2021,"OBJECTIVE: To investigate the effects of COVID-19 pandemic on patients' perceptions of hardship in obtaining their drugs and if this pandemic and the social restrictions in response to that has resulted in any changes in their seizure control status. We also investigated factors potentially associated with the perceptions of difficulty in obtaining their drugs (eg, polytherapy vs monotherapy, taking imported drugs, and seizure status worsening). METHODS: We surveyed a random sample of patients with epilepsy, who were registered in our database at Shiraz Epilepsy Center, Iran, on their perceptions on two issues: (a) What has been your experience on obtaining your antiseizure medications in the past 4 weeks (compared to before)? (b) Have you experienced any changes in your seizure control status in the past 4 weeks? RESULTS: We included 100 patients (53 male and 47 female patients). In response to the question ""Have you had any difficulties in the past 4 weeks to obtain your drugs?,"" 31 people (31%) expressed hardship obtaining their drugs. In response to the question ""How has been your seizure control status compared with before?,"" six people (6%) expressed worsening of their seizure control status in the past 4 weeks. None of the patients reported symptoms of coronavirus infection. CONCLUSION: About one-third of patients with epilepsy expressed significant hardship obtaining their drugs after the intensification of the COVID-19 outbreak in Iran. The current COVID-19 pandemic could be considered as a major shock to a nation that has already been under significant pressure (ie, Iran).","Asadi-Pooya, Ali A; Farazdaghi, Mohsen; Bazrafshan, Mehdi",Acta neurol. scand,,426
495936,Spatial Variability in COVID-19 Mortality,2021,"Subunit vaccines induce immunity to a pathogen by presenting a component of the pathogen and thus inherently limit the representation of pathogen peptides for cellular immunity-based memory. We find that severe acute respiratory syndrome coronavirus 2 (SARS-CoV-2) subunit peptides may not be robustly displayed by the major histocompatibility complex (MHC) molecules in certain individuals. We introduce an augmentation strategy for subunit vaccines that adds a small number of SARS-CoV-2 peptides to a vaccine to improve the population coverage of pathogen peptide display. Our population coverage estimates integrate clinical data on peptide immunogenicity in convalescent COVID-19 patients and machine learning predictions. We evaluate the population coverage of 9 different subunits of SARS-CoV-2, including 5 functional domains and 4 full proteins, and augment each of them to fill a predicted coverage gap.","Liu, Ge; Carter, Brandon; Gifford, David K",Cell Syst,,426
497136,Protective Elements of Mental Health Status during the COVID-19 Outbreak in the Portuguese Population,2021,"Cryoglobulins consist of serum immunoglobulins that precipitate below 37°C and resolubilize upon warming The clinical triad of cryoglobulinemia usually includes purpura, weakness, and arthralgia Cryoglobulinemic syndrome, clinically defined as a systemic vasculitis, is associated with chronic infection with hepatitis C virus (HCV) and autoimmune disorders and can evolve into B-cell malignancies While the current literature about HCV-associated cryoglobulinemia is not very limited, little is known about the immunologic and serologic profiles of affected patients Therefore, comprehension of the pathogenetic mechanisms underlying cryoprecipitation could be very helpful Due to the persistence of viral antigenic stimulation, biomarkers to use after the worsening progression of HCV infection to lymphoproliferative and/or autoimmune diseases are widely needed Laboratory methods used to detect and characterize low concentrations of cryoprecipitates and immunotyping patterns could improve patient management The most critical factor affecting cryoglobulin testing is that the pre-analytical phase is not fully completed at 37°C","Napodano, Cecilia Gulli Francesca Rapaccini Gian Ludovico Marino Mariapaola Basile Umberto",Advances in Clinical Chemistry,,426
497425,Factors Associated with SARS-CoV-2 Infection in Physician Trainees in New York City during the First COVID-19 Wave,2021,"The role of heating, ventilation, and air conditioning systems (HVAC) in spreading SARSCoV-2 is a complex topic and has not been studied thoroughly. There are some existing strategies and technologies for health and high performance buildings;however, applications to other types of buildings come at large energy penalty: cost;design, regulations and standards changes, and varied public perception. In the present work, different factors and strategies are reviewed and discussed and suggested mitigations and solutions are provided including the required air flowrates with the presence of infectors with and without mask and disinfection techniques including ultraviolet (UV) light. Experimental and numerical research in open literature suggests that the airborne transmission of SARS-CoV-2 is sufficiently likely. However, in situ detailed experimental studies are still needed to understand the different scenarios of the virus spread. Displacement ventilation, underfloor air distribution, chilled beams, radiant ceiling panels, and laminar flow systems have varied effectiveness. High-efficiency particulate arrestance (HEPA) filters and UV light can clean viruses but at high energy cost. Suggested solutions to reduce the infection probability include recommended levels of ventilation and a combination of virus sampling technologies including cyclones, liquid impinger, filters, electrostatic precipitators, and water-based condensation. © 2020 by ASME.","Sleiti, A. K.; Ahmed, S. F.; Ghani, S. A.","Journal of Energy Resources Technology, Transactions of the ASME",,426
498057,"Promoting Physical Activity during School Closures Imposed by the First Wave of the COVID-19 Pandemic: Physical Education Teachers' Behaviors in France, Italy and Turkey",2020,,"Parra-Saavedra, Miguel; Miranda, Jezid",Lancet Glob Health,,426
498121,"Pain Status and Its Association with Physical Activity, Psychological Stress, and Telework among Japanese Workers with Pain during the COVID-19 Pandemic",2021,"BACKGROUND: Telemedicine use has expanded rapidly since the COVID-19 pandemic in order to adhere to social distancing protocols and has been met with much enthusiasm. However, less is known about the use of telemedicine in sports and exercise medicine (teleSEM) and its utility to treat emergent craniofacial injuries. Given how common facial trauma is among athletes and its possible complications, incorporation of telemedicine in sports-related injuries may prove to be quintessential for athletes and coaches. METHODS: A comprehensive literature search of the MEDLINE, PubMed, Google Scholar, EMBASE, and Cochrane Central Register of Controlled Trials was conducted for studies published through December 2020 with multiple search terms related to telemedicine in sports and trauma care. RESULTS: Overall, teleSEM is appreciated by both patients and physicians alike. Studies show that the satisfaction rate among patients and physicians are high. Sports-related telemedicine visits can help improve resource utilization and total costs. Facial trauma studies also reveal that the level of concurrency of treatment options between telemedicine visits and in-person consultations is almost perfect. Further, there are many additional ways that teleSEM can be implemented in treating injured athletes, including possible collaboration between athletic coaches and physicians as well as mobile device applications. Telemedicine may be particularly useful in treating acute injuries in low-resourced areas with limited equipment and training. CONCLUSION: Telemedicine has been widely employed for sports-related injuries and in traumatic care. Patients and providers alike have noted its utility over other methods of communication with physicians. Our findings suggest that telemedicine has a significant potential in treating sports-related injuries and improving the efficiency of diagnoses and treatments. It may enhance outcomes for participants in athletic events. This may become a key aspect of determining whether a player can return to immediate competition.","Tam, Anson; Plotsker, Ethan; Kim, Minji; Thaller, Seth R",J. craniofac. surg,,426
498434,The Impact of COVID-19 on Female Sexual Health,2020,,"Hildenwall, Helena; Luthander, Joachim; Rhedin, Samuel; Hertting, Olof; Olsson-Åkefeldt, Selma; Melén, Erik; Alfvén, Tobias; Herlenius, Eric; Ryd Rinder, Malin",Acta paediatr. scand,,426
498552,The Impact of COVID-19 Restrictions on Mental Well-Being and Working Life among Faroese Employees,2021,"BACKGROUND: Pregnancy is an important time for developing attitudes and beliefs about childhood vaccinations. Vaccinations are among the most effective way of preventing some infectious diseases. Discussions on vaccinations have increased due to the Covid-19 pandemic and there is an opportunity to give society correct information on vaccinations. AIM: The aim of the study was to determine the opinions of pregnant women on vaccinations in pregnancy and childhood and the effect of the Covid-19 pandemic on these views. METHODS: The study was conducted as a cross-sectional study. The sample included 152 pregnant women. Data were collected through a 25-item online questionnaire created by the researchers. RESULTS: It was found in our study that 29.6% of pregnant women using forum websites exhibited hesitant attitudes towards vaccinations. The vaccine hesitancy rate was found to be high in pregnant women who said that their economic level was low and who worried about the risks of vaccination. The Covid-19 pandemic was reported to be the cause of a decrease in vaccine hesitancy in 28.9% of the participants. CONCLUSION: The events surrounding the pandemic provided an opportunity to explain how pregnant women feel about vaccinations. Providing pregnant women with access to correct information from health workers may reduce the problem of trust, which is among the most important reasons for vaccine hesitancy.","Gencer, Hatice; Özkan, Sevgi; Vardar, Okan; Serçekus, Pinar",Women and birth (Online),,426
498715,Home-Based Care for People with Alzheimer's Disease and Related Dementias (ADRD) during COVID-19 Pandemic: From Challenges to Solutions,2020,"The outbreak of COVID-19 has significantly inhibited global economic growth and impacted the environment Some evidence suggests that lockdown strategies have significantly reduced traffic-related air pollution (TRAP) in regions across the world However, the impact of COVID-19 on TRAP on roadside is still not clearly understood In this study, we assessed the influence of the COVID-19 lockdown on the levels of traffic-related air pollutants in Shanghai The pollution data from two types of monitoring stations—roadside stations and non-roadside stations were compared and evaluated The results show that NO2, PM2 5, PM10, and SO2 had reduced by ∼30–40% at each station during the COVID-19 pandemic in contrast to 2018–2019 CO showed a moderate decline of 28 8% at roadside stations and 16 4% at non-roadside stations In contrast, O3 concentrations increased by 30 2% at roadside stations and 5 7% at non-roadside stations This result could be resulted from the declined NOx emissions from vehicles, which lowered O3 titration Full lockdown measures resulted in the highest reduction of primary pollutants by 34–48% in roadside stations and 18–50% in non-roadside stations The increase in O3 levels was also the most significant during full lockdown by 64% in roadside stations and 33% in non-roadside stations due to the largest decrease in NO2 precursors, which promote O3 formation Additionally, Spearman's rank correlation coefficients between NO2 and other pollutants significantly decreased, while the values between NO2 and O3 increased at roadside stations","Wu, Cui-Lin Wang Hong-Wei Cai Wan-Jin He Hong-Di Ni An-Ning Peng Zhong-Ren",Building and Environment,,426
498779,Exercising in Times of Lockdown: An Analysis of the Impact of COVID-19 on Levels and Patterns of Exercise among Adults in Belgium,2020,,"Dirie, J.; Hart, E.; Mahesan, T.; Fawcett, W.; Perry, M.; Janardanan, S.; Moschonas, D.; Krishnaji, P.; Chedid, W. A.",British Journal of Surgery,,426
498799,"Dissociation, Cognitive Reflection and Health Literacy Have a Modest Effect on Belief in Conspiracy Theories about COVID-19",2021,"Oncologic patients are regarded as the population most at risk of developing a severe course of COVID-19 due to the fact that malignant diseases and chemotherapy often weaken the immune system. In the face of the ongoing SARS-CoV-2 pandemic, how particular patients deal with this infection remains an important question. In the period between the 15 and 26 April 2020, a total of 1227 patients were tested in one of seven oncologic outpatient clinics for SARS-CoV-2, regardless of symptoms, employing RT-qPCR. Of 1227 patients, 78 (6.4%) were tested positive of SARS-CoV-2. Only one of the patients who tested positive developed a severe form of COVID-19 with pneumonia (CURB-65 score of 2), and two patients showed mild symptoms. Fourteen of 75 asymptomatic but positively tested patients received chemotherapy or chemo-immunotherapy according to their regular therapy algorithm (±4 weeks of SARS-CoV-2 test), and 48 of 78 (61.5%) positive-tested patients received glucocorticoids as co-medication. None of the asymptomatic infected patients showed unexpected complications due to the SARS-CoV-2 infection during the cancer treatment. These data clearly contrast the view that patients with an oncologic disease are particularly vulnerable to SARS-CoV-2 and suggest that compromising therapies could be continued or started despite the ongoing pandemic. Moreover the relatively low appearance of symptoms due to COVID-19 among patients on chemotherapy and other immunosuppressive co-medication like glucocorticoids indicate that suppressing the response capacity of the immune system reduces disease severity.","Hempel, Louisa; Piehler, Armin; Pfaffl, Michael W; Molnar, Jakob; Kirchner, Benedikt; Robert, Sebastian; Veloso, Julia; Gandorfer, Beate; Trepotec, Zeljka; Mederle, Stefanie; Keim, Sabine; Milani, Valeria; Ebner, Florian; Schweneker, Katrin; Fleischmann, Bastian; Kleespies, Axel; Scheiber, Josef; Hempel, Dirk; Zehn, Dietmar",Cancer Med,,426
498822,Health Communication in COVID-19 Era: Experiences from the Italian VaccinarSì Network Websites,2021,,"Marhaeni, Wulandewi; Wijaya, Andreas Budi; Kusumaningtyas, Prabandari; Mapianto, Rahmawan Sakup",Indian J Pediatr,,426
499133,An Umbrella Review of the Work and Health Impacts of Working in an Epidemic/Pandemic Environment,2021,,"Fuse-Nagase, Yasuko; Kuroda, Takuya; Watanabe, Junko",Asian Journal of Psychiatry,,426
