,index,Unnamed: 0,title_x,x,y,publish_time_x,abstract,authors,journal,category,cluster
314947,314947,314947,The Silent Pandemic: Why COVID-19-Induced Loneliness is No Laughing Matter,22.526367,1.1739775,2021,"INTRODUCTION: This study investigated the role of early public research funding regarding the COVID-19 pandemic in Brazil METHODS: We examined the budget for research projects relating to the number of cases and deaths and the relationship between each federal unit, gross domestic product (GDP) per capita, and the national GDP per capita RESULTS: Using data from the websites of official funding agencies and the Brazilian government, we found that, in the first four months since the first case in Wuhan, China (December 31, 2019), around US$ 38 3 million were directed to public funding for scientific investigations against the COVID-19 pandemic However, only 11 out of 27 federal units provided funding during the initial stages of the outbreak, and those that did provide financing were not necessarily the units having the most inhabitants, highest GDP, or the greatest number of cases The areas of research interest were also identified in the funding documents;the most common topic was &quot;diagnosis&quot;and the least common was &quot;equipment for treatment &quot;CONCLUSIONS: Brazilian researchers had access to funding opportunities for projects against COVID-19 However, strategies to minimize the economic impacts of COVID-19 are crucial in mitigating or avoiding substantial financial and social shortcomings, particularly in terms of an emerging market such as Brazil","Campo, Kaio Niitsu Rodrigues Isabella Caroline Pereira Lopes Éder Sócrates Najar Gabriel Laís Pellizzer",Rev. Soc. Bras. Med. Trop,603,16
328411,328411,328411,From World War II to COVID-19: A Historical Perspective on the American Medical Supply Chain,22.639517,1.0983585,2021,"Following an outbreak of a novel Coronavirus (COVID-19) in Wuhan City, Hubei Province of China, rapid community, regional and international spread has occurred with exponential growth in cases and deaths On 30 January 2020, the Director-General (DG) of the WHO declared the COVID-19 outbreak a public health emergency of international concern (PHEIC) under the International Health Regulations (IHR) (2005) The first case in the Americas was confirmed in the USA on 20 January 2020, followed by Brazil on 26 February 2020 Since then, COVID-19 has spread to all 54 countries and territories in the Americas Situation in Numbers in the Americas as of 17 August (15:00): 11,667,196 confirmed cases;419,995 deaths;54 countries / areas / territories counted for epidemiological purposes","Pan American Health, Organization",,603,20
334374,334374,334374,Iran's Experience in Establishing Convalescent Care Facilities for Patients With COVID-19,22.552547,1.2086734,2020,,"Andrade, Chittaranjan",Indian J. Psychiatry,603,25
337299,337299,337299,Emergency Care Systems: The Missing Link for Effective Treatment of COVID-19 in Africa,22.547035,1.0620974,2020,,"Farhat, Amel Hili Amal",,603,1
341178,341178,341178,"COVID-19 Epidemic in the Middle Province of Northern Italy: Impact, Logistics, and Strategy in the First Line Hospital",22.549404,1.1083648,2020,"This research aimed to design and develop an online module for EFL students during and after the Covid-19 pandemic. On 2020, Covid-19 pandemic outbreak forced all teaching and learning processes at universities in Indonesia to migrate totally to the online learning system. The impact of the Covid-19 pandemic that hit and has not been known when it will be ended, the teaching learning process cannot be run optimally because the application of physical and social distancing is practicing on campus and leads the education world to make adjustments to this situation. This research is a developmetn research in the field of education that aims to develop an online-based teaching module on Cross Cultural Understanding subject for students at one of the universities in Indonesia. The final result of this study is an online classroom teaching module of Cross Cultural Understanding subject based on the Contextual Teaching and Learning (CTL) approach for students of English education program in Indonesia which is a good innovation in the midst of the Covid-19 pandemic outbreak, because this teaching module had been developed based on the needs of students and lecturer, adapted from the applicable curriculum in educational institutions related and based on the field trial process that is conformable with the principle of the ASSURE model.","Rahman Hakim, M. Arif Serasi Reko Efrizal Dedi Kurniawan Dondi",Journal of Physics: Conference Series,603,16
351232,351232,351232,"COVID-19: Second Wave or Multiple Peaks, Natural Herd Immunity or Vaccine-We Should be Prepared",22.56158,1.0468484,2020,"La enfermedad del coronavirus 2019 (COVID-19) causada por la infección por el nuevo coronavirus (SARS-CoV-2) ha creado una pandemia que ha llevado a una lucha mundial para hacer frente al gran número de personas infectadas, muchas de las cuales requieren cuidados intensivos. Hasta la fecha, no existe un tratamiento antivirus específico para COVID-19. El uso de transfusiones de plasma de convalecientes podría ser de gran valor en la pandemia actual. Los pacientes con SRAS-CoV-2 recuperados recientemente que pueden ser donantes adecuados se someten a aféresis para obtener plasma de convalecencia que contenga anticuerpos con títulos elevados, siempre que cumplan los criterios de donación de sangre. En esta revisión, resumimos la literatura existente sobre el plasma convaleciente como una opción terapéutica para COVID-19. Es importante señalar que es necesario estudiar más a fondo el momento adecuado para la administración de plasma de convalecencia y la gravedad de sus efectos adversos. El plasma de convalecencia ofrece la posibilidad de convertirse en una opción de tratamiento prometedora inmediata al evaluar los medicamentos existentes y desarrollar nuevas vacunas y terapias específicas.","Platero Portillo, Tania; Llocclla Delgado, Sussan; Guevara Rodriguez, Nehemias",Rev. Fac. Med. Hum,603,5
351555,351555,351555,Regulatory Challenges in the COVID-19 Era: The Case of Tunisia,22.52864,1.2150784,2020,"Due to unique features in surface activity, thermal stability, electrical and thermal conductivity, and compatibility with biomolecules such as DNA and proteins, carbon-based nanoparticles are raised potential as a candidate for various applications such as catalytic processes, drug delivery, light, and electrical engineering. Based on this premise, thermodynamic features of pure, graphene, and carbon nanotube (CNT)-based gold nanoparticles (AuNPs) are investigated using molecular dynamics approach. Melting, heat capacity, thermal conductivity, contact angle of molten AuNPs, and phase transition are calculated as indicators of thermodynamic properties of pure and carbon-based AuNPs. Simulation results indicate that the presence of a carbon platform and its contact surface area has a significant role in the thermodynamic properties of AuNPs and leads the phononic heat capacity and thermal conductivity to decrease for AuNPs. The platform also causes the melting point temperature of AuNPs to increase. The melting of gold on the carbon base is of the first-order type. In addition, contact angle for molten AuNPs on the Graphene is significantly higher than the one on the CNT due to more contact area on the Graphene substrate.Graphical abstract .","Gowdini, E; Ahmad, A A; Mabudi, A; Hadipour, N L; Kharazian, B",J Mol Model,603,16
354835,354835,354835,Bed Surge Capacity in Saudi Hospitals during COVID-19 Pandemic,22.530947,1.2056965,2021,"The novel Coronavirus (COVID-19) has created a worldwide deadly pandemic that has become a major public health challenge. All semi-urgent and elective medical care has come to a halt to conserve capacity to care for patients during this pandemic. As the numbers of COVID-19 cases decrease across Canada, our healthcare system also began to reopen various facilities and medical offices. The aim for this document is to compile the current evidence and provide expert consensus on the safe return to clinic practice in Otolaryngology - Head & Neck Surgery. These recommendations will also summarize general precaution principles and practical tips for office across Canada to optimize patient and provider safety. Risk assessment and patient selection are crucial to minimizing exposure to COVID-19. Controversial topics such as COVID-19 mode of transmission, duration of exposure, personal protective equipment, and aerosol-generating procedures will be analyzed and discussed. Practical solutions of pre-visit office preparation, front office and examination room set-up, and check out procedures are explored. Specific considerations for audiology, pediatric population, and high risk AGMPs are also addressed. Given that the literature surrounding COVID-19 is rapidly evolving, these guidelines will serve to start our specialty back into practice over the next weeks to months and they may change as we learn more about this disease.","Chan, Y; Angel, D; Aron, M; Hartl, T; Moubayed, S P; Smith, K A; Sommer, D D; Sowerby, L; Spafford, P; Mertz, D; Witterick, I J",J Otolaryngol Head Neck Surg,603,23
357404,357404,357404,How to Reorganize the Radiology Departments to Face the 2019 Coronavirus Disease Outbreak,22.578299,1.2888498,2020,,"Magid, Steven K; Nelson, Jamie",HSS J,603,1
357405,357405,357405,How to Reorganize the Radiology Departments to Face the 2019 Coronavirus Disease Outbreak,22.716707,1.505851,2020,"Translation of a genetic codon without a cognate tRNA gene is affected by both the cognate tRNA availability and the interaction with non-cognate isoacceptor tRNAs. Moreover, two consecutive slow codons (slow di-codons) lead to a much slower translation rate. Calculating the composition of host specific slow codons and slow di-codons in the viral protein coding sequences can predict the order of viral protein synthesis rates between different virus strains. Comparison of human-specific slow codon and slow di-codon compositions in the genomes of 590 coronaviruses infect humans revealed that the protein synthetic rates of 2019 novel coronavirus (2019-nCoV) and severe acute respiratory syndrome-related coronavirus (SARS-CoV) may be much faster than other coronaviruses infect humans. Analysis of host-specific slow codon and di-codon compositions provides links between viral genomic sequences and capability of virus replication in host cells that may be useful for surveillance of the transmission potential of novel viruses.","Yang, Chu-Wen; Chen, Mei-Fang",J Microbiol Immunol Infect,603,6
360270,360270,360270,SPE Approach for Robust Estimation of SIR Model with Limited and Noisy Data: The Case for COVID-19,22.621435,1.0848017,2020,"The coronavirus disease 2019 (COVID-19) pandemic has changed the world as we knew it, and medical education is not an exception. Walter Sisulu University (WSU) has a distributed model of clinical training for the Bachelor of Medicine and Bachelor of Surgery (MBChB) programme. To address the challenges occasioned by the pandemic, the Department of Family Medicine and Rural Health undertook a modification of its MBChB VI programme. The changes aim to ensure the protection of all stakeholders and maintain the integrity of the programme, including the assessment. Changes were made in the delivery of the programme and in the way people interact with one another. Continuous assessment was modified, and the oral portfolio examination was introduced as the summative assessment tool. Although COVID-19 threatened the traditional way of teaching and learning, it however provided us with the opportunity to refocus and reposition our undergraduate medical programme.","Adeleke, Olukayode A; Cawe, Busisiwe; Yogeswaran, Parimalaranie",S Afr Fam Pract (2004),603,1
366998,366998,366998,An Eye on the Future of COVID'19: Prediction of Likely Positive Cases and Fatality in India over A 30 Days Horizon using Prophet Model,22.703941,1.0399467,2020,"Achieving promotion in rank is considered an important measure of career success for academic radiologists. Multiple studies have shown prevailing gender inequities disadvantaging women in medicine. The recent global pandemic due to COVID-19 has affected all parts of society but has disproportionately impacted women and may delay academic promotion of female academic radiologists. We reviewed the evidence regarding the potential career impact of the COVID-19 pandemic on female radiologists. The pandemic has disproportionately increased women's domestic and childcare responsibilities and decreased female researchers' productivity which may delay academic promotion. Strategies to address the problem of delayed promotion of female radiologists include raising awareness, mentorship and sponsorship, operational flexibility, and support with domestic and childcare responsibilities.","Tso, Hilda H; Parikh, Jay R",Clin Imaging,603,10
368336,368336,368336,Misinformation in Wake of the COVID-19 Outbreak: Fueling Shortage and Misuse of Lifesaving Drugs in Pakistan,22.609676,1.1254239,2020,"On 19-21 November 2020, the meeting of the 30 years of the Padova Muscle Days was virtually held while the SARS-CoV-2 epidemic was hitting the world after a seemingly quiet summer. During the 2020-2021 winter, the epidemic is still active, despite the start of vaccinations. The organizers hope to hold the 2021 Padua Days on Myology and Mobility Medicine in a semi-virtual form (2021 S-V PDM3) from May 26 to May 29 at the Thermae of Euganean Hills, Padova, Italy. Here the program and the Collection of Abstracts are presented. Despite numerous world problems, the number of submitted/selected presentations (lectures and oral presentations) has increased, prompting the organizers to extend the program to four dense days.","Carraro, Ugo; Yablonka-Reuveni, Zipora",,603,24
369091,369091,369091,Correction to Lancet Respir Med 2020; published online Feb 21. https://doi.org/10.1016/S2213-2600(20)30079-5,22.839512,1.0593367,2020,,"Buxton, Sarah",Dental Nursing,603,4
370346,370346,370346,"Stranger Months: How SARS-CoV-2, Fear of Contagion, and Lockdown Measures Impacted Attendance and Clinical Activity During February and March 2020 at an Urban Emergency Department in Milan",22.559797,1.163742,2020,,"Kunz, Kurt M",N Engl J Med,603,3
372751,372751,372751,Modeling of COVID-19 Outbreak Indicators in China Between January and June,22.536268,1.1623255,2020,"Recent analysis of early COVID-19 data from China showed that the number of confirmed cases followed a subexponential power-law increase, with a growth exponent of around 2 2 (Maier and Brockmann, 2020) The power-law behavior was attributed to a combination of effective containment and mitigation measures employed as well as behavioral changes by the population In this work, we report a random walk Monte Carlo simulation study of proximity-based infection spread Control interventions such as lockdown measures and mobility restrictions are incorporated in the simulations through a single parameter, the size of each step in the random walk process The step size l is taken to be a multiple of 〈r〉, which is the average separation between individuals Three temporal growth regimes (quadratic, intermediate power-law and exponential) are shown to emerge naturally from our simulations For l=〈r〉, we get intermediate power-law growth exponents that are in general agreement with available data from China On the other hand, we obtain a quadratic growth for smaller step sizes l≲〈r〉∕2, while for large l the growth is found to be exponential We further performed a comparative case study of early fatality data (under varying levels of lockdown conditions) from three other countries, India, Brazil and South Africa We show that reasonable agreement with these data can be obtained by incorporating small-world-like connections in our simulations","Triambak, S.; Mahapatra, D. P.",Physica A: Statistical Mechanics and its Applications,603,22
376792,376792,376792,Establishing a 130-Bed Field Intensive Care Unit to Prepare for COVID-19 in 7 Days in Bahrain Military Hospital,22.565245,1.0904763,2020,"BACKGROUND: The COVID-19 outbreak has placed the National Health Service under significant strain. Social distancing measures were introduced in the UK in March 2020 and virtual consultations (via telephone or video call) were identified as a potential alternative to face-to-face consultations at this time. LOCAL PROBLEM: The Royal National Orthopaedic Hospital (RNOH) sees on average 11 200 face-to-face consultations a month. On average 7% of these are delivered virtually via telephone. In response to the COVID-19 crisis, the RNOH set a target of reducing face-to-face consultations to 20% of all outpatient attendances. This report outlines a quality improvement initiative to rapidly implement virtual consultations at the RNOH. METHODS: The COVID-19 Action Team, a multidisciplinary group of healthcare professionals, was assembled to support the implementation of virtual clinics. The Institute for Healthcare Improvement approach to quality improvement was followed using the Plan-Do-Study-Act (PDSA) cycle. A process of enablement, process redesign, delivery support and evaluation were carried out, underpinned by Improvement principles. RESULTS: Following the target of 80% virtual consultations being set, 87% of consultations were delivered virtually during the first 6 weeks. Satisfaction scores were high for virtual consultations (90/100 for patients and 78/100 for clinicians); however, outside of the COVID-19 pandemic, video consultations would be preferred less than 50% of the time. Information to support the future redesign of outpatient services was collected. CONCLUSIONS: This report demonstrates that virtual consultations can be rapidly implemented in response to COVID-19 and that they are largely acceptable. Further initiatives are required to support clinically appropriate and acceptable virtual consultations beyond COVID-19. REGISTRATION: This project was submitted to the RNOH's Project Evaluation Panel and was classified as a service evaluation on 12 March 2020 (ref: SE20.09).","Gilbert, Anthony William; Billany, Joe C T; Adam, Ruth; Martin, Luke; Tobin, Rebecca; Bagdai, Shiv; Galvin, Noreen; Farr, Ian; Allain, Adam; Davies, Lucy; Bateson, John",,603,1
380263,380263,380263,Establishing a Pre-COVID-19 Hospital Biopreparedness Initiative,22.628033,1.169408,2021,"We report a case of COVID-19 in a 29-week preterm infant. This child is the youngest reported case of SARS-CoV-2 infection in Malaysia, and to the best of our knowledge, one of the youngest documented cases of established vertical transmission of SARS-CoV-2 reported in literature. Our report highlights the clinical course, timelines of viral shedding by real-time reverse transcription-PCR and antibody seroconversion in a premature infant infected with SARS-CoV-2. In addition, we discuss the challenges faced in managing a preterm infant infected with SARS-CoV-2 and the knowledge gaps that need to be explored.","Ng, David Ce; Chin, Ling; Choo, Pauline Poh Ling; Paramasivam, Umathevi",BMJ case reports,603,1
384435,384435,384435,COVID-19: epidemiological situation of Argentina and its neighbor countries after three months of pandemic,22.519672,1.1571754,2021,[This corrects the article DOI: 10.1007/s10811-021-02372-9.].,"Petit, Léna; Vernès, Léa; Cadoret, Jean-Paul",J Appl Phycol,603,29
407846,407846,407846,Importance of Pharmacy Partnerships in Effective COVID-19 Vaccine Distribution,22.6056,1.1777108,2021,"The novel coronavirus disease (COVID-19) has been rapidly transmitted in China, Macau, Hong Kong, and other Asian and European counterparts. This COVID-19 epidemic has aroused increasing attention nationwide. Patients, health professionals, and the general public are under insurmountable psychological pressure which may lead to various psychological problems, such as anxiety, fear, depression, and insomnia. Psychological crisis intervention plays a pivotal role in the overall deployment of the disease control. The National Health Commission of China has summoned a call for emergency psychological crisis intervention and thus, various mental health associations and organizations have established expert teams to compile guidelines and public health educational articles/videos for mental health professionals and the general public alongside with online mental health services. In addition, mental health professionals and expert groups are stationed in designated isolation hospitals to provide on-site services. Experts have reached a consensus on the admission of patients with severe mental illness during the COVID-19 outbreak in mental health institutions. Nevertheless, the rapid transmission of the COVID-19 has emerged to mount a serious challenge to the mental health service in China.","Li, Wen; Yang, Yuan; Liu, Zi-Han; Zhao, Yan-Jie; Zhang, Qinge; Zhang, Ling; Cheung, Teris; Xiang, Yu-Tao",Int J Biol Sci,603,3
421292,421292,421292,COVID-19 and African Immigrants in North Africa: A Hidden Pandemic in a Vulnerable Setting,22.564838,1.0767573,2020,"The COVID-19 pandemic springs new challenges to medical personnel, scientists and policy makers every single day. Mask use is the singular policy that stood the test of time in containing the transmission of the disease. However, novel and unthought of side effects of continuous usage of masks for long durations are being reported. Here we report a case of pinna avulsion due to unique etiology-the facemask.","Gattani, Vijayshree Nahata; Gattani, Gaurav",J Maxillofac Oral Surg,603,20
422211,422211,422211,"A Malaysian Medical Non-Governmental Organization's (NGO) Experience in the Emergency Response for COVID-19, Using the Whole-of-Society Collaborative Concept",22.652517,1.2618035,2021,"The coronavirus disease 2019 caused by the severe acute respiratory syndrome coronavirus 2 (SARS-CoV-2) has become a pandemic with people infected in almost all countries. The most efficient solution to end this pandemic is a safe and efficient vaccine. Classic platforms are used to develop vaccines including live-attenuated vaccine, inactivated vaccine, protein subunit vaccine, and viral vector. Nucleic acid vaccine uses next-generation platforms for their development. Vaccines are now rushing to the market. Eleven candidates are in advance development. These comprise inactivated vaccines, viral vector vaccine, nucleic acid vaccine, and the protein subunit vaccine platform, which are now quite advanced in trials in various geographic and ethnic populations. The reported severe adverse effects raised the worries about their safety. It becomes critical to know whether these vaccines will cause neurologic disorders like previously recognized vaccine-related demyelinating diseases, fever-induced seizure, and other possible deficits. We reviewed the most promising COVID-2 vaccines with a particular interest in mechanism(s) and adverse effect(s). We exemplify potential neurological problems these vaccines could cause by looking at previous studies. The current evidence indicated a minor risk of the acute neurological disorders after the application. The observation of the long-time effect is still needed.","Lu, Lu; Xiong, Weixi; Mu, Jie; Zhang, Qi; Zhang, Hesheng; Zou, Ling; Li, Weimin; He, Li; Sander, Josemir W; Zhou, Dong",Acta neurol. scand,603,14
422432,422432,422432,Facing the SARS-CoV-2 Outbreak: What Should Obstetricians and Gynecologists Do?,22.618526,1.1813993,2020,"Urban mobility needs alternative sustainable travel modes to keep our pandemic cities in motion. Ride-pooling, where a single vehicle is shared by more than one traveller, is not only appealing for mobility platforms and their travellers, but also for promoting the sustainability of urban mobility systems. Yet, the potential of ride-pooling rides to serve as a safe and effective alternative given the personal and public health risks considerations associated with the COVID-19 pandemic is hitherto unknown. To answer this, we combine epidemiological and behavioural shareability models to examine spreading among ride-pooling travellers, with an application for Amsterdam. Findings are at first sight devastating, with only few initially infected travellers needed to spread the virus to hundreds of ride-pooling users. Without intervention, ride-pooling system may substantially contribute to virus spreading. Notwithstanding, we identify an effective control measure allowing to halt the spreading before the outbreaks (at 50 instead of 800 infections). Fixed matches among co-travellers disconnect the otherwise dense contact network, encapsulating the virus in small communities and preventing the outbreaks.","Kucharski, Rafal; Cats, Oded; Sienkiewicz, Julian",,603,20
439292,439292,439292,The Role of Emotionally Focused Therapy (EFT) in Coronavirus (COVID-19) Prevention,22.52164,1.0580597,2021,"A two-phase research study was conducted to inform the upcoming fourth edition of Nursing Professional Development: Scope and Standards of Practice. This column describes Phase 1, which used a virtual world café methodology to gather qualitative data from 32 nursing professional development experts. Eighteen themes emerged from the data supporting the six responsibilities of the nursing professional development practitioner. Researchers found the virtual world café to be a useful technique for eliciting expert opinions.","Maloney, Patsy; Harper, Mary G",J Nurses Prof Dev,603,1
