,index,Unnamed: 0,title_x,x,y,publish_time_x,abstract,authors,journal,category,cluster
611463,611463,611463,FRAÇÃO PLAQUETÁRIA IMATURA (IPF) COMO PARÂMETRO DE COAGULAÇÃO EM PACIENTES COM COVID-19: UM ESTUDO PROSPECTIVO,18.222635,-2.281147,2020-11-30,"SIMPLE SUMMARY: In this study, we found that phycoerythrin from Colaconema sp. can differentially stimulate the immune response of whiteleg shrimp in vitro and in vivo and could potentially be used as an immunomodulator in shrimp culture. ABSTRACT: We investigated whether phycoerythrin (PE), a pigment sourced from marine algae, could act as an immunomodulatory agent in whiteleg shrimp (Litopenaeus vannamei). To this end, PE was extracted and purified from a PE-rich macroalgae, Colaconema sp. Our in vitro analysis demonstrated that PE enhanced prophenoloxidase and phagocytosis activity but inhibited the production of reactive oxygen species in hemocytes. Additionally, the PE signal could be detected using an in vivo imaging system after its injection into the ventral sinus of the cephalothorax of whiteleg shrimp. The expression profiles of fourteen immune-related genes were monitored in hemocytes from whiteleg shrimp injected with 0.30 μg of PE per gram of body weight, and crustin, lysozyme, penaiedin 4, and anti-lipopolysaccharide factor showed up-regulated post-stimulation. The induction of immune genes and enhancement of innate immune parameters by PE may explain the higher survival rates for shrimp that received different doses of PE prior to being challenged with Vibrio parahaemolyticus or white spot syndrome virus compared to controls. Combined, these results show that PE from Colaconema sp. can differentially stimulate the immune response of whiteleg shrimp in vitro and in vivo and could potentially be used as an immunomodulator in shrimp culture.","Lee, Po-Tsang; Huang, Jing; Huang, Chin-Yi; Liu, Zi-Xuan; Yeh, Han-Yang; Huang, Huai-Ting; Chen, Li-Li; Nan, Fan-Hua; Lee, Meng-Chou",Animals (Basel),945,1
612365,612365,612365,IMPLICAÇÕES CLÍNICAS DA COVID-19 EM PACIENTES COM LLA: UMA REVISÃO DE LITERATURA,18.078157,-2.2291818,2020-11-30,"Serological testing is increasingly recognized as a useful tool for management of the COVID‐19 pandemic.(1) Cross‐sectional serosurveys provide information on exposure levels in a target population, which is helpful for designing public health strategies to blunt community transmission.(2) This article is protected by copyright. All rights reserved.","Valdivia, Arantxa; Torres, Ignacio; Huntley, Dixie; Alcaraz, María Jesús; Albert, Eliseo; Solano de la Asunción, Carlos; González, Carmelo; Ferrer, Josep; Navarro, David",J Med Virol,945,17
613866,613866,613866,Comment on: Disposable customized aerosol containment chamber for oral cancer biopsy: A novel technique during COVID‐19 pandemic,18.229137,5.3759537,2020-07-02,"The Covid-19 pandemic has had a deep impact on the lives of the entire world population, inducing a participated societal debate. As in other contexts, the debate has been the subject of several d/misinformation campaigns; in a quite unprecedented fashion, however, the presence of false information has seriously put at risk the public health. In this sense, detecting the presence of malicious narratives and identifying the kinds of users that are more prone to spread them represent the first step to limit the persistence of the former ones. In the present paper we analyse the semantic network observed on Twitter during the first Italian lockdown (induced by the hashtags contained in approximately 1.5 millions tweets published between the 23rd of March 2020 and the 23rd of April 2020) and study the extent to which various discursive communities are exposed to d/misinformation arguments. As observed in other studies, the recovered discursive communities largely overlap with traditional political parties, even if the debated topics concern different facets of the management of the pandemic. Although the themes directly related to d/misinformation are a minority of those discussed within our semantic networks, their popularity is unevenly distributed among the various discursive communities.","Mattei, Mattia; Caldarelli, Guido; Squartini, Tiziano; Saracco, Fabio",EPJ Data Sci,945,10
614789,614789,614789,DESCRIÇÃO DAS ALTERAÇÕES DO HEMOGRAMA CORRELACIONADOS À PROTEÍNA C REATIVA (PCR) E FERRITINA EM 7942 PACIENTES COM COVID-19,18.269123,-2.3516142,2020-11-30,"Abstract Background and Objective The SARS-CoV-2 pandemic has consistently changed medical practice throughout specialties, regardless of their contribution in facing the disease itself. We surveyed neurosurgeons worldwide to investigate the situation they are experiencing. Design and participants A 17-question, web-based survey was administered to neurosurgeons worldwide through the WFNS and the Neurosurgery Cocktail from March 28 to April 5, 2020 by web link or e-mail invitation. Questions were divided into three subgroups: general information, health system organization, and institutional plans for the SARS-CoV-2 outbreak. Collected data was initially elaborated using Survey Monkey® software. Country specific data were extracted from the WHO website. Statistical analysis was performed using R version 3.6.3. Results Of the 446 respondents, most were from Italy (20%), India (19%), and Pakistan (5%). Surgical activity was significantly reduced in most centers (79%) and dedicated in-hospital routes were created for SARS-CoV-2 patients (58%). Patient screening was performed only when there were symptoms (57%) and not routinely before surgery (18%). The preferred methods included a nasopharyngeal swab and chest x-ray. Health professionals were rarely screened (20%) and sometimes, even if SARS-CoV-2 positive, were asked to work if asymptomatic (26%). Surgical planning was changed in most institutions (92%), while indications were modified for non-urgent procedures (59%) and remained unchanged for subarachnoid hemorrhages (85%). Conclusions Most neurosurgeons worldwide reported work reorganization and practices that respond to current international guidelines. Differences in practice might be related to the perception of the pandemic and significant differences in the health systems. Sharing data and experiences will be of paramount importance to address the present moment and challenges in the near future.","Fontanella, Marco M.; De Maria, Lucio; Zanin, Luca; Saraceno, Giorgio; Terzi di Bergamo, Lodovico; Servadei, Franco; Chaurasia, Bipin; Olivi, Alessandro; Vajkoczy, Peter; Schaller, Karl; Cappabianca, Paolo; Doglietto, Francesco",World Neurosurg,945,16
618689,618689,618689,ANÁLISE DO IMPACTO DA COVID-19 NA GESTÃO HEMOTERÁPICA: EXPERIÊNCIA HEMOMINAS E SANTA CASA – JUIZ DE FORA,18.294779,-2.5351272,2020-11-30,"Human coronaviruses (HCoVs) are important pathogens that cause upper respiratory tract infections and have neuroinvasive abilities; however, little is known about the dynamic infection process of CoVs in vivo, and there are currently no specific antiviral drugs to prevent or treat HCoV infection. Here, we verified the replication ability and pathogenicity of a reporter HCoV-OC43 strain expressing Renilla luciferase (Rluc; rOC43-ns2DelRluc) in mice with different genetic backgrounds (C57BL/6 and BALB/c). Additionally, we monitored the spatial and temporal progression of HCoV-OC43 through the central nervous system (CNS) of live BALB/c mice after intranasal or intracerebral inoculation with rOC43-ns2DelRluc. We found that rOC43-ns2DelRluc was fatal to suckling mice after intranasal inoculation, and that viral titers and Rluc expression were detected in the brains and spinal cords of mice infected with rOC43-ns2DelRluc. Moreover, viral replication was initially observed in the brain by non-invasive bioluminescence imaging before the infection spread to the spinal cord of BALB/c mice, consistent with its tropism in the CNS. Furthermore, the Rluc readout correlated with the HCoV replication ability and protein expression, which allowed quantification of antiviral activity in live mice. Additionally, we validated that chloroquine strongly inhibited rOC43-ns2DelRluc replication in vivo. These results provide new insights into the temporal and spatial dissemination of HCoV-OC43 in the CNS, and our methods provide an extremely sensitive platform for evaluating the efficacy of antiviral therapies to treat neuroinvasive HCoVs in live mice.","Niu, Junwei; Shen, Liang; Huang, Baoying; Ye, Fei; Zhao, Li; Wang, Huijuan; Deng, Yao; Tan, Wenjie",Antiviral Res,945,0
620342,620342,620342,USO DO PLASMA CONVALESCENTE COMO MÉTODO DE TRATAMENTO DA DOENÇA DO CORONAVÍRUS 2019 (COVID-19),18.253183,-2.5110369,2020-11-30,"The WHO has described coronavirus disease 2019 (COVID-19) as a pandemic due to the speed and scale of its transmission. Without effective interventions, the rapidly increasing number of COVID-19 cases would greatly increase the burden of clinical treatments. Identifying the transmission sources and pathways is of vital importance to block transmission and allocate limited public health resources. According to the relationships among cases, we constructed disease transmission network graphs for the COVID-19 epidemic through a visualization technique based on individual reports of epidemiological data. We proposed an analysis strategy of the transmission network with the epidemiological data in Tianjin and Chengdu. The transmission networks showed different transmission characteristics. In Tianjin, an imported case of COVID-19 can produce an average of 2.9 secondary infections and ultimately produce as many as 4 generations of infections, with a maximum of 6 cases being generated before the imported case is identified. In Chengdu, 45 noninformative cases and 24 cases with vague exposure information made accurate information about the transmission network difficult to provide. The proposed analysis framework of visualized transmission networks can trace the transmission source and contacts, assess the current situation of transmission and prevention, and provide evidence for the global response and control of the COVID-19 pandemic.","Luo, Caiying; Ma, Yue; Jiang, Pei; Zhang, Tao; Yin, Fei",Sci Rep,945,3
621436,621436,621436,O DISTANCIAMENTO SOCIAL DURANTE A PANDEMIA DO COVID-19 E O CADASTRAMENTO DE DOADORES DE MEDULA OSSEA NO HEMOCENTRO RECIFE-PE,18.212185,-2.2376564,2020-11-30,"BACKGROUND: The mortality rate of Middle East Respiratory Syndrome Coronavirus (MERS-CoV) patients is a major challenge in all healthcare systems worldwide. Because the MERS-CoV risk-standardized mortality rates are currently unavailable in the literature, the author concentrated on developing a method to estimate the risk-standardized mortality rates using MERS-CoV 3- and 30-day mortality measures. METHODS: MERS-CoV data in Saudi Arabia is publicly reported and made available through the Saudi Ministry of Health (SMOH) website. The author studied 660 MERS-CoV patients who were reported by the SMOH between December 2, 2014 and November 12, 2016. The data gathered contained basic demographic information (age, gender, and nationality), healthcare worker, source of infection, pre-existing illness, symptomatic, severity of illness, and regions in Saudi Arabia. The status and date of mortality were also reported. Cox-proportional hazard (CPH) models were applied to estimate the hazard ratios for the predictors of 3- and 30-day mortality. RESULTS: 3-day, 30-day, and overall mortality were found to be 13.8%, 28.3%, and 29.8%, respectively. According to CPH, multivariate predictors of 3-day mortality were elderly, non-healthcare workers, illness severity, and hospital-acquired infections (adjusted hazard ratio (aHR) =1.7; 8.8; 6.5; and 2.8, respectively). Multivariate predictors of 30-day mortality were elderly, non-healthcare workers, pre-existing illness, severity of illness, and hospital-acquired infections (aHR =1.7; 19.2; 2.1; 3.7; and 2.9, respectively). CONCLUSIONS: Several factors were identified that could influence mortality outcomes at 3 days and 30 days, including age (elderly), non-healthcare workers, severity of illness, and hospital-acquired infections. The findings can serve as a guide for healthcare practitioners by appropriately identifying and managing potential patients at high risk of death.","Ahmed, Anwar E.",BMC Infect Dis,945,16
623909,623909,623909,COVID-19 E SUA RELAÇÃO COM O DESENVOLVIMENTO DA TROMBOSE,18.251192,-2.6520984,2020-11-30,"MOTIVATION Large-scale cancer genome projects have generated genomic, transcriptomic, epigenomic, and clinicopathological data from thousands of samples in almost every human tumor site. Although most omics data and their associated resources are publicly available, its full integration and interpretation to dissect the sources of gene expression modulation require specialized knowledge and software. RESULTS We present Multiomix, an interactive cloud-based platform that allows biologists to identify genetic and epigenetic events associated with the transcriptional modulation of cancer-related genes through the analysis of multi-omics data available on public functional genomic databases or user-uploaded datasets. Multiomix consists of an integrated set of functions, pipelines, and a graphical user interface that allows retrieval, aggregation, analysis and visualization of different omics data sources. After the user provides the data to be analyzed, Multiomix identifies all significant correlations between mRNAs and non-mRNA genomics features (e.g.: miRNA, DNA methylation and CNV) across the genome, the predicted sequence based interactions (e.g., miRNA-mRNA), and their associated prognostic values. AVAILABILITY Multiomix is available at https://www.multiomix.org The source code is freely available at https://github.com/omics-datascience/multiomix. SUPPLEMENTARY INFORMATION Supplementary data are available at Bioinformatics online.","Camele, Genaro; Menazzi, Sebastian; Chanfreau, Hernán; Marraco, Agustin; Hasperué, Waldo; Butti, Matias D; Abba, Martin C",Bioinformatics,945,1
625539,625539,625539,ANEMIA FALCIFORME COMO AGRAVO NOS CASOS DE COVID-19,18.182386,-2.5629447,2020-11-30,,"Schmid, Hanna; Heininger, Ulrich; Vuichard-Gysin, Danielle; Widmer, Andreas; Bielicki, Julia",Clin Microbiol Infect,945,3
626313,626313,626313,TRANSFUSÃO DE HEMOCOMPONENTES DE DOADORA POSITIVO PARA COVID-19 EM DUAS PACIENTES IMUNODEPRIMIDAS,17.996975,-2.3706627,2020-11-30,,"Akbarzadeh, Mohammad Amin; Hosseini, Mohammad-Salar",Radiother Oncol,945,3
627354,627354,627354,COVID-19 Universal Testing in Hemodialysis Facilities to Reduce Infection Risk,18.365194,6.863468,2020-11-17,"BACKGROUND: Human coronaviruses (HCoVs) are one of the most common causes of the “common cold”. Some HCoV strains, however, can cause fatal respiratory disease. Some examples of these diseases are severe acute respiratory syndrome (SARS), Middle East respiratory syndrome (MERS), and Coronavirus Disease 19 (COVID-19). This article will review the etiology, clinical features, diagnosis, and management of HCoVs. METHODS: A systematic literature review was performed using the terms “human coronaviruses”, “MERS-CoV”, “SARSCoV”, “SARS-CoV2”, “COVID-19”, and “common cold” in OVID MEDLINE, PubMed, and Cochrane Library. FINDINGS: Most HCoVs cause mild upper respiratory infections which resolve with supportive care and no sequelae. In recent decades, however, there have been outbreaks of novel HCoVs that cause more severe disease. This is largely due to HCoVs having large genomes which undergo frequent recombination events, leading to the emergence of novel and more virulent strains of the virus. These severe respiratory illnesses can lead to acute respiratory distress requiring invasive intervention, such as mechanical ventilation. These severe infections can lead to long-lasting sequelae in patients. Scientists continue to investigate potential treatments for these viruses, though supportive care remains the gold standard. Scientists have succeeded in developing numerous vaccines for the SARS-CoV-2 virus, and ongoing data collection and analysis will shed even more light on the next steps in fighting the COVID-19 pandemic. CONCLUSION: Due to the frequency of recombination events and the subsequent emergence of novel strains, HCoVs are becoming more prevalent, making them a global health concern as they can lead to epidemics and pandemics. Understanding the epidemiology, etiology, clinical features, diagnosis, and management of HCoVs is important, especially during this worldwide pandemic.","Coerdt, Kathleen M; Khachemoune, Amor",Afr Health Sci,945,1
627648,627648,627648,Guiding Principles for Cancer Surgery during the COVID-19 Pandemic,18.221443,6.3015647,2020-05-06,"Face masks are an important tool for preventing the spread of COVID-19. However, it is unclear how different types of masks affect speech recognition in different levels of background noise. To address this, we investigated the effects of four masks (a surgical mask, N95 respirator, and two cloth masks) on recognition of spoken sentences in multi-talker babble. In low levels of background noise, masks had little to no effect, with no more than a 5.5% decrease in mean accuracy compared to a no-mask condition. In high levels of noise, mean accuracy was 2.8-18.2% lower than the no-mask condition, but the surgical mask continued to show no significant difference. The results demonstrate that different types of masks generally yield similar accuracy in low levels of background noise, but differences between masks become more apparent in high levels of noise.","Toscano, Joseph C.; Toscano, Cheyenne M.",PLoS One,945,21
629141,629141,629141,PÚRPURA TROMBOCITOPÊNICA IMUNE SECUNDÁRIA À INFECÇÃO POR COVID-19,18.25854,-2.6360462,2020-11-30,"Contagious bovine pleuropneumonia (CBPP) remains a major cattle disease in Africa with serious socio-economic consequences. Its eradication requires the development of improved vaccines. Knowledge on this disease and its causing agent, Mycoplasma mycoides subsp. mycoides biotype Small Colony (MmmSC), has been progressing significantly in the last years, opening new areas for vaccine design. Advances were achieved in the understanding of the protective immune responses to MmmSC infection and immunopathological mechanisms allowing the pathogen to escape the host immune response. Based on sequencing and genomic studies, some virulence factors and metabolic pathways were unraveled leading to the identification of potential MmmSC vaccine candidates. Based on these findings, this review presents a scientific strategy to design multi-component sub-unit vaccines for mucosal delivery as the most promising approach for efficient long-term protective vaccines to prevent CBPP.","Dedieu-Engelmann, Laurence",Comp Immunol Microbiol Infect Dis,945,17
636915,636915,636915,SÍNDROME HEMOFAGOCÍTICA EM PACIENTE COM LMA RECIDIVADA E COVID-19: RELATO DE CASO,18.055496,-2.488495,2020-11-30,,"Sharma, Abhinav; Nicolau, Juan Luis",Ann Tour Res,945,20
638018,638018,638018,DESAFIOS DA DOAÇÃO DE SANGUE DURANTE A PANDEMIA NO BRASIL,18.061655,-2.3280294,2020-11-30,"Sentinel surveillance system plays a key role in screening and monitoring emerging and acute infectious diseases in order to identify the suspected cases in time. During SARS period in 2003, fever clinics emerged in many cities in mainland China with the purpose to screen the suspected SARS patients and to transfer the confirmed cases to designated hospitals for professional management. Shanghai city has reserved the fever clinics and the designated hospitals since then. Hence, clinicians in the front line are able to respond quickly to the emerging COVID-19 outbreak with their accumulated knowledge and experiences from the past. One hundred seventeen fever clinics distributed in various district areas in Shanghai have played a vital ‘sentinel’ role to fight against the COVID-19 epidemic. Most of suspected patients were identified in fever clinics and thereafter among these suspected patients the COVID-19 cases were confirmed and were isolated quickly to avoid the spread. We would like to share the sentinel roadmap for screening and diagnosis of COVID-19 to medical healthcare workers around the world, especially countries who are facing great challenges to cope with COVID-19 and meanwhile with limited medical resources. These sentinel surveillance strategies will certainly provide insight into the early detection and timely isolation of suspected cases from the others.","Lai, Rongtao; Chen, Erzhen; Gao, Weiyi; Cheng, Chengwei; Xie, Qing",Epidemiol Infect,945,21
640831,640831,640831,EVENTOS TROMBOEMBÓLICOS EM PACIENTES COM COVID-19: REVISÃO SISTEMÁTICA,18.316244,-2.116852,2020-11-30,"The drug development process for Coronavirus disease (COVID-19) is the research process to create a preventive vaccine or therapeutic prescription drug to relieve the severity of 2019–2020 (COVID-19). In different stages of preclinical or clinical research, several hundred special scientific research centers, research organizations, and health agencies have developed and tried enormous numbers of vaccine candidates and new drugs for COVID-19 disease. In order to identify new therapies against COVID-19, several clinical trials have been in progress worldwide.","Zahraa Talib Khudhair; Shihab, Mehdi Salih; Hamah-Ameen, Baram",Russ J Bioorg Chem,945,1
650982,650982,650982,COVID-19 E SÍNDROME INFLAMATÓRIA MULTISSISTÊMICA SEMELHANTE À DOENÇA DE KAWASAKI: REVISÃO SISTEMÁTICA,18.248165,-2.5607185,2020-11-30,"Critically ill COVID-19 patients have higher pro-inflammatory (IL-1, IL-2, IL-6, tumor necrosis alpha) and anti-inflammatory (IL-4, IL-10) cytokine levels, less CD4 interferon-gamma expression, and fewer CD4 and CD8 cells. This severe clinical situation increases the risk of serious fungal infections, such as invasive pulmonary aspergillosis, invasive candidiasis or Pneumocystis jirovecii pneumonia. However, few studies have investigated fungal coinfections in this population. We describe an update on published reports on fungal coinfections and our personal experience in three Spanish hospitals. We can conclude that despite the serious disease caused by SARS-CoV-2 in many patients, the scarcity of invasive mycoses is probably due to the few bronchoscopies and necropsies performed in these patients because of the high risk in aerosol generation. However, the presence of fungal markers in clinically relevant specimens, with the exception of bronchopulmonary colonization by Candida, should make it advisable to early implement antifungal therapy.","Pemán, Javier; Ruiz-Gaitán, Alba; García-Vidal, Carolina; Salavert, Miguel; Ramírez, Paula; Puchades, Francesc; García-Hita, Marta; Alastruey-Izquierdo, Ana; Quindós, Guillermo",Rev Iberoam Micol,945,22
651809,651809,651809,USO DO ATIVADOR DE PLASMINOGÊNIO TECIDUAL NO TRATAMENTO DA SÍNDROME DO DESCONFORTO RESPIRATÓRIO AGUDO NA COVID-19: REVISÃO SISTEMÁTICA,18.268677,-2.4569025,2020-11-30,"BACKGROUND: Lateral extra-articular tenodesis (LET) has been used to augment primary anterior cruciate ligament (ACL) reconstruction to reduce the risk of reinjury. Most LET procedures result in a construct that is fixed to both the femur and the tibia. In a modified Ellison procedure, the construct is only fixed distally, reducing the risk of inadvertently overconstraining the lateral compartment. PURPOSE: To evaluate the use of the modified Ellison procedure in a cohort of patients deemed to be at a high risk of further ACL injury after primary ACL reconstruction. STUDY DESIGN: Case series; Level of evidence, 4. METHODS: Included were 25 consecutive patients with at least 2 of the following risk factors: age <20 years at the time of surgery, previous contralateral ACL reconstruction, positive family history of ACL rupture (parent or sibling), generalized ligamentous laxity (Beighton ≥4), grade 3 pivot shift in the consulting room, a desire to return to a pivoting sport, and an elite or professional status. All patients underwent primary ACL reconstruction with an additional modified Ellison procedure. Postoperatively, patients completed the IKDC subjective knee evaluation form (International Knee Documentation Committee), KOOS Quality of Life subscale (Knee injury and Osteoarthritis Outcome Score), ACL–Return to Sport After Injury Scale, Marx Activity Rating Scale, and SANE score (Single Assessment Numeric Evaluation). RESULTS: At 12-month follow-up, the mean outcome scores were as follows: SANE, 94/100; IKDC, 92/100; Marx, 13/16; ACL–Return to Sport, 85/100; and KOOS, 77/100. At 24 months, return-to-sport data were available for 23 of 25 patients; 17 (74%) were playing at the same level or higher than preinjury and 2 at a lower level. One patient (4%) sustained a contact mechanism graft rupture at 12 months. There were 2 (9%) contralateral ACL injuries, including 1 ACL graft rupture, at 11 and 22 months postoperatively. There was a further contralateral ACL graft rupture at 26 months. CONCLUSION: The use of the modified Ellison procedure as a LET augmentation of a primary ACL reconstruction to produce a low graft rupture rate appeared to be safe in a cohort considered to be at a high risk of reinjury. The procedure showed promise in terms of reducing further graft injuries.","Feller, Julian A.; Devitt, Brian M.; Webster, Kate E.; Klemm, Haydn J.",Orthop J Sports Med,945,33
656911,656911,656911,ERITROBLASTOSE E LEUCOCITOSE SÃO PREDITORES DE MORTALIDADE NA COVID-19 EM PACIENTES INTERNADOS,18.27009,-2.5802352,2020-11-30,,"Castro, Arachu",Lancet,945,29
658563,658563,658563,IMPACTO DA PANDEMIA DO COVID-19 NO MANEJO DE DOENÇAS LINFOPROLIFERATIVAS,18.14403,-2.4232793,2020-11-30,,"Chehrehgosha, M.",J Nutr Health Aging,945,26
