,title_x,publish_time_x,abstract,authors,journal,url,category
44268,Azithromycin/hydroxychloroquine: QT prolongation and ventricular extrasystole secondary to off label use: case report,2021-01-02,"BACKGROUND: Hospital-acquired pneumonia (HAP) and ventilator-associated pneumonia (VAP) can be serious complications of coronavirus disease 19 (COVID-19). Co-infections may worsen outcomes and prolong hospitalization. This risk may be exacerbated by systemic corticosteroids (steroids) and other adjunctive therapies. METHODS: We reviewed the records of all adults admitted to Stony Brook University Hospital, NY, from 3/1 to 4/15, 2020 with severe COVID-19 pneumonia, requiring high-ﬂow O2 (non-rebreather mask, Venturi mask with FiO2 >50%, or high-ﬂow nasal cannula). We excluded patients who received mechanical ventilation (MV) or died within 24h. Patients were followed until death or hospital discharge. We reviewed positive sputum cultures (PSC) for pathogenic microorganisms and calculated the incidence of HAP and VAP (nosocomial pneumonia, [NP]), rates of MV and impact on mortality. Fungi isolated from sputum, were considered colonization unless associated with fungemia. We also examined the impact of adjunctive therapies with immunosuppressive potential (steroids and tocilizumab), on HAP or VAP. RESULTS: A total of 469 patients were included (Table 1). Of these, 199 (42.4%) required intensive care and 172 (36.7%) MV. Median length of stay was 13 days (8–22) and 105 (22.4%) had PSC. Of these, 59 were considered true pathogens (HAP: 11, VAP: 48), with predominance of S. aureus (MSSA) 38.9%, Enterobacteriaceae 33.8% and Pseudomonas species 18.6%. 39 isolates were considered colonization (Table 2); Patients with PSC < 48h (N=7) from admission, were not considered NP. The incidence of NP was 7.0 per 1000 patient-days (95%CI 5.5–8.5). Of 11 patients with HAP, 9 needed MV. NP was more frequent among patients receiving steroids (9.0 vs 5.7 per 1000 patient-days; P=0.023). Use of tocilizumab was not associated with NP (6.2 vs 8.4 per 1000 patient-days; P=0.11). Mortality was nonsignificantly higher in patients with (20/59, 33.9%) vs. without (103/410, 25.1%) NP (P=0.16). Intubation and length of stay were the strongest predictors of NP in multivariable models. Cohort Characteristics of Patients with Severe COVID -19 Pneumonia on High Flow Oxygen (N= 469) [Image: see text] All Microbes Isolated from Sputum Cultures [Image: see text] CONCLUSION: Among high risk COVID-19 patients, NP is a common complication. MSSA and Enterobacteriaceae were the most frequent isolates. The risk increases with intubation, longer hospital stay and use of steroids but not tocilizumab. DISCLOSURES: All Authors: No reported disclosures","Papamanoli, Aikaterini; Nakamura, Jacquelyn; Fung, Jenny; Abata, Joshua; Karkala, Nikitha; Tsui, Stella T; Yoo, Jeanwoo; Grewal, Prabhjot; Mojahedi, Azad; Dhaliwal, Simrat; Jacob, Robin; Hotelling, Jessica; Rawal, Sahil; Coritsidis, Alexandra; Psevdos, George; Kalogeropoulos, Andreas; Marcos, Luis",Open Forum Infect Dis,https://www.ncbi.nlm.nih.gov/pmc/articles/PMC7777912/,519
44383,Azithromycin/hydroxychloroquine: Torsades de pointes following off-label use: case report,2021-01-09,"BACKGROUND: We evaluated the characteristics and outcomes of culture-negative versus culture-positive septic shock. METHODS: We performed a retrospective observational study of data from a prospective registry from 2014 to 2018. A total of 2,499 adult patients with septic shock were enrolled. The primary outcome was 90-day mortality, and the secondary outcomes were the length of hospital stay, a requirement for mechanical ventilation or renal replacement therapy, and in-hospital mortality. RESULTS: Of 1,718 patients with septic shock, 1,012 (58.9%) patients were culture-positive (blood 803, urine 302, sputum 102, others 204) and the median pathogen detection time was 9.5 h (aerobic 10.2 h and anaerobic 9.0 h). The most common site of culture-positive infection was the hepatobiliary tract (39.5%), while for the culture-negative it was the lower respiratory tract (38.2%). The culture-negative group had a lower mean body temperature (37.3 vs 37.7 ℃), lactate (2.5 vs. 3.2 mmol/L), C-reactive protein (11.1 vs 11.9 mg/dL), and sequential organ failure assessment score (7.0 vs. 8.0) than that of the culture-positive group. However, 90-day mortality between the groups was not significantly different (32.7 vs 32.2%, p = 0.83), and the other clinical outcomes also did not differ significantly. Moreover, a shorter culture detection time was correlated with a higher sequential organ failure assessment score but not with mortality. CONCLUSION: Patients with septic shock are frequently culture-negative, especially in cases where the infection focus is in the lower respiratory tract. Although culture-negative was associated with a degree of organ dysfunction, it was not an independent predictor of death.","Kim, June-sung; Kim, Youn-Jung; Kim, Won Young",Crit Care,https://www.ncbi.nlm.nih.gov/pmc/articles/PMC7787242/,519
44394,Lopinavir/ritonavir: Hepatic cytolysis following off-label use: case report,2021-01-09,,,Reactions Weekly,https://www.ncbi.nlm.nih.gov/pmc/articles/PMC7787580/,519
44778,Multiple drugs: Flame-shaped haemorrhage and off-label use: case report,2021-01-16,"North African nations, especially Egypt, Algeria, and Morocco, have been heavily affected by COVID-19 if compared to other African countries. Governments in North Africa took proactive legal measures to manage the virus threat, safeguarding population health, but also triggering repressive and invasive mechanisms that in some cases jeopardized basic freedoms and rights. This work will analyze comparatively the anti-COVID-19 legislations, pointing out how the legislative measures mirrored the level of transition of democracy, the opacity of some regimes, exploitation of the pandemic to foster repressive control, and highlighting the weakness of new democratic institutions unprepared to balance health security and democracy.","Tamburini, Francesco",J Asian Afr Stud,https://www.ncbi.nlm.nih.gov/pmc/articles/PMC7809067/,519
45957,Lopinavir/ritonavir: Cardiotoxicities following off-label use: 4 case reports,2021-02-20,"In the last few decades, we have seen a steady rise in Hindu nationalism in India, culminating in a Hindu nationalist government in 2014. The BJP won again and expanded its majority in 2019. Then COVID‐19 hit! This essay explores the national and body politic in India during COVID‐19. It argues that Hindu nationalism has been mobilized and strengthened during the pandemic.","Subramaniam, Banu",,https://www.ncbi.nlm.nih.gov/pmc/articles/PMC7883251/,519
45960,Lopinavir/ritonavir/rocuronium bromide interaction: Myopathy following off-label use: case report,2021-02-20,"BACKGROUND: Promoting live interviews with health workers from all Brazilian regions to address the increased challenges of dementia, quarantine, COVID‐19 and the local specificities of the crisis. The project aims to reach those sheltered in place with positive key content to face misinformation, fear and increasing fake news. METHOD: Informal ""chat"" style targeting audiences with different levels of knowledge. Brazil is a continental country with more than 200 million inhabitants, different cultures, demographic factors and several inequalities. Each live sessions have a central topic (e.g. ""Self‐care in quarantine times The one‐hour live sessions have a central topic (e.g. ""Self‐care in quarantine times"") discussed with a professional from that location. The recording is after available in the interviewer's instagram feed with 16,000 followers. The professionals are geriatricians, psychiatrists, psychologists and neurologists, all associated with large institutions such as the Brazilian Alzheimer's Association or the Brazilian Geriatrics and Gerontology society. RESULT: The virtual interviews (6 to date) had significant engagement, excellent numbers of attendees during the live session (between 200 and 600 people), queries and comments posted (more than 100 interactions in each session), and views in the subsequent 48‐hour period (between 1,100 and 1,600). CONCLUSION: The project is cost‐effective, being a collaboration between interviewer and interviewee without any fee, accessible due to the approach chosen, wide‐ranging in knowledge levels, and dynamic due to the interaction with the public. The project also avoid social isolation of those in quarantine, turning into physical distancing.","Peres, Fernando Aguzzoli",Alzheimers Dement,https://www.ncbi.nlm.nih.gov/pmc/articles/PMC7883266/,519
46126,Dexamethasone: Adrenal insufficiency following off-label use: case report,2021-02-27,"Clinically, fractional flow reserve (FFR)-guided coronary artery bypass grafting (CABG) is more effective than CABG guided by coronary angiography alone. However, no scholars have explained the mechanism from the perspective of hemodynamics. Two patients were clinically selected; their angiography showed 70% coronary stenosis, and the FFRs were 0.7 (patient 1) and 0.95 (patient 2). The FFR non-invasive computational model of the two patients was constructed by a 0–3D coupled multiscaled model, in order to verify that the model can accurately calculate the FFR results. Virtual bypass surgery was performed on these two stenoses, and a CABG multiscaled model was constructed. The flow rate of the graft and the stenosis coronary artery, as well as the wall shear stress (WSS) and the oscillatory shear index (OSI) in the graft were calculated. The non-invasive calculation results of FFR are 0.67 and 0.91, which are close to the clinical results, which proves that our model is accurate. According to the CABG model, the flow ratios of the stenosis coronary artery to the graft of patient 1 and patient 2 were 0.12 and 0.42, respectively. The time-average wall shear stress (TAWSS) results of patient 1 and patient 2 grafts were 2.09 and 2.16 Pa, respectively, and WSS showed uniform distribution on the grafts. The OSI results of patients 1 and 2 grafts were 0.0375 and 0.1264, respectively, and a significantly high OSI region appeared at the anastomosis of patient 2. The FFR value of the stenosis should be considered when performing bypass surgery. When the stenosis of high FFR values is grafted, a high OSI region is created at the graft, especially at the anastomosis. In the long term, this can cause anastomotic blockage and graft failure.","Li, Bao; Mao, Boyan; Feng, Yue; Liu, Jincheng; Zhao, Zhou; Duan, Mengyao; Liu, Youjun",Front Physiol,https://www.ncbi.nlm.nih.gov/pmc/articles/PMC7892768/,519
46432,Hydrocortisone/tocilizumab: Cytomegalovirus haemorrhagic enterocolitis and off-label use: case report,2021-03-06,,"Lindert, Jutta; Tüscher, Oliver",Front Psychiatry,https://www.ncbi.nlm.nih.gov/pmc/articles/PMC7925612/,519
46866,"Ciclesonide/favipiravir/lopinavir/ritonavir: Off-label use, pancytopenia and liver dysfunction: case report",2021-03-13,,"Schäffer, Utz; Weber, Jürgen",Control Manag Rev,https://www.ncbi.nlm.nih.gov/pmc/articles/PMC7941383/,519
48458,Hydroxychloroquine: Elevated aminotransferase levels following off-label use: case report,2021-03-20,"In today’s electronic society, security of information is an issue of major concern especially in the communication domain. Indeed, there is a very serious need for schemes that guarantee security of information exchanged between entities, over public networks. Several techniques such as cryptography and/or steganography have been proposed in existing literature. Audio steganography has certain advantages over conventional steganography. Existing audio steganography systems suffer from limitations that includes, their inability to embed information in multiple audio file formats, high distortion rate and low level of robustness of their resultant stego-files. To overcome these limitations, this current research focused on the development of an efficient and robust audio steganography system for the security of information whether in store or on transit across the Internet. This is achieved by first encrypting a given secret information, compressing the resultant cipher-text, then embedding the compressed file in a suitable cover (audio file) using frequency hopping spread spectrum technique, to yield as output, an audio stego file which is not distinguishable from the original audio cover file. To allow for the embedding of the secret compressed file, the selected audio cover file is first broken into frames using one dimensional Discrete Cosine Transform (DCT). Results of performance evaluation of this developed system shows that it has very low level of distortion as revealed by the Signal to Noise Ratio (SNR). The compression ratio obtained is also equal to one (1), which shows that the cover audio file is identical to the resultant stego-file.","Adeboje, Olawale Timothy; Gabriel, Arome Junior; Adetunmbi, Adebayo Olusola",Computational Science and Its Applications - ICCSA 2020,https://www.ncbi.nlm.nih.gov/pmc/articles/PMC7974983/,519
51245,Dexamethasone: An atypical presentation of adrenal insufficiency during off-label use: case report,2021-04-03,"By the time this article is published and read, vaccines and therapeutic remedies should have become available to alleviate the worst of the pandemic. But while scientists have been successful in finding a cure for this virus, there is no vaccination for the economic, political, and societal upheaval caused by COVID‐19.","Dennis, Marguerite J.",,https://www.ncbi.nlm.nih.gov/pmc/articles/PMC8013286/,519
51254,Methylprednisolone/tocilizumab: Intestinal perforation following off-label use: case report,2021-04-03,"When college and university campuses closed in spring 2020 due to the COVID‐19 pandemic, the amount of alcohol consumed by underage students decreased according to a new report in the Journal of Studies on Alcohol and Drugs. The report speculates that the decrease in underage drinking may be due to students moving back in with their parents, compared to the relative freedom for unsupervised activities when living on a college campus.","Sutton, Halley",,https://www.ncbi.nlm.nih.gov/pmc/articles/PMC8013418/,519
51399,"Aspirin/favipiravir: Haemolytic anaemia, decrease in his lymphocyte count and off-label use: case report",2021-04-10,,,Reactions Weekly,https://www.ncbi.nlm.nih.gov/pmc/articles/PMC8017086/,519
51626,"Azithromycin/hydroxychloroquine: Torsade de pointes, premature atrial contraction and right bundle branch block following off-label use: 4 case reports",2021-04-17,,"Chunhong, Yang",Front Psychol,https://www.ncbi.nlm.nih.gov/pmc/articles/PMC8042202/,519
53411,"Dexamethasone/favipiravir/metoclopramide: Sinus bradycardia, deranged liver enzymes and off-label use: case report",2021-05-22,"BACKGROUND: The outbreak of the COVID-19 has had global impact on elective and emergency surgical care. So far, we possess few data to understand the effect of the CoViD-19 on emergency surgery. AIM: To compare the total number of patients who were referred, admitted, and had an emergency operation under General Surgery (GS) between March and May 2020, to the same period between 2016-19. METHOD: Retrospective analysis of prospectively collected local data from surgical take lists and operative data obtained from the hospital’s Business Intelligence Team. RESULTS: A 22.4% reduction was seen in the referrals per day 15.18+/-2.45 vs. 11.77 +/- 4.54 (2016-9 vs. 2020, mean+/-SD) and a 36% reduction in admissions per day 7.40 +/-1.07 vs. 4.69+/- 2.03 (2016-9 vs. 2020, mean+/-SD). A 55% reduction in the total number of emergency operations during the CoViD-19 outbreak was observed 87 (total, 2020) vs. 194+/-35.96 (mean+/-SD, 2016-19). CONCLUSIONS: CoViD-19 had a significant impact on the number of patients presenting to GS. Interestingly, an even greater reduction in operative treatment was also observed. This may reflect reduction in theatre availability or use of a higher threshold for conservative treatment.","Chatzikonstantinou, M; David, M; Pouncey, A; Aljarad, F; Sorelli, P",Br J Surg,https://www.ncbi.nlm.nih.gov/pmc/articles/PMC8135811/,519
53652,Antivirals/interferon-α-1b: Elevated aminotransferases and vomiting following off-label use: case report,2021-05-29,,"Stute, Petra",J,https://www.ncbi.nlm.nih.gov/pmc/articles/PMC8147587/,519
53821,Multiple drugs: Pleomorphicskin eruptions following off-label use: case report,2021-06-05,"With the introduction of the Internet to the mainstream like e-commerce, online banking, health system and other day-to-day essentials, risk of being exposed to various are increasing exponentially. Zero-day attack(s) targeting unknown vulnerabilities of a software or system opens up further research direction in the field of cyber-attacks. Existing approaches either uses ML/DNN or anomaly-based approach to protect against these attacks. Detecting zero-day attacks through these techniques miss several parameters like frequency of particular byte streams in network traffic and their correlation. Covering attacks that produce lower traffic is difficult through neural network models because it requires higher traffic for correct prediction. This paper proposes a novel robust and intelligent cyber-attack detection model to cover the issues mentioned above using the concept of heavy-hitter and graph technique to detect zero-day attacks. The proposed work consists of two phases (a) Signature generation and (b) Evaluation phase. This model evaluates the performance using generated signatures at the training phase. The result analysis of the proposed zero-day attack detection shows higher performance for accuracy of 91.33% for the binary classification and accuracy of 90.35% for multi-class classification on real-time attack data. The performance against benchmark data set CICIDS18 shows a promising result of 91.62% for binary-class classification on this model. Thus, the proposed approach shows an encouraging result to detect zero-day attacks.","Kumar, Vikash; Sinha, Ditipriya",Complex Intell,https://www.ncbi.nlm.nih.gov/pmc/articles/PMC8160422/,519
53826,Hydroxychloroquine: Lack of efficacy following an off-label use: case report,2021-06-05,"Bioelectrical impedance vector analysis (BIVA) is a method used to estimate variation in body hydration. We assessed the potential of BIVA for monitoring daily body hydration fluctuations in nine healthy, normally active males under matching normoxic (NX) and hypobaric hypoxic (HH) experimental conditions. Furthermore, we aimed to investigate whether changes in BIVA may correspond with the development of acute mountain sickness (AMS). Subjects were exposed in a hypobaric chamber to both NX (corresponding to an altitude of 262 m) and HH conditions corresponding to an altitude of 3500 m during two four-day sojourns within which food, water intake and physical activity were controlled. Bioimpedance and body weight measurements were performed three times a day and medical symptoms were assessed every morning using the Lake Louise score (LLS). Total body water (TBW) was also assessed on the last day of both sojourns using the deuterium dilution technique. We detected circadian changes in vector length, indicating circadian body water variations that did not differ between NX and HH conditions (ANOVA effects: time: p = 0.018, eta(2) = 0.149; interaction: p = 0.214, eta(2) = 0.083; condition: p = 0.920, eta(2) = 0.001). Even though none of the subjects developed AMS, four subjects showed clinical symptoms according to the LLS during the first 24 hours of HH conditions. These subjects showed a pronounced (Cohen’s d: 1.09), yet not statistically significant (p = 0.206) decrease in phase angle 6 hours after exposure, which may indicate fluid shift from the intracellular to the extracellular compartment. At the end of each sojourn, vector length correlated with deuterium dilution TBW “gold standard” measurements (linear regression: NX: p = 0.002 and r(2) = 0.756, HH: p < 0.001 and r(2) = 0.84). BIVA can be considered a valuable method for monitoring body hydration changes at altitude. Whether such changes are related to the development of clinical symptoms associated with AMS, as indicated in the present investigation, must be confirmed in future studies.","Regli, Ivo B.; Turner, Rachel; Woyke, Simon; Rauch, Simon; Brugger, Hermann; Gatterer, Hannes",Int J Environ Res Public Health,https://www.ncbi.nlm.nih.gov/pmc/articles/PMC8161038/,519
54964,Multiple drugs: No response and off-label use: case report,2021-06-26,,"Backhaus, Richard",MTZ Worldw,https://www.ncbi.nlm.nih.gov/pmc/articles/PMC8225395/,519
55498,"Multiple drugs: Latent tuberculosis (TB) reactivation, lack of efficacy and off-label use: case report",2021-07-03,"The world tried to control the spread of coronavirus disease 2019 (COVID‐19) at national and regional levels through various mitigation strategies. In the first wave of infections, the most extreme strategies included large‐scale national and regional lockdowns or stay‐at‐home orders. One major side effect of large‐scale lockdowns was the shuttering of the economy, leading to massive layoffs, loss of income, and livelihood. Lockdowns were justified in part by scientific models (computer forecast and simulations) that assumed exponential growth in infections and predicted millions of fatalities without these ‘non‐pharmaceutical interventions’ (NPI). Some scientists questioned these assumptions. Regions that followed other softer mitigation strategies such as work from home, crowd limits, use of masks, individual quarantining, basic social distancing, testing, and tracing – at least in the first wave of infections – saw similar health outcomes. Clear results were confusing, complicated, and difficult to assess. Ultimately, in the USA, what kind of mitigation strategy was enforced became a political decision only partly based on scientific models. We do not test for what levels of NPI are necessary for appropriate management of the first wave of the pandemic. Rather we use the ‘inverse‐fitting Gompertz function’ methodology suggested by anti‐lockdown advocate and Nobel Laureate Dr. Levitts to estimate the rate of growth/decline in COVID‐19 infections as well to determine when disease peaking occurred. Our estimates may help predict levels of first‐wave infections in the future and help a region to monitor new outbreaks prior to opening its economy. The inverse fitting function is applied to the first wave of infections in the USA and in the hard‐hit New York and New Jersey regions for the time period March to June 2020. This is the earliest days of pandemic in the USA. The estimates for the rates of growth/decline are computed and used to predict underlying future infections, so that decision makers can monitor the disease threat as they open their economies. This preliminary and exploratory analysis and findings are discussed briefly and presented primarily in charts and tables, but the following waves of disease diffusion are not included and certainly were not anticipated.","Haynes, Kingsley E.; Kulkarni, Rajendra",,https://www.ncbi.nlm.nih.gov/pmc/articles/PMC8250709/,519
55705,Ceftriaxone/hydroxychloroquine/lopinavir: Lack of efficacy in off-label use: case report,2021-07-10,"Clinical trials are crucial for the advancement of treatment and knowledge within the medical community. Although the ClinicalTrials.gov initiative has resulted in a rich source of information for clinical trial research, only a handful of analytic studies have been carried out to understand this valuable data source. Analysis of this database provides insight for emerging trends of clinical research. In this study, we propose to use network analysis to understand infectious disease clinical trial research. Our goal is to understand two important issues related to the clinical trials: (1) the concentrations and characteristics of infectious disease clinical trial research, and (2) recommendation of clinical trials to a sponsor (or an investigator). The first issue helps summarize clinical trial research related to a particular disease(s), and the second issue helps match clinical trial sponsors and investigators for information recommendation. By using 4228 clinical trials as the test bed, our study investigates 4864 sponsors and 1879 research areas characterized by Medical Subject Heading (MeSH) keywords. We use a network to characterize infectious disease clinical trials, and design a new community-topic-based link prediction approach to predict sponsors’ interests. Our design relies on network modeling of both clinical trial sponsors and keywords. For sponsors, we extract communities with each community consisting of sponsors with coherent interests. For keywords, we extract topics with each topic containing semantic consistent keywords. The communities and topics are combined for accurate clinical trial recommendation. This transformative study concludes that using network analysis can tremendously help the understanding of clinical trial research for effective summarization, characterization, and prediction.","Elkin, Magdalyn E.; Zhu, Xingquan",Netw Model Anal Health Inform Bioinform,https://www.ncbi.nlm.nih.gov/pmc/articles/PMC8262767/,519
55999,Tocilizumab: Anaphylaxis following off-label use: case report,2021-07-24,,,Reactions Weekly,https://www.ncbi.nlm.nih.gov/pmc/articles/PMC8285688/,519
