,index,Unnamed: 0,title_x,x,y,publish_time_x,abstract,authors,journal,category,cluster
272110,272110,272110,Multi-observer concordance and accuracy of the British Thoracic Society scale and other visual assessment qualitative criteria for solid pulmonary nodule assessment using FDG PET-CT,18.677025,0.41488189,2020,"BACKGROUND: British Columbia, like many jurisdictions, has a health information telephone service (8-1-1) to provide callers with information by registered nurses and help them decide whether to attend an emergency department or primary care clinic, or manage their concern at home. We describe a new service, HealthLink BC Emergency iDoctor-in-assistance (HEiDi), that partnered physicians available by videoconferencing with 8-1-1 registered nurses to support callers. METHODS: From Apr. 6 to Aug. 2, 2020, all callers to the 8-1-1 telephone service (available to anyone in BC) categorized as ""seek care within 24 hours"" by registered nurses were eligible for referral to HEiDi. HEiDi physicians (""virtual physicians"") connected directly with callers via desktop videoconferencing software, assessed their health complaint, provided advice and suggested care disposition. We conducted a descriptive study and collected demographic characteristics, health concern and disposition determined by the virtual physician. RESULTS: HEiDi virtual physicians provided 7687 consultations. Most patients (n = 4439, 57.8%) were in the 20-64 age range, and 4814 (62.9%) were female. Common health concerns were related to gastroenterology (n = 1275, 16.6%), respiratory (n = 877, 11.4%) and dermatology (n = 874, 11.4%). From the 7531 calls with available data, 2548 (33.8%) callers were advised to attempt home treatment, 2885 (38.3%) to contact a primary care physician within 1 week, 1131 (15.0%) to attend an emergency department immediately and 538 (7.1%) to attend their primary provider now. INTERPRETATION: We found that virtual physicians were able to advise nearly 3 out of 4 (72.1%) patients away from in-person emergency or clinic assessment and 1 in 7 (15.0%) to seek immediate emergency department care. Virtual physicians can provide an effective complement to a provincial health telephone system.","Ho, Kendall; Lauscher, Helen Novak; Stewart, Kurtis; Abu-Laban, Riyad B; Scheuermeyer, Frank; Grafstein, Eric; Christenson, Jim; Sundhu, Sandra",CMAJ Open,378,19
272782,272782,272782,Domestic abuse in the time of coronavirus,18.779451,0.33117354,2020,"A lack of service delivery and accountability are two characteristic challenges of numerous municipalities (local government) in South Africa. MobiSAM was introduced as a collaborative effort between a local university, civil society, residents, and local government to grow digital citizen engagement, facilitate two-way communication between local government and its citizenry, and contribute to the improved provision of basic services. Through the course of the project, it became clear that power, with respect to knowledge, was at play in the interactions or lack thereof between local government and citizens. This work-in-progress paper begins the journey of exploration of the power/knowledge dynamics at play in the MobiSAM project (using the SECI model and the Power Cube) by unpacking and understanding the nature of knowledge processed in the project and the associated knowledge creation processes that ensued between the different project stakeholders over time. The influence of power in determining the effective transfer of knowledge between key stakeholders of the project, for capacity building and organisational learning has emerged as an important issue in need of thorough investigation and critical analysis. This work in progress paper presents the preliminary framing of the research findings on the phases associated with the interplay of knowledge and power in the MobiSAM project, which are: 1) Realisation, 2) Navigating Responsiveness, and 3) Emergence.","Khene, Caroline; Sieborger, Ingrid; Thinyane, Mamello; Simuja, Clement",,378,16
273895,273895,273895,Clinical and epidemiological characterization of patients with covid-19,18.291065,0.33121634,2021,"BACKGROUND AND AIMS: Quick and reliable diagnostic tools play an important role in controlling the spread of the SARS-Cov-2 pandemic. The aim of this study was to evaluate the diagnostic accuracy of a new cyto-salivary antigen test aimed at detecting the presence of antigens for SARS-CoV-2, as compared by the gold standard RT-PCR and a lateral flow test. METHODS: A total of 433 healthy volunteers were enrolled in the study and the sensitivity and specificity of the new cyto-salivary antigen test were calculated, as compared to the RT-PCR nasopharyngeal swab and to the lateral flow test. RESULTS: A total of 433 samples were collected and tested at the Mediterranean Fair in Palermo from February 2021 until April 2021. The new cyto-salivary antigen had a sensitivity of 100% and a specificity of 94.2%. The sensitivity and the specificity of the lateral flow test were 55% and 100%, respectively. CONCLUSIONS: The new cyto-salivary antigen test detected more positive cases than the RT-PCR in a sample of asymptomatic subjects, demonstrating to be a promising tool for a more sensitive diagnosis of COVID-19. Further studies are warranted to better characterize its diagnostic accuracy.","Di Domenico, Marina; De Rosa, Alfredo; Di Gaudio, Francesca; Internicola, Pietro; Bettini, Cinzia; Salzano, Nicola; Castrianni, Davide; Marotta, Andrea; Boccellino, Mariarosaria",Int. j. environ. res. public health (Online),378,1
274727,274727,274727,Competing risk largely explains the drop in admissions for acute cardiovascular disease during the COVID-19 pandemic. Response,18.75723,0.31106374,2020,"Background: The COVID-19 pandemic impacted on the sporting field, with athletes constrained in home isolation without the possibility to train and compete in their usual environments. This situation has been investigated within the theoretical frameworks of athletic identity and cognitive emotion regulation. Objectives: The objectives of our investigation were to: (a) validate the athletic identity measurement scale (AIMS) for use in Italian language; and (b) explore differences by gender, typology of sport (individual vs. team), and competitive level (elite vs. non-elite) in athletic identity and in cognitive emotion regulation during the Covid-19 lockdown period. Methods: To achieve these objectives, the reliability and construct validity of the Italian version of the AIMS have been tested in Study 1. Multivariate and univariate analyses were run to evaluate differences between different groups of athletes in Study 2. Results: Results from Study 1 suggest a 3-factor higher order model of athletic identity. Results from Study 2 highlight that, during this lockdown period, elite athletes and team sports athletes show higher athletic identity. Cognitive emotion regulation strategies are different for gender and for competitive level. Finally, athletes with higher athletic identity tend to ruminate and catastrophize more. Conclusions: The present multi-study paper contributes to the theoretical field with a validated measure of athletic identity in Italian language. It also provides some practical implications that could apply in this situation of isolation and can be extended to cases such as those of injury or illness.","Costa, Sergio; Santi, Giampaolo; di Fronso, Selenia; Montesano, Cristina; Di Gruttola, Francesco; Ciofi, Edoardo Giorgio; Morgilli, Luana; Bertollo, Maurizio",Sport Sci Health,378,21
274728,274728,274728,Competing risk largely explains the drop in admissions for acute cardiovascular disease during the COVID-19 pandemic. Response,18.644474,0.45396084,2020,"AbstractDie eskalierende Covid-19-Pandemie hat bewirkt, dass mehrere Impfstoffe gegen die Krankheit in Rekordtempo entwickelt und zugelassen wurden Dabei setzten Forscher sowohl etablierte als auch neue Strategien ein","Groß, Michael",Nachrichten aus der Chemie,378,27
276741,276741,276741,Rethinking the Importance of the Individual within a Community of Data,18.524576,0.45289424,2020,"The management of cardiac implantable electronic devices after death has become a source of controversy. There are no uniform recommendations for such management in Brazil; practices rely exclusively on institutional protocols and regional custom. When the cadaver is sent for cremation, it is recommended to remove the device due to the risk of explosion and damage to crematorium equipment, in addition to other precautions. Especially in the context of the SARS-CoV-2 pandemic, proper guidance and organization of hospital mortuary facilities and funeral services is essential to minimize the flow of people in contact with bodily fluids from individuals who have died with COVID-19. In this context, the Brazilian Society of Cardiac Arrhythmias has prepared this document with practical guidelines, based on international publications and a recommendation issued by the Brazilian Federal Medical Council.","Oliveira, Júlio César de; Fagundes, Alexsandro Alves; Alkmim-Teixeira, Ricardo; Baggio Junior, José Mário; Armaganijan, Luciana; d039,; Avila, Andre; Saad, Eduardo B; Andrade, Veridiana Silva de; Moraes, Luis Gustavo Belo de; Kuniyoshi, Ricardo; Rezende, André Gustavo da Silva; Pimentel, Mauricio; Rodrigues, Thiago da Rocha; Brito Junior, Helio Lima de; Nadalin, Elenir; Pisani, Cristiano Faria; Arfelli, Elerson; Cintra, Fatima Dumas; Kalil, Carlos Antonio Abunader; Melo, Sissy Lara de; Cannavan, Priscila Moreno Sperling",Arq Bras Cardiol,378,1
277548,277548,277548,[Current situation in Urology practice in Spain during the COVID-19 pandemic.],18.459326,0.09853153,2020,"Este artículo sitúa el foco de interés en los estudiantes de las universidades presenciales y en los modelos de enseñanza a distancia (ED) implementados durante el periodo de confinamiento causado por la crisis del COVID-19 Los objetivos son analizar la incidencia del contexto personal y familiar en la equidad digital, identificar el modelo de enseñanza recibido, y conocer su valoración y percepción sobre este modelo La investigación obedece a un estudio mixto de alcance descriptivo en el que se combinan métodos cualitativos y cuantitativos En primer lugar, se realizó un cuestionario a estudiantes de la Universidad de Extremadura (UEx) (n= 548) y a posteriori se efectuaron entrevistas online a miembros del equipo de gobierno de la universidad Los resultados indican que los estudiantes procedentes de familias con un nivel formativo bajo tienen menos oportunidades de uso de tecnologías digitales Las clases virtuales que han recibido han consistido esencialmente en presentaciones subidas al campus virtual con interacciones asíncronas La valoración negativa que hacen de la enseñanza a distancia se explica por la inversa relación percibida entre dedicación al estudio y rendimiento académico y por falta de adaptación de los docentes a las circunstancias personales y académicas de los estudiantes En conclusión, se determina que la universidad debe transitar hacia modelos más colaborativos y centrados en el estudiante Alternate abstract:This paper focuses on the students of traditional face-to-face universities and on the implemented distance learning models during the lockdown period caused by the COVID-19' crisis We aim here to analyze the impact of the personal and family context on digital equity, to identify the teaching model received, and to know their assessment and perception of this model The research is a mixed study of descriptive scope in which qualitative and quantitative methods are combined Firstly, a survey was carried out with students from the University of Extremadura (n=548) and, then, online interviews were conducted to members of the university governance The results indicate that students from families with a low educational level have fewer opportunities to use digital technologies Virtual lessons, which students have received, have essentially been based on presentations uploaded to the virtual campus with asynchronous interactions The negative assessment of distance learning is explained by the apparent reverse relationship between time spent studying and academic performance and by the lack of teachers' adaptation to students' personal and academic circumstances In conclusion, the university must move towards more collaborative and student-centered models","Pérez-López, Eva Atochero Alfonso Vázquez Rivero Santiago Cambero",Revista Iberoamericana de Educación a Distancia,378,33
279911,279911,279911,Prevalence of Increased FDG PET/CT Axillary Lymph Node Uptake Beyond 6 Weeks after mRNA COVID-19 Vaccination,18.708427,0.33760095,2021,"South Africa (SA) is a country of contrasts, with abundant resources, hard-won civil rights and a diverse population Woven into the fabric of our society is a large divide between its poorest and its wealthiest members In this article we highlight the vulnerabilities in our society that have been amplified by the COVID-19 crisis Based on recent projections, it is very likely that the healthcare system will be overwhelmed We acknowledge the recognition by government and civil society of these vulnerabilities, and note that difficult decisions will need to be made with regard to resource allocation Our plea, however, is to ensure that human dignity and the principle of distributive justice are maintained, and that when difficult decisions are made, vulnerable people do not suffer disproportionately Furthermore, it is of great concern that there is no national directive guiding resource allocation, prioritisation and triage decisions in both public and private hospitals The Health Professions Council of SA should, as a matter of urgency, issue guidance on priority-setting and triage decisions in the context of COVID-19, based on distributive justice principles","Castelyn, C. de V.; Viljoen, I. M.; Dhai, A.; Pepper, M. S.",South African Journal of Bioethics and Law,378,20
287577,287577,287577,Predicting tumor recurrence using metabolic indices of 18F-FDG PET/CT prior to orthotopic liver transplantationfor hepatocellular carcinoma,18.559605,0.26090515,2020,COVID-19 is viral respiratory infection with frequently fatal lung complications in the elderly or in people with serious comorbidities. Lung destruction appears to be associated with a cytokine storm related to an increased level of interleukin-6 (IL6). Therapeutic targeting of the interleukin-6 signaling pathway can attenuate such a cytokine storm and can be beneficial for patients with COVID-19 in danger of pulmonary failure. This article demonstrates the importance of IL6 in progression of disease and the possibility of inhibition of IL6 signaling in COVID-19 therapy.,"Smetana, Karel; Brábek, Jan",In Vivo,378,16
287750,287750,287750,"Exercise-based cardiac rehabilitation in COVID-19 times: one small step for health care systems, one giant leap for patients",18.357033,0.35141176,2020,"Shortly after the outbreak of the COVID-19 pandemic, there was a need to provide protective equipment to the medical facilities whose supplies were threatened to be depleted Just like many countries in Europe, Montenegro responded to the need for medical equipment by using the advantages of 3D printers while establishing a state network of production hubs, ensuring closed connectivity, communication, and the mutual fulfilment of personal protective equipment (PPE) demands whenever and wherever required With the second wave of the pandemic, Montenegro rose to second place in the world with the number of coronavirus cases, which also led to an increasing number of infected medical staff Since fever is a frequent symptom of SA+RS-CoV2 infection, a type of innovative 3D-printed thermo-sensored medical gear has been designed and tested in hospital conditions This medical gear shaped like a bracelet, which changes color in the presence of high human body temperatures, proves to be efficient and easy to use for medical staff as well as patients","Djukanović, Milena Mavrić Ardijan Jovanović Jovana Roganović Milovan Bošković Velibor",Applied Sciences,378,24
289126,289126,289126,"The novel coronavirus conundrum, the pregnant woman, her child What the obstetrician-gynecologist is learning",18.381529,0.33773047,2020,"BACKGROUND: The ongoing epidemics of coronavirus disease 2019 (COVID-19) have caused serious concerns about its potential adverse effects on pregnancy. There are limited data on maternal and neonatal outcomes of pregnant women with COVID-19 pneumonia. METHODS: We conducted a case-control study to compare clinical characteristics, maternal and neonatal outcomes of pregnant women with and without COVID-19 pneumonia. RESULTS: During January 24 to February 29, 2020, there were sixteen pregnant women with confirmed COVID-19 pneumonia and eighteen suspected cases who were admitted to labor in the third trimester. Two had vaginal delivery and the rest took cesarean section. Few patients presented respiratory symptoms (fever and cough) on admission, but most had typical chest CT images of COVID-19 pneumonia. Compared to the controls, COVID-19 pneumonia patients had lower counts of white blood cells (WBC), neutrophils, C-reactive protein (CRP), and alanine aminotransferase (ALT) on admission. Increased levels of WBC, neutrophils, eosinophils, and CRP were found in postpartum blood tests of pneumonia patients. There were three (18.8%) and three (16.7%) of the mothers with confirmed or suspected COVID-19 pneumonia had preterm delivery due to maternal complications, which were significantly higher than the control group. None experienced respiratory failure during hospital stay. COVID-19 infection was not found in the newborns and none developed severe neonatal complications. CONCLUSION: Severe maternal and neonatal complications were not observed in pregnant women with COVID-19 pneumonia who had vaginal delivery or caesarean section. Mild respiratory symptoms of pregnant women with COVID-19 pneumonia highlight the need of effective screening on admission.","Li, Na; Han, Lefei; Peng, Min; Lv, Yuxia; Ouyang, Yin; Liu, Kui; Yue, Linli; Li, Qiannan; Sun, Guoqiang; Chen, Lin; Yang, Lin",Clin. infect. dis,378,29
290721,290721,290721,Bioethical and biopolitical challenges revealed by COVID-19 pandemic,18.638657,0.19638126,2020,"Utilizando-se a análise de conteúdo identificaram-se os marcos referenciais (nos níveis nacional e internacional) que orientaram a formação da defesa sanitária animal no Estado de São Paulo, desde a criação da Secretaria de Agricultura de São Paulo aos dias atuais. Descreveu-se o modelo atual de defesa animal, tendo como enfoque as dimensões organizacional, procedimental e operacional, precedida de uma recuperação histórica da sua formação. A defesa animal ocupou diferentes posições na estrutura organizacional da Secretaria, em função dos diferentes objetivos dos diferentes grupos governantes. Passou, de coadjuvante nos projetos de melhoramento animal, a instrumento dos controles legais. Este papel passou a ter maior nitidez, a partir de 1969, com a implantação da Campanha de Combate à Febre Aftosa. Consolidou-se, a partir da década de 1990, com a nova agenda do comércio internacional, do acordo constitutivo da Organização Mundial do Comércio e dos acordos e instrumentos jurídicos conexos que o compõem, especialmente com a adoção do Acordo sobre Aplicação de Medidas Sanitárias e Fitossanitárias. Constatou-se que as estratégias e políticas estabelecidas nos programas de defesa estão baseadas no marco referencial da epidemiologia tradicional. Este enfoque impede que se caracterizem e interpretem o papel que a organização sócio-econômica da produção possui na determinação dos problemas produtivos. A estreita aproximação entre os objetivos da defesa animal em São Paulo e os conteúdos das normas internacionais, coloca em segundo plano as prioridades internas. A base legal que define a organização da defesa não favorece a partilha do poder, no âmbito do próprio serviço, quando, contraditoriamente, espera-se de uma organização pública moderna: flexibilidade, interatividade, capacidade gerencial, visão estratégica e a prática de conceitos de qualidade. Apesar da grande quantidade de oferta de canais de participação e de integração com a sociedade não se evidenciam indicadores de efetividade. As regras estabelecidas para relações de convênio ou parceria mostram-se excessivamente burocratizadas, geralmente mais adequadas a relações com grandes grupos econômicos. Ao longo do período estudado, persiste o discurso sobre a execução de programas de Educação Sanitária, entretanto, os instrumentos e métodos descritos na base legal de atuação da defesa não privilegiam a abordagem educativa","Lima, Zelia Marilia Barbosa",,378,20
290722,290722,290722,Bioethical and biopolitical challenges revealed by COVID-19 pandemic. (Suplemento especial.) [Spanish],18.661497,0.28264585,2020,We describe an approach to the evaluation and isolation of hospitalized persons under investigation (PUIs) for coronavirus disease 2019 (COVID-19) at a large US academic medical center. Only a small proportion (2.9%) of PUIs with 1 or more repeated severe acute respiratory coronavirus virus 2 (SARS-CoV-2) nucleic acid amplification tests (NAATs) after a negative NAAT were diagnosed with COVID-19.,"Dugdale, Caitlin M; Turbett, Sarah E; McCluskey, Suzanne M; Zachary, Kimon C; Shenoy, Erica S; Ciaranello, Andrea L; Walensky, Rochelle P; Rosenberg, Eric S; Anahtar, Melis N; Hooper, David C; Hyle, Emily P",Infect Control Hosp Epidemiol,378,16
290723,290723,290723,Bioethical and biopolitical challenges revealed by COVID-19 pandemic,18.515858,0.23196296,2020,We describe an approach to the evaluation and isolation of hospitalized persons under investigation (PUIs) for coronavirus disease 2019 (COVID-19) at a large US academic medical center. Only a small proportion (2.9%) of PUIs with 1 or more repeated severe acute respiratory coronavirus virus 2 (SARS-CoV-2) nucleic acid amplification tests (NAATs) after a negative NAAT were diagnosed with COVID-19.,"Dugdale, Caitlin M; Turbett, Sarah E; McCluskey, Suzanne M; Zachary, Kimon C; Shenoy, Erica S; Ciaranello, Andrea L; Walensky, Rochelle P; Rosenberg, Eric S; Anahtar, Melis N; Hooper, David C; Hyle, Emily P",Infect Control Hosp Epidemiol,378,24
295857,295857,295857,Support system to covid-19 medical diagnosis via diffuse cognitive map,18.425667,0.042111203,2020,"We propose a new fast method of measuring distances between large numbers of related high dimensional datasets called the Diffusion Earth Mover's Distance (EMD). We model the datasets as distributions supported on common data graph that is derived from the affinity matrix computed on the combined data. In such cases where the graph is a discretization of an underlying Riemannian closed manifold, we prove that Diffusion EMD is topologically equivalent to the standard EMD with a geodesic ground distance. Diffusion EMD can be computed in $\tilde{O}(n)$ time and is more accurate than similarly fast algorithms such as tree-based EMDs. We also show Diffusion EMD is fully differentiable, making it amenable to future uses in gradient-descent frameworks such as deep neural networks. Finally, we demonstrate an application of Diffusion EMD to single cell data collected from 210 COVID-19 patient samples at Yale New Haven Hospital. Here, Diffusion EMD can derive distances between patients on the manifold of cells at least two orders of magnitude faster than equally accurate methods. This distance matrix between patients can be embedded into a higher level patient manifold which uncovers structure and heterogeneity in patients. More generally, Diffusion EMD is applicable to all datasets that are massively collected in parallel in many medical and biological systems.","Tong, Alexander; Huguet, Guillaume; Natik, Amine; MacDonald, Kincaid; Kuchroo, Manik; Coifman, Ronald; Wolf, Guy; Krishnaswamy, Smita",,378,16
300229,300229,300229,"Constitution, state of emergency and public health Administration: some problems",18.380531,0.39810666,2020,,"Collingridge, David",Lancet Oncol,378,21
300276,300276,300276,Beyond the Respiratory System: A Case Report Highlighting the Impact of COVID-19 in Mental Illness and Its Physical Consequences,18.538265,5.8247924,2020,"During the COVID-19 epidemic, the professionals in the field of forensic pathology, forensic sciences in general, and clinical forensic medicine have been performing medicolegal investigation in their communities The forensic medical personnel who carry out such investigation/identification are facing a great risk of potential infection Therefore, forensic institutions and forensic examiners should improve their awareness of infection risk and take universal precautions to prevent infection and spread of coronavirus In addition, forensic experts should abide by the laws when they deal with social unrest and also strengthen research on COVID-19-related medical issues © 2020 Journal of Forensic Science and Medicine Published by Wolters Kluwer - Medknow","Cong, B.; Liu, X.",Journal of Forensic Science and Medicine,378,16
