,index,Unnamed: 0,title_x,x,y,publish_time_x,abstract,authors,journal,category,cluster
359601,359601,359601,Maintaining the momentum of virtual care,11.246562,3.929846,2020,"In this reflective piece, I consider the degree to which Australian universities have become financially dependent on income from foreign students, the reasons for that dependence, the risks it poses and the potential consequences now that COVID-19 has undermined this revenue stream.","Ross, John",High. Educ Res. Dev.,492,16
366794,366794,366794,Report of 5 nurses infecting COVID-19 during patient care: case Series,11.357691,3.982137,2020,"Resumo O objetivo deste artigo é avaliar a eficácia das máscaras faciais padrão tecido não tecido (TNT) para a prevenção de doenças respiratórias (MERS CoV, SARS-CoV e SARS-CoV-2) na população Foi realizada busca nas bases de dados Medline, Embase, Cinahl, The Cochrane Library, Trip Também busca complementar no Google Acadêmico, Rayyan e medRxiv Não foram aplicados filtros relacionados a data, idioma ou status de publicação Títulos e resumos foram rastreados e, posteriormente, textos completos foram avaliados Foram incluídos três estudos: um ensaio clínico randomizado tipo cluster e duas revisões sistemáticas O ensaio clínico indica benefício potencial de máscaras médicas para controle da fonte de infecção, para a doença respiratória clínica Em uma das revisões sistemáticas, não foi possível estabelecer relação conclusiva entre uso da máscara e proteção contra infecção respiratória Por fim, outra revisão sistemática demonstrou que máscaras são eficazes na prevenção da propagação de vírus respiratórios As evidências apontam para benefício potencial das máscaras faciais padrão TNT Para o cenário atual de pandemia por COVID 19, recomenda-se educação sobre uso adequado de máscaras, associado a medidas individuais de proteção Objectives: to evaluate the effectiveness of non-woven face masks for the prevention of respiratory infections (MERS CoV, SARS-CoV, and SARS-CoV-2) in the population Methods: search in Medline, Embase, Cinahl, The Cochrane Library, Trip databases Google Scholar, Rayyan and medRxiv were also consulted for complementary results No filters related to date, language or publication status were applied Titles and abstracts were screened, and later, full texts were evaluated Results: three studies were included: a randomized cluster clinical trial and two systematic reviews The clinical trial indicates a potential benefit of medical masks to control the source of clinical respiratory disease infection In one of the systematic reviews, it was not possible to establish a conclusive relationship between the use of the mask and protection against respiratory infection Finally, another systematic review indicated that masks are effective in preventing the spread of respiratory viruses Conclusion: Evidence points to the potential benefit of standard non-woven face masks For the current pandemic scenario of COVID-19, education on the appropriate use of masks associated with individual protection measures is recommended","Camargo, Maria Cristina de Martinez-Silveira Martha Sílvia Lima Adeânio Almeida Bastos Bruno Pires Santos Diana Lima dos Mota Sara Emanuela de Carvalho Silva Roberta Borges Toledo Isabela Porto de",Ciênc. Saúde Colet,492,24
367114,367114,367114,"Total containment of the population and number of confirmed cases of covid-19 in England, Belgium, France and Italy",11.255522,3.833036,2020,"ETHNOPHARMACOLOGICAL RELEVANCE: The coronavirus disease 2019 (COVID-19) has formed a global pandemic since late 2019. Benefit from the application experience of Chinese Medicine (CM) for influenza and SARS, CM has been used to save patients at the early stage of COVID-19 outbreak in China. AIM OF THE STUDY: In order to evaluate the efficacy and safety of CM, and comparing with that of Western Medicine (WM) for COVID-19, we conducted a retrospective case series study based on the patients in Wuhan Jinyintan Hospital, Wuhan, China. METHODS: The inclusion and exclusion criteria of data extraction was set for this retrospective study. All patients who were admitted by the Wuhan Jinyintan Hospital between January 17 and February 25, 2020 were considered. In addition, patients enrolled met the severe defined by the guidelines released by the National Health Commission of the People's Republic of China. In these cases included in the study, CM or WM treatment was selected according to the wishes of the patients at the beginning of hospitalization. The patients in CM group was treated with Huashi Baidu granule (137 g po, bid) combined with the injections of Xiyanping (100 mg iv, bid), Xuebijing (100 ml iv, bid,) and Shenmai (60 ml iv, qd) according to the syndrome of epidemic toxin blocking the lung in the theory of Traditional Chinese Medicine. The WM group received antiviral therapy (including abidor capsule 0.2 g po, tid; Lopinavir-Ritonavir tablets, 500 mg po, bid), antibiotics (such as cefoperazone, 2 g iv, bid; moxifloxacin hydrochloride tablets, 0.4 g po, qd) or corticosteroid therapy (such as methylprednisolone succinate sodium, 40mg, iv, 40 mg, qd; prednisone, 30 mg po, qd). In addition, patients in both groups received routine supportive treatment, including oxygen inhalation, symptomatic therapy, and/or human intravenous immunoglobulin, and/or serum albumin, and therapy for underlying diseases. The clinical outcomes were evaluated based on changes before and after the treatment related with clinical manifestations, computer tomography (CT) scan images, and laboratory examinations. RESULTS: 55 severe COVID-19 patients, with 23 in CM group and 32 in WM group, were included for analyzed. There was no case of death, transferred to ICU, or received invasive mechanical ventilation in two groups during hospitalization. The median time of SARS-CoV-2 RNA clearance in CM and WM group were 12 days and 15.5 days (P=0.018). Further, the chest CT imaging showed more widely lung lesion opacity absorbed in the CM group (P<0.05). The C-reactive protein level, erythrocyte sedimentation rate, serum ferritin, and myoglobin decreased significantly in the CM group (P<0.05). There was no significant difference in adverse events in terms of liver function and renal function between the two groups. CONCLUSION: Based on this retrospective analysis from Wuhan Jinyintan Hospital, CM has better effects in SARS-CoV-2 RNA clearance, lung lesion opacity absorbed and reduced inflammation in severe COVID-19 patients, is effective and safe therapy for treating severe COVID-19 and reducing mortality.","Huang, Luqi",J Ethnopharmacol,492,20
367726,367726,367726,"Act now to avoid pet crisis, warns Blue Cross",11.319855,3.6871307,2020,"A surge of patients with coronavirus disease 2019 (COVID-19) presenting to New York City hospitals in March 2020 led to a sharp increase in blood culture utilization, which overwhelmed the capacity of automated blood culture instruments We sought to evaluate the utilization and diagnostic yield of blood cultures during the COVID-19 pandemic to determine prevalence and common etiologies of bacteremia and to inform a diagnostic approach to relieve blood culture overutilization We performed a retrospective cohort analysis of 88,201 blood cultures from 28,011 patients at a multicenter network of hospitals within New York City to evaluate order volume, positivity rate, time to positivity, and etiologies of positive cultures in COVID-19 Ordering volume increased by 34 8% in the second half of March 2020 compared to the level in the first half of the month The rate of bacteremia was significantly lower among COVID-19 patients (3 8%) than among COVID-19-negative patients (8 0%) and those not tested (7 1%) (P &lt; 0 001) COVID-19 patients had a high proportion of organisms reflective of commensal skin microbiota, which, when excluded, reduced the bacteremia rate to 1 6% More than 98% of all positive cultures were detected within 4 days of incubation Bloodstream infections are very rare for COVID-19 patients, which supports the judicious use of blood cultures in the absence of compelling evidence for bacterial coinfection Clear communication with ordering providers is necessary to prevent overutilization of blood cultures during patient surges, and laboratories should consider shortening the incubation period from 5 days to 4 days, if necessary, to free additional capacity","Sepulveda, J.; Westblade, L. F.; Whittier, S.; Satlin, M. J.; Greendyke, W. G.; Aaron, J. G.; Zucker, J.; Dietz, D.; Sobieszczyk, M.; Choi, J. J.; Liu, D.; Russell, S.; Connelly, C.; Green, D. A.",Journal of Clinical Microbiology,492,1
370063,370063,370063,"Occurrence and Distribution of Disinfection Byproducts in Domestic Wastewater Effluent, Tap Water, and Surface Water during the SARS-CoV-2 Pandemic in China",11.519236,4.044606,2021,,"Arrocha Lucana, G. G.; Casas, R.",Kidney International Reports,492,22
371328,371328,371328,A warning cry from the Arctic,11.27124,3.9065752,2020,,"Mehra, Mandeep R; Ruschitzka, Frank; Patel, Amit N",Lancet,492,27
372813,372813,372813,Daily briefing: A protein on the surface of the coronavirus might explain why it is so contagious,11.3272915,3.9607978,2020,"BACKGROUND: Psychosocial responses to infectious disease outbreaks have the potential to inflict acute and longstanding mental health consequences Early research across the globe has found wide ranging psychological responses to the current COVID-19 pandemic Understanding how different coping styles can be effective in mitigating mental ill health would enable better tailored psychological support AIMS: The aim of this study was to gain an understanding of psychosocial responses to the COVID-19 pandemic, including depression, anxiety and distress, as well as effective coping styles in an Australian sample METHOD: A sample of 1,495 adults, residing in Australia between April 3rd and May 3rd 2020, completed an online survey which measured psychological distress (Impact of Events Scale-Revised), depression, anxiety, stress (DASS-21), as well as coping strategies (Brief COPE) RESULTS: 47% of the respondents were experiencing some degree of psychological distress Females experienced higher levels of depression, anxiety and stress than males Coping strategies associated with better mental health were positive reframing, acceptance and humour Conversely, self-blame, venting, behavioural disengagement and self-distraction were associated with poorer mental health CONCLUSION: Rates of psychological symptoms amongst the Australian population are similar to those reported in other countries Findings add to the growing literature demonstrating a gender disparity in the mental health impacts of COVID-19 Positive emotion focused coping strategies may be effective for reducing psychological symptoms Understanding psychosocial responses including beneficial coping strategies are crucial to manage the current COVID-19 situation optimally, as well as to develop mental health response plans for future pandemics","Gurvich, C.; Thomas, N.; Thomas, E. H.; Hudaib, A. R.; Sood, L.; Fabiatos, K.; Sutton, K.; Isaacs, A.; Arunogiri, S.; Sharp, G.; Kulkarni, J.",Int J Soc Psychiatry,492,29
372814,372814,372814,Daily briefing: A protein on the surface of the coronavirus might explain why it is so contagious,11.282558,3.9618988,2020,"The haemoflagellate protozoan Trypanosoma cruzi (T. cruzi) is the causative agent of Chagas disease (CD), a potentially life-threatening disease. Little by little, remarkable progress has been achieved against CD, although it is still not enough. In the absence of effective chemotherapy, many research groups, organizations and pharmaceutical companies have focused their efforts on the search for compounds that could become viable drugs against CD. Within the wide variety of reported derivatives, this review summarizes and provides a global vision of the situation of those compounds that include broadly studied heterocycles in their structures due to their applications in medicinal chemistry: imidazole and benzimidazole rings. Therefore, the intention of this work is to present a compilation, as much as possible, of all the reported information, regarding these imidazole and benzimidazole derivatives against T. cruzi, as a starting point for future researchers in this field.","Beltran-Hortelano, Iván; Alcolea, Verónica; Font, María; Pérez-Silanes, Silvia",Eur J Med Chem,492,29
372920,372920,372920,Understanding air and water borne transmission and survival of coronavirus: Insights and way forward for SARS-CoV-2,11.390712,3.646149,2020,"Facing the SARS-CoV-2 epidemic requires intensive testing on the population to early identify and isolate infected subjects. During the first emergency phase of the epidemic, RT-qPCR on nasopharyngeal (NP) swabs, which is the most reliable technique to detect ongoing infections, exhibited limitations due to availability of reagents and budget constraints. This stressed the need to develop screening procedures that require fewer resources and are suitable to be extended to larger portions of the population. RT-qPCR on pooled samples from individual NP swabs seems to be a promising technique to improve surveillance. We performed preliminary experimental analyses aimed to investigate the performance of pool testing on samples with low viral load and we evaluated through Monte Carlo (MC) simulations alternative screening protocols based on sample pooling, tailored to contexts characterized by different infection prevalence. We focused on the role of pool size and the opportunity to develop strategies that take advantage of natural clustering structures in the population, e.g. families, school classes, hospital rooms. Despite the use of a limited number of specimens, our results suggest that, while high viral load samples seem to be detectable even in a pool with 29 negative samples, positive specimens with low viral load may be masked by the negative samples, unless smaller pools are used. The results of MC simulations confirm that pool testing is useful in contexts where the infection prevalence is low. The gain of pool testing in saving resources can be very high, and can be optimized by selecting appropriate group sizes. Exploiting natural groups makes the definition of larger pools convenient and potentially overcomes the issue of low viral load samples by increasing the probability of identifying more than one positive in the same pool.","Baccini, Michela; Rocco, Emilia; Paganini, Irene; Mattei, Alessandra; Sani, Cristina; Vannucci, Giulia; Bisanzi, Simonetta; Burroni, Elena; Peluso, Marco; Munnia, Armelle; Cellai, Filippo; Pompeo, Giampaolo; Micio, Laura; Viti, Jessica; Mealli, Fabrizia; Carozzi, Francesca Maria",PLoS One,492,16
373009,373009,373009,Coronavirus variants get Greek names - but will scientists use them?,11.50329,3.8605459,2021,,,Lancet Glob Health,492,16
374213,374213,374213,Laparoscopic Pneumoperitoneum Escape and Contamination during Surgery using the Airseal Insufflation System: Video Vignette,11.165072,3.880694,2020,,"Su, Mack Y; Das, Shinjita",J Am Acad Dermatol,492,16
374630,374630,374630,Construction and commissioning of a new test gas line at the IFA,11.263012,3.991967,2021,"The present study examined the psychometric properties of the Coronavirus Anxiety Scale (CAS) using an online survey of 398 adult Amazon MTurk workers in the U.S. Confirmatory factor analyses demonstrated that the CAS measures a reliable (&#945; = 0.92), unidimensional construct with a structure that was shown to be invariant across gender, race, and age. Construct validity was demonstrated with correlations between CAS scores and demographics, coronavirus diagnosis, history of anxiety, coronavirus fear, functional impairment, alcohol/drug coping, religious coping, hopelessness, suicidal ideation, as well as social attitudes (e.g., satisfaction with President Trump). The CAS also demonstrated solid discrimination ability for functional impairment (AUC =0.88), while the original cut score of &#8805;9 (76% sensitivity and 90% specificity) showed the strongest diagnostic effectiveness among scores. Overall, these findings are largely consistent with the results of the first CAS investigation and support the validity of this mental health screener for COVID-19 related research and practice.","Lee, Sherman A; Mathis, Amanda A; Jobe, Mary C; Pappalardo, Emily A",Psychiatry Res,492,12
381107,381107,381107,Socioeconomic inequality in global incidence and mortality rates from COVID-19: an Ecological study,11.508236,3.9462614,2020,"OBJECTIVES: To investigate factors associated with the duration of viral shedding in patients with COVID-19, outside of Wuhan. METHODS: In this retrospective cohort study, patients with laboratory-confirmed COVID-19 in Changsha, China were included. Clinical characteristics, laboratory findings, treatment, and outcome were retrieved. Univariate and multivariate analyses were performed to explore potential factors. RESULTS: Overall, 147 patients with COVID-19 were included. The median duration of viral shedding (the number of days from symptoms onset until the successive negative detection of SARS-CoV-2 RNA) was 17 days (interquartile range [IQR], 12-21). Multivariate Logistic regression analysis indicated that the highest temperature at admission (odds ratio [OR], 5.200; 95% confidence interval [CI]: 1.190-22.726; p = 0.028), time from symptom onset to admission (OR, 1.740; 95% CI: 1.296-2.337; p < 0.001) and hospital length of stay (OR, 1.604; 95% CI: 1.262-2.040; p < 0.001) were risk factors for prolonged duration of viral shedding. CONCLUSIONS: This study, with a relatively large sample size, focused on the duration of viral shedding and related factors in patients with COVID-19, outside of Wuhan, China. Potential risk factors were identified and should be taken into consideration for the strategy of quarantining infected patients.","Qi, Lin; Yang, Yong; Jiang, Dixuan; Tu, Chao; Wan, Lu; Chen, Xiangyu; Li, Zhihong",Int J Infect Dis,492,22
384801,384801,384801,N95 or P2 respirator fit testing policy in Australia: implementation issues to consider,11.197789,4.095353,2021,"The persistence of the coronavirus-caused respiratory disease (COVID-19) and the related restrictions to mobility and social interactions are forcing a significant portion of students and workers to reorganize their daily activities to accommodate the needs of distance learning and agile work (smart working). What is the impact of these changes on the bosses/teachers' and workers/students' experience? This article uses recent neuroscience research findings to explore how distance learning and smart working impact the following three pillars that reflect the organization of our brain and are at the core of school and office experiences: (a) the learning/work happens in a dedicated physical place; (b) the learning/work is carried out under the supervision of a boss/professor; and (c) the learning/work is distributed between team members/classmates. For each pillar, we discuss its link with the specific cognitive processes involved and the impact that technology has on their functioning. In particular, the use of videoconferencing affects the functioning of Global Positioning System neurons (neurons that code our navigation behavior), mirror neurons, self-attention networks, spindle cells, and interbrain neural oscillations. These effects have a significant impact on many identity and cognitive processes, including social and professional identity, leadership, intuition, mentoring, and creativity. In conclusion, just moving typical office and learning processes inside a videoconferencing platform, as happened in many contexts during the COVID-19 pandemic, can in the long term erode corporate cultures and school communities. In this view, an effective use of technology requires us to reimagine how work and teaching are done virtually, in creative and bold new ways.","Riva, Giuseppe; Wiederhold, Brenda K; Mantovani, Fabrizia",Cyberpsychol Behav Soc Netw,492,29
389004,389004,389004,What to expect from viruses as winter hits northern hemisphere,11.435263,3.8781643,2020,,"Joob, B.; Wiwanitkit, V.",Int J Prev Med,492,1
394031,394031,394031,Editorial Comment,11.301961,3.7358413,2020,"BACKGROUND AND OBJECTIVES: The role of telemedicine in the evaluation and treatment of patients with spinal disorders is rapidly expanding, brought on largely by the COVID-19 pandemic. Within this context, the ability of pain specialists to accurately diagnose and plan appropriate interventional spine procedures based entirely on telemedicine visits, without an in-person evaluation, remains to be established. In this study, our primary objective was to assess the relevance of telemedicine to interventional spine procedure planning by determining whether procedure plans established solely from virtual visits changed following in-person evaluation. METHODS: We reviewed virtual and in-person clinical encounters from our academic health system's 10 interventional spine specialists. We included patients who were seen exclusively via telemedicine encounters and indicated for an interventional procedure with documented procedural plans. Virtual plans were then compared with the actual procedures performed following in-person evaluation. Demographic data as well as the type and extent of physical examination performed by the interventional spine specialist were also recorded. RESULTS: Of the 87 new patients included, the mean age was 60 years (SE 1.4 years) and the preprocedural plan established by telemedicine, primarily videoconferencing, did not change for 76 individuals (87%; 95% CI 0.79 to 0.94) following in-person evaluation. Based on the size of our sample, interventional procedures indicated solely during telemedicine encounters may be accurate in 79%-94% of cases in the broader population. CONCLUSIONS: Our findings suggest that telemedicine evaluations are a generally accurate means of preprocedural assessment and development of interventional spine procedure plans. These findings clearly demonstrate the capabilities of telemedicine for evaluating spine patients and planning interventional spine procedures.","Crawford, Alexander M; Lightsey, Harry M; Xiong, Grace X; Striano, Brendan M; Greene, Nattaly; Schoenfeld, Andrew J; Simpson, Andrew K",Reg Anesth Pain Med,492,16
398522,398522,398522,Coronavirus has permanently scarred some people's lungs,11.374055,3.667816,2020,"BACKGROUND: In children, the infection with SARS-CoV-2, the cause of COVID-19, tends to be clinically inapparent more often or less severe than in adults. The spread of this infection from children poses a danger to vulnerable adults. Therefore, child care institutions and schools currently are widely closed. METHODS: Since the status of infection tends to be congruent in mothers and their children, we tested 401 mothers of children between 1 and 10 years in the city of Rostock (State of Mecklenburg-Westpomerania, northeast of Germany), for the presence of RNA of SARS-CoV-2 in throat swabs, and of antibodies against SARS-CoV-2 in serum. RESULTS: In none of the mothers tested, RNA of this virus was detected in the throat swab. In the ELISA test, IgG antibodies were positive in one serum sample, IgA antibodies were positive in 11, and borderline in 3 serum samples. All 401 sera were negative in the indirect immunofluorescence test (IIFT) with FITC-labeled IgG, IgA, und IgM antibodies. CONCLUSION: At the time of this study, neither SARS-CoV-2 RNA, nor specific antibodies against SARS-CoV-2 were detectable in the mothers tested in Rostock.","Reisinger, Emil C; von Possel, Ronald; Warnke, Philipp; Geerdes-Fenge, Hilte F; Hemmer, Christoph J; Pfefferle, Susanne; Löbermann, Micha; Littmann, Martina; Emmerich, Petra",Dtsch Med Wochenschr,492,21
399810,399810,399810,Des collaborations novatrices améliorent les soins en santé mentale,11.077352,3.6984284,2020,,"Parker, Salim; Mahomed, Ozayr",J. travel med,492,1
403137,403137,403137,Five ways that Trump is undermining environmental protections under the cover of coronavirus,11.38394,3.9603357,2020,"During the recent COVID-19 pandemic crisis, stock markets around the world have witnessed an abrupt decline in security prices and an unprecedented increase in security volatility In response to a week of financial turmoil on the main European stock markets, some market regulators in Europe, including France, Austria, Italy, Spain, Greece, and Belgium, passed temporary short-selling bans in an attempt to stop downward speculative pressures on the equity market and stabilize and maintain investors' confidence This paper examines the effects of these short-selling bans on market quality during the recent pandemic caused by the spread of COVID-19 Our results suggest that during the crisis, banned stocks had higher information asymmetry, lower liquidity, and lower abnormal returns compared with non-banned stocks These findings confirm prior theoretical arguments and empirical evidence in other settings that short-selling bans are not effective in stabilizing financial markets during periods of heightened uncertainty In contrast, they appear to undermine the policy goals market regulators intended to promote","Siciliano, Gianfranco Ventoruzzo Marco",European Company and Financial Law Review,492,16
