,index,Unnamed: 0,title_x,x,y,publish_time_x,abstract,authors,journal,category,cluster
270385,270385,270385,Terapia Com Células-tronco Em Pacientes Com Covid-19: Revisão Sistemática,18.233923,-2.1515288,2020,"During the pandemic of Coronavirus Disease 2019 (COVID-19), it is critical to introduce potential medical treatments. Anti-oxidative herbal medicines with evidence-based beneficial impacts in the treatment of diabetes mellitus can be suggested as an adjuvant therapy to its conventional treatments in patients infected with COVID-19.","Tabatabaei-Malazy, Ozra; Abdollahi, Mohammad; Larijani, Bagher",Diabetes Metab. Syndr. Obes. Targets Ther.,945,16
271691,271691,271691,Infecção Por Covid-19 E Anemia Falciforme: Uma Revisão De Literatura,18.284498,-2.5538507,2020,"This article attempts to construct an extremely rudimentary framework to argue that the long-term losses from the pandemic shock are likely to far exceed the short-term one In the simple structure presented here, output depends on labour force, efficiency that is determined by past nutrition levels and capital accumulated from the past The immediate effect of the pandemic is to lower the effective labour size, principally due to lockdowns to prevent or delay the spread of the pandemic The other two factors cannot be affected However, the decline in present output is likely to lower both the efficiency of labour and the future capital along with the labour supply in the future, thereby causing a greater impact on future output","Sengupta, Sarbajit",The Indian Economic Journal,945,1
274244,274244,274244,Eventos Tromboembólicos Em Pacientes Com Covid-19: Revisão Sistemática,18.42319,-2.1682003,2020,"Objective: The main goal of this topic is to stimulate novel investigations and theoretical perspectives on how people are psychologically affected by coping with COVID-19 and also their change in the daily physical activity routine Materials and methods: A questionnaire was circulated among people enquiring about their stress level and also the impacts of it in their health status during this pandemic both physically and mentally The results were collected and then analysed through SPSS software Statistical analysis: Descriptive statistical analysis was carried out and Chi square test was used and finally p value was calculated Results: The results implies that even though people are aware of the impacts of physical inactivity, they hesitate to take efforts in maintaining their health and fitness Lockdown has reduced daily physical activity in the majority of the sample population Mental stress was experienced by most of the people in quarantine The major health risk experienced due to this inactive lifestyle is obesity Conclusion: Sedentary lifestyle of the quarantined people makes them feel irritated and also causes lots of stress both mentally and physically They were also able to feel the consequences of being physically inactive throughout This study reveals the impacts of lockdown in physical and mental health of people being quarantined","Dhivyadharshini, J.; Somasundaram, J.",International Journal of Pharmaceutical Research,945,21
281030,281030,281030,Perfil De Problemas Imuno-hematológicos Identificados Em Amostras De Pacientes Durante a Pandemia Covid-19,18.14786,-2.4929395,2020,"OBJECTIVES: To identify a safe pathway for management and treatment of patients with X-linked hypophosphatemic rickets (XLH) during Covid-19 pandemic lockdown. METHODS: Twenty-six patients with XLH (age 3.1-25.7 years) were enrolled in Pediatric Endocrine Unit; nine of them were receiving human monoclonal anti-fibroblast growth factor 23 antibody (burosumab) and 17 (pediatric patients, age 9.5-17.9 years, n=7; young-adult patients, age 20.1-25.7 years, n=10) received conventional treatment with inorganic oral phosphate salts and active vitamin D metabolites. A Covid-19 free pathway was addressed for XLH patients receiving burosumab treatment in hospital. XLH patients receiving conventional treatment were followed by phone calls, e-mails, or telemedicine. RESULTS: All XLH patients receiving burosumab continued the scheduled follow-up and treatment; none of them was infected by Covid-19. Seven XLH patients out of 17 (41%) receiving conventional treatment showed some complication related to the disease itself or its treatment: periapical abscess with gingival fistula was diagnosed in five patients (three children and two young-adults) and treated with antibiotics with complete resolution; one child showed abdominal pain due to the administration of high doses of inorganic oral phosphate salts solved by reducing the dosage, and one child had severe legs pain during deambulation after orthopedic surgery solved with common analgesics. CONCLUSIONS: Covid-19 free pathway was safe and effective to manage XLH patients receiving burosumab. E-health technologies were useful methods to follow XLH patients receiving conventional treatment during Covid-19 pandemic lockdown.","Baroncelli, Giampiero I; Bertelloni, Silvano; Cosci O Di Coscio, Mirna; Tyutyusheva, Nina; D039,; Elios, Sofia; Peroni, Diego",J Pediatr Endocrinol Metab,945,16
284033,284033,284033,Transfusão De Hemocomponentes De Doadora Positivo Para Covid-19 Em Duas Pacientes Imunodeprimidas,18.04096,-2.449507,2020,,"Schramm, Femin Roland; Braz, Marlene",Coleção Criança Mulher e Saúde,945,24
288677,288677,288677,Recaída Atípica De Mieloma Múltiplo Associada Ao Uso De Tocilizumabe Para Covid -19,18.000961,-2.4592597,2020,"BACKGROUND: Amidst corona virus disease-2019 (COVID-19) pandemic, disruption to the usual ways of life can lead to anxiety and feeling of being unsafe, which may be associated with self-medication The study was planned to investigate the prevalence of anxiety and self-medication during COVID-19 pandemic MATERIALS AND METHODS: In this cross-sectional study, data were collected through an anonymous online survey with questionnaire consisting of four sections: demographic data of the participants, validated COVID-19 Anxiety Inventory Items, Self-rating Anxiety Scale, and self-medication practices during COVID-19 pandemic The data were organized and analyzed using Windows Microsoft excel and SPSS software (Version 21) Descriptive statistics were calculated for all patient characteristics and survey responses Analytical analysis included relationship between various parameters using Chi-square test RESULTS: A total of 1100 responses were received Approximately half of the participants were worried about getting severely ill Majority reported reduced social contact (71 3%, n = 784) and also communicated that the pandemic has influenced their use of safety measures (86 5%, n = 951) The prevalence of mild-to-moderate, moderate-to severe, and extremely severe anxiety cases were 23 1%, 4 7%, and 0 54%, respectively One-fourth of the responders reported self-medication, out of which 60% were found to be anxious Nonsteroidal anti-inflammatory drugs were most commonly used CONCLUSIONS: Rising to the present challenge will require integration across different sectors with the immediate aim of getting people safely through the pandemic As the world focuses on containing and delaying the spread of the COVID-19, with burdened health-care systems, we should not miss out on people with anxiety disorders and self-medication problem, which may worsen with the pandemic","Chopra, D.; Bhandari, B.; Sidhu, J. K.; Jakhar, K.; Jamil, F.; Gupta, R.",Journal of Education and Health Promotion,945,6
291453,291453,291453,Pacientes Com Leucemia Mieloide Crônica E Sars-cov-2: Revisão Sistemática,18.267223,-2.5685654,2020,,"Dewitte, J. D.; Ameille, J.; Brochard, P.",Arch. Mal. Prof. Environ.,945,20
293848,293848,293848,Síndrome Hemofagocítica Em Paciente Com Lma Recidivada E Covid-19: Relato De Caso,18.212221,-2.4296849,2020,"The emergence of novel coronavirus (SARS-CoV-2) in 2019 in China marked the third outbreak of a highly pathogenic coronavirus infecting humans. The novel coronavirus disease (COVID-19) spread worldwide, becoming an emergency of major international concern. However, even after a decade of coronavirus research, there are still no licensed vaccines or therapeutic agents to treat the coronavirus infection. In this context, apitherapy presents as a promising source of pharmacological and nutraceutical agents for the treatment and/or prophylaxis of COVID-19. For instance, several honeybee products, such as honey, pollen, propolis, royal jelly, beeswax, and bee venom, have shown potent antiviral activity against pathogens that cause severe respiratory syndromes, including those caused by human coronaviruses. In addition, the benefits of these natural products to the immune system are remarkable, and many of them are involved in the induction of antibody production, maturation of immune cells, and stimulation of the innate and adaptive immune responses. Thus, in the absence of specific antivirals against SARS-CoV-2, apitherapy could offer one hope toward mitigating some of the risks associated with COVID-19.","Lima, William G; Brito, Júlio C M; da Cruz Nizer, Waleska S",Phytother. res,945,1
305894,305894,305894,Covid-19: Riscos Da Auto-hemoterapia,18.433046,-2.4722672,2020,"OBJECTIVES: This is the first of a 2-part article that discusses essential case management practices and strategies amidst the novel coronavirus disease 2019 (COVID-19). The series showcases the potential professional case managers have in support of managing during a crisis such as this global pandemic. Part I discusses reenvisioned roles and responsibilities of case managers and leaders known to address patients' needs during a crisis, with a special focus on telehealth, tele-case management, surge capacity, redeployment, discharge planning, and transitions of care. PRIMARY PRACTICE SETTINGS: Applicable to the various case management practice settings across the continuum of health and human services, especially acute care. FINDINGS CONCLUSIONS: The COVID-19 global pandemic crisis has brought an unprecedented challenge to professional case managers and health care professionals. It also has provided opportunities for innovation and partnerships within and across health care organizations and the various care settings where patients/support systems access necessary services. Most importantly, it created a renewed interest in telehealth and facilitated a wider adoption of such approach to care delivery than ever before. This pandemic has also increased the use of nontraditional sites of care, most importantly those that operate virtually on electronic networks and health information system technologies such as remote visits, e-visits, virtual care, and tele-monitoring. Undoubtedly, these have provided new opportunities for tele-case management services and roles for professional case managers in the virtual world of health and human service delivery. IMPLICATIONS FOR CASE MANAGEMENT PRACTICE: Professional case managers are integral members of interprofessional health care teams. Their roles are even more necessary during a global pandemic such as COVID-19. The practice of case management will forever change-for the better. The experience of this crisis in health care has brought about ever-lasting implications for case management professionals. It has raised awareness to sites of care never were as popular before, resulting in an increased need and recognition for tele-case management practice and virtual case managers. It has also forced partnerships and collaborations among the diverse contexts of health care organizations (public, private, or both) and other industries, regardless of whether directly involved in the delivery of care or having a support service role. These new and innovative approaches in the provision of care and case management services will without a doubt become routine expectations beyond the current pandemic period. Of special note are the enhanced roles of case managers in discharge planning and transitions of care.","Tahan, Hussein M",Prof Case Manag,945,16
310460,310460,310460,Covid-19 Em Paciente Com Leucemia Mieloide Aguda: Um Relato De Caso,18.035795,-2.5525398,2020,"Approximately one in eight visits to the Emergency Department (ED) in the United States are due to a behavioral health crisis. A Midwest community created an Integrated Crisis Team (ICT) as part of its county-wide effort to improve quality of care for people with mental health and/or substance use disorders. This ICT, which is embedded in the ED, ensured trained crisis clinicians were available in the ED, among other strategies. Semi-structured interviews were conducted with 15 staff members and a thematic analysis was used to assess ED staff members' perceptions of the impact of the ICT on staff and patient experience, and to identify barriers to implementation. Results indicated that the ICT facilitated a collaborative team effort in the ED and improved patient care in the ED. This evaluation informs key stakeholders about the importance of integrating a crisis team within an ED to better serve behavioral health patients.","Schulz, Jonathan A; Ramaswamy, Megha; Collie-Akers, Vicki; Jordan, Sonia; Koon, Lyndsie M; Tryanski, Robert",Community ment. health j,945,0
312082,312082,312082,Covid-19 E Sua Relação Com O Desenvolvimento Da Trombose,18.396597,-2.5694032,2020,"OBJECTIVE: The emergence of a novel coronavirus, SARS-CoV-2, and its subsequent spread outside of Wuhan, China, led to the human society experiencing a pandemic of coronavirus disease 2019 (COVID-19). While the development of vaccines and pharmaceutical treatments are ongoing, government authorities in China have implemented unprecedented non-pharmaceutical interventions as primary barriers to curb the spread of the deadly SARS-CoV-2 virus. Although the decline of COVID-19 cases coincided with the implementation of such interventions, we searched for evidence to demonstrate the efficacy of these interventions, since artifactual factors, such as the environment, the pathogen itself, and the phases of epidemic, may also alter the patterns of case development. METHODS: We surveyed common viral respiratory infections that have a similar pattern of transmission, tropism, and clinical manifestation, as COVID-19 under a series of non-pharmaceutical interventions during the current pandemic season. We then compared this data with historical data from previous seasons without such interventions. RESULTS: Our survey showed that the rates of common respiratory infections, such as influenza and respiratory syncytial virus infections, decreased dramatically from 13.7% (95% CI, 10.82-16.58) and 4.64% (95% CI, 2.88-7.64) in previous years to 0.73% (95% CI, 0.02-1.44) and 0.0%, respectively, in the current season. CONCLUSIONS: Our surveillance provides compelling evidence that non-pharmaceutical interventions are cost-effective ways to curb the spread of contagious agents, and may represent the only practical approach to limit the evolving epidemic until specific vaccines and pharmaceutical treatments are available.","Yang, Qi; Xiao, Xia; Gu, Xinxia; Liang, Dong; Cao, Ting; Mou, Jun; Huang, Chunxu; Chen, Lei; Liu, Jie",Int J Infect Dis,945,20
313106,313106,313106,Adaptações Da Hemorrede Do Ceará Em Meio À Pandemia Por Covid-19,18.362722,-2.3217146,2020,"OBJECTIVE: Identification of biological markers able to better stratify cardiovascular risks in SLE patients is needed. We aimed to determine whether serum cardiac troponin T (cTnT) levels measured with a highly sensitive assay [high sensitivity cTnT (HS-cTnT)] may predict cardiovascular events (CVEs) in SLE. METHOD: All SLE patients included between 2007 and 2010 in the randomized, double-blind, placebo-controlled, multicentre PLUS trial were screened. Patients with no past history of CVE at inclusion and a follow-up period of >20 months were analysed. HS-cTnT concentration was measured using the electrochemiluminescence method on serum collected at PLUS inclusion. The primary outcome was the incident CVE. Factors associated with the primary outcome were identified and multivariate analysis was performed. RESULTS: Overall, 442 SLE patients (of the 573 included in the PLUS study) were analysed for the primary outcome with a median follow up of 110 (interquartile range: 99-120) months. Among them, 29 (6.6%) experienced at least one CVE that occurred at a median of 67 (interquartile range: 31-91) months after inclusion. Six out of 29 patients had more than one CVE. In the multivariate analysis, dyslipidaemia, age and HS-cTnT were associated with the occurrence of CVE. Kaplan-Meier analysis showed that a concentration of HS-cTnT > 4.27 ng/l at inclusion increased by 2.7 [hazard ratio 2.7 (95% CI: 1.3, 5.6), P =0.0083] the risk of CVE in SLE. CONCLUSION: HS-cTnT measured in serum is the first identified biomarker independently associated with incident CVE in SLE patients.","Chezel, Julie; Costedoat-Chalumeau, Nathalie; Laouénan, Cedric; Rouzaud, Diane; Chenevier-Gobeaux, Camille; Le Guern, Véronique; Mathian, Alexis; Belhadi, Drifa; de Almeida Chaves, Sébastien; Duhaut, Pierre; Fain, Olivier; Galicier, Lionel; Ghillani-Dalbin, Pascale; Kahn, Jean Emmanuel; Morel, Nathalie; Perard, Laurent; Pha, Micheline; Saidoune, Fanny; Sarrot-Reynauld, Francoise; Aumaitre, Olivier; Chasset, François; Limal, Nicolas; Desmurs-Clavel, Helene; Ackermann, Felix; Amoura, Zahir; Papo, Thomas; Sacre, Karim",Rheumatology (Oxford),945,1
316428,316428,316428,Readequação Do Atendimento Ao Doador De Sangue Total Diante Dos Impactos Ocasionados Pela Pandemia Do Covid-19,18.292524,-2.5178587,2020,"This study aimed to analyze the dynamic changes of lymphocyte subsets and specific antibodies in coronavirus disease 2019 (COVID-19) patients with different illness severity. The amounts of lymphocyte subsets and the levels of immunoglobulin M (IgM) and IgG antibody were retrospectively analyzed in 707 COVID-19 cases. The amounts of lymphocyte subsets were significantly decreased with the increased severity of illness and the levels of IgM and IgG were lower in critical cases than severe and moderate cases. In deceased patients, the lymphocytes subsets were significantly lower than recovered patients. However, the relationship between the levels of IgM and IgG and the amounts of lymphocyte subsets were not significantly correlated. During different stages of COVID-19, the total T cell, CD4+ T cell, and CD8+ T cell counts were gradually recovered to the normal levels in severe and critical groups but the changing trend was relatively stable in the moderate group. The production of IgM and IgG antibodies were delayed in critical groups but also could reach the peak levels at one month after illness onset and decreased to background levels. To detect the kinetics of lymphocytes and antibodies has important clinical value in predicting the illness severity and understanding the pathogenesis of COVID-19.","Zhang, Bo; Yue, Daoyuan; Wang, Yun; Wang, Feng; Wu, Shiji; Hou, Hongyan",J Med Virol,945,16
319054,319054,319054,Manejo Da Enfermagem Com Lesões De Pele Em Portador De Anemia Aplastica Severa,18.075523,-2.5848565,2020,"Telemedicine plays an increasingly important role in global healthcare In this study, we summarized the latest developments related to telemedicine and discussed the obstacles and challenges to its wide adoption with a focus on the impact of COVID-19 © 2020 IEEE","Wu, Z.; Chitkushev, L.; Zhang, G.","Proc. - IEEE Int. Conf. Bioinform. Biomed., BIBM",945,1
327559,327559,327559,"Percepção Dos Hematologistas Brasileiros Sobre O Linfoma Do Manto: Fatores Prognósticos, Tratamento E Impacto Da Pandemia De Covid-19",18.154451,-2.3696885,2020,"Coronavirus disease (COVID-19), caused by the virus severe acute respiratory syndrome coronavirus 2 (SARS-CoV-2) has had a huge impact on global human health and was declared a worldwide distributed pandemic by the World Health Organization SARS-CoV-2 has strong transmission and pathogenicity;so far, there are more than 16,000,000 cases of infections around the world and COVID-19 has caused more than 656,000 deaths Current data indicate risk factors of patients infected by SARS-CoV-2 are older age, male sex, and chronic underlying diseases such as hypertension, diabetes, cardiovascular diseases, chronic respiratory disease, and cancer After the outbreak of COVID-19, concern whether transplant patients are more susceptible to SARS-CoV-2 has been raised It is inconclusive whether patients after transplantation on chronic immunosuppressive therapy are more susceptible to developing a more severe disease course There is limited literature mainly aimed at post-transplantation populations whose immunity was suppressive before the disease occurred Therefore, we attempted to systematically introduce the characteristics of transplant recipients with COVID-19, immunology in SARS-CoV-2 infection, and potential therapeutic strategy","Wang, Meixi Zhao Yuanyuan Wei Lai Chen Dong Yang Bo Chen Zhishui",Critical Reviews in Immunology,945,16
328535,328535,328535,Desafios Da Doação De Sangue Durante a Pandemia No Brasil,18.184484,-2.2788475,2020,,"Trout, Kate E.; Chen, Li-Wu",Health Science Reports,945,14
330665,330665,330665,Análise Do Impacto Da Covid-19 Na Gestão Hemoterápica: Experiência Hemominas E Santa Casa – Juiz De Fora,18.221443,-2.5687764,2020,,"Macip, Ricardo F",Dialect Anthropol,945,5
337044,337044,337044,Relação Entre Os Grupos Sanguíneos E a Covid-19,18.38631,-2.6017728,2020,"COVID-19 mRNA vaccine BNT162b2 is highly immunogenic and effective, but recent studies have indicated waning anti-SARS-CoV-2 immune responses over time. Increasing infection rates has led authorities in several countries to initiate booster campaigns for vulnerable populations, including the elderly. However, the durability of vaccine-induced immunity in the elderly is currently unknown. Here, we describe interim results of a prospective cohort study comparing immune responses in a cohort of vaccinated elderly persons to those in healthcare workers (HCW), measured six months after first immunisation with BNT162b2. Anti-SARS-CoV-2 S1-, full Spike- and RBD-IgG seropositivity rates and IgG levels at six months were significantly lower in the elderly compared to HCW. Serum neutralization of Delta VOC measured by pseudovirus neutralisation test was detectable in 43/71 (60.6%, 95%CI: 48.9-71.1) in the elderly cohort compared to 79/83 in the HCW cohort (95.2%, 95%CI: 88.3-98.1) at six months post vaccination. Consistent with the overall lower antibody levels, SARS-CoV-2-S1 T cell reactivity was reduced in the elderly compared to HCW (261.6 mIU/ml, IQR:141.5-828.6 vs 1198.0 mIU/ml, IQR: 593.9-2533.6, p<0.0001). Collectively, these findings suggest that the established two-dose vaccination regimen elicits less durable immune responses in the elderly compared to young adults. Given the recent surge in hospitalisations, even in countries with high vaccination rates such as Israel, the current data may support booster vaccinations of the elderly. Further studies to determine long-term effectiveness of COVID-19 vaccines in high-risk populations and the safety and effectiveness of additional boosters are needed.","Tober-Lau, Pinkus; Schwarz, Tatjana; Vanshylla, Kanika; Hillus, David; Gruell, Henning; Group, - EICOVCOVIM Study; Suttorp, Norbert; Landgraf, Irmgard; Kappert, Kai; Seybold, Joachim; Drosten, Christian; Klein, Florian; Kurth, Florian; Corman, Victor M; Sander, Leif Erik M",,945,16
341030,341030,341030,Implicações Clínicas Da Covid-19 Em Pacientes Com Lla: Uma Revisão De Literatura,18.083235,-2.221678,2020,"The new Covid SARS-CoV-2 (Severe Acute Respiratory Syndrome Coronavirus-2), was first recognized in Wuhan (China) in December 2019, addresses a similar family as the Severe Acute Respiratory Syndrome Coronavirus-1 (SARS-CoV-1). On January 30, 2020 the World Health Organization pronounced the flare-up as a Public Health Emergency of International Concern. Diagnosis of this disease is carried out by using special molecular tests. It is mandatory to associate the individual with COVID 19 symptom and isolation is necessary to prevent further transmission of this virus. This review highlights the formation, prodrome, transmission, survival mechanism of COVID 19 and shows that, the pandemic circumstance fundamentally improves air quality in various urban areas across the globe, decreases water contamination and commotion, and diminishes the tension on the traveller objections, which may help with the reclamation of the natural framework. The worldwide effect of this new outbreak is yet dubious.","Sivaranjanee, R; Kumar, P Senthil",Curr Opin Environ Sci Health,945,20
344525,344525,344525,O Distanciamento Social Durante a Pandemia Do Covid-19 E O Cadastramento De Doadores De Medula Ossea No Hemocentro Recife-pe,18.19423,-2.2871814,2020,The article was published with incorrect sequence of references citation in Table 2 and Reference section from References 30-63 and reference 64 was removed during processing.,"Rahimi, Kaveh",Neurol. sci,945,9
345573,345573,345573,Material Lúdico Específico Para Crianças E Adolescentes Atendidos Em Um Hemocentro: Elaboração E Aplicabilidade Durante a Pandemia Da Covid-19,18.30252,-2.6624658,2020,,"León Martín, Antonio Alberto",Revista Clínica de Medicina de Familia,945,23
347123,347123,347123,Pandemia E Produtividade: Desenvolvimento De Curso Ead Em Hematologia,18.15219,-2.54119,2020,,"Zimmermann, Gerd W",MMW Fortschr Med,945,16
