,index,Unnamed: 0,title_x,x,y,publish_time_x,abstract,authors,journal,category,cluster
495118,495118,495118,The use of masks to protect against respiratory infections: an umbrella review./ El uso de las mascarillas en la protección de las infecciones respiratorias: una revisión de revisiones,16.395903,-1.251556,2020,"The decline in economic activities and tourism during the COVID-19 pandemic has reduced the pressure on the environment and protected area (PA) systems to some extent. However, the financial losses within nature-based tourism due to travel restrictions and park closures will negatively impact tourism income-dependent PAs' management effectiveness. This exploratory study incorporates a risk-assessment framework to investigate and provide first insights into the pandemic's influence on the delivery of management outputs in Plitvice Lakes National Park, Croatia. Although in 2020, this PA faced a 75% decline in overall revenue compared to the year before, analysis suggests that, in the short term, conservation-related outputs are least affected. Visitor management and PA efforts to support the local community's sustainable development are the most severely impacted first-order outputs. Third-order nature-based tourism-related outputs face average to high risks. This study's risk-assessment framework provides a starting point for a post-pandemic reassessment of the delivery of PA management outputs and decision-making about output prioritisation and resource allocation. Results suggest several new avenues for research.","Mandić, Ante",Journal of Outdoor Recreation and Tourism,459,9
495119,495119,495119,El uso de las mascarillas en la protección de las infecciones respiratorias: una revisión de revisiones,16.558926,-1.5187284,2020,"COVID-19 has rapidly spread around the world in the past few months, researchers around the world are working around the clock to closely monitor and assess the development of this pandemic In this paper, a time series regression model is built to assess the short-term progression of COVID-19 pandemic The model structure and parameters are identified using COVID-19 pandemic data released by China within the time window from 22 January to 09 April 2020 The same model structure and parameters are applied to a few other countries for day ahead forecasting, showing a good fit of the model This modeling exercise confirms that the underlying internal dynamics of this disease progression is quite similar The differences in the impact of this pandemic on different countries are largely attributed to different eternal factors © 2020, Springer Nature Singapore Pte Ltd","Liu, X.; Li, K.; Yang, Z.; Du, D.",Communications in Computer and Information Science,459,9
495198,495198,495198,Legal technologies as instruments of civil aviation safety improvement in conditions of the fight against COVID-2019,16.91664,-1.4169235,2021,"Based on the rapid spread of the CoViD-2019, a lockdown was declared in the whole Northern Italy by the Government. The application of increasingly rigorous containment measures allowed to reduce the impact of the CoViD-2019 pandemic on the Italian National Health System but at the same time these restriction measures gave also the opportunity to assess the effect of anthropogenic activities on air pollutants in an unprecedented way. This paper aims to study the impact of the partial and total lockdown (PL and TL, respectively) on air quality in the Metropolitan City of Milan. As results, the severe limitation of people movements following the PL and the subsequent TL determined a significant reduction of pollutants concentration mainly due to vehicular traffic (PM10, PM2.5, BC, benzene, CO, and NOx). The lockdown led to an appreciable drop in SO2 only in the city of Milan while it remained unchanged in the adjacent areas. Despite the significant decrease in NO2 in the TL, the O3 exhibited a significant increase, probably, due to the minor NO concentration. In Milan and SaA the increase was more accentuated, probably, due to the higher average concentrations of benzene in Milan than the adjacent areas that might have promoted the formation of O3 in a more significant way.","Collivignarelli, Maria Cristina; Abbà, Alessandro; Bertanza, Giorgio; Pedrazzani, Roberta; Ricciardi, Paola; Carnevale Miino, Marco",Sci Total Environ,459,26
495584,495584,495584,Efficient trial designs to evaluate treatments in a public health emergency,16.839092,-1.2094804,2021,,"Katsarou, Maria; Grassi, Viviana; Lomazzi, Chiara; Domanin, Maurizio; Trimarchi, Santi",J. vasc. surg,459,21
495693,495693,495693,Detection of Listeria spp. in cattle and environment of pasture-based dairy farms/ Detecção de Listeria spp. em gados leiteiros no meio ambiente com base na pastagem,16.520445,-1.2179568,2018,,"Kirenga, B. J.; Byakika-Kibwika, P.",Lancet,459,1
495852,495852,495852,"Javier Padilla Bernáldez. ¿A quién vamos a dejar morir? Sanidad pública, crisis y la importancia de lo político. Madrid: Capitán Swing;2019. 176 p. ISBN: 9788412064421",16.623398,-1.2581179,2020,"There is increasing interest in wastewater-based epidemiology (WBE) of SARS-CoV-2 RNA to serve as an early warning system for a community. Despite successful detection of SARS-CoV-2 RNA in wastewaters sampled from multiple locations, there is still no clear idea on the minimal number of cases in a community that are associated with a positive detection of the virus in wastewater. To address this knowledge gap, we sampled wastewaters from a septic tank (n = 57) and biological activated sludge tank (n = 52) located on-site of a hospital. The hospital is providing treatment for SARS-CoV-2 infected patients, with the number of hospitalized patients per day known. It was observed that depending on which nucleocapsid gene is targeted by means of RT-qPCR, a range of 253-409 positive cases out of 10,000 persons are required prior to detecting RNA SARS-CoV-2 in wastewater. There was a weak correlation between N1 and N2 gene abundances in wastewater with the number of hospitalized cases. This correlation was however not observed for N3 gene. The frequency of detecting N1 and N2 gene in wastewater was also higher than that for N3 gene. Furthermore, nucleocapsid genes of SARS-CoV-2 were detected at lower frequency in the partially treated wastewater than in the septic tank. In particular, N1 gene abundance was associated with water quality parameters such as total organic carbon and pH. In instances of positive detection, the average abundance of N1 and N3 genes in the activated sludge tank were reduced by 50 and 70% of the levels detected in septic tank, suggesting degradation of the SARS-CoV-2 gene fragments already occurring in the early stages of the wastewater treatment process.","Hong, Pei-Ying; Rachmadi, Andri Taruna; Mantilla-Calderon, David; Alkahtani, Mohsen; Bashawri, Yasir M; Al Qarni, Hamed; O039,; Reilly, Kathleen M; Zhou, Jianqiang",Environ Res,459,28
496071,496071,496071,"LAURENT SIMON: L'innovation, un instinct de survie ?",16.842216,-1.5576634,2020,,"Dimovska, Eleonora O F; Zelenski, Nicole A; Lindqvist, Ebba K",J. plast. reconstr. aesthet. surg,459,25
497469,497469,497469,Desafíos y aprendizajes para la promoción de la salud durante la pandemia de la COVID-19 en Chile. Un análisis de experiencias locales desde la salud colectiva,16.75357,-1.120582,2021,,"Venkatesh, Nisha; Paldus, Barbora; Lee, Melissa H; MacIsaac, Richard J; Jenkins, Alicia J; O039,; Neal, David N",J Diabetes Sci Technol,459,33
499599,499599,499599,Covid-19 Recomendaciones para la atención y cuidado de la salud de personas en contexto de encierro y sus trabajadores en el marco de la pandemia,16.8328,-1.3360487,2020,"SUMMARY: ""Never let a good crisis go to waste "" - Sir Winston Churchill The value of Canada's Kidney Paired Donation program to the population cannot be overstated Its greatest challenge as a national program, however, is the geographic separation of recipient and matched donor Representatives from every transplant program in the country have been working toward increased use of kidney shipping in order to diminish the disincentive of donor travel With transplantation program and travel restrictions in place to minimize the risk of coronavirus disease 2019 (COVID-19), the time to make a full transition from donor travel to the shipment of donor kidneys has clearly arrived","McGregor, T. B.; Sener, A.; Yetzer, K.; Gillrie, C.; Paraskevas, S.",Can J Surg,459,1
500116,500116,500116,Eficacia y eficiencia de un programa especial para la disminución de la lista de espera de cirugía bariátrica en un hospital terciario./ Eficacia y eficiencia de un programa especial para la disminución de la lista de espera de cirugía bariátrica en un hospital terciario./ Effectiveness and efficiency of a special program to reduce the bariatric surgery waiting list at a tertiary hospital,16.554588,-1.4264357,2020,"The respiratory disease caused by the coronavirus SARS-CoV-2 (COVID-19) is a pandemic that produces a large number of simultaneous patients with severe symptoms and in need of special hospital care, overloading the infrastructure of health services. All of these demands generate the need to ration equipment and interventions. Faced with this imbalance, how, when, and who decides, there is the impact of the stressful systems of professionals who are at the front line of care and, in the background, issues inherent to human subjectivity. Along this path, the idea of using artificial intelligence algorithms to replace health professionals in the decision-making process also arises. In this context, there is the ethical question of how to manage the demands produced by the pandemic. The objective of this work is to reflect, from the point of view of medical ethics, on the basic principles of the choices made by the health teams, during the COVID-19 pandemic, whose resources are scarce and decisions cause anguish and restlessness. The ethical values for the rationing of health resources in an epidemic must converge to some proposals based on fundamental values such as maximizing the benefits produced by scarce resources, treating people equally, promoting and recommending instrumental values, giving priority to critical situations. Naturally, different judgments will occur in different circumstances, but transparency is essential to ensure public trust. In this way, it is possible to develop prioritization guidelines using well-defined values and ethical recommendations to achieve fair resource allocation.","Neves, Nedy M B C; Bitencourt, Flávia B C S N; Bitencourt, Almir G V",Rev Assoc Med Bras (1992),459,30
500460,500460,500460,Covid-19: Drug shortage and surgery. Anticipating the threat Press release of the French National Academy of Medicine and the National Academy of Surgery,16.437075,-1.4031731,2020,"BACKGROUND: Communicating scientific uncertainty about public health threats such as COVID-19 is an ethically desirable task endorsed by expert guidelines on crisis communication. However, the communication of scientific uncertainty is challenging because of its potential to promote ambiguity aversion-a well-described syndrome of negative psychological responses consisting of heightened risk perceptions, emotional distress, and decision avoidance. Communication strategies that can inform the public about scientific uncertainty while mitigating ambiguity aversion are a critical unmet need. OBJECTIVE: This study aimed to evaluate whether an ""uncertainty-normalizing"" communication strategy-aimed at reinforcing the expected nature of scientific uncertainty about the COVID-19 pandemic-can reduce ambiguity aversion, and to compare its effectiveness to conventional public communication strategies aimed at promoting hope and prosocial values. METHODS: In an online factorial experiment conducted from May to June 2020, a national sample of 1497 US adults read one of five versions of an informational message describing the nature, transmission, prevention, and treatment of COVID-19; the versions varied in level of expressed scientific uncertainty and supplemental focus (ie, uncertainty-normalizing, hope-promoting, and prosocial). Participants then completed measures of cognitive, emotional, and behavioral manifestations of ambiguity aversion (ie, perceived likelihood of getting COVID-19, COVID-19 worry, and intentions for COVID-19 risk-reducing behaviors and vaccination). Analyses assessed (1) the extent to which communicating uncertainty produced ambiguity-averse psychological responses; (2) the comparative effectiveness of uncertainty-normalizing, hope-promoting, and prosocial communication strategies in reducing ambiguity-averse responses; and (3) potential moderators of the effects of alternative uncertainty communication strategies. RESULTS: The communication of scientific uncertainty about the COVID-19 pandemic increased perceived likelihood of getting COVID-19 and worry about COVID-19, consistent with ambiguity aversion. However, it did not affect intentions for risk-reducing behaviors or vaccination. The uncertainty-normalizing strategy reduced these aversive effects of communicating scientific uncertainty, resulting in levels of both perceived likelihood of getting COVID-19 and worry about COVID-19 that did not differ from the control message that did not communicate uncertainty. In contrast, the hope-promoting and prosocial strategies did not decrease ambiguity-averse responses to scientific uncertainty. Age and political affiliation, respectively, moderated the effects of uncertainty communication strategies on intentions for COVID-19 risk-reducing behaviors and worry about COVID-19. CONCLUSIONS: Communicating scientific uncertainty about the COVID-19 pandemic produces ambiguity-averse cognitive and emotional, but not behavioral, responses among the general public, and an uncertainty-normalizing communication strategy reduces these responses. Normalizing uncertainty may be an effective strategy for mitigating ambiguity aversion in crisis communication efforts. More research is needed to test uncertainty-normalizing communication strategies and to elucidate the factors that moderate their effectiveness.","Han, Paul K J; Scharnetzki, Elizabeth; Scherer, Aaron M; Thorpe, Alistair; Lary, Christine; Waterston, Leo B; Fagerlin, Angela; Dieckmann, Nathan F",J Med Internet Res,459,29
500976,500976,500976,What are you hungry for? Artistic experience as an essential element of the city,16.903528,-1.181087,2020,"Nasogastric tubes are used frequently in surgical patients for bowel decompression, provision of enteral nutritional support and preventing aspiration of gastric contents. There is no conclusive research into the risk of COVID-19 transmission associated with nasogastric tube insertion, although evidence from the severe acute respiratory syndrome outbreak appears to suggest that there is no increased risk of transmission. However, close contact with a COVID-19 patient, especially those displaying respiratory symptoms, is likely to increase the risk of transmission. Nasogastric tube insertion requires increased time spent at a patient's bedside and can also cause pharyngeal irritation, resulting in coughing. In addition, the nasogastric tube can expose the healthcare worker to potentially infectious saliva. Therefore, there is a clear need for increased evidence regarding the risk of transmission associated with nasogastric tube insertion, to ensure that such risks can be mitigated.","Sturrock, Beattie Rh; Fanning, Sinead J; Khan, Mansoor; Sajid, Muhammad S",Br J Hosp Med (Lond),459,16
501229,501229,501229,[Bartonella henselae with atypical infection and neuroretinitis in a pediatric unit: report of three cases]./ Infección atípica y neurorretinitis por Bartonella henselae en una unidad de hospitalización pediátrica: comunicación de tres casos,16.814232,-1.3906058,2020,,"Martin, Erika G; Birkhead, Guthrie S; Holtgrave, David R",J Public Health Manag Pract,459,1
502102,502102,502102,Passage du tocilizumab ou de l'abatacept de la forme intraveineuse vers la voie sous-cutanée pendant la pandémie de COVID-19 : expérience française,16.561771,-1.5271041,2021,"In most of the recent research on emulsions related to food products containing protein-polysaccharide interactions established via the Maillard reaction have been used as emulsifiers. Key challenges in such studies include long reaction times, uncontrollable extent of reaction, and protein denaturation and aggregation. The living cell is inherently crowded molecularly with biomacromolecules, occupying 20-40% of the total volume. In this study, to mimic cellular crowding conditions, we have used polyethylene glycol as a chemical crowding agent. The degree of glycation and the results of sodium dodecyl sulfate-polyacrylamide gel electrophoresis (SDS-PAGE) indicated that a crowding environment triggers glycosylation and that the glycosylation degree gradually increases (pâ¯<â¯0.05) with increasing PEG concentration, which shortens the reaction time. The surface hydrophobicity of soybean protein isolate (SPI) significant decreased (pâ¯<â¯0.05), and the protein structure gradually unfolded from a helix to a random coil to prevent aggregation of SPI in the crowded environment. The solubility and the emulsifying and antioxidant properties improved upon adding the crowding reagent PEG. The chemical, freeze-thaw, and thermal stabilities of the nanoemulsion-stabilized SPI-dextran conjugate improved with increasing PEG concentration. However, the crowding environment had no effect on the salt stability of nanoemulsions.","Hu, Miao; Liu, Guannan; Du, Xiaoqian; Zhang, Xiaoying; Qi, Baokun; Li, Yang",Int. j. biol. macromol,459,20
503937,503937,503937,Evidence-informed interventions and best practices for supporting women experiencing or at risk of homelessness: a scoping review with gender and equity analysis./ Interventions fondées sur des données probantes et pratiques exemplaires en matière de soutien apporté aux femmes en situation ou à risque d'itinérance : examen de la portée avec analyse fondée sur le sexe et l'équité,16.41276,-1.301503,2021,,"Meshram, P.",Clin Orthop Relat Res,459,1
504061,504061,504061,Percepción de los usuarios de la farmacia comunitaria sobre la COVID-19,16.50986,-1.3545243,2020,"The emergence and widespread circulation of SARS-CoV-2 variants of concern (VOC) or interest (VOI) imposes an enhanced threat to global public health. In Brazil, one of the countries most severely impacted throughout the pandemic, a complex dynamics involving variants co-circulation and turnover events has been recorded with the emergence and spread of VOC Gamma in Manaus in late 2020. In this context, we present a genomic epidemiology investigation based on samples collected between December 2020 and May 2021 in the second major Brazilian metropolis, Rio de Janeiro. By sequencing 244 novel genomes through all epidemiological weeks in this period, we were able to document the introduction and rapid dissemination of VOC Gamma in the city, driving the rise of the third local epidemic wave. Molecular clock analysis indicates this variant has circulated locally since the first weeks of 2021 and only seven weeks were necessary for it to achieve a frequency above 70%, consistent with rates of growth observed in Manaus and other states. Moreover, a Bayesian phylogeographic reconstruction indicates VOC Gamma spread throughout Brazil between December 2020 and January 2021, and that it was introduced in Rio de Janeiro through at least 13 events coming from nearly all regions of the country. Comparative analysis of RT-qPCR cycle threshold (Ct) values provides further evidence that VOC Gamma induces higher viral loads (N1 target; mean reduction of Ct: 2.7, 95% CI = {+/-}0.7). This analysis corroborates the previously proposed mechanistic basis for this variant enhanced transmissibility and distinguished epidemiological behavior. Our results document the evolution of VOC Gamma and provide independent assessment of scenarios previously studied in Manaus, therefore contributing to the better understanding of the epidemiological dynamics currently being surveyed in other Brazilian regions.","Moreira, Filipe Romero Rebello; D039, Mirela; arc,; Mariani, Diana; Herlinger, Alice Laschuk; Schiffler, Francine Bittencourt; Rossi, Atila Duque; Leitao, Isabela de Carvalho; Miranda, Thamiris dos Santos; Cosentino, Matheus Augusto Calvano; Torres, Marcelo Calado de Paula; Costa, Raissa Mirella dos Santos Cunha da; Goncalves, Cassia Cristina Alves; Faffe, Debora Souza; Galiez, Rafael de Mello; Ferreira, Orlando Costa; Aguiar, Renato Santana; Santos, Andre Felipe Andrade dos; Voloch, Carolina Moreira; Castineiras, Terezinha Marta Pereira Pinto; Tanuri, Amilcar; Workgroup, - COVID-19-UFRJ",,459,24
506265,506265,506265,European leaders unmasked: Covid-19 communication strategy through Twitter,16.526777,-1.0960863,2020,,"Stoj, Victoria J; Grant-Kels, Jane M",J Am Acad Dermatol,459,10
506570,506570,506570,Prediction de la severite de la COVID-19 par les biomarqueurs du syndrome de relargage cytokinique au sein d'une population de transplantes renaux,16.596016,-1.210914,2020,,"Mahase, Elisabeth",BMJ,459,1
507154,507154,507154,Charges virales de l'Epstein-Barr Virus (EBV) et du Torque-Teno Virus (TTV) : des marqueurs d'immunodépression associés aux formes graves de COVID-19 ?,16.633873,-1.2510148,2021,,"Chin, Kazuo",Sleep Biol Rhythms,459,10
508810,508810,508810,"Validación de escala de cambios en los estilos de vida durante el periodo de cuarentena en una población de estudiantes universitarios de Lima, Perú/ Validation of scale of changes in lifestyles during the quarantine period in a population of university students from Lima, Peru",16.862638,-1.2170485,2020,"The COVID-19 pandemic has dramatically changed how education is delivered worldwide The resultant rise of e-learning, whereby teaching is undertaken remotely and on digital platforms, has extensively impacted universities and other higher education organizations around the world One approach to support this change in education delivery is the use of virtual simulation approaches Our team at SimXSpace has piloted a virtual workshop using Zoom, an online video-conferencing platform, and virtual simulated persons (SPs) to support communication and interpersonal skills among learners The main objective of the pilot virtual workshop was to develop and implement the SP methodology remotely via the Zoom platform (Zoom Video Communications, San Jose, California) and to evaluate its effectiveness as an immersive environment for simulation The virtual workshop involved four instructors who intend to implement virtual SPs within their courses, two workshop facilitators, and two SPs The workshop was conducted synchronously using Zoom features The workshop followed a predefined structure and was completed as planned Outcomes suggest that remote simulation delivery using virtual SPs and delivered online via Zoom is feasible and provides an effective environment in which to conduct SP methodology to teach communication and interpersonal skills The findings suggest that remote simulation and virtual SPs can support experiential education and provide an effective and engaging learning environment The virtual workshop was successful and laid a foundation for future online training programs for the use of SP methodology Moreover, it formed an effective outline for subsequent iterations of this virtual training workshop and prompted discussion of plans for future workshops with various programs across a pan-university context","Peisachovich, Eva; Da Silva, Celina; Penhearow, Nathaniel J.; Sombilon, Elizabeth V.; Koh, Marianne",Cureus,459,10
