,title_x,publish_time_x,abstract,authors,journal,url,category
355633,What Is the Effect of COVID-19-Related Social Distancing on Oral and Maxillofacial Trauma?,2020,"Morocco is a North African lower middle income country; home to the oldest University in the world, where the first identifiable medical degree was issued. Medical Education in Morocco is provided through 10 Medical Schools offering each year around 3200 new places in the first year of medical studies. It is facing many challenges in both its undergraduate and postgraduate programs that need to be addressed urgently through the currently debated national reform of medical studies.","Fourtassi, Maryam; Abda, Naima; Bentata, Yassamine; Hajjioui, Abderrazak",Med Teach,,557
356485,COVID-19 Is Infecting Our Clinical Acumen,2020,"The aim of our study was to evaluate all-cause mortality risk in patients with laboratory-confirmed COVID-19 in Mexico City treated with repurposed antivirals and antibiotics This real-world retrospective cohort study contemplated 395,343 patients evaluated for suspected COVID-19 between February 24 and September 14, 2020 in 688 primary-to-tertiary medical units in Mexico City Patients were included with a positive RT-PCR for SARS-CoV-2;those receiving unspecified antivirals, excluded;and groups of antivirals prescribed in 2 days) use of antivirals on mortality in a sub-cohort of patients Multivariable adjustment, propensity score matching, generalized estimating equations, and calculation of E-values were performed to limit confounding 136,855 patients were analyzed;mean age 44 2 (SD:16 8) years;51 3 % were men 16 6 % received antivirals (3 %), antibiotics (10 %), or both (3 6 %) Antivirals studied were Oseltamivir (n=8414), Amantadine (n=319), Lopinavir-Ritonavir (n=100), Rimantadine (n=61), Zanamivir (n=39), and Acyclovir (n=36) Survival with antivirals (73 7 %, p&lt;0 0001) and antibiotics (85 8 %, p&lt;0 0001) was lower than no antiviral/antibiotic (93 6 %) After multivariable adjustment, increased risk of death occurred with antivirals (HR=1 72, 95 % CI: 1 61-1 84) in ambulatory (HR=4 7, 95 % CI: 3 94-5 62) and non-critical (HR=2 03, 95 % CI: 1 86-2 21) patients Oseltamivir increased mortality risk in the general population (HR=1 72, 95 % CI: 1 61-1 84), ambulatory (HR=4 79, 95 % CI: 4 01-5 75), non-critical (HR=2 05, 95 % CI: 1 88-2 23), and pregnancy (HR=8 35, 95 % CI: 1 77-39 30);as well as hospitalized (HR=1 13, 95 % CI: 1 01-1 26) and critical patients (HR=1 22, 95 % CI: 1 05-1 43) after propensity score-matching Early versus late oseltamivir did not modify the risk Antibiotics were a risk factor in general population (HR=1 13, 95 % CI: 1 08-1 19) and pediatrics (HR=4 22, 95 % CI: 2 01-8 86), but a protective factor in hospitalized (HR=0 81, 95 % CI: 0 77-0 86) and critical patients (HR=0 67, 95 % CI: 0 63-0 72) No significant benefit for repurposed antivirals was observed;oseltamivir was associated with increased mortality Antibiotics increased mortality risk in the general population but may increase survival in hospitalized and critical patients","Mancilla-Galindo, J.; Garcia-Mendez, J. O.; Marquez-Sanchez, J.; Reyes-Casarrubias, R. E.; Aguirre-Aguilar, E.; Rocha-Gonzalez, H. I.; Kammar-Garcia, A.",Excli Journal,,557
356614,"Contact Tracing and the COVID-19 Response in Africa: Best Practices, Key Challenges, and Lessons Learned from Nigeria, Rwanda, South Africa, and Uganda",2021,"This article defines the prevention measures for SARS-CoV-2 with the objective of reducing and controlling the transmission of this agent to guarantee the safety of the : patient, family and health personnel","Guadalupe Hernandez-Orozco, Hilda; Arias-de la Garza, Eduardo",Acta Pediatrica De Mexico,,557
357336,Association of COVID-19 Outbreak with Changes in Physical Activity Among Adults with Elevated Risk for Major Adverse Cardiovascular Events,2021,"The risk for severe illness and mortality from COVID-19 significantly increases with age As a result, age-stratified modeling for COVID-19 dynamics is the key to study how to reduce hospitalizations and mortality from COVID-19 By taking advantage of network theory, we develop an age-stratified epidemic model for COVID-19 in complex contact networks Specifically, we present an extension of standard SEIR (susceptible-exposed-infectious-removed) compart-mental model, called age-stratified SEAHIR (susceptible-exposed-asymptomatic-hospitalized-infectious-removed) model, to capture the spread of COVID-19 over multitype random networks with general degree distributions We derive several key epidemiological metrics and then propose an age-stratified vaccination strategy to decrease the mortality and hospitalizations Through extensive study, we discover that the outcome of vaccination prioritization depends on the reproduction number R0 Specifically, the elderly should be prioritized only when R0 is relatively high If ongoing intervention policies, such as universal masking, could suppress R0 at a relatively low level, prioritizing the high-transmission age group (i e , adults aged 20-39) is most effective to reduce both mortality and hospitalizations These conclusions provide useful recommendations for age-based vaccination pri-oritization for COVID-19 IEEE","Chen, X.; Zhu, G.; Zhang, L.; Fang, Y.; Guo, L.",IEEE Transactions on Network Science and Engineering,,557
362001,COVID-19 Mitigation Steps Provide a Blueprint for Malaria Control and Elimination,2020,"The COVID-19 pandemic has developed to be more than a bio-crisis as global news has reported a sharp rise in xenophobia and discrimination in both online and offline communities. Such toxic behaviors take a heavy toll on society, especially during these daunting times. Despite the gravity of the issue, very few studies have studied online antisocial behaviors amid the COVID-19 pandemic. In this paper, we fill the research gap by collecting and annotating a large dataset of over 40 million COVID-19 related tweets. Specially, we propose an annotation framework to annotate the antisocial behavior tweets automatically. We also conduct an empirical analysis of our annotated dataset and found that new abusive lexicons are introduced amid the COVID-19 pandemic. Our study also identified the vulnerable targets of antisocial behaviors and the factors that influence the spreading of online antisocial content.","Awal, Md Rabiul; Cao, Rui; Mitrovic, Sandra; Lee, Roy Ka-Wei",,https://arxiv.org/pdf/2007.10712v1.pdf,557
362576,Are chilblain-like acral skin lesions really indicative of COVID-19? A prospective study and literature review,2020,"Summary Background & Aims The worldwide outbreak of the coronavirus disease 2019 (COVID-19) has already caused a substantial public health burden Increasing numbers of studies linked obesity to more severe COVID-19 consequence and mortality, challenging health systems worldwide, especially in emerging countries like Brazil Herein, we aimed to search the literature and present the current intersection between obesity and COVID‐19 in the Brazilian population Methods One hundred twenty-five articles were initially searched after duplicate removal, and nine were finally included in our analysis Results Our findings emphasized the magnitude of COVID-19 infection in Brazil and the impact of obesity as a risk factor that aggravates the prognosis of outpatients or hospitalized patients We also demonstrated social aspects of COVID-19 that could act enhancing the obesity condition in Latin American countries Conclusions A more careful look at the available data could help to understand better the dynamic between obesity and COVID‐19, focusing on the Brazilian population and could eventually guide management strategies and therapies for COVID‐19 in the future","Pinhel, Marcela A. S.; Watanabe, Ligia M.; Noronha, Natalia Y.; Junior, Wilson S.; Nonino, Carla B.",Clinical Nutrition ESPEN,,557
362604,An inquiry into COVID-19 is needed now,2021,"Strict social distancing rules are being implemented to stop the spread of COVID-19 pandemic in many cities globally, causing a sudden and extreme change in the transport activities This offers a unique opportunity to assess the effect of anthropogenic activities on air quality and provides a valuable reference to the policymakers in developing air quality control measures and projecting their effectiveness In this study, we evaluated the effect of the COVID-19 lockdown on the roadside and ambient air quality in Hong Kong, China, by comparing the air quality monitoring data collected in January-April 2020 with those in 2017-2019 The results showed that the roadside and ambient NO2, PM10, PM2 5, CO and SO2 were generally reduced in 2020 when comparing with the historical data in 2017-2019, while O3 was increased However, the reductions during COVID-19 period (i e , February-April) were not always higher than that during pre-COVID-19 period (i e , January) In addition, there were large seasonal variations in the monthly mean pollutant concentrations in every year This study implies that one air pollution control measure may not generate obvious immediate improvements in the air quality monitoring data and its effectiveness should be evaluated carefully to eliminate the effect of seasonal variations © 2020 by the authors","Huang, Y.; Zhou, J. L.; Yu, Y.; Mok, W. C.; Lee, C. F. C.; Yam, Y. S.",Atmosphere,,557
362805,Estimated glucose disposal rate demographics and clinical characteristics of young adults with type 1 diabetes mellitus: A cross-sectional pilot study,2020,"BACKGROUND: Hundreds of variants associated with atopic dermatitis (AD) and psoriasis, two common inflammatory skin disorders, have previously been discovered through genome-wide association studies (GWAS). The majority of these variants are in non-coding regions and their target genes remain largely unclear. OBJECTIVE: We sought to understand the effects of these non-coding variants on the development of AD and psoriasis by linking them to the genes they regulate. METHODS: We constructed genomic 3D maps of human keratinocytes during differentiation using capture Hi-C targeting more >20, 000 promoters and 214 GWAS variants and combined this with transcriptome and epigenomic datasets. We validated our results with reporter assays, CRISPR activation and examination of patient gene expression from previous studies. RESULTS: We identified 118 target genes of 82 AD and psoriasis GWAS-variants. Differential expression of 49% (58) of the 118 target genes occurred in either AD or psoriatic lesions, many of which were not previously linked to any skin disease. We highlight AFG1L, CLINT1, ADO, LINC00302, and RP1-140J1.1 genes and provide further evidence for their potential roles in AD and psoriasis. CONCLUSIONS: Our work focuses on skin barrier pathology through investigation of the interaction profile of GWAS-variants during keratinocyte differentiation. We provide a catalogue of candidate genes that could modulate the risk of AD and psoriasis. Given that only 35% of the target genes are the nearest gene to the known GWAS variants, we expect that our work will contribute to the discovery of novel pathways involved in AD and psoriasis.","Sahlén, Pelin; Spalinskas, Rapolas; Asad, Samina; Mahapatra, Kunal Das; Höjer, Pontus; Anil, Anandashankar; Eisfeldt, Jesper; Srivastava, Ankit; Nikamo, Pernilla; Mukherjee, Anaya; Kim, Kyu-Han; Bergman, Otto; Ståhle, Mona; Sonkoly, Enikö; Pivarcsi, Andor; Wahlgren, Carl-Fredrik; Nordenskjöld, Magnus; Taylan, Fulya; Bradley, Maria; Tapia-Páez, Isabel",J. allergy clin. immunol,,557
364443,A Single-centre Study of COVID-19 Antibody,2021,,"Yi, Stephanie G; Knight, Richard J; Graviss, Edward A; Nguyen, Duc T; Ghobrial, R Mark; Gaber, A Osama; Huang, Howard J",Transplantation,,557
364656,COVID-19 and Fake News in the Dominican Republic,2020,,"Baigrie, Brian; Mercuri, Mathew",J Eval Clin Pract,,557
364657,COVID-19 and Fake News in the Dominican Republic,2020,"BackgroundCamps of forcibly displaced populations are considered to be at risk of large COVID-19 outbreaks. Low screening rates and limited surveillance led us to conduct a study in Dagahaley camp, located in the Dadaab refugee complex in Kenya to estimate SARS-COV-2 seroprevalence and, mortality and to identify changes in access to care during the pandemic. MethodsTo estimate seroprevalence, we conducted a cross-sectional survey among a sample of individuals (n=587) seeking care at the two main health centres and among all household members (n=619) of community health workers and traditional birth attendants working in the camp. We used a rapid immunologic assay (BIOSYNEX(R) COVID-19 BSS [IgG/IgM]) and adjusted for test performance and mismatch between the sampled population and that of the general camp population. To estimate mortality, we exhaustively interviewed all households (n=12860) in the camp about deaths occurring from January 2019 through March 2021. ResultsWe included 1206 participants in the seroprevalence study. In total, 8% (95% CI: 6.6%-9.7%) had a positive serologic test. After adjusting for test performance and standardizing on age, we estimated a seroprevalence of 5.8% (95% CI: 1.6%-8.4%). The mortality rate for 10,000 persons per day was 0.05 (95% CI 0.05-0.06) prior to the pandemic and 0.07 (95% CI 0.06-0.08) during the pandemic, representing a significant 42% increase (p<0.001). MSF health centre consultations and hospital admissions decreased by 38% and 37% respectively. ConclusionWe estimated that the number of infected people was 67 times higher than the number of reported cases. Participants aged 50 years or more where among the most affected. The mortality survey shows an increase in the mortality rate during the pandemic compared to before the pandemic. A decline in attendance at health facilities was observed and sustained despite the easing of restrictions. Summary BoxO_ST_ABSWhat is already known?C_ST_ABSO_LIAt the early stage of the COVID-19 pandemic, models predicted the risk of a large-scale COVID-19 outbreaks in camps of forcibly displaced populations that would have created excess mortality caused directly by the disease and indirectly by reduced access to care and/or congestion in health facilities. C_LIO_LITo date, this prediction has not materialized in most camps, the lower than expected number of cases and deaths could be attributed to a population characteristics and early implementation of confinement; alternatively, it could be an underestimate caused by limited screening and testing capacity and lack of morbidity and mortality surveillance. C_LIO_LIThe actual impact of COVID-19 on these populations therefore remains an open question. C_LI What are the new findings?O_LIIn Dagahaley camps in Kenya, we estimated that the number of infected people was 67 times higher than the number of reported cases. C_LIO_LIParticipants aged 50 years and over, who are most at risk of severe illness, were among the most affected. C_LIO_LIWe observed an increase in mortality rates during the pandemic, and a decrease in the use of health facilities, which continued despite the easing of restrictions, but access for severe cases was less impacted. C_LI What do the new findings imply?O_LITo our knowledge, this is the first combined survey of COVID-19 seroprevalence and retrospective mortality in a forcibly displaced population living in a camp. C_LIO_LIDespite mitigation measures, the virus has circulated, which should prompt rapid vaccination as most of the population remains susceptible; the collateral effects of the pandemic on access to care must be addressed and public confidence restored in order to limit the risk of excess mortality. C_LIO_LIThe varying situations of forcibly displaced populations living in camps around the world support the need for further research at other sites. C_LI","GIGNOUX, Etienne; ATHANASSIADIS, Frida; YARROW, Ahmed GARAT; JIMALE, Abdullahi; MUBUTO, Nicole; DÉGLISE, Carole; MOSOTI, Denis ONSONGO; AZMAN, Andrew S; MWAU, Matilu; LUQUERO, Francisco; CIGLENECKI, Iza",,,557
365518,"Americans' COVID-19 Stress, Coping, and Adherence to CDC Guidelines",2020,,"Trousil, Jirí; Aryal, Santosh; Fuhrmann, Gregor",Nanomedicine (Lond),,557
366216,Methodological Considerations for Modeling Social Vulnerability and COVID-19 Risk-Response to Nayak et al,2021,"Recent advancements in computational power and algorithms have enabled unabridged data (e.g., raw images or audio) to be used as input in some models (e.g., deep learning). However, the black box nature of such models reduces their likelihood of adoption by marketing scholars. Our paradigm of analysis, the Transparent Model of Unabridged Data (TMUD), enables researchers to investigate the inner workings of such black box models by incorporating an ex ante filtration module and an ex post experimentation module. We empirically demonstrate the TMUD by investigating the role of facial components and sexual dimorphism in face perceptions, which have implications for four marketing contexts: advertisement (perceptions of approachability, trustworthiness, and competence), brand (perceptions of whether a face represents a brand's typical customer), category (perceptions of whether a face represents a category's typical customer), and customer persona (perceptions of whether a face represents the persona of a brand's customer segment). Our results reveal new and useful findings that enrich the existing literature on face perception, most of which is based on abridged attributes (e.g., width of mouth). The TMUD has great potential to be a useful paradigm for generating theoretical insights and may encourage more marketing researchers and practitioners to use unabridged data.","Xu, Jie; Ding, Min",,https://arxiv.org/pdf/2106.07558v1.pdf,557
367333,COVID-19 Inequities Across Multiple Racial and Ethnic Groups: Results From an Integrated Health Care Organization,2021,"The role of hydroxychloroquine to prevent hACE2 from interacting with SARS-CoV-2 Spike protein is unveiled Artemisinin & derived compounds entangle better than hydroxychloroquine into Lys353 and Lys31 binding hotspots of the virus Spike protein, therefore preventing infection occurs Since these molecules are effective antivirals with excellent safety track records, their potential repurposing is recommended for clinical trials of COVID-19 patients","Moussa, Sehailia Smain chemat",,,557
367394,More Than a Statistic: a Qualitative Study of COVID-19 Treatment and Prevention Optimization for Black Americans,2020,,"Flahault, A.","Lancet (London, England)",,557
367477,Minding the Gap: Organizational Strategies to Promote Gender Equity in Academic Medicine During the COVID-19 Pandemic,2020,"OBJECTIVE: The novel coronavirus SARS-CoV-2 (COVID-19) pandemic has posed significant changes to physician workflow and healthcare delivery. This national survey investigated the impact of the pandemic on burnout and career satisfaction among U.S. attending neurosurgeons. METHODS: A 24-question survey was sent electronically to all American Association of Neurological Surgeons (AANS) attending members. The abbreviated Maslach Burnout Inventory (aMBI) was used to measure the following burnout and career satisfaction indices: emotional exhaustion, depersonalization, and personal accomplishment. Bivariate analyses were conducted and multivariate analyses were performed using logistic regression models. RESULTS: 407 attending neurosurgeons were included in the present study, with an overall response rate of 17.7 %. The majority of respondents were male (88.7 %), White (84.3 %), and in practice for 15 years or more (64.6 %). The majority reported a decrease in work hours due to the pandemic (82.6 %), uncertainty about future earnings (80.3 %), and uncertainty regarding future healthcare reform (84.5 %). Burnout was identified in 83 (20.4 %) respondents, whereas career satisfaction was identified in 316 (77.6 %) respondents. Rate of burnout was decreased when compared to rates reported in the pre-COVID era. In multivariate analysis, burnout was associated with working in a hostile or difficult environment since the rise of COVID-19 (OR = 2.534, p = 0.008), not having children (OR = 3.294, p = 0.011), being in practice for 5-15 years (vs. < 5 years) (OR = 4.568, p = 0.014), spending increased time conducting non-neurosurgical medical care due to COVID-19 (OR = 2.362, p = 0.019), feeling uncertain about future earnings due to COVID-19 (OR = 4.031, p = 0.035), and choosing not to pursue or feeling uncertain about pursuing neurosurgery again if given the choice (OR = 7.492, p < 0.001). Career satisfaction was associated with cerebrovascular subspecialty training (OR = 2.614, p = 0.046) and a willingness to pursue neurosurgery again if given the choice (OR = 2.962, p < 0.001). CONCLUSION: Factors related to the novel COVID-19 pandemic have contributed to changes in workflow among U.S. attending neurosurgeons. Despite these changes, we report decreased burnout and high career satisfaction among U.S. neurosurgeons. Understanding modifiable stressors among neurosurgeons during the pandemic may help to identify effective future interventions to mitigate burnout and improve career satisfaction.","Khalafallah, Adham M; Lam, Shravika; Gami, Abhishek; Dornbos, David L; Sivakumar, Walavan; Johnson, Jeremiah N; Mukherjee, Debraj",Clin Neurol Neurosurg,,557
369202,Impact of COVID-19 epidemic on maxillofacial surgery in Italy,2020,"Late 2019 witnessed the appearance of coronavirus disease 2019 (COVID-19) outbreak triggered by a new coronavirus, Severe Acute Respiratory Syndrome Coronavirus 2 (SARS-CoV-2). SARS-CoV-2 spread across China from Wuhan and has been circulated to a broader variety of countries. Seeing that COVID-19 has caused tremendous human casualties posing a global danger, an awareness of the current situation and the strategies to curtail the spread of the virus are desperately required. As the most natural way to preserve public wellbeing, preventive and therapeutic vaccinations must have essential roles. Large organizations and companies have started implementing SARS-CoV-2 preventive vaccinations. Hence, in this study, we aimed to update the vaccine evolution for SARS-CoV-2.","Duc Ha, Hoang; Minh Duc, Nguyen; Minh Thong, Pham",Electro. J. Gen. Med.,,557
370338,"36 Feasibility, acceptability, and impact of a computer-guided growth mindset single-session intervention for children and young people with chronic illness: a mixed methods study",2020,"This article takes a condensed look at the impact that SARS-CoV-2 has had on the work-life balance of women engineers across the world in industry, military and academia The same impact has been felt by all women, not only in science, as it is this gender status that inevitably ties women together, facing the same challenges, and cannot be separated by category of employment, or lack thereof Studies from around the world give us insight into how the pandemic has instigated changes and influenced choices made between work and domestic demands Globally, women are burdened with challenges that may compromise their progression in male-dominated fields, such as engineering Taking a glimpse at this issue for women through an international lens, we identify potential human factors methods to respond to this global problem, offering tools and forewarnings for improving our efforts in designing for, and maintaining equilibrium for women in engineering, technology, academia, and beyond © 2021 Wiley Periodicals LLC","Gulotta, C. J.; Madeira-Revell, K.; Fendley, M. E.",Human Factors and Ergonomics In Manufacturing,,557
371888,Responsibility of Medical Journals in Addressing Racism in Health Care,2020,"BACKGROUND: According to the recommendation of the Centers for Disease Control and Prevention (CDC), getting influenza vaccines during the coronavirus (COVID-19) pandemics is especially important for people with certain underlying medical conditions, like cancer. Due to the similarities between the symptoms of influenza and COVID-19, receiving the flu vaccine in suspicious cases can be helpful because it will make it easier to request a medical test and diagnosis. In this study, the value of influenza vaccination in the cancer population was investigated. METHODS: In a cross-sectional study, all cancer patients who were referred to our clinic and had eligibility to receive the flu vaccine were included in our study for following up clinical signs every week for one month. All patients who were vaccinated from October 1 to November 15, 2020 were investigated. The most side effects that were followed were fever, runny nose, bone pain, and life-threatening or persistent adverse effects. RESULTS: From a total of 288 patients (median age: 52 years (range 18-79), 112 (38.9%) males and 176 (61.1%) female) with different types of cancers, only two patients had an adverse effect of vaccination (including bone pain, runny nose, and fatigue), and one had COVID-19 ten days after vaccination. The rest of the patients did not show any side effects due to flu vaccination after one month of follow-up. Cancer patients are recommended to receive the flu vaccine annually during the pandemic and after the end of this pandemic, usually during the flu epidemic season to reduce mortality.","Aznab, Mozaffar; Eskandari Roozbahani, Narges; Moazen, Homa",Support. care cancer,,557
