,index,Unnamed: 0,title_x,x,y,publish_time_x,abstract,authors,journal,category,cluster
10541,10541,10541,'We are all awaiting our call to the frontline',23.285833,6.222903,2020-04-24,,"Landes, D. P.",Br Dent J,600,1
11919,11919,11919,Oncology patient support,23.230629,6.376872,2020-06-26,,,Br Dent J,600,1
11920,11920,11920,UDC highs and lows in Cornwall,23.233122,6.4062905,2020-06-26,,"Gallichan, N.; Heggie, C.; Lee, S.; Messahel, S.; Albadri, S.",Br Dent J,600,1
11931,11931,11931,' My training prepared me for far more than just clinical dentistry',23.439764,6.364527,2020-06-26,"BACKGROUND: The present study analyzed publishing data of scholarly journals which were published in 2018 by academic societies of science and technology in Korea to observe journal editing and publishing status. METHODS: A total of 346 regional journals (59 natural science, 118 engineering, 44 agriculture, fisheries, and oceanography, and 125 medical and pharmacy) and 141 international journals (32 natural science, 43 engineering, 12 agriculture, fisheries, and oceanography, 54 medical and pharmacy) were included in this analysis, which applied the journal review by the Korea Federation of Science and Technology. Websites of the journals and the submitted publication data in 2019 were reviewed. RESULTS: Except for a few journals, all of the journals were published by academic societies. Basic information of journals was well displayed by both offline and online. Most of the 346 regional journals were published in Korean language or mixed with English but 77 (22.3%), mostly medical, were in English. One-third (n = 104) journals published less than 40 articles while 9 published over 200, and 261 journals (75.4%) received less than 100 submissions in 2018. Most (n = 298, 86.1%) of them were enlisted in the Korean Citation Index (KCI). Editorial board members performed manuscript editing in 171 (49.4%) journals, and most of the journals paid < 50,000,000 won for publishing costs. Of 141 international journals, 138 (97.9%) were published in English and all of them published overseas submissions. Forty-one (29.1%) journals accepted < 20% of submissions but 58 (41.1%) accepted 100%. Of them, 124 (87.9%) were indexed in the KCI, 93 (66.0%) in the Web of Science, 120 in Scopus, and 62 in PubMed. Editorial board members in 38 (27.0%) journals took responsibility of manuscript editing. Publishing cost of 79 (56.0%) journals was < 50,000,000 won. Only 157 (32.2%) of total 487 journals, mostly medical, documented gendered innovation in their instruction to authors. CONCLUSION: Most of the Korean science and technology journals keep global standard of editing and publishing. Their offline and online visibility is acceptable but most regional journals are small and of low academic impact while international journals are globally indexed and acknowledged. Korean scholarly journals should invite more and better articles to keep quality publication.","Hong, Sung-Tae; Youn, Ho Shik",J Korean Med Sci,600,1
13209,13209,13209,Testing the limits of UDCs,23.302744,6.2015686,2020-10-09,,"Taylor, P.",Br Dent J,600,1
13213,13213,13213,Not entirely accurate,23.482145,6.3319745,2020-10-09,,"Izquierdo-Domínguez, Adriana; Rojas-Lechuga, María Jesús; Mullol, Joaquim; Alobid, Isam",Med Clin (Engl Ed),600,1
13381,13381,13381,Frugal solutions,23.45759,6.2697845,2020-10-23,"Paratuberculosis is an infectious disease of ruminants caused by Mycobacterium avium subsp. paratuberculosis (MAP). MAP is an intracellular pathogen with a possible zoonotic potential since it has been successfully isolated from the intestine and blood of Crohn’s disease patients.Since no cure is available, after the detection of the disease, animal culling is the sole applicable containment strategy. However, the difficult detection of the disease in its subclinical form, facilitates its spread raising the need for the development of effective diagnosis and vaccination strategies. The prompt identification and isolation of the infected animals in the subclinical stage would prevent the spread of the infection.In the present study, an immunoinformatic approach has been used to investigate the immunogenic properties of 10 MAP proteins. These proteins were chosen according to a previously published immunoproteomics approach. For each previously-described immunoreactive protein, we predicted the epitopes capable of eliciting an immune response by binding both B-cells and/or class I MHC antigens. The retrieved peptide sequences were analyzed for their specificity and cross-reactivity. The final aim is to employ the discovered peptides sequences as a filtered library useful for early-stage diagnosis and/or to be used in novel multi-subunit or recombinant vaccine formulations.","Tilocca, Bruno; Soggiu, Alessio; Greco, Viviana; Piras, Cristian; Arrigoni, Norma; Ricchi, Matteo; Britti, Domenico; Urbani, Andrea; Roncada, Paola",Pathogens,600,1
13848,13848,13848,Correction to: Povidone iodine gargle and mouthwash,23.402323,6.564267,2020-07-24,,"Carlezon, William A.",Neuropsychopharmacology,600,1
13938,13938,13938,Correction to: Restoring the unrestorable! Developing coronal tooth tissue with a minimally invasive surgical extrusion technique,23.354305,6.1550746,2019-10-25,,"Choudhry, H; Albukhari, A; Morotti, M; Haider, S; Moralli, D; Smythies, J; Schödel, J; Green, C M; Camps, C; Buffa, F; Ratcliffe, P; Ragoussis, J; Harris, A L; Mole, D R",Oncogene,600,1
14072,14072,14072,Exam appreciation,23.430246,6.2882705,2020-11-13,,"Islam, Sharif",Br Dent J,600,1
14079,14079,14079,PPE update,23.36661,6.2523117,2020-11-13,"The renin-angiotensin system (RAS) is a peptidic system known mainly for its roles in the maintenance of blood pressure and electrolyte and fluid homeostasis. However, several tissues and cells have been described to possess an intrinsic RAS that acts locally through different paracrine and autocrine mechanisms. In the male reproductive system, several components of this system have been observed in various organs and tissues, such as the testes, spermatozoa and seminal fluid. Some functions attributed to this local RAS are maintenance of seminal plasma electrolytes, regulation of steroidogenesis and spermatogenesis, and sperm functions. However, their specific actions in these locations are not fully understood. Therefore, a deep knowledge of the functions of the RAS at both the testicular and seminal levels could clarify its roles in male infertility and sperm physiology, and the different RAS elements could be used to design tools enabling the diagnosis and/or treatment of male infertility.","Gianzo, Marta; Subirán, Nerea",Int J Mol Sci,600,1
15368,15368,15368,Foundation dentists collaborating with community pharmacies,23.498466,6.3746524,2021-02-12,,"Osman, A.",Br Dent J,600,1
15378,15378,15378,Advice on consent,23.406055,6.177868,2021-02-12,"Discoveries of adaptive gene knockouts and widespread losses of complete genes have in recent years led to a major rethink of the early view that loss-of-function alleles are almost always deleterious. Today, surveys of population genomic diversity are revealing extensive loss-of-function and gene content variation, yet the adaptive significance of much of this variation remains unknown. Here we examine the evolutionary dynamics of adaptive loss of function through the lens of population genomics and consider the challenges and opportunities of studying adaptive loss-of-function alleles using population genetics models. We discuss how the theoretically expected existence of allelic heterogeneity, defined as multiple functionally analogous mutations at the same locus, has proven consistent with empirical evidence and why this impedes both the detection of selection and causal relationships with phenotypes. We then review technical progress towards new functionally explicit population genomic tools and genotype-phenotype methods to overcome these limitations. More broadly, we discuss how the challenges of studying adaptive loss of function highlight the value of classifying genomic variation in a way consistent with the functional concept of an allele from classical population genetics.","Monroe, J. Grey; McKay, John K.; Weigel, Detlef; Flood, Pádraic J.",Heredity (Edinb),600,1
15638,15638,15638,Fit testing troubles?,23.446712,6.3331428,2021-02-26,"Oxidative stress may be defined as an imbalance between reactive oxygen species (ROS) and the antioxidant system to counteract or detoxify these potentially damaging molecules. This phenomenon is a common feature of many human disorders, such as cardiovascular disease. Many of the risk factors, including smoking, hypertension, hypercholesterolemia, diabetes, and obesity, are associated with an increased risk of developing cardiovascular disease, involving an elevated oxidative stress burden (either due to enhanced ROS production or decreased antioxidant protection). There are many therapeutic options to treat oxidative stress-associated cardiovascular diseases. Numerous studies have focused on the utility of antioxidant supplementation. However, whether antioxidant supplementation has any preventive and/or therapeutic value in cardiovascular pathology is still a matter of debate. In this review, we provide a detailed description of oxidative stress biomarkers in several cardiovascular risk factors. We also discuss the clinical implications of the supplementation with several classes of antioxidants, and their potential role for protecting against cardiovascular risk factors.","Cammisotto, Vittoria; Nocella, Cristina; Bartimoccia, Simona; Sanguigni, Valerio; Francomano, Davide; Sciarretta, Sebastiano; Pastori, Daniele; Peruzzi, Mariangela; Cavarretta, Elena; D’Amico, Alessandra; Castellani, Valentina; Frati, Giacomo; Carnevale, Roberto; Group, SMiLe",Antioxidants (Basel),600,1
15642,15642,15642,Lest we forget the students,23.407566,6.3304644,2021-02-26,"Polyphenolic compounds, plant secondary metabolites essential for plant survival, are known for their high antioxidant and anti-inflammatory activity. In addition, several polyphenols, such as phloretin, also have potential antiviral effects, making these compounds potential ingredients of biofunctional foods. A promising source for the extraction of phloretin is a by-product of apple production—apple tree leaves. Focusing on green technologies, the first aim of the present study was to optimize the direct ultrasound-assisted extraction conditions to gain the maximum yield of phloretin from air-dried apple leaves. For the optimization of process parameters, we applied the response surface method with Box–Behnken design. The optimal extraction conditions were extraction time 14.4 min, sonication amplitude 10% and 10 g of sample per 100 mL solvent (70% ethanol, w/w). Using these conditions, we assessed the content of individual and total polyphenolic compounds along with antioxidant activity in the leaves of different autumn and winter apple cultivars grown in Estonia. The analyses were carried out with chromatographic (HPLC-DAD-MS/MS) and spectrophotometric methods. The phloretin concentration ranged from 292 to 726 µg/g and antioxidant activity from 6.06 to 11.42 mg GA eq./g, these being the highest in the local winter cultivars ‘Paide taliõun’ and ‘Tellissaare’, respectively.","Ben-Othman, Sana; Kaldmäe, Hedi; Rätsep, Reelika; Bleive, Uko; Aluvee, Alar; Rinken, Toonika",Antioxidants (Basel),600,1
16903,16903,16903,Brackets response,23.278936,6.2663555,2021-04-23,"(1) Background: The aim of the study was to evaluate the effect of pure lecithins in comparison to a conventional surfactant on skin in vivo. (2) Methods: Physiological skin parameters were evaluated at the beginning and the end of the study (day 1 and day 4) (n = 8, healthy forearm skin) with an Aquaflux(®), skin-pH-Meter, Corneometer(®) and an Epsilon(®) sensor. Confocal Raman spectroscopy was employed to monitor natural moisturizing factor, urea and water content of the participants’ skin. Tape strips of treated skin sites were taken and the collected corneocytes were subjected to atomic force microscopy. Circular nano objects were counted, and dermal texture indices were determined. (3) Results: Transepidermal water loss was increased, and skin hydration was decreased after treatment with SDS and LPC80. Natural moisturizing factor and urea concentrations within the outermost 10 µm of the stratum corneum were lower than after treatment with S75 or water. Dermal texture indices of skin treated with SDS were higher than skin treated with water (control). (4) Conclusions: Results suggest very good (S75) or good (LPC80) skin-tolerability of lecithin-based surfactants in comparison to SDS and encourage further investigation.","Vater, Claudia; Apanovic, Alexandra; Riethmüller, Christoph; Litschauer, Brigitte; Wolzt, Michael; Valenta, Claudia; Klang, Victoria",Pharmaceutics,600,1
18191,18191,18191,Obesity: a growing problem,23.238503,6.191441,2021-06-11,,"Lier, Heiko; Kammerer, Tobias; Knapp, Jürgen; Hofer, Stefan; Maegele, Marc; Fries, Dietmar; von Heymann, Christian",Anaesthesist,600,1
18598,18598,18598,'We were able to gain a greater appreciation for emergency medicine',23.231869,6.6696897,2021-06-25,"BACKGROUND: This study was designed to estimate economic burden of lung cancer in Turkey from payer perspective based on expert panel opinion on practice patterns in clinical practice. METHODS: In this cost of illness study, direct medical cost was calculated based on cost items related to outpatient visits, laboratory and radiological tests, hospitalizations/interventions, drug treatment, adverse events and metastasis. Indirect cost was calculated based on lost productivity due to early retirement, morbidity and premature death resulting from the illness, the value of lost productivity due to time spent by family caregivers and cost of formal caregivers. RESULTS: Cost analysis revealed the total per patient annual direct medical cost for small cell lung cancer to be €8772), for non-small-cell lung cancer to be €10,167. Total annual direct medical cost was €497.9 million, total annual indirect medical cost was €1.1 billion and total economic burden of lung cancer was €1.6 billion. Hospitalization/interventions (41%) and indirect costs (68.6%) were the major cost drivers for total direct costs and the overall economic burden of lung cancer, respectively. CONCLUSIONS: Our findings indicate per patient direct medical costs of small cell lung cancer and non-small-cell lung cancer to be substantial and comparable, indicating the substantial economic burden of lung cancer in terms of both direct and indirect costs. Our findings indicate that hospitalization/interventions cost item and indirect costs were the major cost drivers for total direct costs and the overall economic burden of lung cancer, respectively. Our findings emphasize the potential role of improved cancer prevention and early diagnosis strategies, by enabling cost savings related to drug treatment and metastasis management cost items, in sustainability of cancer treatments. SUPPLEMENTARY INFORMATION: The online version contains supplementary material available at 10.1186/s13561-021-00322-2.","Cicin, Irfan; Oksuz, Ergun; Karadurmus, Nuri; Malhan, Simten; Gumus, Mahmut; Yilmaz, Ulku; Cansever, Levent; Cinarka, Halit; Cetinkaya, Erdogan; Kiyik, Murat; Ozet, Ahmet",Health Econ Rev,600,19
20337,20337,20337,Freedom at any cost?,23.477901,6.2890406,2021-08-27,"BACKGROUND: Understanding the blood feeding preferences and resting habits of malaria vectors is important for assessing and designing effective malaria vector control tools. The presence of livestock, such as cattle, which are used as blood meal hosts by some malaria vectors, may impact malaria parasite transmission dynamics. The presence of livestock may provide sufficient blood meals for the vectors, thereby reducing the frequency of vectors biting humans. Alternatively, the presence of cattle may enhance the availability of blood meals such that infectious mosquitoes may survive longer, thereby increasing the risk of malaria transmission. This study assessed the effect of household-level cattle presence and distribution on the abundance of indoor and outdoor resting malaria vectors. METHODS: Houses with and without cattle were selected in Chikwawa district, southern Malawi for sampling resting malaria vectors. Prokopack aspirators and clay pots were used for indoor and outdoor sampling, respectively. Each house was sampled over two consecutive days. For houses with cattle nearby, the number of cattle and the distances from the house to where the cattle were corralled the previous night were recorded. All data were analysed using generalized linear models fitted with Poisson distribution. RESULTS: The malaria vectors caught resting indoors were Anopheles gambiae sensu stricto (s.s.), Anopheles arabiensis and Anopheles funestus s.s. Outdoor collections consisted primarily of An. arabiensis. The catch sizes of indoor resting An. gambiae sensu lato (s.l.) were not different in houses with and without cattle (P = 0.34). The presence of cattle near a house was associated with a reduction in the abundance of indoor resting An. funestus s.l. (P = 0.04). This effect was strongest when cattle were kept overnight ≤ 15 m away from the houses (P = 0.03). The blood meal hosts varied across the species. CONCLUSION: These results highlight differences between malaria vector species and their interactions with potential blood meal hosts, which may have implications for malaria risk. Whereas An. arabiensis remained unaffected, the reduction of An. funestus s.s. in houses near cattle suggests a potential protective effect of cattle. However, the low abundance of mosquitoes reduced the power of some analyses and limited the generalizability of the results to other settings. Therefore, further studies incorporating the vectors’ host-seeking behaviour/human biting rates are recommended to fully support the primary finding. SUPPLEMENTARY INFORMATION: The online version contains supplementary material available at 10.1186/s12936-021-03885-x.","Mburu, Monicah M.; Zembere, Kennedy; Mzilahowa, Themba; Terlouw, Anja D.; Malenga, Tumaini; van den Berg, Henk; Takken, Willem; McCann, Robert S.",Malar J,600,1
20964,20964,20964,Valedictory speech,23.1944,6.232449,2021-09-10,"The vegetation landscape in urban green space has been shown to provide great psychological benefits to people. Flower border is a well-designed small-scale vegetation landscape with the advantages of color and vegetation richness. This study focused on the effects of the visual attributes of flower borders on the aesthetic preference and emotional perception. The face recognition measurement method was used to obtain the emotional perception and the questionnaire survey method was used to measure the aesthetic preference. The results indicated the following: (1) regarding the ‘color features’ factor, high proportions of cool color and green vegetation significantly increased aesthetic preference and emotional valence, while the proportion of warm color had a negative effect on valence; (2) the ‘visual attractiveness’ (color brightness, and visual richness) and ‘color configuration’ (number of plant patches and number of color hues) factor was positively associated with aesthetic preference and emotional valence; (3) aesthetic preference was significantly related to emotional valence; (4) males expressed higher aesthetic preference and valence for flower border images than females. The results are expected to improve the aesthetic quality of flower borders and to promote public emotional health through the effective design of urban vegetation landscapes.","Zhuang, Jingwei; Qiao, Lin; Zhang, Xuan; Su, Yang; Xia, Yiping",Int J Environ Res Public Health,600,1
34387,34387,34387,Antibody testing,23.111938,6.3005896,2020-06-12,,"Davis, John",,600,1
34396,34396,34396,Undergraduate uncertainty,23.42813,6.3315854,2020-06-12,"The COVID-19 pandemic is forcing schools, universities and learning and development professionals to shift rapidly from in-person to online learning. It made providing of an effective e-learning contents more important. Consequently, the development of e-learning products and provision of e-learning opportunities is one of the most rapidly expanding areas of education and training. The growth of e-learning application is accelerating through both offline and online system. These innovative systems are changing the face of learning as we know it. However, what is known about these innovative approaches for learning and training has been limited by the shortage of scientifically evaluation. This study aims to assess the impact of using interactive instructions on e-learning to improve effectiveness of a programming course. This study develops a questionnaire based on usability evaluation method for an e-learning system. The method extends the current practice by focusing not only on cognitive but also affective considerations that may influence e-learning usability. This paper presents findings from a study of the impact of the learning systems. The study also describes designing evaluation sheet, data collection and analysis strategies of a case study on the evaluation of the e-learning system implemented for Programming Course in Ritsumeikan Asia Pacific University (APU), Japan.","Nariman, Dahlan","Complex, Intelligent and Software Intensive Systems",600,1
36476,36476,36476,Nursing oral care,23.207952,6.3890204,2020-07-10,"The paper deals with the problem of semantic Image Retrieval. Indeed, the image has recently gained popularity in several domains such as medical domain, marketing, etc. Image plays a very vital role in documentation. However, finding visual and relevant information in an image is a huge task for Image Retrieval community and a very discussed issue in digital image processing. In fact, image can be extracted from a big collection of images, in the purpose of responding to user’s need. Image Retrieval processes based on classical techniques may not be sufficient to user. For several years, great efforts have been devoted to integrate semantic aspect, in order to enhance relevance of the result and ensure high-level content consideration in image. This paper presents a state of the art of Image Retrieval approaches using graph theory due to the growing interest given to graphs in terms of performance, representation and its ability to ingrate semantic aspect. We review a number of recently available graph-based approaches in Image Retrieval aiming to determine factors adding semantic aspect in Image Retrieval system.","Belahyane, Imane; Mammass, Mouad; Abioui, Hasna; Idarrou, Ali",Image and Signal Processing,600,12
37052,37052,37052,Commentary: Hydrogen peroxide mouthwash,23.269823,6.398548,2020-07-23,"The study collected the learning behaviors of 179 adult learners, including video learning, page document learning, assignment submission, and so on. In order to find out the characteristics of online learning behavior of adult learners and provide enlightenment for the improvement of online courses and learning platform design, this paper adopts Lag Sequential Analysis to explore the sequence of learners’ behavior transformation. By comparing the behavioral transformation sequence of adult learners with different efficiency, this paper explores the factors influencing learning efficiency. The study found 92 kinds of significant behavioral transformation sequences, reflecting the characteristics of adult learners, such as task-oriented, active exploration and strong self-regulation ability. It is also found that highly efficient learners prefer selective and fast playing pattern, while low efficient learners prefer non-differentiated fast repetition of playing pattern. From this we can get the enlightenment that is helpful to the design of learning platform.","Shang, Junjie; Xiao, Rui; Zhang, Yuanyuan",Blended Learning,600,1
37963,37963,37963,Rapid review of AGPs published,23.227764,6.181646,2020-08-14,,"Thomas-Rüddel, D.; Bauer, M.",Anaesthesist,600,1
37966,37966,37966,Osteoradionecrosis GDP survey,23.471975,6.209667,2020-08-14,,"Hoppen, Thomas",P&#x000e4;diatrie,600,1
39874,39874,39874,Valedictory address,23.311943,6.174514,2020-09-25,"The COVID-19 Pandemic has led to social isolation; however, with the help of technology, education can continue through this tough time. Therefore, this research attempts to explore the Unified Theory of Acceptance and Use of Technology (UTAUT) through the expansion of the model. Also, make it relevant to investigate the influence of social isolation, and the moderating role of Corona fear on Behavioral Intention of the Learning Management System and its Use Behavior of Learning Management System among students. The data was analyzed using Partial Least Square (PLS) and Structural Equation Modelling (SEM). The findings show a positive link of Performance Expectancy (PE), Effort Expectancy (EE), Social Influence (SI), and Social Isolation on Behavioral Intention of LMS and, also between Behavioral Intention of LMS and its Use behavior. Moreover, the results of the moderation analysis show that Corona fears only moderates the link of Performance Expectancy and Social influence with Behavioral Intention of LMS. The findings imply the need for improving the LMS experience to increase its Behavioral Intention among students. Finally, the author's recommendation for future researchers is to examine the extended model in other countries and territories to analyze Coronavirus's influence on e-learning acceptance.","Raza, Syed A.; Qazi, Wasim; Khan, Komal Akram; Salam, Javeria",,600,1
