,index,Unnamed: 0,title_x,x,y,publish_time_x,abstract,authors,journal,category,cluster
89046,89046,89046,Help navigating the labyrinth.,23.204357,6.3702593,2020-06-01,"BACKGROUND Makkah (Mecca) is a holy city located in the western region of the Kingdom of Saudi Arabia. Each year, millions of pilgrims visit Makkah. These numbers impact both routine health care delivery and disaster response. This study aimed to evaluate hospitals' disaster plans in the city of Makkah. METHODS Study investigators administered a questionnaire survey to 17 hospitals in the city of Makkah. Data on hospital characteristics and three key domains of disaster plans (general evaluation of disaster planning, structural feasibility of the hospitals, and health care worker knowledge and training) were collated and analyzed. RESULTS A response rate of 82% (n=14) was attained. Ten (71%) of the hospitals were government hospitals, whereas four were private hospitals. Eleven (79%) hospitals had a capacity of less than 300 beds. Only nine (64%) hospitals reviewed their disaster plan within the preceding two years. Nine (64%) respondents were drilling for disasters at least twice per year. The majority of hospitals did not rely on a hazard vulnerability analysis (HVA) to develop their Emergency Operations Plan. Eleven (79%) hospitals had the Hospital Incident Command Systems (HICS) present in their plans. All hospitals described availability of some supplies required for the first 24 hours of a disaster response, such as: N95 masks, antidotes for nerve agents, and antiviral medications. Only five (36%) hospitals had a designated decontamination area. Nine (64%) hospitals reported ability to re-designate inpatient wards into an intensive care unit (ICU) format. Only seven (50%) respondents had a protocol for increasing availability of isolation rooms to prevent the spread of airborne infection. Ten (71%) hospitals had a designated disaster-training program for health care workers. CONCLUSIONS Makkah has experienced multiple disaster incidents over the last decade. The present research suggests that Makkah hospitals are insufficiently prepared for potential future disasters. This may represent a considerable threat to the health of both residents and visitors to Makkah. This study demonstrated that there is significant room for improvement in most aspects of hospital Emergency Operations Plans, in particular: reviewing the plan and increasing the frequency of multi-agency and multi-hospital drills. Preparedness for terrorism utilizing chemical, biologic, radiation, nuclear, explosion (CBRNE) and infectious diseases was found to be sub-optimal and should be assessed further. Al-Shareef AS , Alsulimani LK , Bojan HM , Masri TM , Grimes JO , Molloy MS , Ciottone GR . Evaluation of hospitals' disaster preparedness plans in the holy city of Makkah (Mecca): a cross-sectional observation study. Prehosp Disaster Med. 2017;32 (1):33-45.","Al-Shareef, Ali S; Alsulimani, Loui K; Bojan, Hattan M; Masri, Taha M; Grimes, Jennifer O; Molloy, Michael S; Ciottone, Gregory R",Prehospital and disaster medicine,600,1
90837,90837,90837,Special protection from acid erosion.,23.142748,6.348843,2020-10-01,We report a young man with a history of deep coma secondary to an extensive superior sagittal sinus thrombosis despite full systemic anticoagulation. Endovascular treatment combining a 5 Max ACE reperfusion catheter (Penumbra) and Solitaire (Covidien) retrieval device permitted revascularization of the superior sagittal sinus with restoration of anterograde venous flow. This treatment led to the disappearance of cytotoxic edema on MRI and to a neurological improvement with a modified Rankin scale score of 2 after two months. Our experience shows that this technique provides a useful and safe tool after failure of anticoagulation in cerebral venous sinus thrombosis.,"Gariel, Florent; Berge, Jerome; Dousset, Vincent","Interventional neuroradiology : journal of peritherapeutic neuroradiology, surgical procedures and related neurosciences",600,19
91661,91661,91661,Cola lime flavoured desensitising varnish.,23.402489,6.360657,2020-04-01,"OBJECTIVE Compare physical functional measures of people with severe mental illness (SMI) to standardized geriatric values. METHOD Retrospective analysis of physical functioning sample data of middle-aged people with SMI was compared to standardized older adult data. Compared: Sit to Stand Test (STS; n = 68), 6 min Walk Test (6MWT; n = 71), and Single Legged Stance Test (SLS; n = 55). One sample t tests were computed, using standardized values for older adult healthy populations, to identify differences for the group. RESULTS STS (M = 11.3 SD = 5.36), for the sample were comparable to 80-89 year old. The 6MWT values were significantly worse than 80-89-year-old range for women, t(28) = -2.88, p < .01, and men, t(40) = -5.32, p =. 00. SLS values for women and men were comparable to the 70-79-year-old range in the general population. CONCLUSIONS AND IMPLICATIONS FOR PRACTICE People with SMI have functional fitness levels that are older than chronological age, and should be assessed regularly for physical functioning to support independent living. (PsycInfo Database Record (c) 2021 APA, all rights reserved).","Zechner, Michelle R; Anderson, Ellen Zambo; Gill, Kenneth J",Psychiatric rehabilitation journal,600,1
93620,93620,93620,Vertical root fractures after apical surgery.,23.32484,6.2571244,2020-11-01,"INTRODUCTION Midwives are exposed to emotional strain, which could affect their overall health. Lack of emotional well-being could be a reason for workforce attrition. The aim of the study was to investigate the prevalence of depressive symptoms, anxiety and stress among Swedish midwives in relation to background variables. METHODS A random sample of 1000 midwives were asked to participate and complete a questionnaire. Participants completed the Depression, Anxiety and Stress Scale, Copenhagen Burnout Inventory and Quality of Life inventories together with demographic and work-related data. RESULTS In all, 470 midwives responded to the questionnaire (48%). The prevalence of moderate/severe/very severe symptoms of depressive symptoms was 12%, anxiety 8.6%, and stress 7.2%. Midwives aged <40 years and those with <10 years work experience reported higher levels of depressive symptoms, anxiety and stress. The factors most strongly associated with symptoms of depression were personal burnout (AOR=12.26), client burnout (AOR=1.95) and quality of life (AOR=0.26) The factors most strongly associated with symptoms of anxiety were work burnout (AOR=2.53) and personal burnout (AOR=5.61). The factors most strongly associated with stress were personal burnout (AOR=3.90) and work burnout (AOR=3.58) and high quality of life (AOR=0.34). CONCLUSIONS Swedish midwives experience symptoms of depression, anxiety and stress. Symptoms of burnout were associated with all aspects of mental health, while high quality of life was protective against these symptoms. These findings are relevant to consider in the work environment for Swedish midwives in order to reduce attrition rates.","Båtsman, Annika; Fahlbeck, Hanna; Hildingsson, Ingegerd",European journal of midwifery,600,8
98087,98087,98087,View from my window.,23.219847,6.291668,2019,"Foot orthoses and insoles are prescribed to runners, however their impact on running economy and performance is uncertain. The aim of this systematic review and meta-analysis was to determine the effect of foot orthoses and insoles on running economy and performance in distance runners. Seven electronic databases were searched from inception until June 2018. Eligible studies investigated the effect of foot orthoses or insoles on running economy (using indirect calorimetry) or running performance. Standardised mean differences (SMDs) were computed and meta-analyses were conducted using random effects models. Methodological quality was assessed using the Quality Index. Nine studies met the criteria and were included: five studies investigated the effect of foot orthoses on running economy and four investigated insoles. Foot orthoses were associated with small negative effects on running economy compared to no orthoses (SMD 0.42 [95% CI 0.17,0.72] p = 0.007). Shock absorbing insoles were also associated with negative effects on running economy, but an imprecise estimate (SMD 0.26 [95% CI -0.33,0.84] p = 0.83). Quality Index scores ranged from 4 to 15 out of 17. Foot orthoses and shock absorbing insoles may adversely affect running economy in distance runners. Future research should consider their potential effects on running performance.","Crago, Daniel; Bishop, Christopher; Arnold, John B",Journal of sports sciences,600,29
105455,105455,105455,Award-winning innovation.,23.097569,6.258271,2020-11-01,"Situs anomalies are a heterogenous class of inborn visceral and vascular abnormalities with a broad range of radiographic characteristics. Situs inversus totalis is characterized by mirror image location of the heart and viscera relative to situs solitus (normal position). Few aberrations involving the neuraxis, and rarely intracranial aneurysms, have been reported in association with situs inversus totalis. We describe the radiological findings and endovascular management of one of the first of its kind: the association of bilateral carotid cavernous aneurysms (one large and the other small-sized) with situs inversus totalis.","Chakravarthi, Sudheer; Oishi, Hidenori; Yatomi, Kenji; Teranishi, Kohsuke","Interventional neuroradiology : journal of peritherapeutic neuroradiology, surgical procedures and related neurosciences",600,1
109552,109552,109552,Gingiva and enamel shades for greater individuality.,23.15309,6.282853,2019,,"Neerland, Bjørn Erik; Watne, Leiv Otto; Krogseth, Maria","Tidsskrift for den Norske laegeforening : tidsskrift for praktisk medicin, ny raekke",600,16
109909,109909,109909,Thumb sucking prevention glove earns accreditation.,23.452806,6.2214403,2020-06-01,"Lead contamination is a widely recognised conservation problem for raptors worldwide. There are a number of studies in individual raptor species but those data have not been systematically evaluated to understand raptor-wide lead exposure and effects at a pan-European scale. To critically assess the extent of this problem, we performed a systematic review compiling all published data on lead in raptors (1983-2019) and, through a meta-analysis, determined if there was evidence for differences in exposure across feeding traits, geographical regions, between hunting and non-hunting periods, and changes over time. We also reviewed the impact of lead on raptors and the likely main source of exposure. We examined 114 studies that were unevenly distributed in terms of time of publication and the countries in which studies were performed. Peer-reviewed articles reported data for 39 raptor species but very few species were widely monitored across Europe. Obligate (vultures) and facultative scavengers (golden eagle, common buzzard and white-tailed sea eagle) accumulated the highest lead concentrations in tissues and generally were the species most at risk of lead poisoning. We found no evidence of a spatial or decadal trend in lead residues, but we demonstrated that high lead blood levels relate to hunting season. Exposure at levels associated with both subclinical and lethal effects is common and lead from rifle bullets and shot is often the likely source of exposure. Overall, our review illustrates the high incidence and ubiquity of lead contamination in raptors in Europe. However, we did not find studies that related exposure to quantitative impacts on European raptor populations nor detailed studies on the impact of mitigation measures. Such information is urgently needed and requires a more harmonised approach to quantifying lead contamination and effects in raptors across Europe.","Monclús, Laura; Shore, Richard F; Krone, Oliver",The Science of the total environment,600,24
112645,112645,112645,A referral partner you can trust.,23.2601,6.2573967,2021-01-01,"The emergence of Coronavirus Disease 2019 (COVID-19) has resulted in unprecedented changes in how the world socially interacts. Limits on contact with others, whether by social distancing or shelter-at-home recommendations, have negatively impacted physical activity (PA), which is especially true for adults over the age of 60 who are at high risk of serious illness from COVID-19.","Jakiela, Jason T; Waugh, Esther J; White, Daniel K",The Journal of rheumatology,600,12
118136,118136,118136,Bespoke advice on air purification.,23.069717,6.389967,2021-01-01,"SARS-CoV-2 whole-genome sequencing of samples from COVID-19 patients is useful for informing infection control. Datasets of these genomes assembled from multiple hospitals can give critical clues to regional or national trends in infection. Herein, we report a lineage summary based on data collected from hospitals located in the Tokyo metropolitan area. We performed SARS-CoV-2 whole-genome sequencing of specimens from 198 patients with COVID-19 at 13 collaborating hospitals located in the Kanto region. Phylogenetic analysis and fingerprinting of the nucleotide substitutions were performed to differentiate and classify the viral lineages. More than 90% of the identified strains belonged to Clade 20B, which has been prevalent in European countries since March 2020. Only two lineages (B.1.1.284 and B.1.1.214) were found to be predominant in Japan. However, one sample from a COVID-19 patient admitted to a hospital in the Kanto region in November 2020 belonged to the B.1.346 lineage of Clade 20C, which has been prevalent in the western United States since November 2020. The patient had no history of overseas travel or any known contact with anyone who had travelled abroad. Consequently, the Clade 20C strain belonging to the B.1.346 lineage appeared likely to have been imported from the western United States to Japan across the strict quarantine barrier. B.1.1.284 and B.1.1.214 lineages were found to be predominant in the Kanto region, but a single case of the B.1.346 lineage of clade 20C, probably imported from the western United States, was also identified. These results illustrate that a decentralized network of hospitals offers significant advantages as a highly responsive system for monitoring regional molecular epidemiologic trends.","Abe, Kodai; Shimura, Takako; Takenouchi, Toshiki; Iwasaki, Yuka W; Ishizu, Hirotsugu; Uwamino, Yoshifumi; Uno, Shunsuke; Gotoh, Jun; Tachikawa, Natsuo; Takeuchi, Yuriko; Katayama, Junpei; Nozaki, Hiroyuki; Fujii, Susumu; Seki, Shikou; Nakamura, Morio; Uda, Kazuhiro; Misumi, Takahiko; Ishihara, Jun; Yamada, Kenichiro; Kanai, Toshio; Murai, Shinji; Araki, Kazuhiro; Ebihara, Tamotsu; Siomi, Haruhiko; Hasegawa, Naoki; Kitagawa, Yuko; Amagai, Masayuki; Suematsu, Makoto; Kosaki, Kenjiro",The Keio journal of medicine,600,1
120506,120506,120506,A helping hand for practices.,23.250233,6.3102593,2020-05-01,"Telemedicine is the provision of healthcare-related services from a distance and is poised to move healthcare from the physician's office back into the patient's home. The field of ophthalmology is often at the forefront of technological advances in medicine including telemedicine and the use of artificial intelligence. Multiple studies have demonstrated the reliability of tele-ophthalmology for use in screening and diagnostics and have demonstrated benefits to patients, physicians, as well as payors. There remain obstacles to widespread implementation, but recent legislation and regulation passed due to the devastating COVID-19 pandemic have helped to reduce some of these barriers. This review describes the current status of tele-ophthalmology in the United States including benefits, hurdles, current programs, technology, and developments in artificial intelligence. With ongoing advances patients may benefit from improved detection and earlier treatment of eye diseases, resulting in better care and improved visual outcomes.","Parikh, Deep; Armstrong, Grayson; Liou, Victor; Husain, Deeba",Seminars in ophthalmology,600,0
121261,121261,121261,"Hard on contamination, gentle on equipment.",23.115295,6.3246803,2020-04-01,"BACKGROUND Atrial fibrillation (AF) is the leading cause of stroke. The European Society of Cardiology (ESC) advises opportunistic AF screening among patients aged ≥ 65 years. Considering this, the aim herein, was compare the feasibility of two different systems of smartphone-based electrocardiogram (ECG) recordings to identify AF among those without a previous arrhythmia history. METHODS Prospective AF screening was conducted at six pharmacies using Kardia Mobile and Hartmann Veroval 2 in 1. A single-lead ECG was acquired by the placement of fingers on the pads. A cardiologist evaluated findings from both devices. RESULTS Atrial fibrillation was identified in 3.60% and previously unknown AF was detected in 1.92% of the study participants. Sensitivity and specificity of the Kardia application in detecting AF were 66.7% (95% confidence interval [CI] 38.4-88.2%) and 98.5% (95% CI 96.7-99.5%), and for Veroval 10.0% (95% CI 0.23-44.5%) and 94.96% (95% CI 92.15-96.98%), accordingly. Inter-rater agreement was k = 0.088 (95% CI 1.59-16.1%). CONCLUSIONS Mobile devices can detect AF, but each finding must be verified by a professional. The Kardia application appeared to be more user-friendly than Veroval. Cardiovascular screening using mobile devices is feasible at pharmacies. Hence it might be considered for routine use.","Zaprutko, Tomasz; Zaprutko, Joanna; Sprawka, Józefina; Pogodzińska, Monika; Michalak, Michał; Paczkowska, Anna; Kus, Krzysztof; Nowakowska, Elżbieta; Baszko, Artur",Cardiology journal,600,30
122719,122719,122719,Dentists at Birmingham devise indexing tool to aid triage.,23.238451,6.2846274,2020-05-01,"PURPOSE To address the gap in interventions for improving sexual and gender minority youth (SGMY; e.g., lesbian, gay, bisexual, and transgender youth) health, we tested the feasibility of a game-based intervention for increasing help-seeking, productive coping skills, resource knowledge/use, and well-being. METHODS We conducted a 2-arm randomized controlled trial testing a theory-based, community-informed, Web-accessible computer role-playing game intervention. Control condition received a list of resources. Primary hypotheses were high levels of implementation success, game demand, and game acceptability. RESULTS We randomized 240 SGMYs aged 14-18 years into the intervention (n = 120) or control (n = 120) conditions. Participants completed baseline (100%), 1-month follow-up (T2; 73.3%), and 2-month follow-up (T3; 64.4%) surveys. Among intervention participants, 55.8% downloaded and played the game. Of those who played, 46.2% reported a desire to play it again, and 50.8% would recommend it. Game acceptability exceeded hypothesized benchmarks, wherein participants reported high positive affect (M = 2.36; 95% confidence interval [CI]: 2.13, 2.58), low negative affect (M = 2.75; 95% CI: 2.55, 2.95), low tension/annoyance (M = 3.18; 95% CI: 2.98, 3.39), and high competence (M = 2.23; 95% CI: 2.04, 2.43) while playing the game. In multivariable intent-to-treat analyses of 38 secondary/tertiary outcomes, intervention participants reported significantly larger reductions than control participants in cyberbullying victimization (T2 b = -.28; 95% CI: -.56, -.01), binge drinking frequency (T2 b = -.39; 95% CI: -.71, -.06), and marijuana use frequency (T3 b = -2.78; 95% CI: -4.49, -1.08). CONCLUSIONS We successfully implemented a Web-accessible game trial with SGMY. The game-based intervention was feasible and acceptable to SGMY, and preliminary results show it improved several health-related behaviors. A larger scale trial is needed to test whether the game-based intervention can reduce health inequities for SGMY.","Egan, James E; Corey, Stephanie L; Henderson, Emmett R; Abebe, Kaleab Z; Louth-Marquez, William; Espelage, Dorothy; Hunter, Simon C; DeLucas, Matthew; Miller, Elizabeth; Morrill, Brooke A; Hieftje, Kimberly; Sang, Jordan M; Friedman, Mark S; Coulter, Robert W S",The Journal of adolescent health : official publication of the Society for Adolescent Medicine,600,11
124947,124947,124947,Absolutely hygienic for peace of mind.,23.11428,6.598635,2020-05-01,"Long-term, persistent central nervous system inflammation is commonly seen following brain infection. Using a murine model of viral encephalitis (murine cytomegalovirus, MCMV) we have previously shown that post-encephalitic brains are maintained in an inflammatory state consisting of glial cell reactivity, retention of brain-infiltrating tissue-resident memory CD8+ T-cells, and long-term persistence of antibody-producing cells of the B-lineage. Here, we report that this neuroinflammation occurs concomitantly with accumulation and retention of immunosuppressive regulatory T-cells (Tregs), and is exacerbated following their ablation. However, the extent to which these Tregs function to control neuroimmune activation following MCMV encephalitis is unknown. In this study, we used Foxp3-diphtheria toxin receptor-GFP (Foxp3-DTR-GFP) transgenic mice, which upon administration of low-dose diphtheria toxin (DTx) results in the specific depletion of Tregs, to investigate their function. We found treatment with DTx during the acute phase of viral brain infection (0-4 dpi) resulted in depletion of Tregs from the brain, exacerbation of encephalitis (i.e., increased presence of CD4+ and CD8+ T-cells), and chronic reactive phenotypes of resident glial cells (i.e., elevated MHC Class II as well as PD-L1 levels, sustained microgliosis, and increased glial fibrillary acidic protein (GFAP) expression on astrocytes) versus untreated, infected animals. This chronic proinflammatory environment was associated with reduced cognitive performance in spatial learning and memory tasks (Barnes Maze) by convalescent animals. These data demonstrate that chronic glial cell activation, unremitting post-encephalitic neuroinflammation, and its associated long-term neurological sequelae in response to viral brain infection are modulated by the immunoregulatory properties of Tregs. GLIA 2015;63:1982-1996.","Lokensgard, James R; Schachtele, Scott J; Mutnal, Manohar B; Sheng, Wen S; Prasad, Sujata; Hu, Shuxian",Glia,600,16
134768,134768,134768,Free Situation Judgement Test e-learning course.,23.204865,6.3017764,2020-10-01,"Mozambique is located on the East Coast of Africa and was one of the last countries affected by COVID-19. The first case was reported on 22 March 2020 and since then the cases have increased gradually as they have in other countries worldwide. Environmental and population characteristics have been analyzed worldwide to understand their possible association with COVID-19. This article seeks to highlight the evolution and the possible contribution of risk factors for COVID-19 severity according to the available data in Mozambique. The available data highlight that COVID-19 severity can be magnified mainly by hypertension, obesity, cancer, asthma, HIV/SIDA and malnutrition conditions, and buffered by age (youthful population). Due to COVID-19 epidemic evolution, particularly in Cabo Delgado, there is the need to increase laboratory diagnosis capacity and monitor compliance of preventive measures. Particular attention should be given to Cabo Delgado, including its isolation from other provinces, to overcome local transmission and the spread of SARS-CoV-2.","Sumbana, Jose; Sacarlal, Jahit; Rubino, Salvatore",Journal of infection in developing countries,600,16
