,index,Unnamed: 0,title_x,x,y,publish_time_x,abstract,authors,journal,category,cluster
60240,60240,60240,Immune biomarker-based enrichment in sepsis trials.,19.942291,11.275278,2020-02-19,"Importance During the coronavirus disease 2019 (COVID-19) pandemic, several cases of chilblains have been reported. Objective To determine if chilblains are associated with COVID-19. Design, Setting, and Participants This monocentric case series was conducted at the Department of Dermatology at Cliniques universitaires Saint-Luc, a tertiary care hospital in Brussels, Belgium, between April 10 and April 17, 2020. We evaluated a total of 31 referred patients who had recently developed chilblains. Main Outcomes and Measures Real-time reverse transcriptase-polymerase chain reaction (RT-PCR) was used to detect severe acute respiratory syndrome coronavirus 2 (SARS-CoV-2) RNA on nasopharyngeal swabs for all patients and in skin biopsy specimens for 22 patients. Blood samples from all patients were tested for specific anti-SARS-CoV-2 immunoglobulin (Ig) M and IgG antibodies. All patients had extended blood analyses. Histologic (22 patients) and immunofluorescence examinations (15 patients) were performed on the skin biopsy specimens. Results The 31 patients were generally in good health; most were teenagers or young adults, and 19 were women. Histopathologic analysis of skin biopsy specimens (22 patients) confirmed the diagnosis of chilblains and showed occasional lymphocytic or microthrombotic phenomena. Immunofluorescence analyses showed vasculitis of small-diameter vessels in 7 patients. In all patients, SARS-CoV-2 RNA remained undetected by RT-PCR on nasopharyngeal swabs and in biopsy samples of the skin lesions. The IgM and IgG antibody titers were negative for SARS-CoV-2 in all patients (<1.0 arbitrary unit/mL). No significant abnormalities in blood test results were suggestive of systemic disease. Antinuclear antibody titers were low in 7 patients and higher in 1 patient. Conclusions and Relevance Chilblains appeared not to be directly associated with COVID-19 in this case series. Lifestyle changes associated with community containment and lockdown measures are a possible explanation for these lesions.","Herman, Anne; Peeters, Caroline; Verroken, Alexia; Tromme, Isabelle; Tennstedt, Dominique; Marot, Liliane; Dachelet, Claire; Gruson, Damien; Hermans, Cedric; Baeck, Marie",JAMA dermatology,6,1
61150,61150,61150,A Visual Tool for Enhanced Critical Care Bedside Communications during the Coronavirus Pandemic: The Window Wall of Information.,19.85584,11.064745,2020-06-26,"BACKGROUND AND AIMS Biliary drainage using endoscopic ultrasound (EUS-BD) has been developed as a novel technique to obtain biliary access and drainage when ERCP fails. Numerous studies have demonstrated its safety and efficacy specifically pertaining to those with malignant distal biliary obstruction or altered foregut anatomy. The aim of this study is to evaluate the safety and efficacy of EUS-BD in benign indications in patients with normal foregut anatomy. METHODS We performed a retrospective comparative study from 5 academic medical centers (2008-2018) involving patients with benign biliary obstruction and native foregut anatomy who had an initial failed ERCP with subsequent attempt at biliary decompression via EUS-BD or by repeating ERCP. RESULTS 36 patients (mean age 61.6 ± 2.2, 38.9% female) who underwent attempted EUS-BD following initial failed ERCP were compared to 50 patients (mean age 62.7 ± 2.3, 73.5% female) who underwent repeat ERCP following an initial failed cannulation. EUS-BD was technically successful in 28 (77.8%) patients with rendezvous being the most common approach (86.1%). A higher level of pre-procedural bilirubin was found to be associated with technical success of EUS-BD (3.65 ± 0.63 versus 1.1 ± 0.4, p value 0.04). Success of repeat ERCP following failed cannulation was 86%. Adverse events were significantly more frequent in the EUS-BD cohort when compared to the repeat ERCP (10 (27.8%) versus 4 (8.0%), p = 0.02, OR 4.32. CONCLUSIONS EUS-BD remains a viable therapeutic option in the setting of benign biliary disease, with success rates of 77.8%. Adverse events were significantly more common with EUS-BD vs. repeat ERCP, emphasizing the need to perform in expert centers with appropriate multidisciplinary support and to strongly consider the urgency of biliary decompression before considering same session EUS-BD after failed initial biliary access.","Bill, Jason G; Ryou, Marvin; Hathorn, Kelly E; Cortes, Pedro; Maple, John T; Al-Shahrani, Abdullah; Lang, Gabriel; Mullady, Daniel K; Das, Koushik; Cosgrove, Natalie; Salameh, Habeeb; Kumta, Nikhil A; DiMaio, Christopher J; Zia, Hassaan; Orr, Jordan; Yachimski, Patrick; Kushnir, Vladimir M",Surgical endoscopy,6,0
61273,61273,61273,Clinical review: Does it matter which hemodynamic monitoring system is used?,19.645348,11.024748,2013,"BACKGROUND The COVID-19 pandemic has caused many adults with intellectual/developmental disabilities (IDD) to lose their daily routines and social support, and as a result, many adults with IDD are increasingly reliant on their family caregivers. Siblings often play a crucial support role for their brothers and sisters with IDD. As such, this study aimed to describe the experiences of adult siblings of people with IDD during the COVID-19 pandemic. METHODS The Sibling Collaborative worked with researchers to codesign an online survey, completed by 91 people, exploring sibling supports and concerns during the COVID-19 pandemic. The survey also aimed to identify helpful resources for siblings during this time. RESULTS The results showed that the majority of siblings are supporting their brother or sister with IDD during the COVID-19 pandemic and are concerned about the health and well-being of their brother/sister. The most common concern related to disruption of their brother's or sister's routine and activities. Although responses of older and younger siblings did not differ from each other, siblings whose brother or sister with IDD lived with family had some unique concerns relative to those whose siblings no longer lived with family. Siblings described how their own self-care and relationships with others, as well as support for their brother/sister, were particularly helpful during the COVID-19 pandemic. CONCLUSIONS Siblings are providing key support to their brother or sister with IDD during the COVID-19 pandemic, and they too must be supported. Siblings should be included in efforts to disseminate resources targeting people with IDD and their feedback and input must be obtained. It is also important to include sibling mental wellness as caregiver supports are created and implemented. More research is needed to further understand how to support sibling caregivers.","Redquest, B K; Tint, A; Ries, H; Lunsky, Y",Journal of intellectual disability research : JIDR,6,31
62436,62436,62436,The effect of syringe size on reliability and safety of low-flow infusions.,20.003113,11.364877,2009,"BACKGROUND Transanal endoscopic microsurgery (TEM) has been used for several decades for excision of neoplastic lesions in the rectum. With the development of natural orifice translumenal endoscopic surgery (NOTES) techniques, the authors describe a new method of proctectomy using a combination of TEM and NOTES principles. METHODS In a porcine model, a circumferential rectal sleeve resection was performed using TEM with flexible endoscopic assistance. The rectum was delivered through the anus, resected, and an end-to-end stapled anastomosis was performed. RESULTS The specimen was approximately 10 cm in length. No adjacent organ injuries or evidence of hemorrhage from the vascular pedicle or in the pelvis was observed at necropsy. Procedure time was 3 hours. CONCLUSION This technique may increase the complexity of lesions accessible by TEM and may ultimately lead to the performance of total mesorectal excision using transanal techniques, reducing the morbidity of the abdominal approach.","Trunzo, Joseph A; Delaney, Conor P",Surgical innovation,6,1
63162,63162,63162,COVID-19 and Its Implications for Thrombosis and Anticoagulation.,19.76875,10.938905,2021-02-06,"BACKGROUND Since February 2020, data on the clinical features of patients infected by severe acute respiratory syndrome coronavirus 2 (SARS-CoV-2) and their clinical evolution have been gathered and intensively discussed, especially in countries with dramatic dissemination of this disease. OBJECTIVE To assess the clinical features of Brazilian patients with SARS-CoV-2 and analyze its local epidemiological features. DESIGN AND SETTING Observational retrospective study conducted using data from an official electronic platform for recording confirmed SARS-CoV-2 cases. METHODS We extracted data from patients based in the state of Pernambuco who were registered on the platform of the Center for Strategic Health Surveillance Information, between February 26 and May 25, 2020. Clinical signs/symptoms, case evolution over time, distribution of confirmed, recovered and fatal cases and relationship between age group and gender were assessed. RESULTS We included 28,854 patients who were positive for SARS-CoV-2 (56.13% females), of median age 44.18 years. SARS-CoV-2 infection was most frequent among adults aged 30-39 years. Among cases that progressed to death, the most frequent age range was 70-79 years. Overall, the mortality rate in the cohort was 8.06%; recovery rate, 30.7%; and hospital admission rate (up to the end of follow-up), 17.3%. The average length of time between symptom onset and death was 10.3 days. The most commonly reported symptoms were coughing (42.39%), fever (38.03%) and dyspnea/respiratory distress with oxygen saturation < 95% (30.98%). CONCLUSION Coughing, fever and dyspnea/respiratory distress with oxygen saturation < 95% were the commonest symptoms. The case-fatality rate was 8.06% and the hospitalization rate, 17.3%.","Nascimento, Israel Júnior Borges do; Pinto, Luiz Ricardo; Fernandes, Valéria Alves; Romero, Israel Molina; Oliveira, João Antonio de Queiroz; Marcolino, Milena Soriano; Leite, Maria Fátima",Sao Paulo medical journal = Revista paulista de medicina,6,1
64532,64532,64532,Positional effects on the distributions of ventilation and end-expiratory gas volume in the asymmetric chest-a quantitative lung computed tomographic analysis.,19.853485,11.225635,2018,"INTRODUCTION : Disease outbreaks of acquired immunodeficiency syndrome, severe acute respiratory syndrome, pandemic H1N1, H7N9, H5N1, Ebola, Zika, Middle East respiratory syndrome, and recently COVID-19 have raised the attention of the public for the past half-century. Revealing the characteristics and epidemic trends are important parts for disease control. The biological scenarios including transmission characteristics, can be constructed and translated into mathematical models, which can help to predict and gain a deeper understanding of diseases. AREAS COVERED : This review discusses the models for infectious diseases and highlights their values in the field of public health. This information will be of interest to mathematicians and clinicians, and make a significant contribution towards the development of more specific and effective models. Literature searches were performed using the online database of PubMed (inception to August, 2020). EXPERT OPINION : Modeling could contribute to infectious disease control by means of predicting the scales of disease epidemics, indicating the characteristics of disease transmission, evaluating the effectiveness of interventions or policies, and warning or forecasting during the pre-outbreak of diseases. With the development of theories and the ability of calculations, infectious disease modeling would play a much more important role in disease prevention and control of public health.","Ding, Cheng; Liu, Xiaoxiao; Yang, Shigui",Expert review of anti-infective therapy,6,1
66188,66188,66188,Predictive Performance of Oximetry to Detect Sleep Apnea in Patients Taking Opioids.,19.768478,10.951243,2021-05-05,"Circumferential bodylift is a powerful procedure for achieving dramatic and natural body contouring changes in the massive weight loss patient. The care of these patients has raised our awareness of several important issues including safety, nutritional status, skin quality, recurrent laxity, surgical steps, and postoperative scars. Integration of this knowledge with various technical modifications over the last 15 years has improved our care for this cohort. We have not only seen a rise in the number of surgeries performed, but also the development of principles, techniques, and details that the authors feel necessary to share to achieve improved contour and more predictable outcomes. LEVEL OF EVIDENCE 4: Therapeutic.","Small, Kevin H; Constantine, Ryan; Eaves, Felmont F; Kenkel, Jeffrey M",Aesthetic surgery journal,6,12
66273,66273,66273,A pilot study documenting increased thrombin generation following abrupt withdrawal of heparin therapy in healthy dogs.,19.801592,10.950412,2018,"AIMS The aim of this study is to generate an in-depth understanding of youth perceptions and experiences of living with type 2 diabetes to inform knowledge translation, research and intervention development. DESIGN Interpretive descriptive qualitative study. METHODS Twenty to 25 youth aged 10-18 years with a diagnosis of type 2 diabetes will be purposively recruited through the Diabetes Education Resource for Children and Adolescents in Winnipeg, Manitoba, and through the Improving Renal Complications in Adolescents With Type 2 Diabetes Through the REsearch [iCARE] cohort. Socio-demographic information will be collected. Semi-structured interviews will occur iteratively with inductive thematic analysis. Data will be professionally transcribed and managed using NVivo 1.0 software. The University Ethics Committee approved this study (May 2020). DISCUSSION There is a critical gap in understanding youth experiences of type 2 diabetes. Research involving youth with type 2 diabetes is predominantly quantitative in nature, largely reflecting risk factors, underlying mechanisms and treatment outcomes associated with diabetes management. In-depth qualitative research on youth experiences can help identify youth priorities, provide insight into critical misalignments between stakeholder perspectives, and drive forward a more consolidated youth-centred research agenda. IMPACT Understanding and applying knowledge of youth experiences is critical as the prevalence of, and challenges associated with, youth onset type 2 diabetes continues to increase worldwide. This research will generate a robust interpretive description of youth lived experiences and perceptions of type 2 diabetes where such research is lacking, to inform basic and applied research within an interdisciplinary investigative and clinical research team with relevance to other jurisdictions. In response to calls for youth-oriented research in type 2 diabetes, this work will catalyse collaborative knowledge translation using creative and youth-directed initiatives.","Archibald, Mandy M; Dart, Allison; Wicklow, Brandy; Pundyk, Katherine J; Marks, Seth D; Sellers, Elizabeth A C",Journal of advanced nursing,6,1
67073,67073,67073,Heat and Moisture Exchangers and Humidification Efficacy in Pediatrics: Effects of Ventilator Settings and ETT Leakage.,20.004602,10.936282,2012,"Anaesthetic management of tracheal resection and reconstruction in patients with difficult tracheal pathologies, poses unique challenges-such as pre-operative assessment and preparation, the induction of general anaesthesia, airway sharing with surgeons during the intra-operative period while performing resection and reconstruction, emergence from general anaesthesia, and post-operative care. While there are no guidelines on choosing the ideal airway technique for the intra-operative period, we describe a simple-yet-effective airway modality, viz. spontaneous ventilation, as a key airway technique during the crucial open airway phase during tracheal reconstruction.","Sivakumar, Ranjith K; Panneerselvam, Sakthirajan; Uthaman, Duraiyarassu; Rudingwa, Priya; Ravi, Ramya",Indian journal of anaesthesia,6,16
67845,67845,67845,"Structure, Organization, and Delivery of Critical Care in Asian ICUs.",19.810276,10.973358,2016,"Summary An enzyme-linked immunosorbent assay (ELISA) is presented for the detection of the K99 antigen of Escherichia coli in calf faeces. False-positive reactions were not observed with K99-negative strains and with several viral antigens. Only bovine coronavirus caused slight positive reactions which could be eliminated by a blocking test. As compared with the conventional procedure for the detection of the K99 antigen, ELISA seemed to be at least as sensitive and had the advantage that samples could be stored at -20° C before testing. In addition many samples could be handled at the same time and the results became available quickly. By carrying out the assay as a blocking test, specific antibody against K99 in serum or colostrum could be detected and titrated.","Ellens, D J; de Leeuw, P W; Rozemond, H",The Veterinary quarterly,6,1
73316,73316,73316,Is proportional-assist ventilation with load-adjustable gain factors a user-friendly mode?,19.883541,11.179045,2009,,"Bryan, Richard T; Arnold, Roland; Khanim, Farhat L; Shepherd, Duncan E; Patel, Prashant; Ward, Douglas G",Nature reviews. Urology,6,16
74023,74023,74023,Clinical review: Update on hemodynamic monitoring--a consensus of 16.,19.883888,10.916638,2011,"BACKGROUND Laparoscopic sleeve gastrectomy (LSG), first intended as the first step of biliopancreatic diversion with duodenal switch (BPD-DS), is gaining popularity as a per-se procedure because of its effectiveness on weight loss and comorbidity resolution. The extraction of the gastrectomy specimen could be challenging and time-consuming. Different techniques have been described for specimen withdrawal. In this article we report the technique adopted in more than 250 LSGs performed in our department. METHODS In the first 90 LSGs performed in our department from October 2002, the specimen was extracted in a retrieval bag using an endoloop. In the following 160 cases the technique has been simplified: the grasped specimen is withdrawn through the 15-mm trocar site without any additional device. RESULTS We registered only two cases of wound infection (1.2%) with the simplified technique, both occurring in the initial cases. There were no cases of trocar site hernia formation. CONCLUSION The technique described does not require any special devices and seems to be simpler, saves time, and is cost effective if compared with other techniques previously reported.","Casella, Giovanni; Soricelli, Emanuele; Fantini, Aldo; Basso, Nicola",World journal of surgery,6,1
74887,74887,74887,Pediatric Emergency and Critical Care Resources and Infrastructure in Resource-Limited Settings: A Multicountry Survey.,20.047583,11.370802,2020-12-21,"OBJECTIVE Justice-involved veteran research remains largely limited to men and those using Veterans Health Administration (VHA) services. Research inclusive of women and those not using VHA care is critical to understanding mental health and suicide risk among justice-involved veterans. This study examined whether lifetime justice involvement was associated with symptoms of posttraumatic stress disorder (PTSD) and depression, recent suicidal ideation, and lifetime suicide attempt. METHOD We conducted a secondary analysis of 812 post-9/11 male and female veterans. The sample included veterans eligible and not eligible for VHA care. Participants were administered the PTSD Checklist for DSM-IV, the Patient Health Questionnaire-8, and the Columbia-Suicide Severity Rating Scale. Additional questions assessed justice involvement, military characteristics, demographics, and recent use of VHA mental health care. RESULTS History of justice involvement was associated with more severe PTSD and depression symptoms as well as suicidal ideation and suicide attempt. Associations were maintained after adjusting for sex, combat exposure, service branch, recent use of VHA mental health care, and education. Sex-stratified exploratory analyses revealed consistent findings among males; justice involvement was associated with suicide attempt among females. Current probation or parole was particularly related to depressive symptoms, suicidal ideation, and suicide attempt. CONCLUSIONS Justice-involved veterans appear to be a vulnerable population experiencing heightened psychiatric symptoms and increased risk for recent suicidal ideation and lifetime suicide attempt. Programs within VHA and the community are important for connecting justice-involved veterans to mental health services and mitigating suicide risk. (PsycInfo Database Record (c) 2021 APA, all rights reserved).","Holliday, Ryan; Hoffmire, Claire A; Martin, W Blake; Hoff, Rani A; Monteith, Lindsey L","Psychological trauma : theory, research, practice and policy",6,31
75722,75722,75722,Corticosteroids for severe influenza pneumonia: A critical appraisal.,19.975393,11.265423,2016,"Background/Aim: The purpose of this study was to evaluate the results of stapled closure of the pancreatic remnant after cold-knife section of the pancreatic isthmus and distal pancreatectomy for adenocarcinoma. Methods: A retrospective evaluation of 57 consecutive patients undergoing distal spleno-pancreatectomy for adenocarcinoma was performed. The pancreatic isthmus was systematically straight-sectioned with a cold knife, and the remnant was stapled close without additional stitches or adjuncts. The study's main endpoints were postoperative mortality, the occurrence of a pancreatic fistula, the need for a re-operation, the postoperative length of stay in the hospital, the rate of re-admission, and late survival. Results: Postoperative mortality was absent. Seventeen patients (29.8%) presented a pancreatic fistula of grade A in seven cases (41.2%), grade B in eight cases (47.1%), and grade C in two cases (11.8%). Re-operation was required in the two patients (3.5%) with grade C fistula in order to drain an intra-abdominal abscess. The mean postoperative length of stay in the hospital was 15 days (range, 6-62 days). No patient required re-admission. Twenty-nine patients (50.8%) were alive and free from disease, respectively, 12 patients (21.1%) at 12 months, 13 patients (22.8%) at 60 months, and four patients (7.0%) at 120 months from the operation. The remaining patients died of metastatic disease 9-37 months from the operation. Lastly, disease-related mortality was 49.1%. Conclusion: Stapler closure of the pancreatic remnant allows good postoperative results, limiting the formation of pancreatic fistula to the lower limit of its overall reported incidence.","Illuminati, Giulio; Cerasari, Saverio; Pasqua, Rocco; Nardi, Priscilla; Fratini, Chiara; Frey, Sébastien; Iannelli, Antonio; Marini, Pierluigi",Frontiers in surgery,6,16
75796,75796,75796,Is my patient's respiratory drive (too) high?,20.11562,11.132116,2018,,"Valicenti-McDermott, Maria; Rivelis, Erin; Bernstein, Carla; Cardin, Marie Joane",Journal of child and adolescent psychopharmacology,6,2
75820,75820,75820,Pediatric emergency mass critical care: focus on family-centered care.,19.815212,11.004366,2011,,"Lane, J T; Smith, Karen; Allen, Meredith; Surio, Priyanka; Ruebush, Elizabeth",Journal of public health management and practice : JPHMP,6,1
