,title_x,publish_time_x,abstract,authors,journal,url,category
224545,"Symptoms of Anxiety, Burnout, and PTSD and the Mitigation Effect of Serologic Testing in Emergency Department Personnel During the COVID-19 Pandemic",2021,"During 2020 and 2021, the global pandemic of coronavirus disease 2019 (COVID-19) due to severe acute respi- ratory syndrome coronavirus 2 (SARS-CoV-2) has resulted in high death rates and acute and chronic morbidity in all countries. The rapid development of new mRNA vaccines to SARS-CoV-2 brings hope that the spread of this virus can be controlled. The ChAdOx1 nCoV-19 vaccine developed by a collaboration between the University of Oxford and AstraZeneca showed efficacy in clinical trials, with a good safety profile. However, there have been recent reports of the rare development of thrombotic events in young women following vaccination with ChAdOx1 nCoV-19, particularly of the rare condition of cavernous sinus thrombosis. Studies have begun to in- vestigate whether antibodies to the SARS-CoV-2 spike cross-react with platelet factor 4 (PF4/CXLC4) and mim- ic autoimmune heparin-induced thrombocytopenia. This Medical Science Monitor Editorial aims to briefly update the current status of studies on a possible rare complication of using new mRNA vaccines to prevent COVID-19.","Parums, Dinah V",Med Sci Monit,,557
224546,"Symptoms of Anxiety, Burnout, and PTSD and the Mitigation Effect of Serologic Testing in Emergency Department Personnel During the COVID-19 Pandemic",2021,"During 2020 and 2021, the global pandemic of coronavirus disease 2019 (COVID-19) due to severe acute respi- ratory syndrome coronavirus 2 (SARS-CoV-2) has resulted in high death rates and acute and chronic morbidity in all countries. The rapid development of new mRNA vaccines to SARS-CoV-2 brings hope that the spread of this virus can be controlled. The ChAdOx1 nCoV-19 vaccine developed by a collaboration between the University of Oxford and AstraZeneca showed efficacy in clinical trials, with a good safety profile. However, there have been recent reports of the rare development of thrombotic events in young women following vaccination with ChAdOx1 nCoV-19, particularly of the rare condition of cavernous sinus thrombosis. Studies have begun to in- vestigate whether antibodies to the SARS-CoV-2 spike cross-react with platelet factor 4 (PF4/CXLC4) and mim- ic autoimmune heparin-induced thrombocytopenia. This Medical Science Monitor Editorial aims to briefly update the current status of studies on a possible rare complication of using new mRNA vaccines to prevent COVID-19.","Parums, Dinah V",Med Sci Monit,,557
224651,The Effectiveness of Virtual Training on the MiniMed 670G System in People with Type 1 Diabetes During the COVID-19 Pandemic,2020,The COVID-19 pandemic is creating acute shortages of healthcare providers in crisis areas Although research has highlighted that both pharmacists and nurse pra,"Timmons, Edward Wei Peter",,,557
224652,The Effectiveness of Virtual Training on the MiniMed 670G System in People with Type 1 Diabetes During the COVID-19 Pandemic,2020,"SARS-CoV-2 virus which caused the global pandemic the Coronavirus Disease- 2019 (COVID-2019) has infected about 1,203,959 patients and brought forth death rate about 64,788 among 206 countries as mentioned by WHO in the month of April 2020. The clinical trials are underway for Remdesivir, an investigational anti-viral drug from Gilead Sciences. Antimalarial drugs such as Chloroquine and Hydroxychloroquine derivatives are being used in emergency cases; however, they are not suitable for patients with conditions like diabetes, hypertension and cardiac issues. The lack of availability of approved treatment for this disease calls forth the scientific community to find novel compounds with the ability to treat it. This paper evaluates the compound Andrographolide from Andrographis paniculata as a potential inhibitor of the main protease of SARS-COV-2 (Mpro) through in silico studies such as molecular docking, target analysis, toxicity prediction and ADME prediction. Andrographolide was docked successfully in the binding site of SARS-CoV-2 Mpro. Computational approaches also predicts this molecule to have good solubility, pharmacodynamics property and target accuracy. This molecule also obeys Lipinski's rule, which makes it a promising compound to pursue further biochemical and cell based assays to explore its potential for use against COVID-19.Communicated by Ramaswamy H. Sarma.","Enmozhi, Sukanth Kumar; Raja, Kavitha; Sebastine, Irudhayasamy; Joseph, Jerrine",J Biomol Struct Dyn,,557
228041,Stop Doing Needless Things! Saving Healthcare Resources During COVID-19 and Beyond,2020,,"Xiaoling, Tian Yang Song Kai Nie Guodong Wang Hongquan Wang Wenbo Xu Wenrui Wang",China CDC Weekly,,557
228231,Biochemical Markers in COVID-19 in Multan,2020,,"Teerawattananon, Yot; Dabak, Saudamini Vishwanath",Nature,,557
230045,Tracheotomies in COVID-19 Patients: Protocols and Outcomes,2021,,"Nierenberg, Andrew A.",Psychiatr. Ann.,,557
230048,Tracheotomies in COVID-19 Patient: Protocols and Outcomes,2021,"This paper looks at how Macao, the world's most densely populated city, deals with the COVID-19 disease, with a focus on government interventions and responses of the gaming concessionaires who operate integrated resorts. Macao was selected as the case not only because of the background of the authors, but also because Macao has been cited in many media coverage as a ""good practice"" example when it comes to fighting against this COVID-19 pandemic situation. Since there are already ample of articles on the background, development timeline, and overall commentary, this paper adopts a mixed approach by combining supplementary secondary data on the COVID-19 timeline in Macao (focusing on government interventions that can affect the tourism and hospitality industry) and primary qualitative in-depth interviews with senior management personnel (holding positions of Director or above) from major integrated resorts in Macao to get insights on industry strategic responses and expectation on future. A total of seven interviews were conducted with senior management members of five integrated resorts in May 2020. Four areas of responses were identified. They are 1. Survival; 2. The New Business Norm; 3. Business Rebound Strategies and 4. Corporate Social Responsibility (CSR). The findings indicate a seemingly utopian scenario among the major integrated resorts and gaming concessionaires in Macao towards their compliance and autonomous actions. The mechanism of this utopian-like scenario is explained by adopting the neo-institutional theory.","Loi, Kim Ieng; Lei, Weng Si; Lourenço, Fernando",Int J Hosp Manag,,557
232881,Qigong exercise enhances cognitive functions in the elderly via an interleukin-6-hippocampus pathway: A randomized active-controlled trial,2021,"O cruzamento é uma ferramenta que pode ser utilizada pelos produtores com o intuito de melhorar a ovinocultura no país, e têm como principal objetivo juntar características de interesse econômico de diferentes raças. O objetivo neste trabalho foi avaliar características de desempenho, carcaça e qualidade da carne de ovinos de diferentes grupos genéticos, desmamados aos 60 ou 90 dias de idade, terminados em confinamento e abatidos com 32 ou 38 kg de peso corporal. Foram utilizados 167 cordeiros machos, não castrados, recém desmamados, pertencentes aos grupos genéticos (GG) Santa Inês (S), Dorper (D), Ile de France (I), Texel (T), ½ D + ½ S, ½ I + ½ S e ½ T + ½ S. Os animais foram distribuídos em quatro tratamentos, constituídos por duas idades ao desmame (ID), 60 ou 90 dias, e dois pesos de abate (PA), 32 kg ou 38 kg de peso corporal. Os animais foram pesados semanalmente até atingirem o peso de abate. Após o abate, as carcaças foram pesadas e acondicionadas em câmara frigorífica (2 ºC) por 24 horas. Após esse período, foram realizadas as medidas morfométricas no lado esquerdo de cada carcaça e separação dos cinco cortes comerciais. Na costela do lado esquerdo de cada carcaça, foram realizadas as análises de área de olho de lombo (AOL), espessura de gordura externa (EG) e cor da gordura (L*, a* e b*). Após a separação do músculo longissimus thoracis foram coletadas amostras de 2,5 cm para as análises de cor da carne (L*, a* e b*), capacidade de retenção de água (CRA), potencial hidrogeniônico (pH), perda de peso por cocção (PPC), sarcômero (SARC), força de cisalhamento (FC) e sensorial. Os dados do consumo de matéria seca, desempenho, qualidade da carcaça e da carne, análise descritiva (AD) e aceitação global (AG) foram analisados, utilizando-se o procedimento Mixed do SAS, em que o modelo estatístico para os dados do consumo de matéria seca, desempenho, qualidade da carcaça e da carne incluiu os efeitos fixos de GG, ID, PA, as interações GG-ID, GG-PA, ID-PA e GG-ID-PA e o resíduo, e o modelo estatístico para as análises de AD e AG incluiu o efeito fixo de GG e os efeitos aleatórios de sessão e provador, além do resíduo. Para a análise check all that apply (CATA), foi utilizando o procedimento Logistic do SAS, com modelo que incluiu o efeito fixo de GG, em que 1(um) representava a ocorrência (sim) do evento e 0 (zero) a não ocorrência do evento. Além disso, foi realizada análise fatorial múltipla no programa XLSTAT. O GG apresentou efeito sobre o consumo de matéria seca total (CMST), tempo de permanência no confinamento (TC), conversão alimentar (CA) e ganho de peso diário (GPD). Interação significativa ID-PA foi verificada para consumo de matéria seca diária (CMSD). Maior CMST foi observado para os animais Santa Inês, ½ I + ½ S e ½ T + ½ S, enquanto que os animais Texel e Ile de France apresentaram maior GPD e CA. GG e PA apresentaram efeito significativo sobre os pesos e os rendimentos de carcaça quente e fria, EG e AOL, enquanto ID não apresentou efeito significativo para nenhuma dessas características. Interação GG-PA foi observada para EG e AOL. Os animais ½ D + ½ S apresentaram valores intermediários entre os Santa Inês e Dorper para peso e rendimento da carcaça. Efeitos significativos de GG e PA foram verificados para todas as características morfométricas, exceto para profundidade do braço (PROFB). Os animais Santa Inês apresentaram maiores comprimento externo e interno, profundidade da carcaça e comprimentos de perna e de braço. Efeitos significativos de GG foram observados para todos os pesos e rendimentos dos cortes da carcaça. Maiores peso e porcentagem de perna foram obtidos pelos animais Texel. O abate de animais com 38 kg de peso proporcionou melhores características da carcaça, além de melhores pesos dos cortes comerciais. Houve efeito de GG sobre as características de cor da carne (L* e b*) e cor da gordura (a* e b*). ID não teve efeito significativo sobre as características de cor da carne e da gordura. Efeito significativo de PA foi observado apenas para o a*_gord. Interação significativa GG-ID foi verificado para a*_carne e b*_carne, enquanto que interação significativa ID-PA foi observada apenas para b*_gord. Não houve efeito significativo de GG para nenhum dos atributos avaliados na AD, CATA e AG. Em geral, nenhum grupo genético apresentou características de qualidade que depreciam o valor da carne ovina, sendo assim, é possível a utilização de qualquer dos grupos genéticos nos sistemas de produção de ovinos, quanto a essas características.","BRITO, GERLANE FERREIRA DE",,,557
232882,Qigong exercise enhances cognitive functions in the elderly via an interleukin-6-hippocampus pathway: A randomized active-controlled trial,2021,"Background: Telestroke network can provide rapid access to specialized treatment and improves on-site management of acute stroke patients through the “hub-and-spoke” model In the northern part of Okayama Prefecture, there has been a regional gap of stroke care due to the shortage of stroke specialists and facilities In addition, due to the novel coronavirus disease 2019 (COVID-19), it is required to reduce the unnecessary contact with stroke patients from other hospitals Aim: We organized a novel cost-free telestroke network with an image and video sharing for neurological diseases in the northern part of Okayama Prefecture to improve the stroke management in the area Method: We prepared the tablet device on which Skype® application was installed for each hospital and recruited the patients who visited or hospitalized in the spoke hospitals and were suspected to have some neurological diseases from April 2019 to May 2020 The patient's clinical data were recorded and analyzed Results: During the study period, 5 patients were recruited including the cases with the initial diagnosis of stroke or brain tumor Among them, 2 cases were transferred to the hub hospital, 2 cases were transferred to other hospitals, and 1 case was treated on site under specialist's advice Conclusion: The new telestroke network system may be beneficial for acute stroke management and reducing the unnecessary patient's transfer in the rural area, especially under coexistence with COVID-19","Sasaki, R.; Yamashita, T.; Omote, Y.; Takemoto, M.; Hishikawa, N.; Yunoki, T.; Kobayashi, K.; Sawata, T.; Sato, Y.; Kubota, J.; Mizobuchi, M.; Hayashi, T.; Abe, K.",Neurology and Clinical Neuroscience,,557
233514,Price Transparency for COVID-19 Testing Among Top US Hospitals,2020,,"Taylor, Luke",BMJ,,557
235223,"Frequency of COVID-19 IgG Antibodies among Special Police Squad Lahore, Pakistan",2020,,"Parhofer, K. G.",MMW Fortschritte der Medizin,,557
237982,Review of Sterilization Techniques for Medical and Personal Protective Equipment Contaminated with SARS-CoV-2,2020,,"Garcell, H. G.",Revista Habanera de Ciencias Medicas,,557
238514,A Walk-through COVID-19 Screening Station Can Preserve Personal Protective Equipment and Quickly Process Patients,2021,"In December 2019, a COVID-19 epidemic was discovered in Wuhan, China, and since has disseminated around the world impacting human health for millions. Herein, in-silico drug discovery approaches have been utilized to identify potential natural products (NPs) as Severe Acute Respiratory Syndrome coronavirus 2 (SARS-CoV-2) main protease (Mpro) inhibitors. The MolPort database that contains over 100,000 NPs was screened and filtered using molecular docking techniques. Based on calculated docking scores, the top 5,000 NPs/natural-like products (NLPs) were selected and subjected to molecular dynamics (MD) simulations followed by molecular mechanics-generalized Born surface area (MM-GBSA) binding energy calculations. Combined 50 ns MD simulations and MM-GBSA calculations revealed nine potent NLPs with binding affinities (&#916;Gbinding ) > -48.0 kcal/mol. Interestingly, among the identified NLPs, four bis([1,3]dioxolo)pyran-5-carboxamide derivatives showed &#916;Gbinding > -56.0 kcal/mol, forming essential short hydrogen bonds with HIS163 and GLY143 amino acids via dioxolane oxygen atoms. Structural and energetic analyses over 50 ns MD simulation demonstrated NLP-Mpro complex stability. Drug-likeness predictions revealed the prospects of the identified NLPs as potential drug candidates. The findings are expected to provide a novel contribution to the field of COVID-19 drug discovery. Communicated by Ramaswamy H. Sarma.","Ibrahim, Mahmoud A A; Abdeljawaad, Khlood A A; Abdelrahman, Alaa H M; Hegazy, Mohamed-Elamir F",J Biomol Struct Dyn,,557
239218,Oral and maxillofacial dental care professionals in critical care during the COVID-19 pandemic,2020,,"Waheed, Waqar; Carey, Magalie E; Tandan, Sarah R; Tandan, Rup",Muscle Nerve,,557
239712,Reasons for physician-related variability in end-of-life decision-making in intensive care,2021,Objective: To determine the diagnostic yield of repeat testing for SARS-CoV-2,"Adamson, P. C.; Goodman-Meza, D.; Vijayan, T.; Yang, ShangXin Garner O. B.",International Journal of Infectious Diseases,,557
239713,Reasons for physician-related variability in end-of-life decision-making in intensive care,2021,"The experiment was carried out in the aviary of Iguatemi Experimental Farm, at Universidade Estadual de Maringá, Maringá, state of Paraná, Brazil, from August 17 to December 6, 1996. After forced molting, 180 commercial laying hens were distributed in a completely randomized design with 5 treatments, 6 replications, and 6 hens for experimental unit. Five isoproteinic (18.68% CP), isoenergetic (2,900.00 kcal ME/kg), isophosphoric (0.46% aP) diets with 3.50%, 3.80%, 4.10%, 4.40% and 4.70% calcium were served. No effects (P > 0.05) of calcium levels were found in the egg laying rate, ration consumption, food conversion and eggshell percentage. A linear increase (P 0.05) in specific weight was found with the increase of calcium levels. A quadratic effect (P 0.05) was found in calcium levels on egg weight. It may be concluded that up to 4.7% calcium may be used efficiently for post-molt commercial laying hens.","Rogério Boscolo, Wilson; Massamito Furuya, Wilson; José Baptista Barbosa, Maria; Eiko Murakami, Alice; Rossetto Barriviera Furuya, Valéria",Acta Sci. Anim. Sci.,,557
240463,COVID-19: The Need for Immunoprevention at Industrial Scale,2020,"Healthy food that includes a diet rich in vegetables is essential for the population's health and well-being since it strengthens the immune system in order to reduce the risk of illnesses and allows for better life quality Surveys that reflect trends in diets, mainly quantity and quality of vegetables and the dissemination of their results may represent an incentive for families, producers, institutions and the population in general to become aware of the multiple benefits of an optimal diet based on healthy and diversified food rich in vegetables of safe and known origin that increase immunity, reduce vulnerability to illnesses and contribute to a good physical state of the population In this context, with the aim of obtaining an updated panorama of the population's vegetable consumption and production preferences and habits and the feeding changes produced in the global Covid-19 pandemic, a survey was carried out by the horticulture team (CRESCA-Centro Regional de Estudio de Cadenas Agroalimentarias) at Facultad de Agronomia (UNCPBA) within its projects and bonds This survey will motivate actions to make the population aware of the need for adequate quantity, quality and variety of vegetable consumption which benefits its life quality, improves its well being and reduces the risk of developing illnesses as from the present global scenario","Castagnino, A. M.; Diaz, K. E.; Rosini, M. B.; Garcia Franco, A.; Martino, B. di Amendolara P.",Horticultura Argentina,,557
240464,COVID-19: The Need for Immunoprevention at Industrial Scale,2020,"COVID-19 has hit hard on the global community, and organizations are working diligently to cope with the new norm of ""work from home"". However, the volume of remote work is unprecedented and creates opportunities for cyber attackers to penetrate home computers. Attackers have been leveraging websites with COVID-19 related names, dubbed COVID-19 themed malicious websites. These websites mostly contain false information, fake forms, fraudulent payments, scams, or malicious payloads to steal sensitive information or infect victims' computers. In this paper, we present a data-driven study on characterizing and detecting COVID-19 themed malicious websites. Our characterization study shows that attackers are agile and are deceptively crafty in designing geolocation targeted websites, often leveraging popular domain registrars and top-level domains. Our detection study shows that the Random Forest classifier can detect COVID-19 themed malicious websites based on the lexical and WHOIS features defined in this paper, achieving a 98% accuracy and 2.7% false-positive rate.","Pritom, M. M. A.; Schweitzer, K. M.; Bateman, R. M.; Xu, M.; Xu, S. H.; Ieee,",2020 Ieee International Conference on Intelligence and Security Informatics,,557
240846,32 Viewing the deceased person: bereaved family uptake of a new service in the wake of COVID-19 restrictions,2021,"If there can be ""love in the time of cholera"", then there can be history of kidney medicine in the time of COVID-19 In our article, we celebrate the history of nephrology, which unites curious young minds with the legacy built by senior figures of the discipline Notably, technological advances such as the Internet have made nephrology history more accessible to a wide range of audiences, including young students and physicians in training The interest that continues to prevail for the field ensures that the future of kidney medicine is bright and bound to expand in new directions We can treat the past and the future with equal precision and rigor under the umbrella of history One can describe a symmetrical timeline with 193 years back to Richard Bright's book in 1827, and 193 years forward to 2213 the point when some expect that human consciousness will be routinely uploaded to inorganic substrates But for now, we shall seek to excavate the past to have a better idea of where we're going and how to achieve desired outcomes, which is especially important in a time of global health emergency, where we are all fighting a single enemy, COVID-19","Solez, K.; Moghe, I.; Wang, Q. Y.; Hu, R.; Solez, K. B.; Cameron, J. S.",Archives of Hellenic Medicine,,557
241301,Fumigation of Schools for COVID-19 Prevention in Nigeria: The Need for a Rethink,2020,,"Yozgat, Can Yilmaz; Uzuner, Selcuk; Bursal Duramaz, Burcu; Yozgat, Yilmaz; Erenberk, Ufuk; Iscan, Akin; Turel, Ozden",Dermatol Ther,,557
241961,Simple Technique for Medical Photography in the Emergency Department During the COVID Pandemic-Say Cheese,2021,"To investigate the cumulative incidence and mortality of COVID-19 and the prevalence of comorbidities such as diabetes, obesity and hypertension in regions with different altitude levels ranging from sea level to high altitude. METHODOLOGY: Analytical study in which we correlated secondary data obtained from reports of the Ministry of Health and National Institute for Statistics and Informatic. The cumulative incidence and mortality of COVID-19 in 25 peruvian regions is reported, together with its relationnship with altitude levels during March-July 2020 using Pearsons correlation. We also aiming to assess the prevalence of diabetes, obesity and hypertension with altitude according to the ENDES 2018 data using Gamma statistics. RESULTS: COVID-19 maintained an inverse correlation with higher rates in the coastal regions and lower rates with increasing altitude in the cumulative incidence (Pearson = -0.8, p < 0.000) and mortality (Pearson = -0.77, p < 0.000), adjusted gender and age. The prevalence of diabetes and obesity showed the same inverse correlation trend with altitude (Gamma p < 0.000) but not hypertension (Gamma p = 0.13) CONCLUSIONS: The data in Peru it is suggested that physiological adaptation in a hypoxic environment at high altitude may protect persons from the severe impact of acute infection caused by SARS-CoV-2. The reduction in cumulative incidence and mortality rates with increasing altitude is the main finding. Possible mechanisms such as a decreased expression of angiotensin-converting enzyme 2 (ACE2) and a lower virulence because of a high altitude environment, may explain this epidemiological features. In addition, the lower prevalence of diabetes, obesity and hypertension may establish a protective epidemiology against these disease.","Seclén, Segundo N; Nunez-Robles, Eloisa; Yovera-Aldana, Marlon; Arias-Chumpitaz, Arturo",Diabetes Res Clin Pract,,557
245847,Reducing transmission of COVID-19 using a continuous negative pressure operative field barrier during oral maxillofacial surgery,2020,"BACKGROUND: In 2018, influenza and pneumonia was the 8th leading cause of death in the United States (US). Since 1950, non-Hispanic blacks (NHB) have experienced higher rates of mortality than non-Hispanic whites (NHW). Previous studies revealed geographic variation in mortality rates by race. The identification of areas with the greatest disparity in influenza and pneumonia mortality may assist policy makers in the allocation of resources including for the COVID-19 pandemic. RESEARCH QUESTION: Does geographic variation in racial disparity in influenza and pneumonia mortality exist? STUDY DESIGN: and Methods: The Centers for Disease Control and Prevention (CDC) database for multiple cause of death between 1999-2018 for NHB and NHW decedents aged &#8805; 25 years with an ICD-10 code for influenza (J09-J11) and pneumonia (J12-J18) was used. Age-adjusted mortality rates (AAMR) with 95% confidence intervals (CI)were computed by race for Health & Human Services (HHS) regions and urbanization in non-Hispanics RESULTS: In 1999-2018, there were 540,476 deaths among NHB and NHW aged 25-84 years. AAMR was higher in NHB than NHW in each age group and in 7 of 10 HHS regions. The greatest disparity was in HHS regions 2 (NY, NJ) and 9 (Arizona, California, Hawaii, Nevada). In HHS region 2, NHB [24.6 (95% CI 24.1-25.1)] were more likely to die than NHW [15.7 (95% CI 15.6-15.9)]. Similarly, in region 9, NHB [23.2 (95% CI 22.7-23.8)] had higher mortality than NHW [16.1 (95% CI 15.9-16.2)]. Within these regions, disparities were greatest in the core of major metropolitan areas. Much of the disparity was due to very high mortality rates in NHB in these areas: region 2 large central metro areas NHB 28.2 (95% CI 27.6-28.9). INTERPRETATION: In 1999-2018 the NHB-NHW disparity in AAMR from influenza and pneumonia was greatest in central metro areas of HHS regions 2 and 9.","Donaldson, Sahai V; Thomas, Alicia N; Gillum, Richard F; Mehari, Alem",Chest,,557
