,index,Unnamed: 0,title_x,x,y,publish_time_x,abstract,authors,journal,category,cluster
5090,5090,5090,Infections de l'intestin grêle,16.52778,-1.1406182,2002,"Cytokines are a family of signaling polypeptides involved in intercellular interactions in the process of the immune response, as well as in the regulation of a number of normal physiological functions. Cytokines are used in medicine for the treatment of cancer, immune disorders, viral infections, and other socially significant diseases, but the extent of their use is limited by the high production cost of the active agent. The development of this area of pharmacology is associated with the success of genetic engineering, which allows the production of significant amounts of protein by transgenic organisms. The review discusses the latest advances in the production of various cytokines with the use of genetically modified plants.","Burlakovskiy, M. S.; Yemelyanov, V. V.; Lutova, L. A.",Appl,459,4
6999,6999,6999,"Abstracts from the 37th Congress of the Société Internationale d’Urologie, Centro de Congressos de Lisboa, October 19-22, 2017",16.628555,-1.4494367,2017-10-19,"Interstitial lung diseases comprise a heterogeneous group of about 200 entities. In the classification of these diseases, diffuse parenchymal lung diseases with known cause, granulomatous diseases, and other specific interstitial lung diseases are separated from the important group of idiopathic interstitial pneumonias, which are classified according to the 2002 ATS/ERS consensus classification. Concerning the histological pattern, this classification differentiates between “usual interstitial pneumonia” (UIP), “nonspecific interstitial pneumonia” (NSIP), “organising pneumonia” (COP), “diffuse alveolar damage” (DAD), “respiratory bronchiolitis” (RB), “desquamative interstitial pneumonia” (DIP), “lymphocytic interstitial pneumonia” (LIP) and “unclassifiable interstitial pneumonias”. A key message of this classification is that the pathologist will give the diagnosis of a histological pattern, whereas the final clinicopathologic diagnosis can be made only by the clinical pulmonologist after careful correlation with the clinical and radiologic features, which is essential in the diagnosis of interstitial lung diseases.","Junker, K.; Brasch, F.",Pathologe,459,4
7078,7078,7078,Terugblik op de influenzapandemie,16.58086,-1.2706438,2010,,,Bone Marrow Transplant,459,4
8082,8082,8082,Enfermedad por virus Ébola y seguridad de las/los estudiantes de enfermería: experiencia de cooperación institucional en una práctica formativa de simulación,16.659992,-1.5443695,2015-03-25,"The symptoms of rhinorrhea secondary to influenza and cold virus or seasonal and perennial allergic rhinitis are circadian rhythmic. Cough frequency and handkerchief use by persons suffering from virus-induced rhinorrhea are more prominent during the daytime, especially during the initial hours after awakening from nocturnal sleep. The elevation in sublingual temperature as well as the decrement in mental alertness associated with influenza in particular are more profound at this time. Sneezing, blocked nose, and runny nose secondary to allergic rhinitis are also greater in intensity during the morning in approximately 70% of sufferers. The day-night variation in symptom intensity amounts to approximately 20% of the 24-hour mean level. The treatment of these diseases and their symptoms has traditionally involved equal-interval, equal-dose (homeostatic) medication schedules. The effects of antihistamine and antiinflammatory medicines may be enhanced by timing them to the day-night temporal pattern in symptom manifestation and intensity to achieve an optimization of their beneficial effects with control of toxicity, that is, as a chronotherapy. (J ALLERGY CLIN IMMUNOL 1995;95:1084-96.)","Smolensky, Michael H.; Reinberg, Alain; Labrecque, Gaston",J Allergy Clin Immunol,459,4
8202,8202,8202,Consenso sobre atención integral de las agudizaciones de la enfermedad pulmonar obstructiva crónica (ATINA-EPOC). Parte II(),16.390608,-1.5239524,2012-05-19,,"Yamey, Gavin; Schäferhoff, Marco; Aars, Ole Kristian; Bloom, Barry; Carroll, Dennis; Chawla, Mukesh; Dzau, Victor; Echalar, Ricardo; Gill, Indermit Singh; Godal, Tore; Gupta, Sanjeev; Jamison, Dean; Kelley, Patrick; Kristensen, Frederik; Mundaca-Shah, Ceci; Oppenheim, Ben; Pavlin, Julie; Salvado, Rodrigo; Sands, Peter; Schmunis, Rocio; Soucat, Agnes; Summers, Lawrence H; El Turabi, Anas; Waldman, Ron; Whiting, Ed",Lancet Glob Health,459,4
8538,8538,8538,Tendencias de la salud internacional: retos y oportunidades para nuestra sociedad,16.609447,-1.5880686,2013-04-03,"The B lymphocytes of the common marmoset Callithrix jacchus can be immortalised by infection with Epstein-Barr virus (EBV) in vitro (Desranges et al., 1976). C. jacchus is susceptible to infection with the blood stages of several species of malaria parasite including the line designated MVF1 (Mitchell et al., 1988) from which it recovers and shows immunity to reinfection. By exploiting these two phenomena, EBV-transformed, marmoset lymphoblastoid cell lines secreting antibodies to malaria parasite antigens have been generated and cloned. We believe this to be the first time that monoclonal antibodies (MAbs) have been raised from common marmosets. Since numerous and diverse human pathogens can infect this small primate in the laboratory, these methods may prove generally applicable for the generation of MAbs whose specificities derive from immune responses to infection.","Johnston, D.A.; Knight, A.M.; Naylor, B.A.; Wedderburn, N.; Mitchell, G.H.",J Immunol Methods,459,4
8616,8616,8616,Síndrome de distrés respiratorio agudo. Conclusiones y perspectivas de futuro(),16.661839,-1.2861656,2009-01-06,,"Tufts, Kimberly Adams",Nurs Outlook,459,4
8675,8675,8675,"Guías de recomendaciones sobre diagnóstico, tratamiento y prevención de infecciones en pacientes con cáncer 2013",16.724825,-1.2307521,2014-08-12,"This paper reports a chemico-enzymatic synthesis of β-CD derivatives. The recognition properties of these derivativeswere tested using flocculating yeast and isolated lectins. It was observed that the substitution of β-cyclodextrins with galactose end arms induces the better recognition by a cell-linked galactose-specific lectin. The physicochemical effects of the β-CD derivatives on membranes were estimated using red blood cells and the effects on the viability of yeast and human rectal tumor cells were appreciated by measuring the mitochondrial deshydrogenase activity. The substitutions of the β-CD ring by sugar antennae decrease the negative physicochemical effects of the β-CD, ie their, hemolytic properties. However, these substitutions induce significant modifications of the biological properties of the molecules, particularly the cytotoxicity and the growth of eukaryotic cells.","Attioui, Fatima; Al-Omar, Anouar; Leray, Eric; Parrot-Lopez, Hélène; Finance, Chantal; Bonaly, Roger",Biol Cell,459,4
9103,9103,9103,Organisation de la réanimation en situation de pandémie de grippe aviaire,16.783772,-1.2875446,2007-11-07,"The analysis of 26 longevity curves of different populations of inbred (Fischer 344) and outbred (Sprague-Dawley) rats highlighted a remarkable between-populations variability in survival parameters. This variability is independent of the breeding characteristics of the strain. The two strains differed in the slope of the survival curves, with Fischer 344 rats showing a higher survival over the second year of life as well as a lower interindividual variability. A model-free approach based on principal component analysis allowed us to quantify these differences and to highlight some limitations of the classical Gompertzian approach.","Ghirardi, Orlando; Cozzolino, Roberto; Guaraldi, Donatella; Giuliani, Alessandro",Exp Gerontol,459,4
9498,9498,9498,Criterios de ingreso hospitalario de los pacientes con una enfermedad pulmonar obstructiva crónica,16.545847,-1.3739196,2013-04-03,,"Gallego Luque, C.; Montero Pérez-Barquero, M.; Cuadrado Marín, P.; Jurado Porcel, A.",Medicine (Madr),459,4
9511,9511,9511,Tratamiento empírico de las infecciones en el adulto,16.809345,-1.3304403,2009-01-06,,"Penel, N.; Bonvalot, S.; Minard, V.; Orbach, D.; Gouin, F.; Corradini, N.; Brahmi, M.; Marec-Bérard, P.; Briand, S.; Gaspar, N.; Llacer, C.; Carrère, S.; Dufresne, A.; Le Cesne, A.; Blay, J.Y.",Ann Oncol,459,4
9555,9555,9555,Bonnes pratiques essentielles en hygiène à l’usage des professionnels de santé en soins de ville,16.570587,-1.2209017,2017-09-01,,"Hatswell, Anthony J.",Pharmacoecon Open,459,4
11577,11577,11577,"À l’occasion de la journée mondiale 2020 de sensibilisation à l’autisme, message et recommandations de l’Académie nationale de médecine",16.436539,-1.5708411,2020-05-15,"Antigenic drift of the hemagglutinin (HA) and neuraminidase (NA) proteins of the influenza virus cause a decrease in vaccine efficacy. Since the information about the evolution of these viruses in Saudi is deficient so we investigated the genetic diversity of circulating H1N1 viruses. Nasopharyngeal aspirates/swabs collected from 149 patients hospitalized with flu‐like symptoms during 2014 and 2015 were analyzed. Viral RNA extraction was followed by a reverse transcription‐polymerase chain reaction and genetic sequencing. We analyzed complete gene sequences of HA and NA from 80 positive isolates. Phylogenetic analysis of HA and NA genes of 80 isolates showed similar topologies and co‐circulation of clades 6b. Genetic diversity was observed among circulating viruses belonging to clade 6B.1A. The amino acid residues in the HA epitope domain were under purifying selection. Amino acid changes at key antigenic sites, such as position S101N, S179N (antigenic site‐Sa), I233T (antigenic site‐Sb) in the head domain might have resulted in antigenic drift and emergence of variant viruses. For NA protein, 36% isolates showed the presence of amino acid changes such as V13I (n = 29), I314M (n = 29) and 12% had I34V (n = 10). However, H257Y mutation responsible for resistance to neuraminidase inhibitors was missing. The presence of amino acid changes at key antigenic sites and their topologies with structural mapping of residues under purifying selection highlights the importance of antigenic drift and warrants further characterization of recently circulating viruses in view of vaccine effectiveness. The co‐circulation of several clades and the predominance of clade 6B.1 suggest multiple introductions in Saudi.","Naeem, Asif; Elbakkouri, Karim; Alfaiz, Ali; Hamed, Maaweya E.; Alsaran, Hadel; AlOtaiby, Shahad; Enani, Mushira; Alosaimi, Bandar",J Med Virol,459,4
12207,12207,12207,Positive association between increased popliteal artery vessel wall thickness and generalized osteoarthritis: is OA also part of the metabolic syndrome?,16.570587,8.411116,2009-07-03,"The diversity and abundance of ammonia-oxidizing archaea (AOA) and ammonia-oxidizing bacteria (AOB) in the sediment of the Pearl River Estuary were investigated by cloning and quantitative real-time polymerase chain reaction (qPCR). From one sediment sample S16, 36 AOA OTUs (3% cutoff) were obtained from three clone libraries constructed using three primer sets for amoA gene. Among the 36 OTUs, six were shared by all three clone libraries, two appeared in two clone libraries, and the other 28 were only recovered in one of the libraries. For AOB, only seven OTUs (based on 16S rRNA gene) and eight OTUs (based on amoA gene) were obtained, showing lower diversity than AOA. The qPCR results revealed that AOA amoA gene copy numbers ranged from 9.6 × 10(6) to 5.1 × 10(7) copies per gram of sediment and AOB amoA gene ranged from 9.5 × 10(4) to 6.2 × 10(5) copies per gram of sediment, indicating that the dominant ammonia-oxidizing microorganisms in the sediment of the Pearl River Estuary were AOA. The terminal restriction fragment length polymorphism results showed that the relative abundance of AOB species in the sediment samples of different salinity were significantly different, indicating that salinity might be a key factor shaping the AOB community composition. ELECTRONIC SUPPLEMENTARY MATERIAL: The online version of this article (doi:10.1007/s00253-011-3107-8) contains supplementary material, which is available to authorized users.","Jin, Tao; Zhang, Tong; Ye, Lin; Lee, On On; Wong, Yue Him; Qian, Pei Yuan",Appl Microbiol Biotechnol,459,1
14717,14717,14717,La prevención y la promoción de la salud en tiempos de cambio(),16.469492,-1.3070132,2020-12-30,,"Sam-Agudu, Nadia A.",Pediatr Res,459,4
16135,16135,16135,Ductal ligation timing and neonatal outcomes: a 12-year bicentric comparison,16.72344,9.052436,2021-03-13,"The methodologies applicable for the evaluation of periodontal associated diseases are constantly evolving to provide quick, realistic, and scientifically proven results. Trends in the past followed a clinical evaluation of periodontal tissues and radiographic-based reports that formed the foundation for detection of diseases involving the structures supporting the teeth. As the confines and limitations of conventional strategies became obvious over the passage of time, hand in hand variety of techniques have evolved and experimentally justified. These improvisations are based on an improved understanding of the periodontal-pathogenic cascade. Periodontal pathogenesis and a paradigm shift from disease understanding to disease prevention and treatment entail few prerequisites that demand the objectivity of diagnostics procedure that includes sensitivity and specificity along with an explanation of the intensity of the disease, Gingival crevicular fluid an oral bio-fluid resides in the close proximity with gingival tissues have been widely used to understand and differentiate the periodontal health and diseased status. The biomarkers present in the GCF can be a reliable tool to detect the minute changes seen in the disease processes. The GCF consists of various host and bacterial-derived products as well as biomarkers which in turn can be evaluated for the diagnosis, prognosis as well as management of the periodontal disease. Thus, the review aims at describing GCF as a potential oral biofluid helpful in differentiating periodontal health and disease status.","Bibi, Tauqeer; Khurshid, Zohaib; Rehman, Ambreen; Imran, Eisha; Srivastava, Kumar Chandan; Shrivastava, Deepti",Molecules,459,1
16416,16416,16416,En respuesta a «Perspectivas de los profesionales de enfermería de cuidados intensivos sobre las visitas abiertas en una UCI»,16.584461,-1.579641,2021-03-26,"OBJECTIVE: To evaluate the efficacy and safety of nebulized magnesium sulphate as a bronchodilator in young children aged 1–24 mo with moderate to severe bronchiolitis in comparison to standard therapy. METHODS: This was an open labeled randomized controlled trial comprising 60 children with moderate to severe bronchiolitis which was randomly assigned to 2 groups. Intervention group received nebulization with 3 mL of 3.2% magnesium sulphate (MgSO(4)) (iso-osmolar) every 4 hourly for 24 h in addition to standard care and the control group received standard care alone. The primary outcome measure was to compare the improvement of bronchiolitis severity score (BSS) and length of hospitalization. The secondary outcome was to measure the need for noninvasive ventilation, need for admission to intensive care unit (ICU) in the initial visit, to evaluate the safety of magnesium sulphate and need for clinic revisit, hospital readmission and ICU readmission within 2 wk after discharge in both the groups. RESULTS: The mean age of children allocated in the control group was 7.4 ± 5.1 mo and 7.7 ± 4.5 mo in the intervention group. There was no significant difference with respect to improvement of BSS or reduced length of hospitalization in both the groups (p > 0.05). BSS monitored sequentially after enrollment at 1, 2, 4, 8, 12, 16, and 24 h did not show statistically significant differences between the groups. Mean length of hospital stay was 2.89 ± 2.25 d in treatment group and 2.96 ± 1.86 d in control group (p = 0.902). No adverse events were observed in both the groups. CONCLUSION: Nebulized magnesium sulphate is not superior to standard therapy in children with moderate to severe bronchiolitis. CLINICAL TRIAL REGISTRATION NUMBER: CTRI/2018/06/014400.","Debbarma, Roma; Khera, Daisy; Singh, Surjit; Toteja, Nisha; Choudhary, Bharat; Singh, Kuldeep",Indian J Pediatr,459,4
16421,16421,16421,Oportunidades tras una pandemia: experiencia de un centro con el empleo de la teleconsulta en la comunicación entre atención primaria y la unidad de endoscopias digestivas,16.627901,-1.4567276,2021-03-26,"The British Society of Gastroenterology (BSG) and the Bangladesh Gastroenterology Society (BGS) have collaborated on an endoscopy training programme, which has grown up over the past decade from a small scheme borne out of the ideas of consultant gastroenterologists in Swansea, South Wales (United Kingdom) to improve gastroenterology services in Bangladesh to become a formalised training programme with broad reach. In this article, we document the socioeconomic and historical problems that beset Bangladesh, the current training needs of doctors and how the BSG-BGS collaboration has made inroads into changing outcomes both for gastroenterologists in Bangladesh, but also for the populations they serve.","Hawkes, Neil; Dave, Umakant; Rahman, Mesbah; Richards, Dafydd; Hasan, Mahmud; Rowshon, A H M; Ahmed, Faruque; Rahman, M Masudur; Kibria, M G; Dodds, Phedra; Hawkes, Bethan; Goddard, Stuart; Rahman, Imdadur; Neville, Peter; Feeney, Mark; Jenkins, Gareth; Lloyd, Keith; Ragunath, Krish; Edwards, Cathryn; Taylor-Robinson, Simon D",Clin Exp Gastroenterol,459,4
17284,17284,17284,Transformer la recherche en santé au Canada en tenant compte de la race,16.463102,-1.4984815,2021-03-22,,"Patzer, Karl-Heinz",MMW Fortschr Med,459,4
19265,19265,19265,Síndrome de burnout y efectos adversos: la prevención ineludible,16.921766,-1.4478252,2021-07-13,"BACKGROUND: We develop a framework for quantifying monetary values associated with changes in disease-specific mortality risk in low- and middle-income countries to help quantify trade-offs involved in investing in mortality reduction due to one disease versus another. METHODS: We monetized the changes in mortality risk for communicable and non-communicable diseases (CD and NCD, respectively) between 2017 and 2030 for low-income, lower-middle-income, and upper-middle-income countries (LICs, LMICs, and UMICs, respectively). We modeled three mortality trajectories (“base-case”, “high-performance”, and “low-performance”) using Global Burden of Disease study forecasts and estimated disease-specific mortality risk changes relative to the base-case. We assigned monetary values to changes in mortality risk using value of a statistical life (VSL) methods and conducted multiple sensitivity analyses. RESULTS: In terms of NCDs, the absolute monetary value associated with changing mortality risk was highest for cardiovascular diseases in older age groups. For example, being on the low-performance trajectory relative to the base-case in 2030 was valued at $9100 (95% uncertainty range $6800; $11,400), $28,300 ($24,200; $32,400), and $30,300 ($27,200; $33,300) for females aged 70–74 years in LICs, LMICs, and UMICs, respectively. Changing the mortality rate from the base-case to the high-performance trajectory was associated with high monetary value for CDs as well, especially among younger age groups. Estimates were sensitive to assumptions made in calculating VSL. CONCLUSIONS: Our framework provides a priority setting paradigm to best allocate investments toward the health sector and enables intersectoral comparisons of returns on investments from health interventions. SUPPLEMENTARY INFORMATION: The online version contains supplementary material available at 10.1186/s12916-021-02029-x.","Khadka, Aayush; Verguet, Stéphane",BMC Med,459,4
24145,24145,24145,Zorgvuldig en verantwoord handelen in de basiszorg,16.41799,-1.1861137,2013-06-14,"#x203A; Although infection is the most common cause of fever, fever is also a common finding in hypersensitivity reaction, autoimmune diseases, and malignancy. › Febrile response is mediated by endogenous pyrogens (cytokines) in response to invading exogenous pyrogens, primarily microorganisms or their direct products (toxins). › These endogenous pyrogens act on thermosensitive neurons in the hypothalamus, which ultimately upgrade the set point via prostaglandins. › The body reacts by increasing the heat production and decreasing the heat loss until the body temperature reaches this elevated set point. › Fever, in contrast to hyperthermia, will not climb up relentlessly because of an effective central control of the hypothalamic center. › Cytokines play a pivotal role in the immune response by activation of the B cells and T lymphocytes. The production of fever simultaneously with lymphocyte activation constitutes the clearest and strongest evidence in favor of the protective role of fever. › The protective processes of the immune response are optimal at high temperature (around 39.5°C). › Not all effects resulting from fever generation benefit the host; some are harmful and even lethal. This occurs mainly by overproduction of the cytokines or imbalance between cytokines and their inhibitors, such as severe and fulminate infections and septic shock.",,Clinical Manual of Fever in Children,459,4
24246,24246,24246,Afwijkingen van het respiratoire systeem,16.650343,-1.1498771,2015-09-24,"Allergic reactions to drugs are not always the result of the drug’s protein-binding capacity, biotransformation, or degradation. Mediator release may occur via cross-linking of cell-bound IgE by di-(multi-) valent free drug. Physiological and pharmacological effects of histamine are mediated through four receptors, H(1), H(2), H(3), and H(4.) The H(3) receptor has a regulatory role in the release of neurotransmitters such as serotonin and dopamine; the H(4) receptor exerts a chemotactic effect on several cell types associated with allergy and asthma. Cysteinyl leukotrienes and PAF are powerful mediators of anaphylaxis, asthma, and shock. Sphingosine-1-phosphate, elevated in the lungs of asthmatics, regulates pulmonary epithelium permeability and contributes to the pathogenesis of anaphylaxis. Urticaria is a heterogeneous disease with many subtypes. Both ACE inhibitors and angiotensin II receptor blockers may cause angioedema. Abacavir changes the shape of the HLA antigen-binding cleft producing an alteration in the repertoire of self-peptides that bind HLA-B*57:01 and a T cell response to self-proteins. Drug-induced delayed-type cutaneous hypersensitivity reactions are mediated by CD4+ and CD8+ CD3+ T cells in the dermis and epidermis. Granulysin appears to be a key molecule for keratinocyte killing in TEN/SJS. Drugs provide good examples of types II (immune hemolytic anemia, drug-induced thrombocytopenia) and III (serum sickness-like) hypersensitivities.","Baldo, Brian A.; Pham, Nghia H.",Drug Allergy,459,4
