,title_x,publish_time_x,abstract,authors,journal,url,category
138928,Transoral endoscopic base of tongue mucosectomy for investigation of unknown primary cancers of head and neck.,2018,"BACKGROUND Human rhinoviruses (HRVs) are an important cause of respiratory tract infections. OBJECTIVES We questioned whether the high prevalence rates of HRVs found in epidemiological studies is due to long-term individual continuity or a result of frequent infections with different HRV subtypes. STUDY DESIGN In a 6-month winter period 18 healthy controls, aged 0-7 years, were at least sampled every two weeks for HRV-PCR, irrespective of respiratory symptoms. All HRV positive samples were genotyped to determine HRV diversity. RESULTS In total 272 samples were collected. HRV was found in 101/272 (37%) samples. Genotyping revealed 27 different HRV subtypes. A median of 3.0 different HRV subtypes was found per child. Re-infections and continuity with identical HRV sequences were observed. The number of HRVs were higher in the youngest age group (p=0.01) and they had more different HRV subtypes (p=0.05) compared to oldest age group. CONCLUSIONS We found a high HRV exposition with a considerable diverse population of HRV subtypes in young children. These results have major implications for future research into the pathogenic role of HRV in respiratory diseases. Characterisation of subtypes will be necessary to discriminate between prolonged continuity and re-infections in patients with respiratory diseases.","van der Zalm, Marieke M; Wilbrink, Berry; van Ewijk, Bart E; Overduin, Pieter; Wolfs, Tom F W; van der Ent, Cornelis K",Journal of clinical virology : the official publication of the Pan American Society for Clinical Virology,https://doi.org/10.1016/j.jcv.2011.09.003; https://www.ncbi.nlm.nih.gov/pubmed/21982210/,744
140198,Video laryngoscope-guided (GlideScope ®) injection of botulinum toxin in laryngectomy patients with limited neck extension.,2020-09-02,,"Greif, Robert; Lockey, Andrew S; Conaghan, Patricia; Lippert, Anne; De Vries, Wiebe; Monsieurs, Koenraad G",Resuscitation,https://doi.org/10.1016/j.resuscitation.2015.07.032; https://www.ncbi.nlm.nih.gov/pubmed/26477418/,744
144151,Admission avoidance in acute epistaxis: a prospective national audit during the initial peak of the COVID-19 pandemic.,2021-01-16,,"Wall, Harriet",Future medicinal chemistry,https://doi.org/10.4155/fmc-2020-0338; https://www.ncbi.nlm.nih.gov/pubmed/33319591/,744
146125,Purpose-built Septal Splints for control of Hereditary Haemorrhagic Telangiectasia related epistaxis: A prospective study.,2021-03-18,"Over the past year, historians of medicine have found our discipline invested with a new sense of relevance. In trying to make sense of epidemics past and present, many of us have been substantially influenced by Charles Rosenberg's 1989 Daedalus essay, ""What Is an Epidemic? AIDS in Historical Perspective."" Writing in the middle of another unfolding global pandemic, Rosenberg suggested that all epidemics possessed similar forms of social choreography, and that applying a narrative framework could help to understand their sequence, structure, and social impact. This issue of the Bulletin offers contributions from thirteen scholars working in various geographic, chronological, and thematic areas that engage with Rosenberg's fundamental historical question about what defines an epidemic, although the question takes on different forms, and different forms of urgency, in each of their works.","Fissell, Mary E; Greene, Jeremy A; Packard, Randall M; Schafer, James A",Bulletin of the history of medicine,https://doi.org/10.1353/bhm.2020.0081; https://www.ncbi.nlm.nih.gov/pubmed/33775938/,744
147693,Histological findings of tracheal samples from COVID-19 positive critically ill mechanically ventilated patients.,2021-10-04,"Respiratory viral infections are common respiratory diseases. Influenza viruses, RSV and SARS-COV2 have the potential to cause severe respiratory infections. Numerous studies have shown that unregulated immune response to these viruses can cause excessive inflammation and tissue damage. Therefore, regulating the antiviral immune response in the respiratory tract is of importance. In this regard, recent years studies have emphasized the importance of vitamin D in respiratory viral infections. Although, the most well-known role of vitamin D is to regulate the metabolism of phosphorus and calcium, it has been shown that this vitamin has other important functions. One of these functions is immune regulation. Vitamin D can regulate the antiviral immune response in the respiratory tract in order to provide an effective defense against respiratory viral infections and prevention from excessive inflammatory response and tissue damage. In addition, this vitamin has preventive effects against respiratory viral infections. Some studies during the COVID-19 pandemic have shown that vitamin D deficiency may be associated with a higher risk of mortality and sever disease in patients with COVID-19. Since, more attention has recently been focused on vitamin D. In this article, after a brief overview of the antiviral immune response in the respiratory system, we will review the role of vitamin D in regulating the antiviral immune response comprehensively. Then we will discuss the importance of this vitamin in influenza, RSV, and COVID-19.","Vaghari-Tabari, Mostafa; Mohammadzadeh, Iraj; Qujeq, Durdi; Majidinia, Maryam; Alemi, Forough; Younesi, Simin; Mahmoodpoor, Ata; Maleki, Masomeh; Yousefi, Bahman; Asemi, Zatollah",Critical reviews in food science and nutrition,https://doi.org/10.1080/10408398.2021.1972407; https://www.ncbi.nlm.nih.gov/pubmed/34470511/,744
147914,COVID-19: protecting our ENT workforce.,2020-04-04,,"Krause, Bernd Joachim; Bartenstein, Peter; Freudenberg, Lutz Stefan; Herrmann, Ken; Jonas, Götz; Luster, Markus; Moka, Detlef; Schäfer, Wolfgang; Schwarzenböck, Sarah Marie; Meyer, Philipp Tobias",Nuklearmedizin. Nuclear medicine,https://doi.org/10.1055/a-1147-6722; https://www.ncbi.nlm.nih.gov/pubmed/32241030/,744
148551,Transoral robotic free flap inset in oropharyngeal cancer.,2020-12-19,,"Sheridan, Cormac",Nature biotechnology,https://doi.org/10.1038/d41587-020-00015-x; https://www.ncbi.nlm.nih.gov/pubmed/32472069/,744
156346,Acute Paediatric Mastoiditis in the UK Before and During the COVID-19 Pandemic: A National Observational Study.,2021-10-04,"PURPOSE To determine the extent of and reasons for hesitancy toward vaccination among adults at high-risk for pneumococcal disease. DESIGN Cross-sectional. SETTING Online survey in March-April 2019 via QuestionPro. SUBJECTS Tennessee adults (18-64 years) at high-risk of pneumococcal disease (n = 1,002). MEASURES Modified version of the validated Vaccine Hesitancy Scale assessed vaccine-related beliefs, reasons for hesitancy, external influences on vaccination, and prior vaccination. ANALYSIS Descriptive and inferential statistics provided an overview of the responses and comparisons among subgroups. Logistic regression determined the odds of being hesitant using the listed beliefs and influencers as predictors. Thematic analysis was performed on the qualitative data gathered from free response questions throughout the survey. RESULTS Analysis included 1,002 complete responses (12% response rate [total viewed = 8,331]) with 34.3% indicating hesitancy toward one or more recommended vaccinations, with 53% of which indicating hesitancy to the pneumococcal vaccine despite it being recommended by the Advisory Committee on Immunization Practices (ACIP) for all respondents. The odds of vaccine hesitancy or resistance were higher in minorities (OR: 1.6; 95% CI: 1.19-2.11), those not believing others like them get vaccinated (OR: 1.82; 95% CI: 1.262-2.613), and respondents recalling negative media about vaccines (OR: 2.56; 95% CI: 1.797-3.643). CONCLUSIONS Patients at high-risk of pneumococcal disease lack awareness of the need for the recommended vaccine, and provider education may need improving to increase vaccination in this population.","Gatwood, Justin; McKnight, Madison; Frederick, Kelsey; Hohmeier, Kenneth; Kapan, Shiyar; Chiu, Chi-Yang; Renfro, Chelsea; Hagemann, Tracy",American journal of health promotion : AJHP,https://doi.org/10.1177/0890117121998141; https://www.ncbi.nlm.nih.gov/pubmed/33657844/,744
614463,One year into the COVID-19 pandemic: What do we know so far from studies assessing risk and mitigation of droplet aerosolisation during endonasal surgery? A systematic review.,2021-09-02,"INTRODUCTION: The safety of renin–angiotensin–aldosterone system inhibitors (RAASi) among COVID-19 patients has been controversial since the onset of the pandemic. METHODS: Digital databases were queried to study the safety of RAASi in COVID-19. The primary outcome of interest was mortality. The secondary outcome was seropositivity improvement/viral clearance, clinical manifestation progression, and progression to intensive care units. A random-effect model was used to compute an unadjusted odds ratio (OR). RESULTS: A total of 49 observational studies were included in the analysis consisting of 83,269 COVID-19 patients (RAASi n = 34,691; non-RAASi n = 48,578). The mean age of the sample was 64, and 56% were males. We found that RAASi was associated with similar mortality outcomes as compared to non-RAASi groups (OR 1.07; 95% CI 0.99–1.15; p > 0.05). RAASi was associated with seropositivity improvement including negative RT-PCR or antibodies, (OR 0.96; 95% CI 0.93–0.99; p < 0.05). There was no association between RAASi versus control with progression to ICU admission (OR 0.99; 95% CI 0.79–1.23; p > 0.05) or higher odds of worsening of clinical manifestations (OR 1.04; 95% CI 0.97–1.11; p > 0.05). Metaregression analysis did not change our outcomes for effect modifiers including age, sex, comorbidities, RAASi type, or study type on outcomes. CONCLUSIONS: COVID-19 is not a contraindication to hold or discontinue RAASi as they are not associated with higher mortality or worsening symptoms. Continuation of RAASi might be associated with favorable outcomes in COVID-19, including seropositivity/viral clearance. SUPPLEMENTARY INFORMATION: The online version contains supplementary material available at 10.1007/s40292-021-00462-w.","Sattar, Yasar; Mukuntharaj, Pradeeksha; Zghouzi, Mohamed; Suleiman, Abdul-Rahman M.; Attique, Hassan; Ullah, Waqas; Sana, Muhammad Khawar; Zaher, Nathan; Mehmood, Maham; Doshi, Rajkumar P.; Panchal, Ankur; Mir, Tanveer; Nadeem, Muhammad; Ali, Omar E.; Mohamed, Mohamad; Bagur, Rodrigo; Elgendy, Islam Y.; Mamas, Mamas A.; Alraies, M. Chadi",High Blood Press Cardiovasc Prev,https://doi.org/10.1007/s40292-021-00462-w; https://www.ncbi.nlm.nih.gov/pubmed/34181203/,744
683568,Low incidence rate of diarrhoea in COVID-19 patients is due to integrin,2021-07-15,"Erosion and runoff from pastures may lead to degradation of surface water. A 2‐yr grazing study was conducted to quantify the effects of grazing management on sediment, phosphorus (P), and pathogen loading of streams in cool‐season grass pastures. Six adjoining 12.1‐ha pastures bisected by a stream in central Iowa were divided into three treatments: continuous stocking with unrestricted stream access (CSU), continuous stocking with restricted stream access (CSR), and rotational stocking (RS). Rainfall simulations on stream banks resulted in greater (P < 0.10) proportions of applied precipitation and amounts of sediment and P transported in runoff from bare sites than from vegetated sites across grazing treatments. Similar differences were observed comparing vegetated sites in CSU and RS pastures with vegetated sites in CSR pastures. Bovine enterovirus was shed by an average of 24.3% of cows during the study period and was collected in the runoff of 8.3 and 16.7% of runoff simulations on bare sites in CSU pastures in June and October of 2008, respectively, and from 8.3% of runoff simulations on vegetated sites in CSU pastures in April 2009. Fecal pathogens (bovine coronavirus [BCV], bovine rotavirus group A, and Escherichia coli O157:H7) shed or detected in runoff were almost nonexistent; only BCV was detected in feces of one cow in August of 2008. Erosion of cut‐banks was the greatest contributor of sediment and P loading to the stream; contributions from surface runoff and grazing animals were considerably less and were minimized by grazing management practices that reduced congregation of cattle by pasture streams.","Schwarte, Kirk A.; Russell, James R.; Kovar, John L.; Morrical, Daniel G.; Ensley, Steven M.; Yoon, Kyoung‐Jin; Cornick, Nancy A.; Cho, Yong Il",J Environ Qual,https://www.ncbi.nlm.nih.gov/pubmed/21712600/; https://doi.org/10.2134/jeq2010.0524,744
