,index,Unnamed: 0,title_x,x,y,publish_time_x,abstract,authors,journal,category,cluster
10755,10755,10755,Correction to Lancet Oncol 2020; published online April 30. https://doi.org/10.1016/S1470-2045(20)30265-5,22.604385,1.0624954,2020-05-04,,"Wood, David A.; Mahmud, Ehtisham; Thourani, Vinod H.; Sathananthan, Janarthanan; Virani, Alice; Poppas, Athena; Harrington, Robert; Dearani, Joseph A.; Swaminathan, Madhav; Russo, Andrea M.; Blankstein, Ron; Dorbala, Sharmila; Carr, James; Virani, Sean; Gin, Kenneth; Packard, Alan; Dilsizian, Vasken; Légaré, Jean-François; Leipsic, Jonathon; Webb, John G.; Krahn, Andrew D.",Ann Thorac Surg,603,1
203827,203827,203827,2019 Coronavirus Disease Applications Made During an Outbreak in a Chemotherapy Center: The Case of Turkey,22.59266,1.2199714,2020,"The COVID-19 pandemic and associated restrictive measures implemented may considerably affect people's lives. This study aimed to assess the well-being of Vietnamese people after COVID-19 lockdown measures were lifted and life gradually returned to normal. An online survey was organized from 21 to 25 April 2020 among Vietnamese residents aged 18 and over. The survey was launched by the Hue University of Medicine and Pharmacy. The WHO-5 Well-Being Index (scored 0-25) was used to score participants' well-being. A multivariate logistic regression model was used to determine the predictors of well-being. A total of 1922 responses were analyzed (mean age: 31 years; 30.5% male; 88.2% health professionals or students in the health sector). The mean well-being score was 17.35 ± 4.97. Determinants of a high well-being score (&#8805;13) included older age, eating healthy food, practicing physical exercise, working from home, and adhering to the COVID-19 preventive measures. Female participants, persons worried about their relatives' health, and smokers were more likely to have a low well-being score. In conclusion, after the lockdown measures were lifted, the Vietnamese have people continued to follow COVID-19 preventive measures, and most of them scored high on the well-being scale. Waiting to achieve large-scale COVID-19 vaccine coverage, promoting preventive COVID-19 measures remains important, together with strategies to guarantee the well-being of the Vietnamese people.","Hoang, Tuyen Dinh; Colebunders, Robert; Fodjo, Joseph Nelson Siewe; Nguyen, Nhan Phuc Thanh; Tran, Trung Dinh; Vo, Thang Van",Int. j. environ. res. public health (Online),603,6
204138,204138,204138,South Korea's COVID-19 Infection Status: From the Perspective of Re-positive Test Results After Viral Clearance Evidenced by Negative Test Results,22.76343,1.3032719,2020,"The worldwide shortage of single-use N95 respirators and surgical masks due to the COVID-19 pandemic has forced many health care personnel to use their existing equipment for as long as possible. In many cases, workers cover respirators with available masks in an attempt to extend their effectiveness against the virus. Due to low mask supplies, many people instead are using face coverings improvised from common fabrics. Our goal was to determine what fabrics would be most effective in both practices. Under laboratory conditions, we examined the hydrophobicity of fabrics (cotton, polyester, silk), as measured by their resistance to the penetration of small and aerosolized water droplets, an important transmission avenue for the virus causing COVID-19. We also examined the breathability of these fabrics and their ability to maintain hydrophobicity despite undergoing repeated cleaning. Laboratory-based tests were conducted when fabrics were fashioned as an overlaying barrier for respirators and when constructed as face coverings. When used as material in these two situations, silk was more effective at impeding the penetration and absorption of droplets due to its greater hydrophobicity relative to other tested fabrics. We found that silk face coverings repelled droplets in spray tests as well as disposable single-use surgical masks, and silk face coverings have the added advantage over masks such that they can be sterilized for immediate reuse. We show that silk is a hydrophobic barrier to droplets, can be more breathable than other fabrics that trap humidity, and are re-useable via cleaning. We suggest that silk can serve as an effective material for making hydrophobic barriers that protect respirators, and silk can now be tested under clinical conditions to verify its efficacy for this function. Although respirators are still the most appropriate form of protection, silk face coverings possess properties that make them capable of repelling droplets.","Parlin, Adam F; Stratton, Samuel M; Culley, Theresa M; Guerra, Patrick A",PLoS One,603,30
208529,208529,208529,Experience of the Coronavirus (COVID-19) patient care in the Amsterdam region: optimization of acute care organization,22.59579,1.306663,2020,,"Ockey, Gary J.",Language Assessment Quarterly,603,21
226234,226234,226234,Correction to Lancet Rheumatol 2020; published online June 25. https://doi.org/10.1016/S2665-9913(20)30173-9,22.767702,0.9538375,2020,,"Rodriguez Escobedo, Raul; Alonso Felgueroso, Carlos; Martinez Tames, Gema; Sanchez Ragnarsson, Cecilia; Menendez Torre, Edelmiro Luis",Endocrinol. diabetes nutr. (Ed. impr.),603,1
226235,226235,226235,Correction to Lancet Rheumatol 2020; published online June 25. https://doi.org/10.1016/S2665-9913(20)30173-9,22.879463,1.029403,2020,"On March 11, 2020 World Health Organization (WHO) declared corona virus disease (COVID-19) to be a pandemic disease, which is caused by a novel coronavirus ""severe acute respiratory syndrome coronavirus-2 (SARS CoV- 2)"" and till now it has affected about 213 countries A nationwide lockdown was announced by the Honorable Prime Minister of India on 24th March 2020 for 21 days to prevent the spread of the COVID-19 Our nation, being a developing nation and emerging market, there was a vast socio-economic consequence of this lockdown Our health care services were at the war front Due to this step, there was a reduction in the rate of the spread of COVID- 19 Other health hazards due to pollution, road traffic accidents, crimes including robberies, rapes, murders, thefts, etc , were decreased substantially People learned good hygiene and family bonding, which was further strengthened Negatively affected sectors were trading companies, schools, and education, economy, stock markets, ongoing events in sports, politics, entertainment industry, transportation, and activities related to religious places, tourists, and hotels Due to starvation, poor people were worst affected as they were daily bread earners though, the government tried to provide money and food Finally, it was the primary care physician, termed ""corona warriors,"" who suffered socially, economically, mentally, and physically Despite all these hardships, the primary care physician learned the innovative way to help patients and ease their suffering with proper advice and awareness","Satish, Kumar Sonkar S. K.; Isha, Atam Harish Gupta Parmar K. S.; Verma, S. K.; Virendra, Atam",Journal of Family Medicine and Primary Care,603,1
237743,237743,237743,Emergence of Coronavirus (COVID-19) Outbreak: Anthropological and Social Science Perspectives,22.54555,1.04234,2020,"This article conceptualizes social distancing in the wake of disasters, such as pandemics, which affect the way actors perceive themselves in relation to the world around them It advances that social distancing goes beyond the mere notion of being physically distant by drawing on work in psychology This article introduces the term actor distance and applies the four domains of temporal, hypothetical, physical and social distance to the construct Moreover, this work embeds actor distance in earlier work on actor wellbeing and the notion of a resources-challenges equilibrium (RCE) concept of wellbeing Expanding on the framework of RCE, this article coins the term of actor safe zone and infuses it into Transformative Service Research It discusses the connection of actor distance, RCE and actor safe zone in the light of major incidents and derives implications for service research and practice","Finsterwalder, Jorg",Service Industries Journal,603,30
245144,245144,245144,"Epidemiologic Features of 135 Patients With Coronavirus Disease (COVID-19) in Tianjin, China",22.527618,1.2803464,2020,"Severe Acute Respiratory Syndrome (SARS) Coronavirus (CoV)-2 is a recently identified positive sense single-strand RNA (ssRNA) β-coronavirus. The viral spike proteins infect human hosts by binding to the cellular receptor angiotensin-converting enzyme 2 (ACE2). The infection causes a systemic illness involving cell metabolism. This widespread involvement is implicated in the pathophysiology of the illness which ranges from mild to severe, requiring multi organ support, ranging from oxygen supplementation to full cardiovascular and respiratory support. Patients with multiple co-existing comorbidities are also at a higher risk. The aim of this review is to explore the exact mechanisms by which COVID-19 affects patients systemically with a primary focus on the bleeding and thrombotic complications linked with the disease. Issues surrounding the thrombotic complications following administration of the ChAdOx1 nCoV-19 (Astra-Zeneca-Oxford) vaccine have also been illustrated. Risk stratification and treatment options in these patients should be tailored according to clinical severity with input from a multidisciplinary team.","Nappi, Francesco Iervolino Adelaide Avtaar Singh Sanjeet Singh",Metabolites,603,24
245146,245146,245146,"Epidemiologic Features of 135 Patients With Coronavirus Disease (COVID-19) in Tianjin, China",22.582972,1.1949469,2020,"The COVID-19 pandemic has brought health professionals face to face with great challenges both personal and professional. They were called to deal with unprecedented situations related to the illness itself, health system’s weaknesses, manage their own stress, cope with social prejudice and stigmatization and more recently deal with the dilemma of getting the COVID-19 vaccine or not. The purpose of the present critical review is to describe challenges faced by health professionals during the COVID-19 pandemic, make suggestions on self care techniques and indicate ways to augment their empowerment. However, not all health professionals develop the same level of stress and/or burnout, since they differ in their ways of reacting to various challenges. In the context of self-care, during the COVID-19 pandemic, psychological empowerment can strengthen resilience, optimize the quality of care provided, contribute to health professionals’ personal development and enhance their sense of personal control. It is important for health professionals to forge their own “shield” of self care that will help them protect against adversities. Future crosssectional and qualitative studies should focus on investigating secondary stress disorders and post traumatic growth, as a result of experiencing COVID-19 pandemic whereas suggest ways to improve health professionals’ physical and mental health during and after the pandemic. © 2020, Society of Nursing Studies. All rights reserved.","Bellali, T.; Manomenidis, G.; Papazisis, G.",Nursing Care and Research,603,30
248711,248711,248711,The Deployment and Operation of Outdoor Treatment Tents During the COVID-19 Pandemic,22.598259,1.140655,2020,"Since the onset of the Coronavirus disease 2019 (COVID-19) pandemic, there has been substantial research and information in media about the mechanisms, and health and economic impacts of COVID-19 There is, however, less information about the possible consequences of this stressful period in developing countries, such as in sub-Saharan Africa;and even less so among lesbian, gay, bisexual, and transgender (LGBT) individuals in these regions In this commentary, we briefly describe the consequences of the COVID-19 pandemic in Nigeria and explore added sources of stress unique to LGBT Nigerians during this period-including exacerbation of preexisting minority stress, financial difficulty, and worries pertaining HIV treatment and COVID-19 infection risk We also highlight some positive outcomes including a stronger sense of community and conclude by recognizing the support from Nigerian LGBT organizations and the need for clinical support and research (PsycInfo Database Record (c) 2021 APA, all rights reserved) Impact Statement Public Significance Statement: In this commentary, we draw attention to possible negative impacts of the COVID-19 pandemic on the mental health of lesbian, gay, bisexual, and transgender (LGBT) Nigerians;and positive aspects of the pandemic such as increased online communication which can make the LGBT community more visible in Nigeria We conclude by recommending more support from clinicians and research into the well-being of LGBT Nigerians (PsycInfo Database Record (c) 2021 APA, all rights reserved)","Oginni, Olakunle Ayokunmi Okanlawon Kehinde Ogunbajo Adedotun",Psychology of Sexual Orientation and Gender Diversity,603,12
262768,262768,262768,Did Persian Nowruz Aggravate the 2019 Coronavirus Disease Crisis in Iran?,22.67309,1.418424,2020,,"Taboada, Manuel; González, Mariana; Alvarez, Antía; Eiras, María; Costa, Jose; Álvarez, Julián; Seoane-Pillado, Teresa",J Infect,603,1
262769,262769,262769,Did Persian Nowruz Aggravate the 2019 Coronavirus Disease Crisis in Iran?,22.870949,1.428021,2020,"The aim of this document is to describe COVID-19 clusters and outbreaks in the EU/EEA and the UK linked to occupational settings, including healthcare and non-healthcare settings, and to identify possible factors contributing to transmission in these settings. Outbreaks or clusters in leisure settings (e.g. households, beaches, parties) or related to mass gatherings and social events (e.g. choir practice, church visits or funerals) are outside of the scope of this document. This report does not address all occupational groups, but takes a broad approach to describing COVID-19 clusters reported by EU/EEA countries and the UK to the European Centre for Disease Prevention and Control (ECDC) and information on relevant COVID-19 clusters gathered by ECDC's Epidemic Intelligence (see Methods chapter). This document does not aim to provide guidance or recommendations on occupational health and safety measures for particular professions in relation to COVID-19 infection control, as this does not fall within ECDC's mandate. The European Agency for Safety and Health at Work (EU-OSHA) has published guidance specifically addressing issues related to workplaces during the COVID-19 pandemic, which also references national and international occupational safety and health guidance for a variety of sectors and occupations. While data on the full spectrum of COVID-19 clusters in occupational settings in the EU/EEA and the UK remain limited, it is clear that the most common exposure relates to lack of physical distancing, particularly in indoor settings, including shared accommodation, canteens, rest rooms and transport. Factors associated with transmission also included face-to-face contact with clients in sectors such as transport and retail, lack of access to hand-washing facilities, the housing conditions of seasonal or migrant workers and appropriate communication of the recommended public health measures. The number of clusters is probably significantly under-identified in occupational settings and at present it is difficult to investigate all clusters thoroughly. Many occupational clusters have been reported in the health and social care sectors, particularly in LTCFs and hospitals;however, these sectors are probably over-represented due to frequent testing in such settings.",,COVID-19 clusters and outbreaks in occupational settings in the EU/EEA and the UK|2020. 17 pp. 67 ref.,603,1
267112,267112,267112,COVID-19 and Alcohol Poisoning: A Fatal Competition,22.628468,1.0390927,2021,,"Peci, Alketa",Revista De Administracao Publica,603,21
278492,278492,278492,How to Build the Plane While Flying: VTE/PE Thromboprophylaxis Clinical Guidelines for COVID-19 Patients,22.61116,1.1110041,2020,"Introduction Dental procedures produce splatter and aerosol which have potential to spread pathogens such as SARS-CoV-2. Mixed evidence exists on the aerosol-generating potential of orthodontic procedures. The aim of this study was to evaluate splatter and/or settled aerosol contamination during orthodontic debonding.Material and methods Fluorescein dye was introduced into the oral cavity of a mannequin. Orthodontic debonding was undertaken with surrounding samples collected. Composite bonding cement was removed using a speed-increasing handpiece with dental suction. A positive control condition included a water-cooled, high-speed air-turbine crown preparation. Samples were analysed using digital image analysis and spectrofluorometric analysis.Results Contamination across the eight-metre experimental rig was 3% of the positive control on spectrofluorometric analysis and 0% on image analysis. Contamination of the operator, assistant and mannequin was 8%, 25% and 28% of the positive control, respectively.Discussion Splatter and settled aerosol from orthodontic debonding is distributed mainly within the immediate locality of the mannequin. Widespread contamination was not observed.Conclusions Orthodontic debonding is unlikely to produce widespread contamination via splatter and settled aerosol, but localised contamination is likely. This highlights the importance of personal protective equipment for the operator, assistant and patient. Further work is required to examine suspended aerosol.","Llandro, Hayley; Allison, James R; Currie, Charlotte C; Edwards, David C; Bowes, Charlotte; Durham, Justin; Jakubovics, Nicholas; Rostami, Nadia; Holliday, Richard",Br. dent. j,603,30
283555,283555,283555,Correction to Lancet Digit Health 2021; published online March 24. https://doi.org/10.1016/S2589-7500(21)00039-X,22.588299,1.299963,2021,"By the time this article is published and read, vaccines and therapeutic remedies should have become available to alleviate the worst of the pandemic But while scientists have been successful in finding a cure for this virus, there is no vaccination for the economic, political, and societal upheaval caused by COVID-19","Dennis, Marguerite J.",Enrollment Management Report,603,16
283556,283556,283556,Correction to Lancet Digit Health 2021; published online March 24. https://doi.org/10.1016/S2589-7500(21)00039-X,22.656868,1.2028893,2021,,"Das, A.; Halder, A.; Patil, R. S.; Harshe, D. G.",Indian Journal of Psychiatry,603,16
284647,284647,284647,Exclusion of SARS-COV-2 From Two Maine Overnight Camps July-August 2020,22.534908,1.0794232,2021,"PURPOSE: As Huntington disease (HD) progresses, speech and swallowing difficulties become more profound. These difficulties have an adverse effect on health-related quality of life (HRQOL), thus psychometrically robust measures of speech and swallowing are needed to better understand the impact of these domains across the course of the disease. Therefore, the purpose of this study is to establish the clinical utility of two new patient-reported outcome measures (PROs), HDQLIFE Speech Difficulties and HDQLIFE Swallowing Difficulties. METHODS: Thirty-one participants with premanifest or manifest HD, and 31 age- and sex-matched healthy control participants were recruited for this study. Participants completed several PROs [HDQLIFE Speech Difficulties, HDQLIFE Swallowing Difficulties, Communication Participation Item Bank (CPIB)], as well as several clinician-rated assessments of speech and functioning. A computational algorithm designed to detect features of spoken discourse was also examined. Analyses were focused on establishing the reliability and validity of these new measures. RESULTS: Internal consistency was good for Swallowing (Cronbach's alpha = 0.89) and excellent for Speech and the CPIB (both Cronbach's alpha &#8805; 0.94), and convergent/discriminant validity was supported. Known groups validity for the PROs was supported by significant group differences among control participants and persons with different stages of HD (all p < 0.0001). All PROs were able to distinguish those with and without clinician-rated dysarthria (likelihood ratios far exceeded the threshold for clinical decision making [all &#8805; 3.28]). CONCLUSIONS: Findings support the clinical utility of the HDQLIFE Speech and Swallowing PROs and the CPIB for use across the HD disease spectrum. These PROs also have the potential to be clinically useful in other populations.","Carlozzi, Noelle E; Boileau, Nicholas R; Roberts, Angela; Dayalu, Praveen; Hanifan, Dana L; Miner, Jennifer A; Claassen, Daniel; Provost, Emily Mower",Qual. life res,603,27
286239,286239,286239,COVID-19 resurgence: lessons learnt to inform the South African response,22.544134,1.1698875,2021,"The uncertainty caused by the COVID-19 pandemic has exacerbated negative emotions, especially among adolescents, who feel unable to tolerate the uncertainty of the epidemic. However, the mechanism by which the intolerance of COVID-19-related uncertainty (COVID-19 IU) affects negative emotions in adolescents remains unclear. This study explored the underlying mechanism from COVID-19 IU to negative emotions using a moderated mediation model in adolescents. In total, 3037 teenagers completed a cross-sectional survey including measures of COVID-19 IU, risk perception, social exclusion, perceived efficacy, and negative emotions. The results showed that COVID-19 IU positively predicted negative emotions and that risk perception and social exclusion mediated this relationship. In addition, both the direct effect of COVID-19 IU on negative emotions and the mediating effect of risk perception on this relationship were moderated by perceived efficacy; in particular, COVID-19 IU had a greater impact on negative emotions among adolescents with lower levels of perceived efficacy. These findings suggest that COVID-19 IU is closely associated with negative emotions among adolescents and that effective measures should be taken to enable adolescents to improve their perceived efficacy and develop a reasonable perception of risk, help them eliminate the stigma of the disease, and strengthen their connections with society.","Li, Qi; Luo, Ronglei; Zhang, Xiaoya; Meng, Guangteng; Dai, Bibing; Liu, Xun",Int. j. environ. res. public health (Online),603,30
304811,304811,304811,"A COVID-19 Lockdown Tabletop Exercise in New Taipei City, Taiwan",22.63223,1.2136534,2021,,"Shen, Xin; Zou, Xiaoyue; Zhong, Xiaofeng; Yan, Jing; Li, Li",Crit Care,603,20
308679,308679,308679,The COVID-19 Pandemic and Mental Well-Being of Pregnant Women in Japan: Need for Economic and Social Policy Interventions,22.535814,1.3209685,2020,"BACKGROUND: Pediatric anesthesiology has been greatly impacted by COVID-19 in the delivery of care to patients and to the individual providers. With this study, we sought to survey pediatric centers and highlight the variations in care related to perioperative medicine during the COVID-19 pandemic, including the availability of protective equipment, the practice of pediatric anesthesia, and economic impact. AIM: The aim of the survey was to determine how COVID-19 directly impacted pediatric anesthesia practices during the study period. METHODS: A survey concerning four major domains (testing, safety, clinical management/policy, economics) was developed. It was pilot tested for clarity and content by members of the Pediatric Anesthesia COVID-19 Collaborative. The survey was administered by email to all Pediatric Anesthesia COVID-19 Collaborative members on September 1, 2020. Respondents had six weeks to complete the survey and were instructed to answer the questions based on their institution's practice during September 1 - October 13, 2020. RESULTS: Sixty-three institutions (100% response rate) participated in the COVID-19 Pediatric Anesthesia Survey. Forty-one hospitals (65%) were from the United States, and 35% included other countries. N95 masks were available to anesthesia teams at 91% of institutions (n = 57) (95% CI: 80%-96%). COVID-19 testing criteria of anesthesia staff and guidelines to return to work varied by institution. Structured simulation training aimed at improving COVID-19 safety and patient care occurred at 62% of institutions (n = 39). Pediatric anesthesiologists were economically affected by a reduction in their employer benefits and restriction of travel due to employer imposed quarantine regulations. CONCLUSION: Our data indicate that the COVID-19 pandemic has impacted the testing, safety, clinical management, and economics of pediatric anesthesia practice. Further investigation into the long-term consequences for the specialty is indicated.","Soneru, Codruta N; Fernandez, Allison M; Bradford, Victoria; Staffa, Steven J; Raman, Vidya T; Cravero, Joseph; Zurakowski, David; Meier, Petra M",Paediatr Anaesth,603,24
