,title_x,publish_time_x,abstract,authors,journal,url,category
351467,Mental Health Problems during the COVID-19 Pandemics and the Mitigation Effects of Exercise: A Longitudinal Study of College Students in China,2020,"Purpose The COVID-19 crisis has brought to the forefront the importance of rural health enterprises (RHEs), the peculiarity, in these terms, of rural areas, and the impact of rurality on health entrepreneurial activities This paper aims to undertake a literature review regarding RHEs in the EU, identify research gaps and set future research directions Design/methodology/approach A systematic literature review was conducted and the key aspects coded across four thematic areas - after examining 68 papers Findings The findings reveal that more intense research should be conducted across four area which emerged;rural health providers vs urban health providers;RHEs and rural development;RHEs and quality of life;and social RHEs Research limitations/implications Future research avenues were identified and suggestions for further research on RHEs were provided Practical implications The paper provides insights into how rural areas can attract health enterprises and how health enterprises can operate in rural areas Originality/value This research expands on the limited existing knowledge of RHEs and sets the foundations for further research","Apostolopoulos, N.; Ratten, V.; Stavroyiannis, S.; Makris, I.; Apostolopoulos, S.; Liargovas, P.",Journal of Enterprising Communities-People and Places in the Global Economy,,426
352667,Development of an Assessment Method for Investigating the Impact of Climate and Urban Parameters in Confirmed Cases of COVID-19: A New Challenge in Sustainable Development,2020,"PURPOSE: The aim of this study was to report the radiological features of chest CT scan of patients with coronavirus disease 2019 (COVID-19) living in a town in Southern Italy where a significant outbreak of the disease occurred. METHODS: We revised the CT scan of 62 patients (34 male, 28 female, mean age 71 +/- 14 years) with clinical and laboratory signs of COVID-19, as assessed by positive SARS-CoV-2 RT-PCR testing. All patients underwent chest CT at the time of admission to the hospital. A semi-quantitative scoring system was used to evaluate the extension of the disease. RESULTS: Out of the 62 patients the main radiological findings were reticular pattern (29%), ground-glass opacities (24%), crazy paving pattern (11%) and consolidation (35%). Most of the lesions were bilateral (97%), posterior (95%) and located near pleura (50%) or lung fissures (45%), mainly involving the lower right lobe (56%) and lower left lobe (23%). Pleural thickening was observed in 72.6% of patients and pleural effusion in 18%. Median value of the score was 7.0 and was significantly higher in male than female (8.5 vs 6.0, p=0.03) and in patients with pleural thickening compared to those without this finding (8.0 vs 5.0, p=0.03).","Martino, Alberigo; Fiore, Emilio; Mazza, Emerico Maria; Minichiello, Stefana; Brogna, Barbara; Petronilla, Salvatore; Megliola, Antonia; Musto, Lanfranco",Infez Med,,426
353192,"Viral Pandemics of the Last Four Decades: Pathophysiology, Health Impacts and Perspectives",2020,,"Miller, J.; Opat, S.; Shortt, J.; Kotsanas, D.; Dendle, C.; Graham, M.",Infect Control Hosp Epidemiol,,426
353390,Empathy and COVID-19: Study in Professionals and Students of the Social Health Field in Ecuador,2021,,"Rai, D. K.; H, A.; Sahay, N.",The Journal of the Association of Physicians of India,,426
353514,Prioritizing Built Environmental Factors to Tackle Chronic and Infectious Diseases in Remote Northern Territory (NT) Communities of Australia: A Concept Mapping Study,2021,"The transcriptional regulator YAP, which plays important roles in the development, regeneration, and tumorigenesis, is activated when released from inhibition by the Hippo kinase cascade. The regulatory mechanism of YAP in Hippo-low contexts is poorly understood. Here, we performed a genome-wide RNA interference screen to identify genes whose loss of function in a Hippo-null background affects YAP activity. We discovered that the coatomer protein complex I (COPI) is required for YAP nuclear enrichment and that COPI dependency of YAP confers an intrinsic vulnerability to COPI disruption in YAP-driven cancer cells. We identified MAP2K3 as a YAP regulator involved in inhibitory YAP phosphorylation induced by COPI subunit depletion. The endoplasmic reticulum stress response pathway activated by COPI malfunction appears to connect COPI and MAP2K3. In addition, we provide evidence that YAP inhibition by COPI disruption may contribute to transcriptional up-regulation of PTGS2 and proinflammatory cytokines. Our study offers a resource for investigating Hippo-independent YAP regulation as a therapeutic target for cancers and suggests a link between YAP and COPI-associated inflammatory diseases.","Kim, Yong Joon; Jung, Eunji; Shin, Eunbie; Hong, Sin-Hyoung; Jeong, Hui Su; Hur, Gayeong; Jeong, Hye Yun; Lee, Seung-Hyo; Lee, Ji Eun; Kim, Gun-Hwa; Kim, Joon",Proc. Natl. Acad. Sci. U. S. A,,426
354849,Intervention Fatigue is the Primary Cause of Strong Secondary Waves in the COVID-19 Pandemic,2020,[Figure: see text].,"Siegel, Jennifer",Ann Intern Med,,426
355741,COVID-19 among Health Workers in Germany and Malaysia,2020,"We examine the relationship between renewable and non-renewable energy consumption and economic growth in the United States While the regime-dependent Granger causality test results for the non-renewable energy consumption and economic growth suggest bi-directional causality in both regimes, we cannot validate any causality between renewable energy consumption and economic growth The US meets its energy demand from non-renewable sources;as such, renewable energy consumption does not seem to affect economic growth Given the efficiency and productivity of renewable energy investments, we conclude that it is worthwhile to consider renewable energy inputs to replace fossil fuels given potential benefits in terms of global warming and climate change concerns In this regard, increasing the R&D investments in the renewable energy sectors, increases in productivity and profitability of renewable energy investments are likely to accrue benefits in the long run",,Energy &amp; Environment,,426
358451,Mental Health and the Symptoms of PTSD in People with Depression and Anxiety Disorders during the COVID-19 Pandemic,2021,"Objective Low vitamin D blood levels have been linked to an increased risk of acute respiratory infections (ARIs). Taking a vitamin D supplement reduced the risk of having ARI. Non-ICU in-patients in our hospital with a vitamin D deficiency were supplemented with vitamin D. Methods and procedures From March to May 2020, data of non-ICU patients with Covid-19 infection were collected at discharge. Vitamin D serum levels were assessed at admission and correlated to age, sex, Body Mass Index (BMI), length of stay (LOS) and discharge outcome. Mean and standard deviation or percentage were calculated for all data. Results Vitamin D serum level was assessed at admission in n. 97 non-ICU patients. Most of them (80%) have a deficiency of vitamin D (&lt; 20 ng/mL), median age is 63,7 years, 71% are men, mean BMI is 26,5, median LOS is 13,6 days (Table 1) and above 25% have a worse discharge outcome (sub-ICU, ICU or death) as shown in Table 2. Patients with a sub-obtimal vitamin D level are 14%, mostly female (64%), with a lower mean BMI (24,8), mean LOS of 15,4 days and a worse discharge outcome in 14% of cases. Only 5 patients have a sufficient vitamin D serum level, mean age of 61,2 years, mean BMI of 24,6, mean LOS of 9,2 and home discharge outcome for all of them. Conclusion Low vitamin D levels seem to correlate with a higher risk of developing the disease;supplementation of vitamin D may help in reducing the risk of ARI and improving outcome.","Mascheroni, A.; Cremonesi, I.; Merelli, E.; Misotti, A. M.; Tamburelli, B.; Tirelli, M. E.",Nutrition,,426
358968,The Impact of Risk Perception on Social Distancing during the COVID-19 Pandemic in China,2020,,"Dean, Wendy; Jacobs, Breanne; Manfredi, Rita A",Ann Emerg Med,,426
360449,Effects of COVID-19 Infection during Pregnancy and Neonatal Prognosis: What Is the Evidence?,2020,"The COVID-19 pandemic has created a great deal of anxiety for many individuals. Several papers have noted that individuals with OCD may be particularly negatively impacted by COVID-19, and that the threat of COVID-19 may impact treatment (Banerjee, 2020; Jassi et al., 2020; Sheu et al., 2020). The study presented herein examined OCD-related and COVID-related intrusions in a non-patient sample. Individuals with elevated OCD symptoms reported having both OCD and COVID intrusions at a similar frequency. Further, OCD symptom severity was significantly correlated with the frequency of COVID related intrusions and the amount of distress they caused. However, distress from COVID related intrusions was not significantly correlated with OCD symptom severity. These results shed light on the similarities between reactions to objectively elevated threat and the perceptions of elevated threat experienced in OCD.","Acenowr, Cohley P; Coles, Meredith E",Psychiatry Res,,426
360643,Risk Interactions of Coronavirus Infection across Age Groups after the Peak of COVID-19 Epidemic,2020,,"D039,; Alimonte, Laura Oshin Fatima Cumming Jessica Fleming Kristen Prantera Angela",Journal of Medical Imaging &amp; Radiation Sciences,,426
362258,"Changes in Sex Life among People in Taiwan during the COVID-19 Pandemic: The Roles of Risk Perception, General Anxiety, and Demographic Characteristics",2020,,"Reinhardt, Dietrich",MMW Fortschr Med,,426
362444,The Impact of Social Support on Public Anxiety amidst the COVID-19 Pandemic in China,2020,"During the coronavirus disease 2019 (COVID-19) pandemic, many hospitals have added COVID-19-specific visitor restrictions to their routine visitor restrictions. These additional visitor restrictions are designed to reduce viral transmission, protect patients and staff, and conserve personal protective equipment. They typically exempt patients with disabilities and those who are dying. Consistent application of these policies may, however, be inequitable. We present the case of a single mother seeking an individual exemption to both a routine and a COVID-19 specific visitor restriction. One commentator focuses on the importance of clear and transparent processes for considering requests for exceptions. The other argues that disproportionate burdens may be mitigated in other ways and the policy maintained.","Lanphier, Elizabeth; Mosley, Luke; Antommaria, Armand H Matheny",Pediatrics,,426
363145,The Tipping Effect of Delayed Interventions on the Evolution of COVID-19 Incidence,2021,,"Hackethal, Veronica",Oncology Times,,426
363262,A Scoping Review of How Income Affects Accessing Local Green Space to Engage in Outdoor Physical Activity to Improve Well-Being: Implications for Post-COVID-19,2020,,"Yang, Chao",Graefes Arch Clin Exp Ophthalmol,,426
363500,Importance-Performance Analysis of Health Perception among Korean Adolescents during the COVID-19 Pandemic,2021,"The World Health Organization (WHO) officially announced coronavirus disease 2019 (COVID-19) as a pandemic in March 2020. Unfortunately, there are still no approved drugs for either the treatment or the prevention of COVID-19. Many studies have focused on repurposing established antimalarial therapies, especially those that showed prior efficacy against Severe Acute Respiratory Syndrome Coronavirus (SARS-CoV) and Middle East Respiratory Syndrome Coronavirus (MERS-CoV), such as chloroquine and hydroxychloroquine, against COVID-19 combined with azithromycin. These classes of drugs potentially induce prolongation of the QT interval, which might lead to lethal arrhythmia. Beta-blockers, as a beta-adrenergic receptor (beta-AR) antagonist, can prevent an increase in the sympathetic tone, which is the most important arrhythmia trigger. In this literature review, we aimed to find the effect of administering azithromycin, chloroquine, and hydroxychloroquine on cardiac rhythm disorders and our findings show that bisoprolol, as a cardio-selective beta-blocker, is effective for the management of the QT (i.e., the start of the Q wave to the end of the T wave) interval prolongation in COVID-19 patients.","Heriansyah, T.; Chomsy, I. N.; Febrianda, L.; Hadi, T. F.; Wihastuti, T. A.",Scientia Pharmaceutica,,426
364873,Exploring the Frequency of Anxiety and Depression Symptoms in a Brazilian Sample during the COVID-19 Outbreak,2021,"Program Goals School-Based Health Centers (SBHCs) provide a cost-effective way to reduce healthcaredisparities of underserved populations (AmJPrevMed,2016), and provide a way to advocate for children'shealth, an essential skill for pediatricians to learn This advocacy project, led by a pediatric resident and aschool nurse, established a SBHC in Winooski, VT, a town with a diverse underserved population of 7500 TheWinooski School District serves 691 elementary through high school students, who speak 18 languages, and98% of whom qualify for Free and Reduced Lunch Although most students have a primary care provider(PCP), families face multiple barriers to accessing care The idea of opening a part-time SBHC was conceived toaddress these barriers, modeled after similar nearby SBHCs To establish the SBHC, the resident and nurseassembled a multidisciplinary team, recruited physicians, secured grants, and engaged leaders from theschool, healthcare organizations, health department, and the community Within 12 months, the SBHC opened, with the mission to increase students' access to quality healthcare, reduce healthcare disparities, andpromote student wellness Evaluation Now in its third year, the SBHC is open twice weekly, staffed by apediatrician or physician's assistant Services include acute visits, follow-ups, chronic and behavioral conditionmanagement, and basic laboratory tests and procedures Students are referred to PCPs for well care, and acoordinator assists with data collection and PCP communication A community advisory council informs SBHCoperations To fund services, the school donates space, providers bill for services, healthcare organizationsdonate supplies, and grants funded initial equipment Utilization of the SBHC has been increasing (Figure 1) Almost all (95%) of SBHC users are covered by Medicaid Most visits are scheduled (70-94%) and are for acutecomplaints (70-77%) Although 41-50% of visits result in prescriptions, labs, imaging, or procedures, moststudents stay in school after visits (Figure 2) Students who are overdue for well visits (10-20 yearly) arescheduled with their PCP Discussion This project highlights successful collaboration between a pediatricresident, school nurse, and the community to establish a SBHC Multiple factors contributed to initial success, including a strong school nurse advocate who contributes in-kind planning time and effectively recruitspatients, a collaborative local culture that facilitates partnerships between stakeholders in the health andeducation sectors, and access to initial grant funding The SBHC is now sustainable: it is nancially viable without further grants;leadership is transitioning to a rst-year resident;and data demonstrates an ongoingneed for the SBHC Next steps include increasing patient recruitment and adolescent outreach, engagingstakeholders to adapt operations to the COVID-19 pandemic, and gathering data on SBHC impact on health and educational outcomes We hope this work inspires trainees and school staff to promote school health within their communities","Zuckerman, A.; Pauley, V.; Parris, E.",Pediatrics,,426
365639,How Does a Public Health Emergency Motivate People's Impulsive Consumption? An Empirical Study during the COVID-19 Outbreak in China,2020,"STRUCUTRED ABSTRACTO_ST_ABSObjectivesC_ST_ABSEnsuring a high COVID-19 vaccine uptake among U.S. child care providers is crucial to mitigating the public health implications of child-to-staff and staff-to-child transmission of SARS-CoV-2; however, the vaccination rate among this group is unknown. MethodsTo characterize the vaccine uptake among U.S. child care providers, we conducted a cross-sectional survey of the child care workforce. Providers were identified through various national databases and state registries. A link to the survey was sent via email between May 26 and June 23, 2021. Out of 44,771 potential respondents, 21,663 responded (48.4%). ResultsOverall COVID-19 vaccine uptake among U.S. child care providers (78.1%, 95% CI [77.3% to 78.9%]) was higher than that of the U.S. adult population (65%). Vaccination rates varied from 53.5% to 89.4% between states. Vaccine uptake differed significantly (p < .01) based on respondent age (70.0% for ages 25-34, 91.5% for ages 75-84), race (70.0% for Black or African Americans, 92.5% for Asian-Americans), annual household income (70.7% for <$35,000, 85.0% for>$75,000), and childcare setting (72.9% for home-based, 79.7% for center-based). ConclusionsCOVID-19 vaccine uptake among U.S. child care providers was higher than that of the general U.S. adult population. Those who were younger, lower income, Black or African American, resided in states either in the Mountain West or the South, and/or worked in home-based childcare programs reported the lowest rates of vaccination; state public health leaders and lawmakers should prioritize these subgroups for placement on the policy agenda to realize the largest gains in vaccine uptake among providers. Tables of Contents SummaryThis article describes the results of a national survey of childcare providers to determine the overall COVID-19 vaccine uptake and the gaps in vaccine coverage. Whats Known on This SubjectEnsuring a high COVID-19 vaccine uptake among U.S. child care providers is crucial to mitigating the public health implications of child-to-staff and staff-to-child transmission of SARS-CoV-2; however, the vaccination rate among this group is unknown. What This Study AddsWhile the vaccine uptake among U.S. child care providers was higher than that of U.S. adults, certain subgroups continue to warrant focused attention for outreach and/or placement on the policy agenda.","Patel, Kavin; Malik, Amyn A.; Lee, Aiden; Klotz, Madeline; Humphries, John Eric; Murray, Thomas; Wilkinson, David; Shafiq, Mehr; Yildirim, Inci; Elharake, Jad; Diaz, Rachel; Reyes, Chin; Omer, Saad; Gilliam, Walter",,,426
365944,French Public Familiarity and Attitudes toward Clinical Research during the COVID-19 Pandemic,2021,"Boredom in adolescence is often underestimated, although it may be the sign of a profound unease or be associated with psychological disorders Given the complexity of the construct of boredom and its increasing prevalence among adolescents in recent years, the present study aimed to validate the factorial structure of the Italian version of the Multidimensional State Boredom Scale (MSBS) in adolescents using a cross-validation approach The study involved 272 students (33 8% males, 66 2% females) aged 14–19 (M = 15 9, SD = 1 38) living in northern and central Italy In addition to the MSBS, the Symptoms Checklist 90-R (SCL 90-R) and the Children’s Depression Inventory (CDI) were administered Exploratory and confirmatory factor analyses validated a 23-item structure of the MSBS, comprising five correlated factors The tool showed a good internal consistency for these factors and a good convergent and factor validity The MSBS consequently seems a valid and reliable method for assessing boredom in adolescence The cut-off for the total score that could pinpoint cases posing a potential clinical risk was 88 A weak correlation was found between the total level of boredom and the daily Internet usage, while no relationship emerged between boredom and age, gender, and grades Since excessive levels of boredom may conceal a general unease that could develop into structured psychological disorders, the value of the MSBS lies in enabling us to identify in advance adolescents at potential clinical risk","Spoto, Andrea Iannattone Sara Valentini Perla Raffagnato Alessia Miscioscia Marina Gatta Michela",Children,,426
366006,Parental Involvement in Children's Sleep Care and Nocturnal Awakenings in Infants and Toddlers,2020,"With the implementation of the new Kidney Allocation System (KAS), there is increased reliance on a virtual crossmatch/histocompatibility risk assessment (vXM) for evaluating potential presence, as well as strength, of HLA antibodies against a potential donor. The accuracy of such an assessment depends on the precision in the identification of the recipient's antibody profile and the potential donor's HLA typing. While the development of the single antigen bead (SAB) multiplex assay has improved the sensitivity and specificity of HLA-antibody detection, several limitations of the assay (specific to certain sensitized patients) can complicate accurate interpretation of results. In this report, we focus on the ""shared-epitope"" phenomenon, a condition in which antibody strength can be underrepresented, or its presence completely missed, due to binding of the antibody to competing targets on multiple antigens (beads), effectively ""diluting"" the resulting MFI-readout. Here, we provide a relevant background to understand this phenomenon and present a couple of case studies illustrating how it can be investigated, leading to a more accurate histocompatibility consultation.","Garcia-Sanchez, Cynthia; Usenko, Crystal Y; Herrera, Nancy D; Tambur, Anat R",Clin Transplant,,426
369260,"Psychosocial Barriers of Public Transport Use and Social Exclusion among Older Adults: Empirical Evidence from Lahore, Pakistan",2020,,"Maltezou, Helena C; Papadima, Kalliopi; Gkolfinopoulou, Kassiani; Ferentinos, George; Mouratidou, Elisavet; Andreopoulou, Anastasia; Pavli, Androula; Magaziotou, Ioanna; Georgakopoulou, Theano; Mellou, Kassiani; Vorou, Rengina; Antoniadou, Anastasia; Stathakarou, Anastasia; Chrysochoou, Anastasios; Gogos, Charalambos; Karaiskou, Angeliki; Kotanidou, Anastasia; Koutsoukou, Antonia; Marangos, Markos; Mentis, Andreas; Metallidis, Symeon; Papa, Anna; Pefanis, Angelos; Tsakris, Athanasios; Sipsas, Nikolaos V",Travel Med Infect Dis,,426
370735,Depressive Symptoms in Swiss University Students during the COVID-19 Pandemic and Its Correlates,2021,,"Desai, Bhakti K",J Dent Educ,,426
370736,Depressive Symptoms in Swiss University Students during the COVID-19 Pandemic and Its Correlates,2021,"Chordomas are rare, locally aggressive bone malignancies with poor prognoses. However, those with minimal or no bone involvement are more easily resectable because of their well-delineated margins and thus have better prognoses. Such extraosseous chordomas of the spine are localized both intradurally and extradurally. Only a few case reports have focused on extraosseous, extradural spinal chordomas. Radiologically, this type of chordoma has a dumbbell shape; however, dumbbell-shaped spinal tumors are traditionally thought to be neurogenic tumors (i.e., schwannomas or neurofibromas). We herein report a unique case involving a woman with a dumbbell-shaped extraosseous chordoma protruding predominantly into the retropharyngeal space. A 44-year-old woman presented for evaluation of a left submandibular mass. A T2-hyperintense, gadolinium-enhancing mass was found in her cervical spinal canal, protruding through the C2/3 neural foramen into the retropharyngeal space with minimal vertebral involvement. The initial diagnosis was a neurogenic tumor, most likely a schwannoma. After subtotal removal, the pathologic diagnosis was a chordoma. Because chordomas and schwannomas have significantly different prognoses, caution is warranted when a dumbbell-shaped tumor is identified in the spine with minimal or no vertebral deterioration on radiology. This report also provides the first thorough review of extraosseous dumbbell-shaped intraspinal-extraspinal chordomas.","Lee, Sun Joo; Paeng, Sung Hwa; Kang, Mi Seon; Jung, Soo Jin; Yoon, Shin Ae; Park, Ha Young; Yoon, Hye Kyoung; Yang, Young Il; Cho, Hwa Jin",J Int Med Res,,426
371094,Assessing the Psychological Impacts of COVID-19 in Undergraduate Medical Students,2021,"This article deals with the provision of cooperation of the Army of the Czech Republic with other units of rescue teams in the implementation of rescue and liquidation work in the regions of the Czech Republic in non-military crisis situations At the present time of the global pandemic of covid-19 and the associated mass deployment of forces and resources of the primary and secondary units of the rescue system, the required effective cooperation in practice has proved necessary The paper deals with the analysis of emergency management in a state of emergency in order to contribute to the improvement of civil-military cooperation Based on the results of the research survey, the authors proposed evaluation criteria for determining the level of emergency preparedness of the forces and resources of the Army of the Czech Republic","Tušer, Irena Jánský Jiří Petráš Antonín",Heliyon,,426
371095,Assessing the Psychological Impacts of COVID-19 in Undergraduate Medical Students,2021,"Innovative monitoring approaches are needed to track the COVID-19 epidemic and potentially assess the impact of community mitigation interventions. In this report, we present temporal data on influenza-like illness, influenza diagnosis and COVID-19 cases for all four regions of New York State through the first six weeks of the outbreak.","Rosenberg, Eli S; Hall, Eric W; Rosenthal, Elizabeth M; Maxted, Angela M; Gowie, Donna L; Dufort, Elizabeth M; Blog, Debra S; Hoefer, Dina; St George, Kirsten; Hutton, Brad J; Zucker, Howard A",Clin. infect. dis,,426
