,index,Unnamed: 0,title_x,x,y,publish_time_x,abstract,authors,journal,category,cluster
334805,334805,334805,"Learning from the First Wave of the Pandemic in England, Wales, and Northern Ireland",19.958006,11.336372,2021,"Introduction: The unprecedented COVID-19 pandemic unveiled a strong need for advanced and informative surveillance tools The Centre for Health Informatics (CHI) at the University of Calgary took action to develop a surveillance dashboard, which would facilitate the education of the public, and answer critical questions posed by local and national government Objectives: The objective of this study was to create an interactive method of surveillance, or a ""COVID-19 Tracker"" for Canadian use The Tracker offers user-friendly graphics characterizing various aspects of the current pandemic (e g case count, testing, hospitalizations, and policy interventions) Methods: Six publicly available data sources were used, and were selected based on the frequency of updates, accuracy and types of data, and data presentation The datasets have different levels of granularity for different provinces, which limits the information that we are able to show Additionally, some datasets have missing entries, for which the ""last observation carried forward"" method was used The website was created and hosted online, with a backend server, which is updated on a daily basis The Tracker development followed an iterative process, as new figures were added to meet the changing needs of policy-makers Results: The resulting Tracker is a dashboard that visualizes real-time data, along with policy interventions from various countries, via user-friendly graphs with a hover option that reveals detailed information The interactive features allow the user to customize the figures by jurisdiction, country/region, and the type of data shown Data is displayed at the national and provincial level, as well as by health regions Conclusion: The COVID-19 Tracker offers real-time, detailed, and interactive visualizations that have the potential to shape crucial decision-making and inform Albertans and Canadians of the current pandemic","Krusina, A.; Chen, O.; Varela, L. O.; Doktorchik, C.; Avati, V.; Knudsen, S.; Southern, D. A.; Eastwood, C.; Sharma, N.; Williamson, T.",International Journal of Population Data Science,6,16
336313,336313,336313,Clinical and histological characterization of late appearance maculopapular eruptions in association with the coronavirus disease 2019. A case series of seven patients,19.921896,10.933999,2020,"Introduction: The COVID pandemic, which started on 11th March as per the World Health Organization, has resulted in a drastic change in health care delivery, including emergency services. Most health workers have deviated towards COVID care delivery; only a few were available for non-COVID conditions. All elective and non-essential services were postponed resulting in the increased burden of the emergency department. The emergency department had to provide essential emergency care with available staff without exposing them to the virus. Triaging of the patients was modified according to the needs. Methods: The statistics of the emergency department of this period (April and May 2020) are compared with the same period of previous years (2018-2019) with the number of patients, indications, and complications. The methods of triaging and preparation were discussed. Discussion: The number of patients admitted to the emergency department (ED) was low during the COVID pandemic. Nevertheless, they got admitted with complications due to delay in accessing the health care facility. Patients with diabetic foot ulcers were also presenting late, leading to an increased number of the forefoot and below knee amputations. In trauma, the emergency department has maintained the same death rate as previous years by giving great care. The indications for tracheostomy were worrisome because it would have been prevented if the patients presented early. Pediatric patients were also presented late, resulting in increased mortality. Some cancer patients also presented with a complication in the emergency department because of the postponement of elective surgeries. Conclusion: There is a delay in accessing the health care delivery for non-COVID conditions resulting in more amputations of limbs and resections of the bowel. So the type of care in the emergency department was changed due to atypical presentation and complicated cases. It is necessary to ensure the provision of high quality health care delivery to non-COVID patients also.","Mehanathan, Pabithadevi B; Edwards, Alex Arthur; Robinson, Theodar",Ann Med Surg (Lond),6,24
340537,340537,340537,Enhancing postgraduate skills in paediatric critical care physiotherapy via simulation-based education: A collaborative approach,19.906075,11.339194,2021,"Introduction: COVID-19 is associated with incident cerebrovascular disease (CVD) We evaluated the association between preexisting CVD and COVID-19 mortality Methods: Utilizing deidentified pooled data from 40 healthcare organizations, adult (≥ 18 years) COVID-19 patients were identified based on ICD-10 diagnostic codes and documentation of laboratory positivity for SARS-CoV-2 RNA or antibodies Among COVID-19 patients, those with documented ICD-10 diagnoses for cerebral infarction / ischemic stroke (IS), intracerebral hemorrhage (ICH), subarachnoid hemorrhage (SAH) and transient ischemic attack (TIA) at least 30- days before the index COVID-19 event were classified as the CVD group The CVD and non-CVD groups were propensity score (PS) matched on demographic and comorbidity variables Pre and post-match risk ratios (RR) and 95% confidence intervals (CI) for 30 and 90-day mortality were calculated Mortality rates for CVD subgroups (ICH, SAH, AIS, TIA) are also reported Results: Among a total of 140,034 COVID-19 cases, 4,614 (3 3%) had prevalent CVD CVD patients were significantly older and were predominantly males of either white or black race (vs other) CVD patients also had a higher comorbidity burden (vs non-CVD patients) (graphic) A 1:1 PS algorithm yielded an optimally matched sample of 8,218 COVID-19 patients (4,109 CVD and non-CVD patients each) In the matched sample, 30-day mortality was 8 4% among CVD patients and 7 0% among non-CVD patients RR (CI): 1 20 (1 03 - 1 39) 90-day mortality among CVD patients (vs Non-CVD patients) remained significantly elevated (9 7% vs 8 2%), RR (CI): 1 20 (1 04 - 1 37) Among CVD subgroups, 30 and 90-day mortality was higher for patients with preexisting ICH (11 8% and 13 7%, respectively) compared to IS (8 7% and 10 2%, respectively) Conclusion: Preexisting CVD significantly increases the mortality risk in COVID-19 patients Mechanisms for poor COVID-19 outcomes among CVD patients need to be evaluated","Meeks, J.; Pan, A.; Potter, T.; Khan, O.; Hooper, D.; Gadhia, R. R.; Misra, V.; Yaghi, S.; Vahidy, F. S.",Stroke,6,1
340538,340538,340538,Enhancing postgraduate skills in paediatric critical care physiotherapy via simulation-based education: A collaborative approach,19.78582,11.194814,2021,"Worldwide, the majority of heart transplant organs are from donation after brain death. However, the shortage of suitable donors places severe limitations on this route. One option to increase the donor pool is to use organs from donation after circulatory death (DCD). Transplant centers for solid organs have been using DCD organs for years. At this time, 40% of solid organ transplantation in the United Kingdom uses organs from DCD. Use of DCD for solid organ transplants in Canada is also rising. Recently, there has been interest in using DCD organs for heart transplantation. The authors will discuss their experience of 4 heart transplants with organs from DCD donors after normothermic regional perfusion (NRP). The authors' first heart transplant using a DCD organ was in January 2020, and the fourth was in March 2020, just before the coronavirus disease 2019 (COVID-19) pandemic. The authors' protocol using NRP allows adequate evaluation of the donor heart to confidently determine organ acceptance. The co-location of the donor and the recipient in neighboring operating rooms limits ischemic times. Avoidance of an expensive ex vivo organ perfusion machine is an additional benefit for programs that may not have the resources required to purchase and maintain the machine. Some hospitals may not have the resources and space to be able to co-locate both the donor and recipient. Use of cold storage may be an option to transport the procured organ, similar to donation after brain death organs. The authors hope that this technique of NRP in DCD donors can help further increase the donor pool for heart transplantation in the United States.","Ngai, Jennie; Masuno, Kiriko; Moazami, Nader",J Cardiothorac Vasc Anesth,6,16
344951,344951,344951,Prone position in COVID-19: Can we tackle the rising dead space?,19.97692,11.378741,2021,"BACKGROUND: Vaccines are one of the most important achievements of modern medicine. However, their acceptance is only partial, with vaccine hesitancy and refusal representing a major health threat. Influenza vaccines have low compliance since repeated, annual vaccination is required. Influenza vaccines stimulate discussions both in the real world and online. Social media is currently a significant source of health and medical information. Elucidating the association between social media engagement and influenza vaccination is important and may be applicable to other vaccines, including ones against COVID-19. OBJECTIVE: The goal of this study is to characterize profiles of social media engagement regarding the influenza vaccine and their association with knowledge and compliance in order to support improvement of future web-associated vaccination campaigns. METHODS: A weblink to an online survey in Hebrew was disseminated over social media and messaging platforms. The survey answers were collected during April 2020. Anonymous and volunteer participants aged 21 years and over answered 30 questions related to sociodemographics; social media usage; influenza- and vaccine-related knowledge and behavior; health-related information searching, its reliability, and its influence; and COVID-19-related information searching. A univariate descriptive data analysis was performed, followed by multivariate analysis via building a decision tree to define the most important attributes associated with vaccination compliance. RESULTS: A total of 213 subjects responded to the survey, of whom 207 were included in the analysis; the majority of the respondents were female, were aged 21 to 40 years, had 1 to 2 children, lived in central Israel, were secular Israeli natives, had higher education, and had a salary close to the national average. Most respondents (128/207, 61.8%) were not vaccinated against influenza in 2019 and used social media. Participants that used social media were younger, secular, and living in high-density agglomerations and had lower influenza vaccination rates. The perceived influence and reliability of the information on social media about COVID-19 were generally similar to those perceptions about influenza. CONCLUSIONS: Using social media is negatively linked to compliance with seasonal influenza vaccination in this study. A high proportion of noncompliant individuals can lead to increased consumption of health care services and can, therefore, overload these health services. This is particularly crucial with a concomitant outbreak, such as COVID-19. Health care professionals should use improved and targeted health communication campaigns with the aid of experts in social media. Targeted communication, based on sociodemographic factors and personalized social media usage, might increase influenza vaccination rates and compliance with other vaccines as well.","Benis, Arriel; Khodos, Anna; Ran, Sivan; Levner, Eugene; Ashkenazi, Shai",J Med Internet Res,6,32
346166,346166,346166,"Interhospital transfer for patients with COVID-19 admitted to an urban academic medical center in Chicago, IL",19.833515,11.200555,2021,"Amidst the COVID-19 crisis, nation-states closed borders Borders divide – and intimate difference In this article, I trace an emergent epidemiological nationalism which intimates a contagious other, taking ‘the’ border as my (unstable) object While post-war and post-wall European projects celebrate dismantling borders, bordering continually becomes by saturating space with territoriality Illustrating epidemiological nationalism’s intimately located here and there, I turn an ethnographic gaze to Wales: a nation yet not a state, with a border that cannot be closed Through the socio-spatial saturate of the Welsh border’s enduring (non)existence run frictive, entangled intimacies Meshing border studies with Lauren Berlant’s theorisation of intimacies, I show epidemiology’s conscription in imaginatively inscribing a safely state-like Welsh nation © The Author(s)","Goodwin-Hawkins, B.",Anthropology in Action,6,16
346167,346167,346167,"Interhospital Transfer for Patients with COVID-19 Admitted to an Urban Academic Medical Center in Chicago, IL",19.91568,11.224928,2021,,"Salzer, Helmut J F; Neuböck, Matthias; Heldt, Sven; Haug, Isabella; Paar, Christian; Lamprecht, Bernd",Wien. med. wochenschr,6,16
346442,346442,346442,"Factors Associated with Hospitalization Length of Stay in Patients with COVID-19, a Multivariable Analysis",19.870125,11.1267605,2021,"Background: Early mitigation orders for COVID-19 halted participation in community-based programs. We examined the early impact of ""Stay Home, Stay Healthy"" orders on functioning in older adults participating in a behavioral intervention study involving community-based exercise. Methods: A quasi-natural experiment, using mixed methods (n = 39). Participants completed interviews and questionnaires after 3-4 weeks of the Stay Home, Stay Healthy directive. PROMIS-29 outcomes were compared to pre-COVID-19 responses. Results: Participants had a mean age of 74.1 (6.5) years, 79.5% were women, and 20.5% were racial/ethnic minorities. Compared to pre-COVID-19, there was a significant increase in anxiety and decrease in fatigue and social participation. Thematic analysis revealed five main themes related to disruption of daily life, the emotional and physical impact of stay-at-home orders, unexpected positive outcomes, and perspectives on messaging surrounding the pandemic. Conclusions: Efforts to curb the spread of COVID-19 have substantially impacted the lives of older adults participating in community-based exercise.","Adams, Leah M; Gell, Nancy M; Hoffman, Elise V; Gibbons, Laura E; Phelan, Elizabeth A; Sturgeon, John A; Turk, Dennis C; Patel, Kushang V",J Aging Health,6,20
346443,346443,346443,"Factors associated with hospitalization length of stay in patients with COVID-19, a multivariable analysis",19.770012,11.331083,2021,"Objective: In the early stages of the COVID-19 pandemic, most IVF clinics stopped the majority of patient treatment cycles to minimize the risk of disease transmission When ASRM and other professional societies recommended resumption of treatments, procedures were put into place to ensure patient and staff safety However, the risk of SARS-CoV-2 viral exposure and potential cross contamination within the IVF laboratory remains largely unclear The objective of this study was to assess the true risk of exposure to SARS-CoV-2 in an active IVF laboratory when strict patient screening procedures are in place Design: Prospective analysis Materials and Methods: Prior to restarting IVF treatments, a COVID-19 safety protocol was implemented Patients and staff were required to wear masks, fill out a symptom-based questionnaire daily, have their temperature taken, and practice social distancing in patient waiting areas Each female patient undergoing transvaginal oocyte retrieval (TVOR) was required to have a negative SARS-CoV-2 RNA test 3-4 days prior to the procedure Male partners were not tested All cases examined utilized ICSI The first tube of follicular fluid aspirated during TVOR (FF), culture media drops following removal of embryos on day 5 (M), and vitrification solution (VS) after blastocyst cryopreservation were analyzed Self-inactivating replication incompetent lentivirus particles containing the single stranded viral RNA genome were immediately inoculated into each sample after collection as a positive control for viral RNA stability, prior to direct RNA isolation (M, VS) or sample concentration (FF) For FF, cell debris was removed by centrifugation and filtration (0 22 um) prior to concentration of virus particles with an Amicon filter RNA was isolated using the optimized QIAamp viral RNA minikit, RNA quantity and quality determined, and cDNA synthesized using SuperScript IV VILO master mix A multiplex TaqMan-based qPCR assay was developed for SARS-CoV-2 and lentivirus RNA (detection limit 5 SARS-CoV-2 copies/qPCR reaction and 50 viral copies/2 mL sample), and used to test all diagnostic samples SARS-Cov2 synthetic RNA and lentivirus RNA were used as an RT-qPCR positive control Samples with no amplification of lentivirus genome were removed from the analysis (false negative) Results: In total, culture medium from 30 patients, vitrification solution from 98 patients, and follicular fluid from 156 patients were analyzed All samples were negative for the presence of SARS-CoV-2 viral RNA Conclusions: With stringent safety protocols in place, including patient testing and use of ICSI, the presence of SARS-CoV-2 RNA can be avoided in the IVF laboratory Importantly, this study does not indicate that virus from an actively infected patient cannot be found in follicular fluid or make its way into the IVF lab However, it does provide reassurance that with proper patient testing and safety measures, cross-contamination of the virus between gametes and embryos (including within liquid nitrogen storage dewars), as well as exposure of embryologists, is minimal","Rajput, S. K.; Khan, S. A.; Goheen, B. B.; Engelhorn, H. J.; Logsdon, D. M.; Grimm, C. K.; Kile, R.; West, R. C.; Yuan, Y.; Schoolcraft, W. B.; Krisher, R. L.; Swain, J. E.",Fertility and Sterility,6,1
351151,351151,351151,Shortage of anesthetics: Think of inhaled sedation!,19.637545,11.223035,2020,,"Marques-Santos, Celi; Avila, Walkiria Samuel; Carvalho, Regina Coeli Marques de; Lucena, Alexandre Jorge Gomes de; Freire, Claudia Maria Vilas; Alexandre, Elizabeth Regina Giunco; Campanharo, Felipe Favorette; Rivera, Maria Alayde Mendonça R; Costa, Maria Elizabeth Navegantes Caetano; Castro, Marildes Luiza de",Arq. bras. cardiol,6,27
351174,351174,351174,COVID-19 and Public Interest in Face Mask Use,19.603483,11.002065,2020,"Though Coronavirus disease (COVID-19) is not a disease that directly affects people's minds, the confinement measures intended to prevent its spread have been taking a toll on mental health. The objective of this study is to evaluate the level of anxiety, stress and depression in university students of the Middle Zone Multidisciplinary Academic Unit of the Autonomous University of San Luis Potosí during the confinement caused by the presence of COVID 19 and to evaluate if these levels are different in men and women. The sample consisted of 180 university students enrolled in the semester between January and May 2020. The short version of the 21-item DASS questionnaire was used. The results give evidence that the level of depression, anxiety and stress in these university students is not high and there is not enough evidence to say that there is a difference between the level of depression, anxiety and stress in women and men.","Escalera-Chávez, Milka Elena Santana Josefina C.; García-Santillán, Arturo",European Journal of Educational Research,6,26
351743,351743,351743,Adjuvant therapeutic plasma exchange in septic shock,19.62777,10.9823475,2021,"Introduction SARS-CoV-2 outbreaks at care homes are associated with a high morbidity and mortality. We aimed to study the molecular epidemiology of a major care home outbreak in Denmark. Methods After a staff member had been tested positive on 16 November 2020, a bundle approach programme was initiated including frequent surveillance screenings of residents and staff, isolation and cohorting procedures. This approach also involved limiting the number of visitors and enhancing the use of personal protective equipment, hand hygiene, and environmental cleaning. Naso/oropharyngeal swabs were tested for SARS-CoV-2 by polymerase chain reaction. Available positive samples were sequenced and phylogenetic relationships between the outbreak and local circulating strains were reconstructed. Results In all, 50% (56/114) of residents and 26% (49/190) of staff members became infected during the 46-day outbreak period. Altogether 16% of the infected residents died within 30 days after becoming infected. A total of 44% (46/105) of the samples with SARS-CoV-2 were sequenced. and phylogenetic analysis demonstrated a dominant outbreak lineage belonging to Global Lineage B.1.1.29 containing the mutation I233V in the S gene. The outbreak lineage was detected in the community 28 days before its introduction into the care home. Conclusions Introduction of SARS-CoV-2 to care homes is associated with severe outbreaks. Initiation of a bundle approach infection control programme in addition to measures ensuring enhanced herd immunity were successful in controlling the outbreak. Genome sequencing proved to be a powerful tool to describe the relatedness of the various clones and may help focusing outbreak interventions. Funding The study was funded in part by The Poul Due Jensen Foundation and The Danish Ministry of Higher Education and Science. The authors have no conflicts of interest to report. Trial registration not relevant.","Andersen, C. O.; Buch, I.; Castruita, J. A. S.; Jacobsen, N. G.; Jensen, C. B.; Westh, H.; Marvig, R. L.; Pedersen, M. S.; Schonning, K.; Pinholt, M.",Danish Medical Journal,6,1
351744,351744,351744,Adjuvant therapeutic plasma exchange in septic shock,19.66379,10.92502,2021,,"Li, Daniel F; Cadnum, Jennifer L; Redmond, Sarah N; Jones, Lucas D; Pearlmutter, Basya; Haq, Muhammed F; Donskey, Curtis J",Am J Infect Control,6,12
364030,364030,364030,A Simple Sit-to-Stand Test to Detect Exercise-Induced Oxygen Desaturation in Patients Being Discharged from Hospital with COVID-19,19.841536,10.873067,2021,,"Mahase, Elisabeth",BMJ,6,20
