,index,Unnamed: 0,title_x,x,y,publish_time_x,abstract,authors,journal,category,cluster
6216,6216,6216,Vaccine for Middle East respiratory syndrome,11.386131,12.248911,2015-10-01,,"Punzo, Christine",Biotechnology (N Y),500,9
8436,8436,8436,The emergence of a new corona virus—MERS-CoV: Hind sight is always 20/20,11.533369,12.1775465,2013-07-02,,"Khan, S.; Nabi, G.; Han, G.; Siddique, R.; Lian, S.; Shi, H.; Bashir, N.; Ali, A.; Shereen, M. Adnan",Clin Microbiol Infect,500,30
9402,9402,9402,MERS-CoV enigma deepens as reported cases surge,11.271684,12.13242,2014-05-23,"BACKGROUND: Antigens expressed in sexual stages of the malaria parasites are targets of transmission-blocking vaccines (TBVs). HAP2/GCS1, a TBV candidate, is critical for fertilization in Plasmodium. Here, the genetic diversity of PvHAP2 was studied in Plasmodium vivax parasite populations from the Greater Mekong Subregion (GMS). METHODS: Plasmodium vivax clinical isolates were collected in clinics from the China-Myanmar border region (135 samples), western Thailand (41 samples) and western Myanmar (51 samples). Near full-length Pvhap2 (nucleotides 13–2574) was amplified and sequenced from these isolates. Molecular evolution studies were conducted to evaluate the genetic diversity, selection and population differentiation. RESULTS: Sequencing of the pvhap2 gene for a total of 227 samples from the three P. vivax populations revealed limited genetic diversity of this gene in the GMS (π = 0.00036 ± 0.00003), with the highest π value observed in Myanmar (0.00053 ± 0.00009). Y133S was the dominant mutation in the China-Myanmar border (99.26%), Myanmar (100%) and Thailand (95.12%). Results of all neutrality tests were negative for all the three populations, suggesting the possible action of purifying selection. Codon-based tests identified specific codons which are under purifying or positive selections. Wright’s fixation index showed low to moderate genetic differentiation of P. vivax populations in the GMS, with F(ST) ranging from 0.04077 to 0.24833, whereas high levels of genetic differentiation were detected between the China-Myanmar border and Iran populations (F(ST) = 0.60266), and between Thailand and Iran populations (F(ST) = 0.44161). A total of 20 haplotypes were identified, with H2 being the abundant haplotype in China-Myanmar border, Myanmar and Thailand populations. Epitope mapping prediction of Pvhap2 antigen showed that high-score B-cell epitopes are located in the S307-G324, L429-P453 and V623-D637 regions. The E317K and D637N mutations located within S307-G324 and V623-D637 epitopes slightly reduced the predicted score for potential epitopes. CONCLUSIONS: The present study showed a very low level of genetic diversity of pvhap2 gene among P. vivax populations in the Greater Mekong Subregion. The relative conservation of pvhap2 supports further evaluation of a Pvhap2-based TBV. [Image: see text]","Li, Danni; Yu, Chunyun; Guo, Jian; Wang, Yazhou; Zhao, Yan; Wang, Lin; Soe, Myat Thu; Feng, Hui; Kyaw, Myat Phone; Sattabongkot, Jetsumon; Jiang, Lubin; Cui, Liwang; Zhu, Xiaotong; Cao, Yaming",Parasit Vectors,500,1
25524,25524,25524,Foodborne Disease in the Middle East,11.404682,12.423058,2016-11-25,1. Understand the roles and responsibilities of health care managers in infection prevention and control in health care organizations. 2. Apply epidemiologic principles to manage an outbreak of a transmissible disease in a health care setting. 3. Develop a strategy for infection prevention in a health care setting.,"Oleske, Denise M.",Epidemiology and the Delivery of Health Care Services,500,17
27162,27162,27162,The nucleocapsid protein of SARS CoV interacts with PIAS1 and affects the NFkappaB pathway,11.472544,12.006992,2010-03-06,,"Malarewicz, Julien; Kirchacker, Romain; Annane, Djillali",Prat Anesth Reanim,500,20
27261,27261,27261,"Serological investigation of MERS-CoV in humans between 2011-2016, Jeddah, Saudi Arabia",11.413841,12.452769,2019-01-08,,"Heymann, D.",Int J Infect Dis,500,30
29418,29418,29418,Emerging and Reemerging Infectious Disease Threats,11.384041,12.010913,2014-10-31,,"Osorio, J.E.; Yuill, T.M.",Encyclopedia of Virology,500,17
29739,29739,29739,Infections in Recipients of Hematopoietic Stem Cell Transplants,11.482159,12.2447815,2014-10-31,,"Hallouët, Pascal; Borry, Anne",M&#x000e9;mo-guide de biologie et de physiologie humaines,500,8
29800,29800,29800,Antiviral Drugs for Influenza and Other Respiratory Virus Infections,11.415809,12.128076,2014-10-31,,"Race, Jeffrey D.; Nichols, Carey; Blumenthal, Susan R.",Ciottone's Disaster Medicine,500,28
30471,30471,30471,"First Confirmed Cases of Middle East Respiratory Syndrome Coronavirus (MERS‐CoV) Infection in the United States, Updated Information on the Epidemiology of MERS‐CoV Infection, and Guidance for the Public, Clinicians, and Public Health Authorities—May 2014",11.142039,12.38064,2014-06-20,,"Marini, Robert P.; Otto, Glen; Erdman, Susan; Palley, Lori; Fox, James G.",Laboratory Animal Medicine,500,9
31427,31427,31427,Prophylaxis and Empirical Therapy of Infection in Cancer Patients,11.245999,12.372113,2014-10-31,"The emergence of a new viral disease is one of the most dramatic aspects of virology, which often receives widespread attention from the scientific community and the lay public. Considering that the discipline of animal virology was established over 100 years ago, it may seem surprising that new virus diseases are still being discovered. How this happens is the subject of this chapter.","Le Duc, James W.; Nathanson, Neal",Viral Pathogenesis,500,1
31475,31475,31475,"Otitis Externa, Otitis Media, and Mastoiditis",11.27267,12.251364,2014-10-31,,"Pierangeli, A.; Scagnolari, C.; Trombetti, S.; Di Marco, P.; Midulla, F.; Moretti, C.; Antonelli, G.",Int J Antimicrob Agents,500,1
31506,31506,31506,Respiratory Syncytial Virus (RSV),11.283016,12.112784,2014-10-31,,,J Virol Methods,500,28
48986,48986,48986,China’s MSRI in Africa and the Middle East: Political Economic Realities Continue to Shape Results and Ramifications,11.401409,12.116628,2020-12-01,"There are many evaluation frameworks for blended teaching; however, there are few suitable frameworks for Blended Learning (BL). This chapter presents an evaluation framework that was designed to span school and university BL, including Initial Teacher Eduction (ITE). An appropriate evaluation framework must show how effective each BL design and implementation is, at the level of a term or semester of study, and at the larger scale, such as across primary, middle, or secondary school, or programmes of study such as an ITE bachelor or master’s. This chapter first identifies eight features from the literature that are necessary for a BL evaluation framework, and shows that existing models do not satisfy these requirements. Next, the chapter introduces the Blended and Engaged Learning Zones (BELZ), designed specifically for BL across schooling and university studies, and that satisfies these eight features. An example follows of a version of BELZ used to evaluate BL in the years prior to a substantial three-term long inquiry task. BELZ addresses the imbalance in the literature, as well as the needs in teaching practice, for an evaluation framework for BL across schooling and university study.","Willison, John","Critical Perspectives on Teaching, Learning and Leadership",500,7
53783,53783,53783,Modi looks West? Assessing change and continuity in India’s Middle East policy since 2014,11.1935835,12.218488,2021-06-03,"α-Glucosidase is considered a prime drug target for Diabetes Mellitus and its inhibitors are used to delay carbohydrate digestion for the treatment of diabetes mellitus. With the aim to design α-glucosidase inhibitors with novel chemical scaffolds, three folds ligand and structure based virtual screening was applied. Initially linear quantitative structure activity relationship (QSAR) model was developed by a molecular operating environment (MOE) using a training set of thirty-two known inhibitors, which showed good correlation coefficient (r(2) = 0.88), low root mean square error (RMSE = 0.23), and cross-validated correlation coefficient r(2) (q(2) = 0.71 and RMSE = 0.31). The model was validated by predicting the biological activities of the test set which depicted r(2) value of 0.82, indicating the robustness of the model. For virtual screening, compounds were retrieved from zinc is not commercial (ZINC) database and screened by molecular docking. The best docked compounds were chosen to assess their pharmacokinetic behavior. Later, the α-glucosidase inhibitory potential of the selected compounds was predicted by their mode of binding interactions. The predicted pharmacokinetic profile, docking scores and protein-ligand interactions revealed that eight compounds preferentially target the catalytic site of α-glucosidase thus exhibit potential α-glucosidase inhibition in silico. The α-glucosidase inhibitory activities of those Hits were predicted by QSAR model, which reflect good inhibitory activities of these compounds. These results serve as a guidelines for the rational drug design and development of potential novel anti-diabetic agents.","Halim, Sobia Ahsan; Jabeen, Sumaira; Khan, Ajmal; Al-Harrasi, Ahmed",Pharmaceuticals (Basel),500,1
72416,72416,72416,"An ultra-rapid real-time RT-PCR method for detecting Middle East respiratory syndrome coronavirus using a mobile PCR device, PCR1100.",11.407751,12.034263,2019-12-25,"OBJECTIVE To analyze notifications of flu-like syndrome according to the time interval between onset of symptoms and testing for COVID-19. METHODS This was a cross-sectional study using records of flu-like syndrome cases containing results of COVID-19 diagnostic tests in the Brazilian state capitals and Federal District, held on the e-SUS Notifica system, from March 1st, 2020 to August 18th, 2020. The time interval between symptom onset and testing was compared using the ANOVA test, classifying it according to test adequacy/timeliness. RESULTS Taking 1,942,514 notifications, average time between symptom onset and testing was 10.2 days (±17.1). Among those tested, females (55.1%), people aged 20-39 years (43.8%), and the Southeast region of Brazil (43.0%) predominated. 58.8% of IgM ELISA tests were performed at an adequate time while 68.0% of rapid antigen tests were not performed at an adequate time. CONCLUSION Inadequacy was found between symptom onset and time taken to test for COVID-19 in the Brazilian regions.","Lima, Francisca Elisângela Teixeira; Albuquerque, Nila Larisse Silva de; Florencio, Sabrina de Souza Gurgel; Fontenele, Maria Gabriela Miranda; Queiroz, Ana Paula Oliveira; Lima, Glaubervania Alves; Figueiredo, Lanese Medeiros de; Amorim, Silvia Maria Costa; Barbosa, Lorena Pinheiro",Epidemiologia e servicos de saude : revista do Sistema Unico de Saude do Brasil,500,1
75512,75512,75512,Testing of Middle East respiratory syndrome coronavirus replication inhibitors for the ability to block viral entry.,11.202435,12.381527,2015,"Enterovirus 71 (EV71) infection has induced fatal encephalitis in thousands of young children in the Asia-Pacific region over the last decade. EV71 infection continues to cause serious problems in areas with outbreaks, because vaccines and antiviral therapies are not available. Lymphocytes are present in the brains of infected patients and mice, and they protect mice from infection by decreasing the viral burden. The chemokines responsible for recruiting lymphocytes to infected organs are yet to be identified. Among the lymphocyte chemokines detected, high levels of interferon-gamma-inducible protein-10 (IP-10) are found in the plasma and cerebral spinal fluid of patients with brainstem encephalitis as compared with the levels of a monokine induced by gamma interferon (Mig). Using a murine model to investigate the induction of IP-10 by EV71 infection, we observed that EV71 infection significantly enhanced IP-10 protein expression in the serum and brain, with kinetics similar to viral titres in the blood and brain. Brain neurons of infected mice expressed IP-10. Using wild-type mice and IP-10 gene knockout mice to investigate the role of IP-10 in EV71 infection, we found that IP-10 deficiency significantly reduced levels of Mig in serum, and levels of gamma interferon and the number of CD8 T cells in the mouse brain. Absence of IP-10 significantly increased the mortality of infected mice by 45%, with slow virus clearance in several vital tissues. Our observations are consistent with a model where EV71 infection boosts IP-10 expression to increase gamma interferon and Mig levels, infiltration of CD8 T cells, virus clearance in tissues and the survival of mice.","Shen, Fang-Hsiu; Tsai, Chia-Chun; Wang, Li-Chiu; Chang, Kung-Chao; Tung, Yuk-Ying; Su, Ih-Jen; Chen, Shun-Hua",The Journal of general virology,500,1
76745,76745,76745,"Middle East Respiratory Syndrome-Coronavirus Seropositive Bactrian Camels, Mongolia.",11.250646,12.415536,2020-11-16,"OBJECTIVE To test the hypothesis that we will be able to detect change in motor outcome measures over time in a cohort with mutations in FKRP. METHODS Individuals with documented FKRP mutations were evaluated annually with a battery of established motor outcome measures including limited quantitative myometry and timed function measures. Results were analyzed using random coefficient regression to determine annual change in each measure. Due to the non-linear progression through the lifespan of the study participants, pediatric (<19 years) and adult (>19 years) cohorts were analyzed separately. Effect of genotype was evaluated in each cohort. RESULTS Sixty-nine participants (30 pediatric, 44 adult) with at least two evaluations were included. There was a small but statistically significant decline in timed motor function measures in both pediatric and adult cohorts. Genotype significantly affected rate of decline in the pediatric but not the adult cohort. Some pediatric patients who are homozygous for the c.826C>A mutation showed improving motor performance in adolescence. Performance on the 10-meter walk/run was highly correlated with other timed function tests. CONCLUSIONS There is a slow annual decline in motor function in adults with FKRP mutations that can be detected with standard motor outcome measures, while the results in the pediatric population were more variable and affected by genotype. Overall, these analyses provide a framework for development of future clinical trials. The DG natural history study may be found on clinicaltrials.gov (NCT00313677).","Gedlinske, Amber M; Stephan, Carrie M; Mockler, Shelley Rh; Laubscher, Katie M; Laubenthal, Karla S; Crockett, Cameron D; Zimmerman, M Bridget; Mathews, Katherine D",Neurology,500,31
77214,77214,77214,Exportations of Symptomatic Cases of MERS-CoV Infection to Countries outside the Middle East.,11.447533,12.088405,2016,,"Dyer, Clare",BMJ,500,16
78296,78296,78296,Alternative screening approaches for discovery of Middle East respiratory syndrome coronavirus inhibitors.,11.077276,12.358381,2014,"INTRODUCTION/OBJECTIVES Prior opioid use can influence outcomes for patients with musculoskeletal disorders. The purpose of this study was to compare downstream medical utilization-based outcomes (costs, visits, recurrent episodes) after an initial diagnosis of patellofemoral pain based on pre-injury utilization of opioids. METHOD A total of 85,7880 consecutive patients were followed for a full 12 months before and 24 months after an initial diagnosis of patellofemoral pain (January 2009 to December 2013). Data were sourced from the Military Health System Data Repository, a single-payer closed government system. Opioid prescription fills were identified, and medical visits and costs were calculated for all knee-related medical care, to include recurrence rates in the 2-year surveillance period. RESULTS A relatively small number of individuals filled an opioid prescription in the year prior (n = 1746; 2.0%); however, these individuals had almost twice the mean costs of knee-related medical care ($1557 versus %802) and medical visits (8.4 versus 4.0). Patients with prior opioid use were more likely to have at least 1 recurrent episode of knee pain (relative risk 1.58, 95% CI 1.51, 1.65) with a higher mean number of episodes of knee pain (1.5 vs 1.8). The use of opioids with higher risk of misuse or dependency (Schedule II or III) resulted in greater medical costs (for any reason) and recurrent episodes of knee pain compared to the use of opioids in a lower risk category (Schedule IV). CONCLUSIONS Prior opioid utilization was associated with a greater number of recurrent episodes of knee pain and higher downstream medical costs compared with individuals without prior opioid use. For individuals with prior opioid utilization, opioids with higher risk of misuse or dependency (Schedule II or III) resulted in greater medical costs (for any reason) and recurrent episodes compared to the use of lower-risk opioids (Schedule IV). Key Points • Patients with prior opioid use had much greater knee-related medical costs compared to patients without prior opioid use. • Patients with prior opioid use were more likely to have additional episodes of knee pain in the following 2 years compared to patients without prior opioid use. • Prior opioid use has predicted higher costs and poor outcomes after surgery, but this is the first study to confirm similar findings in non-surgical patients.","Rhon, Daniel I; Cook, Chad E; Cleland, Joshua A; Snodgrass, Suzanne J",Clinical rheumatology,500,16
80699,80699,80699,Progress of Middle East respiratory syndrome coronavirus vaccines: a patent review.,11.4157,11.930076,2017,,"Vogel, Lauren",CMAJ : Canadian Medical Association journal = journal de l'Association medicale canadienne,500,5
83838,83838,83838,Antiviral potential of ERK/MAPK and PI3K/AKT/mTOR signaling modulation for Middle East respiratory syndrome coronavirus infection as identified by temporal kinome analysis.,11.36831,12.42941,2015,"OBJECTIVE In September 2012, there was an unexpected increase of acute febrile illness (AFI) in Chuuk State of the Federated States of Micronesia. At the same time, dengue outbreaks were occurring in two of the Federated States of Micronesia's other three states. The cause of AFI was suspected to be dengue; however, by the end of October, only one of 39 samples was positive for dengue. The objective of the investigation was to establish the cause of the outbreak. METHODS A line list was created and data analysed by time, place, person and clinical features. Reported symptoms were compared with the published symptoms of several diagnoses and laboratory testing undertaken. RESULTS Of the 168 suspected cases, 62% were less than 20 years of age and 60% were male. The clinical features of the cases were not typical for dengue but suggestive of respiratory illness. Nasopharyngeal swabs were subsequently collected and found to be positive for influenza. Public health measures were undertaken and the AFI returned to expected levels. DISCUSSION Clinical diagnosis of acute febrile illness (AFI) can often be difficult and misleading. This can mean that opportunities for preventive measures early on in an outbreak are missed. In any outbreak, descriptive epidemiological analyses are valuable in helping to ascertain the cause of the outbreak.","Hoy, Damian; Yichiro, Yoster; Otoko, Kasian; Heldart, Helden; Meyshine, Andita; Assito, Prisca; Pretrick, Moses; Souares, Yvan; Hancock, Thane; Durand, Mark; Roth, Adam",Western Pacific surveillance and response journal : WPSAR,500,1
110049,110049,110049,High Prevalence of Middle East Respiratory Coronavirus in Young Dromedary Camels in Jordan.,11.126826,12.163321,2017,"OBJECTIVE To describe and illustrate the evolution of surgical technique, emphasizing technical modifications of laparoscopic donor nephrectomy (LDN) and the impact on complication outcome. METHODS This is a retrospective observational study of prospectively collected data on all consecutive purely LDN surgeries performed at a tertiary academic medical center (n = 1325), performed between March 2000 and October 2013. RESULTS Over time, LDN was performed on older patients, changing from a mean of 35.7 years in 2000 to 41.2 years in 2013 (P <.001). Additionally, mean blood loss decreased from 75 mL in 2000 to 21.6 mL in 2013 (P <.001). However, body mass index, operative time, and length of stay remained similar. Overall, there were 105 (7.9%) complications: Clavien grade 1 (n = 81, 6.1%) and grade 2 or higher (n = 23, 1.8%). Procedure duration, blood loss, surgeon, year of procedure, laterality, body mass index, age, and gender did not significantly predict complications. There was no significant difference for Clavien complication rates between the early learning period (first 150 cases) and the rest of the series. CONCLUSION With continual refinement with LDN techniques based on intraoperative observations and technological advances, complication rates remain consistently low, despite increasing donor age.","Treat, Eric G; Schulam, Peter G; Gritsch, Hans A; Liu, Chia-Hung; Xiong, Siwei; Passos, Felipe; Chuang, Ryan; Hu, Jim C",Urology,500,7
113430,113430,113430,Repurposing of clinically developed drugs for treatment of Middle East respiratory syndrome coronavirus infection.,11.285488,12.311131,2014,"Laser powder bed fusion is a dominant metal 3D printing technology. However, porosity defects remain a challenge for fatigue-sensitive applications. Some porosity is associated with deep and narrow vapor depressions called keyholes, which occur under high-power, low-scan speed laser melting conditions. High-speed x-ray imaging enables operando observation of the detailed formation process of pores in Ti-6Al-4V caused by a critical instability at the keyhole tip. We found that the boundary of the keyhole porosity regime in power-velocity space is sharp and smooth, varying only slightly between the bare plate and powder bed. The critical keyhole instability generates acoustic waves in the melt pool that provide additional yet vital driving force for the pores near the keyhole tip to move away from the keyhole and become trapped as defects.","Zhao, Cang; Parab, Niranjan D; Li, Xuxiao; Fezzaa, Kamel; Tan, Wenda; Rollett, Anthony D; Sun, Tao",Science,500,31
120504,120504,120504,Bilateral entry and release of Middle East respiratory syndrome coronavirus induces profound apoptosis of human bronchial epithelial cells.,11.142953,12.187459,2013,,"Woodland, David L",Viral immunology,500,26
121515,121515,121515,Novel Gold Nanorod-Based HR1 Peptide Inhibitor for Middle East Respiratory Syndrome Coronavirus.,11.224079,12.284615,2019,"AIM To evaluate the effect of Tri-staple technology and slow firing using the Endo-GIA endoscopic linear stapler. METHODS The cardiac and pyloric portions of porcine stomachs were divided using the endoscopic linear stapler with different reload types. A total of 8 min of waiting time was employed during firing in the slow-firing group and no waiting time was employed in the normal-firing group. The shape of the staples was then evaluated. The length of the staple line and serosal laceration was also determined. RESULTS There was a moderate negative correlation between tissue thickness and secure staple formation. Tri-staple reloads (purple, black) offered more secure staple formation compared with Universal green reload. Although slow firing enhanced secure staple formation, its effect was greater when using green reload, compared with Tri-staple reloads. Significantly shorter staple line length and longer serosal laceration was observed in the thick tissue. Although the cartridge type did not influence lengths of the staple line or serosal laceration, both were better in the slow-firing group. CONCLUSIONS Tri-staple reloads offered more secure staple formation compared with the Universal reload. Although slow firing improved staple line shortening and serosal laceration, its effect on secure stapling was relatively small when using Tri-staple reloads.","Hasegawa, Suguru; Nakayama, Shinya; Hida, Koya; Kawada, Kenji; Sakai, Yoshiharu",Digestive surgery,500,1
133944,133944,133944,A single tyrosine in the severe acute respiratory syndrome coronavirus membrane protein cytoplasmic tail is important for efficient interaction with spike protein.,11.472466,12.043025,2010,"The current COVID-19 pandemic has the potential to overwhelm the capacity of hospitals and Intensive Care Units in Chile and Latin America. Thus local authorities have an ethical obligation to be prepared by implementing pertinent measures to prevent a situation of rationing of scarce healthcare resources, and by defining ethically acceptable and socially legitimate criteria for the allocation of these resources. This paper responds to recent ethical guidelines issued by a Chilean academic institution and discusses the main moral principles for the ethical foundations of criteria for rationing during the present crisis. It argues that under exceptional circumstances such as the current pandemic, the traditional patient-centered morality of medicine needs to be balanced with ethical principles formulated from a public health perspective, including the principles of social utility, social justice and equity, among others. The paper concludes with some recommendations regarding how to reach an agreement about rationing criteria and about their implementation in clinical practice.","Aguilera, Bernardo",Medwave,500,1
