,index,Unnamed: 0,title_x,x,y,publish_time_x,abstract,authors,journal,category,cluster
182089,182089,182089,Evaluation of the Augmented Reality Educational Application for the 2nd cycle of primary school,13.379891,-0.49387008,2021,"Abstract COVID-19 is a huge threat to global health. Due to the lack of definitive etiological therapeutics currently, effective disease monitoring is of high clinical value for better healthcare and management of the large number of COVID-19 patients. In this study, we recruited 37 COVID-19 patients, collected 176 blood samples upon diagnosis and during treatment, and analyzed cell-free DNA (cfDNA) in these samples. We report gross abnormalities in cfDNA of COVID-19 patients, including elevated GC content, altered molecule size and end motif patterns. More importantly, such cfDNA characteristics reflect patient-specific physiological conditions during treatment. Further analysis on tissue origin tracing of cfDNA reveals frequent tissue injuries in COVID-19 patients, which is supported by clinical diagnoses. Hence, we demonstrate the translational merit of cfDNA as valuable analyte for effective disease monitoring, as well as tissue injury assessment in COVID-19 patients.","Jin, X.; Wang, Y.; Xu, J.; Li, Y.; Cheng, F.; Luo, Y.; Zhou, H.; Lin, S.; Xiao, F.; Zhang, L.; Lin, Y.; Zhang, Z.; Jin, Y.; Zheng, F.; Chen, W.; Zhu, A.; Tao, Y.; Zhao, J.; Kuo, T.; Li, L.; Wen, L.; Ou, R.; Li, F.; Lin, L.; Zhang, Y.; Sun, J.; Yuan, H.; Zhuang, Z.; Sun, H.; Chen, Z.; Li, J.; Zhuo, J.; Chen, D.; Zhang, S.; Sun, Y.; Wei, P.; Yuan, J.; Xu, T.; Yang, H.; Wang, J.; Xu, X.; Zhong, N.; Xu, Y.; Sun, K.",,817,16
182244,182244,182244,Digitalising medical education: virtual ward rounds during COVID-19 and beyond,13.356518,-0.31173378,2021,"This paper presents the results of a bibliometric analysis of academic research dealing with COVID-19 in the area of city destination development from 1 December 2019 to 31 March 2021. Particularly, by means of SciMAT software, it identifies, quantifies, and visually displays the main research clusters, thematic structure and emerging trends that city and tourism planners will face in the new normal. The search revealed that social media and smart tourism are the themes with the greatest potential;sustainable cities, local destination development, changes in tourist behavior, and tourists’ risk perception are underdeveloped streams with enormous relevance and growth in the new normal. Research on the effects of COVID-19 on citizen health and its economic impact on the tourism industry and cities are intersectional and highly developed topics, although of little relevance. The current study also identifies the challenges of destination research for planners and proposes future research directions. Consequently, this paper contributes to the existing literature on COVID-19 and sustainable cities, as it develops a critical examination of the extant research and points out the research gaps that must be filled by future studies.","Casado-Aranda, Luis-Alberto SÁNchez-FernÁNdez Juan Bastidas-Manzano A. N. A. BelÉN",Sustainable Cities and Society,817,26
182317,182317,182317,Failure modes and effects analysis to assess COVID-19 protocols in the management of obstetric emergencies,13.448027,-0.07620544,2021,"Introduction Fervorous investigation and dialogue surrounding the true number of SARS-CoV-2 related deaths and implied infection fatality rates in India have been ongoing throughout the pandemic, and especially pronounced during the nations devastating second wave. We aim to synthesize the existing literature on the true SARS-CoV-2 excess deaths and infection fatality rates (IFR) in India, through a systematic search followed by viable meta-analysis. We then provide updated epidemiological model-based estimates of the wave 1, wave 2 and combined IFRs using an extension of the Susceptible-Exposed-Infected-Removed (SEIR) model, using data from April 1, 2020 to June 30, 2021. Methods Following PRISMA guidelines, the databases PubMed, Embase, Global Index Medicus, as well as BioRxiv, MedRxiv, and SSRN for preprints (accessed through iSearch), were searched on July 3, 2021 (with results verified through August 15, 2021). Altogether using a two-step approach, 4,765 initial citations were screened resulting in 37 citations included in the narrative review and 19 studies with 41 datapoints included in the quantitative synthesis. Using a random effects model with DerSimonian-Laird estimation, we meta-analyze IFR1 which is defined as the ratio of the total number of observed reported deaths divided by the total number of estimated infections and IFR2 (which accounts for death underreporting in the numerator of IFR1). For the latter, we provide lower and upper bounds based on the available range of estimates of death undercounting, often arising from an excess death calculation. The primary focus is to estimate pooled nationwide estimates of IFRs with the secondary goal of estimating pooled regional and state-specific estimates for SARS-CoV-2 related IFRs in India. We also try to stratify our empirical results across the first and the second wave. In tandem, we present updated SEIR model estimates of IFRs for waves 1, 2, and combined across the waves with observed case and death count data from April 1, 2020 to June 30, 2021. Results For India countrywide, underreporting factors (URF) for cases (sourced from serosurveys) range from 14.3-29.1 in the four nationwide serosurveys; URFs for deaths (sourced from excess deaths reports) range from 4.4-11.9 with cumulative excess deaths ranging from 1.79-4.9 million (as of June 2021). Nationwide pooled IFR1 and IFR2 estimates for India are 0.097% (95% confidence interval [CI]: 0.067 - 0.140) and 0.365% (95% CI: 0.264 - 0.504) to 0.485% (95% CI: 0.344 - 0.685), respectively, again noting that IFR2 changes as excess deaths estimates vary. Among the included studies in this meta-analysis, the IFR1 generally appear to decrease over time from the earliest study end date to the latest study end date (from 4 June 2020 to 6 July 2021, IFR1 changed from 0.199 to 0.055%), whereas a similar trend is not as readily evident for IFR2 due to the wide variation in excess death estimates (from 4 June 2020 to 6 July 2021, IFR2 ranged from (0.290-1.316) to (0.241-0.651) %). Nationwide SEIR model-based combined estimates for IFR1 and IFR2 are 0.101% (95% CI: 0.097 - 0.116) and 0.367% (95% CI: 0.358 - 0.383), respectively, which largely reconcile with the empirical findings and concur with the lower end of the excess death estimates. An advantage of such epidemiological models is the ability to produce daily estimates with updated data with the disadvantages being that these estimates are subject to numerous assumptions, arduousness of validation and not directly using the available excess death data. Whether one uses empirical data or model-based estimation, it is evident that IFR2 is at least 3.6 times more than IFR1. Conclusion When incorporating case and death underreporting, the meta-analyzed cumulative infection fatality rate in India varies from 0.36%-0.48%, with a case underreporting factor ranging from 25-30 and a death underreporting factor ranging from 4-12. This implies, by June 30, 2021, India may have seen nearly 900 million infections and 1.7-4.9 million deaths when the reported numbers stood at 30.4 million cases and 412 thousand deaths (covid19india.org) with an observed case fatality rate (CFR) of 1.35%. We reiterate the need for timely and disaggregated infection and fatality data to examine the burden of the virus by age and other demographics. Large degrees of nationwide and state-specific death undercounting reinforce the call to improve death reporting within India.","Zimmermann, L.; Bhattacharya, S.; Purkayastha, S.; Kundu, R.; Bhaduri, R.; Ghosh, P.; Mukherjee, B.",,817,1
182559,182559,182559,Emotion analysis of Portuguese Political Parties Communication over the covid-19 Pandemic,13.497704,-0.31522143,2021,"COVID-19 has highlighted the underlying global burden from non-communicable diseases (NCDs) and the lack of resiliency in health systems to tackle highly preventable risk factors, which have left populations vulnerable to acute health crises. The persistent issue of unhealthy behaviors, particularly those related to a high-sodium diet, suggests inadequate policy attention and insufficient funding for public health and behavioral research. This year, Japan will host the Tokyo Nutrition for Growth (N4G) Summit 2021. The summit is being held in the era of COVID-19, offering a historic opportunity to make a difference on the global health agenda for food and nutrition and to reaffirm the global commitment to prevent future health crises by addressing the growing burden of NCDs and building better prepared and more resilient health systems. This perspective article suggests that we, global health researchers and decision-makers, should rethink the value of using ""Umami"" substances as candidates for a practical salt-reducing alternative that originated in Japan (while maintaining the affordability, accessibility, availability, and desirability of healthy food). Reduced salt intake will help address the global syndemic of COVID-19 pandemic and high rates of hypertension, heart diseases, diabetes, and other NCDs. By addressing these issues, it will make countries more resilient to future pandemic threats.","Nomura, S.; Ishizuka, A.; Tanaka, S.; Yoneoka, D.; Uneyama, H.; Shibuya, K.",Health,817,22
203279,203279,203279,Quantitative easing in overcoming the crisis: Criticism ofqeinthe monetary system of capitalism,13.706722,-0.27945867,2021,"When asked about the five rights, most nurses automatically think about a safety measure used to prevent medication errors: right med, right dose, right time, right route, right person The Bill of Rights for Registered Nurses states that: * ""Nurses have the right to practice in a manner that fulfills their obligations to society and to those who receive nursing care * Nurses have the right to practice in environments that allow them to act in accordance with professional standards and legally authorized scopes of practice * Nurses have the right to a work environment that supports and facilitates ethical practice, in accordance with Code of Ethics for Nurses and its interpretive statements * Nurses have the right to freely and openly advocate for themselves and their patients, without fear of retribution * Nurses have the right to fair compensation for their work, consistent with their educational preparation, knowledge, experience and professional responsibilities * Nurses have the right to a work environment that is safe for themselves and their patients * Nurses in all practice settings have the right to negotiate, either as individuals or collectively, the conditions of their employment To lead is to live dangerously because when leadership counts, when you lead people through difficult change, you challenge what people hold dear - with nothing more to offer perhaps than a possibility [ ]leadership often means exceeding the authority you are given to tackle the challenge at hand","Pryor, Lillian A. M. S. N. R. N. C. N. N.",Nephrology Nursing Journal,817,4
207969,207969,207969,Product development of mini chamber with ergonomic function deployment (EFD) method,13.718849,-0.4400694,2021,"Vaccines may induce positive non-specific immune responses to other pathogens This study aims to evaluate if influenza vaccination in the 2019&ndash;2020 season had any effect on the risk of SARS-CoV-2 confirmed infection in a cohort of health workers During the first SARS-CoV-2 epidemic wave in Spain, between March and May 2020, a cohort of 11,201 health workers was highly tested by RT-qPCR and/or rapid antibody test when the infection was suspected Later in June, 8665 of them were tested for total antibodies in serum A total of 890 (7 9%) health workers were laboratory-confirmed for SARS-CoV-2 infection by any type of test, while no case of influenza was detected The adjusted odds ratio between 2019&ndash;2020 influenza vaccination and SARS-CoV-2 confirmed infection was the same (1 07;95% CI, 0 92&ndash;1 24) in both comparisons of positive testers with all others (cohort design) and with negative testers (test-negative design) Among symptomatic patients tested by RT-qPCR, the comparison of positive cases and negative controls showed an adjusted odds ratio of 0 86 (95% CI, 0 68&ndash;1 08) These results suggest that influenza vaccination does not significantly modify the risk of SARS-CoV-2 infection The development of specific vaccines against SARS-CoV-2 is urgent","Martínez-Baz, Iván Trobajo-Sanmartín Camino; Arregui, Irati; Navascués, Ana; Adelantado, Marta; Indurain, Juan; Fresán, Ujué Ezpeleta Carmen; Castilla, Jesús",Vaccines,817,2
208249,208249,208249,"An empirical evaluation of video conferencing systems used in industry, academia, and entertainment [work-in-progress]",13.421865,-0.2651776,2021,"Serological rapid diagnostic tests (RDTs) are widely used across pathologies, often providing users a simple, binary result (positive or negative) in as little as 5 to 20 min. Since the beginning of the COVID-19 pandemic, new RDTs for identifying SARS-CoV-2 have rapidly proliferated. However, these seemingly easy-to-read tests can be highly subjective, and interpretations of the visible ""bands"" of color that appear (or not) in a test window may vary between users, test models, and brands. We developed and evaluated the accuracy/performance of a smartphone application (xRCovid) that uses machine learning to classify SARS-CoV-2 serological RDT results and reduce reading ambiguities. Across 11 COVID-19 RDT models, the app yielded 99.3% precision compared to reading by eye. Using the app replaces the uncertainty from visual RDT interpretation with a smaller uncertainty of the image classifier, thereby increasing confidence of clinicians and laboratory staff when using RDTs, and creating opportunities for patient self-testing.","Mendels, David-A; Dortet, Laurent; Emeraud, Cécile; Oueslati, Saoussen; Girlich, Delphine; Ronat, Jean-Baptiste; Bernabeu, Sandrine; Bahi, Silvestre; Atkinson, Gary J H; Naas, Thierry",Proc. Natl. Acad. Sci. U. S. A,817,13
208250,208250,208250,"An empirical evaluation of video conferencing systems used in industry, academia, and entertainment [work-in-progress]",13.325826,-0.14430536,2021,"Today, the use of computer networks is evident in all walks of life, including mobile phones, vehicles, personal computers, the workplace and more Creating and operating networks between each of the above-mentioned devices require good infrastructure to be able to communicate between these devices To solve this problem, there were networks called ad-hoc networks, which were able to network with each other without the need for specific infrastructure and only through direct and wireless communication between the equipment But how to make the right connections in these types of networks, as well as high-speed communication for devices, are also challenges for researchers In this study, we try to implement the communication between these devices by the DSR routing algorithm and, using the Q learning technique of the reinforced learning algorithm, we enhance it to respond to QOS in Ad-Hoc mobile networks compared to previous solutions In addition to what has been improved in this article In the following articles, we will try to improve the discussion of communication security using this method and also apply this method to routing VANETs networks © 2020 © 2020 Ehsan Moqimi, Amir Najafi and Mojtaba Ajami This open access article is distributed under a Creative Commons Attribution (CC-BY) 3 0 license","Moqimi, E.; Najafi, A.; Ajami, M.",Journal of Computer Science,817,1
209309,209309,209309,Indefiniteness Effect on Meaning Regulation in the Young Female Students Trained in Psychology,13.237353,-0.48319116,2021,"The importance of spiritual nourishment has become the hope of the people in dealing with the COVID-19 pandemic. This spiritual side of the people must be in tandem with the social responsibility for those in need. Dealing with both spiritual and social responsibilities points out the 'Alay Kapwa Spirituality'. Thus, in both spiritual and social aspects, this paper highlights that practicing 'Alay Kapwa Spirituality' in the time of the Corona Virus Disease (COVID-19) pandemic is highly useful response in satisfying one's spiritual thirst and social responsibility.","Rosales, Renniel Jayson Jacinto; Agena, Kristel Eunice Geroleo",J. public health (Oxf),817,16
213324,213324,213324,Challenges facing movement research in the time of Covid-19: Issues in redesigning workshops for remote participation and data collection,13.274849,-0.17094728,2020,"At the time of writing, the ongoing pandemic of coronavirus disease (COVID-19) has caused severe impacts on society, economy and people's daily lives. People constantly express their opinions on various aspects of the pandemic on social media, making user-generated content an important source for understanding public emotions and concerns. In this paper, we perform a comprehensive analysis on the affective trajectories of the American people and the Chinese people based on Twitter and Weibo posts between January 20th, 2020 and May 11th 2020. Specifically, by identifying people's sentiments, emotions (i.e., anger, disgust, fear, happiness, sadness, surprise) and the emotional triggers (e.g., what a user is angry/sad about) we are able to depict the dynamics of public affect in the time of COVID-19. By contrasting two very different countries, China and the Unites States, we reveal sharp differences in people's views on COVID-19 in different cultures. Our study provides a computational approach to unveiling public emotions and concerns on the pandemic in real-time, which would potentially help policy-makers better understand people's need and thus make optimal policy.","Li, Xiaoya; Zhou, Mingxin; Wu, Jiawei; Yuan, Arianna; Wu, Fei; Li, Jiwei",,817,16
214768,214768,214768,How Human and Organizational Factors Influence Software Teams Productivity in COVID-19 Pandemic: A Brazilian Survey,13.41312,-0.52110845,2020,"During the Covid-19 pandemic in Italy, official data are collected with medical swabs following a pure convenience criterion which, at least in an early phase, has privileged the exam of patients showing evident symptoms. However, there are evidences of a very high proportion of asymptomatic patients. In this situation, in order to estimate the real number of infected (and to estimate the lethality rate), it should be necessary to run a properly designed sample survey through which it would be possible to calculate the probability of inclusion and hence draw sound probabilistic inference. Unfortunately, the survey run by the Italian Statistical Institute encountered many field difficulties. Some researchers proposed estimates of the total prevalence based on various approaches, including epidemiologic models, time series and the analysis of data collected in countries that faced the epidemic in earlier times. In this paper, we propose to estimate the prevalence of Covid-19 in Italy by reweighting the available official data published by the Istituto Superiore di Sanità so as to obtain a more representative sample of the Italian population. Reweighting is a procedure commonly used to artificially modify the sample composition so as to obtain a distribution which is more similar to the population. In this paper, we will use post-stratification of the official data, in order to derive the weights necessary for reweighting the sample results, using age and gender as post-stratification variables, thus obtaining more reliable estimation of prevalence and lethality. Specifically, for Italy, we obtain a prevalence of 9%. The proposed methodology represents a reasonable approximation while waiting for more reliable data obtained with a properly designed national sample survey and that it could be further improved if more data were made available.","Bassi, F; Arbia, G; Falorsi, P D",Sci Total Environ,817,20
214959,214959,214959,Performance testing on the shopee website in the pandemic period of COVID-19,13.381331,-0.31879276,2020,"Propolis, a resinous material produced by honey bees from plant exudates, has long been used in traditional herbal medicine and is widely consumed as a health aid and immune system booster The COVID-19 pandemic has renewed interest in propolis products worldwide;fortunately, various aspects of the SARS-CoV-2 infection mechanism are potential targets for propolis compounds SARS-CoV-2 entry into host cells is characterized by viral spike protein interaction with cellular angiotensin-converting enzyme 2 (ACE2) and serine protease TMPRSS2 This mechanism involves PAK1 overexpression, which is a kinase that mediates coronavirus-induced lung inflammation, fibrosis, and immune system suppression Propolis components have inhibitory effects on the ACE2, TMPRSS2 and PAK1 signaling pathways;in addition, antiviral activity has been proven in vitro and in vivo In pre-clinical studies, propolis promoted immunoregulation of pro-inflammatory cytokines, including reduction in IL-6, IL-1 beta and TNF-a This immunoregulation involves monocytes and macrophages, as well as Jak2/STAT3, NF-kB, and inflammasome pathways, reducing the risk of cytokine storm syndrome, a major mortality factor in advanced COVID-19 disease Propolis has also shown promise as an aid in the treatment of various of the comorbidities that are particularly dangerous in COVID-19 patients, including respiratory diseases, hypertension, diabetes, and cancer Standardized propolis products with consistent bioactive properties are now available Given the current emergency caused by the COVID-19 pandemic and limited therapeutic options, propolis is presented as a promising and relevant therapeutic option that is safe, easy to administrate orally and is readily available as a natural supplement and functional food","Berretta, A. A.; Silveira, M. A. D.; Capcha, J. M. C.; Jong, D. de",Biomedicine &amp; Pharmacotherapy,817,24
215587,215587,215587,PG119 Adapting on-call simulation for final year medical students to an online format during the Covid-19 pandemic,13.608059,-0.20330009,2020,"The aim of this paper is to highlight the problematic of significant growth of mental health issues in retire people category, and the care of retire people with mental health issues, primarily the perspective of this paper is social. The main focus of this article is on characteristic and approach to mental health issues with addition of arise of mental health issues in the population. Also, it reflects the pandemic of COVID-19. Furthermore, the article is presenting the aspect of social influence. Besides, it focuses on the possibilities of healing the mental health diseases with regards to chosen age category. © 2021, University of Defence, Faculty of Military Health Sciences. All rights reserved.","Stárek, L.",Military Medical Science Letters (Vojenske Zdravotnicke Listy),817,16
215687,215687,215687,PG30 How to do a remote OSCE successfully: converting face to face simulation into a Virtual E-consult in the pandemic crisis,13.435234,-0.17846878,2020,"Nrf2 is a key transcription factor responsible for antioxidant defense in many tissues and cells, including alveolar epithelium, endothelium, and macrophages Furthermore, Nrf2 functions as a transcriptional repressor that inhibits expression of the inflammatory cytokines in macrophages Critically ill patients with COVID-19 infection often present signs of high oxidative stress and systemic inflammation - the leading causes of mortality This article suggests rationale for the use of Nrf2 inducers to prevent development of an excessive inflammatory response in COVID-19 patients Nrf2 является ключевым фактором транскрипции, ответственным за антиоксидантную защиту во многих тканях и клетках, включая альвеолярный эпителий, эндотелий и макрофаги Кроме того, Nrf2 функционирует как транскрипционный репрессор, подавляющий экспрессию цитокинов воспаления в макрофагах Пациенты с COVID-19 в критическом состоянии зачастую имеют чрезвычайно высокие параметры окислительного стресса и системного воспаления, которое служит одной из основных причин летальности В данной статье представлено обоснование использования индукторов транскрипционного фактора Nrf2 для предотвращения развития избыточного воспалительного ответа при COVID-19","Zinovkin, R. A.; Grebenchikov, O. A.",Biokhimiya,817,20
