,index,Unnamed: 0,title_x,x,y,publish_time_x,abstract,authors,journal,category,cluster
108806,108806,108806,COVID-19 Vaccination: An Overview and Education Tool for Nuclear Medical Technologists.,18.601355,0.16298646,2021-01-22,"OBJECTIVE To identify additional risk factors for placenta praevia in women with prior caesarean section. METHOD A retrospective case-control study of 53 cases and 157 controls was performed. Information was obtained from the National Women's database between 2004 and 2009. Cases were defined as women with diagnosed placenta praevia over 20 weeks' gestation and having had one or more prior caesarean sections. Risk factors assessed from the prior caesarean section were (i) type of suture used for hysterotomy closure; (ii) stage of labour; (iii) type of primary surgeon; and (iv) model of funding. Univariate and logistical regression analyses were performed. RESULTS Use of monofilament suture for hysterotomy closure in prior caesarean section significantly reduced the chance of having placenta praevia in the index pregnancy (adjusted odds ratio 0.26, 95% confidence interval 0.08-0.80), as did prior caesarean being performed in the first stage of labour (aOR 0.36, 95% CI 0.14-0.92). Type of primary surgeon (specialist vs trainee junior doctor), nor model of funding of prior caesarean section (public vs private), was associated with risk of placenta praevia (privately funded specialist aOR 4.75, 95% CI 0.89-25.23 and trainee junior doctor aOR 3.18, 95% CI 0.59-17.28, respectively). CONCLUSION A prior caesarean section performed in first stage, and monofilament suture for hysterotomy closure, reduced the chance of having placenta praevia in the index pregnancy.","Chiu, Tin Lok; Sadler, Lynn; Wise, Michelle R",The Australian & New Zealand journal of obstetrics & gynaecology,378,8
109187,109187,109187,AAR-LN-DQ: Automatic Anatomy Recognition based Disease Quantification in Thoracic Lymph Node Zones via FDG PET/CT images without Nodal Delineation.,18.390465,0.4678398,2020-05-16,"Human PP11 (placental protein 11) was previously described as a serine protease specifically expressed in the syncytiotrophoblast and in numerous tumor tissues. Several PP11-like proteins were annotated in distantly related organisms, such as worms and mammals, suggesting their involvement in evolutionarily conserved processes. Based on sequence similarity, human PP11 was included in a protein family whose characterized members are XendoU, a Xenopus laevis endoribonuclease involved in small nucleolar RNA processing, and Nsp15, an endoribonuclease essential for coronavirus replication. Here we show that the bacterially expressed human PP11 displays RNA binding capability and cleaves single stranded RNA in a Mn(2+)-dependent manner at uridylates, to produce molecules with 2',3'-cyclic phosphate ends. These features, together with structural and mutagenesis analyses, which identified the potential active site residues, reveal striking parallels to the amphibian XendoU and assign a ribonuclease function to PP11. This newly discovered enzymatic activity places PP11-like proteins in a completely new perspective.","Laneve, Pietro; Gioia, Ubaldo; Ragno, Rino; Altieri, Fabio; Di Franco, Carmen; Santini, Tiziana; Arceci, Massimo; Bozzoni, Irene; Caffarelli, Elisa",The Journal of biological chemistry,378,24
109257,109257,109257,Leadership and early strategic response to the SARS-CoV-2 pandemic at a COVID-19 designated hospital in South Africa.,18.55826,0.3839481,2020-04-23,"BACKGROUND There are myriad symptoms and signs of gastrojejunal leak; prompt recognition is essential. Many surgeons use clinical predictors to guide selective use of upper gastrointestinal imaging (UGI). The appropriate practice remains undefined. STUDY DESIGN A review of patients who underwent primary laparoscopic Roux-en-Y gastric bypass between January 2002 and December 2008 was conducted. All underwent routine UGI studies on postoperative day 1. Actual gastrojejunal leak within 7 days of surgery (actual leak [AL], radiologic leaks), operative reports, patient charts, and postoperative vital signs were retrospectively reviewed. RESULTS There were 2,099 operations. Eight ALs (0.43%) occurred without associated mortality. UGI was positive in 7 AL patients and falsely positive in 6 patients. The AL patients underwent laparoscopy on postoperative days 1 and 3 (n = 5 and n = 1, respectively), laparotomy on postoperative day 3 (n = 1), and peritoneal drainage (n = 1). False-positive UGIs prompted laparoscopy (n = 3) and close observation (n = 3). Pulse was 100 to 120 beats per minute in 2 patients and fever (>38.5°C) was present in 0 AL patients. AL patients had osteogenesis imperfecta (n = 1), macronodular cirrhosis (n = 1), positive bubble test (n = 3), and concomitant splenectomy (n = 1). No jejunojejunostomy leaks were identified. CONCLUSIONS Routine UGI after laparoscopic Roux-en-Y gastric bypass has greater sensitivity than clinical signs for detecting gastrojejunal leak. Delay in the diagnosis of leakage can impact mortality, and this suggests that indications for routine UGI might still exist. Tachycardia is not a reliable early marker of leak. There might be risk factors for leak in addition to vital signs, including patient medical history or intraoperative events, which should prompt routine UGI on postoperative day 1.","Leslie, Daniel B; Dorman, Robert B; Anderson, Joel; Serrot, Federico J; Kellogg, Todd A; Buchwald, Henry; Sampson, Barbara K; Slusarek, Bridget M; Ikramuddin, Sayeed",Journal of the American College of Surgeons,378,17
109359,109359,109359,Assessing Trainees and Making Entrustment Decisions: On the Nature and Use of Entrustment-Supervision Scales.,18.694223,0.12266669,2020-04-21,"OBJECTIVE To review recent endovascular intervention trials for acute ischemic stroke. DATA SOURCES Recent, randomized controlled trials of endovascular interventions for acute ischemic stroke were identified. The search terms ""endovascular"" AND ""stroke"" were used and filter for ""randomized controlled trial"" was applied; the period searched was January 1, 2013, to October 31, 2015. STUDY SELECTION AND DATA EXTRACTION Randomized controlled trials of endovascular interventions in acute ischemic stroke published within the past 3 years (2013-2015). DATA SYNTHESIS A total of 8 trials are reviewed: 3 trials published in 2013 demonstrated neutral results for endovascular interventions, and 5 trials published in 2015 demonstrated positive results for endovascular interventions. Potential reasons for the change in outcomes include better patient selection and improvement indevice technology. Patient selection improvements included selecting patients with salvageable brain tissue with an identifiable thrombus on perfusion imaging. The major improvement in device technology was the introduction of the Solitaire Flow Restoration stent retriever and the Trevo stent retriever, both of which have improved recanalization rates compared with earlier devices. Adjunctive medication considerations include the mode of sedation (general or conscious), intraprocedural anticoagulation with heparin, and intra-arterial tissue plasminogen activator. CONCLUSIONS The use of endovascular devices for treating acute ischemic stroke is likely to increase as more centers become capable of integrating them into their stroke programs. It is important for pharmacists to understand the trials that evaluated endovascular interventions because differences exist with respect to device, adjunctive medication, and patient selection, all of which affect patient outcomes.","Bishop, Bryan M",The Annals of pharmacotherapy,378,26
109992,109992,109992,Updated guidelines on telemedicine - a step in the right direction.,18.704102,0.4292944,2020-07-07,"PURPOSE Evidence-based practice is fundamental to providing quality care, patient satisfaction and judicious use of limited healthcare resources. However, variability in evidence-based eye care delivery has been reported. Given the important role of optometrists in delivering primary eye care, a better understanding of the barriers and facilitators to providing optometric care is required. This systematic review aimed to identify determinants (barriers and facilitators) of eye care delivery by optometrists and interventions that may improve eye care delivery. RECENT FINDINGS PubMed, MEDLINE, EMBASE, CINAHL, SCOPUS, PsychINFO, ProQuest and Web of Science were searched for studies reporting barriers and facilitators to eye care delivery published between 1999 and 2020. The Theoretical Domains Framework (TDF) was used to analyse data (quotations, interpretive summaries, survey result) with barriers and facilitators coded to one or more of the 14 domains, and used to identify the key behavioural domains influencing eye care delivery based on frequency of coding, elaboration and stated importance in the study. Influential domains were mapped to the Behaviour Change Wheel to identify potential interventions to improve eye care delivery. Of the 802 studies retrieved from the search, 30 were included. Frequently identified barriers were time constraints, resources and equipment issues, patient factors, lack of awareness, skill proficiency deficits and negative attitudes and beliefs. Frequently identified facilitators were adequate time, resources and equipment, education, skill proficiency and understanding the relevancy of the eye care provided. The key TDF domains influencing eye care delivery were 'environmental context and resources' (time, resources, equipment issues, patient factors), 'knowledge' (awareness issues), 'skills' (skills proficiency) and 'belief about consequences' (beliefs and relevancy). Intervention functions that may improve eye care delivery were education, training, restriction, environmental restructuring, enablement, persuasion and modelling. SUMMARY The barriers and facilitators identified in this review were diverse and located at both the practitioner and organisational levels. Four TDF domains were found to be influential determinants of eye care practice. Intervention functions identified in this study can be used to improve the appropriateness of primary eye care delivery.","Toomey, Melinda; Gyawali, Rajendra; Stapleton, Fiona; Ho, Kam Chun; Keay, Lisa; Jalbert, Isabelle",Ophthalmic & physiological optics : the journal of the British College of Ophthalmic Opticians,378,1
110133,110133,110133,COVID-19 Pandemic: health professionals' perception about the assistance mentioned in television media.,18.745485,0.30018625,2021,"PURPOSE To describe the possible adverse effects of sodium hypochlorite (NaOCl) solutions, high-concentration alcohol solutions, and povidone-iodine products, which are indicated for disinfection of inanimate surfaces against human coronavirus of the severe acute respiratory syndrome (SARS-CoV), on prosthesis materials, including zirconia, lithium disilicate, and acrylic resin. MATERIALS AND METHODS A systematic literature research for articles published between January 2010 and February 2020 was conducted in Scopus, PubMed/Medline, Web of Science, Embase, and Science Direct using a combination of the following MeSH/Emtree terms and keywords: sodium hypochlorite, alcohol, ethanol, povidone-iodine, dental ceramic, zirconia, lithium disilicate, and acrylic resin. RESULTS A total of 538 studies were identified in the search during initial screening, of which 44 were subject to full-text evaluation, and 24 fulfilled the inclusion criteria. Seven articles on zirconia and lithium disilicate investigated the effect of NaOCl (0.5% and 1%), 96% isopropanol, and 80% ethanol on bond strength after saliva contamination. The remaining articles evaluated color alteration, surface roughness modifications, decrease in flexural strength, and bonding strength of all cleaning agents on acrylic resin. CONCLUSION NaOCl (1%) solution for 1 minute is recommended to reduce SARS-CoV infectivity and to minimize the risk of cross-contamination through prosthetic materials. The increase in surface roughness and color alteration were recorded using 1% NaOCl on acrylic resin, but this increase was not clinically significant. A decrease in bonding strength was determined after using 1% NaOCl, 96% isopropanol, and 80% ethanol solutions on lithium disilicate. Silanization before the try-in procedure and the application of the second layer of silane after cleaning methods are recommended to improve the bonding strength.","Di Fiore, Adolfo; Monaco, Carlo; Granata, Stefano; Stellini, Edoardo",The International journal of prosthodontics,378,19
110540,110540,110540,Lessons from the past in the present: news from the Spanish flu pandemic to COVID-19.,18.710802,0.1336004,2021,"STUDY OBJECTIVE To evaluate risk of leakage and tissue dissemination associated with various contained tissue extraction (CTE) techniques. DESIGN In vitro study (Canadian Task Force classification: II-1). SETTING Academic hospital simulation laboratory. INTERVENTION Beef tongue specimens weighing 400 to 500 g were stained using 5 mL indigo carmine dye and morcellated under laparoscopic guidance within a plastic box trainer. CTE was performed via 3 different techniques: a stitch-sealed rip-stop nylon bag and multi-port approach; a one-piece clear plastic 50 × 50-cm isolation bag and multi-port approach; or a 1-piece clear plastic 50 × 50-cm isolation bag and single-site approach. Four trials of each CTE method were performed and compared with an open morcellation control. All bags were insufflated to within 10 to 25 mmHg pressure with a standard CO2 insufflator. Visual evidence of spilled tissue or dye was recorded, and fluid washings of the box trainer were sent for cytologic analysis. MEASUREMENTS AND MAIN RESULTS Blue dye spill was noted in only 1 of 12 CTE trials. Spillage was visualized from a seam in 1 of the 4 stitch-sealed rip-stop nylon bags before morcellation of the specimen. The only trial in which gross tissue chips were visualized in the box trainer after morcellation was the open morcellation control. However, cytologic examination revealed muscle cells in the open morcellation washings and in the washings from the trial with dye spill. Muscle cells were not observed at cytologly in any of the other samples. CONCLUSION CTE did not result in any leakage or tissue dissemination with use of the single-site or multi-port approach when using a 1-piece clear plastic 50 × 50-cm isolation bag. Further studies are needed to corroborate these findings in an in vivo context and to evaluate use of alternate bag options for specimen containment.","Cohen, Sarah L; Greenberg, James A; Wang, Karen C; Srouji, Serene S; Gargiulo, Antonio R; Pozner, Charles N; Hoover, Nicholas; Einarsson, Jon I",Journal of minimally invasive gynecology,378,1
111542,111542,111542,A qualitative analysis of seven ivermectin formulations in South Africa.,18.494719,0.5200478,2021-02-18,"BACKGROUND The effectiveness of vedolizumab as a treatment for extraintestinal manifestations (EIM) is questionable due to its gut-specificity. AIM To assess effectiveness of vedolizumab for EIM in patients with inflammatory bowel disease (IBD) in a large real-life experience cohort. METHODS Between June and December 2014, 173 patients with Crohn's disease and 121 with ulcerative colitis were treated with vedolizumab. Patients were followed until week 54. EIM activity was assessed at weeks 0, 6, 14, 22, 30 and 54 by using a 3-step scale: complete remission, partial response and no response. RESULTS At baseline, 49 (16.7%) patients had EIMs of which 47 had inflammatory arthralgia/arthritis, four had cutaneous lesions and two had both rheumatologic and skin EIM. At week 54, 21 (44.7%) patients had complete remission for inflammatory arthralgia/arthritis and three (75%) for cutaneous EIM. In multivariate analysis, complete remission of inflammatory arthralgia/arthritis was associated with clinical remission of IBD (OR = 1.89, IC95% [1.05-3.41], P = .03) and recent onset of inflammatory arthralgia/arthritis (OR = 1.99, IC95% [1.12-3.52], P = .02). During the follow-up period, 34 (13.8%) patients without any EIM at baseline, developed incident cases of inflammatory arthralgia/arthritis consisting mostly of peripheral arthralgia without evidence of arthritis and 14 (4.8%) incident cases of paradoxical skin manifestation. CONCLUSION Vedolizumab therapy is commonly associated with improvement in EIM. This was associated with quiescent IBD and recent EIM. However, paradoxical skin manifestation and inflammatory arthralgia/arthritis may occur upon vedolizumab therapy.","Tadbiri, S; Peyrin-Biroulet, L; Serrero, M; Filippi, J; Pariente, B; Roblin, X; Buisson, A; Stefanescu, C; Trang-Poisson, C; Altwegg, R; Marteau, P; Vaysse, T; Bourrier, A; Nancey, S; Laharie, D; Allez, M; Savoye, G; Gilletta, C; Gagniere, C; Vuitton, L; Viennot, S; Aubourg, A; Pelletier, A-L; Bouguen, G; Abitbol, V; Fumery, M; Claudepierre, P; Bouhnik, Y; Amiot, A",Alimentary pharmacology & therapeutics,378,1
111968,111968,111968,Challenges in evaluating SARS-CoV-2 vaccines during the COVID-19 pandemic.,18.266838,0.0085137645,2020-07-09,"The COVID-19 pandemic has resulted in significant challenges for the resuscitation of paediatric patients, especially for infants and children who are suspected or confirmed to be infected. Thus, the paediatric subcommittee of the Singapore Resuscitation and First Aid Council developed interim modifications to the current Singapore paediatric guidelines using extrapolated data from the available literature, local multidisciplinary expert consensus and institutional best practices. It is hoped that this it will provide a framework during the pandemic for improved outcomes in paediatric cardiac arrest patients in the local context, while taking into consideration the safety of all community first responders, medical frontline providers and healthcare workers.","Ong, Gene Yong-Kwang; Ng, Beatrice Hui Zhi; Mok, Yee Hui; Ong, Jacqueline Sm; Ngiam, Nicola; Tan, Josephine; Lim, Swee Han; Ng, Kee Chong",Singapore medical journal,378,31
112145,112145,112145,HIV and SARS-CoV-2 co-infection: The diagnostic challenges of dual pandemics.,18.657156,0.08669048,2020-04-30,"PURPOSE OF THE REVIEW Viruses are an increasingly recognized cause of community-acquired pneumonia (CAP), but their exact role in nosocomial pneumonia is still debated. This review focuses on the role of viruses as a cause of nosocomial pneumonia. RECENT FINDINGS Respiratory viruses may be responsible for healthcare-associated pneumonia, because affected patients and those with CAP have the same risk factors for viral disease. In mechanically ventilated patients, viruses belonging to the Herpesviridae family, namely herpes simplex virus (HSV) and cytomegalovirus, can be reactivated and cause bronchopneumonitis or ventilator-associated pneumonia, respectively. Recent results confirmed the high rate of HSV reactivation in the distal airways of mechanically ventilated patients, and that patients with high virus loads (>10(5) copies/ml of bronchoalveolar lavage fluid) have poorer outcomes than those with low or no virus load. However, the responsibility of mimivirus, initially described as a possible cause of pneumonia, was not confirmed for nosocomial pneumonia. SUMMARY Respiratory viruses are mainly responsible for CAP, but they may also cause healthcare-associated pneumonia. HSV bronchopneumonitis and cytomegalovirus pneumonia are not rare diseases, and patients with Herpesviridae lung infections have worse prognoses than those without. Whether or not those Herpesviridae infections are responsible for true morbidity or morbidity remains to be determined.","Luyt, Charles-Edouard; Bréchot, Nicolas; Chastre, Jean",Current opinion in infectious diseases,378,17
112986,112986,112986,Worldwide COVID-19 spreading explained: traveling numbers as a primary driver for the pandemic.,18.7099,0.061019473,2020,"BACKGROUND AND PURPOSE Smoking is a major risk factor for patients with intracranial aneurysms, yet the effects of smoking on outcomes of aneurysm with flow-diverter treatment remain unknown. We studied the impact of smoking on long-term angiographic and clinical outcomes after flow-diverter treatment of intracranial aneurysms. MATERIALS AND METHODS We retrospectively reviewed data from patients treated with the Pipeline Embolization Device and included in the International Retrospective Study of the Pipeline Embolization Device, the Pipeline for Uncoilable or Failed Aneurysms Study, and the Aneurysm Study of Pipeline in an Observational Registry. Patients were stratified according to smoking status into 3 groups: 1) never smoker, 2) current smoker, and 3) former smoker. We studied angiographic and clinical outcomes. Outcomes were compared by using χ(2) and Student t tests. A multivariate analysis was performed to determine whether smoking was independently associated with poor outcomes. RESULTS Six hundred sixteen patients with 694 aneurysms were included. Current smokers had a smaller mean aneurysm size compared with the other 2 groups (P = .005) and lower rates of multiple Pipeline Embolization Device use (P = .015). On multivariate analysis, former smokers (OR, 1.08; 95% CI, 0.43-2.71; P = .57) and current smokers (OR, 0.70; 95% CI, 0.27-1.77; P = .38) had similar odds of long-term angiographic incomplete occlusion compared with never smokers. Former smokers (OR, 1.27; 95% CI, 0.64-2.52; P = .25) and current smokers (OR, 0.74; 95% CI, 0.37-1.46; P = .22) had similar odds of major morbidity and neurologic mortality compared with never smokers. CONCLUSIONS These results suggest that smoking is not associated with angiographic and clinical outcomes among patients treated with the Pipeline Embolization Device. Nonetheless, patients with intracranial aneurysms should continue to be counseled about the risks of tobacco smoking.","Rouchaud, A; Brinjikji, W; Cloft, H J; Lanzino, G; Becske, T; Kallmes, D F",AJNR. American journal of neuroradiology,378,5
