,index,Unnamed: 0,title_x,x,y,publish_time_x,abstract,authors,journal,category,cluster
229374,229374,229374,[COVID-19-associated hyperinflammatory state in a 15-year-old female patient],16.606153,7.409182,2020,"Introduction: dyslipidemia and hypertension are independent cardiovascular risk factors that are linked by insulin resistance and commonly coexist as components of the metabolic syndrome. The consequences of dyslipidaemic patterns includes high cardiovascular risk profile and sequalae. Data on lipid patterns amongst hypertensive patients in Abuja, a city with affluent pattern of life style and rising cardiovascular risk profile is very scanty or limited to just levels of total plasma cholesterol. This study was aimed at determining the pattern and frequencies of dyslipidaemic forms among hypertensive patients in Abuja. Methods: this was a retrospective cohort study with the following data collected; socio-demographics, anthropometric measures and certain metabolic parameters from the new and old groups and analyzed using IBM SPSS Statistics, version 23. All decisions were made using the assymp. Two-sided Pearson &#967;2 probability. Quantitative variables were expressed as means and standard deviations. Qualitative variables were expressed as percentages. A p-value of &#8804;0.05 was set as significant. Results: eight hundred and fifty eight (858) cases were enrolled for this study, 704 (82.1%) olds and 154 (17.9%) news. There were 251 (29.3%) males and 607 (70.7%) females. The means of the two groups were largely comparable. The commonest dyslipidaemic type was reduced High density lipoprotein, HDL (96.1%), followed by elevated low-density lipoprotein, LDL (78.6%), then, elevated total cholesterol, (62.3%) TCHOL and elevated triglycerides, TG 43.5%. Conclusion: dyslipidemic forms are very common among hypertensive patients in Abuja, Nigeria, particularly reduced HDL. Some observed associations include; middle age, female gender, middle/upper socio-economic classes, low levels of physical activity, overweight/obesity, dysglycaemia and long-standing hypertension.","Onyegbutulem, Henry Chijioke; Dogo, Dilli; Alu, Francis; Dankyau, Musa; Olorunfemi, David Samuel; Abdullahi, Faruk Mustapha; Akerele, Isaac Olubanji; Bala, Nafisah Ja039; afar,; Ibeabuchi, Ugo Nnenna; Mohammed, Maimuna Onyi",Pan Afr Med J,459,24
229585,229585,229585,El ozono no consigue la desinfección de los vehículos de emergencias de virus similares al SARS-CoV-2,16.842655,-1.5281247,2020,"The impact of the COVID-19 pandemic on the practice of work-integrated learning (WIL) has been significant, with many active WIL activities pivoting to remote offerings where students engage with the workplace through online platforms from their homes The pandemic has also caused significant and ongoing disruption to the economy, likely causing less work placement opportunities for upcoming years within the context of limited institutional budgets and resourcing It is, therefore, vitally important that institutions develop diverse practices of WIL and shift away from a heavy reliance on work placements Developing diverse WIL practices across educational institutions is an important strategy to build 'institutional WIL resilience' during times of disrupted economies with limited WIL opportunities During the pandemic, the use of simulations had increased, in particular, in relation to preparing students for WIL, however, caution is needed in considering simulations as a comparable alternative to WIL","Zegwaard, Karsten E.; Pretti, T. Judene Rowe Anna D.",International Journal of Work - Integrated Learning,459,32
229879,229879,229879,Sequelles de la COVID-19,16.432219,-1.5489978,2020,"e-Commerce today is a huge domain which has flourished at an unparalleled pace throughout the world. People have been turning towards online businesses for buying as well as selling their merchandise. The times of COVID-19 pandemic have further fueled this shift. Considerable research has been done for the betterment of the marketplace as well as customer experience. However, the e-Seller's point of view has never been given its due in this scenario. Most of the e-Sellers have now shifted to multi-platform e-Commerce solutions with surge in competition. This manuscript focuses on the plight of the e-Seller and elaborates the Process Flow of an e-Commerce business and details the various challenges encountered during each phase for a multi-platform goods trade. It discusses the set procedure that every e-Commerce business follows in order to achieve satisfactory results and reviews the needs of an e-Seller and the tools available for easing out some of the e-Seller tasks. The findings are based on the first-hand information and experience provided by the e-sellers and analysis of their data. With practically no study and appropriate tools to aid the e-Seller, the survival chances of even average-sized businesses are low. Despite the advancement of technology, through the research done in this paper, it has been found out that there are many domains in the e-Commerce Process Flow of the e-Seller which have still not been studied and fail to come up with a solution to help the trader. As a first of its kind, these novel dimensions in this domain have been highlighted, and the possibility for a plausible solution has been conveyed through this manuscript. © 2021 Bharati Vidyapeeth, New Delhi. Copy Right in Bulk will be transferred to IEEE by Bharati Vidyapeeth.","Jain, S.; Jain, A.","8th International Conference on Computing for Sustainable Global Development, INDIACom 2021",459,30
230545,230545,230545,"Orientaciones para la planificación de la introducción de la vacuna contra la COVID-19, 10 de julio del 2020",16.44167,-1.3584422,2020,"The safety of NSAIDs, corticosteroids and renin-angiotensin inhibitors in COVID-19 is challenged NSAIDs may interfere with the defense process against viral infection and are best avoided Systemic corticosteroids have not shown benefit in viral infection, including other coronavirus;thus they should be avoided, unless prescribed for another indication The benefit-risk ratio is however clearly in favor of continuing inhaled corticosteroids in patients with asthma or COPD ACE inhibitors and sartans upregulate the expression of angiotensin-converting enzyme 2 (ACE2), the pulmonary receptor for SARS-CoV-2 Any possible clinical impact of these treatments on COVID-19 infection remains to be clarified;in the meantime, they should be continued La securite des AINS, corticoides et antihypertenseurs agissant sur le systeme renine-angiotensine lors dinfection a COVID-19 est mise en question Les AINS pourraient interferer avec le processus de defense face a une infection virale ;ils sont donc plutot a eviter Les corticoides systemiques nont pas montre de benefice lors dinfections virales, y compris a dautres coronavirus ;ils sont a eviter, sauf si prescrits pour une autre indication Le rapport benefice/risque est en revanche clairement en faveur de la poursuite des corticosteroides inhales chez les asthmatiques ou BPCO Les IEC et les sartans modulent lexpression de lenzyme de conversion de langiotensine 2 (ACE2), recepteur pulmonaire du SARS-CoV-2 Limpact clinique de ces traitements sur linfection a COVID-19 reste a preciser ;en attendant, ils sont a poursuivre","Rothuizen, Laura E.; Livio, Francoise; Buclin, Thierry",Revue medicale suisse,459,14
231579,231579,231579,"La Educación Ambiental En Los Límites, O La Necesidad Cívica Y Pedagógica De Respuestas a Una Civilización Que Colapsa",16.710623,-1.2989309,2020,"Serological testing is crucial in detection of previous infection and in monitoring convalescent and vaccine-induced immunity During the Severe Acute Respiratory Syndrome Corona Virus 2 (SARS-CoV-2) pandemic, numerous assay platforms have been developed and marketed for clinical use Several studies recently compared clinical performance of a limited number of serological tests, but broad comparative evaluation is currently missing Within this study, a panel of 161 sera from SARS-CoV-2 infected, seasonal CoV-infected and SARS-CoV-2 naïve subjects was enrolled to evaluate 16 ELISA/ECLIA-based and 16 LFA-based tests Specificities of all ELISA/ECLIA-based assays were acceptable and generally in agreement with the providers’ specifications, but sensitivities were lower as specified Results of the LFAs were less accurate as compared to the ELISAs, albeit with some exceptions We found a sporadic unequal immune response for different antigens and thus recommend the use of a nucleocapsid protein (N)- and spike protein (S)-based test combination when maximal sensitivity is necessary Finally, the quality of the immune response in terms of neutralization should be tested using S-based IgG tests","Werner, Maren Pervan Philip Glück Vivian Zeman Florian Koller Michael Burkhardt Ralph Glück Thomas Wenzel Jürgen J.; Schmidt, Barbara Gessner André Peterhoff David",Journal of Clinical Medicine,459,20
232216,232216,232216,Radiografía de la pandemia: análisis de la cobertura periodística de la Covid-19 en portadas de periódicos,16.47086,-1.4437674,2020,,"Rose, Suzanne",JAMA,459,1
232652,232652,232652,Proposal for a Model of Suicidal Ideation in Medical Students in Colombia: A Simulation Study./ Propuesta de un modelo de la ideación suicida en estudiantes de Medicina en Colombia: un estudio de simulación,16.837017,-1.3206444,2020,"Fintechs and banks welcome the opportunities presented by the EU's second Payment Services Directive, but fragmentation and other challenges still linger The EU’s second payment services directive (PSD2) has remained a challenge for financial services firms due to market fragmentation as well as technological issues, such as application programme interfaces (API) and strong customer authentication (SCA) Market fragmentation has continued to be an issue for financial services as they adjust to PSD2;The challenge for many remains strong customer authentication, for which the European Banking Authority has extended its deadline;Banks and fintechs are positive about the new relationship opportunities that PSD2 has offered “In the short term, we expect account aggregation to be the most common offering, while expecting more value-added services to follow, like credit risk assessments or allowing customers to benchmark their bills to find the cheapest providers","Franklin, Jimmie",International Financial Law Review,459,4
232841,232841,232841,"iOntoBioethics: A Framework for the Agile Development of Bioethics Ontologies in Pandemics, Applied to COVID-19",16.745161,6.5936728,2021,"Recently, a novel coronavirus (SARS-CoV-2; coronavirus disease 2019, COVID-19) has emerged, rapidly spreading and severely straining the capacity of the global health community. Many nations are employing combinations of containment and mitigation strategies, where early diagnosis of COVID-19 is vital in controlling illness progression and limiting viral spread within the population. Thus, rapid and accurate methods of early detection are vital to contain COVID-19 and prevent further spread and predicted subsequent infectious waves of viral recurrence in future. Immediately after its initial characterization, Chinese and American Centers for Disease Control and Prevention (CDCs) rapidly employed molecular assays for detection of COVID-19, mostly employing real-time polymerase chain reaction (RT-PCR) methods. However, such methods require specific expensive items of equipment and highly trained analysts, requiring upwards of 4-8 h to process. These requirements coupled with associated financial pressures may prevent effective deployment of such diagnostic tests. Loop mediated isothermal amplification(LAMP) is method of nucleic acid amplification which exhibits increased sensitivity and specificity are significantly rapid, and do not require expensive reagents or instruments, which aids in cost reduction for coronavirus detection. Studies have shown the successful application of LAMP assays in various forms to detect coronavirus RNA in patient samples, demonstrating that 1-10 copies of viral RNA template per reaction are sufficient for successful detection, ~100-fold more sensitive than conventional RT-PCR methods. Importantly, studies have also now demonstrated the effectiveness of LAMP methodology in the detection of SARS-CoV-2 RNA at significantly low levels, particularly following numerous improvements to LAMP assay protocols. We hypothesise that recent advancements in enhanced LAMP protocols assay perhaps represent the best chance for a rapid and robust assay for field diagnosis of COVID-19, without the requirement of specialized equipment and highly trained professionals to interpret results. Herein, we present our arguments with a view to disseminate such findings, to assist the combat of this virus that is proving so devastating. We hope that this strategy could be applied rapidly, and confirmed for viability with clinical samples, before being rolled out for mass-diagnostic testing in these current times.","Kashir, Junaid; Yaqinuddin, Ahmed",Med Hypotheses,459,23
233870,233870,233870,"[AEP: engine of the specialist's recognition and guarantor of the pediatric model. Generating health also in pandemic situations]./ La AEP, motor del reconocimiento de especialistas y garante del modelo pediátrico. Generando salud también en situaciones de pandemia",16.848593,-1.3843907,2020,"The perceived contrast of a central stimulus is reduced in the presence of a high contrast surround. A number of stimulus features influence the amount of suppression. A two-mechanism model has been proposed for stationary patterns involving a narrowly-tuned process, requiring very similar stimuli in the centre and surround, and a weaker, untuned or very broadly tuned process unselective for stimulus features. This study examines whether a similar model applies to the motion pathway in human participants by varying the orientation and direction of motion of the surround relative to the centre. Four experienced observers completed a two-interval forced-choice contrast matching task. The stimuli were drifting sinusoidal grating patterns with high contrast surrounds (95%) differing in direction of motion and orientation relative to the centre grating. All surround conditions produced suppression but a common orientation and direction of motion produced significantly more suppression than either opposite direction of motion conditions or orthogonal direction conditions. The tuning for motion direction differences was assessed for same and opposite directions of motion. These findings support the extension of the two-mechanism model of contrast suppression to motion direction.","Phillips, Daisy J; McDougall, Thomas J; Dickinson, J Edwin; Badcock, David R",Vision Res,459,14
234425,234425,234425,A propósito de la carta científica «Sospecha de abdomen agudo como manifestación extrapulmonar de infección COVID-19¼./ A propósito de la carta científica «Sospecha de abdomen agudo como manifestación extrapulmonar de infección COVID-19¼./ About the scientific letter 'Suspected acute abdomen as an extrapulmonary manifestation of COVID-19 infection',16.601751,-1.1159272,2020,"BACKGROUND: Kidney transplant recipients are at high risk of severe complications and death due to coronavirus disease 2019 (COVID-19). METHODS: The first part of the article describes a case of COVID-19 in our patient after a recent kidney transplant. The second part of the article presents the outcome of literature search from multiple resources from April 2020 until March 2021. Abstracts were screened, followed by full-text review with data extraction. Part 2 discusses current treatment options of COVID-19, and part 3 refers to this treatment application in patients after solid organ transplant. RESULTS: We have summarized 45 studies from China, France, Italy, Spain, the United Kingdom, and the United States. Mortality rates from published studies were variable. Based on early data from Spain, 42% of patients who developed COVID-19 within 60 days of transplant died. According to results of the European Renal Association COVID-19 Database collaboration group, the 28-day COVID-19-related mortality is 21.3% for kidney transplant recipients, which is still markedly higher than what is observed in other populations. Acute kidney injury was common, and mycophenolate mofetil and mammalian target of rapamycin were discontinued in most patients. CONCLUSIONS: Effective therapy has been sought since the outbreak of the pandemic, and at the same time intensive work has been done to produce a vaccine that could effectively protect against the disease. Summing up the efforts of numerous groups of researchers from around the world that have been continued since the beginning of 2020, we may assume the following: (1) we still do not have causal drugs that would reduce severe acute respiratory syndrome coronavirus 2 (SARS-CoV-2) replication and allow its complete elimination, but antispike monoclonal antibodies against SARS-CoV-2 seem to be very promising, and (2) the withdrawal of antiproliferative and antimetabolic drugs and the continuation of steroids and calcineurin inhibitors is now a commonly accepted approach in patients after organ transplant.","Kedzierska-Kapuza, Karolina; Zielinska, Dorota; Matejak-Górska, Marta; Durlik, Marek",Transplant Proc,459,21
234628,234628,234628,"Public Libraries: context, trends and models",16.434755,-1.4483241,2020,,"Singh, Mehak; Bothra, Atul; Pawar, Manoj; Maheswari, Anshu; Tiwari, Apoorv; Adhicari, Pankaj",J Am Acad Dermatol,459,1
235183,235183,235183,El tutor de formación sanitaria especializada en España (parte I): Regulación y reconocimiento de su labor,16.85399,-1.5652995,2021,"The transmission capacity of single-mode single-core fibers is approaching the limit of about 100 Tbps owing to nonlinearity and the fiber fuse, which limit the input signal power To avoid the so-called capacity crunch and dramatically increase the transmission capacity, a new approach utilizing space-division multiplexing (SDM) and mode-division multiplexing (MDM) has been proposed and demonstrated In these new multiplexing technologies, a problem that is unprecedented in conventional single-mode fibers, namely, the crosstalk between transmission channels, arises Although the input signal channels are mixed through at the output end, the signal channel can be identified using multiple-input multiple-output (MIMO) signal processing technology at the output end However, even using the MIMO digital signal processing technology, the problem that the computation time increases with the number of channels remains, resulting in increased latency, and so the number of channels is limited To design a transmission system using the SDM and MDM technologies, the crosstalk should be analyzed precisely However, the origin and behavior of crosstalk are different in SDM using multicore fibers (MCFs) and in MDM using few-mode fibers (FMFs) The behavior of crosstalk in single-mode MCFs is predictable to some extent by statistical analysis, and the system can be designed by considering the results of the analysis On the other hand, the behavior of crosstalk of FMFs is less predictable Since the mode launched at the input end is not the eigenmode, mode discrimination or accurate mode demultiplexing is difficult using a conventional mode demultiplexer In addition, the eigenmode itself of FMFs is not always the hybrid mode predicted by the conventional theory but sometimes a linearly polarized (LP) mode, contradicting the conventional theory In other words, the demultiplexed signal always involves crosstalk regardless of the transmission distance, and the quantity of crosstalk cannot be analyzed statistically Therefore, the crosstalk and its behavior are unpredictable In spite of these unpredictable phenomena, the signal channel can be identified using the MIMO signal processing as in single-mode MCFs This means that the MDM technology using FMFs is established in the engineering or inductive logic sense, but still involves unexplained phenomena in the scientific or deductive logic sense In this review, we discuss the predictable behavior of crosstalk in single-mode MCFs and also the unpredictable behavior of crosstalk in FMFs","Kokubun, Yasuo; Koshiba, Masanori",IEICE Electronics Express,459,16
235764,235764,235764,Documento de posicionamiento AEG-SEED para el reinicio de la actividad endoscópica tras la fase pico de la pandemia de COVID-19./ Documento de posicionamiento AEG-SEED para el reinicio de la actividad endoscópica tras la fase pico de la pandemia de COVID-19./ AEG-SEED position paper for the resumption of endoscopic activity after the peak phase of the COVID-19 pandemic,16.817997,-1.3850553,2020,"We present results on the infection risk from SARS-CoV-2 under different scenarios based on measured particle size-dependent mask penetration, measured total inward leakage, measured human aerosol emission for sizes from 10nm to 1mm, and re-hydration on inhalation. Well-mixed room models significantly underestimate the risk of infection for short and direct exposure. To this end, we estimate the upper bound for infection risk with the susceptible in the infectious exhalation cloud or wearing masks by having the masked susceptible inhale the entire exhalation of a masked infectious. Social distances without a mask, even at 3m between speaking individuals results in an upper bound of 90\% for risk of infection after a few minutes. If both wear a surgical mask, the risk of infection for the person speaking remains below 26\% even after 60 minutes. When both the infectious and susceptible wear a well-fitting FFP2 mask, the upper bound for risk is reduced by a factor of 60 compared to surgical masks. In both cases, face leakage is very important. For FFP2 masks, leakage is low in the nasal region and directed upward, which can be further reduced significantly by applying double-sided medical tape there. Considering that the calculated upper bound greatly overestimates the risk of infection, and the fact that with a poorly worn mask even the upper bound we calculated is very low, we conclude that wearing a mask, even with some leakage, provides excellent third party and self-protection.","Bagheri, Gholamhossein; Thiede, Birte; Hejazi, Bardia; Schlenczek, Oliver; Bodenschatz, Eberhard",,459,15
236277,236277,236277,Intervención en línea para el aumento de la autoeficacia en habilidades docentes por Internet ante la contingencia del COVID-19,16.674335,-1.2637604,2020,"The impact of the Covid-19 pandemic on largescale social restrictions forced the economic activities of the Indonesian population to cease, which had an impact on the educational funding process This makes some people expect a helping hand from the government to cover some of the shortcomings in daily spending, one of them through the Indonesia Smart Card The provision of aid funds in these conditions must make the process of channeling aid on target With this problem, it is important to develop a Decision-Making System to help the KIP acceptance selection process for students who are indeed eligible to get it The purpose of this study is that the provision of KIP can be right on target for students who really need it according to specified criteria For decision making, three stages are used with the method used, the first stage the C-45 method is used for decision making whether students graduate or not, the second stage is the Fuzzy MADM method used for decision making of students who get KIP, and the third stage ranks according to specified total quota Initial selection uses the C-45 method with variable GPA (V1), distance from home to campus (V2), length of study (V3), work (V4), family (V5), and tuition payment bills (V6) The calculation yields 5 rules which are used to determine normal (graduated) or DO (not) students Students who pass the initial selection are processed using the MADM fuzzy method for the decision-making process that is truly feasible for KIP Furthermore, the number that passes is ranked and the amount is taken based on the quota in accordance with the results of the ranking Of the 456 student data received based on 1024 registrants after ranking, 300 students were drawn based on KIP target recipients The resultsof testing the accuracy of 300 KIP recipients who obtained data actually had 284 rights In order to obtain an accuracy of 98% of students who are eligible for KIP © 2020 IEEE","Haris, N. A.; Nidhom, M.; Ariyanto, A. S. S.; Asgar, H.; Kusrini,","2020 3rd International Conference on Information and Communications Technology, ICOIACT 2020",459,15
236409,236409,236409,"Consenso colombiano para la prevención, el diagnóstico y el tratamiento de condiciones trombóticas en adultos con COVID-19: aplicando el Marco de la Evidencia a la Decisión (EtD) GRADE",16.825945,-1.1243442,2020,,"Preskorn, S. H.",Psychiatric Times,459,32
240007,240007,240007,Las tecnologías de la información: aliado y soporte para las organizaciones en un mundo en crisis,16.731234,-1.489118,2020,EDITORIAL.,"Erhabor, G E",West Afr J Med,459,26
