,index,Unnamed: 0,title_x,x,y,publish_time_x,abstract,authors,journal,category,cluster
412453,412453,412453,Caution in interpretation of SARS-CoV-2 quantification based on RT-PCR cycle threshold value,11.439031,12.128715,2021,"This article explores the restrictions that have been recently placed on religions in Bosnia and Herzegovina on congregating and conducting religious rituals during the covid-19 pandemic, as well as the perceptions and responses of the main religious communities to these restrictions Our data sources included the state covid-19 regulations, the guidelines of religious communities regarding worship services, congregational prayers, and other activities during the pandemic, and media articles covering religion and the covid-19 issues on a domestic and regional scale Our research has shown that not all religious communities have been equally supportive of state regulations that restricted the religious freedom of individuals and religious communities Their responses have ranged from strict harmonization of internal religious guidelines with the state covid-19 regulations to declarative support of public health recommendations while ignoring them in practice © koninklijke brill nv, leiden, 2020","Begović, N.","Journal of Law, Religion and State",500,1
415037,415037,415037,SARS-CoV-2 rapid antigen detection tests,11.4776,12.042175,2021,"INTRODUCTION: Telehealth and its usage strongly depend on regulatory frameworks and user acceptance. During the COVID-19 pandemic, physiotherapists, occupational therapists, speech-language therapists and their patients experienced restrictions regarding the usual face-to-face therapy. Teletherapy has become a highly discussed medium for providing therapy services. This study aimed at assessing Austrian therapists' attitudes towards teletherapy, including perceived barriers, during and before the COVID-19 lockdown. Further interest referred to therapists' technical affinity and experiences with the application of teletherapy. METHODS: Therapists (n = 325) completed an online survey amid the COVID-19 lockdown in 2020. Retrospective indications referred to the time prior to the lockdown. Ratings were opposed across the three therapeutic professions. Subgroup analyses investigated the role of gender and age regarding technical affinity. Measures included custom-made attitudinal statements towards teletherapy and the standardized TA-EG survey. RESULTS: The COVID-19 lockdown caused attitude changes towards teletherapy - for example, in terms of interest (r = 0.57, p > 0.01), perceived skills for performance of teletherapy (r = 0.33, p > 0.01) and perceived need for physical contact with patients (r = 0.35, p > 0.01). Regarding technical affinity, women reported significantly higher values than men did (r = 0.32, p > 0.01). Nearly half of the participants already applied teletherapy, with mainly positive ratings regarding perceived skills and feasibility. Barriers identified were missing or unstable reimbursement policies by insurance companies and therapeutic software with guaranteed data security. DISCUSSION: Austrian therapists indicate a relatively high level of telehealth positivity, with an improvement in the course of the COVID-19 lockdown. However, therapists outline the need for stable reimbursement policies and secure software solutions.","Rettinger, Lena; Klupper, Carissa; Werner, Franz; Putz, Peter",J Telemed Telecare,500,1
415038,415038,415038,SARS-CoV-2 rapid antigen detection tests,11.462137,12.140697,2021,,"Hefel, Adam; Honda, Masayoshi; Cronin, Nicholas; Harrell, Kailey; Patel, Pooja; Spies, Maria; Smolikove, Sarit",Nucleic acids res,500,1
415851,415851,415851,Quantification of the Middle East Respiratory Syndrome-Coronavirus RNA in Tissues by Quantitative Real-Time RT-PCR,11.114324,12.170744,2020,"Since the report of the first cases of pneumonia caused by SARS-CoV-2 in December 2019, COVID-19 has become a pandemic and is globally overwhelming healthcare systems. The symptoms of COVID-19 vary from asymptomatic infection to severe complicated pneumonia with acute respiratory distress syndrome (ARDS) and multiple organ failure leading to death. The estimated case-fatality rate among infected patients in Wuhan, the city where the first case appeared, was 1.4%, with 5.1 times increase in the death rate among those aged above 59 years than those aged 30-59 years. In the absence of a proven effective and licensed treatment, many agents that showed activity against previous coronavirus outbreaks such as SARS and MERS have been used to treat SARS-CoV-2 infection. The SARS-CoV-2 is reported to be 80% homologous with SARS-CoV, and some enzymes are almost 90% homologous. Antiviral drugs are urgently required to reduce case fatality-rate and hospitalizations to relieve the burden on healthcare systems worldwide. Randomized controlled trials are ongoing to assess the efficacy and safety of several treatment regimens.","Al-Iede, Montaha; Badran, Eman; Al-Lawama, Manar; Daher, Amirah; Al-Zayadneh, Enas; Aleidi, Shereen M; Khawaldeh, Taima; Alqutawneh, Basim",Adv Respir Med,500,26
420857,420857,420857,Posterior oropharyngeal saliva for the detection of SARS-CoV-2,11.5647955,12.0818815,2020,"The rapid evolution of the COVID-19 pandemic in New York City during the spring of 2020 challenged the Department of Obstetrics and Gynecology at Columbia University Irving Medical Center to rely on its core values to respond effectively. In particular, five core values, ""5 C's,"" were engaged: Communication; Collaboration; Continuity; Community; and Culture. Beginning on March 11, 2020, the Department of Ob/Gyn used these values to navigate an unprecedented public health crisis, continuing to deliver care to the women and families of New York City, to protecting and supporting its team, and to sharing its lessons learned with the national and international women's health community.","Yates, Hope S; Goffman, Dena; D039,; Alton, Mary E",Semin Perinatol,500,16
420858,420858,420858,Posterior oropharyngeal saliva for the detection of SARS-CoV-2,11.484685,12.015058,2020,,"Rubin, Eric J; Baden, Lindsey R; Farrar, Jeremy J; Morrissey, Stephen",N Engl J Med,500,14
420859,420859,420859,Posterior oropharyngeal saliva for the detection of SARS-CoV-2,11.533924,11.968908,2020,"Single risk factors, such as hypertension and dyslipidemia, can combine to exacerbate the development and severity of cardiovascular disease. Treatment goals may be more effectively achieved if multiple disease factors are targeted with combination treatment. We enrolled 202 patients who were randomly divided into the following three groups: telmisartan/amlodipine 80/5 mg + rosuvastatin 20 mg, telmisartan 80 mg + rosuvastatin 20 mg, and telmisartan/amlodipine 80/5 mg. The primary efficacy variables were changes from baseline in mean sitting systolic blood pressure (MSSBP) between telmisartan/amlodipine 80/5 mg + rosuvastatin 20 mg and telmisartan 80 mg + rosuvastatin 20 mg at 8 weeks, and the percent changes from baseline in low-density lipoprotein (LDL) cholesterol between telmisartan/amlodipine 80/5 mg + rosuvastatin 20 mg and telmisartan/amlodipine 80/5 mg at 8 weeks. The secondary efficacy variables were changes in MSSBP, mean sitting diastolic blood pressure (MSDBP), LDL cholesterol and other lipid levels at 4 weeks and 8 weeks, as well as observed adverse events during follow-up. There were no significant differences between the three groups in demographic characteristics and no significant difference among the three groups in terms of baseline characteristics for the validity evaluation variables. The mean overall treatment compliance in the three groups was, respectively, 98.42%, 96.68%, and 98.12%, indicating strong compliance for all patients. The Least-Square (LS) mean (SE) for changes in MSSBP in the two (telmisartan/amlodipine 80/5 mg + rosuvastatin 20 mg and telmisartan 80 mg + rosuvastatin 20 mg) groups were -19.3 (2.68) mm Hg and -6.69 (2.76) mm Hg. The difference between the two groups was significant (-12.60 (2.77) mm Hg, 95% CI -18.06 to -7.14, P < .0001). The LS Mean for the percent changes from baseline in LDL cholesterol in the two (telmisartan/amlodipine 80/5 mg + rosuvastatin 20 mg and telmisartan/amlodipine 80/5 mg) groups were -52.45 (3.23) % and 2.68 (3.15) %. The difference between the two groups was significant (-55.13 (3.20) %, 95% CI -61.45 to -48.81, P < .0001). There were no adverse events leading to discontinuation or death. Combined administration of telmisartan/amlodipine 80/5 mg and rosuvastatin 20 mg for the treatment of hypertensive patients with dyslipidemia significantly reduces blood pressure and improves lipid control. ClinicalTrials.gov identifier: NCT03067688.","Jin, Xuan; Kim, Moo Hyun; Han, Ki Hoon; Hong, Soon Jun; Ahn, Jeong-Cheon; Sung, Jung-Hoon; Cho, Jin-Man; Lee, Han Cheol; Choi, So-Yeon; Lee, Kyounghoon; Kim, Woo-Shik; Rhee, Moo-Yong; Kim, Ju Han; Hong, Seung Pyo; Yoo, Byung Su; Cho, Eun Joo; Lee, Jae-Hwan; Kim, Pum-Joon; Park, Chang-Gyu; Hyon, Min Su; Shin, Jin Ho; Lee, Sang Hyun; Sung, Ki Chul; Hwang, Jinyong; Kwon, Kihwan; Chae, In-Ho; Seo, Jeong-Sook; Kim, Hyungseop; Lee, Hana; Cho, Yoonhwa; Kim, Hyo-Soo",J. clin. hypertens. (Greenwich),500,20
422148,422148,422148,"In suspected SARS-CoV-2, rapid antigen detection tests had 67% to 73% sensitivity and 98% to 100% specificity",11.231835,11.939065,2021,"Background: Recent evidence suggested that the higher titers of anti-severe acute respiratory syndrome coronavirus 2 (SARS-CoV-2) antibody from convalescent plasma donors contributed to the clinical improvement in coronavirus disease 2019 (COVID-19) patients. However, the titers of anti-SARS-CoV-2 antibodies varied in each individual, and the precise factors that might govern such variation have not been elucidated. Objectives: To assess the factors associated with high titers of anti-SARS-CoV-2 antibody among COVID-19 convalescent plasma (CCP) donors. Methods: A cross-sectional study was conducted in Saiful Anwar General Hospital, Malang, Indonesia. Information of interest including demographic characteristics, clinical symptoms, comorbidities, laboratory findings, and the titers of anti-SARS-CoV-2 antibody among COVID-19 CCP donors were collected. The correlation was assessed using multiple logistic regression. Results: A total of 50 COVID-19 CCP donors with the titers of anti-SARS-CoV-2 antibody of more than 1:320 and 33 donors with the titers of less than 1:320 were analyzed. Our analysis revealed that CCP donors with history of cough, fever, dyspnea, and pneumonia significantly had higher titers of anti-SARS-CoV-2 antibody compared to asymptomatic donors. Moreover, CCP donors with elevated levels of eosinophils and immature granulocytes and low levels of albumins had higher levels of anti-SARS-CoV-2 antibody. The titer of antibody was not affected by comorbidities of donors. Conclusions: CPP donors who had experience of symptomatic COVID-19 with high eosinophils level, high immature granulocytes and low albumin level have higher titers of anti-SARS-COV-2 antibody than those who experienced asymptomatic COVID-19. Our current findings may be used as the additional baseline criteria for selecting the donors of CCP for the management of COVID-19.","Wardhani, Shinta Oktya; Fajar, Jonny Karunia; Nurarifah, Nina; Hermanto, Djoko Heri; Fatonah, Siti; Djajalaksana, Susanthy; Fatoni, Arie Zainul; Arsana, Putu Moda; Wulandari, Laksmi; Soegiarto, Gatot; Dhama, Kuldeep; Harapan, Harapan",Clin Epidemiol Glob Health,500,21
426157,426157,426157,SARS-CoV-2: The Growing Case for Potential Transmission in a Building via Wastewater Plumbing Systems,11.409163,12.029454,2020,"The coronavirus disease 2019 (COVID-19) pandemic has strained the health system worldwide. Nurses caring for patients with COVID-19 reported experiencing significant work-related stress and anxiety. The current online descriptive cross-sectional correlational study aimed to investigate work-related stress and anxiety among nurses caring for patients with COVID-19. Data were collected from 240 nurses using the Stress Overload Scale and Self-Rated Anxiety Scale. Average stress and anxiety scores were 34.96 (SD = 5.85) and 52.8 (SD = 5.48), respectively. Statistically significant differences were found in mean stress overload and anxiety scores based on gender, professional title, average working hours per week, working area, and presence of fear of being infected with COVID-19. These findings suggest the need to promote well-being in nurses and assist nurses and other health care workers experiencing mental and psychological health problems in the context of the COVID-19 pandemic. [Journal of Psychosocial Nursing and Mental Health Services, 59(8), 31-42.].","D039,; emeh, Waddah Mohammad; Yacoub, Mohammed Ibrahim; Shahwan, Batool Sama039; an,",J Psychosoc Nurs Ment Health Serv,500,10
426158,426158,426158,SARS-CoV-2: The Growing Case for Potential Transmission in a Building via Wastewater Plumbing Systems,11.404063,12.2224045,2020,,"DePaul, A.",Nature,500,10
426337,426337,426337,"Introduction: States of Displacement: Middle Eastern Refugees, Internally Displaced Persons and Asylum Seekers in Global Context",11.401643,12.369376,2021,,"Schiavone, D; Torresan, F; Rossi, G P; Iacobone, M",Br. j. surg,500,24
426404,426404,426404,Evidence of SARS-CoV-2 reinfection without mutations in Spike protein,11.475847,12.279902,2021,"Substantia nigra (SNc) dopaminergic neurons respond to aversive stimuli with inhibitory pauses in firing followed by transient rebound activation. We tested integration of inhibitory synaptic inputs onto SNc neurons from genetically defined populations in dorsal striatum (striosome and matrix) and external globus pallidus (GPe; parvalbumin- and Lhx6-positive), and examined their contribution to pause-rebound firing. Activation of striosome projections, which target ""dendron bouquets"" in the pars reticulata (SNr), consistently quiets firing and relief from striosome inhibition triggers rebound activity. Striosomal inhibitory postsynaptic currents (IPSCs) display a prominent GABA-B receptor-mediated component that strengthens the impact of SNr dendrite synapses on somatic excitability and enables rebounding. By contrast, GPe projections activate GABA-A receptors on the soma and proximal dendrites but do not result in rebounding. Lastly, optical mapping shows that dorsal striatum selectively inhibits the ventral population of SNc neurons, which are intrinsically capable of rebounding. Therefore, we define a distinct striatonigral circuit for generating dopamine rebound.","Evans, Rebekah C; Twedell, Emily L; Zhu, Manhua; Ascencio, Jefferson; Zhang, Renshu; Khaliq, Zayd M",Cell Rep,500,1
426909,426909,426909,Independent Side-by-Side Validation and Comparison of 4 Serological Platforms for SARS-CoV-2 Antibody Testing,11.223476,12.151105,2021,"If they work as expected, the strict containment measures enforced to stop the French Covid-19 epidemic will leave a large proportion of the population &quot;naive&quot;about the SARS-CoV-2 virus In these conditions, how can we prevent the epidemic from rebounding, at a time when this restrictive policy will soon become untenable economically and socially? Based on the figures, now well known, of the lethality of covid-19 according to age classes, I suggest that a gradual release of the containment be instituted, which will keep retirees in isolation (the 65+ age class), whose risk is maximal and the impact on economic production the lowest This scenario might be applicable to most European countries that enforce mandatory retirement ages for most of workers","Claverie, Jean-Michel",Virologie (Montrouge),500,15
426910,426910,426910,Independent side-by-side validation and comparison of four serological platforms for SARS-CoV-2 antibody testing,11.31318,12.10525,2020,"Academics find themselves living in historical times with the COVID-19 pandemic To record recent happenings is to write a historical account about how higher education has ridden the pandemic?s wave It is to perceive and to adjust to a rapidly changing landscape as one who knows and sees by learning through inquiry, as well as to reflexively shape the course of history","Yoo, Joanne",Qualitative Inquiry,500,5
426911,426911,426911,Independent side-by-side validation and comparison of four serological platforms for SARS-CoV-2 antibody testing,11.353185,12.056899,2020,"Background The optimal approach to manage Coronavirus Disease 2019 (COVID-19) patient is still uncertain, especially for critical ill patients, high mortality has been observed since the outbreak of the crisis. Glucocorticoid use has been in debate for treating COVID-19-infected patient. Methods Twenty-nine critically ill patients with COVID-19 in this report are defined as patients are intubated and admitted to intensive care unit (ICU). Chart review was conducted on those patients, their demographic characteristics, baseline comorbidities, hospital course, clinical management, and laboratory/imagine reports were summarized. Thirty-day survival probability after ICU admission was analyzed for comparing the steroid group and nonsteroid group. Survival curve and analysis were performed by Kaplan-Meier survival analysis. P value less than 0.05 is defined as significant different. Results Among the 29 critical COVID-19 cases, 12 are survived beyond day 30 of ICU admission, 9 of the 12 are successfully extubated and discharged home, 3 remained on ventilator support in ICU after 30 days. In the 12 survived patients, 10 (83%) received glucocorticoid treatment, whereas in the 17 patients who died, only 8 (44%) were treated with steroid. The baseline characteristics between the steroid and nonsteroid group are similar. The 30-day survival rate is lower in the steroid group comparing to the nonsteroid group (P = 0.0405). Conclusions Proper use of glucocorticoids offers considerable mortality benefit to the outcome of critical ill COVID-19 patient. This observational descriptive study might be helpful to other similar small community hospital facing a surge of COVID-19 patients, when other clinical trials or supports are hardly available.","Wang, T.; Guerra, A. L.",Infectious Diseases in Clinical Practice,500,20
427767,427767,427767,"Detecting Rapid Spread of SARS-CoV-2 Variants, France, January 26-February 16, 2021",11.402364,12.363581,2021,"C-type lectin CD209/DC-SIGN and CD209L/L-SIGN proteins are distinct cell adhesion and pathogen recognition receptors that mediate cellular interactions and recognize a wide range of pathogens, including viruses such as SARS, SARS-CoV-2, bacteria, fungi and parasites Pathogens exploit CD209 family proteins to promote infection and evade the immune recognition system CD209L and CD209 are widely expressed in SARS-CoV-2 target organs and can contribute to infection and pathogenesis CD209 family receptors are highly susceptible to alternative splicing and genomic polymorphism, which may influence virus tropism and transmission in vivo The carbohydrate recognition domain (CRD) and the neck/repeat region represent the key features of CD209 family proteins that are also central to facilitating cellular ligand interactions and pathogen recognition While the neck/repeat region is involved in oligomeric dimerization, the CRD recognizes the mannose-containing structures present on specific glycoproteins such as those found on the SARS-CoV-2 spike protein Considering the role of CD209L and related proteins in diverse pathogen recognition, this review article discusses the recent advances in the cellular and biochemical characterization of CD209 and CD209L and their roles in viral uptake, which has important implications in understanding the host-pathogen interaction, the viral pathobiology and driving vaccine development of SARS-CoV-2","Rahimi, N.",Biology (Basel),500,28
429091,429091,429091,Identification of Exertional Hypoxia and Its Implications in SARS-CoV-2 Pneumonia,11.43538,12.244064,2020,"Recent reports have shown that small and big felines could be infected by SARS-CoV-2, while other animals, like swines and mice, are apparently not susceptible to this infection. These findings raise the question of the role of cell factors associated with early stages of the viral infection in host selectivity. The cellular receptor for SARS-CoV-2 is the Angiotensin Converting Enzyme (ACE2). Transmembrane protease serine 2 (TMPRSS2) has been shown to prime the viral spike for its interaction with its receptor. GRP78 has also been proposed as a possible co-receptor. In this study, we used several bioinformatics approaches to bring clues in the interaction of ACE2, TMPRSS2, and GRP78 with SARS-CoV-2. We selected several mammalian hosts that could play a key role in viral spread by acting as secondary hosts (cats, dogs, pigs, mice, and ferrets) and evaluated their predicted permissiveness by in silico analysis. Results showed that ionic pairs (salt bridges, N-O pair, and long-range interactions) produced between ACE2 and the viral spike has an essential function in the host interaction. On the other hand, TMPRSS2 and GRP78 are proteins with high homology in all the evaluated hosts. Thus, these proteins do not seem to play a role in host selectivity, suggesting that other factors may play a role in the non-permissivity in some of these hosts. These proteins represent however interesting cell targets that could be explored in order to control the virus replication in humans and in the intermediary hosts.","Rangel, H R; Ortega, J T; Maksoud, S; Pujol, F H; Serrano, M L",Virus Res,500,1
432124,432124,432124,"DETECTION OF SARS-CoV-2 IN AIR OF TWO HOSPITAL IN HERMOSILLO, SONORA, MÉXICO, UTILIZING A LOW-COST ENVIRONMENTAL MONITORING SYSTEM",11.533714,12.242698,2020,,"Malhotra, Atul; Ayas, Najib T",Am J Respir Crit Care Med,500,26
433947,433947,433947,"Seroprevalence of SARS-CoV-2 in slums versus non-slums in Mumbai, India",11.064686,12.308725,2020,,"Watters, David A; Brown, Wendy; Hardidge, Andrew",ANZ j. Surg,500,26
435610,435610,435610,"SARS-CoV-2 sero-prevalence among general population and healthcare workers in India, December 2020 - January 2021",11.352277,12.22589,2021,"BACKGROUND: Knowledge about the COVID-19 outbreak is still sparse, especially in a cross-national setting. COVID-19 is caused by a SARS-CoV-2 infection. The aim of the study is to contribute to the surveillance of the pandemic by bringing new knowledge about SARS-CoV-2 seropositivity among healthcare workers. It seeks to evaluate whether certain job functions are associated with a higher risk of being infected and to clarify if such association is mediated by the number of individuals that employees meet during a workday. In addition, we investigate regional and national differences in seroprevalence. METHODS: This research involved a bi-national prospective observational cohort study including 3272 adults employed at Falck in Sweden and Denmark. Participants were tested for SARS-CoV-2 antibodies every second week for a period of 8 weeks from 22 June 2020 until 10 August 2020. Descriptive statistics as well as multivariable logistic regression analyses were applied. RESULTS: Of the 3272 Falck employees participating in this study, 159 (4.9%) tested positive for SARS-CoV-2 antibodies. The seroprevalence was lower among Danish Falck employees than among those from Sweden (2.8% in Denmark and 8.3% in Sweden). We also found that the number of customer or patient contacts during a workday was the most prominent predictor for seropositivity and that ambulance staff was the most vulnerable staff group. CONCLUSION: Our study presents geographical variations in seroprevalence within the Falck organization and shows evidence that social interaction is one of the biggest risk factors for becoming infected with SARS-CoV-2.","Laursen, Jannie; Petersen, Janne; Didriksen, Maria; Iversen, Kasper; Ullum, Henrik",Int. j. environ. res. public health (Online),500,22
438212,438212,438212,NMR assignments of the macro domain from severe acute respiratory syndrome coronavirus 2 (SARS-CoV-2),11.346077,12.502835,2021,"There is a near consensus view that SARS-CoV-2 has a natural zoonotic origin; however, several characteristics of SARS-CoV-2 taken together are not easily explained by a natural zoonotic origin hypothesis. These include: a low rate of evolution in the early phase of transmission; the lack of evidence of recombination events; a high pre-existing binding to human ACE2; a novel furin cleavage site insert; a flat glycan binding domain of the spike protein which conflicts with host evasion survival patterns exhibited by other coronaviruses, and high human and mouse peptide mimicry. Initial assumptions against a laboratory origin, by contrast, have remained unsubstantiated. Furthermore, over a year after the initial outbreak in Wuhan, there is still no clear evidence of zoonotic transfer from a bat or intermediate species. Given the immense social and economic impact of this pandemic, identifying the true origin of SARS-CoV-2 is fundamental to preventing future outbreaks. The search for SARS-CoV-2's origin should include an open and unbiased inquiry into a possible laboratory origin.","Segreto, Rossana; Deigin, Yuri; McCairn, Kevin; Sousa, Alejandro; Sirotkin, Dan; Sirotkin, Karl; Couey, Jonathan J.; Jones, Adrian; Microbiology, Daoyu Zhang Department of; Innsbruck, University of; Austria,; Inc., Youthereum Genetics; Toronto,; Ontario,; Canada,; Solutions, Synaptek - Deep Learning; Gifu,; Japan,; Monforte, Regional Hospital of; Lugo,; Spain,; Compostela, University of Santiago de; LLC, Karl Sirotkin; Mary, Lake; FL,; USA,; Pittsburgh, University of; Medicine, School of; researcher, Independent bioinformatics; researcher, Independent genetics",,500,16
