,index,Unnamed: 0,title_x,x,y,publish_time_x,abstract,authors,journal,category,cluster
153878,153878,153878,Surgical retrieval of a guide wire lost during central venous catheterization in a dog.,19.96096,11.213197,2017,"Purpose The study aimed to compare the radiobiological and dosimetric parameters between sequential boost (SEQB) and simultaneous integrated boost (SIB) treatment regimen using intensity-modulated arc therapy technique in locally advanced head-and-neck cancer (LAHNC) patients. Materials and Methods A total of 24 previously untreated LAHNC patients were randomized into SIB (n= 11) and SEQB (n = 13) arms. The planning computed tomography data set was transferred to the treatment planning system. All the target volumes and organ at risk volumes were delineated. Single plan for SIB group and three plans (three phases) were generated for SEQB group of patients. Radiobiological and dosimetric parameters were compared. Results The BED10(planned) value for high-risk (HR) planning target volume (PTV) was same in both groups, whereas for intermediate-risk (IR) PTV and low-risk (LR) PTV, the values were higher in SEQB arm than SIB arm. The V95 values were 100% for all the target volumes in both arms of patients. The average D100 value for gross target volume, HR PTV, and IR PTV was higher in SEQB arm than that in the SIB arm. The average D100 value for LR PTV was higher in the SIB arm compared to that of the SEQB arm. The BED10(achieved) was calculated using D100 values of target volumes. The difference of BED10(achieved) values between SEQB arm and SIB arm further increased than the BED10(planned) values for all target volumes. The maximum doses for spinal cord, spinal cord planning risk volume, and brain stem were within the tolerance dose in both groups of patients. The left and right parotid glands sparing was comparable in both groups of patients. Average integral dose was higher in the SIB group than SEQB group. The average total monitor unit per fraction was higher in the SEQB arm than that in the SIB arm. Conclusion SIB regimen may be considered as more logical and efficient over SEQB regimen in the treatment of LAHNC with comparable radiobiological and dosimetric parameters.","Mandal, Abhijit; Choudhary, Sunil; Mani, Nilesh; Aggarwal, Sushil Kumar",Journal of cancer research and therapeutics,6,16
154801,154801,154801,Clinical review: Respiratory monitoring in the ICU - a consensus of 16.,19.856794,11.204395,2012,,"Coke, Lola A; Hayman, Laura L",The Journal of cardiovascular nursing,6,1
156532,156532,156532,Stress is in the Air: Ambient ROS and COVID-19.,19.835321,11.369309,2021-05-26,,"Maria, Benzo; Roberto, Benzo",Chronic obstructive pulmonary diseases,6,19
156625,156625,156625,[NPPV Treatment for Neuromuscular Diseases during the COVID-19 Pandemic].,19.630411,11.201297,2020-10-01,,"Chaler, J",Rehabilitacion,6,1
157287,157287,157287,Pediatric emergency mass critical care: the role of community preparedness in conserving critical care resources.,19.948433,10.91833,2011,"The coronavirus disease 2019 (COVID-19) originated in bats and human-to-human transmission through respiratory droplets and contact with surfaces of infected aerosol are the main ways of transmitting this virus. Until now, there is no effective pharmaceutical treatment; conclusively it is important to evaluate the types of applied disinfectants in different areas against Severe Acute Respiratory Syndrome Corona Virus 2 (SARS-CoV-2), the virus that causes COVID-19. The aim of this review was to summarize the information about environmental disinfection for preventing of COVID-19. We performed a review of the science direct database to find articles providing information on disinfection used for SARS-CoV-2. The extracted results were given the original data on inactivation coronaviruses by disinfectants in different places of health care facilities. The final search recognized that five groups of disinfectants include: chlorine containing disinfectants, alcohol, UV irradiation, Hydrogen peroxide, and other disinfectant were used against SARS-CoV-2 in different environments. Among these groups, bleach (chlorine containing disinfectants) has the most applicability. Also, in many studies by using disinfectants with 62-71% ethanol can reduce coronavirus in contaminated areas. Furthermore, after the using of operating room for COVID-19 patients, hydrogen peroxide and UV irradiation should be used for 24 h before it can be used again. The povidone-iodine or the chlorhexidine, could be recommended when there is a risk of SARS-CoV-2 contamination especially for open wounds. According to the different studies on SARS-CoV-2 disinfection, because of the SARS-CoV-2 can remain in the air and on surfaces, as well as observing individual disinfection guidelines in different hospital areas, disinfection of surfaces is necessary to decrease SARS-CoV-2 spreading. Moreover, the most suggested disinfectants have been limited to bleach and alcohol, it's better to be considered the potential of other disinfectants in different areas.","Sharafi, Seyedeh Maryam; Ebrahimpour, Karim; Nafez, Amirhossein",Reviews on environmental health,6,1
160109,160109,160109,Interstitial Lung Disease Following COVID-19.,19.722326,11.403146,2021-03-18,,"Niederberger, Craig",The Journal of urology,6,1
161642,161642,161642,Respiratory depression in low acuity hospital settings-Seeking answers from the PRODIGY trial.,19.74457,11.217426,2018,"Objective: The review presents a systematic analysis of literature investigating the association between migraine and suicidal behaviors. Introduction: Migraine is a common neurological disorder. The prevalence of migraines increases with age from adolescence to adulthood in both sexes, and results in a substantial loss of productivity due to missing days of school or work and need for bed rest. Literature prior to 2015 suggests that migraine is a predictor of suicide. Given the worldwide public health interest in suicide prevention, we examined the literature collected from diverse, predominantly non-European, populations post-2015. Methods: The databases used in this systematic review included: Medline, PsycINFO, EMBASE (Ovid), Science Direct (Elsevier), Cochrane, and PubMed for all available years of publication from January 2015 onwards. The review included participants aged 16 and over who had been diagnosed with migraines with the following outcome variables: any suicidality, both fatal and non-fatal; suicidal ideation; and suicidal behavior. Results: The database searches yielded a total of 542 citations. Following title and abstract screening, 460 articles were excluded and a total of 21 citations were evaluated. After full-text review and excluding a further 11 non-eligible studies, a total of 10 studies were eligible for inclusion in the systematic review. Conclusions: Current existing research highlights the important association between the increased risk of suicidal behaviors in the clinical and general population among chronic migraineurs with/without aura worldwide. Future studies are needed to facilitate the development of clinical guidelines for risk assessment, targeted interventions, and evidence-based treatment of migraine to reduce the risk of suicide among this vulnerable population.","Karimi, Leila; Hoppe, Dimi; Burdick, Christine; Buultjens, Melissa; Wijeratne, Tissa; Crewther, Sheila G",Frontiers in neurology,6,2
161678,161678,161678,Near Infrared Spectroscopy as a Hemodynamic Monitor in Critical Illness.,19.836271,11.125572,2016,,"Ruiz de Pellón Santamaría, Ángel",Journal of clinical psychopharmacology,6,1
166289,166289,166289,Clinician Readiness to Adopt A.I. for Critical Care Prioritisation,20.096716,10.989315,2021-02-15,"The COVID-19 lockdown significantly improved the global environmental quality by restricted anthropogenic activities. We aimed to understand the response of Indian coastal environmental quality and an estuarine (Zuari estuary, central west coast of India) water quality to the lockdown using satellite-derived data sets and in-situ measurements, respectively. The in-situ study was carried out for two weeks (during August and September 2020) to measure chlorophyll-a and macro-nutrients. Recent 5-years (2015–2019;March–August) data sets of aerosol optical depth (AOD), rainfall, air temperature, sea surface temperature (SST), chlorophyll-a, particulate inorganic carbon (PIC) and particulate organic carbon (POC) were compared with lockdown period (2020). The AOD was decreased during the lockdown period (23 ± 11%) as compared with recent 5-years shows the significant impact of lockdown on industrial, transport and urbanization activities. The water quality parameters and chlorophyll-a biomass have remained similar to the past data sets, indicating the insignificant effect of lockdown on these parameters. The results of the case study were compared with the previous reports, which showed a decrease in the concentration of nitrate, phosphate and silicate and comparable concentration of chlorophyll-a. Recent studies show significant impacts of lockdown on the atmospheric parameters and water quality parameters, however the present study did not observe any significant variations in the in-situ and satellite derived data sets of water quality and chlorophyll-a. We have discussed the possible reasons underlying in the less/undetectable response of the chlorophyll-a and water quality of the Indian coastal waters and estuaries during the lockdown. © 2021 Elsevier Ltd","Karnan, C.; Sandhya, S. V.; Gauns, M.; Pratihary, A.",Continental Shelf Research,6,10
172749,172749,172749,Performance evaluation of a multinational data platform for critical care in Asia,20.01115,11.037417,2021-07-14,"PurposeThe purpose of this study is to examine how societal disruptions in the wake of disasters and crises also disrupt the tourism and hospitality industries.Design/methodology/approachThis paper takes a case-study approach. First, the literature on disasters/crises is reviewed;then three cases in which disasters impacted local, regional and global tourism and hospitality industries are examined: Hurricane Katrina, Arab Spring and the COVID-19 pandemic.FindingsThree principles are proposed to assist in mitigating the impacts of disaster on the tourist industry. These principles also serve as a means of potentially re-orienting and guiding the tourism and hospitality industries toward a sustainable and equitable future.Originality/valueIn addition to the three guiding principles offered in this paper;the examination of COVID-19 offers a novel case in which tourism is impacted globally by a singular disaster. Findings and implications from this case will guide recovery and, potentially, allow for a reconceptualization of the tourism and hospitality industries.","Chapman, Connor M.; DeMond Shondell, Miller Salley Geremy",Worldwide Hospitality and Tourism Themes,6,1
185230,185230,185230,Communicating medical information over the telephone in critical care.,19.921066,10.983499,2020-09-01,"ABSTRACT Background: In the wake of the COVID-19 outbreak, many speech-language pathologists have transitioned from in-person service delivery to online environments. As such, there is an urgent need to inform clinicians on the availability of efficacious and effective telehealth interventions for childhood apraxia of speech (CAS). Objectives: This review was informed by the following clinical question: Is providing intervention remotely through telehealth as efficacious and effective as in-person therapy for treating CAS? Methods, eligibility criteria, and sources of evidence: Eight databases and seven search engines were searched for articles to identify intervention studies that have investigated the efficacy and/or effectiveness of treating CAS remotely. Search criteria was restricted to papers with children under 18 years of age, published in the English language between 1993 and 2020. Results: Two studies were found to meet our inclusion criteria. A phase I study employed a multiple baseline across participants design to investigate the efficacy of the Rapid Syllable Transition treatment via telehealth. The second study assessed the feasibility of adopting a novel system for the remote administration of the Nuffield Dyspraxia Program-Third Edition. Based on the Oxford hierarchy Centre for Evidence-Based Medicine, both studies are level IV (case-series/case-control), and therefore deemed low level evidence. Results showed limited but promising outcomes when CAS therapy is conducted remotely. Conclusion: There is limited, low-level evidence indicating positive outcomes for the remote treatment of CAS via telehealth. The scarcity of data available warrants a need for large-scale randomized control trials and controlled clinical trials. (PsycInfo Database Record (c) 2021 APA, all rights reserved)","Bahar, Nilgoun Namasivayam Aravind K.; van Lieshout, Pascal","Speech, Language and Hearing",6,19
186051,186051,186051,Febrile respiratory illness in the intensive care unit setting: an infection control perspective.,19.677504,11.158877,2006,"Export of cargo from the ER occurs through the formation of 60-70nm COPII-coated vesicular carriers. We have applied serial-thin sectioning and stereology to quantitatively characterize the three-dimensional organization of ER export sites in vivo and in vitro. We find that ER buds in vivo are nonrandomly distributed, being concentrated in regional foci we refer to as export complexes. The basic organization of an export complex can be divided into an active COPII-containing budding zone on a single ER cisterna, which is adjacent to budding zones found on distantly connected ER cisternae. These budding foci surround and face a central cluster of morphologically independent vesicular-tubular elements that contain COPI coats involved in retrograde transport. Vesicles within these export complexes contain concentrated cargo molecules. The structure of vesicular-tubular clusters in export complexes is particularly striking in replicas generated using a quick-freeze, deep-etch approach to visualize for the first time their three-dimensional organization and cargo composition. We conclude that budding from the ER through recruitment of COPII is confined to highly specialized export complexes that topologically restrict anterograde transport to regional foci to facilitate efficient coupling to retrograde recycling by COPI.",,J Cell Biol,6,9
186177,186177,186177,Critical care medicine in China: history and perspective.,19.674274,11.284363,2013,,,,6,26
190353,190353,190353,"Terror Australis 2004: preparedness of Australian hospitals for disasters and incidents involving chemical, biological and radiological agents.",20.054327,11.139003,2008,"BACKGROUND Accurate, objective models of triage for patients with suspected severe acute respiratory syndrome (SARS) could assess risks and improve decisions about isolation and inpatient treatment. OBJECTIVE To develop and validate a clinical prediction rule for identifying patients with SARS in an emergency department setting. DESIGN Retrospective analysis using a 2-step coefficient-based multivariable logistic regression scoring method with internal validation by bootstrapping. SETTING 2 hospitals in Hong Kong. PARTICIPANTS 1274 consecutive patients from 1 hospital and 1375 consecutive patients from another hospital. MEASUREMENTS Points were assigned on the basis of history, physical examination, and simple investigations obtained at presentation. The outcome measure was a final diagnosis of SARS, as confirmed by World Health Organization laboratory criteria. RESULTS Predictors for SARS on the basis of history (step 1) included previous contact with a patient with SARS and the presence of fever, myalgia, and malaise. Age 65 years and older and younger than 18 years and the presence of sputum, abdominal pain, sore throat, and rhinorrhea were inversely related to having SARS. In step 2, haziness or pneumonic consolidation on chest radiographs and low lymphocyte and platelet counts, in addition to a positive contact history and fever were associated with a higher probability of SARS. A high neutrophil count, the extremes of age, and sputum production were associated with a lower probability of SARS. In the derivation sample, the observed incidence of SARS was 4.4% for those assigned to the low-risk group (in steps 1 or 2); in the high-risk group, incidence of SARS was 21.0% for quartile 1, 39.5% for quartile 2, 61.2% for quartile 3, and 79.7% for quartile 4. This prediction rule achieved an optimism-corrected sensitivity of 0.90, a specificity of 0.62, and an area under the receiver-operating characteristic curve of 0.85. LIMITATIONS The prediction rule may not apply to isolated cases occurring during an interepidemic period. Generalizability of the findings should be confirmed in other SARS-affected countries and should be prospectively validated if SARS returns. CONCLUSIONS Our findings suggest that a simple model that uses clinical data at the time of presentation to an emergency department during an acute outbreak predicted the incidence of SARS and provided good diagnostic utility.","Leung, Gabriel M; Rainer, Timothy H; Lau, Fei-Lung; Wong, Irene O L; Tong, Anna; Wong, Tai-Wai; Kong, James H B; Hedley, Anthony J; Lam, Tai-Hing",Annals of internal medicine,6,26
191253,191253,191253,Infection control in times of Ebola: how well are we training the next generation of intensivists in Australia and New Zealand?,19.846636,11.18985,2015,,"Koren, Gideon; King, Susan; Knowles, Sandra; Phillips, Elizabeth",CMAJ : Canadian Medical Association journal = journal de l'Association medicale canadienne,6,1
192749,192749,192749,Providing critical care during a disaster: the interface between disaster response agencies and hospitals.,20.116724,10.974805,2006,"The use of cerebral oximetry to guide intraoperative management has been shown to improve patient outcomes in cardiac surgery. This pilot trial assessed the feasibility of performing a similar study of outcome in patients over the age of 70 years undergoing non-cardiac surgery. Patients over the age of 70 years undergoing total knee or hip arthroplasty or bowel resection surgery were randomly assigned to have cerebral oximetry values monitored (intervention group) or not monitored (control) while under general anaesthesia. Indicators of proof of concept were: rate of complications, rate of cerebral desaturation, relationship between cerebral desaturation and complications, and anaesthetist response to cerebral desaturation. Forty patients were recruited and randomised to a control group (n=20) or an intervention group (n=20). The proportion of the study population who had a complication was 40% (95% confidence interval [CI] 26% to 55%). Cerebral desaturation (<75% of baseline) occurred in only two patients (5.0% (CI 1.4% to 16%)), one in each group, and neither of those patients recorded a complication. Changes to anaesthetic management on the basis of cerebral oximetry values occurred in only two patients in the intervention group (10% (CI 2.8% to 30%)). Maintenance of cerebral oximetry values appeared to be closer to baseline in the intervention group than in the control group but this difference was not significant (P=0.15). Our results indicated that complications occurred frequently in the study population but did not appear to be associated with cerebral desaturation events. These findings do not support a larger intervention study using the current study population.","Cowie, D A; Nazareth, J; Story, D A",Anaesthesia and intensive care,6,4
193109,193109,193109,Vascular access site influences circuit life in continuous renal replacement therapy.,19.77721,11.162894,2014,"PURPOSE OF REVIEW Molecular techniques offer the promise of improving diagnosis of lower respiratory tract infections. This review focuses on currently used molecular diagnostic techniques for various types of pneumonia and highlights potential future applications of this technology. RECENT FINDINGS Lower respiratory tract infections result in a high degree of morbidity and mortality, but a definitive microbiologic diagnosis is often not obtained by traditional culture or serologic methods. In addition, culture of certain organisms may be difficult or require extended periods of time. Molecular techniques have the potential to improve diagnostic yield and decrease time to pathogen identification. These techniques are also helpful in the determination of drug sensitivity and the understanding of transmission and outbreaks. Most currently used techniques employ some variation of the polymerase chain reaction. Limitations include high costs, the need for specialized equipment, and problems with false-positive and -negative results. SUMMARY Molecular diagnosis of pneumonia has the potential to improve identification of pathogens in patients with suspected lower respiratory tract infection. Limitations of molecular techniques currently prevent their widespread use, but future developments will likely lead to inclusion of these tests in routine diagnostic evaluations.","Chan, Yvonne R; Morris, Alison",Current opinion in infectious diseases,6,1
194145,194145,194145,Microvascular COVID-19 lung vessels obstructive thromboinflammatory syndrome (MicroCLOTS): a new variant of thrombotic microangiopathy?,19.6768,11.094163,2020-09-01,"The Middle East syndrome coronavirus (MERS-CoV) is a recently emerging betacoronavirus with high fatality. Recently, dipeptidyle peptidase (CD26, DPP4) was identified as the host cell receptor for MERS-CoV. Interestingly, despite of common presence of DPP4 receptors the binding and infection of various cells shows imminent variability. In this report, we provide a tool for prediction of the host tropism of the virus based on the host receptor binding interface. We found out that, in the binding of MERS-CoV to cells the amino acid residues in lancets 4 and 5 of DPP4 receptor, namely K267, Q286, T288, R317, R336, Q344 A291, L294, and I295 are involved. Changes in these residues correspond to profound decrease in virus binding to cells. The nine residues at the interface between the virus spikes and the lancets 4 and 5 of host DPP4 can be used as a predictive tool for the host tropism and virus affinity to host cell receptors.","Kandeel, M; Elaiziz, M A; Kandeel, A; Altaher, A A; Kitade, Y",Acta virologica,6,0
194540,194540,194540,Medical technology in the intensive care unit.,19.738237,10.91228,2004,"Human coronaviruses (HCV) OC43 and 229E are the second most frequently isolated agents of common colds, and have also been associated with severe upper respiratory infections in children and with gastroenteritis of unknown etiology, such as infantile necrotizing enterocolitis. While HCV-OC43 and neonatal calf diarrhea coronavirus NCDCV cannot be held responsible for enteric infection in man, serological data suggest the possible existence of a human coronavirus, antigenically related to HCV-OC43 and NCDCV, and responsible for enteric infections. We developed a rapid and sensitive method for the diagnosis of the human respiratory coronavirus infections, and for detecting these viruses in suspect coronavirus infections. This assay entails a reverse transcriptase polymerase chain reaction, followed by Southern blot analysis with a probe specific for the amplification products.","Cristallo, A; Biamonti, G; Battaglia, M; Cereda, P M",The new microbiologica,6,28
