,index,Unnamed: 0,title_x,x,y,publish_time_x,abstract,authors,journal,category,cluster
599962,599962,599962,Disaggregated environmental impacts of non-renewable energy and trade openness in selected G-20 countries: the conditioning role of technological innovation,23.307856,7.0197043,2021-07-12,"The COVID-19 pandemic altered many facets of life. We aimed to evaluate the impact of COVID-19-related public health guidelines on physical activity (PA), sedentary behavior, mental health, and their interrelations. Cross-sectional data were collected from 3052 US adults 3–8 April 2020 (from all 50 states). Participants self-reported pre- and post-COVID-19 levels of moderate and vigorous PA, sitting, and screen time. Currently-followed public health guidelines, stress, loneliness, positive mental health (PMH), social connectedness, and depressive and anxiety symptoms were self-reported. Participants were grouped by meeting US PA guidelines, reporting ≥8 h/day of sitting, or ≥8 h/day of screen time, pre- and post-COVID-19. Overall, 62% of participants were female, with age ranging from 18–24 (16.6% of sample) to 75+ (9.3%). Self-reported PA was lower post-COVID among participants reporting being previously active (mean change: −32.3% [95% CI: −36.3%, −28.1%]) but largely unchanged among previously inactive participants (+2.3% [−3.5%, +8.1%]). No longer meeting PA guidelines and increased screen time were associated with worse depression, loneliness, stress, and PMH (p < 0.001). Self-isolation/quarantine was associated with higher depressive and anxiety symptoms compared to social distancing (p < 0.001). Maintaining and enhancing physical activity participation and limiting screen time increases during abrupt societal changes may mitigate the mental health consequences.","Meyer, Jacob; McDowell, Cillian; Lansing, Jeni; Brower, Cassandra; Smith, Lee; Tully, Mark; Herring, Matthew",Int J Environ Res Public Health,367,20
600608,600608,600608,A supply chain disruption risk mitigation model to manage COVID-19 pandemic risk,22.986578,6.7307606,2021-01-05,"OBJECTIVE: During a disease outbreak, media serve as primary transmitters of information from public health agencies to the public, and have been shown to influence both behavior and perception of risk. Differences in news frequency, framing and information source can impact the public's interpretation of risk messages and subsequent attitudes and behaviors about a particular threat. The media's framing of an outbreak is important, as it may affect both perception of risk and the ability to process important health information. METHODS: To understand how risk communication by the Centers for Disease Control and Prevention (CDC) during the 2014 Ebola outbreak was framed and delivered and to what extent primetime broadcast news media mirrored CDC's framing and authoritative voice, 209 CDC communications and primetime broadcast transcripts issued between July 24 and December 29, 2014 were analyzed and coded by thematic frame and authoritative voice. Dominant frame and voice were determined for each month and for overall period of analysis. RESULTS: Medical frame was dominant in CDC (60%), Anderson Cooper 360 (49%), The Rachel Maddow Show (47%) and All In with Chris Hayes (47%). The human interest frame was dominant in The Kelly File (45%), while The O'Reilly Factor coverage was equally split between sociopolitical and medical frames (28%, respectively). Primetime news media also changed dominant frames over time. Dominant authoritative voice in CDC communications was that of CDC officials, while primetime news dominantly featured local and federal (non-CDC) government officials and academic/medical experts. CONCLUSION: Differences in framing and delivery could have led the public to interpret risk in a different way than intended by CDC. Overall, public health agencies should consider adapting risk communication strategies to account for a dynamic news environment and the media's agenda. Options include adapting communications to short-form styles and embracing the concept of storytelling.","Kott, Anne; Limaye, Rupali J.",Soc Sci Med,367,1
603594,603594,603594,"PM(10) correlates with COVID-19 infections 15 days later in Arequipa, Peru",23.244722,6.927052,2021-03-24,"Results of a comparative statistical analysis of the daily data associated with New coronavirus COVID-19 infection of confirmed cases ([C]) of the population in Georgia (GEO), Armenia (ARM), Azerbaijan (AZE), Turkey (TUR) and Russia (RUS) amid a global pandemic (WLD) in the period from March 14 to July 31, 2020 are presented. The analysis of data is carried out with the use of the standard statistical analysis methods of random events and methods of mathematical statistics for the non-accidental time-series of observations. In particular, a correlation and autocorrelation analysis of the observational data was carried out, the periodicity in the time- series of [C] were revealed, the calculation of the interval prediction values of [C] taking into account the periodicity in the time-series of observations from August 1 to 31, 2020 (ARM, AZE) and from August 1 to September 11, 2020 (WLD, GEO, TUR, RUS) were carried out. Comparison of real and calculated predictions data on [C] in the study sites from August 1 to August 31, 2020 is carried out. It was found that daily, monthly and mean weekly real values of [C] for all the studied locations practically fall into the 99% confidence interval of the predicted values of [C] for the specified time period. A dangerous situation with the spread of coronavirus infection may arise when the mean weekly values of [C] of the 99% upper level of the forecast confidence interval are exceeded within 1-2 weeks. Favorable - when the mean weekly values of [C] decrease below 99% of the lower level of the forecast confidence interval.","Amiranashvili, A. G.; Khazaradze, K. R.; Japaridze, N. D.",,367,12
605024,605024,605024,"A spatial model of COVID-19 transmission in England and Wales: early spread, peak timing and the impact of seasonality",22.929945,6.895335,2021-07-19,"The SARS-CoV-2 coronavirus (COVID-19) pandemic is impacting post-acute inpatient rehabilitation nursing practice from preadmission assessment to inpatient care delivery and transition planning. Patients with disability following COVID-19 require interventions to address respiratory, cardiovascular, neurological, musculoskeletal, and psychosocial issues. The pandemic has resulted in changes to program structures and how inpatient rehabilitation facilities approach family caregiver engagement amidst visitation restrictions. Technology solutions can be utilized to reduce the patient and their family's feelings of isolation and support caregiver preparation for discharge. Nurse leaders are essential in supporting staff during this crisis through authentic presence and providing resources and training. Rehabilitation nurses are key in helping patients and families manage rehabilitation and the aftermath of COVID-19 to restore optimal functioning. In this clinical consultation, we synthesize insights learned from the COVID-19 responses at three inpatient rehabilitation facilities. We describe the impact of rehabilitation nursing interventions to improve outcomes for patients with COVID-19 and their caregivers.","Camicia, Michelle E.; Cournan, Michele C.; Rye, Jill",Rehabil Nurs,367,26
609604,609604,609604,Supplementing politics-based with risk-based management in the COVID-19 outbreak,23.226425,7.117269,2021-05-13,"As the situation of severe acute respiratory syndrome coronavirus type 2 (SARS-CoV-2) is still deteriorating, there has been a huge increase in the demand and use of disinfectants. Electrolyzed water (EW), as a novel broad-spectrum disinfectant and cleaner, has been widely used for several years. EW can be produced in an electrolysis chamber which contains dilute salt and tap water. It is an effective antimicrobial and antibiofilm agent, with several advantages such as on-the-spot, cheap, environmentally friendly and safe for human beings. Therefore, EW holds potential significance for high-risk settings in hospitals and other clinical facilities. EW can also be applied for wound healing, advanced tissue care, and dental clinics. The present review article highlights the latest developments and new perspectives of EW, especially in clinical fields. Furthermore, the main action modes of antibiofilm and antimicrobial will be summarized.","Yan, Pianpian; Daliri, Eric Banan-Mwine; Oh, Deog-Hwan",Microorganisms,367,1
610421,610421,610421,Design and performance evaluation of a photocatalytic reactor for indoor air disinfection,23.20685,6.8631654,2020-11-21,"Over the last decades, great strides have been made in the management of acute respiratory distress syndrome (ARDS). Mechanical ventilation remains the cornerstone of supportive therapy for ARDS. Lung-protective mechanical ventilation minimizes the risk of ventilator-induced lung injury (VILI) and improves survival. Several parameters are determinants of VILI and require careful setting, such as tidal volume (VT), plateau pressure (Pplat), driving pressure (DP), positive end-expiratory pressure (PEEP), and respiratory rate. Furthermore, measurement of energy and mechanical power may enable quantification of the relative contribution of its different components (VT, Pplat, ΔP, PEEP, respiratory rate, and airflow) and better individualize mechanical ventilation settings. The use of neuromuscular blocking agents is of interest, mainly in cases of severe ARDS, to improve oxygenation and reduce asynchrony; however, no significant changes in survival have been observed. Rescue respiratory therapies, such as prone positioning, inhaled nitric oxide, and extracorporeal support techniques may also be used in specific situations. Furthermore, respiratory weaning protocols should be discussed. After reviewing all recent clinical trials, we now present 10 golden rules to individualize mechanical ventilation in ARDS management.","Battaglini, Denise; Sottano, Marco; Ball, Lorenzo; Robba, Chiara; Rocco, Patricia R.M.; Pelosi, Paolo",,367,22
610824,610824,610824,The impact of the COVID-19 pandemic on socio-economic and sustainability,23.180344,6.826855,2021-07-15,"A retrospective observational study was conducted for patients 18 years or older presenting to a Midwestern emergency department (ED) in the United States during February 2019–January 2020 to characterize associated subsequent care utilization in patients who left the ED without being seen. Patients were classified as left without being seen (LWBS) based on documented ED disposition. The healthcare system’s records were reviewed for any associated utilizations within 3 weeks following the initial ED encounter. During the study period, 45,456 patients presented to the ED, with 2269 (5.0%) classified as LWBS. The median documented time until patients left the ED was 112 min. Of these patients, 1257 (55.4%) had a subsequent encounter within the health system within 3 weeks and 920 (73.2%) of these visits were determined to be related to the LWBS chief complaint. These visits included 67.5% of patients returning to ED or hospital, 27.5% to primary care or an urgent care clinic, and 5.0% to a specialty or other provider appointment. Of patients returning to ED, 78.1% did so within 72 h. Patients without a subsequent health system associated encounter tended to be younger, female, non-White, and present with possible lower-acuity chief complaints. At least one-half of LWBS patients sought care related to the concerns by a health system provider within 3 weeks of the initial encounter within the same system. The high prevalence of ED returns within a narrow turnaround window highlights a missed opportunity to provide services to these patients during their initial encounter. SUPPLEMENTARY INFORMATION: The online version contains supplementary material available at 10.1007/s11739-021-02775-z.","Roby, Nathan; Smith, Hayden; Hurdelbrink, Jonathan; Craig, Steven; Hawthorne, Clint; DuMontier, Samuel; Kluesner, Nicholas",Intern Emerg Med,367,3
612766,612766,612766,Local disease–ecosystem–livelihood dynamics: reflections from comparative case studies in Africa,22.981165,7.1301017,2017-07-19,"Viral respiratory infections are risk factors for cardiovascular disease (CVD). Underlying CVD is also associated with an increased risk of complications following viral respiratory infections, including increased morbidity, mortality, and health care utilization. Globally, these phenomena are observed with seasonal influenza and with the current coronavirus disease 2019 (COVID-19) pandemic. Persons with CVD represent an important target population for respiratory virus vaccines, with capacity developed within 3 large ongoing influenza vaccine cardiovascular outcomes trials to determine the potential cardioprotective effects of influenza vaccines. In the context of COVID-19, these international trial networks may be uniquely positioned to redeploy infrastructure to study therapies for primary and secondary prevention of COVID-19. Here, we describe mechanistic links between influenza and COVID-19 infection and the risk of acute cardiovascular events, summarize the data to date on the potential cardioprotective effects of influenza vaccines, and describe the ongoing influenza vaccine cardiovascular outcomes trials, highlighting important lessons learned that are applicable to COVID-19.","Behrouzi, Bahar; Araujo Campoverde, Maria Viviana; Liang, Kyle; Talbot, H. Keipp; Bogoch, Isaac I.; McGeer, Allison; Fröbert, Ole; Loeb, Mark; Vardeny, Orly; Solomon, Scott D.; Udell, Jacob A.",J Am Coll Cardiol,367,13
617236,617236,617236,"Deciphering the impact of novel coronavirus pandemic on agricultural sustainability, food security, and socio-economic sectors—a review",23.18603,6.858758,2021-07-31,"COVID-19 is deadly to older adults, with research showing that being older and having underlying chronic diseases are significant risk factors for COVID-19 related deaths. However, though similarities exist between both nursing home residents and older community-dwelling people, nursing home residents are substantially more vulnerable to COVID-19. A closer review of both demographic groups provides clarity concerning the difference within the context of COVID-19. Therefore, to address the research gap, drawing insights from Maslow’s hierarchy of needs model, this article aims to examine similarities and differences in COVID-19 risk factors experienced by nursing home residents and community-dwelling older people.","Su, Z; McDonnell, D; Li, Y",QJM,367,20
619622,619622,619622,Prevalence of smoking in the Kuwaiti adult population in 2014: a cross-sectional study,23.253036,6.9747176,2020-11-08,,"Fiala, Matthew J.",Ann Emerg Med,367,22
620810,620810,620810,"Knowledge, attitude, and practice of clinicians about antimicrobial stewardship and resistance among hospitals of Pakistan: a multicenter cross-sectional study",22.976875,6.8101897,2021-09-06,,"Santos, Núria F; Alho, António P; Costa, Isa D; Ferreira, Liliana P; Sêco, Elisabete H",Prim. care companion CNS disord. (Online),367,16
621378,621378,621378,Effect of meteorological factors and Air Quality Index on the COVID-19 epidemiological characteristics: an ecological study among 210 countries,23.30571,7.078976,2021-05-22,"INTRODUCTION: Hospital do Rim is a high‐volume kidney transplant (KT) center located in São Paulo, a city with 12.2 million inhabitants. Over the last 18 years, we performed 11 436 KT, 70% of which from deceased donors. To mitigate the effects of reduction in the number of transplants on the waiting list, sequential measures were implemented when COVID‐19 was declared pandemic. METHODS: The first step was to provide SARS‐COV‐2 RT‐PCR testing for all symptomatic employees and patients and the compulsory use of personal protective equipment in the hospital facilities. Living donor KT were postponed, and all deceased donors and recipients were tested before the transplantation. The immunosuppressive protocols were maintained, and telehealth strategies were developed. RESULTS: Among the 1013 employees, there were 214 cases of COVID‐19, nine required ward hospitalization, and no deaths occurred. In 26%, the probable source of contamination was occupational. From the first patient diagnosed with COVID‐19 in 03/20/2020 till 10/21/2020, 523 deceased KT were performed, a 21% increase compared with 2019, with no confirmed donor‐derived SARS‐CoV‐2 infection. Four patients were transplanted with a positive pretransplant SARS‐CoV‐2 test, but none of them developed the disease. Overall, of 11 875 KT followed in our center, 674 developed COVID‐19. Among the hospitalized, 53% required mechanical ventilation, and 45% required hemodialysis. Their overall mortality rate was 27.5%. CONCLUSION: This experience shows the challenges that transplant centers faced as the pandemic unfolded and illustrates the effectiveness of the sequential measures implemented to provide a safe environment for transplantation.","Cristelli, Marina P.; Viana, Laila A.; Fernandes, Ruan de A.; Nakamura, Monica R.; Foresto, Renato D.; Stopa Martins, Suelen B.; Alvarazi, Jacqueline F. L.; Leite, Valeria C.; de Oliveira, Francisco R.; Carneiro, Vanessa A.; Santos, Daniel Wagner de C. L.; Aguiar, Wilson F.; Vaz, Maria Lucia dos S.; Tedesco‐Silva, Helio; Medina‐Pestana, José",Transpl Infect Dis,367,21
624387,624387,624387,"Discussion of “Improving precision and power in randomized trials for COVID‐19 treatments using covariate adjustment, for binary, ordinal, and time‐to‐event outcomes”",23.159906,7.25082,2021-06-09,"BACKGROUND: Corona virus disease 2019 (COVID‐19) has been announced as a new coronavirus disease by the World Health Organization. At the time of writing this article (April 2020), the world is drastically influenced by the COVID‐19. Recently, the COVID‐19 Open Research Dataset (CORD‐19) was published. For researchers on ID such as ourselves, it is of key interest to learn whether this open research dataset may be used to investigate the virus and its consequences for people with an ID. METHODS: From CORD‐19, we identified full‐text articles containing terms related to the ID care and applied a text mining technique, specifically the term frequency–inverse document frequency analysis in combination with K‐means clustering. RESULTS: Two hundred fifty‐nine articles contained one or more of our specified terms related to ID. We were able to cluster these articles related to ID into five clusters on different topics, namely: mental health, viral diseases, diagnoses and treatments, maternal care and paediatrics, and genetics. CONCLUSION: The CORD‐19 open research dataset consists of valuable information about not only COVID‐19 disease but also ID and the relationship between them. We suggest researchers investigate literature‐based discovery approaches on the CORD‐19 and develop a new dataset that addresses the intersection of these two fields for further research.","Tummers, J.; Catal, C.; Tobi, H.; Tekinerdogan, B.; Leusink, G.",J Intellect Disabil Res,367,22
628333,628333,628333,Correlation between measles immunization coverage and overall morbidity and mortality for COVID-19: an epidemiological study,23.112148,7.2382884,2021-06-29,"We use Bayesian Estimation for the logistic growth model in order to estimate the spread of the coronavirus epidemic in the state of New York. Models weighting all data points equally as well as models with normal error structure prove inadequate to model the process accurately. On the other hand, a model with larger weights for more recent data points and with t-distributed errors seems reasonably capable of making at least short term predictions.","Bliznashki, Svetoslav",,367,31
628829,628829,628829,Prevalence and associated risk factors of cannabinoid abuse among Egyptian university students: a cross-sectional study,22.94854,6.8791065,2021-07-17,"This paper aims to propose a provisional assessment of the research developed in the context of the COVID19 pandemic since the beginning of 2020. It reviews the types of research already published, presents their methodologies and analyzes the questions posed. It places recent research in the perspective of the history of empirical research on sexuality, particularly in relation to research carried out in the context of HIV/AIDS. Situated in an intellectual history perspective, the article analyzes research currently being developed as the construction and prefiguration of a new paradigm of sexualities that distinguishes and associates sexual relations that take place in the presence of a real partner and those that take place with the help of a whole range of electronic devices qualified as “virtual” that provide support for the imagination and maintain sexual arousal for personal satisfaction.","Giami, A.",,367,28
630520,630520,630520,Outbreak analytics: a developing data science for informing the response to emerging pathogens,22.79285,6.8240576,2019-07-08,"BACKGROUND: The Integrated Disease Surveillance and Response (IDSR) strategy was introduced in Madagascar in 2007. Information was collected by Healthcare structures (HS) on paper forms and transferred to the central level by post or email. Completeness of data reporting was around 20% in 2009–10. From 2011, in two southern regions data were transmitted through short messages service using one telephone provider. We evaluated the system in 2014–15 to determine its performance before changing or expanding it. METHODS: We randomly selected 80 HS and interviewed their representatives face-to-face (42) or by telephone (38). We evaluated knowledge of surveillance activities and selected case definitions, number of SMS with erroneous or missing information among the last ten transferred SMS, proportion of weekly reports received in the last 4 weeks and of the last four health alerts notified within 48 h, as well as mobile phone network coverage. RESULTS: Sixty-four percent of 80 interviewed HS representatives didn’t know their terms of reference, 83% were familiar with the malaria case definition and 32% with that of dengue. Ninety percent (37/41) of visited HS had five or more errors and 47% had missing data in the last ten SMS they transferred. The average time needed for weekly IDSR data compilation was 24 min in the Southern and 47 in the South-eastern region. Of 320 expected SMS 232 (73%) were received, 136 (43%) of them in time. Out of 38 alerts detected, four were notified on time. Nine percent (7/80) of HS had no telephone network with the current provider. CONCLUSIONS: SMS transfer has improved IDSR data completeness, but timeliness and data quality remain a problem. Healthcare staff needs training on guidelines and case definitions. From 2016, data are collected and managed electronically to reduce errors and improve the system’s performance.","Randriamiarana, Rado; Raminosoa, Grégoire; Vonjitsara, Nikaria; Randrianasolo, Rivo; Rasamoelina, Harena; Razafimandimby, Harimahefa; Rakotonjanabelo, Arthur Lamina; Lepec, Richard; Flachet, Loïc; Halm, Ariane",BMC Health Serv Res,367,11
632887,632887,632887,Are meteorological factors enhancing COVID-19 transmission in Bangladesh? Novel findings from a compound Poisson generalized linear modeling approach,23.210222,6.791437,2020-10-28,"INTRODUCTION: Environmental factors such as wind, temperature, humidity, and sun exposure are known to affect influenza and viruses such as severe acute respiratory syndrome (SARS) and Middle East Respiratory Syndrome (MERS) transmissions. COVID-19 is a new pandemic with very little information available about its transmission and association with environmental factors. The goal of this paper is to explore the association of environmental factors on daily incidence rate, mortality rate, and recoveries of COVID-19. METHODS: The environmental data for humidity, temperature, wind, and sun exposure were recorded from metrological websites and COVID-19 data such as the daily incidence rate, death rate, and daily recovery were extracted from the government's official website available to the general public. The analysis for each outcome was adjusted for factors such as lock down status, nationwide events, and the number of daily tests performed. Analysis was completed with negative binominal regression log link using generalised linear modelling. RESULTS: Daily temperature, sun exposure, wind, and humidity were not significantly associated with daily incidence rate. Temperature and nationwide social gatherings, although non-significant, showed trends towards a higher chance of incidence. An increase in the number of daily testing was significantly associated with higher COVID-19 incidences (effect size ranged from 2.17–9.96). No factors were significantly associated with daily death rates. Except for the province of Balochistan, a lower daily temperature was associated with a significantly higher daily recovery rate. DISCUSSION: Environmental factors such as temperature, humidity, wind, and daily sun exposure were not consistently associated with COVID-19 incidence, death rates, or recovery. More policing about precautionary measures and ensuring diagnostic testing and accuracy are needed.","Rehman, Yasir; Rehman, Nadia",AIMS Public Health,367,20
