,title_x,publish_time_x,abstract,authors,journal,url,category
6936,"Evaluation of TNF as antiviral, antibacterial and antiparasitic agent",1991,"T follicular regulatory (Tfr) cell is a CXCR5(+)Foxp3(+) subset of T regulatory (Treg) cell with critical roles in regulating germinal center responses and modulating the immune environment in the lymph nodes. Studies have shown that the proportion of Tfr cells may increase during acute inflammation. In this study, we investigated the role of Tfr cells in acute respiratory distress syndrome (ARDS). We found that Tfr cells were significantly enriched in peripheral blood and in mini-bronchoalveolar lavage (BAL) during the onset of ARDS. Notably, Tfr cells represented the majority of Treg cells in the mini-BAL samples. Tfr cells also showed CTLA-4, IL-10, and TGF-β expression, but compared to the non-Tfr Treg cells, the CTLA-4 and IL-10 expression by Tfr cells were slightly reduced. Both Tfr cells and non-Tfr Treg cells suppressed the proliferation of autologous CD4(+)CD25(−) T cells; however, the Tfr cells displayed slightly reduced suppression capacity. Subsequently, B cells were co-incubated with autologous Tfr cells or non-Tfr Treg cells. Interestingly, we found that the frequency of IL-10(+) Breg cells was significantly higher following incubation with Tfr cells than with non-Tfr Treg cells, which suggested that Tfr cells were more potent at inducing IL-10(+) Breg cells. Together, these results demonstrated that Tfr cells were a similar but distinctive subset of Treg cells. Given that Tfr cells were strongly enriched in ARDS patients, especially in the lung infiltrates, they may exert critical ameliorating effects in ARDS.","Li, Hongqiang; Zhou, Runv; Wang, Chunmei; Li, Yusheng; Zheng, Guizhen; Jiang, Sen; Dong, Tiancao; Bai, Jianwen; Xu, Shumin",Immunol Res,https://www.ncbi.nlm.nih.gov/pmc/articles/PMC7102368/,519
35931,Hydroxychloroquine: QTc prolongation following off-label-use: case report,2020-07-04,"Almost all CDCL SAT solvers use the 1-UIP clause learning scheme for learning new clauses from conflicts, and our current understanding of SAT solving provides good reasons for using that scheme. In particular, the 1-UIP scheme yields asserting clauses, and these asserting clauses have minimum LBD among all possible asserting clauses. As a result of these advantages, other clause learning schemes, like i-UIP and all-UIP, that were proposed in early work are not used in modern solvers. In this paper, we propose a new technique for exploiting the all-UIP clause learning scheme. Our technique is to employ all-UIP learning under the constraint that the learnt clause’s LBD does not increase (over the minimum established by the 1-UIP clause). Our method can learn clauses that are significantly smaller than the 1-UIP clause while preserving the minimum LBD. Unlike previous clause minimization methods, our technique is not limited to learning a sub-clause of the 1-UIP clause. We show empirically that our method can improve the performance of state of the art solvers.","Feng, Nick; Bacchus, Fahiem",Theory and Applications of Satisfiability Testing - SAT 2020,https://www.ncbi.nlm.nih.gov/pmc/articles/PMC7326470/,519
36464,Hydroxychloroquine/lopinavir/ritonavir/methylprednisolone: Manic episode with psychotic features during an off-label use: case report,2020-07-11,"The research of skin lesion diseases is currently one of the hottest topics in the medical research fields, and has gained a lot of attention on the last few years. However, the existing skin lesion methods are mainly relying on conventional Convolutional Neural Network (CNN) and the performance of skin lesion recognition is far from satisfactory. Therefore, to overcome the aforementioned drawbacks of traditional methods, we propose a novel Computer-Aided Diagnosis (CAD) system, named DermoNet, based on Multi-Scale Feature Level (MSFL) blocks and Multi-Level Feature Fusion (MLFF). Further, the DermoNet approach yields a significant enhancement in terms of dealing with the challenge of small training data sizes in the dermoscopic domain and avoiding high similarity between classes and overfitting issue. Extensive experiments are conducted on the public dermoscopic dataset, and the results demonstrate that DermoNet outperforms the state-of-the-art approaches. Hence, DermoNet can achieve an excellent diagnostic efficiency in the auxiliary diagnosis of skin lesions.","Bakkouri, Ibtissam; Afdel, Karim",Image and Signal Processing,https://www.ncbi.nlm.nih.gov/pmc/articles/PMC7340898/,519
36881,Tocilizumab: Bacterial superinfection following off-label use: case report,2020-07-18,"This chapter summarizes and expands on the breakout session at the 2019 Autonomous Vehicles Symposium in Orlando, FL, titled “Ethical Algorithms in Autonomous Vehicles.” First, the content of the workshop presentations is summarized, covering technical and nontechnical detail. Second, the discussion during, and on the margins of the workshop is summarized from the perspective of the authors, consistent with the Chatham House Rule. Conclusions are posed for industry, academia, and government readers.","Evans, Nicholas G.",Road Vehicle Automation 7,https://www.ncbi.nlm.nih.gov/pmc/articles/PMC7360353/,519
37191,"Azithromycin/hydroxychloroquine: Lengthening of the QT interval, bradycardia and atrioventricular block following an off-label use: case report",2020-07-25,"BACKGROUND: To analyze the clinical characteristics of Mycoplasma pneumoniae pneumonia with hypoxia in children, and identify the associated risk factors of hypoxia in MPP. METHODS: A retrospective case-control study was performed on 345 children with Mycoplasma pneumoniae pneumonia (MPP) admitted to our hospital wards from January 2017 to June 2019. They were divided into three groups, namely MPP with hypoxia, refractory Mycoplasma pneumoniae pneumonia (RMPP), and general Mycoplasma pneumoniae pneumonia (GMPP). The clinical features, laboratory findings, imaging, and management were collected and compared in the three groups. RESULTS: The MPP with hypoxia patients (n = 69) had longer disease duration, a higher extra-pulmonary complications rate, and more severe radiological abnormalities (P < 0.05). They also needed more complicated treatments (P < 0.05). Meanwhile, the levels of white blood cell count (WBC), C-reactive protein (CRP), lactic dehydrogenase (LDH), interleukin (IL)-6, ferritin, D-dimer, fibrinogen (FG), alanine aminotransferase (ALT) and the percentage of neutrophils in the MPP with hypoxia group were significantly higher than those in the RMPP group and the GMPP group (P < 0.05). In ROC curve analysis, the percentage of neutrophils, WBC, CRP, LDH, IL-6, ferritin, D-dimer, and ALT were contributed to identify the MPP with hypoxia patients. Multivariate logistic regression analysis revealed that ferritin> 174.15 ng/mL, IL-6 > 25.475 pg/ml, and pleural effusion were significantly associated with the incidence of hypoxia in MPP (P < 0.01). CONCLUSION: MPP with hypoxia patients presented more serious clinical manifestations. Ferritin> 174.15 ng/mL, IL-6 > 25.475 pg/ml and pleural effusion were related risk factors for hypoxia in MPP.","Ling, Yaoyao; Zhang, Tongqiang; Guo, Wei; Zhu, Zhenli; Tian, Jiao; Cai, Chunquan; Xu, Yongsheng",BMC Infect Dis,https://www.ncbi.nlm.nih.gov/pmc/articles/PMC7374650/,519
37403,Multiple drugs: Increased tacrolimus blood trough levels due to interaction and off-label use: case report,2020-08-01,,,,https://www.ncbi.nlm.nih.gov/pmc/articles/PMC7380938/,519
37886,Methylprednisolone/tocilizumab: Intestinal perforation following off-label use: case report,2020-08-01,,"Razavipour, Kioumars",Asian,https://www.ncbi.nlm.nih.gov/pmc/articles/PMC7416799/,519
38157,Azithromycin/hydroxychloroquine interaction: QT interval prolongation following off-label use: case report,2020-08-22,"This paper discusses on the increasing relevancy of geospatial technologies such as geographic information system (GIS) in the public health domain, particularly for the infectious disease surveillance and modelling strategies. Traditionally, the disease mapping tasks have faced many challenges—(1) authors rarely documented the evidence that were used to create map, (2) before evolution of GIS, many errors aroused in mapping tasks which were expanded extremely at global scales, and (3) there were no fidelity assessment of maps which resulted in inaccurate precision. This study on infectious diseases geo-surveillance is divided into four broad sections with emphasis on handling geographical and temporal issues to help in public health decision-making and planning policies: (1) geospatial mapping of diseases using its spatial and temporal information to understand their behaviour across geography; (2) the citizen’s involvement as volunteers in giving health and disease data to assess the critical situation for disease’s spread and prevention in neighbourhood effect; (3) scientific analysis of health-related behaviour using mathematical epidemiological and geo-statistical approaches with (4) capacity building program. To illustrate each theme, recent case studies are cited and case studies are performed on COVID-19 to demonstrate selected models.","Saran, Sameer; Singh, Priyanka; Kumar, Vishal; Chauhan, Prakash",J Indian Soc Remote Sens,https://www.ncbi.nlm.nih.gov/pmc/articles/PMC7433774/,519
38397,Azithromycin/hydroxychloroquine: DRESS syndrome following off-label use: case report,2020-08-29,"The first case was that of a 58–year–old man diagnosed with coronavirus disease 2019 (COVID–19) pneumonia after 7 days of fever. Favipiravir was administered on admission; however, the patient’s respiratory status worsened with high fever. On day 2 of admission, after tracheal intubation, maintaining oxygenation was difficult after initiating mechanical ventilation, and extracorporeal membrane oxygenation (ECMO) was initiated. On day 5, prone positioning and corticosteroid therapy were started. The patient was weaned from ECMO on day 9 and from ventilator support on day 11. On day 27, he was discharged ambulatory. The second case was that of a 44–year–old man who complained of dyspnea after 12 days of fever. After tracheal intubation, he was diagnosed with COVID–19 pneumonia. Favipiravir was administered on admission; nevertheless, the patient’s respiratory status worsened gradually with high fever. On day 4 of admission, ECMO and corticosteroid therapy were initiated. On day 5, prone positioning was started. The patient was weaned from ECMO on day 12 and from ventilator support on day 15. On day 30, he was discharged ambulatory. The aggravation of COVID–19 pneumonia may be associated with excessive inflammation; therefore, some patients were effectively treated with corticosteroid therapy.","(Jiro Kamiyama), 神山 治郎; (Koichi Yasaka), 八坂 剛一; (Saki Sakamoto), 坂本 早紀; (Katsura Hayakawa), 早川 桂; (Yuko Egawa), 江川 裕子; (Shigemasa Taguchi), 田口 茂正; (Kazuya Kiyota), 清田 和也",,https://www.ncbi.nlm.nih.gov/pmc/articles/PMC7436470/,519
38406,Baricitinib/lopinavir/ritonavir: Elevated transaminases and off-label use: case report,2020-08-29,,"Vashishtha, Vipin M.; Kumar, Puneet",Indian Pediatr,https://www.ncbi.nlm.nih.gov/pmc/articles/PMC7444173/,519
39425,Azithromycin/hydroxychloroquine: QTc interval prolongation and torsades de pointes following off-label use: case report,2020-09-19,,"Kumar, Anil; Paulose, Roopa; Sadasivan, Shine; Bajad, Chandan; Ramachandran, Arya; Nair, Priya",Clin Microbiol Infect,https://www.ncbi.nlm.nih.gov/pmc/articles/PMC7497548/,519
39427,"Lopinavir/ritonavir/tocilizumab: Myositis, Staphylococcus epidermidis bacteraemia, hepatitis and ventilator-associated pneumonia following off-label use: 3 case reports",2020-09-19,,"ALVAREZ, Ronald D.; GOFF, Barbara A.; CHELMOW, David; GRIFFIN, Todd R.; NORWITZ, Errol R.; LANCEY, John O.DE.",Am J Obstet Gynecol,https://www.ncbi.nlm.nih.gov/pmc/articles/PMC7497777/,519
39433,Hydroxychloroquine/remdesivir/tocilizumab: Increase in corrected QT interval and off-label use: case report,2020-09-19,"To assess the incidence, clinical, microbiological features and outcome of invasive Streptococcus agalactiae (GBS) infections in non-pregnant adults in three tertiary hospitals of the Brussels-Capital Region. All bacterial cultures positive for GBS, from 2005 to 2019 from 3 hospitals of the Brussels-Capital Region, were extracted, and only cases of invasive diseases were included. Medical files were retrospectively retrieved for risk factors, clinical manifestations and outcome and also antibiotic-susceptibility testing and GBS serotypes. Incidence rates were calculated based on the hospitals catchment populations. A total of 337 cases of GBS-invasive infections were included. The incidence of invasive GBS for the 3 hospitals increased from 3.7 to 8.2 cases per 100.000 inhabitants between 2009 and 2018 (p = 0.04). The most frequently identified risk factors were diabetes (36.8%), obesity (35.0%), cancer (21.7%), renal disease (20.8%), and advanced age (≥ 65 years; 47.2%). Isolated bacteremia (22%), osteoarticular infection (21.4%), abscesses (13.9%), and skin and soft tissue infections (18.4%) were the most frequent manifestations. Intensive care unit admission was required in 21.7% and overall mortality was 9.4%. All strains remained susceptible to penicillin over the years. Up to 20% of strains were resistant to clindamycin. Serotypes Ia, Ib, II, III, IV, and V represented 96.8% of the available serotypes (60/62). As reported in several countries, invasive GBS disease in non-pregnant adults represents an increasing burden, particularly among diabetic, obese, and elderly patients. Almost all serotypes identified are included in the upcoming hexavalent GBS conjugate vaccine. ELECTRONIC SUPPLEMENTARY MATERIAL: The online version of this article (10.1007/s10096-020-04041-0) contains supplementary material, which is available to authorized users.","Graux, Elena; Hites, Maya; Martiny, Delphine; Maillart, Evelyne; Delforge, Marc; Melin, Pierrette; Dauby, Nicolas",Eur J Clin Microbiol Infect Dis,https://www.ncbi.nlm.nih.gov/pmc/articles/PMC7498195/,519
39842,Hydroxychloroquine: Ocular myasthenic syndrome following off-label use: case report,2020-09-26,"Recent guidance from the US Immigration and Customs Enforcement drastically altered the lives of international students in America, especially those who are matriculating. This commentary describes how international students still face uncertainty concerning their visa statuses and their place in American society.","Lemieux, Mackenzie; Colazo, Juan Manuel; Kienka, Tamina; Zhakyp, Ademi",Cell Rep Med,https://www.ncbi.nlm.nih.gov/pmc/articles/PMC7508047/,519
39852,Hydroxychloroquine/oseltamivir: Exacerbation of psoriasis during off-label use: case report,2020-09-26,,,,https://www.ncbi.nlm.nih.gov/pmc/articles/PMC7508512/,519
40173,Multiple drugs: Prolonged viral shedding time and off-label use: case report,2020-10-03,,The Lancet Public Health,Lancet Public Health,https://www.ncbi.nlm.nih.gov/pmc/articles/PMC7524434/,519
40184,Azithromycin: Wide QRS complex tachyarrhythmia following off-label use: case report,2020-10-03,,"Kumar Kalidoss, Vinoth; Singh Bakshi, Satvinder",,https://www.ncbi.nlm.nih.gov/pmc/articles/PMC7525082/,519
40701,Hydroxychloroquine: Sinus bradycardia and QTc prolongation following off-label use: case report,2020-10-10,"BACKGROUND: At the end of February 2020 a new case was diagnosed with COVID-19 in north Italy, suddenly followed by new cases. Italian health authorities decided to enforce restrictive measures. Northern areas of Italy were identified as “red areas” to slow down the epidemic and its impact on the healthcare system. From this perspective, the COVID-19 epidemic in Italy constitutes a testing ground for the assessment of the ability of consumers to cope with this health risk. METHODS: A cross-sectional study on a representative sample of 1000 Italian citizens was conducted over the period 27 February- 5 March exploring the following hypotheses: 1) less engaged individuals are more concerned for the health emergency and feel more vulnerable; 2) less engaged have higher probability to develop negative attitudes and dysfunctional behaviors. RESULTS: only the 16% the interviewees presented a high level of engagement. Lower levels of engagement were measured in the southern parts of Italy (not yet touched by the epidemics at the time of data collection). People with lowers levels of engagement reported higher fears for the contagion and sense of vulnerability. Furthermore, they showed the lower levels of trust in the Public Health Authorities, in medical research and in vaccines. Finally, they appeared more dismissive in their preventive behaviors and more disorganized in the fruition of the healthcare services. CONCLUSIONS: A psychological analysis of processes of attitudinal and role change in the direction of becoming more engaged in health prevention is worthy in order to forecast potential dysfunctional reactions to restrictive health prevention measures and to orient personalized education initiatives to consumers with different level of engagement. KEY MESSAGES: Profiling based on the levels of health engagement is important in order to plan more effective healthcare measures during epidemics. Targeted educational initiatives should take into account citizens' engagement profiles.","Graffigna, G; Barello, S; Palamenghi, L; Savarese, M; Castellini, G",Eur J Public Health,https://www.ncbi.nlm.nih.gov/pmc/articles/PMC7543550/,519
40702,Favipiravir: Hyperuricaemia and acute gouty arthritis following off-label use: case report,2020-10-10,"BACKGROUND: At the end of 2019, a novel pneumonia-causing Coronavirus called Sars-CoV-2 was first identified in Wuhan, Hubei Province, China. It subsequently spread throughout China and elsewhere, becoming a global health emergency. In February 2020, WHO designated the disease COVID-19, which stands for Coronavirus disease 2019. The aim of this study was to evaluate the impact of the COVID-19 epidemic on the perception of young Italians and to assess their knowledge and attitudes about the disease. METHODS: An online survey was conducted on 3rd-4th-5th February 2020 with the collaboration of “Skuola.net”, an important Italian Website for students. Young people had the opportunity to participate in the survey by answering an ad hoc questionnaire created to investigate knowledge and attitudes about the new Coronavirus, using a link published on the homepage. RESULTS: 5234 responses were received of which 3262 were females and 1972 were males, aged from 11 to 30. 82,4% were students (50,4% high school students) while 17,6% did not attend school or university. Regarding knowledge, 80% of the participants knew that the infection occurs through droplets from infected people; 63% knew that symptoms can appear up to 14 days after exposure; 80% knew that a vaccine has not yet been discovered. Regarding attitudes, 36% admitted that their attitude towards Chinese tourists has significantly worsened; 26% did not buy from Chinese run stores and 24% avoided Chinese restaurants. CONCLUSIONS: Although most of the participants seem correctly informed about COVID-19, young Italians are at risk of assuming irrational behavior due to psychosis. KEY MESSAGES: The global emergency of COVID-19 needs adequate information to avoid the spread of dangerous psychoses. Young people, usual users of social networks as a means of information, are more at risk of being influenced by fake news and adopting wrong behaviors.","Lia, L; Dorelli, B; Marte, M; Chiappetta, M; Faticoni, A; Lucaccini Paoli, L; Grassucci, D; Gelardini, M; Ardizzone, C; La Torre, G",Eur J Public Health,https://www.ncbi.nlm.nih.gov/pmc/articles/PMC7543551/,519
40901,Hydroxychloroquine: Acute haemolytic anaemia direct Coombs negative following off-label use: case report,2020-10-17,"BACKGROUND: Early in a pandemic, outcomes are biased towards patients with shorter durations of critical illness. We describe 60-day outcomes for patients critically ill with confirmed COVID-19 and explore the potential bias in the weekly reported data by ICNARC. METHODS: First 200 consecutive patients with confirmed COVID-19, admitted for critical care in England, Wales and Northern Ireland, followed-up for a minimum of 60 days from admission. Outcomes included survival and duration of critical care, receipt/duration of organ support in critical care and hospital survival. RESULTS: Mean age was 62.6 years, 70.5% were male, 52.0% were white, 39.2% obese and 9.0% had serious comorbidities. Median APACHE II score was 16 (IQR 12, 19). After 60 days, 83 (41.5%) patients had been discharged from hospital, 15 (7.5%) had been discharged from critical care but remained in hospital, 1 (0.5%) was still receiving critical care, 90 (45.0%) had died while receiving critical care and 11 (5.5%) had died in hospital after discharge from critical care. Median duration of critical care was 14.0 days (IQR 6.1, 23.0) for survivors and 10.0 days (IQR 5.0, 16.0) for non-survivors of critical care. Overall, 158 (79.0%) patients received advanced respiratory support for a median of 13 (IQR 8, 20) calendar days. Compared with weekly reports during the pandemic, critical care mortality started higher than but then decreased below that of the first 200 consecutive patients. Duration of critical care, for both survivors and non-survivors increased over time; however, both were still lower than those for the first 200 consecutive patients. Receipt and duration of organ support increased to values similar to those for the first 200 consecutive patients. CONCLUSION: COVID-19 in critical care has high mortality and places a large burden on resources. Analysis of preliminary data with limited follow-up should be interpreted with caution, particularly for future planning in a pandemic.","Richards-Belle, Alvin; Orzechowska, Izabella; Doidge, James; Thomas, Karen; Harrison, David A; Koelewyn, Abby; Christian, Michael D; Shankar-Hari, Manu; Rowan, Kathryn M; Gould, Doug W",J Intensive Care Soc,https://www.ncbi.nlm.nih.gov/pmc/articles/PMC7548541/,519
40905,Tocilizumab: Septic shock following off-label use: case report,2020-10-17,"Seit der Ausbreitung des SARS-CoV-2-Virus in Europa Anfang 2020 wir dan technischen Lösungen zur Eindämmung der Pandemie gearbeitet. Unter den verschiedenen Systementwürfen stechen jene hervor, die damit werben, datenschutzfreundlich und DSGVO-konform zu sein. Die DSGVO selbst verpflichtet die Betreiberïnnen umfangreicher Datenverarbeitungssysteme wie etwa Tracing-Apps zur Anfertigung einer Datenschutz-Folgenabschätzung (DSFA) aufgrund des hohen Risikos für die Rechte- und Freiheiten (Art. 35 DSGVO). Hierbei handelt es sich um eine strukturierte Risikoanalyse, die mögliche grundrechtsrelevante Folgen einer Datenverarbeitung im Vorfeld identifiziert und bewertet. Wir zeigen in unserer DSFA, dass auch die aktuelle, dezentrale Implementierung der Corona-Warn-App zahlreiche gravierende Schwachstellen und Risiken birgt. Auf der rechtlichen Seite haben wir die Legitimationsgrundlage einer freiwilligen Einwilligung untersucht und formulieren die begründete Forderung, dass der Einsatz einer Tracing-App gesetzlich geregelt werden muss. Weiterhin wurden Maßnahmen zur Verwirklichung von Betroffenenrechten nicht ausreichend betrachtet. Nicht zuletzt ist die Behauptung, ein Datum sei anonym, hoch voraussetzungsreich. Anonymisierung muss als ein kontinuierlicher Vorgang begriffen werden, der eine Abtrennung des Personenbezugs zum Ziel hat und auf dem Zusammenspiel von rechtlichen, organisatorischen und technischen Maßnahmen beruht. Der derzeit vorliegenden Corona-Warn-App fehlt es an einem solchen expliziten Trennungsvorgang. Unsere DSFA zeigt dabei auch die wesentlichen Defizite der offiziellen DSFA der Corona-Warn-App auf.","Bock, Kirsten; Kühne, Christian Ricardo; Mühlhoff, Rainer; Ost, Měto R.; Pohle, Jörg; Rehak, Rainer",Informatik Spektrum,https://www.ncbi.nlm.nih.gov/pmc/articles/PMC7549335/,519
41615,Ceftriaxone/heparin/hydroxychloroquine: Thrombocytopenia and off-label use: case report,2020-10-24,,"Sonnet, Miriam",der junge zahnarzt,https://www.ncbi.nlm.nih.gov/pmc/articles/PMC7605134/,519
41618,"Enoxaparin-sodium/heparin/tocilizumab: Masking of inflammatory markers following off-label use, and lack of efficacy and: 5 case reports",2020-10-24,,,Allergo J,https://www.ncbi.nlm.nih.gov/pmc/articles/PMC7605137/,519
