,index,Unnamed: 0,title_x,x,y,publish_time_x,abstract,authors,journal,category,cluster
350655,350655,350655,Coronavirus and analgesics,23.211227,6.4167624,2020,"To control COVID-19, several strategies were proposed in Iran since the start of the outbreak. The number of reported infected people and its consequent death toll herald relative inadequacies in the quality and extent of the measures in curbing the COVID-19 transmission cycle. This study was conducted to investigate knowledge, attitude, precautionary practices and degree of fear related to COVID-19 in a sample of Iranian population. This study was conducted among 457 residents of Kurdistan Province, Iran, through social networks and social media (WhatsApp and Telegram). Knowledge, attitude and practice and fear of COVID-19 were collected using valid tools. Multiple logistic regression and multivariate linear regression analyses were used to identify factors associated with binary outcome attitudes, practices and continuous variables knowledge and fear of COVID-19, respectively. The mean (SD) age of participants was 37.86 (10.42); of them, 252 (55.1%) were men, and more than two-thirds were married (74.8%). About 10% of the respondents were in believed that COVID-19 could create a type of social stigma. Level of knowledge about COVID-19 in 77.8% of the study attendees was acceptable, and 352 of them (70%) were confident that the virus would eventually be successfully controlled in the world, but only 252 of the attendants (50%) had confidence about successful control of COVID-19 in Iran. Applying multiple logistic regression, knowledge (OR: 1.18, p = 0.028) and fear (OR: 1.04, p = 0.028) of COVID-19 were associated with positive attitude towards controllability of COVID-19. Gender (OR: 1.96, p = 0.012), sources of information (OR: 5.00, p = 0.005) and knowledge (OR: 1.27, p = 0.006) were also indicated association with taking precautionary practices to control COVID-19. Further studies are recommended to boost level of knowledge, strengthen positive attitude and ameliorate behavioural pattern for successful control of COVID-19 in Iran.","Ghaderi, Ebrahim; Mahmoodi, Hassan; Sharifi Saqqezi, Pershang; Ghanei Gheshlagh, Reza; Moradi, Ghobad; Shokri, Azad; Piroozi, Bakhtiar; Mohamadi Bolbanabad, Amjad; Ahmadi, Asad",Heal. soc. care community,600,25
354773,354773,354773,Award-winning innovation,23.461979,6.395901,2020,"Artificial Intelligence (AI) has made leapfrogs in development across all the industrial sectors especially when deep learning has been introduced. Deep learning helps to learn the behaviour of an entity through methods of recognising and interpreting patterns. Despite its limitless potential, the mystery is how deep learning algorithms make a decision in the first place. Explainable AI (XAI) is the key to unlocking AI and the black-box for deep learning. XAI is an AI model that is programmed to explain its goals, logic, and decision making so that the end users can understand. The end users can be domain experts, regulatory agencies, managers and executive board members, data scientists, users that use AI, with or without awareness, or someone who is affected by the decisions of an AI model. Chest CT has emerged as a valuable tool for the clinical diagnostic and treatment management of the lung diseases associated with COVID-19. AI can support rapid evaluation of CT scans to differentiate COVID-19 findings from other lung diseases. However, how these AI tools or deep learning algorithms reach such a decision and which are the most influential features derived from these neural networks with typically deep layers are not clear. The aim of this study is to propose and develop XAI strategies for COVID-19 classification models with an investigation of comparison. The results demonstrate promising quantification and qualitative visualisations that can further enhance the clinician's understanding and decision making with more granular information from the results given by the learned XAI models.","Ye, Qinghao; Xia, Jun; Yang, Guang",,600,5
354774,354774,354774,Award-winning innovation,23.420061,6.4773793,2020,"Objectives With clinical experience from previous coronavirus infections, public health measures and fear of infection may have negative psychological effects on pregnant women. This study aimed to compare the level of anxiety and depression in the same pregnant women before and during the COVID-19 pandemic. Methods The pregnant women continuing pregnancy who participated in the first study which was undertaken to clarify the factors associated with mental health of pregnant women before the COVID-19 pandemic, were included for the current study during the outbreak. Anxiety and depression symptoms of the same pregnant women were evaluated by using the Inventory of Depression and Anxiety Symptoms II and Beck Anxiety Inventory twice before and during the pandemic. Results A total of 63 pregnant women completed questionnaires. The mean age of the women and the mean gestational age was 30.35±5.27 years and 32.5±7 weeks, respectively. The mean total IDAS II score was found to increase from 184.78±49.67 (min: 109, max: 308) to 202.57±52.90 (min: 104, max: 329) before and during the SARS-CoV-2 pandemic. According to the BAI scores the number of patients without anxiety (from 10 to 6) and with mild anxiety (from 31 to 24) decreased and patients with moderate (from 20 to 25) and severe anxiety (from 2 to 8) increased after SARS-CoV-2 infection. Multivariate linear regression analysis revealed that obesity and relationship with her husband are the best predictors of IDAS II scores. Conclusions This study indicated that COVID-19 outbreak affects the mental health of pregnant women negatively which leads to adverse birth outcomes. The level of anxiety and depression symptoms of pregnant women during the COVID-19 infection significantly increased. Healthcare professionals should establish comprehensive treatment plans for pregnant women who are highly vulnerable population to prevent mental trauma during the infectious disease outbreaks.","Ayaz, Reyhan; Hocaoglu, Meryem; Günay, Taner; Yardimci, Oguz Devrim; Turgut, Abdulkadir; Karateke, Ates",J Perinat Med,600,31
355091,355091,355091,Align Technology announces UK general dentist forum lineup,23.20756,6.1931105,2020,"Social distancing measures introduced in response to the COVID-19 pandemic resulted in an almost complete cessation of family bedside interaction, with negative effects on patients, families and staff Here we report on measures introduced in response to this situation at the critical care unit in one hospital involving the use of videoconferencing technology The solutions used also had the potential to be extended to clinical use, for example when seeking advice for colleagues, and to the provision of training","Webb, H.; Parson, M.; Hodgson, L. E.; Daswani, K.",Future Healthcare Journal,600,24
355092,355092,355092,Align Technology announces UK general dentist forum lineup,23.106722,6.285985,2020,"In this cross-sectional survey-based study conducted in early fall 2020, we attempted to measure and ascertain the extent of whether employers in New York and New Jersey were prepared to manage and follow occupational safety and health (S&H) regulations and industry risk processes in developing an exposure control response program to COVID-19, the disease caused by exposure to the coronavirus SARS-CoV-2. We focused on Region II of the U.S. Department of Labor (USDOL)-Occupational Safety and Health Administration (OSHA). In addition, we examined possible explanations for lack of compliance and uniformity across the region in various USDOL-OSHA regulatory aspects like training, respiratory protection program administration and proper task-specific application of occupational S&H hazard controls through risk management systems. We suggest opportunities for employer and governmental interventions to reduce potential worker exposures and better control future worksite biological hazards and infectious disease transmission. Overall, data suggested prevalent inconsistencies, noncompliance and a less than uniform approach to implementing COVID-19 response programs.","Koshy, Koshy; Shendell, Derek G; Presutti, Michael J",Saf Sci,600,16
360923,360923,360923,"Effects of remote virtual work environment during COVID-19 pandemic on technostress among Menoufia University Staff, Egypt: a cross-sectional study",23.383318,6.608501,2021,"Over the past century, the great pandemics and most epidemics (defined as virus presence and disease induction presenting more than the expected number of infections in a population) were caused by the sudden outbreak of an RNA virus such as the pandemics of influenza, polio, and HIV/AIDS and the epidemics of influenza, Ebola, Dengue, Zika, West Nile, severe acute respiratory syndrome (SARS), Middle East respiratory syndrome (MERS), and Chikungunya Of course, there are other infections that remain endemic problems in parts of the world, which are caused by bacteria (like tuberculosis) or parasites (like malaria) As everyone knows, the newest and among the most severe pandemic coronavirus disease 2019 (COVID-19) is again caused by an RNA virus, first identified by Chinese medical scientists and shown to be both highly contagious and dangerous (1–4) Why its relatives, SARS and MERS, rather quickly declined and disappeared as a global threat, while COVID-19 became global and persisted unabetted is unknown What is clear are the following: 1) the Chinese scientific and public health groups such as China CDC were quick and effective for China (see references at the end for a few of the key early papers);2) the rapid publication (January 10, 2020) of the sequence of the genome of the virus enabled the world to rapidly design vaccine plans and more sophisticated diagnostics;3) their grasp of transmission by aerosols;4) asymptomatic persons could be infectious;and 5) their identification of numerous coronaviruses in bats as the key carriers benefited all As this virus spread globally, medical scientists were quick to see that it could induce a two-phase disease First is the establishment of infection and showing mild symptoms, but in many cases progressing to a severe inflammatory disease involving numerous organs but especially lung damage and sometimes leading to death Progress on developing safe, specific, and potent anti-viral drugs for the early first-stage disease has been slow and disappointing, whereas treatment of the inflammatory stage with dexamethasone has had some significant benefit, but this will soon greatly improve (see below)","Robert, C. Gallo",China CDC Weekly,600,3
360924,360924,360924,"Effects of remote virtual work environment during COVID-19 pandemic on technostress among Menoufia University Staff, Egypt: a cross-sectional study",23.389868,6.6072254,2021,,"Wolf, Douglas C; Wolf, Christine H; Rubin, David T",Am J Gastroenterol,600,16
367901,367901,367901,A complete disinfection range for dentistry,23.405256,6.24444,2020,"Is death larger than life and does it annihilate life altogether? This is the basic question discussed in this essay, within a philosophical/existential context. The central argument is that the concept of death is problematic and, following Levinas, the author holds that death cannot lead to nothingness. This accords with the teaching of all religious traditions, which hold that there is life beyond death, and Plato's and Aristotle's theories about the immortality of the soul. In modernity, since the Enlightenment, God and religion have been placed in the margin or rejected in rational discourse. Consequently, the anthropocentric promethean view of man has been stressed and the reality of the limits placed on humans by death deemphasised or ignored. Yet, death remains at the centre of nature and human life, and its reality and threat become evident in the spread of a single virus. So, death always remains a mystery, relating to life and morality.","Kokosalakis, Nikos",Society,600,1
368340,368340,368340,Effect of meteorological factors and Air Quality Index on the COVID-19 epidemiological characteristics: an ecological study among 210 countries,23.365068,6.68499,2021,"Introduction: Corona virus disease 2019 (COVID-19) is an infectious disease that caused by SARS-CoV-2 with new cases and mortality rates that are increasing recently Due to inadequate of health facilities in Indonesia and the absence of a COVID-19 vaccine, some actions are required to reduce the spread of the virus, such as physical distancing In educational aspect, conventional learning systems are replaced by online learning system This kind of system may cause burnout in medical students The aim of the study was to describe the burnout incidence during online lectures in medical students in Udayana University during the Covid-19 pandemic Materials and Methods: A cross sectional study with 175 medical students in Udayana University class of 2018 and 2019 was conducted in this study The data were collected via goggle form which includes informed consent and questionnaire which contains burnout scale Univariate and bivariate analysis through chi-square test was conducted in this study Results: According to univariate analysis, there was 75 4% students were experienced moderate burnout, 4 9% students were experienced high burnout, and 9 7% were experienced low burnout Based on chi-square results (p&lt;0 05) There was no significant relationship between burnout incidence and age (p=0 813), sex (p=0 813), and students’ generations (p=0 761) Conclusions: Most of the students had experienced moderate burnout Therefore, a new learning method that does not increase students’ burden during online lectures is recommended in this study and further research is required to find the potential factors that affect burnout syndrome ©2009-2020, JGPT All Rights Reserved","Remitha, N. P. S. I.; Sadvika, I. G. A. S.; Prasetyo, A. V.; Rompis, A. Y.; Indrayani, A. W.; Artini, I. G. A.",Journal of Global Pharma Technology,600,1
368751,368751,368751,Gingiva and enamel shades for greater individuality,23.54346,6.254874,2021,"ABSTARCT Four hundred and fifty-three SARS CoV-2 antibodies tests were conducted using Roche Elecsys® Anti SARS CoV-2 kits (detecting total antibodies) between June 13 to July 8, 2020 (25 days) on Cobas® e411 automatic analyser, based on electrochemiluminescence immunoassay (ECLIA) principle. Samples were collected from walk-in patients at our facility. Among them, 2 (0.4%) were found equivocal, 289 (63.8%) were found reactive, while 162 (35.8%) were found non-reactive. Moreover, reactive (symptomatic) cases were 262 (57.8%), reactive (asymptomatic) were 27 (6.0%), non-reactive (symptomatic) were 34 (7.5%), while non-reactive (asymptomatic) were 128 (28.3%). Most common symptom was fever, found in 262 (87.9%) individuals, followed by dry cough 146 (49.0%). Most number of reactive cases, i.e. 110 (42.6%) were those who got themselves tested between 15-21 days after onset of first symptom. Key Words: COVID-19, Coronavirus, Antibodies testing.","Ghazanfer, Sidra; Mahmood, Hasan Osman",J Coll Physicians Surg Pak,600,16
397931,397931,397931,Orthodontic retention: what's on the horizon?,23.570944,6.515783,2021,"Since we announced the call for this Special Issue on Decolonial Interventions: in the middle of decoloniality in mid-2019, it feels like a lot has changed and the “middle” is more entangled and complicated than ever The COVID-19 pandemic has locked us down to shelter in our places, yet it has made us busier and more connected, and more worried and questioning The concerns and motivations that stood behind our decision to call for this Special Issue have not been eclipsed, as we might have initially thought Indeed, our concerns have been magnified and thrust forward as the global spread of the pandemic has been accompanied by the eruption of Black Lives Matter protests against police violence in the US, scenes of pandemic refugees dying on their exodus from locked-down cities in India, toppling statues in Britain and horrendously unjust disparities of sickness and death burdening Black people, Indigenous people and people of colour in different countries Deep questions about structural injustice and the colonial-modern have (re)surfaced as the entangled roots of oppression and violence have been thrust into the open, making them impossible to ignore Racism, gender violence, indigenous dispossession and genocide, climate and environmental injustice, forest fires and species extinction render basic human demands for healthcare, shelter, food, clean water and even the universal right to breathe (Mbembe 2020) impossible for so many © 2020 Journal of International Women''s Studies","Khoo, S. M.; Vered, A.; Dey, S.",Journal of International Women&#039;s Studies,600,16
398156,398156,398156,"Quality, cost-efficiency and maximum infection control",23.329105,6.5219526,2020,"A summary is given of the mechanical characteristics of virus contaminants and the transmission via droplets and aerosols. The ordinary and partial differential equations describing the physics of these processes with high fidelity are presented, as well as appropriate numerical schemes to solve them. Several examples taken from recent evaluations of the built environment are shown, as well as the optimal placement of sensors.","Lohner, Rainald; Antil, Harbir; Idelsohn, Sergio; Onate, Eugenio",,600,20
398157,398157,398157,"Quality, cost-efficiency and maximum infection control",23.270475,6.402905,2020,"A summary is given of the mechanical characteristics of virus contaminants and the transmission via droplets and aerosols. The ordinary and partial differential equations describing the physics of these processes with high fidelity are presented, as well as appropriate numerical schemes to solve them. Several examples taken from recent evaluations of the built environment are shown, as well as the optimal placement of sensors.","Löhner, Rainald; Antil, Harbir; Idelsohn, Sergio; Oñate, Eugenio",Comput Mech,600,22
405420,405420,405420,A helping hand for practices,23.136345,6.504145,2020,"Soil is the main distribution place of viruses in nature and an important medium for virus transmission The survival and transmission of influenza virus, enterovirus, hepatitis A virus and coronavirus in soil and the main influencing factors were analyzed systematically The results showed that influenza viruses, enteroviruses, hepatitis A viruses and coronaviruses could survive in soil for a long time In addition, these viruses could be transmitted through soil and lead to human infection through soil exposure Soil microorganisms, water content, soil type and temperature were found to be the main factors affecting the adsorption and survival of virus in soil The presence of soil microorganisms, low soil moisture content and high temperature could hinder the survival of viruses in soil In soil with high clay content and pH, the adsorption capacity and survival rate of viruses were high, while in the soil with high metal oxide and organic matter content, the adsorption capacity and survival rate of viruses were low Based on the above analysis, specific suggestions about the studies of virus survival and transmission in soil were put forward, such as systematic investigation on soil viruses in China need to be carried out and research on the survival, transmission and influencing factors of viruses in soil need to be strengthened This study shows that soil plays an important role in the environmental transmission of viruses, so the risk posed by environmental transmission of viruses should not be ignored © 2020, Editorial Board, Research of Environmental Sciences All right reserved","Wu, Y.; Liu, Q.; Yang, S.; Ma, J.",Research of Environmental Sciences,600,26
420565,420565,420565,Absolutely hygienic for peace of mind,23.198463,6.3106985,2020,"Coronavirus is an enveloped RNA virus that causes mild to severe respiratory diseases in humans, including HKU1-CoV, 229E-CoV, NL63-CoV, OC43-CoV, SARS-CoV, MERS-CoV, and SARS-CoV-2. Due to the outbreak of SARS-CoV-2, it is important to identify the patients and investigate their immune responses. Protein microarray is one of the best platforms to profile the antibodies in the blood because of its fast, multiplexed, and sensitive nature. To fully understand the immune responses and biological specificities, this study developed a human coronavirus (HCoV) protein microarray and included all seven human coronaviruses and three influenza viruses. Each protein was printed in triplicate and formed 14 identical blocks per array. The HCoV protein microarray showed high reproducibility and sensitivity to the monoclonal antibodies against spike and nucleocapsid protein with detection limits of 10-200 pg. The HCoV proteins that were immobilized on the array were properly folded and functional by showing interactions with a known human receptor, e.g., ACE2. By profiling the serum IgG and IgA from 32 COVID-19 patients and 36 healthy patients, the HCoV protein microarray demonstrated 97% sensitivity and 97% specificity with two biomarkers. The results also showed the cross-reactivity of IgG and IgA in COVID-19 patients to spike proteins from various coronaviruses, including that from SARS-CoV, HKU1-CoV, and OC43-CoV. Finally, an innate immune protein named surfactant protein D showed broad affinities to spike proteins in all human coronaviruses. Overall, the HCoV protein microarray is multiplexed, sensitive, and specific, which is useful in diagnosis, immune assessment, biological development, and drug screening.","Du, Pin-Xian; Chou, Yi-Yu; Santos, Harvey M; Keskin, Batuhan Birol; Hsieh, Miao-Hsi; Ho, Tzong-Shiann; Wang, Jiu-Yao; Lin, Yi-Ling; Syu, Guan-Da",Anal Chem,600,6
420566,420566,420566,Absolutely hygienic for peace of mind,23.289326,6.310744,2020,"Coronavirus is an enveloped RNA virus that causes mild to severe respiratory diseases in humans, including HKU1-CoV, 229E-CoV, NL63-CoV, OC43-CoV, SARS-CoV, MERS-CoV, and SARS-CoV-2. Due to the outbreak of SARS-CoV-2, it is important to identify the patients and investigate their immune responses. Protein microarray is one of the best platforms to profile the antibodies in the blood because of its fast, multiplexed, and sensitive nature. To fully understand the immune responses and biological specificities, this study developed a human coronavirus (HCoV) protein microarray and included all seven human coronaviruses and three influenza viruses. Each protein was printed in triplicate and formed 14 identical blocks per array. The HCoV protein microarray showed high reproducibility and sensitivity to the monoclonal antibodies against spike and nucleocapsid protein with detection limits of 10-200 pg. The HCoV proteins that were immobilized on the array were properly folded and functional by showing interactions with a known human receptor, e.g., ACE2. By profiling the serum IgG and IgA from 32 COVID-19 patients and 36 healthy patients, the HCoV protein microarray demonstrated 97% sensitivity and 97% specificity with two biomarkers. The results also showed the cross-reactivity of IgG and IgA in COVID-19 patients to spike proteins from various coronaviruses, including that from SARS-CoV, HKU1-CoV, and OC43-CoV. Finally, an innate immune protein named surfactant protein D showed broad affinities to spike proteins in all human coronaviruses. Overall, the HCoV protein microarray is multiplexed, sensitive, and specific, which is useful in diagnosis, immune assessment, biological development, and drug screening.","Du, Pin-Xian; Chou, Yi-Yu; Santos, Harvey M; Keskin, Batuhan Birol; Hsieh, Miao-Hsi; Ho, Tzong-Shiann; Wang, Jiu-Yao; Lin, Yi-Ling; Syu, Guan-Da",Anal Chem,600,6
443981,443981,443981,Disposable eye protection for you and your patients,23.300098,6.396481,2020,"INTRODUCTION: Preliminary retrospective reports showed that zinc supplementation may decrease mortality in COVID-19 patients, postulating the potential therapeutic efficacy of zinc in the management of the disease. OBJECTIVES: We sought to summarize the studies published to date regarding the antiviral activity of zinc in COVID-19 patients. PATIENTS AND METHODS: A meta-analysis was performed to compare the outcomes of hospitalized patients receiving zinc supplementation and those treated with standard care. The primary outcome was survival to hospital discharge. Secondary outcomes were in-hospital mortality and length of stay in hospital or intensive care unit (ICU). RESULTS: Data relating to 1474 patients included in four studies were analyzed. Survival to hospital discharge was 56.8% in the zinc group, compared to 75.9% in the non-zinc group (P=0.88). In-hospital mortality was 22.3% in the zinc group, compared to 13.6% for the standard care group (P=0.16). Length of hospital stay was 7.7(3.7) days in the zinc group and 7.2(3.9) days in the standard treatment group (P<0.001). Length of ICU stay was 4.9(1.7) days in the zinc group and 5.8(1.9) days in the standard care group (P=0.009). CONCLUSIONS: Zinc supplementation did not have any beneficial impact on the course of COVID-19 evaluated as survival to hospital discharge and in-hospital mortality. The zinc-supplemented group had longer hospital and ICU lengths of stay. There is at present no evidence-based data to support routine zinc supplementation in COVID-19 patients.","Szarpak, Lukasz; Pruc, Michal; Gasecka, Aleksandra; Jaguszewski, Milosz J; Michalski, Tomasz; Peacock, Frank W; Smereka, Jacek; Pytkowska, Katarzyna; Filipiak, Krzysztof J",Pol. Arch. Med. Wew. (Online),600,16
