,title_x,publish_time_x,abstract,authors,journal,url,category
629602,"Students’ Views towards Sars-Cov-2 Mass Asymptomatic Testing, Social Distancing and Self-Isolation in a University Setting during the COVID-19 Pandemic: A Qualitative Study",2021-04-15,"Critically ill patients admitted to hospital following SARS-CoV-2 infection often experience hypoxic respiratory failure and a proportion require invasive mechanical ventilation to maintain adequate oxygenation. The combination of prone positioning and non-invasive ventilation in conscious patients may have a role in improving oxygenation. The purpose of this study was to assess the effect of prone positioning in spontaneously ventilating patients receiving non-invasive ventilation admitted to the intensive care. Clinical data of 81 patients admitted with COVID 19 pneumonia and acute hypoxic respiratory failure were retrieved from electronic medical records and examined. Patients who had received prone positioning in combination with non-invasive ventilation were identified. A total of 20 patients received prone positioning in conjunction with non-invasive ventilation. This resulted in improved oxygenation as measured by a change in PaO (2)/FiO (2) (P/F) ratio of 28.7 mmHg while prone, without significant change in heart rate or respiratory rate. Patients on average underwent 5 cycles with a median duration of 3 hours. There were no reported deaths, 7 of the 20 patients (35%) failed non-invasive ventilation and subsequently required intubation and mechanical ventilation. In our cohort of 20 COVID-19 patients with moderate acute hypoxic respiratory failure, prone positioning with non-invasive ventilation resulted in improved oxygenation. Prone positioning with non-invasive ventilation may be considered as an early therapeutic intervention in COVID-19 patients with moderate acute hypoxic respiratory failure.","Burton-Papp, Helmi C.; Jackson, Alexander I. R.; Beecham, Ryan; Ferrari, Matteo; Nasim-Mohi, Myra; Grocott, Michael P. W.; Chambers, Robert; Dushianthan, Ahilanandan",F1000Res,https://www.ncbi.nlm.nih.gov/pubmed/33110499/; https://doi.org/10.12688/f1000research.25384.1,426
630024,Artificial Intelligence-Empowered Mobilization of Assessments in COVID-19-like Pandemics: A Case Study for Early Flattening of the Curve,2020-05-14,"The design of alpha-helical tectons for self-assembly is maturing as a science. We have now reached the point where many different coiled-coil topologies can be reliably produced and validated in synthetic systems and the field is now moving on towards more complex, discrete structures and applications. Similarly the design of infinite or fiber assemblies has also matured, with the creation fibers that have been modified or functionalized in a variety of ways. This chapter discusses the progress made in both of these areas as well as outlining the challenges still to come.","Bromley, Elizabeth H.C.; Channon, Kevin J.",Prog Mol Biol Transl Sci,https://api.elsevier.com/content/article/pii/B9780124159068000017; https://doi.org/10.1016/b978-0-12-415906-8.00001-7; https://www.sciencedirect.com/science/article/pii/B9780124159068000017; https://www.ncbi.nlm.nih.gov/pubmed/21999998/,426
630854,The Association between Health and Culture: The Perspective of Older Adult Hospital In-Patients in Israel,2021-06-16,"Background: Formyl peptide receptor 2 (FPR2) is involved in the pathogenesis of chronic inflammatory diseases, being activated either by pro-resolving or proinflammatory ligands. FPR2-associated signal transduction pathways result in phosphorylation of several proteins and in NADPH oxidase activation. We, herein, investigated molecular mechanisms underlying phosphorylation of heat shock protein 27 (HSP27), oxidative stress responsive kinase 1 (OSR1), and myristolated alanine-rich C-kinase substrate (MARCKS) elicited by the pro-resolving FPR2 agonists WKYMVm and annexin A1 (ANXA1). Methods: CaLu-6 cells or p22phox(Crispr/Cas9) double nickase CaLu-6 cells were incubated for 5 min with WKYMVm or ANXA1, in the presence or absence of NADPH oxidase inhibitors. Phosphorylation at specific serine residues of HSP27, OSR1, and MARCKS, as well as the respective upstream kinases activated by FPR2 stimulation was analysed. Results: Blockade of NADPH oxidase functions prevents WKYMVm- and ANXA1-induced HSP-27(Ser82), OSR1(Ser339) and MARCKS(Ser170) phosphorylation. Moreover, NADPH oxidase inhibitors prevent WKYMVm- and ANXA1-dependent activation of p38MAPK, PI3K and PKCδ, the kinases upstream to HSP-27, OSR1 and MARCKS, respectively. The same results were obtained in p22phox(Crispr/Cas9) cells. Conclusions: FPR2 shows an immunomodulatory role by regulating proinflammatory and anti-inflammatory activities and NADPH oxidase is a key regulator of inflammatory pathways. The activation of NADPH oxidase-dependent pro-resolving downstream signals suggests that FPR2 signalling and NADPH oxidase could represent novel targets for inflammation therapeutic intervention.","Ammendola, Rosario; Parisi, Melania; Esposito, Gabriella; Cattaneo, Fabio",Antioxidants (Basel),https://doi.org/10.3390/antiox10010134; https://www.ncbi.nlm.nih.gov/pubmed/33477989/,426
631286,A Statistical Model to Assess Risk for Supporting COVID-19 Quarantine Decisions,2021-08-31,"The COVID-19 pandemic and associated physical distancing restrictions have exacerbated social, economic and health disadvantage within our communities. With increases in mental health difficulties and family violence already being seen, there is concern that the risk of child maltreatment risk may also be increased. The current study aimed to explore the experience of the COVID-19 pandemic for families identified to be at risk of child maltreatment in Victoria, Australia. Understanding the experiences of the pandemic for families already at risk is essential in identifying how to best support vulnerable parents and young children during this challenging time. Interviews were conducted with 11 parents currently involved with Child Protection Services, and nine clinicians working within a child and family health services, supporting clients with child protection involvement. Parents and clinicians described a range of pandemic related stressors including employment and financial stress, worry about infection and changes to service access. In addition, parents with children in out of home care discussed decreased access to their children resulting from physical distancing restrictions. Parents and clinicians perceived the pandemic to be having a negative impact on parent mental health, parenting stress and isolation. Although parents raised minimal concerns about the impact of the pandemic on child well-being, clinicians expressed concerns about the rise in risk factors for child maltreatment. Parents discussed a range of coping strategies which they perceived to be helpful during the pandemic, and clinicians and parents described the need for additional mental health support and support to access basic needs. The study highlights the importance of ensuring at risk families have access to parenting and mental health support throughout the pandemic and the importance of ensuring children within at-risk families are sighted and their safety assessed.","Fogarty, Alison; Jones, Andi; Evans, Kirsty; O'Brien, Jacquie; Giallo, Rebecca",Health & social care in the community,https://www.ncbi.nlm.nih.gov/pubmed/34435399/; https://doi.org/10.1111/hsc.13555,426
631318,Assessing the Psychological Impacts of COVID-19 in Undergraduate Medical Students,2021-03-13,"Review of the literature and reported case series has not reported an increased risk of SARS-CoV-2 infection in heart transplant recipients. However, this population is at increased risk of a more severe infection with increased mortality because of age and the presence of multiple comorbid conditions There is no significant difference in presenting symptoms in transplant recipients as compared to nontransplant patients, although diarrhea has been reported to be more frequent in transplant patients, a common side effect of immunosuppressive medications. Standard preventive measures have been shown to be equally protective in heart transplant recipients. Risk factors for severe disease and mortality are similar in both transplant recipients and nontransplant patients and include older age and the presence of comorbidities hypertension being the most common. The SARS-CoV-2 infection did not increase the risk of transplant allograft rejection. Currently, there are no specific treatment recommendations for SARS-CoV-2 infection in transplant recipients. However, the International Society of Heart and Lung and Transplant has issued guidance on how to modulate immunosuppressive therapy during SARS-CoV-2 infection.","Shah, Jassim Zaheen; Elbdri, Salah; Patel, Ashfaq Ahmad; Badr, Amr Mohamed Hamed",Heart Views,https://doi.org/10.4103/heartviews.heartviews_155_20; https://www.ncbi.nlm.nih.gov/pubmed/33688415/,426
631829,Multi–Criteria–Decision–Analysis (MCDA) for the Horizon Scanning of Health Innovations an Application to COVID 19 Emergency,2020-10-26,"After a period of rapidly declining U.S. COVID-19 incidence during January-March 2021, increases occurred in several jurisdictions (1,2) despite the rapid rollout of a large-scale vaccination program. This increase coincided with the spread of more transmissible variants of SARS-CoV-2, the virus that causes COVID-19, including B.1.1.7 (1,3) and relaxation of COVID-19 prevention strategies such as those for businesses, large-scale gatherings, and educational activities. To provide long-term projections of potential trends in COVID-19 cases, hospitalizations, and deaths, COVID-19 Scenario Modeling Hub teams used a multiple-model approach comprising six models to assess the potential course of COVID-19 in the United States across four scenarios with different vaccination coverage rates and effectiveness estimates and strength and implementation of nonpharmaceutical interventions (NPIs) (public health policies, such as physical distancing and masking) over a 6-month period (April-September 2021) using data available through March 27, 2021 (4). Among the four scenarios, an accelerated decline in NPI adherence (which encapsulates NPI mandates and population behavior) was shown to undermine vaccination-related gains over the subsequent 2-3 months and, in combination with increased transmissibility of new variants, could lead to surges in cases, hospitalizations, and deaths. A sharp decline in cases was projected by July 2021, with a faster decline in the high-vaccination scenarios. High vaccination rates and compliance with public health prevention measures are essential to control the COVID-19 pandemic and to prevent surges in hospitalizations and deaths in the coming months.","Borchering, Rebecca K.; Viboud, Cécile; Howerton, Emily; Smith, Claire P.; Truelove, Shaun; Runge, Michael C.; Reich, Nicholas G.; Contamin, Lucie; Levander, John; Salerno, Jessica; van Panhuis, Wilbert; Kinsey, Matt; Tallaksen, Kate; Obrecht, R. Freddy; Asher, Laura; Costello, Cash; Kelbaugh, Michael; Wilson, Shelby; Shin, Lauren; Gallagher, Molly E.; Mullany, Luke C.; Rainwater-Lovett, Kaitlin; Lemaitre, Joseph C.; Dent, Juan; Grantz, Kyra H.; Kaminsky, Joshua; Lauer, Stephen A.; Lee, Elizabeth C.; Meredith, Hannah R.; Perez-Saez, Javier; Keegan, Lindsay T.; Karlen, Dean; Chinazzi, Matteo; Davis, Jessica T.; Mu, Kunpeng; Xiong, Xinyue; Pastore y Piontti, Ana; Vespignani, Alessandro; Srivastava, Ajitesh; Porebski, Przemyslaw; Venkatramanan, Srinivasan; Adiga, Aniruddha; Lewis, Bryan; Klahn, Brian; Outten, Joseph; Schlitt, James; Corbett, Patrick; Telionis, Pyrros Alexander; Wang, Lijing; Peddireddy, Akhil Sai; Hurt, Benjamin; Chen, Jiangzhuo; Vullikanti, Anil; Marathe, Madhav; Healy, Jessica M.; Slayton, Rachel B.; Biggerstaff, Matthew; Johansson, Michael A.; Shea, Katriona; Lessler, Justin",MMWR Morb Mortal Wkly Rep,https://doi.org/10.15585/mmwr.mm7019e3; https://www.ncbi.nlm.nih.gov/pubmed/33988185/,426
631934,Analysis of Stress Factors for Female Professors at Online Universities,2020-04-24,"Objective: To analyze the efficacy of Hydroxychloroquine (HCQ) plus standard of care (SOC) compared with SOC alone in reducing disease progression in Mild COVID-19 Design: A single centre, open label randomized controlled trial Place and Duration: Pulmonology department, Pak emirates Military Hospital (PEMH) from 10 April 2020 to 31 May 2020. Methodology: Five hundred patients of both genders having age between 18-50 years who were PCR positive and had Mild COVID-19 were selected. Patients assigned to standard dose of HCQ (400mg 12 hourly day 1 then 200mg 12 hrly for next 4 days) plus SOC were 349 while 151 patients received SOC comprising of Vit C, Vit D, and Zinc only (control group). Primary outcome was progression of disease while secondary outcome was PCR negativity on day 7 and 14. The results were analyzed on SPSS version 23. P value <0.05 was considered significant. Results: Median age of intervention group (34 + 11.778 years) and control group (34 + 9.813 years). Disease progressed in 16 patients, 11 (3.15%) were in intervention group as compared to 5 (3.35%) in control group, (p value = 0.865). PCR negativity in intervention and control groups were (day 7, 182 (52.1%) vs. 54 (35.7%) (p value = 0.001), (day 14, 244 (69.9%) vs. 110 (72.8%) (p value = 0.508). Consecutive PCR negativity at day 7 and 14 was observed in 240 (68.8%) in intervention group compared to 108 (71.5%) in control group. (p value = 0.231). Conclusion: Addition of HCQ to standard of care treatment in Mild COVID-19 neither prevents disease progression nor is it significantly associated with successive PCR negativity on day 7 and 14.","kamran, s. m.; Mirza, Z. e. H.; Naseem, A.; Saeed, F.; Azam, R.; Ullah, N.; Ahmad, W.; Saleem, S.",,http://medrxiv.org/cgi/content/short/2020.07.30.20165365v1?rss=1; https://doi.org/10.1101/2020.07.30.20165365,426
632083,Prevalence of Psychological Impacts on Healthcare Providers during COVID-19 Pandemic in Asia,2021-08-30,,,hautnah,https://doi.org/10.1007/s12326-020-00412-8,426
632119,Differential Impacts of Multimorbidity on COVID-19 Severity across the Socioeconomic Ladder in Hong Kong: A Syndemic Perspective,2021-08-02,"Macrodomains, enzymes that remove ADP-ribose from proteins, are encoded by several families of RNA viruses and have recently been shown to counter innate immune responses to virus infection. ADP-ribose is covalently attached to target proteins by poly-ADP-ribose polymerases (PARPs), using nicotinamide adenine dinucleotide (NAD+) as a substrate. This modification can have a wide variety of effects on proteins including alteration of enzyme activity, protein–protein interactions, and protein stability. Several PARPs are induced by interferon (IFN) and are known to have antiviral properties, implicating ADP-ribosylation in the host defense response and suggesting that viral macrodomains may counter this response. Recent studies have demonstrated that viral macrodomains do counter the innate immune response by interfering with PARP-mediated antiviral defenses, stress granule formation, and pro-inflammatory cytokine production. Here, we will describe the known functions of the viral macrodomains and review recent literature demonstrating their roles in countering PARP-mediated antiviral responses.","Alhammad, Yousef M. O.; Fehr, Anthony R.",Viruses,https://www.ncbi.nlm.nih.gov/pubmed/32244383/; https://doi.org/10.3390/v12040384,426
632736,A Preliminary Evaluation of the Public Risk Perception Related to the COVID-19 Health Emergency in Italy,2020-04-27,[Figure: see text].,"Swanson, Phillip A; Padilla, Marcelino; Hoyland, Wesley; McGlinchey, Kelly; Fields, Paul A; Bibi, Sagida; Faust, Saul N; McDermott, Adrian B; Lambe, Teresa; Pollard, Andrew J; Durham, Nicholas M; Kelly, Elizabeth J; Adlou, Syed; Aley, Parvinder K; Angus, Brian; Anslow, Rachel; Baker, Philip; Bansal, Himanshu; Beveridge, Amy; Bridges-Webb, Alice; Ching, Steven; Cicconi, Paola; Clutterbuck, Elizabeth A; Collins, Andrea M; Darton, Thomas C; Demissie, Tesfaye; Dinesh, Tanya; Douglas, Alexander D; Duncan, Christopher J A; Ewer, Katie J; Felle, Sally; Ferreira, Daniela M; Folegatti, Pedro M; Fuskova, Michelle; Gaudinski, Martin; Gilbert, Sarah C; Goodman, Anna L; Gordon, Ingelise; Green, Christopher A; Harbolick, Elizabeth; Hayes, Susana; Hill, Adrian V S; Hill, Helen; Jenkin, Daniel; Jepson, Brett M; Kasanyinga, Mwila; Libri, Vincenzo; Lillie, Patrick J; McGregor, Alastair C; Minassian, Angela M",Sci Transl Med,https://doi.org/10.1126/scitranslmed.abj7211; https://www.ncbi.nlm.nih.gov/pubmed/34591596/,426
633160,Comparing the Scope and Efficacy of COVID-19 Response Strategies in 16 Countries: An Overview,2020-12-16,"Acute respiratory illnesses (ARIs) with unconfirmed infectious aetiologies peak at different times of the year. Molecular diagnostic assays reduce the number of unconfirmed ARIs compared to serology- or culture-based techniques. Screening of 888 inpatient and outpatient respiratory specimens spanning late autumn through to early spring, 2004, identified the presence of a human coronavirus (HCoV) on 74 occasions (8.3% of all specimens and 26.3% of all respiratory virus detections). Prevalence peaked in August (late winter in the southern hemisphere) when they were detected in 21.9% of specimens tested. HCoV-HKU1 and HCoV-OC43 comprised 82.4% of all HCoVs detected. Positive specimens were used to develop novel reverse transcriptase real-time PCRs (RT-rtPCRs) for HCoV detection. An objective clinical severity score was assigned to each positive HCoV patient. Severity scores were similar to those from a random selection of young children who were positive for respiratory syncytial virus at a different time but from the same specimen population. During the cooler months of 2004, sensitive and specific RT-rtPCRs identified the concurrent circulation of all four HCoVs, a quarter of which co-occurred with another virus and most of which were from children under the age of two years.","Mackay, Ian M.; Arden, Katherine E.; Speicher, David J.; O’Neil, Nicholas T.; McErlean, Peter K.; Greer, Ristan M.; Nissen, Michael D.; Sloots, Theo P.",Viruses,https://doi.org/10.3390/v4040637; https://www.ncbi.nlm.nih.gov/pubmed/22590689/,426
634353,The Shirom-Melamed Vigor Measure for Students: Factorial Analysis and Construct Validity in Spanish Undergraduate University Students,2020-12-21,"Emergency department (ED) boarding is an indicator of less efficient hospital flow and is associated with longer inpatient length of stay, higher readmission rates and increased risk of mortality and medical errors. In addition to being associated with poor patient and staff satisfaction. This article describes the efforts of six tertiary care governmental hospitals in the Kingdom of Saudi Arabia that have enrolled in a collaborative improvement project to reduce ED boarding time. The hospitals implemented a multifaceted system intervention that included forming multidisciplinary flow improvement teams, implementing the National Health Service (NHS) SAFER patient flow bundle, visual management system and multidisciplinary ED bed huddles. By the end of the project, all hospitals significantly reduced ED boarding time with a pooled mean difference of – 7.1 hours (16.6 before, 9.5 hours after, p<0.001), reaching a pooled average of 2 hours in March 2020. Furthermore, by the end of the third learning session, all hospitals were able to achieve a boarding time below 6 hours. The enrolled hospitals also experienced an improvement in hospital flow process measures without any increase in 30-day readmission rates or bed occupancy rates. Our project demonstrates that implementing multifaceted system-wide interventions improves hospital flow and ED boarding time. Additionally, our project demonstrates a significant correlation between improvements in ED boarding time, daily consultant-led rounds and early discharge from inpatient units and time till discharge.","Alotaibi, Yasser; Alnowaiser, Noura; Alamry, Ahmed",BMJ Open Qual,https://doi.org/10.1136/bmjoq-2021-001505; https://www.ncbi.nlm.nih.gov/pubmed/34583936/,426
634595,Post-COVID-19 Syndrome and the Potential Benefits of Exercise,2021-05-17,"Adipose cell-free derivatives have been recently gaining attention as potential therapeutic agents for various human diseases. In this context, mesenchymal stromal/stem cells (MSCs), adipocyte mesenchymal stem cells (Ad-MSCs) and adipose-derived stem cells (ADSC) possessing potent immunomodulatory activities are proposed as a therapeutic option for the treatment of coronavirus disease 2019 (COVID-19). The COVID-19 represents a global concern of public health caused by severe acute respiratory syndrome coronavirus 2 (SARS-CoV-2) in which there is not actually any specific therapy. MSCs exert an immunomodulation effect due to the secretion of endogenous factors, such as vascular endothelial growth factor (VEGF), insulin growth factor (IGF), and nerve growth factor (NGF), transforming growth factor (TGF)-β and growth differentiation factor (GDF)-11. Recent reports are promising for further studies and clinical applications of ADSCs and Ad-MSCs in COVID-19 patients. Experimental and clinical studies are exploring the therapeutic potential of both MSCs and derived-exosomes in moderating the morbidity and mortality of COVID-19. In this field, more preclinical and clinical studies are warranted to find an effective treatment for the patients suffering from COVID-19 infection.","Mazini, Loubna; Rochette, Luc; Malka, Gabriel",J Transl Med,https://doi.org/10.1186/s12967-021-02884-5; https://www.ncbi.nlm.nih.gov/pubmed/34059065/,426
634978,Dental Health Services Response to COVID-19 in Norway,2020-08-12,"Traditionally, biochemical studies are performed in dilute homogenous solutions, which are very different from the dense mixture of molecules found in cells. Thus, the physiological relevance of these studies is in question. This recognition motivated scientists to formulate the effect of crowded solutions in general, and excluded volume in particular, on biochemical processes. Using polymers or proteins as crowders, it was shown that while crowding tends to significantly enhance the formation of complexes containing many subunits, dimerizations are only mildly affected. Computer simulations, together with experimental evidence, indicate soft interactions and diffusion as critical factors that operate in a concerted manner with excluded volume to modulate protein binding. Yet, these approaches do not truly mimic the cellular environment. In vivo studies may overcome this shortfall. The few studies conducted thus far suggest that in cells, binding and folding occur at rates close to those determined in dilute solutions. Obtaining quantitative biochemical information on reactions inside living cells is currently a main challenge of the field, as the complexity of the intracellular milieu was what motivated crowding research to begin with.","Phillip, Yael; Schreiber, Gideon",FEBS Lett,https://www.ncbi.nlm.nih.gov/pubmed/23337873/; https://www.sciencedirect.com/science/article/pii/S0014579313000264; https://doi.org/10.1016/j.febslet.2013.01.007; https://api.elsevier.com/content/article/pii/S0014579313000264,426
635035,Hospital and Population-Based Evidence for COVID-19 Early Circulation in the East of France,2020-09-30,"Minority groups continue to suffer disproportionately from COVID-19's impact, with Blacks and Hispanics three times more likely to die from the disease than their White counterparts. The COVID-19 vaccine roll out has the potential to provide relief to these most adversely impacted communities. However, historic mistrust within racial minority communities threatens to derail the effective implementation of a vaccination program. The origin of this mistrust is multifactorial. Current day experience with structural racism and research abuses like Tuskegee Study collectively influence our perception of biased healthcare system. We outline issues and propose solutions that must be addressed to achieve a successful vaccination agenda. Mishandling of public expectations at any point may lead to an avalanche of vaccine opposition which might be unrecoverable.","Kirksey, Lee; Sorour, Ahmed A.; Modlin, Charles",J Natl Med Assoc,https://api.elsevier.com/content/article/pii/S0027968421000018; https://www.ncbi.nlm.nih.gov/pubmed/33608084/; https://www.sciencedirect.com/science/article/pii/S0027968421000018; https://doi.org/10.1016/j.jnma.2021.01.001,426
635218,Connected at Sea: The Influence of the Internet and Online Communication on the Well-Being and Life Satisfaction of Cruise Ship Employees,2020-04-20,"Pneumonia is one of the most common infections in the pediatric age group and one of the leading diagnoses that results in overnight hospital admission for children. Various micro-organisms can cause pneumonia, and etiologies differ by age. Clinical manifestations vary, and diagnostic testing is frequently not standardized. Hospital management should emphasize timely diagnosis and prompt initiation of antimicrobial therapy when appropriate. Issues of particular relevance to inpatient management are emphasized in this article.","Sandora, Thomas J.; Harper, Marvin B.",Pediatr Clin North Am,https://api.elsevier.com/content/article/pii/S0031395505000672; https://www.ncbi.nlm.nih.gov/pubmed/16009257/; https://www.sciencedirect.com/science/article/pii/S0031395505000672,426
