,title_x,publish_time_x,abstract,authors,journal,url,category
278356,Molecular features of IGHV3-53-encoded antibodies elicited by SARS-CoV-2,2020,"In the era of big data transformation, with the emergence of COVID-19, tourism has been given more social responsibilities Tourism construction in the Yellow River Basin is an indispensable part of tourism construction in China This paper analyzes the existing eco-tourism resources in Kaifeng City and Shandong Province, as well as the necessity and construction conditions of developing tourism In this paper, principal component analysis is used to analyze the resource conditions, regional conditions and environmental conditions of the Yellow River tourism resources The comprehensive evaluation model and index system of tourism resources are constructed Big data transformation has been realized The purpose of this paper is to clarify the current situation and potential of tourism in the Yellow River Basin, and to provide reference for the development of tourism in the Yellow River Basin during COVID-19 © 2020 - IOS Press and the authors All rights reserved","Wang, Z.",Journal of Intelligent and Fuzzy Systems,,637
283491,Immunological surrogate endpoints of COVID-2019 vaccines: the evidence we have versus the evidence we need,2021,"Introduction: On February 19, 2020, the first confirmed case of Coronavirus disease 2019, known as COVID-19, was identified in Iran The disease spread rapidly throughout the country Some of the cases were asymptomatic, some had mild to severe symptoms, and some of them died Transplant patients are highly at risk due to long-term immunosuppressive therapy, and precise treatment approaches are needed to not only cure the disease but also protect graft function Case Presentation: This study reports two kidney transplant patients with COVID-19 pneumonia, both of whom showed respiratory and gastrointestinal symptoms High cyclosporine and tacrolimus trough levels were observed despite initial dose reduction After a treatment program containing reduced immunosuppressant dose and the addition of pulsatile hydrocortisone, these patients recovered effectively We also discuss the importance of drug-drug interactions related to COVID-19 treatment protocol medications, especially with immunosuppressants in these patients Conclusion: In conclusion, frequent monitoring of the trough levels of calcineurin and mammalian target of rapamycin inhibitors during hospitalization is recommended It helps to determine the ideal treatment and prevent serious clinical toxicity","Khamas, S. S.; Ramezanzadeh, E.; Jafari, A.",Iranian Red Crescent Medical Journal,,637
295887,Salvianolic acid C potently inhibits SARS-CoV-2 infection by blocking the formation of six-helix bundle core of spike protein,2020,"Due to their immunomodulatory potential and release of trophic factors that promote healing, mesenchymal stromal cells (MSCs) are considered important players in tissue homeostasis and regeneration. MSCs have been widely used in clinical trials to treat multiple conditions associated with inflammation and tissue damage. Recent evidence suggests that most of the MSC therapeutic effects are derived from their secretome, including the extracellular vesicles, representing a promising approach in regenerative medicine application to treat organ failure as a result of inflammation/fibrosis. The recent outbreak of respiratory syndrome coronavirus, caused by the newly identified agent severe acute respiratory syndrome coronavirus 2 (SARS-CoV-2), has forced scientists worldwide to use all available instruments to fight the infection, including the inflammatory cascade caused by this pandemic disease. The use of MSCs is a valid approach to combat organ inflammation in different compartments. In addition to the lungs, which are considered the main inflammatory target for this virus, other organs are compromised by the infection. In particular, the liver is involved in the inflammatory response to SARS-CoV-2 infection, which causes organ failure, leading to death in coronavirus disease 2019 (COVID-19) patients. We herein summarize the current implications derived from the use of MSCs and their soluble derivatives in COVID-19 treatment, and emphasize the potential of MSC-based therapy in this clinical setting.","Chinnici, Cinzia Maria; Russelli, Giovanna; Bulati, Matteo; Miceli, Vitale; Gallo, Alessia; Busà, Rosalia; Tinnirello, Rosaria; Conaldi, Pier Giulio; Iannolo, Gioacchin",World J Gastroenterol,,637
297679,Newly synthesized Mpro inhibitors as potential oral anti-SARS-CoV-2 agents,2021,"COVID-19 has had far-reaching global effects on the health and wellbeing of individuals on every continent. The economic and financial market response has been equally disastrous with high levels of volatility observed. This study explores the temporal relations between structural breaks, market volatility and government stay-at-home policy interventions and social distancing measures for 28 countries and their respective indices. We present results which indicate the establishment of stay-at-home policies influence sharp discontinuities in 15 of 28 markets (53.57 %) and increase market efficiency in 30 of 49 cases observed (61.22 %). These results indicate a small, statistically significant degree of stabilization in international financial markets responding to government stay-at-home policies and social distancing measures, a promising result for political actors concerned with economic performance during the public health response to the coronavirus 2019 pandemic.","Bickley, Steve J.; Brumpton, Martin Chan Ho Fai Colthurst Richard Torgler Benno",Research in International Business and Finance,,637
297680,Newly synthesized Mpro inhibitors as potential oral anti-SARS-CoV-2 agents,2021,"Coronavirus disease 2019 (COVID-19) is an ongoing global pandemic with very limited specific treatments To fight COVID-19, various traditional antiviral medicines havebeen prescribed in China to infected patients with mild to moderate symptoms and received unexpected success in controlling the disease However, the molecular mechanisms of how these herbal medicines interact with the virus have remained elusive It is well known that the main protease (Mpro) of SARS-CoV-2 plays an important role in maturation of many viral proteins such as the RNA-dependent RNA polymerase Here,we explore the underlying molecular mechanisms of the computationally determined tocandidateâ€“rutin, a key component in many traditional antiviral medicines such as Lianhuaqinwen and Shuanghuanlian, for inhibiting the viral targetâ€“Mpro Using in silico methods (docking and molecular dynamics simulations), we revealed the dynamics and energetics of rutin when interacting with the Mpro of SARS-CoV-2, suggesting that the highly hydrophilic rutin molecule can be bound inside the Mproâ€™ pocket (active site) and possibly inhibit its biological functions In addition, we optimized the structure of rutin and designed a more hydrophobic analog which satisfies the rule of five for western medicines and demonstrated that it possesses a much stronger binding affinity to the SARS-COV-2â€™s Mpro br /div","Tien, Huynh Haoran Wang Wendy Cornell Binquan Luan",,,637
306996,Mutation D614G increases SARS-CoV-2 transmission,2021,,"Giustiniano, Enrico; Padua, Eleonora; Negri, Katerina; Bragato, Renato Maria; Cecconi, Maurizio",J. Am. Soc. Echocardiogr,,637
306997,Mutation D614G increases SARS-CoV-2 transmission,2021,,"Giustiniano, Enrico; Padua, Eleonora; Negri, Katerina; Bragato, Renato Maria; Cecconi, Maurizio",J Am Soc Echocardiogr,,637
310895,"Door to the cell for COVID-19 opened, leading way to therapies",2020,"Coronavirus disease 2019 (COVID-19) caused by severe acute respiratory syndrome coronavirus 2 (SARS-CoV-2) has become a worldwide pandemic since it emerged in December 2019. Previous studies have reported rapid antibody response to SARS-CoV-2 in the first 2 to 3 weeks after symptom onset. Here, we retrospectively described the dynamic changes of serum immunoglobulin M (IgM) and IgG specifically against SARS-CoV-2 in later weeks (mainly 4-10 weeks) in 97 hospitalized patients with COVID-19. We observed that serum IgM and IgG, especially in patients with moderate-to-high levels, declined significantly between week 4 to 10 after illness onset. Notably, IgG levels in high percentage of patients (77.5%, 31 of 40) rapidly declined by half, from 212.5 (range, 163.7-420.3) to 96.3 (range, 75.0-133.4) AU/mL, within 1 to 2 weeks in the second month and then sustained at around 100 AU/mL until discharge from hospital. Significant reduction of IgM was also observed as SARS-CoV-2 nucleic acid turned negative (P = .002). In the recovery stage, serum IgG declined significantly (early vs late recovery stage, n = 16, P = .003) with a median reduction of 50.0% (range, 3.7%-77.0%). Our results suggested that the decline of IgM may be an indicator of virus clearance and recovered patients may have a robust immunity against reinfection within at least 3 months after illness onset. Yet, the rapid reduction of IgG by half rises serious concerns on the robustness and sustainability of the humoral immune response in the period after discharge, which is crucial for immunity strategy and developing a vaccine.","Zhou, Wei; Xu, Xiaomao; Chang, Zhigang; Wang, He; Zhong, Xuefeng; Tong, Xunliang; Liu, Taotao; Li, Yanming",J. med. virol,,637
310896,"Door to the cell for COVID-19 opened, leading way to therapies",2020,"Coronavirus disease 2019 (COVID-19) caused by severe acute respiratory syndrome coronavirus 2 (SARS-CoV-2) has become a worldwide pandemic since it emerged in December 2019. Previous studies have reported rapid antibody response to SARS-CoV-2 in the first 2 to 3 weeks after symptom onset. Here, we retrospectively described the dynamic changes of serum immunoglobulin M (IgM) and IgG specifically against SARS-CoV-2 in later weeks (mainly 4-10 weeks) in 97 hospitalized patients with COVID-19. We observed that serum IgM and IgG, especially in patients with moderate-to-high levels, declined significantly between week 4 to 10 after illness onset. Notably, IgG levels in high percentage of patients (77.5%, 31 of 40) rapidly declined by half, from 212.5 (range, 163.7-420.3) to 96.3 (range, 75.0-133.4) AU/mL, within 1 to 2 weeks in the second month and then sustained at around 100 AU/mL until discharge from hospital. Significant reduction of IgM was also observed as SARS-CoV-2 nucleic acid turned negative (P = .002). In the recovery stage, serum IgG declined significantly (early vs late recovery stage, n = 16, P = .003) with a median reduction of 50.0% (range, 3.7%-77.0%). Our results suggested that the decline of IgM may be an indicator of virus clearance and recovered patients may have a robust immunity against reinfection within at least 3 months after illness onset. Yet, the rapid reduction of IgG by half rises serious concerns on the robustness and sustainability of the humoral immune response in the period after discharge, which is crucial for immunity strategy and developing a vaccine.","Zhou, Wei; Xu, Xiaomao; Chang, Zhigang; Wang, He; Zhong, Xuefeng; Tong, Xunliang; Liu, Taotao; Li, Yanming",J. med. virol,,637
312432,Clinical evidence of an interferon-glucocorticoid therapeutic synergy in COVID-19,2021,"The public authorities' reaction to the covid-19 epidemic has led to a staggering set of legal acts, some of arguable lawfulness The prohibition of the public use of beaches was one of the cases in which public health emergency led to contradictory and legally questionable decisions Although the State chose not to ban the public use of the beaches, municipalities decided otherwise Without questioning what would have been the best choice - to ban or not to ban - the antinomy of those administrative measures requires the determination of which administrative body has the legal power to make that prohibitive decision","Pação, Jorge",e-Pública: Revista Eletrónica de Direito Público,,637
312433,Clinical evidence of an interferon-glucocorticoid therapeutic synergy in COVID-19,2021,,"Jaffe, Susan",Lancet,,637
314417,COVID-19: immunopathogenesis and Immunotherapeutics,2020,"Coronavirus vaccines have made their debut. Now, allocation practices have stepped into the spotlight. Following Centers for Disease Control and Prevention guidelines, states and healthcare institutions initially prioritised healthcare personnel and elderly residents of congregant facilities; other groups at elevated risk for severe complications are now becoming eligible through locally administered programmes. The question remains, however: who else should be prioritised for immunisation? Here, we call attention to individuals institutionalised with severe mental illnesses and/or developmental or intellectual disabilities-a group highly susceptible to the damages of COVID-19, recent research shows, and critical to consider for priority vaccination. The language describing both federal-level and state-level intentions for this population remains largely vague, despite the population's diversity across age, diagnosis, functional status and living arrangement. Such absence of specificity, in turn, leaves room for confusion and even neglect of various subgroups. We review data stressing this group's vulnerability, as well as select state plans for priority vaccination, highlighting the importance of clarity when describing intentions to vaccinate, or even generally care for, diverse populations composed of distinct subgroups in need.","Shevzov-Zebrun, Nina; Caplan, Arthur L",J. med. ethics,,637
324068,Human recombinant soluble ACE2 (hrsACE2) shows promise for treating severe COVID-19,2020,"We evaluate the economic impact of the Wuhan coronavirus, a massive infectious and contagious disease, on Chinaâ€™s economic performance To do so, we develoa","Ruiz Estrada, Mario Arturo Park Donghyun Koutronas Evangelos Khan Alam Tahir Muhammad",,,637
334578,A core-shell structured COVID-19 mRNA vaccine with favorable biodistribution pattern and promising immunity,2021,"Cystic fibrosis (CF) is an inherited disorder caused by mutations in the gene encoding for the cystic fibrosis transmembrane conductance regulator (CFTR) protein, an ATP-gated chloride channel expressed on the apical surface of airway epithelial cells. CFTR absence/dysfunction results in defective ion transport and subsequent airway surface liquid dehydration that severely compromise the airway microenvironment. Noxious agents and pathogens are entrapped inside the abnormally thick mucus layer and establish a highly inflammatory environment, ultimately leading to lung damage. Since chronic airway inflammation plays a crucial role in CF pathophysiology, several studies have investigated the mechanisms responsible for the altered inflammatory/immune response that, in turn, exacerbates the epithelial dysfunction and infection susceptibility in CF patients. In this review, we address the evidence for a critical role of dysfunctional inflammation in lung damage in CF and discuss current therapeutic approaches targeting this condition, as well as potential new treatments that have been developed recently. Traditional therapeutic strategies have shown several limitations and limited clinical benefits. Therefore, many efforts have been made to develop alternative treatments and novel therapeutic approaches, and recent findings have identified new molecules as potential anti-inflammatory agents that may exert beneficial effects in CF patients. Furthermore, the potential anti-inflammatory properties of CFTR modulators, a class of drugs that directly target the molecular defect of CF, also will be critically reviewed. Finally, we also will discuss the possible impact of SARS-CoV-2 infection on CF patients, with a major focus on the consequences that the viral infection could have on the persistent inflammation in these patients.","Ghigo, Alessandra; Prono, Giulia; Riccardi, Elisa; De Rose, Virginia",Int. j. mol. sci. (Online),,637
340596,Therapeutic potential of C1632 by inhibition of SARS-CoV-2 replication and viral-induced inflammation through upregulating let-7,2021,"BACKGROUND: Little is known about the effect of the Coronavirus disease 2019 pandemic on stroke care and the impact of the epidemic on acute stroke hospitalizations has not been described. METHODS: We analyze the stroke admission rate in three hospitals in New York City from January 1, 2020 through April 17, 2020, identifying all cases of acute ischemic stroke, intraparenchymal hemorrhage and subarachnoid hemorrhage. RESULTS: We confirmed 518 cases of out-of-hospital stroke. During the baseline period up to February 25, 2020, the daily stroke admission rate was stable, with the slope of the regression describing the number of admissions over time equal to -0.33 (seâ¯=â¯1.21), not significantly different from 0 (pâ¯=â¯0.79), with daily admissions averaging 41. During the pandemic period, the slope was -4.4 (seâ¯=â¯1.00); i.e., the number of stroke admissions decreased an average of 4.4 per week, (pâ¯=â¯0.005), with weekly admissions averaging 23, a reduction of 44% versus baseline. This general result was not different by patient age, sex, or race/ethnicity. CONCLUSIONS: The weekly stroke admission rate started declining two weeks prior to the local surge of coronavirus admissions. The consequences of lack of diagnosis and treatment of a large proportion of acute stroke patients are likely severe and lasting.","Esenwa, Charles; Parides, Michael K; Labovitz, Daniel L",J Stroke Cerebrovasc Dis,,637
352500,Storm of soluble immune checkpoints associated with disease severity of COVID-19,2020,"Daily covid-19 cases are rising across Europe, but is that just because countries are performing more tests? Michael Le Page investigates","Le Page, Michael",New Scientist,,637
372108,"GSK-LSD1, an LSD1 inhibitor, quashes SARS-CoV-2-triggered cytokine release syndrome in-vitro",2020,"At the time of writing, the world population is suffering from more than 10,000 registered COVID-19 disease epidemic induced deaths since the outbreak of the Corona virus more than three months ago now officially known as SARS-CoV-2. Since, tremendous efforts have been made worldwide to counter-steer and control the epidemic by now labelled as pandemic. In this contribution, we provide an overview on the potential for computer audition (CA), i.e., the usage of speech and sound analysis by artificial intelligence to help in this scenario. We first survey which types of related or contextually significant phenomena can be automatically assessed from speech or sound. These include the automatic recognition and monitoring of breathing, dry and wet coughing or sneezing sounds, speech under cold, eating behaviour, sleepiness, or pain to name but a few. Then, we consider potential use-cases for exploitation. These include risk assessment and diagnosis based on symptom histograms and their development over time, as well as monitoring of spread, social distancing and its effects, treatment and recovery, and patient wellbeing. We quickly guide further through challenges that need to be faced for real-life usage. We come to the conclusion that CA appears ready for implementation of (pre-)diagnosis and monitoring tools, and more generally provides rich and significant, yet so far untapped potential in the fight against COVID-19 spread.","Schuller, Bjorn W.; Schuller, Dagmar M.; Qian, Kun; Liu, Juan; Zheng, Huaiyuan; Li, Xiao",,https://arxiv.org/pdf/2003.11117v1.pdf,637
372827,COVID-19: complexity of disease severity revealed by systemic and localized single cell immune atlas,2021,"Mothers of Japanese or South American ancestry living in the United States participated. Similarities and differences in mothers' social and didactic parenting behaviors and beliefs, and direct relations between behaviors and beliefs in these 2 domains of interaction, are reported. In accordance with a common collectivist orientation, Japanese American and South American mothers reported that they engaged in more social than didactic interactions with their infants, and South American mothers more than Japanese American mothers. However, in actuality, both of these acculturating groups engaged in more didactic than social behaviors with their infants and did so for longer periods of time. Not surprisingly, no belief-behavior relations emerged in either group.","Cote, Linda R; Bornstein, Marc H",Infancy,,637
372828,COVID-19: complexity of disease severity revealed by systemic and localized single cell immune atlas,2021,"This letter addresses the challenges for the dental radiology clinic in times of the COVID-19 pandemic. It highlights the use of teleradiography and mobile devices, as well as the proper care in disinfecting these equipments. As there are still no specific therapies for COVID-19, biosafety measures that promote containment and prevent the spread of the virus are crucial to stop the outbreak and control a possible new infectious peak.","Doriguêtto, Paulo Victor Teixeira; Americano, Julia Pereira; Devito, Karina Lopes",Oral Radiol,,637
382226,Berbamine inhibits SARS-CoV-2 infection by compromising TRPMLs-mediated endolysosomal trafficking of ACE2,2021,"Virtual learning has become the popular and adopted form of teaching due to the COVID-19 pandemic, including learning the parts of the human body. As we move through this pandemic and look into the future of medical education, anatomic virtual models have the potential to be a key educational tool in learning the unique engineering of the human body. In this project, we look into the making of an anatomical structure, the cerebellum, which is located at the base of the skull in the posterior cranial fossa. The cerebellum largely controls the coordination of voluntary movement sequences of the body. Computed tomography angiography (CTA) data and surface and volume rendering technology found in the Amira 5.6 software was used in the creation of a three-dimensional (3D) stereoscopic virtual model of the cerebellum. An outlining process was used for each CTA image that comprised the cerebellum;a total of 73 slices of CTA data were outlined. Each outline was made using the paintbrush, blow, and lasso tools found in Amira 5.6. To refine the selected areas, the paintbrush tool along with the coronal and sagittal views were employed. Each segmented slice was then stacked to create the surface of the cerebellum, generating the 3D stereoscopic model. A smoothing filter was also applied to correct human error. End results show a 3D stereoscopic cerebellum model that can be integrated at various angles and magnifications with orthoslice CTA data and project as a 3D stereoscopic presentation in a virtual environment with a dim light background. We find that the cerebellum stereoscopic model can serve as a virtual learning tool in a classroom setting and allow students to view the cerebellum in a 3D stereoscopic presentation in order to better grasp the spatial relationship of the cerebellum with other structures in the cranial vault. Three-dimensional stereoscopic presentations along with video clips created within Amira 5.6 can be used for online anatomical learning, which allows for different visual perspectives than the traditional two-dimensional presentations.","Patel, Niki Patel Shiv Cui Dongmei",The FASEB Journal,,637
382227,Berbamine inhibits SARS-CoV-2 infection by compromising TRPMLs-mediated endolysosomal trafficking of ACE2,2021,,"Mathur, Mahesh; Acharya, Prakash; Karki, Alina",Indian Dermatol Online J,,637
385868,The olfactory route is a potential way for SARS-CoV-2 to invade the central nervous system of rhesus monkeys,2021,"Literature on art education often emphasizes dialogue as a preferred approach and as a way of practicing democratic education in museums and galleries. Dialogue-based tours in such contexts are often characterized by a sense of harmony and agreement. In contrast, this article discusses the democratic aspect and political potentiality when dissensus and agonism are used as central educational strategies. The point of departure for the discussion was a teaching session on the online platform Zoom with student teachers as part of their module on art and crafts at the University of Agder in Kristiansand, Norway, in spring 2020. Artworks from the exhibition ""Dry Joy,"" in Sørlandet Art Museum, by Finnish photographer Iiu Susiraja, were the pivot point in the session. Before the lockdown caused by COVID-19, the exhibition caused intense debates. The strong reactions were particularly prevalent amongst parents whose children had witnessed the exhibition as part of a school trip. A central part of the teaching session was encouraging students to come up with and explore arguments both for and against exposure of school children to these images. This article aims to contribute to knowledge about how educational strategies that challenge consensus may enable democratic arenas beyond hegemony.","Skregelid, Lisbet",Education Sciences,,637
