,index,Unnamed: 0,title_x,x,y,publish_time_x,abstract,authors,journal,category,cluster
309873,309873,309873,"Health Care Utilization and Clinical Characteristics of Nonhospitalized Adults in an Integrated Health Care System 28-180 Days After COVID-19 Diagnosis - Georgia, May 2020-March 2021",22.132843,11.169542,2021,"The current changes in vehicle movement due to 'lockdown' conditions (imposed in cities worldwide in response to the COVID-19 epidemic) provide opportunities to quantify the local impact of 'controlled interventions' on air quality and establish baseline pollution concentrations in cities. Here, we present a case study from Auckland, New Zealand, an isolated Southern Hemisphere city, which is largely unaffected by long-range pollution transport or industrial sources of air pollution. In this city, traffic flows reduced by 60-80% as a result of a government-led initiative to contain the virus by limiting all transport to only essential services. In this paper, ambient pollutant concentrations of NO2, O3, BC, PM2.5, and PM10 are compared between the lockdown period and comparable periods in the historical air pollution record, while taking into account changes in the local meteorology. We show that this 'natural experiment' in source emission reductions had significant but non-linear impacts on air quality. While emission inventories and receptor modelling approaches confirm the dominance of traffic sources for NOx (86%), and BC (72%) across the city, observations suggest a consequent reduction in NO2 of only 34-57% and a reduction in BC of 55-75%. The observed reductions in PM2.5 (still likely to be dominated by traffic emissions), and PM10 (dominated by sea salt, traffic emissions to a lesser extent, and affected by seasonality) were found to be significantly less (8-17% for PM2.5 and 7-20% for PM10). The impact of this unplanned controlled intervention shows the importance of establishing accurate, local-scale emission inventories, and the potential of the local atmospheric chemistry and meteorology in limiting their accuracy.","Patel, Hamesh; Talbot, Nick; Salmond, Jennifer; Dirks, Kim; Xie, Shanju; Davy, Perry",Sci Total Environ,804,20
311301,311301,311301,"Potential Indirect Effects of the COVID-19 Pandemic on Use of Emergency Departments for Acute Life-Threatening Conditions - United States, January-May 2020",21.870245,11.133468,2020,"COVID 19 has highlighted with lethal force the need to re-imagine and re-design the provisioning of human resources for health, starting from the reality of our radical interdependence and concern for global health and justice. Starting from the structured health injustice suffered by migrant workers during the pandemic and its impact on the health of others in both destination and source countries, I argue here for re-structuring the system for educating and distributing care workers around what I call a global ecological ethic. Rather than rely on a system that privileges nationalism, that is unjust, and that sustains and even worsens injustice, including health injustice, and that has profound consequences for global health, a global ecological ethic would have us see health as interdependent and aim at ""ethical place-making"" across health ecosystems to enable people everywhere to have the capability to be healthy.","Eckenwiler, Lisa A",J Bioeth Inq,804,5
311303,311303,311303,"Potential Indirect Effects of the COVID-19 Pandemic on Use of Emergency Departments for Acute Life-Threatening Conditions - United States, January-May 2020",21.8589,11.200569,2020,"BACKGROUND: This survey was focused on the provision of neurointerventional services, the current practices of managing patients under COVID-19 conditions, and the expectations for the future. METHODS: Invitations for this survey were sent out as a collaborative effort of the European Society of Minimally Invasive Neurological Therapy (ESMINT), the Society of NeuroInterventional Surgery (SNIS), the Sociedad Iberolatinoamericana de Neuroradiologia Diagnostica y Terapeutica (SILAN), the Society of Vascular and Interventional Neurology (SVIN), and the World Federation of Interventional and Therapeutic Neuroradiology (WFITN). RESULTS: Overall, 475 participants from 61 countries responded (six from Africa (1%), 81 from Asia (17%), 156 from Europe (33%), 53 from Latin America (11%), and 172 from North America (11%)). The majority of participants (96%) reported being able to provide emergency services, though 26% of these reported limited resources. A decrease in emergency procedures was reported by 69% of participants (52% in ischemic and hemorrhagic stroke, 11% ischemic, and 6% hemorrhagic stroke alone). Only 4% reported an increase in emergency cases. The emerging need for social distancing and the rapid adoption of remote communication was reflected in the interest in establishing case discussion forums (43%), general online forums (37%), and access to angio video streaming for live mentoring and support (33%). CONCLUSION: Neurointerventional emergency services are available in almost all centers, while the number of emergency patients is markedly decreased. Half of the participants have abandoned neurointerventions in non-emergent situations. There are considerable variations in the management of neurointerventions and in the expectations for the future.","Fiehler, Jens; Brouwer, Patrick; Díaz, Carlos; Hirsch, Joshua A; Kulcsar, Zsolt; Liebeskind, David; Linfante, Italo; Lylyk, Pedro; Mack, William J; Milburn, James; Nogueira, Raul; Orbach, Darren B; Pumar, José Manuel Manuel; Tanaka, Michihiro; Taylor, Allan",J. neurointerv. surg. (Print),804,24
324328,324328,324328,"Exposures Before Issuance of Stay-at-Home Orders Among Persons with Laboratory-Confirmed COVID-19 - Colorado, March 2020",22.071888,11.301076,2020,"This article presents the results of a survey on yet under-researched aspects of remote learning and learning difficulties in higher education during the initial stage (March - June 2020) of the COVID-19 pandemic. A total of 2182 students from University of Warsaw in Poland completed a two-part questionnaire regarding academic achievements in the academic year 2019/2020, living conditions and stress related to learning and pandemic, as well as basic demographic information, and Dyslexia Diagnosis Questionnaire (DDQ). The analyses were carried out in three sub-groups of students: who self-reported having a formal diagnosis of dyslexia (CDYS), self-reported reading difficulties, but had no formal diagnosis of dyslexia (SIDYS), and who reported no reading difficulties (CON). The results of the survey revealed that compared with the CON group, more students from CDYS and SIDYS groups did not pass at least one exam in the summer semester. CDYS and SIDYS groups experienced higher stress due to epidemiological restrictions, they had more difficulties than CON with the organisation of learning and obtaining credit during the COVID-19 pandemic. The results indicate a need for special consideration of additional support for students experiencing reading difficulties (whether or not they have a formal diagnosis).","Zawadka, Joanna; Miekisz, Aneta; Nowakowska, Iwona; Plewko, Joanna; Kochanska, Magdalena; Haman, Ewa",Educ Inf Technol (Dordr),804,20
324329,324329,324329,"Exposures Before Issuance of Stay-at-Home Orders Among Persons with Laboratory-Confirmed COVID-19 — Colorado, March 2020",22.098013,11.122827,2020,"The enzyme ficin, abundantly found in the leaves of the common Fig (Ficus carica. L), is a cysteine protease of the plant endopeptidase family. In terms of activity, this enzyme mimics the activity of the papain enzyme. However, the enzyme is more acidic than papain and binds with higher efficiency to its substrate. Ficin is widely used in the food and pharmaceutical industry along with the medical diagnosis. To date, there are no available data on cloning and recombinant production of various isoforms of ficin. In the present study, after the cloning process and optimized expression of ficin in E. coli BL21, by means of the central composite design (CCD) and approach-based response surface methodology (RSM), the recombinant protein was purified using the Ni-sepharose column and gel filtration. The activity of ficin was determined by its ability to hydrolyze the bovine casein enzyme as a substrate. These results showed the presence of different isoforms of ficin in this cultivar that they are distinct in terms of DNA coding sequences. The optimum conditions for maximum production of the recombinant ficin enzyme in E. coli were as follows; a cell density of 1.25, post-induction time 7â¯h, 10% (w/v) lactose concentration, and shaking at 115â¯rpm at 24â¯°C. The concentration of purified product was reported to be 0.27â¯mg/ml. The optimization procedures increased the amounts of ficin production by approximately 3 folds (0.67â¯mg/ml) compared with the expiration level (in the absence of optimization). Also, our findings showed that the recombinant ficin was able to hydrolyze casein, denoting the functionality of the enzyme when used in-vitro. The pitfall of cutting-off the young branches of the common fig tree to purify the enzyme from the young shoots was successfully solved in this study.","Sattari, Farinaz; Rigi, Garshasb; Ghaedmohammadi, Samira",Int. j. biol. macromol,804,1
341475,341475,341475,"Mental Health, Substance Use, and Suicidal Ideation During the COVID-19 Pandemic - United States, June 24-30, 2020",22.073465,11.009825,2020,,"Usher, Kim; Ranmuthugala, Geetha; Maple, Myfanwy; Durkin, Joanne; Douglas, Lesley; Coffey, Yumiko; Bhullar, Navjot",Int. j. ment. health nurs,804,8
343030,343030,343030,"COVID-19 Stats: COVID-19 Incidence,* by Age Group - United States, March 1-November 14, 2020§",22.016178,11.219765,2021,,"Hakroush, Samy; Franz, Jonas; Larsen, Jörg; Korsten, Peter; Winkler, Martin Sebastian; Tampe, Björn",Ann. rheum. dis,804,20
343031,343031,343031,"COVID-19 Stats: COVID-19 Incidence,* by Age Group - United States, March 1-November 14, 2020§",21.901659,11.203693,2021,"Three new isopimarane-type diterpenoids, botrysphins G-I (1-3), a new muurolane-type sesquiterpenoid, 11,12-dihydroxylentideusether (4), and two new triketides, 4-dechlorobotrysphone C (5) and 4,5-dihydroxy-3-methoxy-6-undecanoyloxy-2-cyclohexen-1-one (6), together with one known diterpenoid, sphaeropsidin A (7), one sesquiterpenoid, lentideusether (8), and one triketide sphaeropsidone (9), were isolated from culture of the fungus Botrysphaeria laricina associated with the moss Rhodobryum umgiganteum. The structures of the new compounds were established on the basis of extensive spectroscopic techniques including HRMS and 1D and 2D NMR data. Compounds 1 and 2 exhibited NO inhibitory activity with IC50 values of 13.9â¯µM and 41.9â¯µM, respectively. At the same time, these two compounds showed quinone reductase inducing activity with 2.7-fold of induction for 1 at 12.5â¯µM and 1.6-fold for 2 at 25.0â¯µM.","Yang, Hu; Liu, Xiao-Yu; Zhang, Peng-Liang; Gao, Hui-Min; Zhang, Long-Teng; Shen, Tao; Ren, Dong-Mei; Lou, Hong-Xiang; Wang, Xiao-Ning",Fitoterapia,804,20
343032,343032,343032,"COVID-19 Stats: COVID-19 Incidence,* by Age Group - United States, March 1-November 14, 2020§",21.898447,11.297951,2021,"COVID-19 disrupted international tourism worldwide, subsequently presenting forecasters with a challenging conundrum In this competition, we predict international arrivals for 20 destinations in two phases: (i) Ex post forecasts pre-COVID;(ii) Ex ante forecasts during and after the pandemic up to end 2021 Our results show that univariate combined with cross-sectional hierarchical forecasting techniques (THieF-ETS) outperform multivariate models pre-COVID Scenarios were developed based on judgemental adjustment of the THieF-ETS baseline forecasts Analysts provided a regional view on the most likely path to normal, based on country-specific regulations, macroeconomic conditions, seasonal factors and vaccine development Results show an average recovery of 58% compared to 2019 tourist arrivals in the 20 destinations under the medium scenario;severe, it is 34% and mild, 80%","Kourentzes, Nikolaos Saayman Andrea Jean-Pierre Philippe Provenzano Davide Sahli Mondher Seetaram Neelu Volo Serena",Annals of Tourism Research,804,16
370872,370872,370872,"Early COVID-19 First-Dose Vaccination Coverage Among Residents and Staff Members of Skilled Nursing Facilities Participating in the Pharmacy Partnership for Long-Term Care Program - United States, December 2020-January 2021",21.884848,11.055323,2021,"Abstract Objectives Circulating antibodies are important markers of previous infection and immunity Questions remain with respect to the durability and functionality of SARS-CoV-2 antibodies This study explored antibody responses in recovered COVID-19 patients in a setting where the probability of re-exposure is effectively nil, owing to New Zealand's successful elimination strategy Methods A triplex bead-based assay that detects antibody isotype (IgG, IgM and IgA) and subclass (IgG1, IgG2, IgG3 and IgG4) responses against Nucleocapsid (N) protein, the receptor binding domain (RBD) and Spike (S) protein of SARS-CoV-2 was developed After establishing baseline levels with pre-pandemic control sera (n = 113), samples from PCR-confirmed COVID-19 patients with mild?moderate disease (n = 189) collected up to 8 months post-infection were examined The relationship between antigen-specific antibodies and neutralising antibodies (NAbs) was explored with a surrogate neutralisation assay that quantifies inhibition of the RBD/hACE-2 interaction Results While most individuals had broad isotype and subclass responses to each antigen shortly after infection, only RBD and S protein IgG, as well as NAbs, were relatively stable over the study period, with 99%, 96% and 90% of samples, respectively, having responses over baseline 4?8 months post-infection Anti-RBD antibodies were strongly correlated with NAbs at all time points (Pearson's r ≥ 0 87), and feasibility of using finger prick sampling to accurately measure anti-RBD IgG was demonstrated Conclusion Antibodies to SARS-CoV-2 persist for up to 8 months following mild-to-moderate infection This robust response can be attributed to the initial exposure without immune boosting given the lack of community transmission in our setting","Whitcombe, Alana L.; McGregor, Reuben Craigie Alyson James Alex Charlewood Richard Lorenz Natalie Dickson James M. J.; Sheen, Campbell R.; Koch, Barbara Fox-Lewis Shivani McAuliffe Gary Roberts Sally A.; Morpeth, Susan C.; Taylor, Susan Webb Rachel H.; Jack, Susan Upton Arlo Ussher James E.; Moreland, Nicole J.",Clinical &amp; Translational Immunology,804,1
372665,372665,372665,"Rapid Sentinel Surveillance for COVID-19 - Santa Clara County, California, March 2020",22.082726,11.386885,2020,,"Blazoski, C. M.; Baram, M.; Hirose, H.",American Journal of Respiratory and Critical Care Medicine,804,30
378683,378683,378683,"Multidisciplinary Community-Based Investigation of a COVID-19 Outbreak Among Marshallese and Hispanic/Latino Communities - Benton and Washington Counties, Arkansas, March-June 2020",22.112892,11.315028,2020,"INTRODUCTION: Acute kidney injury (AKI) is common in coronavirus disease 2019 (COVID-19). It is unknown if hospital-acquired AKI (HA-AKI) and community-acquired AKI (CA-AKI) convey a distinct prognosis. METHODS: The study aim was to evaluate the incidence and risk factors associated with both CA-AKI and HA-AKI. Consecutive patients hospitalized at a reference center for COVID-19 were included in this prospective cohort study. RESULTS: We registered 349 (30%) AKI episodes in 1,170 hospitalized patients, 224 (19%) corresponded to CA-AKI, and 125 (11%) to HA-AKI. Compared to patients with HA-AKI, subjects with CA-AKI were older (61 years [IQR 49-70] vs. 50 years [IQR 43-61]), had more comorbidities (hypertension [44 vs. 26%], CKD [10 vs. 3%]), higher Charlson Comorbidity Index (2 points [IQR 1-4] vs. 1 point [IQR 0-2]), and presented to the emergency department with more severe disease. Mortality rates were not different between CA-AKI and HA-AKI (119 [53%] vs. 63 [50%], p = 0.66). In multivariate analysis, CA-AKI was strongly associated to a history of CKD (OR 4.17, 95% CI 1.53-11.3), hypertension (OR 1.55, 95% CI 1.01-2.36), Charlson Comorbidity Index (OR 1.16, 95% CI 1.02-1.32), and SOFA score (OR 2.19, 95% CI 1.87-2.57). HA-AKI was associated with the requirement for mechanical ventilation (OR 68.2, 95% CI 37.1-126), elevated troponin I (OR 1.95, 95% CI 1.01-3.83), and glucose levels at admission (OR 1.05, 95% CI 1.02-1.08). DISCUSSION/CONCLUSIONS: CA-AKI and HA-AKI portend an adverse prognosis in CO-VID-19. Nevertheless, CA-AKI was associated with a higher comorbidity burden (including CKD and hypertension), while HA-AKI occurred in younger patients by the time severe multiorgan disease developed.","Martínez-Rueda, Armando J; Álvarez, Rigoberto D; Méndez-Pérez, R Angélica; Fernández-Camargo, Dheni A; Gaytan-Arocha, Jorge E; Berman-Parks, Nathan; Flores-Camargo, Areli; Comunidad-Bonilla, Roque A; Mejia-Vilet, Juan M; Arvizu-Hernandez, Mauricio; Ramirez-Sandoval, Juan C; Correa-Rotter, Ricardo; Vega-Vega, Olynka",Blood Purif,804,16
431011,431011,431011,"Effectiveness of the Pfizer-BioNTech COVID-19 Vaccine Among Residents of Two Skilled Nursing Facilities Experiencing COVID-19 Outbreaks - Connecticut, December 2020-February 2021",21.788498,11.120518,2021,,"Loucera, Carlos; Esteban-Medina, Marina; Rian, Kinza; Falco, Matías M; Dopazo, Joaquín; Peña-Chilet, María",Signal Transduct Target Ther,804,13
454476,454476,454476,"Demographic Characteristics of Persons Vaccinated During the First Month of the COVID-19 Vaccination Program - United States, December 14, 2020-January 14, 2021",22.078932,11.418866,2021,"Despite vaccination and antivirals, influenza remains a communicable disease of high burden, with limited therapeutic options available to patients that develop complications. Here, we report the development and preclinical characterization of Adipose Stromal Cell (ASC) concentrated secretome (CS), generated by process adaptable to current Good Manufacturing Practices (cGMP) standards. We demonstrate that ASC-CS limits pulmonary histopathological changes, infiltration of inflammatory cells, protein leak, water accumulation, and arterial oxygen saturation (spO2) reduction in murine model of lung infection with influenza A virus (IAV) when first administered six days post-infection. The ability to limit lung injury is sustained in ASC-CS preparations stored at -80 °C for three years. Priming of the ASC with inflammatory factors TNF&#945; and IFNÎ³ enhances ASC-CS ability to suppress lung injury. IAV infection is associated with dramatic increases in programmed cell death ligand (PDL1) and angiopoietin 2 (Angpt2) levels. ASC-CS application significantly reduces both PDL1 and Angpt2 levels. Neutralization of PDL1 with anti-mouse PDL1 antibody starting Day6 onward effectively ablates lung PDL1, but only non-significantly reduces Angpt2 release. Most importantly, late-phase PDL1 neutralization results in negligible suppression of protein leakage and inflammatory cell infiltration, suggesting that suppression of PDL1 does not play a critical role in ASC-CS therapeutic effects.","Bogatcheva, Natalia V; Coleman, Michael E",,804,1
467348,467348,467348,"Decreases in COVID-19 Cases, Emergency Department Visits, Hospital Admissions, and Deaths Among Older Adults Following the Introduction of COVID-19 Vaccine - United States, September 6, 2020-May 1, 2021",21.798105,11.366172,2021,,"Mittal, Saurabh; Madan, Karan; Mohan, Anant",Prim Care Diabetes,804,20
480107,480107,480107,"COVID-19 Stats: COVID-19* and Influenza Discharge Diagnoses as a Percentage of Emergency Department (ED) Visits,§ by Year - United States, June 2018-March 2021",22.250069,11.178251,2021,,"Miller, Craig S; Carlson, Charles R",Oral dis,804,1
480108,480108,480108,"COVID-19 Stats: COVID-19* and Influenza Discharge Diagnoses as a Percentage of Emergency Department (ED) Visits,§ by Year - United States, June 2018-March 2021",22.119068,11.1913,2021,,"Kelly, Kiersten",J Pediatr Rehabil Med,804,2
480109,480109,480109,"COVID-19 Stats: COVID-19* and Influenza Discharge Diagnoses as a Percentage of Emergency Department (ED) Visits,§ by Year - United States, June 2018-March 2021",22.035902,11.289128,2021,"OBJECTIVE: To identify cell types in the male and female reproductive systems at risk for SARS-CoV-2 infection because of the expression of host genes and proteins used by the virus for cell entry. DESIGN: Descriptive analysis of transcriptomic and proteomic data. SETTING: Academic research department and clinical diagnostic laboratory. PATIENT(S): Not applicable (focus was on previously generated gene and protein expression data). INTERVENTION(S): None. MAIN OUTCOME MEASURE(S): Identification of cell types coexpressing the key angiotensin-converting enzyme 2 (ACE2) and transmembrane serine protease 2 (TMPRSS2) genes and proteins as well as other candidates potentially involved in SARS-CoV-2 cell entry. RESULT(S): On the basis of single-cell RNA sequencing data, coexpression of ACE2 and TMPRSS2 was not detected in testicular cells, including sperm. A subpopulation of oocytes in nonhuman primate ovarian tissue was found to express ACE2 and TMPRSS2, but coexpression was not observed in ovarian somatic cells. RNA expression of TMPRSS2 in 18 samples of human cumulus cells was shown to be low or absent. There was general agreement between publicly available bulk RNA and protein datasets in terms of ACE2 and TMPRSS2 expression patterns in testis, ovary, endometrial, and placental cells. CONCLUSION(S): These analyses suggest that SARS-CoV-2 infection is unlikely to have long-term effects on male and female reproductive function. Although the results cannot be considered definitive, they imply that procedures in which oocytes are collected and fertilized in vitro are associated with very little risk of viral transmission from gametes to embryos and may indeed have the potential to minimize exposure of susceptible reproductive cell types to infection in comparison with natural conception.","Stanley, Kate E; Thomas, Elizabeth; Leaver, Megan; Wells, Dagan",Fertil Steril,804,16
503699,503699,503699,"Symptom Duration and Risk Factors for Delayed Return to Usual Health Among Outpatients with COVID-19 in a Multistate Health Care Systems Network - United States, March-June 2020",21.988695,11.049794,2020,"BackgroundLower respiratory tract (LRT) involvement, observed in about 20% of patients suffering from coronavirus disease 2019 (COVID-19) is associated with a more severe clinical course, adverse outcomes and long-term sequelae. Early identification of LRT involvement could facilitated targeted and timely interventions that could alter the short- and long-term disease outcomes. The LungPass is an automated lung sound analysis platform developed using neural network technology and previously trained. We hypothesised that the LungPass could be used as a screening tool for LRT involvement in patients with COVID-19. MethodsIn a prospective observational study involving 282 individuals with presenting in the emergency department with a strong clinical suspicion of COVID-19 and imaging findings consistent with COVID-19 LRT involvement (25.5% had concomitant hypoxia), and 32 healthy controls, we assessed the sensitivity and specificity of the LungPass in identifying LRT involvement in COVID-19. We also compared the auscultatory findings of the LungPass compared to a chest physician using a traditional, high-quality stethoscope. ResultsAmong individuals with COVID-19 LRT involvement, the LungPass identified crackles in at least one auscultation site in 93.6% and in two or more points in 84%. Moreover, the LungPass identified any abnormal lung sound (crackles or wheeze) in at least one auscultation site in 98.6% and in at least two points in 94% of the participants. The respective percentages for the respiratory physicians were lower. Considering the presence of any added abnormal sound (crackles or wheeze) in at least two auscultation points as evidence of LRT involvement, LungPass demonstrated a sensitivity of 98.6% (95% confidence intervals [CI]: 96.4%-99.6%) and a specificity of 96.9% (95% CI: 83.8%-99.9%) in identifying COVID-19 LRT involvement. ConclusionThis exploratory study suggests the LungPass is a sensitive and specific platform for identifying LRT involvement due to COVID-19, even before the development of hypoxia.","Lapteva, Elena A; Kharevich, Olga N; Khatsko, Victoria V.; Voronova, Natalia A.; Chamko, Maksim V.; Bezruchko, Irina V.; Katibnikova, Elena I; Loban, Elena I; Mouawie, Mostafa M; Binetskaya, Helena; Aleshkevich, Sergey; Karankevich, Aleksey; Dubinetski, Vitali; Vestbo, Joergen; Mathioudakis, Alexander G.",,804,29
513465,513465,513465,"Association of State-Issued Mask Mandates and Allowing On-Premises Restaurant Dining with County-Level COVID-19 Case and Death Growth Rates - United States, March 1-December 31, 2020",21.937906,11.385193,2021,,"Rodrigues, B.; Daoud, D.; Li, G.; Segraves, J.; Hemmersbach-Miller, M.; Loor, G.; Garcha, P.",Journal of Heart and Lung Transplantation,804,25
