,index,Unnamed: 0,title_x,x,y,publish_time_x,abstract,authors,journal,category,cluster
38502,38502,38502,Houd afstand,17.588856,14.826231,2020-09-04,,,Z Psychodrama Soziom,800,1
39898,39898,39898,Vraag het aan Google: Is de bedrijfsgeneeskunde ook klaar voor de verschuiving?,17.692709,14.684832,2020-10-02,"Crowd Sourced Software Development (CSSD) is becoming popular in software development industries due to reduced cost and efficiency. Many companies are moving towards crowdsourcing, and have already adopted Agile Software Development (ASD). However, CSSD differs from ASD in many ways due to its distributed nature. Although there is little research on the integration of these two approaches, whereas at the same time the combination of the two is advocated by some. It is deemed necessary to identify and resolve the issues emerged while integrating CSSD and ASD. This study hence intends to explore the issues emerged as a result of integrating agile and CSSD and propose a Crowd Agile model that will help in effective software development.","Qayyum, Shamaila; Imtiaz, Salma; Khan, Huma Hayyat",Agile Processes in Software Engineering and Extreme Programming - Workshops,800,4
43694,43694,43694,'Ik ben een bedrijfsarts met een hart voor publieke gezondheid',17.69522,14.824025,2021-01-15,"The propagation of coronavirus disease 2019 (COVID‐19) pandemic had resulted in a significant slowdown of economic activities worldwide. Teleworking practices and policies could play a significant and essential role of any business continuity plan in time of risk that prohibits employees from performing their working tasks at their regular workplace or offices. Hence, telework gives those employees the opportunity to perform their work tasks remotely and keep the organization operational. The aim of this study is to examine the impact of the COVID‐19 pandemic on promoting telework practices. This study discusses the transition to telework during the COVID‐19 pandemic and the continuity of teleworking practices after the pandemic. Furthermore, the study discusses what elements and interventions that are necessary to maximize the potential gains for more widespread telework for employers and employees. Adopting telework in this circumstance can reduce the negative impact of the pandemic and be a mitigating measure for the economy and inequality. This research is important because it analyses the benefits of implementing telework practices in a time of risk.","Abulibdeh, Ammar",,800,1
43698,43698,43698,Afscheid van het oude normaal,17.702152,14.888537,2021-01-15,"Peer support groups are groups of people who share something in common and use their experiences to help each other. As the pandemic persists and health care teams are adjusting to the changing circumstances, facilitating access to peer support groups that can hold meetings via a digital platform can provide a unique source of additional help for diabetes self‐management and mental wellbeing.","Sauchelli, Sarah",,800,1
46182,46182,46182,Van hybride werken naar activity based werken,17.610052,14.844102,2021-03-05,,,Rheuma Plus,800,26
54087,54087,54087,"Beroepsziekte, en toch behoud van werk",17.648863,14.7378645,2021-06-18,"Blood group antigens are inherited traits that may play a role in immune and inflammatory processes. We investigated associations between blood groups and circulating inflammation-related molecules in 3537 non-Hispanic white participants selected from the Prostate, Lung, Colorectal, and Ovarian Cancer Screening Trial. Whole-genome scans were used to infer blood types for 12 common antigen systems based on well-characterized single-nucleotide polymorphisms. Serum levels of 96 biomarkers were measured on multiplex fluorescent bead-based panels. We estimated marker associations with blood type using weighted linear or logistic regression models adjusted for age, sex, smoking status, and principal components of population substructure. Bonferroni correction was used to control for multiple comparisons, with two-sided p values < 0.05 considered statistically significant. Among the 1152 associations tested, 10 were statistically significant. Duffy blood type was associated with levels of CXCL6/GCP2, CXCL5/ENA78, CCL11/EOTAXIN, CXCL1/GRO, CCL2/MCP1, CCL13/MCP4, and CCL17/TARC, whereas ABO blood type was associated with levels of sVEGFR2, sVEGFR3, and sGP130. Post hoc pairwise t-tests showed that individuals with type Fy(a+b−) had the lowest mean levels of all Duffy-associated markers, while individuals with type A blood had the lowest mean levels of all ABO-associated markers. Additional work is warranted to explore potential clinical implications of these differences.","C. Van Alsten, Sarah; Aversa, John G.; Santo, Loredana; Constanza Camargo, M.; Kemp, Troy; Liu, Jia; Huang, Wen-Yi; Sampson, Joshua; Rabkin, Charles S.",Genes Immun,800,7
54101,54101,54101,"Fysiek consult, telefonisch consult of videoconsult?",17.41114,14.955543,2021-06-18,"BACKGROUND: Traumatic brain injury is a public health concern and is the main cause of death among various types of trauma. The inflammatory conditions due to TBI are associated with unfavorable clinical outcomes. Taurine has been reported to have immune-modulatory effects. Thus, the aim of this study was to survey the effect of taurine supplementation in TBI patients. METHODS: In this study, 32 patients with TBI were randomized into two groups. The treatment group received 30 mg/kg/day of taurine in addition to the Standard Entera Meal and the control group received Standard Entera Meal for 14 days. Prior to and following the intervention, the patients were investigated in terms of serum levels of IL-6, IL-10, hs-CRP and TNF-α as well as APACHEII, SOFA and NUTRIC scores, Glasgow coma scale and weight. In addition, the length of Intensive Care Unit stay, days of dependence on ventilator and 30-day mortality were studied. SPSS software (version 13.0) was used for data analysis. RESULTS: Taurine significantly decreased the serum levels of IL-6 (p = 0.04) and marginally APACHEII score (p = 0.05). In addition, weight loss was significantly lower in taurine group (p = 0.03). Furthermore, taurine significantly increased the GCS (p = 0.03). The groups were not different significantly in terms of levels of IL-10, hs-CRP, and TNF-α, SOFA and NUTRIC scores, 30-day mortality, length of ICU stay and days of dependence on ventilator. CONCLUSION: According to the results of the present study, taurine supplementation can reduce the IL-6 levels as one of the important inflammatory markers in these patients; and enhances the clinical outcomes too. TRIAL REGISTRATION: IRCT, IRCT20180514039657N1. Registered 22 June 2018.","Vahdat, Mahsa; Hosseini, Seyed Ahmad; Soltani, Farhad; Cheraghian, Bahman; Namjoonia, Masih",Nutr J,800,1
69868,69868,69868,Deaths after confirmed SARS-CoV-2 in Norway.,17.63298,14.8096075,2020-12-15,"INTRODUCTION The use of online learning and subsequent online testing has expanded rapidly in pharmacy programs across the United States. Numerous published studies have compared online learning with traditional methods in pharmacy. However, no such studies have been published in pharmacy. This study's objective is to compare first-professional year student preferences for computer-based vs. traditional paper-and-pencil testing for a required social and administrative pharmacy class. METHODS All students enrolled in the class were invited to complete one brief survey at the end of the semester to determine their testing preference. RESULTS Of the 138 first-professional year students completing the survey, 79% (109 of 138) preferred computer-based testing, 9% had no preference, 6% (8 of 138) preferred paper-and-pencil testing, and the remainder (8 of 138) stated it depended on what was being tested. Ninety-one percent of students did not perceive the testing method to impact their grades. Students preferred computer-based testing over traditional paper-and-pencil as a convenient testing method (mean 4.73 vs. 3.4, P < .001), providing immediate feedback (mean 4.87 vs. 1.91, P < .001), and as a more effective testing method (mean 4.57 vs. 3.96, P < .001). CONCLUSIONS First-professional year students preferred computer-based over traditional paper-and-pencil testing for a social and administrative science class, with the method of testing not perceived to impact grade. This finding is timely, given the recent required transitioning of all pharmacy classes and subsequent testing to an online format due to the coronavirus disease of 2019 pandemic.","Franic, Duska M; Palmer, Russ; Fulford, Michael",Currents in pharmacy teaching & learning,800,27
78218,78218,78218,"SARS-CoV-2 in health and care staff in Norway, 2020.",17.686234,14.753278,2021-02-23,BACKGROUND Minimal evidence compares nursing student outcomes when replacing clinical hours with manikin-based high-fidelity patient simulation (HFPS) or virtual simulation. PURPOSE The study aims were to compare differences in outcomes: (1) between 2 intervention groups (HFPS or virtual simulation) when replacing 25% of pediatric/obstetrics clinical hours and (2) pass/fail for clinical practice between the intervention groups and a face-to-face clinical group (control). METHODS A quasi-experimental study was conducted to determine differences in knowledge between intervention groups participating in 6 pediatric/obstetrics simulation scenarios. RESULTS No differences in composite knowledge were found between simulation groups (P = .319). There also was no difference in clinical practice pass/fail among the groups. CONCLUSIONS HFPS and virtual simulation were equally effective in achieving learning goals.,"Díaz, Desiree A; Anderson, Mindi; Hill, Peggy P; Quelly, Susan B; Clark, Kristen; Lynn, Melissa",Nurse educator,800,31
89102,89102,89102,"The Impact of Frailty on Epistaxis admission, a retrospective cohort study.",17.268267,14.898405,2021-03-23,,"Fong, Jie Ming Nigel; Devanand, Anantham",Singapore medical journal,800,1
100978,100978,100978,"SARS-CoV-2 in children and adolescents in Norway: confirmed infection, hospitalisations and underlying conditions.",17.66667,14.683251,2020-08-18,"OBJECTIVE Inadequate nutrition literacy within families is a barrier for healthy dietary choices and influences chronic disease risk. This pilot study examined the feasibility of providing an in-person nutrition intervention for families at high risk of developing prediabetes or type 2 diabetes and cardiovascular risk-factors. METHODS Eligible families had at least one member with a non-communicable disease (NCD) or metabolic risk factor, fluency in English, willingness to attend all three educational sessions and complete questionnaires as a family unit. Sessions included didactic and experiential activities on food label reading, portion sizing, physical activity and modifiable lifestyle factors to reduce NCD risk. Demographics and fruit and vegetable screeners were collected from all participants at baseline and after completion of sessions. Families participated in focus groups to evaluate the program. RESULTS Twelve families (n=35;17 adults;18 children) were recruited from New York City. Participants self-identified as Asian, Hispanic or Black. Adults had a mean age of 40y, BMI of 32.29kg/m2, household income of $35,000-$49,000y, and 13 of 17 adult participants had college degrees. Children ranged from 1-17y. Based on focus group feedback, three sessions were acceptable, families reported enjoying interactive activities and group learning and requested child-friendly activities. They reported improved knowledge of food labels, strategies for grocery shopping, portion-sizing, and increased awareness of the links between diet quality and NCDs. CONCLUSIONS AND IMPLICATIONS The study met recruitment goals within 4 months. The educational intervention was acceptable and may be scaled-up for future studies on NCD prevention, particularly prediabetes and type 2 diabetes.","Parekh, Niyati; Khalife, Gabrielle; Hellmers, Natalie; D'Eramo Melkus, Gail",The Diabetes educator,800,12
109448,109448,109448,A systematic review of outcomes of remote consultation in ENT.,17.233654,14.96534,2021-03-23,,"Lowe, A; Atwan, A; Mills, C",Clinical and experimental dermatology,800,23
132523,132523,132523,Multiorgan inflammatory syndrome associated with SARS-CoV-2 in a child.,17.704035,14.848892,2020-08-18,,"Shrank, William H; Caveney, Brian; Miller, Steve; Medows, Rhonda M; Arroliga, Alejandro; Doga, Benjamin; Ban, Kevin; Muldoon, Sean; Seiden, J Michael; Tong, Ian; Chaguturu, Sreekanth; Wohlgemuth, Jay G",Population health management,800,16
166408,166408,166408,Saudi School Education During the COVID-19 Pandemic: The Madrasati Platform,17.420671,3.1347451,2021,,"Anonymous,",Journal of Nihon University Medical Association,800,26
195987,195987,195987,[Diagnosis and treatment of acute bronchitis].,17.642574,14.564092,1994,"Enveloped viruses enter into cells via fusion of their envelope and cellular membrane. Spike (S) protein of coronavirus (CoV) is responsible for entry events. We studied the cell entry mechanisms of two different CoVs, murine coronavirus mouse hepatitis virus (MHV) and severe acute respiratory syndrome coronavirus (SARS-CoV). MHV-JHM that induces syncytia in infected cells entered directly from cell surface, i.e., fusion of envelope and plasma membrane, whereas SARS-CoV and MHV-2 that fail to induce syncytia entered via endosome in a protease-dependent fashion, i.e., fusion of envelope and endosomal membrane. The latter viruses entered directly from cell surface, when receptor-bound viruses were treated with proteases that activate fusion activity of their S proteins. The entry pathway of SARS-CoV could influence the severity of the disease. It was also reveled that a highly neurovirulent JHM spread in a receptor-independent fashion, which could result in a high neuropathogenicity of the virus.","Taguchi, Fumihiro; Matsuyama, Shutoku",Uirusu,800,17
202644,202644,202644,Designerprotein mot covid-19?,17.692133,14.646299,2021,"Objective: To summarize the current status of, and the current expert opinions, recommendation and evidence associated with the use and implementation of electronic health (eHealth), telemedicine, and/or telehealth to provide healthcare services for chronic disease patients during the COVID-19 pandemic. Materials and methods: We searched four electronic databases (PubMed, Google Scholar, Science Direct, and Web of Science Core Collection) to identify relevant articles published between 2019 and 2020. Searches were restricted to English language articles only. Two independent reviewers screened the titles, abstracts, and keywords for relevance. The potential eligible articles, papers with no abstract, and those that fall into the uncertain category were read in full text independently. The reviewers met and discussed which articles to include in the final review and reached a consensus. Results: We identified 51 articles of which 25 articles met the inclusion criteria. All included articles indicated the promising potential of eHealth, telehealth, and/or telemedicine solutions in delivering healthcare services to patients living with chronic diseases/conditions during the COVID-19 pandemic. We synthesized the main findings into ten usages and eight recommendations concerning the different activities for delivering healthcare services remotely for those living with chronic diseases/conditions in the era of COVID-19. Discussion and conclusions: There is limited evidence available about the effectiveness of such solutions. Further research is required during this pandemic to improve the credibility of evidence on telemedicine, telehealth, and/or eHealth-related outcomes for those living with chronic diseases. © The Author(s) 2021.","Bitar, H.; Alismail, S.",Digital Health,800,25
244648,244648,244648,Ett forsok till kompletterande perspektiv pa coronaviruset,17.606384,14.620085,2020,"Since December 2019, China has experienced a widespread outbreak of COVID-19. However, at the early stage of outbreak, investigations revealed a variety of patterns resulting in the transmission of COVID-19. Thus, it is essential to understand the transmission types and the potential for sustained human-to-human transmission. Moreover, the information regarding the characteristics of transmission helps in coordinating the current screening programme, and controlling and containing measures, and also, helps in deciding the appropriate quarantine duration. Thus, this investigation reports an outbreak of COVID-19 in a family residing in Wenzhou, Zhejiang, China during the month of January-February 2020.","Zhou, Zu-Mu; Zhou, Hai-Zhen; Lin, Xian-Dan; Su, Zhi-Cheng; Zhao, Lu-Shuang; Chen, Xi",Epidemiol Infect,800,1
263970,263970,263970,Mayo Mat: An Initiative to Improve the Safety and Efficiency of the Anesthesia Cart in Cases Requiring Strict Isolation Precautions,17.504128,14.608948,2020,,"Prvu Bettger, Janet; Resnik, Linda J",Phys Ther,800,1
314640,314640,314640,The Tipping Point of Medical Technology: Implications for the Postpandemic Era,17.541994,14.636451,2020,,"Takeda, Flavio Roberto; Obregon, Carlos de Almeida; Navarro, Yasmin Peres; Santo Filho, Marco Aurélio; Ribeiro Junior, Ulysses; Sallum, Rubens Antônio Aissar; Cecconello, Ivan",Clinics (Sao Paulo),800,27
338585,338585,338585,Return to Normal: Prioritizing Elective Surgeries With Low Resource Utilization,17.420671,14.531687,2020,"Smartphone-based electronic contact tracing is currently considered an essential tool towards easing lockdowns, curfews, and shelter-in-place orders issued by most governments around the world in response to the 2020 novel coronavirus (SARS-CoV-2) crisis. While the focus on developing smartphone-based contact tracing applications or apps has been on privacy concerns stemming from the use of such apps, an important question that has not received sufficient attention is: How reliable will such smartphone-based electronic contact tracing be? This is a technical question related to how two smartphones reliably register their mutual proximity. Here, we examine in detail the technical prerequisites required for effective smartphone-based contact tracing. The underlying mechanism that any contact tracing app relies on is called Neighbor Discovery (ND), which involves smartphones transmitting and scanning for Bluetooth signals to record their mutual presence whenever they are in close proximity. The hardware support and the software protocols used for ND in smartphones, however, were not designed for reliable contact tracing. In this paper, we quantitatively evaluate how reliably can smartphones do contact tracing. Our results point towards the design of a wearable solution for contact tracing that can overcome the shortcomings of a smartphone-based solution to provide more reliable and accurate contact tracing. To the best of our knowledge, this is the first study that quantifies, both, the suitability and also the drawbacks of smartphone-based contact tracing. Further, our results can be used to parameterize a ND protocol to maximize the reliability of any contact tracing app that uses it.","Kindt, Philipp H.; Chakraborty, Trinad; Chakraborty, Samarjit",,800,20
384024,384024,384024,Kwetsbaarheid in tijden van pandemie,17.617498,14.977854,2020,"The 2015 Administration of Criminal Justice Act (ACJA) has set Nigeria on the path of adopting a more technology-driven criminal justice administration Prior to its enactment after several years of consideration, there had been only episodic use of Information and Communication Technology (ICT) facilities in criminal proceedings This paper examines Nigeria's Criminal Justice Administration (CJA) in light of the ACJA's innovative provisions with a view to furthering the application of ICT facilities It is hoped that ICT might be integrated throughout the CJA as it currently operates in Nigeria so as to promote the effective and efficient automated administration of criminal justice In the new era of social distancing given the COVID-19 pandemic, such reform is submitted to be imperative © 2020","Olugasa, O.",International Journal for Court Administration,800,20
399403,399403,399403,The Norwegian Government's 'coronavirus special committee' is unrepresentative and its chair is unqualified,17.546621,14.578469,2020,"COVID-19 pandemic turned the entire health-care system organization upside-down, suspending elective activities and outpatient services. In Italy, we are entering a second phase of the pandemic and several strategies have been developed to ""re-open"" the country, some businesses, and also health care outpatient activities. This manuscript describes the experience of a Southern Italy Respiratory Unit for safely resuming outpatient respiratory services and preventing COVID-19 transmission.","Crimi, Claudia; Impellizzeri, Pietro; Campisi, Raffaele; Spicuzza, Lucia; Vancheri, Carlo; Crimi, Nunzio",Am J Infect Control,800,1
412428,412428,412428,"e-COVID Xingu: Social Media and Information against Covid-19 in Altamira, Pará/ e-COVID Xingu: Mídias Sociais e Informação no Combate à Covid-19 em Altamira, Pará",17.233654,4.200932,2020,"OBJECTIVE: To characterize the demographic and clinical features of pediatric severe acute respiratory syndrome coronavirus 2 (SARS-CoV-2) syndromes and identify admission variables predictive of disease severity STUDY DESIGN: We conducted a multicenter, retrospective, and prospective study of pediatric patients hospitalized with acute SARS-CoV-2 infections and multisystem inflammatory syndrome in children (MIS-C) at 8 sites in New York, New Jersey, and Connecticut RESULTS: We identified 281 hospitalized patients with SARS-CoV-2 infections and divided them into 3 groups based on clinical features Overall, 143 (51%) had respiratory disease, 69 (25%) had MIS-C, and 69 (25%) had other manifestations including gastrointestinal illness or fever Patients with MIS-C were more likely to identify as non-Hispanic black compared with patients with respiratory disease (35% vs 18%, P = 02) Seven patients (2%) died and 114 (41%) were admitted to the intensive care unit In multivariable analyses, obesity (OR 3 39, 95% CI 1 26-9 10, P = 02) and hypoxia on admission (OR 4 01;95% CI 1 14-14 15;P = 03) were predictive of severe respiratory disease Lower absolute lymphocyte count (OR 8 33 per unit decrease in 109 cells/L, 95% CI 2 32-33 33, P = 001) and greater C-reactive protein (OR 1 06 per unit increase in mg/dL, 95% CI 1 01-1 12, P = 017) were predictive of severe MIS-C Race/ethnicity or socioeconomic status were not predictive of disease severity CONCLUSIONS: We identified variables at the time of hospitalization that may help predict the development of severe SARS-CoV-2 disease manifestations in children and youth These variables may have implications for future prognostic tools that inform hospital admission and clinical management","Fernandes, D. M.; Oliveira, C. R.; Guerguis, S.; Eisenberg, R.; Choi, J.; Kim, M.; Abdelhemid, A.; Agha, R.; Agarwal, S.; Aschner, J. L.; Avner, J. R.; Ballance, C.; Bock, J.; Bhavsar, S. M.; Campbell, M.; Clouser, K. N.; Gesner, M.; Goldman, D. L.; Hammerschlag, M. R.; Hymes, S.; Howard, A.; Jung, H. J.; Kohlhoff, S.; Kojaoghlanian, T.; Lewis, R.; Nachman, S.; Naganathan, S.; Paintsil, E.; Pall, H.; Sy, S.; Wadowski, S.; Zirinsky, E.; Cabana, M. D.; Herold, B. C.; Tri-State Pediatric, Covid-Research Consortium",Journal of Pediatrics,800,29
455829,455829,455829,When Does a Gadget Become a Paper?,17.343761,14.548509,2020,"Crisafulli and Juhas explore the significance of REACH for Commercialization in addressing the gender gap in technology transfer REACH for Commercialization is a year-round, cohort-based program designed to address the persistent gender gap in technology transfer, patenting and entrepreneurial activities REACH consists of a series of interactive workshops, formal and informal networking opportunities and individual mentoring The program is designed to amplify the impact of ResEArCH, fast-track academic discovery for the benefit of the society and enhance professional development","Juhas, Mary C.; Crisafulli, Caroline E.",JOM,800,13
597985,597985,597985,Mayo Mat: An Initiative to Improve the Safety and Efficiency of the Anesthesia Cart in Cases Requiring Strict Isolation Precautions,17.568436,14.572423,2020-07-13,,"Singer, Benjamin D.; Jain, Manu; Budinger, G. R. Scott; Wunderink, Richard G.",Am J Respir Cell Mol Biol,800,12
