,title_x,publish_time_x,abstract,authors,journal,url,category
495511,"Clinical course and outcomes of patients with asthma hospitalized for severe acute respiratory syndrome coronavirus 2 pneumonia: A single-center, retrospective study",2020,"COVID-19, a global pandemic, has caused over 750,000 deaths worldwide as of August 2020. A vaccine or remedy for SARS-CoV-2, the virus responsible for COVID-19, is necessary to slow down the spread and lethality of COVID-19. However, there is currently no effective treatment available against SARS-CoV-2. In this report, we demonstrated that EGCG and theaflavin, the main active ingredients of green tea and black tea, respectively, are potentially effective to inhibit SARS-CoV-2 activity. Coronaviruses require the 3CL-protease for the cleavage of its polyprotein to make individual proteins functional. EGCG and theaflavin showed inhibitory activity against the SARS-CoV-2 3CL-protease in a dose-dependent manner, and the half inhibitory concentration (IC50) was 7.58 µg/ml for EGCG and 8.44 µg/ml for theaflavin. In addition, we did not observe any cytotoxicity for either EGCG or theaflavin at the concentrations tested up to 40 µg/ml in HEK293T cells. These results suggest that upon further study, EGCG and theaflavin can be potentially useful to treat COVID-19.","Jang, Minsu; Park, Yea-In; Cha, Yeo-Eun; Park, Rackhyun; Namkoong, Sim; Lee, Jin I; Park, Junsoo",Evid Based Complement Alternat Med,,374
496334,"Epidemiological and Clinical Findings of Short-Term Recurrence of Severe Acute Respiratory Syndrome Coronavirus 2 Ribonucleic Acid Polymerase Chain Reaction Positivity in 1282 Discharged Coronavirus Disease 2019 Cases: A Multicenter, Retrospective, Observational Study",2020,"The coronavirus disease 2019 (COVID-19) pandemic has shattered the meticulously developed processes by which we delivered quality care for patients with cirrhosis. Care has been transformed by the crisis, but enduring lessons have been learned. In this article, we review how COVID-19 will impact cirrhosis care. We describe how this impact unfolds over 3 waves; i) an intense period with prioritized high-acuity care with delayed elective procedures and routine care during physical distancing, ii) a challenging 'return to normal' following the end of physical distancing, with increased emergent decompensations, morbidity, and systems of care overwhelmed by the backlog of deferred care, and iii) a protracted period of suboptimal outcomes characterized by missed diagnoses, progressive disease and loss to follow-up. We outline the concrete steps required to preserve the quality of care provided to patients with cirrhosis. This includes an intensification of the preventative care provided to patients with compensated cirrhosis, proactive chronic disease management, robust telehealth programs, and a reorganization of care delivery to provide a full service of care with flexible clinical staffing. Managing the pandemic of a serious chronic disease in the midst of a global infectious pandemic is challenging. It is incumbent upon the entire healthcare establishment to be strong enough to weather the storm. Change is needed.","Tapper, Elliot B; Asrani, Sumeet K",J Hepatol,,374
497959,SARS CoV-2-associated multisystem inflammatory syndrome of children (MIS-C) in the Washington DC metropolitan region,2020,"The recent 'outburst' of COVID-19 spurred efforts to model and forecast its diffusion patterns, either in terms of infections, people in need of medical assistance (ICU occupation) or casualties. Forecasting patterns and their implied end states remains cumbersome when few (stochastic) data points are available during the early stage of diffusion processes. Extrapolations based on compounded growth rates do not account for inflection points nor end-states. In order to remedy this situation, we advance a set of heuristics which combine forecasting and scenario thinking. Inspired by scenario thinking we allow for a broad range of end states (and their implied growth dynamics, parameters) which are consecutively being assessed in terms of how well they coincide with actual observations. When applying this approach to the diffusion of COVID-19, it becomes clear that combining potential end states with unfolding trajectories provides a better-informed decision space as short term predictions are accurate, while a portfolio of different end states informs the long view. The creation of such a decision space requires temporal distance. Only to the extent that one refrains from incorporating more recent data, more plausible end states become visible. Such dynamic approach also allows one to assess the potential effects of mitigating measures. As such, our contribution implies a plea for dynamically blending forecasting algorithms and scenario-oriented thinking, rather than conceiving them as substitutes or complements.","Decock, Kristof; Debackere, Koenraad; Vandamme, Anne-Mieke; Van Looy, Bart",Scientometrics,,374
498929,"Why Do Some People Develop Serious COVID-19 Disease After Infection, While Others Only Exhibit Mild Symptoms?",2021,"The article analyzes the population's assessment of their own health and attitude to a healthy lifestyle in the context of distribution by age groups. Of particular interest is the presence of transformations taking into account the complex epidemiological situation, the increase in the incidence of coronavirus infection in the population (the peak of the incidence came during the period of selective observation in 2020). The article assesses the closeness of the relationship between the respondents ' belonging to a particular socio-demographic group and their social well-being during the period of self-isolation, quarantine or other restrictions imposed during the coronavirus pandemic in 2020. To solve this problem, the demographic and socio-economic characteristics of respondents are presented, the distribution of responses according to the survey results is estimated and the most significant factor characteristics are selected. The distributions of respondents ' responses are presented for the selected questions. To determine the closeness of the relationship between the respondents ' answers to the question and their gender or age distribution, the coefficients of mutual conjugacy and rank correlation coefficients were calculated and analyzed. The ultimate goal of the analytical component of this study is to determine the social well-being of the Russian population during the pandemic on the basis of sample survey data. As a result of the analysis of changes for the period 2019-2020, the assessment of the closeness of communication revealed the parameters that form differences (gender, wealth, territory of residence).","Davletshina, Leysan Anvarovna; Sadovnikova, Natalia Alekseevna; Bezrukov, Alexander Valeryevich; Lebedinskaya, Olga Guryevna",,https://arxiv.org/pdf/2109.05917v1.pdf,374
498930,Recovery does not always signal the end of the battle: A Case of Post SARS-CoV-2 Multisystem Inflammatory Syndrome in an Adult,2021,"Our first COVID-19 case in Turkey was a 44-year-old male who referred to the hospital on March 9, 2020. The first related death occurred on March 17, 2020. Preparedness for the pandemic has been ongoing before the first case was detected. The National Pandemic Plan was published in 2006. The Pandemic Influenza National Preparedness Plan was available after being updated in light of experiences gained during the 2009 Influenza A pandemic. Accordingly, Pandemic Coordination Boards and Operation Centers have been established on the national and provincial levels. This was an adaptable plan to the Novel Coronavirus Disease (COVID-19). We formed teams to work on a 24/7 basis and established a Scientific Committee at the Public Health Emergency Operation Center within the General Directorate of Public Health. ""COVID-19 Risk Assessment"", ""COVID-19 Guideline"" and ""Case Report Form"", regulations of personal protective equipment along with need-based guidelines, treatment algorithms, brochures and related documents have been released. For the case-based follow-up, Public Health Management System (HSYS) is being used. PCR and rapid diagnostic kits are being used to analyze the samples at the central Microbiology Reference Laboratory and the authorized laboratories in several provinces. Various preventive measures were implemented including flight restrictions to certain countries, gradually expanded to suspending all flights and prohibiting the entry of foreign nationals, 14-day isolation and symptom monitoring for those that came from countries under risk. Persons with chronic diseases have been granted an administrative leave, on campus education at schools and activities of public rest and entertainment areas were temporarily suspended. The measures have been implemented for penitentiary institutions, dormitories, nursing homes, public transport and intercity buses, and also weekend curfews are implemented. In accordance with the pandemic plan, actions have been carried out with a multi-sectoral approach, and preventive measures have been implemented to cover the society as a whole.","Demirbilek, Yasemin; Pehlivantürk, Gülen; Özgüler, Zeynep Özge; Alp Mese, Emine",Turk J Med Sci,,374
500614,Severe Acute Respiratory Syndrome-Coronavirus-2 (SARS-CoV-2) Antibody Responses in Children With Multisystem Inflammatory Syndrome in Children (MIS-C) and Mild and Severe Coronavirus Disease 2019 (COVID-19),2021,,"Acob, J. R. U.",Belitung Nursing Journal,,374
501025,Association Between Low Zinc Levels and Severity of Acute Respiratory Distress Syndrome by New Coronavirus SARS-CoV-2,2021,"S Pullorum and S Enteritidis are closely related in genetic terms, but they show very different pathogenicity and host range S Enteritidis infects many different hosts, usually causing acute gastroenteritis, while S Pullorum is restricted to avian, where it causes systemic disease in young animals The reason why they differ in host range and pathogenicity is unknown The core-genome denotes those genes that are present in all strains within a clade, and in the present work, an automated bioinformatics workflow was developed and applied to identify core-genome differences between these two serovars with the aim to identify genome features associated with host specificity of S Pullorum Results showed that S Pullorum unique coding sequences (CDS) were mainly concentrated in three regions not present in S Enteritidis, suggesting that such CDS were taken up probably during the separation of the two types from their common ancestor One of the unique regions encoded Pathogenicity Islands 19 (SPI-19), which encodes a type VI secretion system (T6SS) Single-nucleotide polymorphism (SNP) analysis identified 1791 conserved SNPs in coding sequences between the two serovars, including several SNPs located in a type IV secretion system (T4SS) Analyzing of 100â¯bp regions upstream of coding sequences identified 443 conserved SNPs between the two serovars, including SNP variations in type III secretion system effector (T3SE) In conclusion, this analysis has identified genetic features encoding putative factors controlling host-specificity in S Pullorum The novel bioinformatic workflow and associated scripts can directly be applied to other bacteria to uncover the genome difference between clades OBJECTIVE: Currently, Coronavirus COVID-19 is spreading worldwide very rapidly and its control is very difficult because there is no effective vaccine or drugs available in markets This virus can infect both animals and people and cause illnesses of the respiratory tract WHO has declared Coronavirus as pandemic and the whole world is fighting against Coronavirus Globally, more than 199,478 people have been diagnosed with COVID-19 As of March 18, 2020, more than 167 countries have been affected and more than 8000 deaths have been reported The main country being affected is China followed by Italy, Iran, Spain, France, and the USA MATERIALS AND METHODS: Since there are no effective drugs available against Coronavirus, we conducted virtual screening of phytochemicals to find novel compounds against this virus Hence, we created a phytochemical library of 318 phytochemicals from 11 plants which have been reported as antiviral, antibacterial and antifungal activity The phytochemical library was subjected to virtual screening against molecular targets;Main protease (Mpro) and Angiotensin-Converting Enzyme 2 (ACE2) RESULTS: Top 10 compounds were selected from each target which had better and significantly low binding energy as compared to the reference molecule CONCLUSIONS: Based on the binding energy score, we suggest that these compounds can be tested against Coronavirus and used to develop effective antiviral drugs","Fei, Xiao; Li, Qiuchun; Olsen, John Elmerdahl; Jiao, Xinan; Joshi, T.; Sharma, P.; Mathpal, S.; Pundir, H.; Bhatt, V.; Chandra, S.",Infect Genet Evol,,374
503006,Temporal differences in culturable SARS-CoV-2 from the respiratory and gastro-intestinal tracts in a patient with moderate COVID-19,2021,"As of 14th July 2020, 12,964,809 confirmed cases of coronavirus (COVID-19) and 570,288 deaths had been reported globally In Kuwait, the numbers stood at 55,508 confirmed cases and 393 deaths The disease seems to be hitting hard on the country despite the measures that have been put in place The current study sought to examine healthcare workers HCWs awareness and perceptions of coronavirus disease in Kuwait hospitals A prospective study design was used to examine the development of the disease among 28 HCWs between mid-May and the start of June 2020 The primary findings were as follows;most of the study participants had attended lectures/ discussions on COVID-19, only few HCWs could identify the incubation period of the novel coronavirus However, the majority could identify the most common symptoms of the disease as fever, cough, headache, sore throat, runny nose, and skin rashes Most of the HCWs were aware that the virus transmitted through contact A good number of the study participants also identified pneumonia, respiratory failure and death as complications associated with coronavirus disease The study recommends running health education programs in Kuwait to promote knowledge on the coronavirus and help the HCWs develop positive attitudes and uphold important practices © 2020, University of Defence, Faculty of Military Health Sciences All rights reserved","Alshammari, E.; Alsaleh, N.; Alshammari, A.; Alsharif, A.; Alsaleh, A.; Alhamed, M.; Alsmari, A.",Military Medical Science Letters (Vojenske Zdravotnicke Listy),,374
508995,"Nosocomial Coronavirus Disease Outbreak Containment, Hanoi, Vietnam, March-April 2020",2020,,"Rezaeijo, Seyed Masoud Ghorvei Mohammadreza Abedi-Firouzjah Razzagh Mojtahedi Hesam Entezari Zarch Hossein",Egyptian Journal of Radiology and Nuclear Medicine,,374
509163,Clinical sensitivity of severe acute respiratory syndrome coronavirus 2 nucleic acid amplification tests for diagnosing coronavirus disease 2019,2020,,"Chau, I Y; Chen, C-C; Kuo, L-J",Colorectal Dis,,374
509814,Severe acute respiratory coronavirus virus 2 (SARS-CoV-2) seroprevalence in healthcare personnel in northern California early in the coronavirus disease 2019 (COVID-19) pandemic,2020,,,BMJ,,374
512319,"Reply to ""Subcutaneous terbutaline as an alternative to aerosolized albuterol""",2020,"Many Indonesian people talk about the additional ṣallû fî riḥâlikum in azan, thus questioning the hadith that is referred to Afterwards, the Indonesian ‘Ulamâ’ Council (MUI) immediately states that ṣallû fî riḥâlikum refers to al-Bukhârî 632;666 and Muslim 699 Next, MUI appeals to muezzins to read the additional in the hope that people will not attend mosques and avoid communal worship Even so, public still do not fully believe in MUI, and the ṣallû fî riḥâlikum was not announced, hence the congregational prayers continued With this background, this paper attempts to address this problem by using culture-shock, reception, sociology theories This research found that, ṣallû fî riḥâlikum became a cultural shock and was perceived in Indonesia with three kinds of models dominant, negotiated, and optional readings Ṣallû fî riḥâlikum becomes an ""objective meaning"" and is used by Muslims when prayer itself is more important than congregational prayer in order to avoid demolition Ṣallû fî riḥâlikum is expressed in various forms Some read it while holding back sobs, others refuse In the end ṣallû fî riḥâlikum became cultural documentation for Muslims as a whole","Solahuddin, Ahmad Atiqoh Firdaus Saifuddin Zuhri Qudsy",Ulul Albab,,374
512320,"Reply to ""Subcutaneous terbutaline as an alternative to aerosolized albuterol""",2020,"BACKGROUND: The coronavirus disease 2019 (COVID-19) disrupted the education and clinical training of nursing students. Clinical sites shut out students over low equipment supplies, physical distancing requirements, and redeployment of staff. PURPOSE AND METHODS: The purpose of this paper is to highlight a progressive solution to engage nurse practitioner students as part of the COVID-19 response given the disruption of their traditional clinical training environments so that student could continue to matriculate and graduate in a timely manner. FINDINGS: Nurse practitioner students swiftly responded and were deemed an essential part of the nursing workforce. DISCUSSION: Policy implications for advanced nursing practice and education for telehealth and simulation research moving forward is also provided.","Intinarelli, Gina; Wagner, Laura M; Burgel, Barbara; Andersen, Robin; Gilliss, Catherine L",Nurs. outlook,,374
512321,"Reply to ""Subcutaneous terbutaline as an alternative to aerosolized albuterol""",2020,"BACKGROUND: The coronavirus disease 2019 (COVID-19) disrupted the education and clinical training of nursing students. Clinical sites shut out students over low equipment supplies, physical distancing requirements, and redeployment of staff. PURPOSE AND METHODS: The purpose of this paper is to highlight a progressive solution to engage nurse practitioner students as part of the COVID-19 response given the disruption of their traditional clinical training environments so that student could continue to matriculate and graduate in a timely manner. FINDINGS: Nurse practitioner students swiftly responded and were deemed an essential part of the nursing workforce. DISCUSSION: Policy implications for advanced nursing practice and education for telehealth and simulation research moving forward is also provided.","Intinarelli, Gina; Wagner, Laura M; Burgel, Barbara; Andersen, Robin; Gilliss, Catherine L",Nurs. outlook,,374
513343,Detection of severe acute respiratory syndrome Coronavirus-2 in the tears of patients with Coronavirus disease 2019,2020,,"Burki, Talha Khan",Lancet Respir Med,,374
516701,Severe Acute Respiratory Syndrome Coronavirus 2 Testing in Children in a Large Regional US Health System During the Coronavirus Disease 2019 Pandemic,2021,"BACKGROUND: To highlight clinical practice among referral (Hub, HH) or satellite (Spoke, SH) hospitals Vascular Surgery Units (VSUs) in Lombardy, during the COVID-19 pandemic ""phase 1"" period (March 8 - May 3, 2020). METHODS: The Vascular Surgery Group of Regione Lombardia Register, a real-word, multicenter, retrospective register was interrogated. All patients admitted with vascular disease were included. Patients' data on demographics, COVID-19 positivity, comorbidities and outcomes were extrapolated. Two cohorts were obtained: patients admitted to HH or SH. Primary endpoint was 30- day mortality rate. Secondary outcomes were 30-day complications and amputation (in case of peripheral artery disease [PAD]) rates. Univariate and multivariate analysis were used to compare HH and SH groups and predictors of poor outcomes. RESULTS: During the study period, 659 vascular patients in 4 HH and 27 SH were analyzed. Among these, 321 (48.7%) were admitted to a HH. No difference in COVID-19 positive patients was described (21.7% in HH vs 15.9% in SH; p=.058). After 30 days from intervention, HH and SH experienced similar mortality and no-intervention-related complication rate (12.1% vs 10.0%; p=.427 and 10.3% vs 8.3%; p=.377, respectively). Conversely, in HH postoperative complications were higher (23.4% vs 16.9%, p=.038) and amputations in patients treated for PAD were lower (10.8% vs 26.8%; p<.001) than in SH. Multivariate analysis demonstrated in both cohorts COVID-19-related pneumonia as independent predictor of death and postoperative complications, while age for death. CONCLUSIONS: HH and SH ensured stackable results in patients with vascular disease during COVID-19 ""phase 1"". Despite this, poor outcomes were observed in both HH and SH cohorts, due to COVID-19 infection and its related pneumonia.","Bellosta, Raffaello; Bissacco, Daniele; Rossi, Giovanni; Pirrelli, Stefano; Lanza, Gaetano; Frigerio, Dalmazio; Chiesa, Roberto; Castelli, Patrizio; Bonardelli, Stefano; Trimarchi, Santi",J. cardiovasc. surg,,374
518308,"Worldwide Effects of Coronavirus Disease Pandemic on Tuberculosis Services, January-April 2020",2020,,"Feng, Z-H; Cheng, Y-R; Ye, L; Zhou, M-Y; Wang, M-W; Chen, J",Public Health,,374
521080,"Familial cluster of asymptomatic COVID-19 cases in a First Nation community in Northern Saskatchewan, Canada",2021,"Inside the Outbreak “What kind of government is this?” Bella Zhang, a 25-year old perfume saleswoman with tinted blue hair asked as she sat outside a Wuhan hospital in February 2020 with her mother and younger brother, all three hooked to intravenous drips attached to a tree branch Since the hospital had no free beds, the whole family was quarantined at home, but visited the hospital for medication An epidemic could begin in any country, but not every political regime would labor to suppress news of its emergence (although the US president and Iran’s top leaders downplayed its dangers) 1 One saving grace for China was that its system could build new hospitals nearly overnight and regulate population movement to limit contagion Things fall apart;the centre cannot hold;Mere anarchy is loosed upon the world, The blood-dimmed tide is loosed, and everywhere The ceremony of innocence is drowned;Turning and turning in the widening gyre The best lack all conviction, while the worst Are full of passionate intensity The book contains sixty figures and tables illustrating such variables as “Increase in Chinese National Income Generated by One Unit of Fixed-Asset Investment, 1981–2012” and “China’s Gini Coefficient in Comparative Perspective ”","Clemens, Walter C.; Jr.,",Asian Perspective,,374
521081,A Novel Large-Vessel Arteritis in SARS-CoV-2-Related Multisystem Inflammatory Syndrome in Children (MIS-C),2021,,"Dowd, Jennifer Beam; Block, Per; Rotondi, Valentina; Mills, Melinda C",Proc Natl Acad Sci U S A,,374
590124,Acute Respiratory Distress Syndrome (ARDS) and Severe Acute Respiratory Syndrome (SARS): Are We Speaking Different Languages?,2005-01-31,"As the vaccines against COVID are slowly becoming available, we need to consider the paradox of why so many people of color are dying from the disease yet cannot get the vaccinations. Concerns focus on vaccine refusal but lack of access is the bigger problem.","Reverby, Susan M.",PLoS Biol,https://www.ncbi.nlm.nih.gov/pubmed/33684102/; https://doi.org/10.1371/journal.pbio.3001167,374
590128,"Clinical Features, Severity, and Incidence of RSV Illness During 12 Consecutive Seasons in a Community Cohort of Adults ≥60 Years Old",2018-11-27,,"Callaway, Ewen",Nature,https://www.ncbi.nlm.nih.gov/pubmed/34354274/; https://doi.org/10.1038/d41586-021-02158-6,374
