,index,Unnamed: 0,title_x,x,y,publish_time_x,abstract,authors,journal,category,cluster
590802,590802,590802,Saliva is a reliable and accessible source for the detection of SARS-CoV-2,11.3907585,12.188887,2021-02-11,"Background and Objective: The epidemic of coronavirus disease 2019 (COVID-19) pneumonia caused by infection with severe acute respiratory syndrome coronavirus 2 (SARS-CoV2) has expanded from China throughout the world. This study aims to estimate the risk of disease progression of patients who have been confirmed with COVID-19. Methods: Meta-analysis was performed in existing literatures to identify risk factors associated with COVID-19 pneumonia progression. Patients with COVID-19 pneumonia were admitted to hospitals in Wuhan or Hangzhou were retrospectively enrolled. The risk prediction model and nomogram were developed from Wuhan cohort through logistic regression algorithm, and then validated in Hangzhou and Yinchuan cohorts. Results: A total of 270 patients admitted to hospital between Dec 30, 2019, and Mar 30, 2020, were retrospectively enrolled (Table 1). The development cohort (Wuhan cohort) included 87 (43%) men and 115 (57%) women, and the median age was 53 years old. Hangzhou validation cohort included 20 (48%) men and 22 (52%) women, and the median age was 59 years old. Yinchuan validation cohort included 12 (46%) men and 14 (54%) women, and the median age was 44 years old. The meta-analysis along with univariate logistic analysis in development cohort have shown that age, fever, diabetes, hypertension, CREA, BUN, CK, LDH, and neutrophil count were significantly associated with disease progression of COVID-19 pneumonia. The model and nomogram derived from development cohort show good performance in both development and validation cohorts. Conclusion: The severe COVID-19 pneumonia is associated with various types of risk factors including age, fever, comorbidities, and some laboratory examination indexes. The model integrated with these factors can help to evaluate the disease progression of COVID-19 pneumonia.","Cao, Guodong; Li, Pengping; Chen, Yuanyuan; Fang, Kun; Chen, Bo; Wang, Shuyue; Feng, Xudong; Wang, Zhenyu; Xiong, Maoming; Zheng, Ruiying; Guo, Mengzhe; Sun, Qiang",Front Med (Lausanne),500,20
591942,591942,591942,Evaluation of different sample treatments options in a simple and safe procedure for the detection of SARS-COV-2 in saliva,11.22763,11.928634,2021-05-24,"The United States Centers for Disease Control and Prevention considers saliva contact the lead transmission mean of severe acute respiratory syndrome coronavirus 2 (SARS-CoV-2), which causes the coronavirus disease 2019 (COVID-19). Saliva droplets or aerosols expelled by sneezing, coughing, breathing, and talking may carry this virus. People in close distance may be exposed directly to these droplets or indirectly when touching the droplets that fall on surrounding surfaces and ending up contracting COVID-19 after touching the mucosa tissue of their faces. It is of great interest to quickly and effectively detect the presence of SARS-CoV-2 in an environment, but the existing methods only work in laboratory settings, to the best of our knowledge. However, it may be possible to detect the presence of saliva in the environment and proceed with prevention measures. However, detecting saliva itself has not been documented in the literature. On the other hand, many sensors that detect different organic components in saliva to monitor a person’s health and diagnose different diseases, ranging from diabetes to dental health, have been proposed and they may be used to detect the presence of saliva. This paper surveys sensors that detect organic and inorganic components of human saliva. Humidity sensors are also considered in the detection of saliva because a large portion of saliva is water. Moreover, sensors that detect infectious viruses are also included as they may also be embedded into saliva sensors for a confirmation of the presence of the virus. A classification of sensors by their working principles and the substances they detect is presented, including the sensors’ specifications, sample size, and sensitivity. Indications of which sensors are portable and suitable for field application are presented. This paper also discusses future research and challenges that must be resolved to realize practical saliva sensors. Such sensors may help minimize the spread of not only COVID-19 but also other infectious diseases.","Dave, Priya Kishor; Rojas-Cessa, Roberto; Dong, Ziqian; Umpaichitra, Vatcharapan",Biosensors (Basel),500,1
594757,594757,594757,Bioinformatics and system biology approaches to identify the diseasome and comorbidities complexities of SARS-CoV-2 infection with the digestive tract disorders,11.328162,11.977551,2021-05-17,"BACKGROUND: Many cancer survivors experience physical and/or psychosocial problems affecting return to work (RTW) and work retention. Current interventions on RTW lack evidence regarding effectiveness, while interventions for work retention are missing. Partners of cancer survivors may also experience work- and health-related outcomes; yet, these consequences are not well understood. Here, the protocol of the STEPS study is described. The study aims are to: 1) evaluate the (cost-)effectiveness of a rehabilitation program for RTW and work retention in cancer survivors, and 2) assess health- and work-related outcomes among cancer survivors’ partners. METHODS: In a multicentre Randomized Controlled Trial (RCT), 236 working-age cancer survivors with an employment contract will be randomly allocated to a usual care group or an intervention group receiving a multidisciplinary rehabilitation program, combining occupational therapy facilitating work retention (e.g., energy management and self-efficacy training) and reintegration consultation addressing work-related issues (e.g., RTW planning and discussing workplace or task modifications with the supervisor). Alongside the RCT, a prospective cohort study will be conducted among cancer survivors’ partners (n = 267). Participants in the RCT and cohort study will be asked to complete questionnaires at baseline, and after six and 12 months, assessing work- and health-related outcomes. Generalized estimating equations will be used to assess intervention’s effectiveness, compared to usual care, regarding primary (i.e., working hours per week) and secondary outcomes. Also economic and process evaluations will be performed. For the cohort study, logistic or linear regression modelling will be applied assessing work- and health-related outcomes (primary outcome: working hours) of cancer survivors’ partners, and what factors predict these outcomes. RESULTS: The study is planned to start in September 2021; results are expected in 2023. CONCLUSION: Compared to usual care, the STEPS intervention is hypothesized to be (cost-)effective and the intervention could be a valuable addition to standard care helping cancer survivors to sustain employment. Further, it is expected that living with a cancer survivor has a substantial impact on work and health of partners, while specific groups of partners that are at particular risk for this impact are likely to be identified. TRIAL REGISTRATION: Dutch Trial Register (NTR;NL9094; 15-12-2020). SUPPLEMENTARY INFORMATION: The online version contains supplementary material available at 10.1186/s12889-021-11865-8.","Zegers, Amber D.; Coenen, Pieter; Bültmann, Ute; Retèl, Valesca; Kieffer, Jacobien M.; van der Beek, Allard J.; Duijts, Saskia F. A.",BMC Public Health,500,1
595773,595773,595773,MERS-CoV diagnosis: An update,11.482581,11.959492,2016-04-20,"Objectives Concerns about the increasing impact of severe COVID-19 in younger individuals in Brazil came after a recent synchronised country-wide wave of cases in Brazil. This communication analyses how hospitalisations due to COVID-19 changed in the age groups 18–49 years and ≥70 years. Study design Longitudinal study based on secondary data. Methods Data from SIVEP-Gripe, a public and open-access database of Severe Acute Respiratory Illness records (including COVID-19 notifications), were used in this study. Statistical control charts examined changes in the magnitude and variation of younger (18–49 years) and older (≥70 years) adults who were hospitalised between 15 March 2020 and 19 June 2021. Results During the few first weeks of the pandemic in Brazil, the number of COVID-19 hospitalisations increased in older adults, but decreased in younger adults. Subsequently, hospitalisations reached statistical control zones in epidemiological weeks (EW) 19–48 of 2020 (EW 19-48/2020) and EW 03-05/2021 (18–49 y, mean = 26.1%; ≥70 y, mean = 32.8%). Between EW 49/2020 and EW 02/2021, the number of hospitalisations of younger adults dropped to levels below the lower control limit. In contrast, the number of hospitalisations of older adults surpassed the upper limit of the corresponding statistical control zones. However, from EW 06/2021, numbers of hospitalisations changed from statistical control zones, with hospitalisations of younger adults increasing and reaching 44.9% in EW 24/2021 and hospitalisations of older adults decreasing until EW 19/2021 (14.1%) and reaching 17.3% in EW 24/2021. Conclusions An increasing number of COVID-19 hospitalisations were observed in younger adults from EW 06/2021. This could be a result of the successful vaccination programme in older adults, who were initially prioritised, and possibly an increased exposure to highly transmissible variants of COVID-19 in younger adults who had to go to work in the absence of social protection (i.e. government financial support). Potential consequences of COVID-19 hospitalisations in younger adults could include a reduced life expectancy of the population and an increased number of people unable to perform daily activities due to post-COVID-19 conditions.","Guimarães, Raphael; Villela, Daniel Antunes Maciel; Xavier, Diego Ricardo; Saldanha, Raphael; Barcellos, Christovam; Machado de Freitas, Carlos; Portela, Margareth Crisóstomo",Public Health,500,20
596081,596081,596081,"SARS-CoV-2 Phylogenetic Analysis, Lazio Region, Italy, February–March 2020",11.445827,12.328964,2020-08-11,"Alzheimer's disease (AD) and all other dementia represent a global challenge, with an estimated 50 million individuals in the world living with dementia today. In low and middle income countries (LMICs), the burden of disease often is greater, and some of these countries are projected to have some of the largest increases in dementia prevalence during the next few decades. As the world's largest voluntary health organization dedicated to AD and all other dementia, the Alzheimer's Association is committed to its vision of a world without dementia and recognizes the needs, challenges, and opportunities for dementia research in all parts of the world, and especially in LMICs. Currently, the Association is devoting more than $215 million in funding to nearly 600 best-of-field projects in 31 countries, including a significant number of projects that advance and support LMIC-specific research. The innovative work in LMICs is focused on addressing unmet needs or challenges associated with the many unique cultural, demographic, and economic characteristics of these countries. The Association also is expanding leading global forums such as the Alzheimer's Association International Conference (AAIC). In an effort to create new learning and participation opportunities, the Association also has been partnering with other international organizations and collaborating with local leadership to provide AAIC Satellite Symposia (AAIC SS) in LMIC regions around the world. In 2021 and beyond, the Association is committed to continuing these LMIC-focused initiatives, identifying gaps in LMIC research and resources, and enhancing collaboration and communication among researchers in these regions.","Sexton, Claire; Snyder, Heather M.; Chandrasekaran, Lakshmi; Worley, Susan; Carrillo, Maria C.",Front Neurol,500,29
598346,598346,598346,"Spatial and Temporal Epidemiology of Lumpy Skin Disease in the Middle East, 2012–2015",11.264512,12.14782,2016-03-03,,"Mudway, I.S.; Kelly, F.J.; Holgate, S.T.",Free Radic Biol Med,500,20
598986,598986,598986,Household Clustering of SARS-CoV-2 in Community Settings: A Study from Rural Ecuador,11.517721,12.139705,2020-08-04,,"Finsterer, Josef; Scorza, Fulvio A.; Scorza, Carla A.",J Neurol Sci,500,16
602946,602946,602946,Beyond SARS-CoV-2: Lessons That African Governments Can Apply in Preparation for Possible Future Epidemics,11.365947,11.907587,2020-08-18,"Towards the goal of producing fully human polyclonal antibodies (hpAbs or hIgGs) in transchromosomic (Tc) cattle, we previously reported that Tc cattle carrying a human artificial chromosome (HAC) comprising the entire unrearranged human immunoglobulin (Ig) heavy-chain (hIGH), kappa-chain (hIGK), and lambda-chain (hIGL) germline loci produced physiological levels of hIgGs when both of the bovine immunoglobulin mu heavy-chains, bIGHM and bIGHML1, were homozygously inactivated (bIGHM(−/−), bIGHML1(−/−); double knockouts or DKO). However, because endogenous bovine immunoglobulin light chain loci are still intact, the light chains are produced both from the hIGK and hIGL genomic loci on the HAC and from the endogenous bovine kappa-chain (bIGK) and lambda-chain (bIGL) genomic loci, resulting in the production of fully hIgGs (both Ig heavy-chains and light-chains are of human origin: hIgG/hIgκ or hIgG/hIgλ) and chimeric hIgGs (Ig heavy-chains are of human origin while the Ig light-chains are of bovine origin: hIgG/bIgκ or hIgG/bIgλ). To improve fully hIgG production in Tc cattle, we here report the deletion of the entire bIGL joining (J) and constant (C) gene cluster (bIGLJ1-IGLC1 to bIGLJ5-IGLC5) by employing Cre/loxP mediated site-specific chromosome recombination and the production of triple knockout (bIGHM(−/−), bIGHML1(−/−) and bIGL(−/−); TKO) Tc cattle. We further demonstrate that bIGL cluster deletion greatly improves fully hIgGs production in the sera of TKO Tc cattle, with 51.3% fully hIgGs (hIgG/hIgκ plus hIgG/hIgλ).","Matsushita, Hiroaki; Sano, Akiko; Wu, Hua; Jiao, Jin-an; Kasinathan, Poothappillai; Sullivan, Eddie J.; Wang, Zhongde; Kuroiwa, Yoshimi",PLoS One,500,24
604392,604392,604392,Estimation of secondary household attack rates for emergent spike L452R SARS-CoV-2 variants detected by genomic surveillance at a community-based testing site in San Francisco,11.233796,12.183199,2021-03-31,"Novel coronavirus, SARS-CoV-2, has emerged as one of the deadliest pathogens of this century, creating an unprecedented pandemic. Belonging to the betacoronavirus family, it primarily spreads through human contact via symptomatic and asymptomatic transmission. Despite several attempts since it emerged, there is no known treatment in the form of drugs or vaccines. Hence, work on developing a potential multi-subunit vaccine is the need of the hour. In this study, attempts have been made to find globally conserved epitopes from the entire set of SARS-CoV-2 proteins as there is as yet, no clear information on the immunogenicity of these proteins. Using diverse computational tools, a ranked list of probable immunogenic, promiscuous epitopes generated through all the three main stages of antigen processing and presentation pathways has been prioritized. Moreover, several useful insights were gleaned during these analyses. One of the most important insights is that all of the proteins in this pathogen present unique epitopes, so that the targeting of a few specific viral proteins is not likely to result in an effective immune response in humans. Due to the presence of these unique epitopes in all of the SARS-CoV-2 proteins, stronger immune responses generated by T cell hyperactivation may lead to cytokine storm and immunopathology and consequently, remote chances of human survival. These epitopes, after due validation in vitro, may thus need to be presented to the human body in that form of multi-subunit epitope-based vaccine that avoids such immunopathologies.","Mishra, Seema",R Soc Open Sci,500,24
605596,605596,605596,Caveats of Reporting Cycles Threshold from SARS-CoV-2 Qualitative PCR Assays: A Molecular Diagnostic Laboratory Perspective,11.295161,12.453464,2020-09-15,"SIMPLE SUMMARY: Meat products represent a core aspect of the US food supply chain and faced multiple disruptions in the COVID-19 pandemic. Available data are often aggregated or lagged in availability, thus limiting insights into consumer behavior. Using household-level data from continuous consumer tracking in the Meat Demand Monitor project, we extend understanding of consumer behavior during the pandemic. This provides a timely example of the improved insights that follow from refined and ongoing data collection to generate valuable information. ABSTRACT: Meat products represent a significant share of US consumer food expenditures. The COVID-19 pandemic directly impacted both demand and supply of US beef and pork products for a prolonged period, resulting in a myriad of economic impacts. The complex disruptions create significant challenges in isolating and inferring consumer-demand changes from lagged secondary data. Thus, we turn to novel household-level data from a continuous consumer tracking survey, the Meat Demand Monitor, launched in February 2020, just before the US pandemic. We find diverse impacts across US households related to “hoarding” behavior and financial confidence over the course of the pandemic. Combined, these insights extend our understanding of pandemic impacts on US consumers and provide a timely example of knowledge enabled by ongoing and targeted household-level data collection and analysis.","Tonsor, Glynn T.; Lusk, Jayson L.; Tonsor, Shauna L.",Animals (Basel),500,16
606377,606377,606377,Using Virus Sequencing to Determine Source of SARS-CoV-2 Transmission for Healthcare Worker,11.587933,12.3172865,2020-10-11,"Emerging adults’ lives have changed because of the COVID-19 pandemic. Physical activity (PA) behaviors need to be examined to inform interventions and improve health. Responses to the C-EAT (COVID-19 Eating and Activity over Time) survey (N = 720; age = 24.7 ± 2.0 yrs) were analyzed. This mixed-methods study quantitatively examined changes in self-reported PA (hours/week of mild PA, moderate-to-vigorous PA (MVPA), and total PA) from 2018 to 2020. Qualitative responses on how COVID-19 impacted PA were analyzed using a grounded theory approach. Hours of PA were lower on average for all intensity levels during COVID-19 than in 2018 (p’s < 0.0001). Over half of the sample reported a decrease in MVPA (53.8%) and total PA (55.6%); 42.6% reported a decrease in mild PA. High SES were more likely to report an increase in total PA (p = 0.001) compared to those of lower SES. Most (83.6%) participants perceived that COVID-19 had influenced their PA. The most common explanations were decreased gym access, effects on outdoor PA, and increased dependence on at-home PA. Results suggest that emerging adults would benefit from behavioral interventions and health promotion efforts in response to the pandemic, with a focus on activities that can be easily performed in the home or in safe neighborhood spaces.","Folk, Amanda L.; Wagner, Brooke E.; Hahn, Samantha L.; Larson, Nicole; Barr-Anderson, Daheia J.; Neumark-Sztainer, Dianne",Int J Environ Res Public Health,500,1
607934,607934,607934,Is Curfew Effective in Limiting SARS-CoV-2 Progression? An Evaluation in France Based on Epidemiokinetic Analyses,11.44285,11.975102,2021-06-15,,"Patrì, Angela; Fabbrocini, Gabriella",Int J Dermatol,500,16
611633,611633,611633,A SARS-CoV-2 familial cluster infection reveals asymptomatic transmission to children,11.236102,11.951343,2020-05-27,"BACKGROUND: SARS-CoV-2 test kits are in critical shortage in many countries. This limits large-scale population testing and hinders the effort to identify and isolate infected individuals. OBJECTIVE: Herein, we developed and evaluated multi-stage group testing schemes that test samples in groups of various pool sizes in multiple stages. Through this approach, groups of negative samples can be eliminated with a single test, avoiding the need for individual testing and achieving considerable savings of resources. STUDY DESIGN: We designed and parameterized various multi-stage testing schemes and compared their efficiency at different prevalence rates using computer simulations. RESULTS: We found that three-stage testing schemes with pool sizes of maximum 16 samples can test up to three and seven times as many individuals with the same number of test kits for prevalence rates of around 5% and 1%, respectively. We propose an adaptive approach, where the optimal testing scheme is selected based on the expected prevalence rate. CONCLUSION: These group testing schemes could lead to a major reduction in the number of testing kits required and help improve large-scale population testing in general and in the context of the current COVID-19 pandemic.","Eberhardt, J.N.; Breuckmann, N.P.; Eberhardt, C.S.",J Clin Virol,500,26
611892,611892,611892,"Validation of a rapid antigen test as a screening tool for SARS-CoV-2 infection in asymptomatic populations. Sensitivity, specificity and predictive values",11.375789,11.944488,2021-06-09,"PURPOSE: The objective of this study was to implement a standardized process across health systems to determine the prevalence and clinical relevance of prescribing errors intercepted by pharmacists. METHODS: This prospective, multicenter, observational study was conducted across 11 hospitals. Pharmacist-intercepted prescribing errors were collected during inpatient order verification over 6 consecutive weeks utilizing a standardized documentation process. The potential harm of each error was evaluated using a modified National Coordinating Council for Medication Error Reporting and Prevention (NCC-MERP) index with physician validation, and errors were stratified into those with potentially low, serious, or life-threatening harm. Endpoints included the median error rate per 1,000 patient days, error type, and potential harm with correlating cost avoidance. RESULTS: Pharmacists intervened on 7,187 errors, resulting in a mean error rate of 39 errors per 1,000 patient days. Among the errors, 46.6% (n = 3,349) were determined to have potentially serious consequences and 2.4% (n = 175) could have been life-threatening if not intercepted. This equates to $874,000 in avoided cost. The top 3 error types occurring with the highest frequency were “wrong dose/rate/frequency” (n = 2,298, 32.0%), “duplicate therapy” (n = 1,431, 19.9%), and “wrong timing” (n = 960, 13.4%). “Wrong dose/rate/frequency” (n = 49, 28%), “duplicate therapy” (n = 26, 14.9%), and “drug-disease interaction” (n = 24, 13.7%) errors occurred with the highest frequency among errors with potential for life-threatening harm. “Wrong dose/rate/frequency” (n = 1,028, 30.7%), “wrong timing” (n = 573, 17.1%), and “duplicate therapy” (n = 482, 14.4%) errors occurred with the highest frequency among errors with potentially serious harm. CONCLUSION: Documentation of pharmacist intervention on prescribing errors via a standardized process creates a platform for multicenter analysis of prescribing error trends and an opportunity for development of system-wide solutions to reduce potential harm from prescribing errors.","Cabri, Ann; Barsegyan, Naira; Postelnick, Michael; Schulz, Lucas; Nguyen, Victoria; Szwak, Jennifer; Shane, Rita",Am J Health Syst Pharm,500,16
612153,612153,612153,Inactivation of Middle East respiratory syndrome coronavirus (MERS‐CoV) in plasma products using a riboflavin‐based and ultraviolet light‐based photochemical treatment,11.323206,12.495876,2016-11-02,"The recent revision of the International Health Regulations, say Wilson and colleagues, is both long overdue and eminently necessary to face the challenges of an increasingly globalized world.","Wilson, Kumanan; McDougall, Christopher; Upshur, Ross",PLoS Med,500,1
