,title_x,publish_time_x,abstract,authors,journal,url,category
19000,Zertifikate gibt es jetzt auch für Genesene,2021-07-15,"Technical challenges remain in the sequencing of RNA viruses due to their high intra-host diversity. This bottleneck is particularly pronounced when interrogating long-range co-evolved genetic interactions given the read-length limitations of next-generation sequencing platforms. This has hampered the direct observation of these genetic interactions that code for protein-protein interfaces with relevance in both drug and vaccine development. Here we overcome these technical limitations by developing a nanopore-based long-range viral sequencing pipeline that yields accurate single molecule sequences of circulating virions from clinical samples. We demonstrate its utility in observing the evolution of individual HIV Gag-Pol genomes in response to antiviral pressure. Our pipeline, called Multi-read Hairpin Mediated Error-correction Reaction (MrHAMER), yields >1000s of viral genomes per sample at 99.9% accuracy, maintains the original proportion of sequenced virions present in a complex mixture, and allows the detection of rare viral genomes with their associated mutations present at <1% frequency. This method facilitates scalable investigation of genetic correlates of resistance to both antiviral therapy and immune pressure and enables the identification of novel host-viral and viral-viral interfaces that can be modulated for therapeutic benefit.","Gallardo, Christian M; Wang, Shiyi; Montiel-Garcia, Daniel J; Little, Susan J; Smith, Davey M; Routh, Andrew L; Torbett, Bruce E",Nucleic Acids Res,https://www.ncbi.nlm.nih.gov/pmc/articles/PMC8266615/,507
21235,Corona-Splitter,2021-09-23,"OBJECTIVES: Our recent systematic review determined that remote patient monitoring (RPM) interventions can reduce acute care use. However, effectiveness varied within and between populations. Clinicians, researchers, and policymakers require more than evidence of effect; they need guidance on how best to design and implement RPM interventions. Therefore, this study aimed to explore these results further to (1) identify factors of RPM interventions that relate to increased and decreased acute care use and (2) develop recommendations for future RPM interventions. DESIGN: Realist review—a qualitative systematic review method which aims to identify and explain why intervention results vary in different situations. We analysed secondarily 91 studies included in our previous systematic review that reported on RPM interventions and the impact on acute care use. Online databases PubMed, EMBASE and CINAHL were searched in October 2020. Included studies were published in English during 2015–2020 and used RPM to monitor an individual’s biometric data (eg, heart rate, blood pressure) from a distance. PRIMARY AND SECONDARY OUTCOME MEASURES: Contextual factors and potential mechanisms that led to variation in acute care use (hospitalisations, length of stay or emergency department presentations). RESULTS: Across a range of RPM interventions 31 factors emerged that impact the effectiveness of RPM innovations on acute care use. These were synthesised into six theories of intervention success: (1) targeting populations at high risk; (2) accurately detecting a decline in health; (3) providing responsive and timely care; (4) personalising care; (5) enhancing self-management, and (6) ensuring collaborative and coordinated care. CONCLUSION: While RPM interventions are complex, if they are designed with patients, providers and the implementation setting in mind and incorporate the key variables identified within this review, it is more likely that they will be effective at reducing acute hospital events. PROSPERO REGISTRATION NUMBER: CRD42020142523.","Thomas, Emma E; Taylor, Monica L; Banbury, Annie; Snoswell, Centaine L; Haydon, Helen M; Gallegos Rejas, Victor M; Smith, Anthony C; Caffery, Liam J",BMJ Open,https://www.ncbi.nlm.nih.gov/pmc/articles/PMC8388293/,507
21880,Teenager ohne Zustimmung der Eltern gegen Corona impfen,2021-10-07,"BACKGROUND: Collaboration is vital within health care institutions, and it allows for the effective use of collective health care worker (HCW) expertise. Human-computer interactions involving electronic health records (EHRs) have become pervasive and act as an avenue for quantifying these collaborations using statistical and network analysis methods. OBJECTIVE: We aimed to measure HCW collaboration and its characteristics by analyzing concurrent EHR usage. METHODS: By extracting concurrent EHR usage events from audit log data, we defined concurrent sessions. For each HCW, we established a metric called concurrent intensity, which was the proportion of EHR activities in concurrent sessions over all EHR activities. Statistical models were used to test the differences in the concurrent intensity between HCWs. For each patient visit, starting from admission to discharge, we measured concurrent EHR usage across all HCWs, which we called temporal patterns. Again, we applied statistical models to test the differences in temporal patterns of the admission, discharge, and intermediate days of hospital stay between weekdays and weekends. Network analysis was leveraged to measure collaborative relationships among HCWs. We surveyed experts to determine if they could distinguish collaborative relationships between high and low likelihood categories derived from concurrent EHR usage. Clustering was used to aggregate concurrent activities to describe concurrent sessions. We gathered 4 months of EHR audit log data from a large academic medical center’s neonatal intensive care unit (NICU) to validate the effectiveness of our framework. RESULTS: There was a significant difference (P<.001) in the concurrent intensity (proportion of concurrent activities: ranging from mean 0.07, 95% CI 0.06-0.08, to mean 0.36, 95% CI 0.18-0.54; proportion of time spent on concurrent activities: ranging from mean 0.32, 95% CI 0.20-0.44, to mean 0.76, 95% CI 0.51-1.00) between the top 13 HCW specialties who had the largest amount of time spent in EHRs. Temporal patterns between weekday and weekend periods were significantly different on admission (number of concurrent intervals per hour: 11.60 vs 0.54; P<.001) and discharge days (4.72 vs 1.54; P<.001), but not during intermediate days of hospital stay. Neonatal nurses, fellows, frontline providers, neonatologists, consultants, respiratory therapists, and ancillary and support staff had collaborative relationships. NICU professionals could distinguish high likelihood collaborative relationships from low ones at significant rates (3.54, 95% CI 3.31-4.37 vs 2.64, 95% CI 2.46-3.29; P<.001). We identified 50 clusters of concurrent activities. Over 87% of concurrent sessions could be described by a single cluster, with the remaining 13% of sessions comprising multiple clusters. CONCLUSIONS: Leveraging concurrent EHR usage workflow through audit logs to analyze HCW collaboration may improve our understanding of collaborative patient care. HCW collaboration using EHRs could potentially influence the quality of patient care, discharge timeliness, and clinician workload, stress, or burnout.","Li, Patrick; Chen, Bob; Rhodes, Evan; Slagle, Jason; Alrifai, Mhd Wael; France, Daniel; Chen, You",JMIR Med Inform,https://www.ncbi.nlm.nih.gov/pmc/articles/PMC8449299/,507
21882,Was ist bei der Grippeimpfung 2021/22 zu beachten?,2021-10-07,"The recent controversy about misinformation has moved a question into the focus of the public eye that has occupied philosophers for decades: Under what conditions is it appropriate to assert a certain claim? When asserting a claim that x, must one know that x? Must x be true? Might it be normatively acceptable to assert whatever one believes? In the largest cross-cultural study to date (total n = 1,091) on the topic, findings from the United States, Germany, and Japan suggest that, in order to claim that x, x need not be known, and it can be false. However, the data show, we do expect considerable epistemic responsibility on the speaker’s behalf: In order to appropriately assert a claim, the speaker must have good reasons to believe it.","Kneer, Markus",Proc Natl Acad Sci U S A,https://www.ncbi.nlm.nih.gov/pmc/articles/PMC8449385/,507
22478,Abstractband zum 120. Kongress der DGIM 2014,2014-03-26,,"Citerio, Giuseppe; Bakker, Jan; Bassetti, Matteo; Benoit, Dominique; Cecconi, Maurizio; Curtis, J. Randall; Doig, Gordon S.; Herridge, Margaret; Jaber, Samir; Joannidis, Michael; Papazian, Laurent; Perner, Anders; Peters, Mark J.; Singer, Pierre; Smith, Martin; Soares, Marcio; Torres, Antoni; Vieillard-Baron, Antoine; Timsit, Jean-François; Azoulay, Elie",Intensive Care Med,https://www.ncbi.nlm.nih.gov/pmc/articles/PMC4315874/,507
23812,Schwarze Haarknötchenkrankheit,2009-08-18,"This chapter explores how postmodernism and its rejection of grand narratives inform current epistemological theory, emerging from the study of contagion as a fluid and transgressive phenomenon. Donner proposes a drastic re-centering of epistemology around the notion of belief as well as the abandonment of truth and knowledge as possible objects of enquiry. By embracing the idea that the foundations of every belief cannot but themselves be the unjustified and unjustifiable products of an epistemic act, the result of an arbitrary cultural or individual decision, this chapter suggests a new approach to epistemology. Re-framing belief as akin to an insidious form of viral programming, lurking endemically in every belief and act, this new theory signals the invariably performative dimension of every belief and, ultimately, the necessary ethical responsibility revealed by applying epidemiological thinking to epistemological problems.","Donner, Mathieu",Endemic,https://www.ncbi.nlm.nih.gov/pmc/articles/PMC7119914/,507
23875,Präsentismus,2019-02-01,"In this chapter we discuss allergic skin disorders other than atopic dermatitis (AD): the urticaria-angioedema syndrome, allergic contact dermatitis (ACD), protein contact dermatitis (PCD), phytodermatitis, allergic photodermatitis and allergic vasculitis.",,"Pediatric Allergy, Asthma and Immunology",https://www.ncbi.nlm.nih.gov/pmc/articles/PMC7119998/,507
24447,Cordylobia spp.,2009-08-18,"The principles behind the taxonomy of the microorganisms, especially the ­molecular approach (using the sequence of the 16S RNA in the small subunit of the ribosome) in the identification of bacteria, are discussed. The detailed taxonomy of bacteria, fungi, algae, protozoa, and viruses (including bacteriophages) is discussed, and emphasis is laid on those microorganisms which are aquatic. The chapter includes information on some of the smaller macroorganisms found in water such as nematodes and rotifers. The activities of aquatic microorganisms in photosynthesis, and the global cycling of nitrogen and sulfur is discussed.","Okafor, Nduka",Environmental Microbiology of Aquatic and Waste Systems,https://www.ncbi.nlm.nih.gov/pmc/articles/PMC7120757/,507
24600,Sarcoptes scabiei,2009-08-18,"Viren sind aufgrund ihrer kurzen Generationszeit, der großen Zahl von Nachkommen, die sie im Infektionsverlauf produzieren, und nicht zuletzt aufgrund ihrer einfachen Struktur ideale Objekte zum Studium von Evolutionsprozessen. Viren müssen sich ständig den Bedingungen ihres Wirtes oder ihrer Wirtspopulationen anpassen, sodass Mechanismen der Selektion experimentellen Ansätzen zugänglich sind. Dabei spielen unterschiedliche Kriterien, wie die antigene Diversität, das Ausmaß der Virusausscheidung, der Grad der Virulenz und viele andere Faktoren eine wichtige Rolle. Die vollständige Adaptation eines Virus an seinen Wirt, welche in eine möglichst geringe Virulenz des Infektionserregers mündet, ist die für beide erstrebenswerte Konsequenz: ein problemloses Zusammen- und Überleben. So scheinen die Hepatitis-G-Viren, die zwar erstmals aus Patienten mit einer Leberentzündung isoliert wurden, ähnlich wie die TT-Viren in vielen Menschen zu persistieren, ohne dass sie dabei Erkrankungen verursachen (▸Abschnitte 14.5 und 20.2).","Modrow, Susanne; Falke, Dietrich; Truyen, Uwe; Schätzl, Hermann",Molekulare Virologie,https://www.ncbi.nlm.nih.gov/pmc/articles/PMC7120978/,507
24983,Krim-Fieber,2009-08-18,"“Why do parasites harm their host?” is a recurrent question in evolutionary biology and ecology, and has several implications for the biomedical sciences, particularly public health and epidemiology. Contrasting the meaning(s) of the concept of “virulence” in molecular pathology and evolutionary ecology, we review different explanations proposed as to why, and under what conditions, parasites cause harm to their host: whereas the former uses molecular techniques and concepts to explain changes and the nature of virulence seen as a categorical trait, the latter conceptualizes virulence as a phenotypic quantitative trait (usually related to a reduction in the host’s fitness). After describing the biology of emerging influenza viruses we illustrate how the ecological and the molecular approaches provide distinct (but incomplete) explanations of the 1918–19 influenza pandemic. We suggest that an evolutionary approach is necessary to understand the dynamics of disease transmission but that a broader understanding of virulence will ultimately benefit from articulating and integrating the ecological dynamics with cellular mechanisms of virulence. Both ecological and functional perspectives on host-pathogens’ interactions are required to answer the opening question but also to devise appropriate health-care measures in order to prevent (and predict?) future influenza pandemics and other emerging threats. Finally, the difficult co-existence of distinct explanatory frameworks reflects the fact that scientists can work on a same problem using various methodologies but it also highlights the enduring tension between two scientific styles of practice in biomedicine.","Méthot, Pierre-Olivier; Alizon, Samuel","Classification, Disease and Evidence",https://www.ncbi.nlm.nih.gov/pmc/articles/PMC7121464/,507
25439,Trench-Fieber,2009-08-18,"The pediatric critical care physician is frequently challenged by hematologic abnormalities in critically ill children admitted to the pediatric intensive care unit (PICU). The challenge is to differentiate between primary hematologic emergencies that require critical care interventions and abnormalities secondary to other disease conditions. It is therefore necessary for the pediatric critical care physician to collaborate with the pediatric hematologist when managing such patients. This chapter summarizes some of the most common hematologic emergencies of red blood cell (RBC), white blood cell (WBC), or platelet disorders observed in critically ill children that may require attention of the pediatric critical care physician.","Kneyber, Martin C. J.",Pediatric Critical Care Medicine,https://www.ncbi.nlm.nih.gov/pmc/articles/PMC7122033/,507
25955,"Optische und Elektronenmikroskopische Detektion – Erregerschnelldiagnostik, hochauflösende Lichtmikroskopie und Live-Cell-Imaging",2011-12-14,,"Ozin, Amanda J.; Kaufmann, Stephen H. E.",Risk Assessment and Risk Communication Strategies in Bioterrorism Preparedness,https://www.ncbi.nlm.nih.gov/pmc/articles/PMC7122689/,507
26859,Akute Störungen der Atmung: spezielle Krankheitsbilder,2012-05-30,"There is increasing recognition of infections caused by respiratory viruses (RVs) as a major cause of morbidity and mortality in solid organ transplant (SOT) recipients, especially within the thoracic and pediatric population. In addition to their direct, cytopathic, and tissue-invasive effects, RVs can create an inflammatory environment, autoimmune responses, resulting in acute and chronic rejection, although this relationship remains controversial. A laboratory diagnosis in SOT with respiratory syndrome should be performed with nucleic acid amplification tests on respiratory specimens, mainly nasopharyngeal swabs (NPS) and bronchoalveolar lavage (BAL). Treatment options remain limited and consist of supportive care, reduction of immunosuppression, and, if available, antiviral therapy. The use of immunomodulatory agents remains a clinical dilemma. Since treatment options for RVs are limited, maximizing prevention measures against viral infections in SOT is mandatory. The main preventive strategy against influenza remains the administration of yearly inactivated influenza vaccine in all SOT. The aim of this review is to summarize the evidence-based recommendations on the diagnostic, preventive, and therapeutic strategies to decrease the burden of RV infections in SOT recipients.","Peghin, Maddalena; Danziger-Isakov, Lara",Infectious Diseases in Solid-Organ Transplant Recipients,https://www.ncbi.nlm.nih.gov/pmc/articles/PMC7123882/,507
27681,Mitteilungen des Berufsverbandes der Deutschen Radiologen,2020-04-01,,,Vaccine,https://www.ncbi.nlm.nih.gov/pmc/articles/PMC7130878/,507
30482,Branche,2020-04-16,,"Platts-Mills, Thomas A.E.; Heymann, Peter W.",Kendig's Disorders of the Respiratory Tract in Children,https://www.ncbi.nlm.nih.gov/pmc/articles/PMC7158275/,507
31774,„Anwendung von Antikörper-Schnelltests ist Körperverletzung“: SARS-CoV-2-Diagnostik -- Interviewpartner: Dr. Matthias Orth,2020-04-30,"Pneumonien im Kindesalter sind häufig; je nach geographischer Region kann die Sterblichkeit an Pneumonien bis 2 Millionen pro Jahr betragen, das sind weltweit rund 30% aller Sterbefälle bei Kindern bis zum 5. Lebensjahr. In Mitteleuropa und den USA erkranken ca. 30/10.000 Kinder unter 5 Jahren jährlich an einer Pneumonie, für die Altersgruppe 0–16 jährig beträgt die Inzidenz etwa 15/10.000 Kinder.","Schöni, Martin H.",Therapie der Krankheiten im Kindes- und Jugendalter,https://www.ncbi.nlm.nih.gov/pmc/articles/PMC7176185/,507
35116,Mitteilungen des BDI,2020-06-22,"JPEG algorithm defines a sequence of steps (essential and optional) executed in order to compress an image. The first step is an optional conversion of the image color space from RBG (red-blue-green) to YCbCr (luminance and two chroma components). This step allows to discard part of chrominance information, a useful gain due to the fact, that the chrominance resolution of the human eye is much lower than the luminance resolution. In the next step, the image is divided into 8[Formula: see text]8 blocks, called MCUs (Minimum Coded Units). In this paper we present a new adaptive bitmap compression algorithm, and we compare it to the state-of-the-art of JPEG algorithms. Our algorithm utilizes hypergraph grammar model, partitioning the bitmap into a set of adaptively selected rectangles. Each rectangle approximates a bitmap using MCUs with the size selected according to the entire rectangular element. The hypergraph grammar model allows to describe the whole compression algorithm by a set of five productions. They are executed during the compression stage, and they partition the actual rectangles into smaller ones, until the required compression rate is obtained. We show that our method allows to compress bitmaps with large uniform areas in a better way than traditional JPEG algorithms do.","Soliński, Grzegorz; Woźniak, Maciej; Ryzner, Jakub; Mosiałek, Albert; Paszyńska, Anna",Computational Science - ICCS 2020,https://www.ncbi.nlm.nih.gov/pmc/articles/PMC7304022/,507
37458,Mitteilungen des BDI,2020-08-03,This asymmetric effect of the shock on economic activities becomes an asymmetric impact on countries depending on their sectoral composition.,"Díaz, Antonia",Inter Econ,https://www.ncbi.nlm.nih.gov/pmc/articles/PMC7385203/,507
38875,Institute blicken in eine ungewisse Zukunft,2020-09-09,,"Backhaus, Richard",ATZ Electron Worldw,https://www.ncbi.nlm.nih.gov/pmc/articles/PMC7471583/,507
39325,Exokrine Pankreasinsuffizienz,2013,"High temperature sensing sensitivity and luminescence intensity of phosphors are crucial factors for excellent optical temperature sensing performance. Based on material design, the pure phase and two-phase solid solutions were prepared by regulating the relative content of cations Ca(2+) and La(3+) in CaWO(4)–La(2)(WO(4))(3), respectively. The up-conversion luminescence (UCL) and optical temperature sensing performance of rare earth ions Er(3+)/Yb(3+) co-doped CaWO(4)–La(2)(WO(4))(3) were studied. As guided by regulating cation composition through partial substituting Ca(2+) ions by La(3+) ions, the UCL intensity of two-phase solid solutions at 552 nm is much higher than that of pure phase material. The UCL intensity of 0.2La(2)(WO(4))(3)–0.8CaWO(4): 1%Er(3+), 5%Yb(3+) is as 33.5 times as that of CaWO(4): 1%Er(3+), 5%Yb(3+) material. More importantly, the high temperature sensing sensitivity (0.01026 K(−1)) is achieved in a wider temperature range 83–683 K in optimal UCL material 0.2La(2)(WO(4))(3)–0.8CaWO(4): 1%Er(3+), 5%Yb(3+). It is suggested that material design theory can be used as a powerful tool to accelerate discovery of novel optical temperature sensing materials, with implications even for the design of other optoelectronic materials.","Zhang, Ying; Wang, Xusheng; Liu, Qian; Song, Zhitang",J Mater Sci: Mater Electron,https://www.ncbi.nlm.nih.gov/pmc/articles/PMC7491023/,507
39335,Zystische Fibrose,2013,,"Burra, Patrizia; Tacke, Frank; Ratziu, Vlad; Zeuzem, Stefan; Sangro, Bruno; Angeli, Paolo",J Hepatol,https://www.ncbi.nlm.nih.gov/pmc/articles/PMC7491378/,507
39339,Sondenernährung,2013,"Android accessibility features include a robust set of tools allowing developers to create apps for assisting people with disabilities. Unfortunately, this useful set of tools can also be abused and turned into an attack vector, providing malware with the ability to interact and read content from third-party apps. In this work, we are the first to study the impact that the stealthy exploitation of Android accessibility services can have on significantly reducing the forensic footprint of malware attacks, thus hindering both live and post-incident forensic investigations. We show that through Living off the Land (LotL) tactics, or by offering a malware-only substitute for attacks typically requiring more elaborate schemes, accessibility-based malware can be rendered virtually undetectable. In the LotL approach, we demonstrate accessibility-enabled SMS and command and control (C2) capabilities. As for the latter, we show a complete cryptocurrency wallet theft, whereby the accessibility trojan can hijack the entire withdrawal process of a widely used app, including two-factor authentication (2FA). In both cases, we demonstrate how the attacks result in significantly diminished forensic evidence when compared to similar attacks not employing accessibility tools, even to the extent of maintaining device take-over without requiring malware persistence.","Leguesse, Yonas; Vella, Mark; Colombo, Christian; Hernandez-Castro, Julio",Security and Trust Management,https://www.ncbi.nlm.nih.gov/pmc/articles/PMC7491630/,507
39346,Enterale Ernährung von Frühgeborenen,2013,,"Petrie, John R",Lancet Diabetes Endocrinol,https://www.ncbi.nlm.nih.gov/pmc/articles/PMC7492012/,507
39350,Pharmakologische Aspekte,2013,,"McCullough, Danielle; Gotian, Ruth",Br J Anaesth,https://www.ncbi.nlm.nih.gov/pmc/articles/PMC7492052/,507
39351,Störungen der Motilität,2013,,"Ky, Bonnie",JACC CardioOncol,https://www.ncbi.nlm.nih.gov/pmc/articles/PMC7492054/,507
39365,Adipositas,2013,"PURPOSE OF REVIEW: Placental malaria is the primary mechanism through which malaria in pregnancy causes adverse perinatal outcomes. This review summarizes recent work on the significance, pathogenesis, diagnosis, and prevention of placental malaria. RECENT FINDINGS: Placental malaria, characterized by the accumulation of Plasmodium-infected red blood cells in the placental intervillous space, leads to adverse perinatal outcomes such as stillbirth, low birth weight, preterm birth, and small-for-gestational-age neonates. Placental inflammatory responses may be primary drivers of these complications. Associated factors contributing to adverse outcomes include maternal gravidity, timing of perinatal infection, and parasite burden. SUMMARY: Placental malaria is an important cause of adverse birth outcomes in endemic regions. The main strategy to combat this is intermittent preventative treatment in pregnancy; however, increasing drug resistance threatens the efficacy of this approach. There are studies dissecting the inflammatory response to placental malaria, alternative preventative treatments, and in developing a vaccine for placental malaria.","Zakama, Arthurine K.; Ozarslan, Nida; Gaw, Stephanie L.",Curr Trop Med Rep,https://www.ncbi.nlm.nih.gov/pmc/articles/PMC7493061/,507
