,index,Unnamed: 0,title_x,x,y,publish_time_x,abstract,authors,journal,category,cluster
163579,163579,163579,"Live or let die: strategies for coping with COVID-19 from a business perspective in Sao Luis, Maranhao, Brazil",18.784748,0.15375207,2021,"Introducción. Las crisis provocadas por acontecimientos imprevistos como el COVID-19 ponen a prueba las capacidades de comunicación y liderazgo de los actores políticos. Como respuesta, estos políticos establecen estrategias comunicativas que buscan redefinir y reforzar su liderazgo (y su imagen) ante la opinión pública. Metodología. Este texto analiza el desarrollo de algunas de las estrategias llevadas a cabo por los líderes políticos de los tres países europeos más afectados en la primera ola de la pandemia del COVID-19: Emmanuel Macron (Francia), Giuseppe Conte (Italia) y Pedro Sánchez (España). El análisis se basa en la semiótica generativa y se centra en el estudio de las dimensiones semionarrativa, semántica y discursiva. Resultados. En el caso concreto de la pandemia del coronavirus, tales narrativas introducen cuestiones relacionadas con la guerra y el combate. De este modo, facilitan la aparición de subencuadres como la heroicidad y el patriotismo. Discusión. Existe una gran similitud entre todos los discursos analizados a la hora de valerse de la secuencia narrativa propia de la realización del héroe. Pero ni la diferencia de contexto político, ni la diversa evolución de la pandemia en cada uno de los países analizados, así como tampoco el diferente estatuto político de los líderes, conlleva una diferenciación en sus bases narrativas y en sus encuadres bélicos. Conclusiones. Se confirma que las nuevas narrativas se originan en los órdenes discursivos tradicionales como el bélico y el épico-heroico y se destaca una novedad: el papel que juega la ciencia en el acompañamiento de este discurso.Alternate abstract:Introduction. Crises caused by unforeseen events such as COVID-19 challenge political actors' communication and leadership abilities. In response, these politicians establish communication strategies that seek to redefine and reinforce their leadership (and their image) before public opinion. Methodology. This text analyzes the development of some of the strategies carried out by the political leaders of the three European countries most affected by the first wave of the COVID-19 pandemic: Emmanuel Macron (France), Giuseppe Conte (Italy), and Pedro Sánchez (Spain). The analysis is based on generative semiotics and focuses on the study of the semi-operative, semantic and discursive dimensions. Results. In the specific case of the coronavirus pandemic, such narratives introduce issues related to war and combat. In this way, they facilitate the appearance of sub-frames such as heroism and patriotism. Discussion. There is great similarity between all the discourses analyzed when making use of the narrative sequence of the hero's realization. Neither the different political context nor the diverse evolution of the pandemic in each of the countries analyzed, as well as the different political status of the leaders, entails a differentiation in their narrative bases and their war frameworks. Conclusions. It is confirmed that the new narratives originate in traditional discursive orders such as the warlike and the epic-heroic and a novelty stands out: the role that science plays in accompanying this discourse.","Tornero, José Manuel Pérez Lladó Carles Marín Cervi Laura",Revista Latina de Comunicación Social,378,1
171564,171564,171564,Interrupted dreams: memories and emotions of travel experiences during COVID-19 breakthrough,18.621065,0.0768823,2021,"Drug discovery involves extremely costly and time consuming procedures and can be significantly benefited by computational approaches, such as virtual screening (VS). Structurebased VS relies on scoring functions which aim to evaluate the binding of a candidate compound (ligand) on a protein target. Over the last few years, the advancement of the deep learning field has led to the development of novel scoring functions based on convolutional neural networks (CNN), which have achieved state-of-the-art results. In this paper, we present an integrated end-to-end VS pipeline for application on real-world drug discovery scenarios. It combines multiple conformations of the ligand with a new CNN scoring function based on the ResNet architecture, called ResNetVS, which incorporates also the docking output score in its evaluation. After experiments on the DUD-E dataset, it has shown notable performance, especially in early enrichment, where it overcomes current benchmarks. The proposed pipeline is finally applied on the emerging case of COVID-19 pandemic, in a struggle to discover inhibitors for the viral spike protein-ACE2 interaction.","Mylonas, S.; Axenopoulos, A.; Katsamakas, S.; Gkekas, I.; Stamatopoulos, K.; Petrakis, S.; Daras, P.; Ieee,",2020 Ieee 20th International Conference on Bioinformatics and Bioengineering,378,1
174894,174894,174894,Fracking and glyphosate amid covid-19 pandemic in colombia,18.510601,0.1344116,2021,"Background: Infants are at highest risk of pneumococcal disease. Their added protection through herd effects is a key part in the considerations on optimal pneumococcal vaccination strategies. Yet, little is currently known about the main transmission pathways to this vulnerable age group. Methods and findings: We conducted a nested cross-sectional contact and nasopharyngeal swabbing survey in randomly selected infants across all 27 communes of Nha Trang, Vietnam. Bayesian logistic regression models were used to estimate age specific carriage prevalence in the population, a proxy for the probability that a contact of a given age could lead to pneumococcal exposure for the infant. We used another Bayesian logistic regression model to estimate the correlation between infant carriage and the probability that at least one of their reported contacts carried pneumococci, controlling for age and locality. In total 1583 infants between 4 and 13 months old participated, with 7428 contacts reported. Few infants (5%) attended day care and carriage prevalence was 22%. Most infants (61%) had less than a 25% probability to have had close contact with a pneumococcal carrier on the surveyed day. Pneumococcal infection risk and contact behaviour were highly correlated: if adjusted for age and locality the odds of an infant's carriage increased by 22% (95%CI:15-29) per 10 percentage points increase in the probability to have had close contact with at least one pneumococcal carrier. Two to six year old children contributed 51% (95%CI: 39-63) to the total pneumococcal exposure risks to infants in this setting. Conclusions: Cross-sectional contact and infection studies can help identify pneumococcal transmission routes. In Nha Trang, preschool age children are the largest reservoir for pneumococcal transmission to infants.","Qian, G.; Toizumi, M.; Clifford, S.; Le, L. T.; Papastylianou, T.; Quilty, B. J.; Iwasaki, C.; Kitamura, N.; Takegata, M.; Nguyen, T. M.; Nguyen, H. A. T.; Dang, D. A.; van Hoek, A. J.; Yoshida, L.-M.; Flasche, S.",,378,25
175759,175759,175759,Coordination unit of outgoing flow from intensive care unit during COVID-19 crisis,18.479244,0.05685768,2020,"Neuromyelitis optica spectrum disorder is an autoimmune demyelinating disease with high relative prevalence in the East Asian population. Clinical manifestations include optic neuritis, longitudinally extensive transverse myelitis, area postrema syndrome, brainstem syndromes, and diencephalic syndromes. In this case report, we present a case of neuromyelitis optica spectrum disorder that developed 10 days after the first dose of the severe acute respiratory syndrome coronavirus 2 mRNA-1273 vaccine. The patient was a previously healthy White female, completely independent and functional at baseline. She presented with bilateral lower-extremity numbness/tingling, weakness, and urinary retention. Although her neuromyelitis optica IgG was negative, the MRI was consistent with neuromyelitis optica involving and spanning longitudinally the C6-T2 vertebrae. She was treated with IV steroids and her symptoms improved. Given the novelty of the COVID-19 vaccines and the paucity of literature regarding their adverse effects, case reports such as ours provide unique information that aids healthcare providers in accurately diagnosing and treating patients, ultimately minimizing long-term neurologic deficits.","Fujikawa, P.; Shah, F. A.; Braford, M.; Patel, K.; Madey, J.",Cureus,378,16
176966,176966,176966,The Inter-American Responses during COVID-19: Development of Green Human Rights in Indigenous Cases at the Regional and National Levels,18.305893,0.40768838,2021,"The on-going humanitarian crisis in Yemen is one of the worst in the world, with more than14 million people in acute need. The conflict in Yemen deteriorated the already fragile health system and lead to the collapse of more than half of the health facilities. Health system fragmentation is also a problem in Yemen, which is complicated by the existence of two health ministries with different strategies. The aim of this study is to evaluate the effect of health system fragmentation on the implementation of health policies in Yemen across the global agendas of Universal Health Coverage (UHC), Health Security (GHS) and Health Promotion (HP) in the context of WHO priorities achieving universal health coverage, addressing health emergencies and promoting healthier populations. Methods The study is qualitative research using key informant in-depth interviews and documents analysis. Results There are many health stakeholders in Yemen, including the public, private, and NGO sectors - each with different priorities and interests, which did not always align with national policies and strategies. The WHO and Ministry of Public Health and Population (MoPHP) are the main supporters to implement all policies related to the UHC, GHS and HP agendas. Interestingly, initiatives initially pursuing a health security approach to control the cholera epidemic realigned with the UHC concept and moved from an initial focus on health security, to propose a minimum health service package, a classical UHC intervention. Overall, Universal Health Coverage is the most adapted agenda, health security agendas were highly disrupted due to conflicts and health staffs were caught unprepared for emerging outbreaks. The health promotion agenda was largely ignored. Conclusion Restoring peace, building on synergies between the three health agendas through joint planning between the MoPHP and other health actors are highly recommended.","Hussein, T.; Dureab, F.; Al-Waziza, R.; Noman, H.; Hennig, L.; Jahn, A.",,378,17
179822,179822,179822,The Incidence of the Coronavirus Pandemic in the Italian Constitutional System,18.49606,0.38473606,2021,"The ongoing COVID-19 pandemic perpetuated by SARS-CoV-2 variants, has highlighted the continued need for broadly protective vaccines that elicit robust and durable protection. Here, the vaccinia virus-based, replication-defective Sementis Copenhagen Vector (SCV) was used to develop a first-generation COVID-19 vaccine encoding the spike glycoprotein (SCV-S). Vaccination of mice rapidly induced polyfunctional CD8 T cells with cytotoxic activity and robust Th1-biased, spike-specific neutralizing antibodies, which are significantly increased following a second vaccination, and contained neutralizing activity against the alpha and beta variants of concern. Longitudinal studies indicated neutralizing antibody activity was maintained up to 9 months post-vaccination in both young and aging mice, with durable immune memory evident even in the presence of pre-existing vector immunity. This immunogenicity profile suggests a potential to expand protection generated by current vaccines in a heterologous boost format, and presents a solid basis for second-generation SCV-based COVID-19 vaccine candidates incorporating additional SARS-CoV-2 immunogens.","Eldi, Preethi; Cooper, Tamara H.; Prow, Natalie A.; Liu, Liang; Heinemann, Gary K.; Zhang, Voueleng J.; Trinidad, Abigail D.; Guzman-Genuino, Ruth Marian; Wulff, Peter; Hobbs, Leanne M.; Diener, Kerrilyn R.; Hayball, John D.",bioRxiv,378,10
183481,183481,183481,Lung uptake detected by 68Ga-PSMA-11 PET/CT in prostate cancer patients with SARS-CoV-2: a case series.,18.573208,0.039031718,2021,"Lung fibrosis means scarring of tissue in a patient's lungs and is a common condition that can complicate the course of COVID-19 disease. Pulmonary fibrosis destroys the patient's lungs, preventing oxygenation of the blood. Modern methods of treatment are not highly effective even with access to a patient's CT scan. The problem of predicting the prognosis of pulmonary fibrosis is extremely important, since its solution will make it possible to organize clinical trials to study methods of treating patients with fibrosis more effectively. This article proposes a method for predicting the prognosis of pulmonary fibrosis progression as the volume of inhaled and exhaled air to the individual patient based on tabular patient data using an ensemble of four machine learning algorithms. This solution also provides a forecast accuracy because it is useful in medical applications to assess the 'confidence' of the model in its predictions. Modeling the proposed method shows a better result than other forecasting methods that are compared in the article. Keywords-Pulmonary fibrosis progression prognosis, Machine learning, Computer-aided diagnostics. © 2021 IEEE.","Glotov, A.; Lyakhov, P.","2021 Ural Symposium on Biomedical Engineering, Radioelectronics and Information Technology, USBEREIT 2021",378,12
183642,183642,183642,"Josiah Macy, Jr. Foundation.",18.570143,0.42498073,1989,"Tourists consider the costs, energy, and safety of the COVID-19 pandemic that is currently hitting the world globally. Tourism travel is expected to remain the primary choice for economic recovery and improving family relations. This study uses Respondent-Driven Sampling and Snowball Sampling to collect 432 respondents via social media and the internet. This study used a structural equation model (SEM) to examine risk perceptions of risk-averse attitudes by mediating knowledge of pandemic risk, tourism travel, and travel intentions. The results showed that most of the prospective tourists showed a preference for tourism. Tourists pay attention to the dangers of performance, costs, time, tourism destinati ons, while the social-psychological risks posed by the COVID-19 pandemic have a low impact. The nature and behaviour of tourists to avoid pandemic risk cause pandemic risk to be less effective in reducing tourists' intention to travel. Understanding pandemic risk effectively reduces risk perceptions that potential tourists have on tourism travel. The purpose of travelling and the i ntent to recommend tourism travel harms risk avoidance attitudes higher than the risk perception of a pandemic. All tourism travel stakeholders must consider the mediating effect of risk perception and risk aversion attitudes in tourism. © 2021 by ASERS® Publishing. All rights reserved.","Rudyanto, R.; Pramono, R.; Juliana, J.",Journal of Environmental Management and Tourism,378,31
183704,183704,183704,"Pandemics, professionalism and the duty of care: Concerns from the coalface.",18.669168,0.41180232,2020-05-14,"Background: The outbreak of COVID-19 changed the normality of daily life. Due to mobility restriction measures, physical and mental health in general population became a remarkable concern for researchers and health professionals. Material and methods: This article briefly reviews the evidence of mental and physical health consequences during COVID-19 pandemic. The review was conducted in October 2020 through PubMed and Web of Science with the searching frame: Mental health and Physical health and COVID-19. The study selection process followed the PRISMA flow diagram. Results: The reported mental consequences were mainly negative psychological effects including stress symptoms, anxiety, and depression. The total physical activity in MET- minutes/week demonstrated a statistically significant reduction between before and during COVID-19 pandemic. Specifically, males showed higher significant variation of Delta-MET compared with females (p &lt; 0.001). Also, the reduction of total physical activity was related to worse psychological well-being (r = 0.07541, p &lt; 0.001). Conclusions: In the general population, both mental and physical health consequences call for academic concern, and investigation from different social layers of population needs to be justified. Discovery of mental and physical promotion interventions to outline the psychological, social, and physiological aspects of the pandemic are required.","Wang, F. F.; Boros, S.",Baltic Journal of Health and Physical Activity,378,11
185131,185131,185131,The use of disinfection tunnels or disinfectant spraying of humans as a measure to reduce the spread of the SARS-CoV-2 virus.,18.772966,0.29813784,2020-06-11,"With the outbreak and unstable development of COVID-19, its instability has blocked people’s inherent willingness and channel of free travel. As a real-time cultural demand, online performance has temporarily replaced the physical theater and offline performance, attracting more and more consumers’ attention and meeting the entertainment needs in emergency situations. This paper will take COVID-19 as the background, mainly through the way of questionnaire survey and using Decision-Making Trial and Evaluation Laboratory (DEMATEL) to analyze the relationships among critical decision-making factor and different influencing factors that influence the consumption experience of online performance, and to summarize the advantages of the development model and the methods to improve the consumption experience of online performance under the current epidemic situation, so as to provide positive guidance for the development direction of online performances under the situation of future epidemic prevention and control. © 2021, The Author(s), under exclusive license to Springer Nature Switzerland AG.","Tasaki, S.","AHFE Conference on Human Factors and Ergonomics in Healthcare and Medical Devices, 2021",378,9
185863,185863,185863,COVID-19 infection in Italy: An occupational injury.,18.438545,0.22800778,2020-05-08,"The temporary decrease of fine particulate matter (PM2.5) concentrations in many parts of the world due to the COVID-19 lockdown spurred discussions on urban air pollution and health. However there has been little focus on sub-Saharan Africa, as few African cities have air quality monitors and if they do, these data are often not publicly available. Spatial differentials of changes in PM2.5 concentrations as a result of COVID also remain largely unstudied. To address this gap, we use a serendipitous mobile air quality monitoring deployment of eight Sensirion SPS 30 sensors on motorbikes in the city of Nairobi starting on 16 March 2020, before a COVID-19 curfew was imposed on 25 March and continuing until 5 May 2020. We developed a random-forest model to estimate PM2.5 surfaces for the entire city of Nairobi before and during the COVID-19 curfew. The highest PM2.5 concentrations during both periods were observed in the poor neighborhoods of Kariobangi, Mathare, Umoja, and Dandora, located to the east of the city center. Changes in PM2.5 were heterogeneous over space. PM2.5 concentrations increased during the curfew in rapidly urbanizing, the lower-middle-class neighborhoods of Kahawa, Kasarani, and Ruaraka, likely because residents switched from LPG to biomass fuels due to loss of income. Our results indicate that COVID-19 and policies to address it may have exacerbated existing air pollution inequalities in the city of Nairobi. The quantitative results are preliminary, due to sampling limitations and measurement uncertainties, as the available data came exclusively from low-cost sensors. This research serves to highlight that spatial data that is essential for understanding structural inequalities reflected in uneven air pollution burdens and differential impacts of events like the COVID pandemic. With the help of carefully deployed low-cost sensors with improved spatial sampling and at least one reference-quality monitor for calibration, we can collect data that is critical for developing targeted interventions that address environmental injustice in the African context.","deSouza, P. N.; Oriama, P. A.; Pedersen, P. P.; Horstmann, S.; Gordillo-Dagallier, L.; Christensen, C. N.; Franck, C. O.; Ayah, R.; Kahn, R. A.; Klopp, J. M.; Messier, K. P.; Kinney, P. L.",Environmental Research Communications,378,1
186407,186407,186407,Viewpoint: on wondering.,18.554817,0.094164416,2005,,"Ahmed, Abeer HA Mohamed; Goh, Choon Fu",Community Eye Health,378,20
186417,186417,186417,Guideline for medical certification of death in the COVID-19 era.,18.713373,0.4184632,2020-07-20,"Vertical transmission of the novel coronavirus 2019 (COVID-19), has been reported in case reports and series, while the data regarding its transmission is still not enough. Thus, presenting different experiences form various regions could help better understand the virus behavior in pregnancy. We herein report a possible vertical transmission of COVID-19 from a mother to the neonate. A 41-year-old mother with signs and symptoms of acute respiratory illness presented with labor pain and vaginal leak at 37 weeks of gestation. She tested positive for COVID-19 using RT-PCR and underwent emergency cesarean section delivery and gave birth to a girl neonate. The baby tested positive for the COVID-19. Although vertical transmission of COVID-19 has not been proved yet, but there are several lines of evidences suggesting it. Paying close attention to the mother and newborn with COVID-19 and long-term follow-up are needed for better understanding of the virus in pregnancy.","Parsa, Yekta; Shokri, Nazila; Jahedbozorgan, Tayebeh; Naeiji, Zahra; Zadehmodares, Shahrzad; Moridi, Atefeh",Arch Acad Emerg Med,378,16
186611,186611,186611,An imperative to offer pregnant and lactating women access to the COVID-19 vaccination roll-out programme.,18.618252,0.1733913,2021-04-12,"The genome expression of positive-stranded RNA viruses starts with translation rather than transcription. For some viruses, the genome is the only viral mRNA and expression is regulated primarily at the translational level and by limited proteolysis of polyproteins. Other virus groups also generate subgenomic mRNAs later in the reproductive cycle. For nidoviruses, subgenomic mRNA synthesis (transcription) is discontinuous and yields a 5' and 3' coterminal nested set of mRNAs. Nidovirus transcription is not essential for genome replication, which relies on the autoprocessing products of two replicase polyproteins that are translated from the genome. We now show that the N-terminal replicase subunit, nonstructural protein 1 (nsp1), of the nidovirus equine arteritis virus is in fact dispensable for replication but crucial for transcription, thereby coupling replicase expression and subgenomic mRNA synthesis in an unprecedented manner. Nsp1 is composed of two papain-like protease domains and a predicted N-terminal zinc finger, which was implicated in transcription by site-directed mutagenesis. The structural integrity of nsp1 is essential, suggesting that the protease domains form a platform for the zinc finger to operate in transcription.","Tijms, M A; van Dinten, L C; Gorbalenya, A E; Snijder, E J",Proceedings of the National Academy of Sciences of the United States of America,378,16
186691,186691,186691,[Tobacco use in Spain during COVID-19 lockdown: an evaluation through social media.],18.426517,0.2647629,2021-03-16,"Animal diseases impact food supplies, trade and commerce, and human health and well-being in every part of the world. Outbreaks draw the attention of those in agriculture, regulatory agencies, and government, as well as the general public. This was demonstrated by the 2000-2001 foot and mouth disease (FMD) outbreaks that occurred in Europe, South America, Asia and Africa and by the recent increased occurrence of emerging diseases transmitted from animals to humans. Examples of these emerging zoonotic diseases are highly pathogenic avian influenza, bovine spongiform encephalopathy, West Nile virus and severe acute respiratory syndrome. There is also the risk of well-known and preventable zoonotic diseases, such as rabies, brucellosis, leishmaniasis, and echinococcosis/hydatidosis, in certain countries; these diseases have a high morbidity with the potential for a very high mortality. Animal agriculturalists should have a global disease awareness of disease risks and develop plans of action to deal with them; in order to better respond to these diseases, they should develop the skills and competencies in politics, media interactions, and community engagement. This issue of Veterinaria Italiana presents information on the risk of animal diseases; their impact on animals and humans at the international, national, industry, and societal levels; and the responses to them. In addition, specific information is provided on national and international disease monitoring, surveillance and reporting, the risk of spread of disease by bioterrorism and on import risk analysis.","Pearson, J E",Veterinaria italiana,378,0
