,title_x,publish_time_x,abstract,authors,journal,url,category
507817,Management of obstetrics and gynaecological patients with COVID-19,2020,"The objectives are to present an updated synopsis on osteosarcopenic adiposity (OSA) syndrome and evaluate the roles of selected micronutrients in its prevention and management. OSA refers to the concurrent deterioration of bone (osteopenia/osteoporosis), muscle (sarcopenia) and adipose tissue expansion. It portrays the most advanced stage in a continuum of body composition disorders. Although OSA has been widely studied involving the populations of different backgrounds, its prevalence is hard to collate because different methodologies and criteria were used for its diagnosis. Another critical health aspect is the presence of low-grade chronic inflammation (LGCI) which contributes to OSA and vice versa. Nutrition is important in the prevention and management of both OSA and LGCI. Although micronutrients act in numerous metabolic and physiological processes, their roles here are presented in relation to OSA (and its components) and LGCI in general and relevant to the COVID-19 pandemic. These include calcium, magnesium, phosphorus, potassium, sodium and vitamins D and K; their interactions, physiological ratios and synergism/antagonism are discussed as well. In conclusion, calcium, magnesium and vitamin D have a profound impact on OSA and its components, and the latter two also on LGCI. Potassium and vitamin K are vital in bone, muscle functioning and possibly adipose tissue modification. Both, but particularly vitamin D, surfaced as important modulators of immune system with application in COVID-19 infections. While both phosphorus and sodium have important roles in bone, muscle and can impact adiposity, due to their abundance in food, their intake should be curbed to prevent possible damaging effects.","Ilich, Jasminka Z",Proc Nutr Soc,,557
509243,Finding ways for children's doctors to care for big 'Kids' and save adults in a pandemic,2021,,"Hamilton, Robert E.; Shattuck, Thomas J.",Orbis,,557
509432,US Public Attitudes Toward COVID-19 Vaccine Mandates,2020,"This article investigates the impact of public reactions to the Covid‐19 panemic on voting for former President Donald Trump in the 2020 American presidential election The impact of the pandemic on voting is assessed by multivariate statistical analyses of representative national survey data gathered before and after the 2020 presidential election Analyses show that voters reacted very negatively to Trump's handling of the pandemic Controlling for several other relevant factors, these reactions affected voting for Trump and exerted a significant impact on the election outcome Before the onset of Covid‐19 Trump had a very narrow path to victory in 2020, and the pandemic did much to ensure his defeat [ABSTRACT FROM AUTHOR] Copyright of Social Science Quarterly (Wiley-Blackwell) is the property of Wiley-Blackwell and its content may not be copied or emailed to multiple sites or posted to a listserv without the copyright holder's express written permission However, users may print, download, or email articles for individual use This abstract may be abridged No warranty is given about the accuracy of the copy Users should refer to the original published version of the material for the full abstract (Copyright applies to all Abstracts )","Clarke, Harold Stewart Marianne C.; Ho, Karl",Social Science Quarterly (Wiley-Blackwell),,557
509804,Implementation of an Algorithm of Cohort Classification to Prevent the Spread of COVID-19 in Nursing Homes,2020,"During normal and predictable circumstances, employees' occupational calling (i.e., a transcendent passion to use their talent and competencies toward positive societal impact and a sense of meaningfulness derived from working in a chosen occupational domain) is observed to be relatively stable. However, with the onset of the COVID-19 pandemic, circumstances have become anything but normal and predictable, thus putting employees' sense of occupational calling to the test. In this study, we investigate the possibility that occupational calling fluctuates across days during situations of crisis, and we identify antecedents and consequence of such fluctuations. To test our model, we conducted a daily diary study of 66 nurses working in intensive care units over 5 consecutive work days in a specialized Wuhan hospital that only admitted confirmed COVID-19 patients during the peak of the pandemic in China. We found that the daily number of code blue events (i.e., cardiopulmonary resuscitation efforts with the primary goal of patient revival) was positively related to daily occupational calling for nurses. Moreover, individual differences in prosocial motivation predicted the average level and variability of occupational calling over the 5 days, which subsequently related to the nurses' job performance. Our study sheds light on how occupational calling enables people with the needed occupational knowledge and skills to function effectively in crisis situations. (PsycInfo Database Record (c) 2021 APA, all rights reserved).","Zhu, Yue; Chen, Tingting; Wang, Jie; Wang, Mo; Johnson, Russell E; Jin, Yanghua",J Appl Psychol,,557
510360,Are we able to predict airway dimensional changes in isolated mandibular setback?,2021,,"Ballesté, Raquel",Rev. méd. Urug,,557
511642,"Battling COVID-19 in Bangladesh: A Conversation with Dr. John Clemens of icddr,b",2020,"We previously demonstrated corticosteroid administration on the neonatal intensive care unit was associated with reduced lung function at 11 to 14 years of age in children born very prematurely. The objective of this observational study was to assess if lung function remained impaired at 16 to 19 years of age in those who had received postnatal corticosteroids and whether the trajectory of lung function with increasing age differed between those who had and had not received corticosteroids. One hundred and fifty-nine children born prior to 29 weeks of gestational age had comprehensive lung function measurements; 49 had received postnatal dexamethasone. Lung function outcomes were compared between those who had and had not received postnatal dexamethasone after adjustment for neonatal factors. Forced expiratory flow at 75%, 50%, 25% and 25-75% of the expired vital capacity, forced expiratory volume in one second, peak expiratory flow and forced vital capacity and lung volumes (total lung capacity and residual volume) were assessed. The majority of results were significantly lower in those who received dexamethasone (between 0.61 to 0.78 standard deviations). Lung function reduced as the number of courses of dexamethasone increased. Between 11 and 14 years and 16 to 19 years, lung function improved in the unexposed group, but forced expiratory flow at 75% of the expired vital capacity and forced expiratory volume in one second deteriorated in those who had received postnatal corticosteroids (p = 0.0006). These results suggest that prematurely born young people who received postnatal corticosteroids may be at risk of premature onset of chronic obstructive pulmonary disease.","Harris, Christopher; Bisquera, Alessandra; Zivanovic, Sanja; Lunt, Alan; Calvert, Sandy; Marlow, Neil; Peacock, Janet L; Greenough, Anne",PLoS One,,557
511644,"Battling COVID-19 in Bangladesh: A Conversation with Dr. John Clemens of icddr,b",2020,"A new epidemic model for Covid-19 has been constructed and simulated for eight US states. The coefficients for this model, based on seven coupled differential equations, are carefully evaluated against recorded data on cases and deaths. These projections reveal that Covid-19 will become endemic, spreading for more than two years. If stay-at-home orders are relaxed, most states may experience a secondary peak in 2021. The number of Covid-19 deaths could have been significantly lower in most states that opened up, if lockdowns had been maintained. Additionally, our model predicts that decreasing contact rate by 10%, or increasing testing by approximately 15%, or doubling lockdown compliance (from the current $\sim$ 15%) will eradicate infections in Texas within a year. Applied to the entire US, the predictions based on the current situation indicate about 11 million total infections (including undetected), 8 million cumulative confirmed cases, and 630,000 cumulative deaths by November 1, 2020.","Hussain, Fazle; Khan, Zeina S.; Bussel, Frank Van",,https://arxiv.org/pdf/2007.07789v2.pdf,557
514659,ASR News &Announcements,2020,"Considering the COVID-19 pandemic declared, part of the researchers’ efforts has been in studies of repurposing chloroquine (CQ) and hydroxychloroquine (HCQ), cheap medicines that have been used for decades with indication for malaria, rheumatoid arthritis and systemic lupus erythematosus Chinese and South Korean health officials recommended the use of QC and HCQ for prophylaxis and treatment of COVID-19, encouraging researchers around the world to assess the potential of these medicines as antivirals To date, results of three clinical trials have been released Two studies show divergent results for virological clearance, while the third suggests a benefit in terms of radiological and clinical improvement The three studies have methodological limitations and low overall quality of evidence, in view of the absence of randomization, allocation concealment, blinding patients, health care providers, and outcome assessors, missing data and/or selective reporting of results, as well as probable heterogeneity of patients and treatments, imprecision due to the reduced statistical power of the studies, indirect evidence for patients with severe form of the disease or patients with high severity comorbidities The irresponsible self-medication of these medicines is of concern both for the potential risk of shortages, as well as for the adverse events and potentially fatal intoxications Thus, in the USA, Europe and Brazil, regulatory agencies have positioned themselves in an emergency, authorizing the use of CQ and HCQ under medical criteria and/or in the context of clinical trials In Brazil, to restrict irresponsible self-medication and possible shortages, Anvisa included the drugs in a special control list Evidence on the efficacy and safety of QC and HCQ remains uncertain, so the results of ongoing studies are needed to adequately guide public policy and clinical practice Evidence-based health assumptions must be maintained even in times of international emergency due to the risk of having to deal with future complications from the irrational use of these medicines © 2019, Universidade Estadual Paulista (UNESP) All rights reserved","Lucchetta, R. C.; Mastroianni, P. C.",Revista de Ciencias Farmaceuticas Basica e Aplicada,,557
514991,Personal protective equipment in the paediatric emergency department during the COVID-19 pandemic: Estimating requirements based on staff numbers and patient presentations,2020,"The global coronavirus disease 2019 pandemic's impact on kidney transplant recipients and transplantation programs in the calamitous months of February to June 2020, spring to summer in the Northern Hemisphere, is represented in articles published in the December issue of Kidney International. Writing about another pandemic in the year of 1665 over 300 years ago, the author Daniel Defoe1 describes the same period of time in London and gives a remarkably familiar description of how a pandemic affects populations, including the unproven treatments, epidemiology of infection, and human response to restrictions on freedom of city lockdowns that occurred during that time. The risks, outcomes, epidemiology, and potential treatments for the kidney transplant population worldwide during the past 12 months have been thankfully studied in detail by multiple investigators and form the subject of papers in KI this month.","Coates, P Toby",Kidney Int,,557
517956,Bracing for the Wave: a Multi-Institutional Survey Analysis of Inpatient Workforce Adaptations in the First Phase of COVID-19,2021,"BACKGROUND/AIMS: The coronavirus disease 2019 (CO-VID-19) pandemic is the major current health emergency worldwide, adding a significant burden also to the community of nephrologists for the management of their patients. Here, we analyzed the impact of COVID-19 infection in renal patients to assess the time to viral clearance, together with the production and persistence of IgG and IgM antibody response, in consideration of the altered immune capacity of this fragile population. METHODS: Viral clearance and antibody kinetics were investigated in 49 renal patients recovered from COVID-19 infection: 7 of them with chronic decompensated renal failure, 31 under dialysis treatment, and 11 kidney transplant recipients. RESULTS: The time span between the diagnosis of infection and recovery based on laboratory testing (2 negative nasopharyngeal swabs in consecutive days) was 31.7 ± 13.3 days. Three new positive cases were detected from 8 to 13 days following recovery. At the first serological determination after swab negativization, all the patients developed IgG and IgM antibodies. The semiquantitative analysis showed a progressive increase in IgG and a slow reduction in IgM. DISCUSSION/CONCLUSION: In subjects with decompensated chronic kidney disease, under dialysis and in transplant recipients, viral clearance is lengthened compared to the general population. However, in spite of their common status of immunodepression, all of them were able to produce specific antibodies. These data might provide useful insights for monitoring and planning health-care activities in the weak category of patients with compromised renal function recovered from COVID-19.","Bruno, Paolo Ferdinando; Cappuccilli, Maria; Spazzoli, Alessandra; De Liberali, Matteo; Sejdiu, Brunilda; Napoli, Marianna; Minerva, Vera; Semprini, Simona; Dirani, Giorgio; Sambri, Vittorio; Buscaroli, Andrea; Rigotti, Angelo; Mancini, Elena; Masperi, Paolo; La Manna, Gaetano; Mosconi, Giovanni",Nephron,,557
517957,Bracing for the Wave: a Multi-Institutional Survey Analysis of Inpatient Workforce Adaptations in the First Phase of COVID-19,2021,"PURPOSE: This study investigated the effect of anxiety on nicotine dependence among university students during the COVID-19 pandemic. DESIGN AND METHODS: This was a descriptive and correlational study. The sample consisted of 503 university students in Turkey. Data were collected online using a demographic characteristics form, the State-Trait Anxiety Inventory (STAI), and the Fagerström Test for Nicotine Dependence (FTND). FINDINGS: FTND scores differed by gender, family type, and grade level, while STAI scores differed by gender, income, and region of residence (p < 0.05). Fifty-one percent of the participants had moderate anxiety, while 65.2% had low nicotine dependence. FTND and STAI mean scores were strongly correlated (p < 0.05). PRACTICAL IMPLICATIONS: The higher the anxiety, the higher the nicotine dependence among university students during the COVID-19 pandemic.","Ayran, Gülsün; Köse, Semra; Küçükoglu, Sibel; Aytekin Özdemir, Aynur",Perspect. psychiatr. care,,557
518838,COVID-19: Magnifying the Effect of Health Disparities,2020,"COVID-19 disease induced by coronavirus SARS-CoV-2 presents among its symptoms alterations of the chemosensory functions. In the first studies on the Chinese population, this symptomatology was not particularly relevant, and hyposmia and hypogeusia were excluded from the symptoms to be evaluated to diagnose the disease. With the pandemic spread of the illness, there has been an augment in reports on chemosensory dysfunctions among patients. The first data analysis showed the presence of these disorders mainly in paucisymptomatic and asymptomatic patients. The interest in chemosensory systems therefore increased considerably, because the olfactory and gustatory symptoms could be the key to stop the infection spread. Furthermore, the degree of alert and attention grew, considering that these types of dysfunctions are prognostic symptoms of serious neurodegenerative diseases. About 9 months have passed since the first anecdotal reports on the involvement of the olfactory and gustatory systems in the COVID-19 pathology. For this reason, a careful review of the literature was conducted to understand if it is clearer which people present chemosensory symptoms and if these are related to the severity of the disease. Furthermore, we have identified which aspects still remain to be clarified.","Veronese, Sheila; Sbarbati, Andrea",ACS Chem Neurosci,,557
518892,"COVID-19, remote working and paediatric training: what can we learn?",2020,,"Silva, Antônio Augusto Moura da; Minayo, Maria Cecília de Souza; Gomes, Romeu",Cien Saude Colet,,557
519733,Improved Serious Illness Communication May Help Mitigate Racial Disparities in Care Among Black Americans with COVID-19,2021,,"Oguz, F; Pasau, T; Reper, P",Int J Infect Dis,,557
521383,"Variations in volume of emergency surgeries and emergency department access at a third level hospital in Milan, Lombardy, during the COVID-19 outbreak",2021,"The newly identified severe acute respiratory syndrome coronavirus 2 (SARS-CoV-2) causes COVID-19, a pandemic respiratory disease. Moreover, thromboembolic events throughout the body, including in the CNS, have been described. Given the neurological symptoms observed in a large majority of individuals with COVID-19, SARS-CoV-2 penetrance of the CNS is likely. By various means, we demonstrate the presence of SARS-CoV-2 RNA and protein in anatomically distinct regions of the nasopharynx and brain. Furthermore, we describe the morphological changes associated with infection such as thromboembolic ischemic infarction of the CNS and present evidence of SARS-CoV-2 neurotropism. SARS-CoV-2 can enter the nervous system by crossing the neural-mucosal interface in olfactory mucosa, exploiting the close vicinity of olfactory mucosal, endothelial and nervous tissue, including delicate olfactory and sensory nerve endings. Subsequently, SARS-CoV-2 appears to follow neuroanatomical structures, penetrating defined neuroanatomical areas including the primary respiratory and cardiovascular control center in the medulla oblongata.","Meinhardt, Jenny; Radke, Josefine; Dittmayer, Carsten; Franz, Jonas; Thomas, Carolina; Mothes, Ronja; Laue, Michael; Schneider, Julia; Brünink, Sebastian; Greuel, Selina; Lehmann, Malte; Hassan, Olga; Aschman, Tom; Schumann, Elisa; Chua, Robert Lorenz; Conrad, Christian; Eils, Roland; Stenzel, Werner; Windgassen, Marc; Rößler, Larissa; Goebel, Hans-Hilmar; Gelderblom, Hans R; Martin, Hubert; Nitsche, Andreas; Schulz-Schaeffer, Walter J; Hakroush, Samy; Winkler, Martin S; Tampe, Björn; Scheibe, Franziska; Körtvélyessy, Péter; Reinhold, Dirk; Siegmund, Britta; Kühl, Anja A; Elezkurtaj, Sefer; Horst, David; Oesterhelweg, Lars; Tsokos, Michael; Ingold-Heppner, Barbara; Stadelmann, Christine; Drosten, Christian; Corman, Victor Max; Radbruch, Helena; Heppner, Frank L",Nat. neurosci,,557
522254,Telemedicine and COVID-19: an Observational Study of Rapid Scale Up in a US Academic Medical System,2020,,"Sidqalati, Sikandar Ali Ahmed Naveed Mei Jinlan Thu Troung Thi Hong Sohu Jan Muhammad",,,557
590755,Big Data-driven personal protective equipment stockpiling framework under Universal Healthcare for Disease Control and Prevention in the COVID-19 Era,2020-06-04,"BACKGROUND: The cotton rat (genus Sigmodon) is an essential small animal model for the study of human infectious disease and viral therapeutic development. However, the impact of the host microbiome on infection outcomes has not been explored in this model, partly due to the lack of a comprehensive characterization of microbial communities across different cotton rat species. Understanding the dynamics of their microbiome could significantly help to better understand its role when modeling viral infections in this animal model. RESULTS: We examined the bacterial communities of the gut and three external sites (skin, ear, and nose) of two inbred species of cotton rats commonly used in research (S. hispidus and S. fulviventer) by using 16S rRNA gene sequencing, constituting the first comprehensive characterization of the cotton rat microbiome. We showed that S. fulviventer maintained higher alpha diversity and richness than S. hispidus at external sites (skin, ear, nose), but there were no differentially abundant genera. However, S. fulviventer and S. hispidus had distinct fecal microbiomes composed of several significantly differentially abundant genera. Whole metagenomic shotgun sequencing of fecal samples identified species-level differences between S. hispidus and S. fulviventer, as well as different metabolic pathway functions as a result of differential host microbiome contributions. Furthermore, the microbiome composition of the external sites showed significant sex-based differences while fecal communities were not largely different. CONCLUSIONS: Our study shows that host genetic background potentially exerts homeostatic pressures, resulting in distinct microbiomes for two different inbred cotton rat species. Because of the numerous studies that have uncovered strong relationships between host microbiome, viral infection outcomes, and immune responses, our findings represent a strong contribution for understanding the impact of different microbial communities on viral pathogenesis. Furthermore, we provide novel cotton rat microbiome data as a springboard to uncover the full therapeutic potential of the microbiome against viral infections. SUPPLEMENTARY INFORMATION: The online version contains supplementary material available at 10.1186/s42523-021-00090-8.","Strickland, Britton A.; Patel, Mira C.; Shilts, Meghan H.; Boone, Helen H.; Kamali, Arash; Zhang, Wei; Stylos, Daniel; Boukhvalova, Marina S.; Rosas-Salazar, Christian; Yooseph, Shibu; Rajagopala, Seesandra V.; Blanco, Jorge C. G.; Das, Suman R.",Anim Microbiome,https://www.ncbi.nlm.nih.gov/pubmed/33863395/; https://doi.org/10.1186/s42523-021-00090-8,557
590899,Internet of things (IoT) applications to fight against COVID-19 pandemic,2020-05-05,,"Boudjema, Sophia; Finance, Julie; Coulibaly, Fatoumata; Meddeb, Line; Tissot-Dupont, Hervé; Michel, Moïse; Lagier, Jean Christophe; Million, Matthieu; Radulesco, Thomas; Michel, Justin; Brouqui, Philippe; Raoult, Didier; Fenollar, Florence; Parola, Philippe",Travel Med Infect Dis,https://www.ncbi.nlm.nih.gov/pubmed/32898703/; https://doi.org/10.1016/j.tmaid.2020.101875; https://www.sciencedirect.com/science/article/pii/S1477893920303719?v=s5; https://api.elsevier.com/content/article/pii/S1477893920303719,557
591218,Maxillofacial services in the COVID-19 (SARS-CoV-2) pandemic – early lessons from the Italian experience,2020-06-11,"Bringing together discussion of innate immunity, B cell and T cell responses, vaccine design and efficacy, and the genetics of HIV and AIDS resistance allows us to access the extraordinary complexity of viral immunity and host responsiveness.","Doherty, Peter C.; Turner, Stephen J.",Immunity,https://www.ncbi.nlm.nih.gov/pubmed/17892844/; https://api.elsevier.com/content/article/pii/S1074761307004165; https://www.sciencedirect.com/science/article/pii/S1074761307004165,557
