,title_x,publish_time_x,abstract,authors,journal,url,category
28325,Een nieuw type coronavirus: MERS-CoV,2013-09-26,,"Calisher, C.",Int J Antimicrob Agents,https://www.ncbi.nlm.nih.gov/pmc/articles/PMC7135072/,744
61627,Single use device endoscopy for the diagnosis of acute bacterial rhinosinusitis in primary care: A pilot and feasibility study.,2021-04-18,"PURPOSE OF REVIEW We are in an exhilarating time in which innovations exist to help reduce the impact of cancer for individuals, practitioners and society. Innovative tools in cancer genomics can optimize decision-making concerning appropriate drugs (alone or in combination) to cure or prolong life. The genomic characterization of tumours can also give direction to the development of novel drugs. Next-generation tumour sequencing is increasingly becoming an essential part of clinical decision-making, and, as such, will require appropriate coordination for effective adoption and delivery. RECENT FINDINGS There are several challenges that will need to be addressed if we are to facilitate cancer genomics as part of routine community oncology practice. Recent research into this novel testing paradigm has demonstrated the barriers are at the individual level, while others are at the institution and societal levels. SUMMARY This article, based on the authors' experience in community oncology practice and summary of literature, describes these challenges so strategies can be developed to address these challenges to improve patient outcomes.","Ashbury, Fredrick D; Thompson, Keith; Williams, Casey; Williams, Kirstin",Current opinion in oncology,https://doi.org/10.1097/cco.0000000000000764; https://www.ncbi.nlm.nih.gov/pubmed/34183492/,744
61820,Post-Treatment Head and Neck Cancer Care: National Audit and Analysis of Current Practice in the United Kingdom.,2020-07-30,"Le recours aux dons de lait maternel pasteurisé est la norme de soins dans les hôpitaux pour les nourrissons ayant un très faible poids à la naissance, afin de faire le pont en attendant que les mères puissent allaiter leur enfant. Le but de cette étude était de vérifier si la pasteurisation à l’aide de la méthode de Holder (à 62,5 °C pendant 30 min) serait suffisante pour inactiver le coronavirus du syndrome respiratoire aigu sévère 2 (SRAS-CoV-2) dans des échantillons de lait maternel provenant de donneuses. MÉTHODES: Nous avons inoculé avec le SRAS-CoV-2 des échantillons de lait congelés provenant de 10 donneuses de la Rogers Hixon Ontario Human Milk Bank (la banque de lait maternel de l’Ontario) pour atteindre une concentration finale de 1 × 107 DICT50/mL (50 % de la dose infectante de la culture de tissus par mL). Les échantillons ont été pasteurisés à l’aide de la méthode de Holder ou laissés à la température du laboratoire pendant 30 minutes, puis nous avons mis en culture des dilutions en série sur des cellules Vero E6 durant 5 jours. Nous avons utilisé des échantillons témoins dans cette étude, soit des échantillons de lait provenant des mêmes donneuses, auxquels le virus n’a pas été ajouté (échantillons pasteurisés et non pasteurisés), de même que des réplicats de cellules Vero E6 directement inoculées avec le SRAS-CoV-2. Nous rapportons ici les effets cytopathologiques en DICT50/mL. RÉSULTATS: Nous n’avons détecté aucune activité cytopathologique dans l’ensemble des échantillons de lait contenant le SRAS-CoV-2 pasteurisés à l’aide de la méthode de Holder. Dans les échantillons contenant le SRASCoV-2 qui n’ont pas été pasteurisés, mais plutôt laissés à la température du laboratoire pendant 30 minutes, nous avons observé une réduction du titre infectieux d’environ 1 log. INTERPRÉTATION: La pasteurisation du lait maternel à l’aide de la méthode de Holder (à 62,5 °C pendant 30 min) inactive le SRAS-CoV-2. Ainsi, si du lait maternel provenant de donneuses contenait le virus à la suite d’une transmission par la glande mammaire ou d’une contamination, cette méthode de pasteurisation rendrait le lait sans danger pour la consommation par le nourrisson et la manipulation par les travailleurs de la santé.","Unger, Sharon; Christie-Holmes, Natasha; Guvenc, Furkan; Budylowski, Patrick; Mubareka, Samira; Gray-Owen, Scott D; O'Connor, Deborah L",CMAJ : Canadian Medical Association journal = journal de l'Association medicale canadienne,https://doi.org/10.1503/cmaj.201309-f; https://www.ncbi.nlm.nih.gov/pubmed/33257336/,744
67145,Dissolvable intranasal haemostatic agents for acute epistaxis: a systematic review and meta-analysis.,2021-01-16,"Emilia sonchifolia (L.) DC is a plant used in traditional medicine to treat several viral and bacterial diseases. The antiviral activities of selected Sephadex LH-20 column fractions and HPLC subfractions of an acetone extract of E. sonchifolia leaves were determined in shrimp Penaeus merguiensis primary lymphoid cells infected with either white spot syndrome virus (WSSV) or yellow head virus (YHV). WSSV and YHV replication was quantified using quantitative real-time PCR tests targeted to the VP19 and ORF1b gene transcripts, respectively. In lymphoid organ cells exposed to 100 µg ml⁻¹ of either the Sephadex fraction F14 or the HPLC F14 subfraction SF4, both fractions caused reduced replication, but YHV replication was reduced only by SF4. In the asthiazolyl blue mitochondrial enzyme activity assays to assess extract cytotoxicity, >60% of primary lymphoid organ cells remained viable following exposure to 100 µg ml⁻¹ of either F14 or SF4. GC-MS analysis of the HPLC F14 subfraction SF4 showed that it contained 2,4-di-tert-butylphenol. This study is the first to show that E. sonchifolia leaf extracts might be useful as bioactive agents to protect shrimp against viruses such as WSSV and YHV.","Maikaeo, Lamai; Chotigeat, Wilaiwan; Mahabusarakam, Wilawan",Diseases of aquatic organisms,https://doi.org/10.3354/dao02891; https://www.ncbi.nlm.nih.gov/pubmed/26203887/,744
74664,Investigating the nasal cycle using unilateral peak nasal inspiratory flow and acoustic rhinometry minimal cross-sectional area measurements.,2019,,"Accili, Domenico",Nature metabolism,https://doi.org/10.1038/s42255-020-00339-7; https://www.ncbi.nlm.nih.gov/pubmed/33432203/,744
84037,Introducing an ethanol ablation service for recurrent symptomatic thyroid cysts within the NHS - a prospective study of twenty-six patients.,2020-12-21,"Infectious disease outbreaks are expected to grow exponentially in time when left unchecked. Containment measures such as lockdown and social distancing can drastically alter the growth dynamics of the outbreak. This is the case for the 2019-2020 COVID-19 outbreak, which is characterized by a power-law growth. Strikingly however, the power-law exponent is different across countries. Here I illustrate the relationship between these two extreme scenarios, exponential and power-law growth, based on the impact of superspreaders and lockdown strategies to contain the outbreak. The theory predicts a relationship between the power- law exponent and the time interval between the first case and lockdown that is validated by the observed COVID-19 data across different countries.","Vazquez, Alexei",Physical review. E,https://doi.org/10.1103/physreve.102.040302; https://www.ncbi.nlm.nih.gov/pubmed/33212569/,744
87689,Drainless parotidectomy and the same day discharge with routine use of topical haemostatic agent and Balaclava bandage.,2019,"Pathologic aerophagia is sometimes seen in patients with neurologic disorders. It rarely causes massive bowel distention, ileus, and volvulus. Here, we report the use of esophagogastric separation and abdominal esophagostomy via jejunal interposition to prevent bowel distention caused by severe aerophagia in 2 patients with neurologic disorders in whom the usual nonoperative methods of management failed. In both cases, swallowed air was evacuated via the jejunostomy, eliminating bowel distention. This operation may be useful in patients with neurologic disorders associated with severe aerophagia.","Fukuzawa, Hiroaki; Urushihara, Naoto; Fukumoto, Koji; Sugiyama, Akihide; Mitsunaga, Maki; Watanabe, Kentaro; Hasegawa, Shiro",Journal of pediatric surgery,https://doi.org/10.1016/j.jpedsurg.2011.05.024; https://www.ncbi.nlm.nih.gov/pubmed/22008348/,744
88122,Droplet and Bone Dust Contamination from High-speed Drilling During Mastoidectomy.,2021-02-03,"Chikungunya virus (CHIKV) is a re-emerging mosquito-borne alphavirus that causes severe persistent arthralgia. To better understand the molecular details of CHIKV RNA synthesis and the mode of action of inhibitors, we have developed an in vitro assay to study CHIKV replication/transcription complexes isolated from infected cells. In this assay (32)P-CTP was incorporated into the CHIKV genome, subgenomic (sg) RNA and into a ~7.5 kb positive-stranded RNA, termed RNA II. We mapped RNA II, which was also found in CHIKV-infected cells, to the 5' end of the genome up to the start of the sgRNA promoter region. Most of the RNA-synthesizing activity, negative-stranded RNA and a relatively large proportion of nsP1 and nsP4 were recovered from a crude membrane fraction obtained by pelleting at 15,000 G: . Positive-stranded RNA was mainly found in the cytosolic S15 fraction, suggesting it was released from the membrane-associated replication/transcription complexes (RTCs). The newly synthesized RNA was relatively stable and remained protected from cellular nucleases, possibly by encapsidation. A set of compounds that inhibit CHIKV replication in cell culture was tested in the in vitro RTC assay. In contrast to 3'dNTPs, chain terminators that acted as potent inhibitors of RTC activity, ribavirin triphosphate and 6-aza-UTP did not affect the RNA-synthesizing activity in vitro. In conclusion, this in vitro assay for CHIKV RNA synthesis is a useful tool for mechanistic studies on the RTC and mode of action studies on compounds with anti-CHIKV activity.","Albulescu, Irina C; Tas, Ali; Scholte, Florine E M; Snijder, Eric J; van Hemert, Martijn J",The Journal of general virology,https://doi.org/10.1099/vir.0.069690-0; https://www.ncbi.nlm.nih.gov/pubmed/25135884/,744
88732,Functional expansion pharyngoplasty: Technical update by unidirectional barbed sutures.,2018,,"Thwaites, Guy E; Day, Nicholas P J",The New England journal of medicine,https://doi.org/10.1056/nejmc1703009; https://www.ncbi.nlm.nih.gov/pubmed/28467877/,744
90070,TransOral Endoscopic Surgery for Posterior Palate: A novel approach for lesions at this location.,2018,"Rotator cuff and scapular muscle strengthening exercises are an essential part of shoulder rehabilitation and sports training. Although the effect of exercise training on pain and function have been widely investigated, few studies have focused on the changes in shoulder kinematics and muscle activity after exercise training. Therefore, the purpose of the present study was to investigate the effect of rotator cuff and scapular strengthening exercises on shoulder kinematics and the activation of rotator cuff and scapular muscles in healthy subjects. Thirty-six healthy subjects were recruited and randomly assigned into either a training or control group. Subjects in the training group were trained with rotator cuff and scapular strengthening exercises for 4 weeks. Scapular kinematics and shoulder muscle activity during arm elevation were measured before and after exercise training. After the 4-week training protocol, there was an increase in strength and a decrease in upper trapezius activation in the training group, which is consistent with previous studies. However, no difference was found in scapular kinematics and activation of rotator cuff muscles between the control and training groups after the training protocol. Although the exercise protocol resulted in strength gains for the rotator cuff, these gains did not transfer to an increase in muscle activation during motion. These results demonstrate the difficulty in changing activation patterns of the rotator cuff muscles. © 2016 Orthopaedic Research Society. Published by Wiley Periodicals, Inc. J Orthop Res 34:2079-2088, 2016.","Lin, Yin-Liang; Karduna, Andrew",Journal of orthopaedic research : official publication of the Orthopaedic Research Society,https://doi.org/10.1002/jor.23234; https://www.ncbi.nlm.nih.gov/pubmed/26996811/,744
92833,Rhinology in the COVID-19 era: Our experience from a rhinology tertiary referral hospital and implications for future practice.,2021-01-01,,"Pettigrew, Luisa M; Kumpunen, Stephanie; Mays, Nicholas",BMJ,https://doi.org/10.1136/bmj.m3353; https://www.ncbi.nlm.nih.gov/pubmed/32883685/,744
96146,A simple method for dilating tracheostomal stenosis.,2010,"INTRODUCTION It is unknown which comorbidities and stroke characteristics are associated with elevated cardiac troponin (cTn) levels after stroke. The main objective of this systematic review and meta-analysis is to assess the association of elevated cTn with preexisting cardiovascular comorbidities (eg, coronary artery disease, heart failure and structural heart disease), specific stroke characteristics (eg, infarct/haemorrhage size, stroke severity, insular cortex involvement) and renal failure after ischaemic stroke (IS) or intracranial haemorrhage (ICH). The secondary objective is to evaluate the association of elevated cTn with stroke recurrence and death. METHODS AND ANALYSIS We will include all cross-sectional, case-control, cohort studies and clinical trials involving IS and ICH adult patients (≥18 years), published between 1 January 1990 and 31 December 2020 in English or Spanish, reporting the proportion with elevated cTn. We will search PubMed, EMBASE and Web of Science by applying predefined search terms. Two reviewers will independently screen titles and abstracts, retrieve full texts, extract the data in a predesigned form, and assess the risk of bias. We will apply random-effects or fixed-effects meta-analyses to estimate the association between cardiovascular comorbidities, stroke characteristics and renal failure with cTn elevation. We will report results as risk ratios or ORs. We will perform sensitivity analyses for subtypes of cTn (cTn-I and cTn-T), regular versus high-sensitivity assays, and type of stroke (IS vs ICH). We will estimate heterogeneity by using t2 Q and I2 measures. We will use funnel plots, Rosenthal's Fail-Safe N, Duval and Tweedie's trim and fill procedure, and Egger's regression intercept to assess publication bias. ETHICS AND DISSEMINATION This review will be based on published data and does therefore not require ethical clearance. The results will be published in peer-reviewed journals. PROSPERO REGISTRATION NUMBER CRD42020203126.","Jimenez-Ruiz, Amado; Fridman, Sebastian; Sposato, Luciano A",BMJ open,https://doi.org/10.1136/bmjopen-2020-043613; https://www.ncbi.nlm.nih.gov/pubmed/33500289/,744
98693,An anatomically consistent approach for performing transthyrohyoid injection laryngoplasty.,2019,"Acute aortic syndrome (AAS) is a constellation of potentially life-threatening acute aortic diseases. The spectrum includes penetrating atherosclerotic ulcer, intramural haematoma, dissection, and unstable thoracic aneurysm. AAS cannot be reliably diagnosed clinically and multidetector computed tomography (MDCT) has revolutionized the diagnosis and management of this group of conditions in the acute setting due to its availability, speed, and accuracy. The purpose of this review is to illustrate key MDCT findings of AAS. Imaging techniques, radiological findings, and common pitfalls are also discussed.","Chiu, K W H; Lakshminarayan, R; Ettles, D F",Clinical radiology,https://doi.org/10.1016/j.crad.2013.03.001; https://www.ncbi.nlm.nih.gov/pubmed/23582433/,744
102154,Telephone triage is effective in identifying nasal fractures that require manipulation.,2021-01-27,"Ten years have elapsed since the severe acute respiratory syndrome outbreak, which resulted in more than 8000 cases worldwide with more than 700 deaths. Recently, a new coronavirus, the Middle East Respiratory Syndrome Coronavirus emerged, causing serious respiratory cases and death. By the end of August 2013, 108 cases including 50 deaths were reported. The authors discuss a coronavirus-associated severe acute respiratory syndrome, which was detected in Hungary in 2005 and highlight its significance in 2013. In 2005 the patient was hospitalized and all relevant clinical and microbiological tests were performed. Based on the IgG antibody positivity of the serum samples, the patient was diagnosed as having severe acute respiratory syndrome coronavirus infection in the past. The time and source of the infection remained unknown. The condition of the patient improved and he was discharged from the hospital. The case raises the possibility of infections in Hungary imported from remote areas of the world and the importance of thorough examination of patients with severe respiratory syndrome with unknown etiology.","Rókusz, László; Jankovics, István; Jankovics, Máté; Sarkadi, Júlia; Visontai, Ildikó",Orvosi hetilap,https://doi.org/10.1556/oh.2013.29763; https://www.ncbi.nlm.nih.gov/pubmed/24240525/,744
108298,Validated swallowing outcomes following open transcervical cricopharyngeal myotomy for the treatment of symptomatic pharyngeal pouches.,2021-03-29,,"Thomas, Sandra P",Issues in mental health nursing,https://doi.org/10.1080/01612840.2021.1913016; https://www.ncbi.nlm.nih.gov/pubmed/33886420/,744
109184,"Transoral endoscopic video-assisted lateral oropharyngeal resection: A reliable technique for early-stage tonsil tumours, our experience of 19 patients.",2019,"The aim of our study was to validate the method of head-shake static posturography (HS-posturography) in healthy individuals and to establish the value of this novel method in the diagnostics of patients with unilateral vestibular lesion (UV). The study included 202 participants divided into two groups, one consisting of 133 patients with canal paresis CP > 19% and one of 69 healthy subjects. Participant was tested according to the standard protocol of static posturography (SP), and with head movements of 0.3 Hz (HS 40), 0.6 Hz (HS 70) in random order controlled by a metronome. HS-posturography revealed a similar repeatability and internal consistency as the standard posturography. In patients with UV, 4th condition revealed higher sensitivity (74%) and specificity (71%) in HS 40 than in the standard posturography (67%, 65% respectively) and HS 70 (54%, 70% respectively). Static posturography and HS- posturography revealed a high reliability of the testing method. The head movements added to static posturography improve the sensitivity and specificity of the method in group with vestibular impairment. The most important test for that purpose seems to be the one on unstable surface with the eyes closed, with low frequency of head movements.","Janc, Magdalena; Sliwinska-Kowalska, Mariola; Politanski, Piotr; Kaminski, Marek; Jozefowicz-Korczynska, Magdalena; Zamyslowska-Szmytke, Ewa",Scientific reports,https://doi.org/10.1038/s41598-021-85745-x; https://www.ncbi.nlm.nih.gov/pubmed/33737683/,744
111015,Should twin-mode white-light and virtual chromoendoscopy of pre-defined mucosal stations be considered a standard of care for transnasal panendoscopy?,2021-04-17,"CLINICAL QUESTION Are Echinacea products associated with a reduced incidence and a shorter duration of common colds compared with placebo? BOTTOM LINE Individual prophylaxis trials show no association with prevention of the common cold, but exploratory meta-analysis suggests that Echinacea products may be associated with a small reduction in cold incidence. In treatment trials, there was no association of Echinacea products with a shorter duration of colds.","Karsch-Völk, Marlies; Barrett, Bruce; Linde, Klaus",JAMA,https://doi.org/10.1001/jama.2014.17145; https://www.ncbi.nlm.nih.gov/pubmed/25668266/,744
124105,A prospective randomised trial of LigaSure Small Jaw® versus conventional neck dissection in head and neck cancer patients.,2017,"BACKGROUND Studies show that the COVID-19 pandemic has promoted distress and stress-related symptoms in the general population. It has also increased the suicide rate in vulnerable groups who cannot handle the social and psychological consequences of the pandemic and the measures in place to halt it. OBJECTIVE In this study, we compared the lethality of suicide attempts and the methods chosen between the three months before the COVID-19 pandemic and three months during curfew and lockdown in Saudi Arabia. METHODS This is a retrospective, causal-comparative study conducted at King Saud Medical City in Riyadh, Saudi Arabia. A total of 62 suicide attempt cases between January 2020 and June 2020 were included in this study. The scale for assessment of the lethality of suicide attempts (SALSA) was used for comparison, and cross-tabulation was used for the data of suicide methods. RESULTS There was a significant difference (P = 0.003) in the total SALSA score before and during the COVID-19 lockdown. The scores of lethality of suicide attempts were high during the lockdown. No significant difference was found in the suicide methods selected between the two time periods. However, the use of psychotropic medication overdose and self-immolation were prominent during the lockdown period. CONCLUSIONS Our findings suggest that the lockdown during the COVID-19 pandemic is likely associated with increased lethality of suicide attempts as well as an increased suicide rate. The development of appropriate mental health services is required.","Almaghrebi, Asma H",Current pediatric reviews,https://doi.org/10.2174/1573396317666210528123059; https://www.ncbi.nlm.nih.gov/pubmed/34053428/,744
127583,Pediatric Laryngeal Squamous Cell Carcinoma: Systematic Review and Pooled Analysis.,2021-01-21,In spring 2009 a new strain of influenza A(H1N1) emerged and caused a worldwide pandemic. This study utilized a large collection of respiratory specimens from suspected cases of influenza A(H1N1) in the UK West Midlands during the pandemic in order to investigate which other respiratory viruses were circulating and whether they played any role in the increased hospitalization rates seen during that period. Study specimens were selected from community and hospitalized patients positive and negative for influenza A(H1N1) and tested by PCR for other respiratory viruses. A number of infections diagnosed as influenza during the summer influenza outbreak were found to be due to other virus infections (most commonly rhinovirus). No statistically significant difference was found between the rates of respiratory virus co-infection with H1N1 in patients from community or hospital locations suggesting underlying factors were likely to be more significant than viral co-infections in determining severity of influenza A(H1N1) disease.,"Tanner, H E; Curran, M D; Boxall, E H; Osman, H",Epidemiology and infection,https://doi.org/10.1017/s0950268811002251; https://www.ncbi.nlm.nih.gov/pubmed/22074791/,744
130700,Expiratory airflow obstruction due to tracheostomy tube: a spirometric studyin 50 patients.,2020-04-29,"BACKGROUND COVID-19 patients develop pneumonia generally associated to lymphopenia and severe inflammatory response due to uncontrolled cytokine release. These mediators are transcriptionally regulated by the JAK-STAT signaling pathways, which can be disabled by small molecules. METHODS A group of subjects (n = 20) was treated with baricitinib according to an off-label use of the drug. The study was designed as an observational longitudinal trial and approved by the local ethical committee. The patients were treated with baricitinib 4 mg twice daily for 2 days, followed by 4 mg per day for the remaining 7 days. Changes in the immune phenotype and expression of pSTAT3 in blood cells were evaluated and correlated with serum-derived cytokine levels and antibodies anti-SARS-CoV-2. In a single treated patient, we evaluated also the alteration of myeloid cell functional activity. RESULTS We provided evidences that baricitinib-treated patients have a marked reduction in serum levels of interleukin (IL)-6, IL-1β and tumor necrosis factor (TNF)-α, a rapid recovery in circulating T and B cell frequencies, and increased antibody production against SARS-CoV-2 spike protein, which were clinically associated with a reduction in oxygen flow need and progressive increase in the P/F. CONCLUSION Baricitinib prevented the progression towards a severe/extreme form of the viral disease by modulating the patients' immune landscape and these changes were associated with a safer and favorable clinical outcome of patients with COVID-19 pneumonia. TRIAL REGISTRATION The ClinicalTrials.gov identifier of this project is protocol NCT04438629. FUNDING This work was supported by Fondazione Cariverona (ENACT Project) and Fondazione TIM.","Bronte, Vincenzo; Ugel, Stefano; Tinazzi, Elisa; Vella, Antonio; De Sanctis, Francesco; Canè, Stefania; Batani, Veronica; Trovato, Rosalinda; Fiore, Alessandra; Petrova, Varvara; Hofer, Francesca; Barouni, Roza Maria; Musiu, Chiara; Caligola, Simone; Pinton, Laura; Torroni, Lorena; Polati, Enrico; Donadello, Katia; Friso, Simonetta; Pizzolo, Francesca; Iezzi, Manuela; Facciotti, Federica; Pelicci, Pier Giuseppe; Righetti, Daniela; Bazzoni, Paolo; Rampudda, Mariaelisa; Comel, Andrea C; Mosaner, Walter; Lunardi, Claudio; Olivieri, Oliviero",The Journal of clinical investigation,https://doi.org/10.1172/jci141772; https://www.ncbi.nlm.nih.gov/pubmed/32809969/,744
