,title_x,publish_time_x,abstract,authors,journal,url,category
122540,THROMBOELASTOGRAPHY IN THE HEALTHY ASIAN ELEPHANT ( ELEPHAS MAXIMUS): REFERENCE INTERVALS AND EFFECTS OF STORAGE.,2018,"BACKGROUND Experimental studies showed that controlled variable ventilation (CVV) yielded better pulmonary function compared to non-variable ventilation (CNV) in injured lungs. We hypothesized that CVV improves intraoperative and postoperative respiratory function in patients undergoing open abdominal surgery. METHODS Fifty patients planned for open abdominal surgery lasting >3 h were randomly assigned to receive either CVV or CNV. Mean tidal volumes and PEEP were set at 8 ml kg-1 (predicted body weight) and 5 cm H2O, respectively. In CVV, tidal volumes varied randomly, following a normal distribution, on a breath-by-breath basis. The primary endpoint was the forced vital capacity (FVC) on postoperative Day 1. Secondary endpoints were oxygenation, non-aerated lung volume, distribution of ventilation, and pulmonary and extrapulmonary complications until postoperative Day 5. RESULTS FVC did not differ significantly between CVV and CNV on postoperative Day 1, 61.5 (standard deviation 22.1) % vs 61.9 (23.6) %, respectively; mean [95% confidence interval (CI)] difference, -0.4 (-13.2-14.0), P=0.95. Intraoperatively, CVV did not result in improved respiratory function, haemodynamics, or redistribution of ventilation compared to CNV. Postoperatively, FVC, forced expiratory volume at the first second (FEV1), and FEV1/FVC deteriorated, while atelectasis volume and plasma levels of interleukin-6 and interleukin-8 increased, but values did not differ between groups. The incidence of postoperative pulmonary and extrapulmonary complications was comparable in CVV and CNV. CONCLUSIONS In patients undergoing open abdominal surgery, CVV did not improve intraoperative and postoperative respiratory function compared with CNV. CLINICAL TRIAL REGISTRATION NCT 01683578.","Spieth, P M; Güldner, A; Uhlig, C; Bluth, T; Kiss, T; Conrad, C; Bischlager, K; Braune, A; Huhle, R; Insorsi, A; Tarantino, F; Ball, L; Schultz, M J; Abolmaali, N; Koch, T; Pelosi, P; Gama de Abreu, M",British journal of anaesthesia,https://doi.org/10.1016/j.bja.2017.11.078; https://www.ncbi.nlm.nih.gov/pubmed/29452815/,855
125615,EMERGENCY ANESTHESIA AND EXPLORATORY LAPAROTOMY IN A COMPROMISED PACIFIC WHITE-SIDED DOLPHIN (LAGENORHYNCHUS OBLIQUIDENS).,2017,"Infectious bronchitis virus (IBV) isolates recovered in Russia, Ukraine, and Kazakhstan between 2007 and 2010 were subjected to molecular characterization and compared with those isolated a decade ago. The IBV genome was detected in 202 out of 605 field samples from chickens with various clinical signs. Partial sequencing of the S1 gene revealed 153 vaccine strains and 49 field isolates of several genetic groups. Massachusetts, 793/B and D274 remained the predominant IBV genotypes along with QX, whereas B1648, Italy-02, Arkansas and variants accounted for about 12% of the total number. Three IBVs contained recombinant S1 gene sequences comprising genome fragments of QX-type field isolates and vaccine strains H120 (UKR/02/2009) or 4/91 (RF/03/2010), and vaccine strains H120 and D274 (RF/01/2010). The results of the present study showed a significant decline in prevalence of variant IBVs and a further spread of QX-type isolates in commercial chicken flocks in Russia as compared with the 1998 to 2002 data.","Ovchinnikova, Evgeniya V; Bochkov, Yury A; Shcherbakova, Lidiya O; Nikonova, Zoya B; Zinyakov, Nikolay G; Elatkin, Nikolay P; Mudrak, Nataliya S; Borisov, Alexander V; Drygin, Vladimir V",Avian pathology : journal of the W.V.P.A,https://doi.org/10.1080/03079457.2011.605782; https://www.ncbi.nlm.nih.gov/pubmed/21854179/,855
128677,BASELINE PHYSIOLOGIC AND HEMATOLOGIC HEALTH IN WILD-CAUGHT MUSKRATS (ONDATRA ZIBETHICUS) FROM A NEAR-PRISTINE ECOSYSTEM IN NORTHERN MINNESOTA.,2021-06-01,"This article explores a tension at the core of the concept of herd immunity that has been overlooked in public and scientiﬁc discussions‒namely: how can immunity, a phenomenon of individual biological defenses, be made relevant to populations? How can collectives be considered ""immune""? Over the course of more than a century of use of the term, scientists have developed many different understandings of the concept in response to this inherent tension. Originating among veterinary scientists in the United States in the late 19th century, the concept was adopted by British scientists researching human infectious disease by the early 1920s. It soon became a staple concept for epidemiologists interested in disease ecology, helping to articulate the population dynamics of diseases such as diphtheria and inﬂuenza. Finally, though more traditional understandings of the concept remained in scientiﬁc use, in the era after World War II, it increasingly came to signal the objective and outcome of mass vaccination. Recognizing the complexity of scientiﬁc efforts to resolve the paradox of herd immunity may help us consider the best distribution of immunity against severe acute respiratory syndrome coronavirus 2 (SARS-CoV-2).(Am J Public Health. Published online ahead of print June 10, 2021: e1-e8. https://doi.org/10.2105/AJPH.2021.306264).","Robertson, David",American journal of public health,https://doi.org/10.2105/ajph.2021.306264; https://www.ncbi.nlm.nih.gov/pubmed/34111938/,855
133519,SUCCESSFUL DIAGNOSIS AND TREATMENT OF BILATERAL PERINEAL HERNIAS IN A SKUNK (MEPHITIS MEPHITIS).,2015,"AIM Nationwide lockdowns and social restrictions during the COVID-19 pandemic have reduced childhood infections. We assessed how many items of systemic antibiotics and asthma medicines were dispensed to children aged-0-12 years in Finland before and during the pandemic and analysed the reimbursement costs. METHODS The data came from the national Finnish register of reimbursable prescriptions, which is maintained by the country's Social Insurance Institution. It included all prescriptions for antibiotics and asthma medicines dispensed to children aged 0-12 years in 2019 and 2020. Prescription rates per 1,000 children were calculated for each quarter and compared using rate ratios and 95% confidence intervals (95% CI). RESULTS Overall dispensing for antibiotics decreased by 55.3% and was most prominent for macrolides for children aged 0-5 years (59.6%, 95% CI 60.9-58.2%). Asthma medicines decreased by 19.8% and the most prominent reduction was in short-acting beta-agonists for children aged 0-5 years (35.2%, 95% CI 36.1-34.2%). These reduced reimbursement costs by 3.4 million Euros from 2019 to 2020. CONCLUSION This nationwide study showed that the number of antibiotics and asthma medicines decreased by 59.6% and 19.8% respectively from 2019 to 2020, generating a cost saving of 3.4 million Euros.","Haapanen, Marjut; Renko, Marjo; Artama, Miia; Kuitunen, Ilari",Acta paediatrica,https://doi.org/10.1111/apa.16144; https://www.ncbi.nlm.nih.gov/pubmed/34626007/,855
136483,CUTANEOUS EPITHELIOTROPIC T-CELL LYMPHOMA WITH METASTASES IN A VIRGINIA OPOSSUM (DIDELPHIS VIRGINIANA).,2015,,"Dias, Daniel Aguiar; de Brito, Lara Albuquerque; Neves, Luciana de Oliveira; Paiva, Roberto Guido Santos; Barbosa Júnior, Octávio Alencar; Tavares-Júnior, José Wagner Leonel",Arquivos de neuro-psiquiatria,https://doi.org/10.1590/0004-282x20200184; https://www.ncbi.nlm.nih.gov/pubmed/33331467/,855
138386,ANTEMORTEM DIAGNOSIS AND SUCCESSFUL TREATMENT OF A COMPLETE MOLAR PREGNANCY IN A GERIATRIC BONOBO ( PAN PANISCUS).,2018,"The aim was to evaluate a novel method of threshold-free prediction of brain infarct from computed tomography perfusion (CTP) imaging in comparison to conventional ischemic thresholds. In a multicenter cohort of 161 patients with acute large vessel occlusion who received endovascular therapy, brain infarction was predicted by CTP using (1) optimized parameter cut-off values determined by ROC curve analysis and (2) probabilistic logistic regression threshold-free analysis. Predicted infarct volumes and prediction errors based on four perfusion parameter maps were compared against observed infarcts. In 93 patients with successful recanalization, the mean observed infarct volume was 35.7 ± 61.9 ml (the reference for core infarct not savable by reperfusion). Optimal parameter thresholds predicted mean infarct volumes between 53.2 ± 44.4 and 125.0 ± 95.4 ml whereas threshold-free analysis predicted mean volumes between 35.9 ± 28.5 and 36.1 ± 29.0 ml. In 68 patients with persistent occlusion, the mean observed infarct volume was 113.4 ± 138.3 ml (the reference to define penumbral infarct savable by reperfusion). Predicted mean infarct volumes by parameter thresholds ranged from 91.4 ± 81.5 to 163.8 ± 135.7 ml, by threshold-free analysis from 113.2 ± 89.9 to 113.5 ± 89.0 ml. Threshold-free prediction of infarct volumes had a higher precision and lower patient-specific prediction error than conventional thresholding. Penumbra to core lesion mismatch estimate may therefore benefit from threshold-free CTP analysis.","Flottmann, Fabian; Broocks, Gabriel; Faizy, Tobias Djamsched; Ernst, Marielle; Forkert, Nils Daniel; Grosser, Malte; Thomalla, Götz; Siemonsen, Susanne; Fiehler, Jens; Kemmling, André",Scientific reports,https://doi.org/10.1038/s41598-017-06882-w; https://www.ncbi.nlm.nih.gov/pubmed/28751692/,855
146176,"SEDATIVE, CARDIORESPIRATORY, AND THERMOREGULATORY EFFECTS OF ALFAXALONE ON BUDGERIGARS (MELOPSITTACUS UNDULATUS).",2020-03-17,,"Whitcroft, Katherine Lisa; Hummel, Thomas",JAMA,https://doi.org/10.1001/jama.2020.8391; https://www.ncbi.nlm.nih.gov/pubmed/32432682/,855
148711,SERUM BIOCHEMISTRY AND SELECT MINERAL PARAMETERS OF PRE-RELEASE SUNDA PANGOLINS (MANIS JAVANICA) FOLLOWING REHABILITATION IN VIETNAM.,2021-04-01,"The 288-nucleotide (nt) 3' untranslated region (UTR) in the genome of the bovine coronavirus (BCoV) and 339-nt 3' UTR in the severe acute respiratory syndrome (SARS) coronavirus (SCoV) can each replace the 301-nt 3' UTR in the mouse hepatitis coronavirus (MHV) for virus replication, thus demonstrating common 3' cis-replication signals. Here, we show that replacing the 209-nt MHV 5' UTR with the ∼63%-sequence-identical 210-nt BCoV 5' UTR by reverse genetics does not yield viable virus, suggesting 5' end signals are more stringent or possibly are not strictly 5' UTR confined. To identify potential smaller, 5'-common signals, each of three stem-loop (SL) signaling domains and one inter-stem-loop domain from the BCoV 5' UTR was tested by replacing its counterpart in the MHV genome. The SLI/II domain (nucleotides 1 to 84) and SLIII domain (nucleotides 85 to 141) each immediately enabled near-wild-type (wt) MHV-like progeny, thus behaving similarly to comparable 5'-proximal regions of the SCoV 5' UTR as shown by others. The inter-stem-loop domain (nt 142 to 173 between SLs III and IV) enabled small plaques only after genetic adaptation. The SLIV domain (nt 174 to 210) required a 16-nt extension into BCoV open reading frame 1 (ORF1) for apparent stabilization of a longer BCoV SLIV (nt 174 to 226) and optimal virus replication. Surprisingly, pleiomorphic SLIV structures, including a terminal loop deletion, were found among debilitated progeny from intra-SLIV chimeras. The results show the inter-stem-loop domain to be a potential novel species-specific cis-replication element and that cis-acting SLIV in the viral genome extends into ORF1 in a manner that stabilizes its lower stem and is thus not 5' UTR confined.","Guan, Bo-Jhih; Wu, Hung-Yi; Brian, David A",Journal of virology,https://doi.org/10.1128/jvi.00263-11; https://www.ncbi.nlm.nih.gov/pubmed/21430057/,855
157534,"GROWTH, HUSBANDRY, AND DIETS OF FIVE SUCCESSFULLY HAND-REARED ORPHANED GIRAFFE CALVES (GIRAFFA CAMELOPARDALIS ROTHSCHILDI AND GIRAFFA CAMELOPARDALIS RETICULATA).",2019,"BACKGROUND Spinal muscular atrophy (SMA) is a genetic motor neuron disease related to deletions in the SMN1 gene. There is mounting evidence that the disease is not restricted to motor neurons. In this neuroimaging study, we aimed to investigate the presence of in-vivo cerebellar damage in adult SMA patients not treated with disease-modifying treatment. METHODS Twenty-five molecularly confirmed patients with SMA type III or IV and 25 healthy controls underwent MRI with cerebellar focused structural analysis by the CERES automated pipeline. Volumetry (total and gray matter-GM) as well as cortical thickness of the cerebellar lobules were compared in both groups. Full clinical and demographic data were then assessed for correlations with cerebellar imaging findings. RESULTS Volumes of cerebellar lobules VIIIB (right), IX and X were significantly smaller in patients with SMA. Lobule IX also had GM atrophy in comparison to controls. We found no significant correlation between clinical findings and cerebellar damage. CONCLUSIONS Neuroimaging detects cerebellar structural changes in adult SMA patients, suggesting that neurodegeneration is not confined to the lower motor neurons in the disease.","de Borba, Fabrício Castro; Querin, Giorgia; França, Marcondes Cavalcante; Pradat, Pierre-François",Journal of neurology,https://doi.org/10.1007/s00415-020-09875-4; https://www.ncbi.nlm.nih.gov/pubmed/32388834/,855
183534,Canine adenovirus type 1 in a fennec fox (Vulpes zerda).,2014,"Surf tourism is the principal development driver in many coastal communities around the world. Surf tourism development brings economic opportunities to residents in coastal destinations, but has also been criticized for associations with gentrification, pollution, and inequity. While many have speculated that surfers represent a crisis-resistant tourist segment, this had not yet been empirically demonstrated, nor had the sustainability implications of their travel during crises been explored. Building on ethnographic observations and two interview phases with 25 resident surfers in Bocas del Toro, Panama, this is the first study to do both. The findings reveal that the pandemic exacerbated existing sustainability challenges by accelerating development near surf-breaks, fomenting tensions within the surf community (related to surf tourism business operations and the distribution of benefits) and facilitating residents to surf more frequently—exacerbating surf-resource crowding. Evidence also revealed, however, a potential shift in surfers’ collective consciousness in the context of the pandemic, which reduced conflicts between visiting and resident surfers. This paper exposes the urgent need for stakeholders in surf communities, and particularly surf tourism business owners, to cooperate in order to preserve surf experiences that are vital to resident mental/physical health and well-being, as well as the attractiveness as a surf tourism destination.","Mach, Leon John",Societies,https://doi.org/10.3390/soc11030075,855
184602,Renal flagellate infections in reptiles: 29 cases.,2014,"This paper intends to present the potential technologies for sustainable tourism development and promotion of Nepal. Based on secondary literature, various emerging technologies that help to reduce manual works, maximize productivity and ensure the physical security of entities have been explored in the paper. Similarly, some challenges of technological interventions and needful steps to overcome the obstacles are also illustrated. Moreover, this paper also addresses the impacts of the prevailing COVID- 19 crisis on tourism in Nepal and puts forward the needful suggestions to mitigate the crisis. It is hoped that this paper can be a reference to scholars, tourism stakeholders, and policymakers as it delivers plentiful information on the potentialities and feasibilities of ICT implementation in Nepal.","Acharya, Rashmi; en,",Asean Journal On Hospitality And Tourism,https://doi.org/10.5614/ajht.2021.19.1.04,855
184690,Sensitivity and specificity of a nested polymerase chain reaction for detection of lentivirus infection in lions (Panthera leo).,2010,Unknown,,,https://api.elsevier.com/content/article/pii/B9780124653306500208; https://www.sciencedirect.com/science/article/pii/B9780124653306500208,855
184959,Mycotic proventriculitis in gray partridges (Perdix perdix) on two game bird farms.,2008,"Coronavirus disease-2019 (COVID-19) provokes a hypercoagulable state with increased incidence of thromboembolism and mortality. Platelets are major effectors of thrombosis and hemostasis. Suitable animal models are needed to better understand COVID-19-associated coagulopathy (CAC) and underlying platelet phenotypes. Here, we assessed K18-hACE2 mice undergoing a standardized SARS-CoV-2 infection protocol to study dynamic platelet responses via mass spectrometry-based proteomics. In total, we found significant changes in >1,200 proteins. Strikingly, protein alterations occurred rapidly by 2 days post-infection (dpi) and preceded outward clinical signs of severe disease. Pathway enrichment analysis of 2dpi platelet proteomes revealed that SARS-CoV-2 infection upregulated complement-coagulation networks (F2, F12, CFH, CD55/CD59), platelet activation-adhesion-degranulation proteins (PF4, SELP, PECAM1, HRG, PLG, vWF), and chemokines (CCL8, CXCL5, CXCL12). When mice started to lose weight at 4dpi, pattern recognition receptor signaling (RIG-I/MDA5, CASP8, MAPK3), and interferon pathways (IFIT1/IFIT3, STAT1) were predominant. Interestingly, SARS-CoV-2 spike protein in the lungs was observed by immunohistochemistry, but in platelets was undetected by proteomics. Similar to patients, K18-hACE2 mice during SARS-CoV-2 infection developed progressive lymphohistiocytic interstitial pneumonia with platelet aggregates in the lungs and kidneys. In conclusion, this model recapitulates activation of coagulation, complement, and interferon responses in circulating platelets, providing valuable insight into platelet pathology during COVID-19. Key Points SARS-CoV-2-infected humanized ACE2 mice recapitulate platelet reprogramming towards activation-degranulation-aggregation. Complement/coagulation pathways are dominant in platelets at 2 days post-infection (dpi), while interferon signaling is dominant at 4dpi.","Subramaniam, Saravanan; Hekman, Ryan Matthew; Jayaraman, Archana; O’Connell, Aoife Kateri; Montanaro, Paige; Blum, Benjamin; Kenney, Devin; Ericsson, Maria; Ravid, Katya; Crossland, Nicholas A; Emili, Andrew; Douam, Florian; Bosmann, Markus",bioRxiv,https://doi.org/10.1101/2021.08.19.457020,855
187403,Baseline assessment of ophthalmic parameters in the greater one-horned rhinoceros (Rhinoceros unicornis).,2014,,"Ebell, Mark H; Barry, Henry C",American family physician,https://www.ncbi.nlm.nih.gov/pubmed/32603079/,855
190372,"Hematology and serum biochemistry of Sumatran rhinoceroses (Dicerorhinus sumatrensis) in a rainforest sanctuary in Way Kambas National Park, Indonesia.",2013,"1. Infection with SARS coronavirus (SARS-CoV) induces a cellular stress condition known as the unfolded protein response (UPR). UPR induction is mediated primarily by viral spike (S) protein. The modulation of UPR by S protein involves activation of PERK protein kinase. Other branches of the UPR pathways controlled by IRE1 and ATF6 proteins, respectively, are not involved. 2. The protease inhibitor Ben-HCl effectively suppresses SARS-CoV infection by blocking virus entry. Viral infectivity is associated with the cleavage of S protein by the cellular protease factor Xa. 3. Two new aspects of the interaction between SARS-CoV S protein and the cell have been defined. These have important implications in the pathogenesis of SARS, providing opportunities for developing vaccines and antivirals against SARS-CoV. 4. Counteracting the UPR and targeting the cleavage of S protein with small molecule pharmaceutical agents represent two new anti-SARS-CoV strategies. 5. The receptor-binding domain of S protein delivered via adeno-associated virus can efficiently induce mucosal immunity and provide long-term protection against SARS-CoV infection.","Jin, D Y; Zheng, B J",Hong Kong medical journal = Xianggang yi xue za zhi,https://www.ncbi.nlm.nih.gov/pubmed/19258633/,855
190819,BILATERAL HYDRONEPHROSIS IN A SUGAR GLIDER (PETAURUS BREVICEPS).,2016,"BACKGROUND Despite the potential for rapid, asynchronous, documentable communication, the use of e-mail for physician-patient communication has not been widely adopted. OBJECTIVE To survey physicians currently using e-mail with their patients daily to understand their experiences. METHODS In-depth phone interviews of 45 physicians currently using e-mail with patients were audio taped and transcribed verbatim. Two investigators independently qualitatively coded comments. Differences were adjudicated by group consensus. RESULTS Almost all of the 642 comments from these physicians who currently use e-mail with patients daily could be grouped into 1 of 4 broad domains: (1) e-mail access and content, (2) effects of e-mail on the doctor-patient relationship, (3) managing clinical issues by e-mail, and (4) integrating e-mail into office processes. The most consistent theme was that e-mail communication enhances chronic-disease management. Many physicians also reported improved continuity of care and increased flexibility in responding to nonurgent issues. Integration of e-mail into daily workflow, such as utilization of office personnel, appears to be a significant area of concern for many of the physicians. For other issues, such as content, efficiency of e-mail, and confidentiality, there were diverging experiences and opinions. Physicians appear to be selective in choosing which patients they will communicate with via e-mail, but the criteria for selection is unclear. CONCLUSION These physician respondents did perceive benefits to e-mail with a select group of patients. Several areas, such as identifying clinical situations where e-mail communication is effective, incorporating e-mail into office flow, and being reimbursed for online medical care/communication, need to be addressed before this mode of communication diffuses into most practices.","Patt, Madhavi R; Houston, Thomas K; Jenckes, Mollie W; Sands, Daniel Z; Ford, Daniel E",Journal of medical Internet research,https://www.ncbi.nlm.nih.gov/pubmed/12857665/,855
191384,Transitional cell carcinomas in four fishing cats (Prionailurus viverrinus).,2004,"PURPOSE Tumor-derived exosomes are proposed as a new type of cancer vaccine. Heat shock proteins are potent Th1 adjuvant, and heat stress can induce heat shock protein and MHC-I expression in tumor cells, leading to the increased immunogenicity of tumor cells. To improve the immunogenicity of exosomes as cancer vaccine, we prepared exosomes from heat-stressed carcinoembryonic antigen (CEA)-positive tumor cells (CEA+/HS-Exo) and tested the efficacy of these exosomes in the induction of CEA-specific antitumor immunity. EXPERIMENTAL DESIGN First, we identified the composition of CEA+/HS-Exo and observed their effects on human dendritic cell maturation. Then, we evaluated their ability to induce a CEA-specific immune response in vivo in HLA-A2.1/Kb transgenic mice and CEA-specific CTL response in vitro in HLA-A*0201+ healthy donors and HLA-A*0201+CEA+ cancer patients. RESULTS CEA+/HS-Exo contained CEA and more heat shock protein 70 and MHC-I and significantly induced dendritic cell maturation. Immunization of HLA-A2.1/Kb transgenic mice with CEA+/HS-Exo was more efficient in priming a CEA-specific CTL, and the CTL showed antitumor effect when adoptively transferred to SW480-bearing nude mice. Moreover, in vitro incubation of lymphocytes from HLA-A*0201+ healthy donors and HLA-A*0201+CEA+ cancer patients with CEA+/HS-Exo-pulsed autologous dendritic cells induces HLA-A*0201-restricted and CEA-specific CTL response. CONCLUSIONS Our results show that CEA+/HS-Exo has superior immunogenicity than CEA+/Exo in inducing CEA-specific CTL response and suggest that exosomes derived from heat-stressed tumor cells may be used as efficient vaccine for cancer immunotherapy.","Dai, Shengming; Wan, Tao; Wang, Baomei; Zhou, Xiangyang; Xiu, Fangming; Chen, Taoyong; Wu, Yanfeng; Cao, Xuetao",Clinical cancer research : an official journal of the American Association for Cancer Research,https://www.ncbi.nlm.nih.gov/pubmed/16243831/,855
