,title_x,publish_time_x,abstract,authors,journal,url,category
192143,Systemic calicivirus epidemic in captive exotic felids.,2007,"The potential role for serological tests in the current COVID-19 pandemic has generated very considerable recent interest across many sectors worldwide, inter alia pathologists seeking additional weapons for their armoury of diagnostic tests; epidemiologists seeking tools to gain seroprevalence data that will inform improved models of the spread of disease; research scientists seeking tools to study the natural history of COVID-19 disease; vaccine developers seeking tools to assess vaccine efficacy in clinical trials; and companies and governments seeking tools to aid return-to-work decision-making. However, much of the local debate to date has centred on questions surrounding whether regulatory approval processes are limiting access to serological tests, and has not paused to consider the intrinsically limiting impact of underlying fundamental biology and immunology on where and how different COVID-19 serological tests can usefully be deployed in the response to the current pandemic. We review, from an immunological perspective, recent experimental evidence on the time-dependency of adaptive immune responses following SARS-CoV-2 infection and the impact of this on the sensitivity and specificity of COVID-19 antibody tests made at different time points post infection. We interpret this scientific evidence in terms of mooted clinical applications for current COVID-19 antibody tests in identifying acute infections, in confirming recent or past infections at the individual and population level, and in detecting re-infection and protective immunity. We conclude with guidance on where current COVID-19 antibody tests can make a genuine impact in the pandemic.","Gray, C M; Peter, J; Mendelson, M; Madhi, S; Blackburn, J M",South African medical journal = Suid-Afrikaanse tydskrif vir geneeskunde,https://www.ncbi.nlm.nih.gov/pubmed/32880263/,855
192309,Canine distemper in terrestrial carnivores: a review.,2000,,"Rouleau, Katherine; Redwood-Campbell, Lynda",Canadian family physician Medecin de famille canadien,https://www.ncbi.nlm.nih.gov/pubmed/19509193/,855
192896,Blastomycosis in nondomestic felids.,2003,"A culture collection of cyanobacteria has been established at the University of Illinois at Chicago. This collection includes marine, terrestrial, and freshwater strains and contains representatives of the five orders of cyanobacteria: Chroococcales, Pleurocapsales, Oscillatoriales, Nostocales, and Stigonematales. In this study, extracts from a subset of 61 strains, 16 marine and 45 freshwater/terrestrial, were evaluated against three current protease targets, i.e. 20S proteasome and two SARS viral proteases, two important bacterial targets, i.e. Mycobacterium tuberculosis and Bacillus anthracis, and in the Artemia salina toxicity assay. In total, extracts of 12 strains possessed significant levels of activity in one or more targets. The overwhelming majority of active extracts (11 of 12) were from either freshwater or terrestrial forms of cyanobacteria, with the greater part of these (9 of 12) being heterocyst-forming strains. These results further support the use of cultured cyanobacteria as a source of biologically active natural products.","Chlipala, George; Mo, Shunyan; Carcache de Blanco, Esperanza J; Ito, Aiko; Bazarek, Stanley; Orjala, Jimmy",Pharmaceutical biology,https://www.ncbi.nlm.nih.gov/pubmed/21430788/,855
193715,Exploring passive transfer in muskoxen (Ovibos moschatus).,2007,"BACKGROUND The attention of the world is focused on the coronavirus disease-2019 (COVID-19) pandemic. There is s general awareness that certain population groups are at greater risk. However, some other populations may be transparent and may not be receiving the attention they warrant. We focused on those with intellectual disability explaining why they are vulnerable during the current pandemic and require special attention.","Tenenbaum, Ariel; Glasbauer, Diego; Wexler, Isaiah D",The Israel Medical Association journal : IMAJ,https://www.ncbi.nlm.nih.gov/pubmed/33443333/,855
194303,Comparison of thiafenantil-xylazine and carfentanil-xylazine for immobilization of gemsbok (Oryx gazella).,2010,"Human coronaviruses (HCoV) cause common colds but can also infect neural cell cultures. To provide definitive experimental evidence for the neurotropism and neuroinvasion of HCoV and its possible association with multiple sclerosis (MS), we have performed an extensive search and characterization of HCoV RNA in a large panel of human brain autopsy samples. Very stringent reverse transcription-PCR with two primer pairs for both viral strains (229E and OC43), combined with Southern hybridization, was performed on samples from 90 coded donors with various neurological diseases (39 with MS and 26 with other neurological diseases) or normal controls (25 patients). We report that 44% (40 of 90) of donors were positive for 229E and that 23% (21 of 90) were positive for OC43. A statistically significant higher prevalence of OC43 in MS patients (35.9%; 14 of 39) than in controls (13.7%; 7 of 51) was observed. Sequencing of nucleocapsid protein (N) gene amplicons revealed point mutations in OC43, some consistently found in three MS patient brains and one normal control but never observed in laboratory viruses. In situ hybridization confirmed the presence of viral RNA in brain parenchyma, outside blood vessels. The presence of HCoV in human brains is consistent with neuroinvasion by these respiratory pathogens. Further studies are needed to distinguish between opportunistic and disease-associated viral presence in human brains.","Arbour, N; Day, R; Newcombe, J; Talbot, P J",Journal of virology,https://www.ncbi.nlm.nih.gov/pubmed/10982334/,855
195672,"Serosurvey of pathogens in domestic dogs on the border of Noël Kempff Mercado National Park, Bolivia.",2008,"Coronavirus spike (S) proteins are palmitoylated at several cysteine residues clustered near their transmembrane-spanning domains. This is achieved by cellular palmitoyl acyltransferases (PATs), which can modify newly synthesized S proteins before they are assembled into virion envelopes at the intermediate compartment of the exocytic pathway. To address the importance of these fatty acylations to coronavirus infection, we exposed infected cells to 2-bromopalmitate (2-BP), a specific PAT inhibitor. 2-BP profoundly reduced the specific infectivities of murine coronaviruses at very low, nontoxic doses that were inert to alphavirus and rhabdovirus infections. 2-BP effected only two- to fivefold reductions in S palmitoylation, yet this correlated with reduced S complexing with virion membrane (M) proteins and consequent exclusion of S from virions. At defined 2-BP doses, underpalmitoylated S proteins instead trafficked to infected cell surfaces and elicited cell-cell membrane fusions, suggesting that the acyl chain adducts are more critical to virion assembly than to S-induced syncytial developments. These studies involving pharmacologic inhibition of S protein palmitoylation were complemented with molecular genetic analyses in which cysteine acylation substrates were mutated. Notably, some mutations (C1347F and C1348S) did not interfere with S incorporation into virions, indicating that only a subset of the cysteine-rich region provides the essential S-assembly functions. However, the C1347F/C1348S mutant viruses exhibited relatively low specific infectivities, similar to virions secreted from 2-BP-treated cultures. Our collective results indicate that the palmitate adducts on coronavirus S proteins are necessary in assembly and also in positioning the assembled envelope proteins for maximal infectivity.","Thorp, Edward B; Boscarino, Joseph A; Logan, Hillary L; Goletz, Jeffrey T; Gallagher, Thomas M",Journal of virology,https://www.ncbi.nlm.nih.gov/pubmed/16415005/,855
196555,Omental torsion in a captive polar bear (Ursus maritimus).,2014,"The PREVIA study was designed to investigate the role of montelukast, a leukotriene receptor antagonist, in the prevention of viral-induced asthma exacerbations in children aged 2 to 5 years with a history of intermittent asthma symptoms. The study was a 12-month multicenter, double-blind, parallel-group study of patients with asthma exacerbations associated with respiratory infections and minimal symptoms between episodes. Patients were randomized to receive oral montelukast 4 or 5 mg (depending on age) (n = 278) or placebo (n = 271) once per day for 12 months. Caregivers recorded children's symptoms, beta-agonist use, and health care resource use in a diary card. Over 12 months of therapy, montelukast significantly reduced the rate of asthma exacerbations by 31.9% compared with placebo. The average rate of exacerbation episodes per patient was 1.60 episodes per year on montelukast compared with 2.34 episodes on placebo. Montelukast also delayed the median time to first exacerbation by approximately 2 months (p = 0.024), and the rate of inhaled corticosteroid courses (p = 0.027) compared with placebo. Montelukast effectively reduced asthma exacerbations in 2- to 5-year-old patients with intermittent asthma over 12 months of treatment and was generally well tolerated.","Bisgaard, Hans; Zielen, Stefen; Garcia-Garcia, María Luz; Johnston, Sebastian L; Gilles, Leen; Menten, Joris; Tozzi, Carol A; Polos, Peter",American journal of respiratory and critical care medicine,https://www.ncbi.nlm.nih.gov/pubmed/15542792/,855
197282,Serosurvey of leptospirosis in feral hogs (Sus scrofa) in Florida.,2013,"The mouse hepatitis virus (MHV) sequences required for replication of the JHM strain of MHV defective interfering (DI) RNA consist of three discontinuous genomic regions: about 0.47 kb from both terminal sequences and a 0.13-kb internal region present at about 0.9 kb from the 5' end of the DI genome. In this study, we investigated the role of the internal 0.13-kb region in MHV RNA replication. Overall sequences of the 0.13-kb regions from various MHV strains were similar to each other, with nucleotide substitutions in some strains; MHV-A59 was exceptional, with three nucleotide deletions. Computer-based secondary-structure analysis of the 0.13-kb region in the positive strand revealed that most of the MHV strains formed the same or a similar main stem-loop structure, whereas only MHV-A59 formed a smaller main stem-loop structure. The RNA secondary structures in the negative strands were much less uniform among the MHV strains. A series of DI RNAs that contained MHV-JHM-derived 5'- and 3'-terminal sequences plus internal 0.13-kb regions derived from various MHV strains were constructed. Most of these DI RNAs replicated in MHV-infected cells, except that MRP-A59, with a 0.13-kb region derived from MHV-A59, failed to replicate. Interestingly, replication of MRP-A59 was temperature dependent; it occurred at 39.5 degrees C but not at 37 or 35 degrees C, whereas a DI RNA with an MHV-JHM-derived 0.13-kb region replicated at all three temperatures. At 37 degrees C, synthesis of MRP-A59 negative-strand RNA was detected in MHV-infected and MRP-A59 RNA-transfected cells. Another DI RNA with the internal 0.13-kb region deleted also synthesized negative-strand RNA in MHV-infected cells. MRP-A59-transfected cells were shifted from 39.5 to 37 degrees C at 5.5 h postinfection, a time when most MHV negative-strand RNAs have already accumulated; after the shift, MRP-A59 positive-strand RNA synthesis ceased. The minimum sequence required for maintenance of the positive-strand major stem-loop structure and biological function of the MHV-JHM 0.13-kb region was about 57 nucleotides. Function was lost in the 50-nucleotide sequence that formed a positive-strand stem-loop structure identical to that of MHV-A59. These studies suggested that the RNA structure made by the internal sequence was important for positive-strand MHV RNA synthesis.","Kim, Y N; Makino, S",Journal of virology,https://www.ncbi.nlm.nih.gov/pubmed/7609066/,855
198194,Antibiotic intravenous regional perfusion for successful resolution of distal limb infections: two cases.,2008,"The outbreak of severe acute respiratory syndrome (SARS) in 2003 indicated that China's existing former mechanism for emergency management was very vulnerable. The Chinese Government has since established a new mechanism for responding to emerging communicable diseases. This paper examined the current status of and developments in China's response to emerging communicable diseases from the outbreak of SARS in 2003 to the outbreak of H7N9 virus infection in 2013. Results indicated that the current mechanism for emergency responses to emerging communicable diseases in China has made great achievements in terms of command and decision-making, organization and collaboration, monitoring and early warning systems, protection, and international communication and cooperation. This mechanism for responding to emerging communicable diseases allowed China to successfully deal with outbreaks of the H5N1 bird flu, H1N1 flu, and H7N9 bird flu. However, a better coordination system, a more complete Office of Responses to Public Health Emergencies, administrative responsibility and error correction, better personnel training, and government responsibility may help to improve the response to emerging communicable diseases. Such improvements are eagerly anticipated.","Yao, Linong; Chen, Enfu; Chen, Zhiping; Gong, Zhenyu",Bioscience trends,https://www.ncbi.nlm.nih.gov/pubmed/24390368/,855
