,index,Unnamed: 0,title_x,x,y,publish_time_x,abstract,authors,journal,category,cluster
6929,6929,6929,Hematopoietic stem cell transplantation for severe aplastic anemia—experience of an institute in Taiwan,13.658372,9.914989,2003-10-03,"The purpose of this study was to evaluate the significance of cerebrovascular CO(2) reactivity (CO(2) R) in the course and outcome of inflammatory central nervous system (CNS) diseases. Sixty-eight patients with inflammatory CNS diseases and 30 healthy volunteers were included in this prospective observational cohort study. The observational period was between January 2005 and May 2009. The CO(2) R was measured by transcranial Doppler (TCD) ultrasound using the breath-holding method. We compared patients with normal CO(2) R (breath-holding index [BHI(m)] ≥ 1.18 = BHI(N) group) with patients who showed impaired CO(2) R (BHI(m) < 1.18 = BHI(R) group). We also analyzed the association of impaired CO(2) R with the etiology, severity, and outcome of disease. When compared to the BHI(N) group, the patients from the BHI(R) group were older, had a heavier consciousness disturbance, experienced more frequent respiratory failure, and, subsequently, had worse outcomes. There were no fatalities among the 28 patients in the BHI(N) group. The comparison of subjects with bacterial and non-bacterial meningitis revealed no significant differences. The unfavorable outcome of disease (Glasgow Outcome Scale [GOS] score 1–3) was significantly more common in subjects with impaired CO(2) R (62.5% vs. 10.7%). Logistic regression analysis was performed in order to establish the prognostic value of BHI(m). The outcome variable was unfavorable outcome (GOS 1–3), while the independent variables were age, Glasgow Coma Scale (GCS) score, and BHI(m). The age and BHI(m) showed the strongest influence on disease outcome. A decrease of BHI(m) for each 0.1 unit increased the risk of unfavorable outcome by 17%. Our study emphasizes the importance of CO(2) R assessment in patients with inflammatory CNS diseases.","Lepur, D.; Kutleša, M.; Baršić, B.",Eur J Clin Microbiol Infect Dis,817,8
37040,37040,37040,The Ethics of Technology: From Thinking Big to Small—and Big Again,13.43021,2.8014624,2020-07-23,,,ATZ Electron Worldw,817,1
48898,48898,48898,Does Herding Behaviour Among Traders Increase During Covid 19 Pandemic? Evidence from the Cryptocurrency Market,13.680041,-0.16808046,2020-11-10,"CoVeriTest, which is integrated in the analysis framework CPAchecker, adopts verification technology for test-case generation. It encodes individual test goals as reachability queries, which are then processed by verifiers. To increase the effectiveness on a broad class of testing tasks, CoVeriTest leverages the strengths of two different analyses: an explicit value analysis and predicate abstraction. Similar to TestComp’20, the two analyses are interleaved and the time duration of an interleaving segment is calculated dynamically. However, the calculation of the time duration focuses on the predicted future performance instead of the past performance, thus, rewarding analyses that likely cover open test goals.","Jakobs, Marie-Christine; Richter, Cedric",Fundamental Approaches to Software Engineering,817,13
48915,48915,48915,Emerging Technologies and Emergent Workplaces: Findings from an Ethnographic Study at an Indian IT Organization,13.578906,-0.385838,2020-11-10,"Deep Neural Networks (DNNs) are being deployed in a wide range of settings today, from safety-critical applications like autonomous driving to commercial applications involving image classifications. However, recent research has shown that DNNs can be brittle to even slight variations of the input data. Therefore, rigorous testing of DNNs has gained widespread attention. While DNN robustness under norm-bound perturbation got significant attention over the past few years, our knowledge is still limited when natural variants of the input images come. These natural variants, e.g., a rotated or a rainy version of the original input, are especially concerning as they can occur naturally in the field without any active adversary and may lead to undesirable consequences. Thus, it is important to identify the inputs whose small variations may lead to erroneous DNN behaviors. The very few studies that looked at DNN’s robustness under natural variants, however, focus on estimating the overall robustness of DNNs across all the test data rather than localizing such error-producing points. This work aims to bridge this gap. To this end, we study the local per-input robustness properties of the DNNs and leverage those properties to build a white-box (DeepRobust-W) and a black-box (DeepRobust-B) tool to automatically identify the non-robust points. Our evaluation of these methods on three DNN models spanning three widely used image classification datasets shows that they are effective in flagging points of poor robustness. In particular, DeepRobust-W and DeepRobust-B are able to achieve an F1 score of up to 91.4% and 99.1%, respectively. We further show that DeepRobust-W can be applied to a regression problem in a domain beyond image classification. Our evaluation on three self-driving car models demonstrates that DeepRobust-W is effective in identifying points of poor robustness with F1 score up to 78.9%.","Zhong, Ziyuan; Tian, Yuchi; Ray, Baishakhi",Fundamental Approaches to Software Engineering,817,16
48990,48990,48990,Influence of FinTech Companies on Banking Landscape an Exploratory Study in Indian Context,13.564434,-0.41067925,2020-11-10,"A much-cited article on the website “Inside Higher ED” outlines fifteen scenarios for higher education in the coming period (Malony and Kim, www.insidehighered.com/digital-learning/blogs/learning-innovation/15-fall-scenarios; 2020). The continuum ranges from education completely back to normal to education completely at a distance. Full return to normal is not on the horizon; full distance education is possible but not optimal for most educational programs; and somewhere in between is quite a challenge. However, it is striking that the continuum focuses entirely on official educational activities and that there is no attention for informal educational activities: a neglect that is reflected in the current discussions about the future of our education. This chapter is about this neglect and the proposition is that the coronavirus crisis offers significant opportunities for a “new educational common” at Tilburg University in this respect.","Adams, Maurice",The New Common,817,1
49053,49053,49053,Financial Inclusion via Mobile Banking – A Comparison Between Kenya and India,13.663476,-0.50038826,2020-11-10,"In this chapter, the author investigates and analyzes the effect of Brexit in the UK after Covid-19, the expansion of China’s influence in the Central–East–Southern half of the European Union, and the emerging narrative of “Illiberal Democracy” from Hungary’s leader Victor Orbán that is shaking western values in Central East Europe(*). In the UK, the birthplace of parliamentary democracy, the parliament rejected the Withdrawal Agreement negotiated between the EU and Prime Minister May on three occasions. After the May government resigned, the government of Boris Johnson in the wake of a general election victory (December 2019) was able to secure a prompt exit from the EU at the end of January 2020. However, the new economic relationship between the EU and the UK is yet to be reconstructed. Negotiations remain on-going at a time when Covid-19 continues to cause a large loss of life and major economic disruption. It is a phenomenon not to be overlooked, that Asian Countries controlled Covid-19 very well, including Australia and New Zealand, but especially Hong Kong, Taiwan and Vietnam. How will the post-Covid-19 world change? The trend of international ‘power politics’ in the early twenty-first century appears to be strengthening, Chinese influence is widening through the 16 + 1 and 17 + 1 policy and is making itself felt across half of the European Union. As a result of Brexit, the future of Britain's political and economic clout remains uncertain. Are we now truly witnessing a shift in the global order when the economic and medical reliance and wider influence of Asian countries become a reality post-Brexit and once Covid-19 abates?","Haba, Kumiko",Brexit and After,817,5
49371,49371,49371,Health Fear Mongering Make People More Sicker: Twitter Analysis in the Context of Corona Virus Infection,13.716665,-0.123794034,2020-11-10,"Chapter 8 recapitulates the situation: the accelerating changes, atoms and bits, and humanity in the matrix. It concludes with a prescription for achieving cognitive superiority in detail, including a proposed organizational structure, and a rationale for a Manhattan-Project-scale effort.","Hartley III, Dean S.; Jobson, Kenneth O.",Cognitive Superiority,817,1
49384,49384,49384,Digital Humanitarianism in a Pandemic Outbreak: An Empirical Study of Antecedents and Consequences,13.652604,-0.31276375,2020-11-10,"The purpose of this paper is threefold: firstly, it provides a stocktake of the current (parlous) state of the decaying, and so-called, liberal world order. Secondly, it identifies the key obstacles inhibiting the prospects for the reform of that order. Both decay and the obstacles to reform are exacerbated by the COVID-19 pandemic. Especially, it looks at the equally parlous relationship between the USA and China, as it has unwound in recent years and asks how the future development of the US-China relationship will determine the reform of world order over the next five to ten years; again, a question profoundly influenced by COVID-19. Thirdly, the paper asks what role the EU 27 might play in the debate over, and practice of, the reform of world order after Brexit.","Higgott, Richard",A New Beginning or More of the Same?,817,16
49387,49387,49387,Developing Indian Smart Cities: Insights from Social Media,13.6274395,-0.3234966,2020-11-10,"From a traditional public international law perspective, a standard is either binding or it is not: there is no in-between. The emergence of international standards as a key component of modern international public policy, however, has proven that normativity does not have such a binary notation. The voluntary instruments described as international standards have acquired growing influence in the field of World Trade Organization law. This chapter argues that international investment law has not escaped these developments. Accordingly, the purpose of the present chapter is to identify the role of international standardization bodies as transnational actors of international investment law, by determining their influence on the interpretation and application of rights and obligations under international investment agreements.","Giannakopoulou, Eleni-Amalia; Tokas, Marios",Transnational Actors in International Investment Law,817,1
49435,49435,49435,Women’s Political Participation on Social Media: The Case of Tanzania,13.64086,-0.3389016,2020-11-10,"Infectious diseases present an omnipresent threat to the health and safety of the global community. In 2020, the COVID-19 pandemic that began in China in 2019 swept around the world imposing unprecedented impacts on all the sectors of the world economy. The multibillion-dollar sports tourism industry was hit hard. This chapter unravels the impacts of COVID-19 on sporting events and, by default, sporting tourism. Such information is key for the industry to develop resilience against future pandemics and other natural disasters. Document and critical discourse analysis was used in gathering and analysing data. The findings show that most sporting events were either cancelled or postponed during the peak of the pandemic because of COVID-19 containment measures across the world, such as travel bans and port closures. Many sports governing bodies were also bankrupted and left in financial distress. Individual athletes lost income as their salaries were reduced or completely cut. Sponsors, betting firms, broadcasters and others in the sports value chain also incurred huge losses during this period. Among the key events affected were the 2020 Olympics, football leagues, golf, cricket, marathons, rugby and tennis. As such, there was a need for bailout packages and seeking alternatives for the sports industry to recover from the shock. This chapter recommends post-COVID-19 reviews of the sports industry and putting in place alternative future intervention measures for similar pandemics and other disasters.","Nhamo, Godwell; Dube, Kaitano; Chikodzi, David",Counting the Cost of COVID-19 on the Global Tourism Industry,817,1
65472,65472,65472,Protecting the population with immune individuals.,13.360632,5.732748,2020-05-07,"People with implantable cardiac defibrillators (ICDs) who are nearing the end of life are at risk for arrhythmias, which activate the ICD and may cause unnecessary shocks and suffering. Because ICDs have enabled more patients to live longer, they often succumb to noncardiac diseases and may be cared for by primary care physicians. Despite published recommendations 10 years ago regarding the management of ICDs during the end of life, over half of patients with ICDs who are dying still have not been offered the choice of deactivation. The Coronavirus disease 2019 (COVID-19) pandemic has complicated this issue and the need to discuss it because of practices that separate patients from loved ones and that modify the usual interactions of patients with doctors and nurses. We offer the following recommendations: (1) the management of ICDs at the end-of-life needs to be understood by all physicians who care for patients with ICDs; (2) discussions about deactivating the ICD should occur while patients have decision-making capacity and are clinically stable, beginning at the time of ICD implantation, then periodically at follow-up appointments, and certainly when a change in the patient's clinical status warrants a reconsideration of the goals of care; and (3) clinicians should compensate for the impediments to communication with patients and families associated with the COVID-19 pandemic, which includes patient isolation and restrictive visitor policies, by using devices that permit visual communication to reexamine goals of care, including defibrillator deactivation, in patients with ICDs who are expected to die.","Myers, Sarah E; Eastwood, Gregory L",Journal of the American Board of Family Medicine : JABFM,817,19
162355,162355,162355,Has online betting come to conquer casinos?: A comparison between the experience and emotions of online betting vs casinos,13.4948435,-0.016174683,2021,"UNLABELLED Combination therapy has improved the quality of life for patients with squamous cell carcinomas of the head and neck (HNSCCs) but has not decisively changed prognosis. Targeted therapies, which enhance accumulation of the drug in the tumor, may be realized using tumor-specific binding peptides. This paper identifies and characterizes an HNSCC affine peptide. METHODS From a phage library comprising 10(9) different displayed peptides, 1 peptide was enriched after 5 in vitro selection rounds on HNO223 tumor cells. Subsequently, the gained peptide sequence H(2)N-SPRGDLAVLGHKY-CONH(2) (HBP-1) was synthesized as an amide and labeled with (125)I. In vitro studies for binding kinetics and competition were performed with 5 different HNSCC cell lines. Furthermore, the stability of the peptide was evaluated in human serum. The in vivo biodistribution of (131)I-labeled peptide was determined in HNSCC tumor-bearing nude mice. The results were further validated in human HNSCC tumor tissue sections using fluorescence-labeled HBP-1. Competition experiments were performed to determine the binding sequence and validate the target. RESULTS The HBP-1 motif was enriched in 62% of all phages sequenced. Labeled (125)I-HBP-1 showed binding to 5 different HNSCC cell lines and a maximum binding to HNO97 cells, with 11% of the applied dose per 10(6) cells and an inhibitory concentration of 50% of 38.9 nM. Stability experiments in human serum showed a half-life of 55 min. In 2 different HNSCC tumor xenografts, (131)I-HBP-1 accumulated rapidly, with stable uptake until 45 min after intravenous application. Peptide immunohistochemistry of HNSCC tissue sections exhibited tumor staining by HBP-1, whereas normal tissue remained negative. Sequence mutation and competition experiments revealed that the intrinsic RGD motif in combination with the intrinsic LXXL motif is responsible for the binding ability of HBP1. The RGDLXXL sequence within this peptide is known and indicates that binding occurs via the alpha(v)beta(6) rather than the alpha(v)beta(3) integrin. CONCLUSION Within the sequence of HBP-1 is a RGDLXXL motif, and most likely it is targeting the alpha(v)beta(6) receptor of the integrin family of cell adhesion receptors. HBP-1 represents a promising lead structure for the development of targeted therapies or diagnostic procedures in patients with HNSCC.","Nothelfer, Eva-Maria; Zitzmann-Kolbe, Sabine; Garcia-Boy, Regine; Krämer, Susanne; Herold-Mende, Christel; Altmann, Annette; Eisenhut, Michael; Mier, Walter; Haberkorn, Uwe","Journal of nuclear medicine : official publication, Society of Nuclear Medicine",817,23
162513,162513,162513,"Effects of Covid-19 on the purchasing behavior of Generation Z, a study in Ecuador, Mexico and Colombia",13.629611,-0.4154042,2021,,,British dental journal,817,25
162718,162718,162718,Business Intelligence in clinical decision support: Applications in the context of intensive medicine,13.362282,-0.12074299,2021,"Triclosan (TCS), an emergent pollutant, is raising a global concern due to its toxic effects on organisms and aquatic ecosystems. The non-availability of proven treatment technologies for TCS remediation is the central issue stressing thorough research on understanding the underlying mechanisms of toxicity and assessing vital biomarkers in the aquatic organism for practical monitoring purposes. Given the unprecedented circumstances during COVID 19 pandemic, a several-fold higher discharge of TCS in the aquatic ecosystems cannot be considered a remote possibility. Therefore, identifying potential biomarkers for assessing chronic effects of TCS are prerequisites for addressing the issues related to its ecological impact and its monitoring in the future. It is the first holistic review on highlighting the biomarkers of TCS toxicity based on a comprehensive review of available literature about the biomarkers related to cytotoxicity, genotoxicity, hematological, alterations of gene expression, and metabolic profiling. This review establishes that biomarkers at the subcellular level such as oxidative stress, lipid peroxidation, neurotoxicity, and metabolic enzymes can be used to evaluate the cytotoxic effect of TCS in future investigations. Micronuclei frequency and % DNA damage proved to be reliable biomarkers for genotoxic effects of TCS in fishes and other aquatic organisms. Alteration of gene expression and metabolic profiling in different organs provides a better insight into mechanisms underlying the biocide's toxicity. In the concluding part of the review, the present status of knowledge about mechanisms of antimicrobial resistance of TCS and its relevance in understanding the toxicity is also discussed referring to the relevant reports on microorganisms.","Kumar, Saurav; Paul, Tapas; Shukla, S P; Kumar, Kundan; Karmakar, Sutanu; Bera, Kuntal Krishna; Bhushan Kumar, Chandra",Environmental pollution,817,1
162892,162892,162892,"Learning process of causes, consequences and solutions to climate change of undergraduate students without background in the subject",13.306598,-0.14156514,2021,"The 2019 Coronavirus (COVID-19) significantly affected our society, the country, and the world. During the Corona time, people mostly spent their time on the internet and actively connected with other people through online social media (OSM) or game chatboxes. Due to extensive use of the internet and social media, the sharing of offensive content increases. OSM provides a platform where people freely express their opinion, emotions, and thoughts. Sometimes people share their feelings and thoughts sarcastically, wherein it signifies the opposite of what it states. Sarcastic content shared by people can vary in many forms, such as videos, images, podcasts, audio, and text. This research mainly focuses on Twitter text data extracted by the Twitter API during COVID-19 and investigates sarcastic content with negative sentiments during COVID-19. We extracted the data with some specific keywords like hashtag-related sarcastic information, sarcasm, irony, etc., and performed an offensive and aggressive nature analysis of people at this stage. We have used the linear support vector classifier (libSVM), Naïve Bayes, and Decision Tree for this analysis. The Decision Tree achieved the highest accuracy as compared to libSVM and Naïve Bayes. It can detect sarcastic content with up to 90% accuracy. © 2021 IEEE.","Kumar, R.; Bhat, A.","2nd International Conference for Emerging Technology, INCET 2021",817,1
163093,163093,163093,Playing with Escape Room Games for Children: An online experience at home in times of pandemic,13.404955,-0.45064038,2021,"This article constructs a cultural framework for Arab education amid the COVID-19 pandemic. Such education occurs inside private homes, raising privacy-related methodological challenges to research. To bypass these, numerous researchers were recruited to collect qualitative data from within the homes of friends and relatives. They collected large-scale data (2304 observations and 1292 interviews) and examined 1422 initiatives taken to facilitate education during the pandemic. In addition, they scrutinised 1390 relevant witticisms, on the basis that the humour of a culture is an indicator of public feeling. Data analysis reveals the existence of ‘covidian education’;this is digital and, thus, less tangible than pre-covidian education, necessitating spatial and temporal rearrangements. It is parent-centred, adding educational responsibilities to parents' workloads. It undermines integrity, with parents taking examinations on children's behalf. Being home-based, it compromises the privacy of students' and teachers' residences. It modifies gender relations, eliminates existing actors and welcomes new stakeholders. Compared to pre-covidian education, it is culturally dissimilar and educationally inferior. It presents ‘façades’ of positive experiences that mask negative realities, and does students more harm than good. We find that unprecedented issues arise in relation to ‘covidian natives’ (whose education comprises solely the covidian form) and ‘covidian graduates’.","Al Lily, Abdulrahman Essa Alhazmi Ahmed Ali Abunasser Fathi Mohammed Buarki Hanadi Jumah Shams Eldin Gomaa Aliaa Adel Al Hanandeh Anas Mohammad Elayyan Shaher Rebhi Alghamdi Ayed Mohammed Almufeez Khawla Abdullah Aldoghmi Maha Affat Al Mohsen Nouf Abdulaziz Mohamed Shahpo Samia Mokhtar Ben-Motreb Khaled Saad Al-Abdullatif Ahlam Mohammed Bukhamseen Amani Mohammed Aldoughan Eman Abdulaziz Almustafa Sarah Saleh Alsubaie Merfat Ayesh Alqhtani Munira Hshbel Alsaeed Maha Saad Aladsani Hibah Khalid Amira Mostafa Samy Almotreb Lena Khaled Elsayed Ahmed R.; Ismaeel, Weaam Mohamed Al Hasan Sumaia Attia",Technology in Society,817,1
163447,163447,163447,Perception of learning mediated by information technologies and communicate in higher education,13.572653,-0.2338746,2021,"BACKGROUND & AIMS : The use of hydroxycholoroquin for COVID-19 treatment and prophylaxis raised issues concerning its cardiac safety owing to possibility of QT prolongation and arrhythmias.1 There was no study on long term electrocardiographic telemetry monitoring of patients taking hydroxychloroquin and we planned a continuous electrocardiographic holter telemetry of these patients for a period of seven days. Methods : Healthcare workers taking hydroxycholoroquin as pre exposure prophylaxis, patients taking hydroxychloroquin were monitored by holter electrocardiographic telemetry with continuous beat to beat analysis for seven days with capacity to report any arrhythmic event or significant QT prolongation instantly to medical faculty. Results : 25 participants with mean age 42.4 {+/-} 14.1 years, 40% females. 20% patients needed to stop HCQ. Four patients developed QT prolongation > 500 ms and needed to stop HCQ, one patient had accelerated idioventricular rhythm and stopped treatment. one had short episodes of atrial fibrillation. No malignant arrhythmia or ventricular arrhythmia or torsades were noted. No episode of significant conduction disturbance and arrhythmic death noted. Baseline mean QTc was 423.96{+/-}32.18 ms, mean QTc corrected at 24 hours 438.93 {+/-} 37.95, mean QTc 451.879 {+/-}37.99 at 48 hours, change in baseline mean QTc to max QTc was 30.74 {+/-}21.75 ms at 48 hours. All those develop QTc prolongation > 500 ms were greater than 50 years of age. Conclusion : Ambulatory telemetry ECG monitoring seems to detect early QT prolongation and stopping drug timely prevented malignant arrhythmias. HCQ seems to have less risk of QT prolongation in young healthy individuals.","Walia, R.; Prabhakaran, N.; Kodliwadmath, A.; Singh, O. B. C.; Sabbarwal, V.; Nigam, A.; Vijay B, K.; Pai, V. S.",,817,1
