,index,Unnamed: 0,title_x,x,y,publish_time_x,abstract,authors,journal,category,cluster
374750,374750,374750,PG73 Emergency management of tracheostomy during COVID-19 pandemic: simulation vs online real-time demonstration,13.353639,-0.31154448,2020,"The COVID-19 global pandemic and the lockdown policies enacted to mitigate it have had profound effects on the labour market. Understanding these effects requires us to obtain and analyse data in as close to real time as possible, especially as rules change rapidly and local lockdowns are enacted. This work studies the UK labour market by analysing data from the online job board Reed.co.uk, using topic modelling and geo-inference methods to break down the data by sector and geography. I also study how the salary, contract type, and mode of work have changed since the COVID-19 crisis hit the UK in March. Overall, vacancies were down by 60 to 70% in the first weeks of lockdown. By the end of the year numbers had recovered somewhat, but the total job ad deficit is measured to be over 40%. Broken down by sector, vacancies for hospitality and graduate jobs are greatly reduced, while there were more care work and nursing vacancies during lockdown. Differences by geography are less significant than between sectors, though there is some indication that local lockdowns stall recovery and less badly hit areas may have experienced a smaller reduction in vacancies. There are also small but significant changes in the salary distribution and number of full time and permanent jobs. As well as the analysis, this work presents an open methodology that enables a rapid and detailed survey of the job market in unsettled conditions and describes a web application jobtrender.com that allows others to query this data set.","Arthur, Rudy",PLoS One,817,16
376441,376441,376441,Coping with the challenges posed by virtual learning environment,13.608032,-0.49401274,2020,,"Grindrod, Kelly Waite Nancy Constantinescu Cora Watson Kaitlyn E.; Tsuyuki, Ross T.",Canadian Pharmacists Journal / Revue des Pharmaciens du Canada,817,30
376442,376442,376442,Coping with the challenges posed by virtual learning environment,13.720407,-0.37762946,2020,,"Grindrod, Kelly Waite Nancy Constantinescu Cora Watson Kaitlyn E.; Tsuyuki, Ross T.",Canadian Pharmacists Journal / Revue des Pharmaciens du Canada,817,20
382300,382300,382300,Analyzing Impact of Climate Variability on COVID-19 Outbreak: A Semantically-enhanced Theory-guided Data-driven Approach,13.367809,-0.091244176,2020,,"Meconcelli, Gianna; Bazzoni, Giancarlo; Casu, Cinzia",International Journal of Pharmaceutical and Phytopharmacological Research,817,28
385206,385206,385206,Apple Siri as communication conduit during COVID-19: Between inside and outside the or,13.408218,-0.03327769,2020,"The present work describes development of rapid, robust, sensitive and green spectrofluorimetric method for determination of favipiravir (FAV). Different factors affecting fluorescence were carefully studied and Box Behnken Design was applied to optimize experimental parameters. The proposed method is based on measuring native fluorescence of FAV in 0.2 M borate buffer (pH 8.0) at 432 nm after excitation at 361 nm. There was a linear relationship between FAV concentration and relative fluorescence intensity over the range 40-280 ng/mL with limit of detection of 9.44 ng/mL and quantitation limit of 28.60 ng/mL. The method was successfully implemented for determination of FAV in its pharmaceutical formulation with mean % recovery of 99.26 ± 0.87. Moreover, the high sensitivity of the method allowed determination of FAV in spiked human plasma over a range of 48-192 ng/mL. The proposed spectrofluorimetric method was proved to be eco-friendly according to analytical eco-scale.","Megahed, Safa M; Habib, Ahmed A; Hammad, Sherin F; Kamal, Amira H",Spectrochim Acta A Mol Biomol Spectrosc,817,16
386928,386928,386928,Analyzing YouTube Videos Shared on Whatsapp in the Early COVID-19 Crisis,13.269001,-0.3214497,2020,,"Fieiras, Cecilia Panoso Carrasco Claudia Nadia Rosell Camila Inés Franco Juan Víctor Ariel",Evid. actual. práct. ambul,817,25
388388,388388,388388,Application and experience of hybrid online teaching model based on Rain Classroom,13.466031,-0.20301878,2020,"The brain endothelium is an integral element of the blood-brain barrier (BBB) Dysfunction of this formation due to increased generation of reactive oxygen species (ROS) progresses the establishment of neurological disorders including stroke and traumatic brain injury Heat shock protein 90 inhibitors are anti-inflammatory agents, and their activities are mediated, at least in part, by P53 This is a tumor suppressor protein which regulates the opposing activities of Rac1 and RhoA in the cellular cytoskeleton In the present study we investigated the role of Hsp90 inhibitors in the H2O2-induced brain endothelium breakdown, by employing human cerebral microvascular endothelial cells (hCMEC/D3) Our findings suggest that H2O2 downregulates P53 by enhancing the P53 suppressor mouse double minute 2 homolog (MDM2), as well as by increasing the apyrimidinic endonuclease 1/redox factor 1 (APE1/Ref1) The H2O2 – triggered violation of the brain endothelium barrier was reflected in measurements of transendothelial resistance, and the increased expression of the key cytoskeletal modulators cofilin and myosin light chain 2 (MLC2) Treatment of the hCMEC/D3 cells with Hsp90 inhibitors counteracted those events, and reduced the generation of the hydrogen peroxide – induced reactive oxygen species Hence, our study suggests that Hsp90 inhibition supports the BBB integrity, and may represent a promising therapeutic approach for disorders associated with brain endothelium breakdown;including COVID-19","Uddin, Mohammad A.; Akhter, Mohammad S.; Kubra, Khadeja-Tul Whitaker Kathryn E.; Shipley, Summer L.; Smith, Landon M.; Barabutis, Nektarios",Brain Disorders,817,13
388389,388389,388389,Application and experience of hybrid online teaching model based on Rain Classroom,13.535054,-0.039934292,2020,,"Schneider, Joseph; Wirth, Axel",Biomed Instrum Technol,817,13
388455,388455,388455,E-learning Can Reduce the Negative Impact of COVID-19 in Teaching Mathematics,13.341086,-0.17832404,2020,"BACKGROUND: Maternal nutrition during gestation and lactation is essential for offspring's health. The present study aimed to investigate the effects of betaine hydrochloride addition to sow diets during gestation and lactation on suckling piglet's immunity and intestine microbiota composition. Forty Bama mini-pigs were randomly allocated into two groups and fed a basal diet (control group) and basal diet with 3.50 kg ton-1 betaine hydrochloride (betaine group) from day 3 after mating to day 21 of lactation. After 21 days of the delivery, 12 suckling piglets from each group with similar body weight were selected for sample collection. RESULTS: The results showed that maternal betaine hydrochloride addition decreased (P < 0.05) the plasma levels of interleukin (IL)-1ß, IL-2, IL-6, and tumor necrosis factor (TNF)-&#945; in suckling piglets. Furthermore, dietary betaine hydrochloride addition in sow diets increased (P < 0.05) the villus height (VH) and VH to crypt depth ratio in the jejunum and ileum of suckling piglets. In the piglets' intestinal microbiota community, the relative abundances of Roseburia (P < 0.05) and Clostridium (P = 0.059) were lower in the betaine group than those in the control group. Moreover, betaine hydrochloride addition in sow diets decreased the colonic tyramine (P = 0.091) and skatole (P = 0.070) concentrations in suckling piglets. CONCLUSION: Betaine hydrochloride addition in sow diets enhanced the intestinal morphology, improved immunity, and altered intestinal microbiota of suckling piglets. These findings indicated that betaine hydrochloride addition in sow diets during gestation and lactation will impact suckling piglets' health. This article is protected by copyright. All rights reserved.","Azad, Abul Kalam; Gao, Qiankun; Ma, Cui; Wang, Kai; Kong, Xiangfeng",J. sci. food agric,817,23
388456,388456,388456,E-learning Can Reduce the Negative Impact of COVID-19 in Teaching Mathematics,13.311897,-0.15299182,2020,,"Habibzadeh, Parham; Moghadami, Mohsen; Lankarani, Kamran Bagheri",Med Hypotheses,817,20
389073,389073,389073,Investing a Better Future: Education for Sustainable Development as a Means to Strengthen the Environmental Education,13.316886,-0.47823462,2020,"The purpose of this work is to present Virtual Tutoring as a strategy of the Psychopedagogy and Tutoring service to respond to the need for accompaniment and monitoring of students from the Faculty of Sciences and Engineering of a university in the north of Lima during the first four months into the COVID-19 pandemic. Measures were adopted according to the comprehensive training model, taking into account that the student requires academic attention, with emotional-motivational support. The intervention was carried out using technological tools, highlighting the importance of mediation and the optimistic perspective of coping in adverse situations. The results are encouraging, since most of the intervened students remained in the university with adequate academic performance, in addition to achievements in relation to the affective-motivational aspect, reducing the levels of anxiety, hopelessness and demotivation. As a complement, it is important to mention that the student-tutor bond was also strengthened. © 2021 IEEE.","Tragodara, K. S. C.","5th IEEE World Engineering Education Conference, EDUNINE 2021",817,6
389417,389417,389417,An Interactive Simulator for COVID-19 Trend Analysis,13.3623295,-0.32620758,2020,"BackgroundWe aimed to assess the effectiveness of the BNT162b2 mRNA vaccine against B.1.351 (beta) variant among residents of long-term care facilities (LCTFs) in eastern France. MethodsWe used routinely collected surveillance and COVID-19 vaccination data to conduct a retrospective cohort study of SARS-CoV-2 B.1.351 infection incidence and vaccine effectiveness among LCTFs residents in eastern France between 15 January and 19 May 2021. Data from secondary RT-PCR screening were used to identify B.1.351 variants. FindingsIncluded in our analysis were 378 residents from five LCTFs: 287 (76%) females, with median (IQR) age of 89 (83-92) years. Two B.1.351 outbreaks took place in LTCFs in which more than 70% of residents had received two doses of BNT162b2 mRNA vaccine, which included 11 cases of severe disease and six deaths among those who had received two doses. Vaccine effectiveness (95% CI) seven days after the second dose of vaccine was 49% (14-69) against any infection with B.1.351 and 86% (67-94) against severe forms of COVID-19. In multivariable analysis, females were less likely to develop severe forms of disease (IRR = 0.35, 95% CI = 0.20-0.63). InterpretationWe observed reduced vaccine effectiveness associated with B.1.351, as well as B.1.351 outbreaks in two LTCFs among individuals who had received two doses of vaccine. Our findings highlight the need to maintain SARS-CoV-2 surveillance in these high-risk settings beyond the current COVID-19 mass vaccination campaign, and advocate for a booster vaccine dose prior to the next winter season.","Lefevre, Benjamin; Tondeur, Laura; Madec, Yoann; Grant, Rebecca; Lina, Bruno; Werf, Sylvie van der; Rabaud, Christian; Fontanet, Arnaud",,817,14
389762,389762,389762,"O19 SBE, SOPs and COVID-19: Using simulation-based education (SBE) to facilitate the development of paediatric COVID-19 standard operating procedures (SOP)",13.644753,-0.17708355,2020,"To address chronically low primary school completion rates and the disconnect between learners' skills at the end of primary school and the skills learners need to thrive in secondary school identified in many low- and middle-income countries, more investment is needed to improve the quality of teaching and learning in upper primary grades. Accordingly, we provide guidelines for improving five components of upper primary education: (1) In-service teacher professional development and pre-service preparation to improve and enhance teacher quality;(2) a focus on mathematics, literacy, and core content-area subjects;(3) assessment for learning;(4) high-quality teaching and learning materials;and (5) positive school climates. We provide foundational guiding principles and recommendations for intervention design and implementation for each component. Additionally, we discuss and propose how to structure and design pre-service teacher preparation and in-service teacher training and ongoing support, fortified by materials design and assessment, to help teachers determine where learners are in developmental progressions, move learners towards mastery, and differentiate and support learners who have fallen behind. We provide additional suggestions for integrating a whole-school climate curriculum, social-emotional learning, and school related gender-based violence prevention strategies to address the internal and societal changes learners often face as they enter upper primary.","Sowa, Patience Jordan Rachel Ralaingita Wendi Piper Benjamin",RTI International,817,1
390896,390896,390896,Virtual learning platforms as a mediating factor in developing oral communication skills: A quantitative study of the experience of English major students at the university of Bahrain,13.660775,-0.5232155,2020,,"Brookes, Gavin",Critical Discourse Studies,817,0
391029,391029,391029,Technical Challenges and Vision of Slovak National Telepresence Infrastructure during the COVID-19 Pandemic,13.510241,-0.20029402,2020,,"Hamiduzzaman, Mohammad; Islam, M. Rezaul",Local Development &amp; Society,817,25
392136,392136,392136,Remote rapid cycle deliberate practice simulation training during the COVID-19 pandemic,13.26642,-0.38449714,2021,"OBJECTIVES: To determine imaging features of coronavirus disease 2019 (COVID-19) in different stages, and to provide foundations for early diagnosis and treatment. METHODS: CT image data of 187 COVID-19 patients were analyzed in the period of hospitalization. CT scanning was performed on admission and repeated every 3 days. The improvement time of clinical symptoms and the image changes of follow-up CT were statistically analyzed. RESULTS: All 187 patients' nucleic acid test were positive to severe acute respiratory syndrome coronavirus 2 (SARS-CoV-2). The early CT images of lung in 187 cases (100%) showed multiple patchy and ground-glass opacities with fine mesh and consolidation shade, which mainly distributed in pulmonary band or under the pleura. In the progressive stage, the pulmonary lesions in 146 cases (78.1%) were mainly consolidation, accompanied by air bronchogram, thickening of blood vessels, and interstitial changes. Severe pulmonary CT images in 15 cases (8%) showed diffuse lesions in both lungs, displaying consolidation, or ""white lung"". The CT imaging features in 185 cases (98.9%) at the absorptive period showed that the lesions diminished and fibrogenesis. The imaging features of 6 times of lung CT examination in one case showed continuous progress. The original lesion in one case was obviously absorbed, but new lesions appeared under the pleura of both lungs at the third review of CT scanning. The changes of CT imaging lesions during follow-up were significantly different in different clinical symptoms improvement time (P< 0.01). CONCLUSIONS: Images of COVID-19 in various stages have special characteristics. The change of clinical symptoms is synchronous with the change of reexamination CT. Follow-up CT can reflect the trend of clinical changes. Repeat CT examination plays an important role in the early clinical diagnosis and the evaluation for the therapeutic effect on COVID-19 patient.","Zhong, Zheng; Hu, Ying; Yu, Qizhi; Li, Yuxin; Li, Peng; Huang, Wei; Liu, Jingui; Liu, Jun; Xie, Xingzhi; Zhao, Wei",Zhong Nan Da Xue Xue Bao Yi Xue Ban,817,32
392808,392808,392808,Research on blended learning mode based on network,13.354272,-0.08757446,2020,"Lockdowns to contain the spread of the SARS-CoV-2 have disrupted routines and behaviors, which could lead to a worsening of lifestyle and an increase in the burden of non-communicable diseases. This study aimed to describe the changes in physical activity, diet, alcohol drinking, and cigarette smoking during lockdown. A self-administered online survey addressing adults living in a province in northern Italy was advertised through websites and social media. Citizens could access the survey in anonymity from 4 May until 15 June 2020. A total of 1826 adults completed the survey, with a worsening of physical activity (35.1%), diet (17.6%), alcohol drinking (12.5%), and cigarette smoking (7.7%) reported. In contrast, 33.5% reported an improvement in diet, 12.6% in alcohol drinking, 5.3% in physical activity and 4.1% in cigarette smoking. Female sex, young adult age, suspension of work activity, and symptoms of psychological distress were the factors associated with a greater likelihood of change, which was frequently for the worse. Lockdown had an impact on lifestyle, with some net beneficial effects on diet and mostly negative effects on physical activity. Public health measures should be implemented to avoid long-term negative effects of the lockdown, supporting individuals more prone to change for the worse.","Paltrinieri, Sara; Bressi, Barbara; Costi, Stefania; Mazzini, Elisa; Cavuto, Silvio; Ottone, Marta; De Panfilis, Ludovica; Fugazzaro, Stefania; Rondini, Ermanno; Giorgi Rossi, Paolo",Nutrients,817,16
394696,394696,394696,Adaptive COVID-19 Forecasting via Bayesian Optimization,13.291274,-0.46736774,2020,"There is an increasing interest in ensuring machine learning (ML) frameworks behave in a socially responsible manner and are deemed trustworthy. Although considerable progress has been made in the field of Trustworthy ML (TwML) in the recent past, much of the current characterization of this progress is qualitative. Consequently, decisions about how to address issues of trustworthiness and future research goals are often left to the interested researcher. In this paper, we present the first quantitative approach to characterize the comprehension of TwML research. We build a co-occurrence network of words using a web-scraped corpus of more than 7,000 peer-reviewed recent ML papers -- consisting of papers both related and unrelated to TwML. We use community detection to obtain semantic clusters of words in this network that can infer relative positions of TwML topics. We propose an innovative fingerprinting algorithm to obtain probabilistic similarity scores for individual words, then combine them to give a paper-level relevance score. The outcomes of our analysis inform a number of interesting insights on advancing the field of TwML research.","Derzsy, Noemi; Majumdar, Subhabrata; Malik, Rajat",,817,23
396981,396981,396981,Medicine's longest year,13.329266,4.6621017,2021,"This review focuses on assessing the prevalence and risk factors of mental disorders in older adults in the current era, including the COVID-19 pandemic. A systematic review of the literature in PubMed, Elsevier, Google, using keywords over the past 10 years was conducted. It is shown that data on the prevalence of psychiatric disorders in the elderly population, including in comparison with young adults, diverge significantly. The significant incidence of mental disorders among nursing home residents is highlighted. The relevance of non-psychotic disorders of the depressive and anxiety spectrum in older adults is demonstrated. The difficulty of diagnosing mental disorders associated with somatic pathology as well as cognitive disorders in elderly patients is demonstrated. Risk factors for mental disorders in older adults are socio-demographic as well as economic, psychological and somatic factors. The problem of mental health of the elderly under the COVID-19 pandemic associated with specific risk factors for mental disorders is characterized. The shortage of evidence-based research in the treatment of mental disorders in old age and the urgency to improve the organization of psychiatric care for such patients are noted. Understanding the structure and prevalence of mental disorders among the elderly will allow to optimize the work of the healthcare system.","Petrova, N. N.; Khvostikova, D. A.",Adv Gerontol,817,16
397212,397212,397212,A Molecular View of Coronavirus Disease-2019 (COVID-19),13.42833,-0.061438367,2020,"Objetivo: Analisar como a testagem da população influencia os indicadores de saúde usados para monitorar a pandemia de COVID-19 nos 50 países com maior número de casos diagnosticados. Métodos: Estudo ecológico sobre dados secundários, extraídos em 19/08/2020. Foram calculadas incidência acumulada, taxa de mortalidade, letalidade e proporção de testes positivos. Os dados foram descritos e apresentados graficamente, com o respectivo coeficiente de correlação de Spearman. Resultados: A taxa de testagem variou enormemente entre os países. A incidência acumulada e a proporção de testes positivos foram correlacionadas ao número de testes, enquanto a taxa de mortalidade e a letalidade apresentaram correlação baixa com esse indicador. Conclusão: A maioria dos países não testa o suficiente para garantir adequado monitoramento da pandemia, com reflexo na qualidade dos indicadores. A ampliação do número de testes é fundamental; porém, ela deve ser acompanhada de outras medidas, como isolamento de casos diagnosticados e rastreamento de contatos.","Pilecco, Flávia Bulegon; Coelho, Carolina Gomes; Fernandes, Qeren Hapuk Rodrigues Ferreira; Silveira, Ismael Henrique; Pescarini, Júlia Moreira; Ortelan, Naiá; Gabrielli, Ligia; Aquino, Estela M. L; Barreto, Maurício Lima",Epidemiol. serv. saúde,817,24
397213,397213,397213,A Molecular View of Coronavirus Disease-2019 (COVID-19),13.222515,-0.14984527,2020,"OBJECTIVE: To analyse how testing the population influences the health indicators used to monitor the COVID-19 pandemic in the 50 countries with the highest number of diagnosed cases METHODS: This was an ecological study using secondary data retrieved on 8/19/2020 Cumulative incidence, mortality rate, case-fatality rate, and proportion of positive tests were calculated The data were described and presented graphically, with their respective Spearman Correlation Coefficients RESULTS: The testing rate varied enormously between countries Cumulative incidence and the proportion of positive tests were correlated with the number of tests, while the mortality rate and case-fatality rate showed low correlation with this indicator CONCLUSION: Most countries do not test enough to ensure adequate monitoring of the pandemic, and this is reflected in the quality of the indicators Expanding the number of tests is essential, but it needs to be accompanied by other measures, such as isolation of diagnosed cases and contact tracing","Pilecco, F. B.; Coelho, C. G.; Fernandes, Qhrf Silveira I. H.; Pescarini, J. M.; Ortelan, N.; Gabrielli, L.; Aquino, E. M. L.; Barreto, M. L.",Epidemiologia e Servicos de Saude,817,16
397501,397501,397501,Digital Learning Experience for University Student,13.21733,-0.2603566,2020,"46,XY disorders of sex development (DSD) is characterized by incomplete masculinization genitalia, with gonadal dysplasia and with/without the presence of Müllerian structures. At least 30 genes related to 46,XY DSD have been found. However, the clinical phenotypes of patients with different gene mutations overlap, and accurate diagnosis relies on gene sequencing technology. Therefore, this study aims to determine the prevalence of pathogenic mutations in a Chinese cohort with 46,XY DSD by the targeted next-generation sequencing (NGS) technology. Eighty-seven 46,XY DSD patients were enrolled from the Peking Union Medical College Hospital (Beijing, China). A total of fifty-four rare variants were identified in 60 patients with 46,XY DSD. The incidence of these rare variants was approximately 69.0% (60/87). Twenty-five novel variants and 29 reported variants were identified. Based on the American College of Medical Genetics and Genomics (ACMG) guidelines, thirty-three variants were classified as pathogenic or likely pathogenic variants and 21 variants were assessed as variants of uncertain significance. The overall diagnostic rate was about 42.5% based on the pathogenic and likely pathogenic variants. Androgen receptor (AR), steroid 5-alpha-reductase 2 (SRD5A2) and nuclear receptor subfamily 5 Group A member 1 (NR5A1) gene variants were identified in 21, 13 and 13 patients, respectively. The incidence of these three gene variants was about 78.3% (47/60) in patients with rare variants. It is concluded that targeted NGS is an effective method to detect pathogenic mutations in 46,XY DSD patients and AR, SRD5A2, and NR5A1 genes were the most common pathogenic genes in our cohort.s.","Yu, Bing-Qing; Liu, Zhao-Xiang; Gao, Yin-Jie; Wang, Xi; Mao, Jiang-Feng; Nie, Min; Wu, Xue-Yan",Asian j. androl,817,20
