,index,Unnamed: 0,title_x,x,y,publish_time_x,abstract,authors,journal,category,cluster
2899,2899,2899,"Kinetic Modelling of Infection Tracers [(18)F]FDG, [(68)Ga]Ga-Citrate, [(11)C]Methionine, and [(11)C]Donepezil in a Porcine Osteomyelitis Model",18.437222,0.11668485,2017-10-09,"INTRODUCTION: Positron emission tomography (PET) is increasingly applied for infection imaging using [(18)F]FDG as tracer, but uptake is unspecific. The present study compares the kinetics of [(18)F]FDG and three other PET tracers with relevance for infection imaging. METHODS: A juvenile porcine osteomyelitis model was used. Eleven pigs underwent PET/CT with 60-minute dynamic PET imaging of [(18)F]FDG, [(68)Ga]Ga-citrate, [(11)C]methionine, and/or [(11)C]donepezil, along with blood sampling. For infectious lesions, kinetic modelling with one- and two-tissue-compartment models was conducted for each tracer. RESULTS: Irreversible uptake was found for [(18)F]FDG and [(68)Ga]Ga-citrate; reversible uptake was found for [(11)C]methionine (two-tissue model) and [(11)C]donepezil (one-tissue model). The uptake rate for [(68)Ga]Ga-citrate was slow and diffusion-limited. For the other tracers, the uptake rate was primarily determined by perfusion (flow-limited uptake). Net uptake rate for [(18)F]FDG and distribution volume for [(11)C]methionine were significantly higher for infectious lesions than for correspondingly noninfected tissue. For [(11)C]donepezil in pigs, labelled metabolite products appeared to be important for the analysis. CONCLUSIONS: The kinetics of the four studied tracers in infection was characterized. For clinical applications, [(18)F]FDG remains the first-choice PET tracer. [(11)C]methionine may have a potential for detecting soft tissue infections. [(68)Ga]Ga-citrate and [(11)C]donepezil were not found useful for imaging of osteomyelitis.","Jødal, Lars; Jensen, Svend B.; Nielsen, Ole L.; Afzelius, Pia; Borghammer, Per; Alstrup, Aage K. O.; Hansen, Søren B.",Contrast Media Mol Imaging,378,1
12146,12146,12146,"Uncertainty Is the New Norm, Adaptability Is Essential",18.383797,0.42504358,2020-07-28,"The sympathetic nervous system modulates cardiac function by controlling key parameters such as chronotropy and inotropy. Sympathetic control of ventricular function occurs through extrinsic innervation arising from the stellate ganglia and thoracic sympathetic chain. In the healthy heart, sympathetic release of norepinephrine (NE) results in positive modulation of chronotropy, inotropy, and dromotropy, significantly increasing cardiac output. However, in the setting of myocardial infarction or injury, sympathetic activation persists, contributing to heart failure and increasing the risk of arrhythmias, including sudden cardiac death. Methodologies for detection of norepinephrine in cardiac tissue are limited. Present techniques rely on microdialysis for analysis by high-performance liquid chromatography coupled to electrochemical detection (HPLC-ED), radioimmunoassay, or other immunoassays, such as enzyme-linked immunosorbent assay (ELISA). Although significant information about the release and action of norepinephrine has been obtained with these methodologies, they are limited in temporal resolution, require large sample volumes, and provide results with a significant delay after sample collection (hours to weeks). In this study, we report a novel approach for measurement of interstitial cardiac norepinephrine, using minimally invasive, electrode-based, fast-scanning cyclic voltammetry (FSCV) applied in a beating porcine heart. The first multispatial and high temporal resolution, multichannel measurements of NE release in vivo are provided. Our data demonstrate rapid changes in interstitial NE profiles with regional differences in response to coronary ischemia, sympathetic nerve stimulation, and alterations in preload/afterload. NEW & NOTEWORTHY Pharmacological, electrical, or surgical regulation of sympathetic neuronal control can be used to modulate cardiac function and treat arrhythmias. However, present methods for monitoring sympathetic release of norepinephrine in the heart are limited in spatial and temporal resolution. Here, we provide for the first time a methodology and demonstration of practice and rapid measures of individualized regional autonomic neurotransmitter levels in a beating heart. We show dynamic, spatially resolved release profiles under normal and pathological conditions.","Chan, Shyue-An; Vaseghi, Marmar; Kluge, Nicholas; Shivkumar, Kalyanam; Ardell, Jeffrey L.; Smith, Corey",Am J Physiol Heart Circ Physiol,378,22
13274,13274,13274,Red cell volume measurement: using technetium as a replacement for chromium,18.523676,0.12567788,2020-10-06,,,Lancet Diabetes Endocrinol,378,8
15037,15037,15037,Competing risk largely explains the drop in admissions for acute cardiovascular disease during the COVID-19 pandemic. Response,18.366087,0.024363285,2020-10-07,,"Rubiera Ponga, Carlos; Quispe-Mauricio, Ángel Pelayo; Sánchez-Carpintero Abad, María",Arch Bronconeumol,378,24
15050,15050,15050,Cardiac involvement in COVID-19: does echocardiography matter? Response,18.708853,0.20477073,2020-12-21,,"Pujadas, Elisabet; Chaudhry, Fayzan; McBride, Russell; Richter, Felix; Zhao, Shan; Wajnberg, Ania; Nadkarni, Girish; Glicksberg, Benjamin S; Houldsworth, Jane; Cordon-Cardo, Carlos",Lancet Respir Med,378,16
17999,17999,17999,An easy and practical guide for imaging infection/inflammation by [(18)F]FDG PET/CT,18.290104,0.039880272,2021-06-01,"Using a ground-based model to simulate spaceflight [21-days of single-housed, hindlimb unloading (HLU) combined with continuous low-dose gamma irradiation (LDR, total dose of 0.04 Gy)], an in-depth survey of the immune and hematological systems of mice at 7-days post-exposure was performed. Collected blood was profiled with a hematology analyzer and spleens were analyzed by whole transcriptome shotgun sequencing (RNA-sequencing). The results revealed negligible differences in immune differentials. However, hematological system analyses of whole blood indicated large disparities in red blood cell differentials and morphology, suggestive of anemia. Murine Reactome networks indicated majority of spleen cells displayed differentially expressed genes (DEG) involved in signal transduction, metabolism, cell cycle, chromatin organization, and DNA repair. Although immune differentials were not changed, DEG analysis of the spleen revealed expression profiles associated with inflammation and dysregulated immune function persist to 1-week post-simulated spaceflight. Additionally, specific regulation pathways associated with human blood disease gene orthologs, such as blood pressure regulation, transforming growth factor-β receptor signaling, and B cell differentiation were noted. Collectively, this study revealed differential immune and hematological outcomes 1-week post-simulated spaceflight conditions, suggesting recovery from spaceflight is an unremitting process.","Paul, Amber M.; Overbey, Eliah G.; da Silveira, Willian A.; Szewczyk, Nathaniel; Nishiyama, Nina C.; Pecaut, Michael J.; Anand, Sulekha; Galazka, Jonathan M.; Mao, Xiao Wen",Sci Rep,378,1
20441,20441,20441,Carcinoembryonic Antigen Increase in a Patient with Colon Cancer Who Have Achieved Complete Remission and Negative (18)F-FDG PET/CT: Don’t Forget the Thyroid!,18.683151,0.13002555,2021-08-05,"The prevalence of chronic kidney disease (CKD) is increasing worldwide, and a close association between acute kidney injury (AKI) and CKD has recently been identified. Black cumin (Nigella sativa) has been shown to be effective in treating various kidney diseases. Accumulating evidence shows that black cumin and its vital compound, thymoquinone (TQ), can protect against kidney injury caused by various xenobiotics, namely chemotherapeutic agents, heavy metals, pesticides, and other environmental chemicals. Black cumin can also protect the kidneys from ischemic shock. The mechanisms underlying the kidney protective potential of black cumin and TQ include antioxidation, anti-inflammation, anti-apoptosis, and antifibrosis which are manifested in their regulatory role in the antioxidant defense system, NF-κB signaling, caspase pathways, and TGF-β signaling. In clinical trials, black seed oil was shown to normalize blood and urine parameters and improve disease outcomes in advanced CKD patients. While black cumin and its products have shown promising kidney protective effects, information on nanoparticle-guided targeted delivery into kidney is still lacking. Moreover, the clinical evidence on this natural product is not sufficient to recommend it to CKD patients. This review provides insightful information on the pharmacological benefits of black cumin and TQ against kidney damage.","Hannan, Md. Abdul; Zahan, Md. Sarwar; Sarker, Partha Protim; Moni, Akhi; Ha, Hunjoo; Uddin, Md Jamal",Int J Mol Sci,378,1
31753,31753,31753,COVID-19 y shock cardiogénico: diferentes formas de presentación cardiovascular con alta mortalidad,18.443592,-0.056152385,2020-04-27,"The identification of angiotensin-converting enzyme 2 (ACE2) as a cellular receptor for the SARS coronavirus (SARS-CoV) rejuvenated research into what was regarded by some as a minor player in the renin–angiotensin system. The discovery of its double life led to breathtaking advances in the understanding of virtually all aspects of its biology, including its structure, physiological and pathophysiological roles and cell biology. ACE2, like its well-known homologue, ACE, is a metallopeptidase which resides on the cell surface of the epithelial, and sometimes endothelial, cells of the heart, kidney, testes, lung and gastrointestinal tract. It is a type I transmembrane protein with a large catalytic extracellular domain which acts as both a peptidase and a viral receptor. This extracellular domain can be cleaved from the cell surface by other peptidases, modulating its activity. The levels of the enzyme on the cell surface are also thought to be regulated by internalisation on S-protein binding and by clustering in membrane microdomains known as lipid rafts. This chapter summarises the current understanding of how the cell biology of ACE2 is regulated and may influence and determine its function, and concludes by discussing the future challenges and opportunities for studies of this increasingly important enzyme.","Lambert, Daniel W.",Molecular Biology of the SARS-Coronavirus,378,15
33271,33271,33271,Living evidence in response to controversies about the use of antimalarials in COVID-19,18.308098,0.016395563,2020-05-29,"A digraph D is singly connected if for all ordered pairs of vertices [Formula: see text], there is at most one path in D from u to v. In this paper, we study the Singly Connected Vertex Deletion (SCVD) problem: Given an n-vertex digraph D and a positive integer k, does there exist a set [Formula: see text] such that [Formula: see text] and [Formula: see text] is singly connected? This problem may be seen as a directed counterpart of the (Undirected) Feedback Vertex Set problem, as an undirected graph is singly connected if and only if it is acyclic. SCVD is known to be NP-hard on general digraphs. We study the complexity of SCVD on various classes of digraphs such as tournaments, and various generalisations of tournaments such as digraphs of bounded independence number, in- and out-tournaments and local tournaments. We show that unlike the Feedback Vertex Set on Tournaments (FVST) problem, SCVD is polynomial time solvable on tournaments. In addition, we show that SCVD is polynomial time solvable on digraphs of bounded independence number, and on the class of acyclic local tournaments. We also study the parameterized complexity of SCVD, with k as the parameter, on the class of in-tournaments. And we show that on in-tournaments (and out-tournaments), SCVD admits a fixed-parameter tractable algorithm and a quadratic kernel. We also show that on the class of local tournaments, which is a sub-class of in-tournaments, SCVD admits a linear kernel.","Das, Avinandan; Kanesh, Lawqueen; Madathil, Jayakrishnan; Muluk, Komal; Purohit, Nidhi; Saurabh, Saket",Combinatorial Algorithms,378,16
39542,39542,39542,Competing risk largely explains the drop in admissions for acute cardiovascular disease during the COVID-19 pandemic,18.411598,0.114552446,2020-09-18,Zahlreiche Erkrankungen gehen mit einer Vergrößerung der Leber einher. In den einzelnen Altersgruppen verteilen sich die möglichen Diagnosen in ihrer Häufigkeit sehr unterschiedlich. Neben entzündlichen Prozessen in der Leber können Stoffwechsel- und infiltrative Erkrankungen sowie Veränderungen des Blutflusses in der Leber oder Gallenwegerkrankungen mit einer Hepatomegalie in ursächlichem Zusammenhang stehen.,"Lang, Thomas; Rodeck, Burkhard","P&#x000e4;diatrische Gastroenterologie, Hepatologie und Ern&#x000e4;hrung",378,24
41432,41432,41432,Myocardial infarction in times of COVID-19,18.2564,0.23797081,2020-10-31,,"Ritter, Thomas",AMS Rev,378,20
42195,42195,42195,Cardiac involvement in COVID-19: does echocardiography matter?,18.502571,0.21028131,2020-11-19,,"Faggian, Alessandra; Modica, Marco",Rev Reg Res,378,1
43268,43268,43268,Institucionalização das políticas informadas por evidências no Brasil,18.273766,0.15264851,2020-12-17,,"Chan, K.",Br Dent J,378,1
54098,54098,54098,tbv: Tijdschrift voor Bedrijfs- en Verzekeringsgeneeskunde,18.310715,0.13597755,2021-06-18,,"Mummery, Christine",Stem Cell Reports,378,1
55647,55647,55647,"Horning SJ, Juweid ME, Schöder H, et al. Interim positron emission tomography scans in diffuse large B-cell lymphoma: an independent expert nuclear medicine evaluation of the Eastern Cooperative Oncology Group E3404 study. Blood. 2010;115(4):775–777.",18.731085,0.1482033,2012-05-31,,,Reactions Weekly,378,1
59666,59666,59666,Cerebral oxygenation in patients undergoing shoulder surgery in beach chair position: comparing general to regional anesthesia and the impact on neurobehavioral outcome.,18.520773,-0.017378757,2014,"UNLABELLED Early biochemical studies of viral replication suggested that most viruses produce double-stranded RNA (dsRNA), which is essential for the induction of the host immune response. However, it was reported in 2006 that dsRNA could be detected by immunofluorescence antibody staining in double-stranded DNA and positive-strand RNA virus infections but not in negative-strand RNA virus infections. Other reports in the literature seemed to support these observations. This suggested that negative-strand RNA viruses produce little, if any, dsRNA or that more efficient viral countermeasures to mask dsRNA are mounted. Because of our interest in the use of dsRNA antibodies for virus discovery, particularly in pathological specimens, we wanted to determine how universal immunostaining for dsRNA might be in animal virus infections. We have detected the in situ formation of dsRNA in cells infected with vesicular stomatitis virus, measles virus, influenza A virus, and Nyamanini virus, which represent viruses from different negative-strand RNA virus families. dsRNA was also detected in cells infected with lymphocytic choriomeningitis virus, an ambisense RNA virus, and minute virus of mice (MVM), a single-stranded DNA (ssDNA) parvovirus, but not hepatitis B virus. Although dsRNA staining was primarily observed in the cytoplasm, it was also seen in the nucleus of cells infected with influenza A virus, Nyamanini virus, and MVM. Thus, it is likely that most animal virus infections produce dsRNA species that can be detected by immunofluorescence staining. The apoptosis induced in several uninfected cell lines failed to upregulate dsRNA formation. IMPORTANCE An effective antiviral host immune response depends on recognition of viral invasion and an intact innate immune system as a first line of defense. Double-stranded RNA (dsRNA) is a viral product essential for the induction of innate immunity, leading to the production of type I interferons (IFNs) and the activation of hundreds of IFN-stimulated genes. The present study demonstrates that infections, including those by ssDNA viruses and positive- and negative-strand RNA viruses, produce dsRNAs detectable by standard immunofluorescence staining. While dsRNA staining was primarily observed in the cytoplasm, nuclear staining was also present in some RNA and DNA virus infections. The nucleus is unlikely to have pathogen-associated molecular pattern (PAMP) receptors for dsRNA because of the presence of host dsRNA molecules. Thus, it is likely that most animal virus infections produce dsRNA species detectable by immunofluorescence staining, which may prove useful in viral discovery as well.","Son, Kyung-No; Liang, Zhiguo; Lipton, Howard L",Journal of virology,378,1
60499,60499,60499,Reflection on the Fly: Development of the Team Reflection Behavioral Observation (TuRBO) System for Acute Care Teams.,18.578876,0.11697495,2021-03-30,"Despite the growing proportion of older adults in the United States, federal and state funding for nonmedical supportive services remains limited. To meet increasing demand, some communities across the nation are exploring alternative funding sources for aging services. Although no systematic database exists to track such local programs, through an array of data sources including a national survey, telephone contacts, and a web review, we identified 15 states that are using local funding to support aging services. Communities are using a variety of local revenue streams, such as property tax levies, payroll, and sales taxes to provide services for older adults and/or their family or friend caregivers. There are considerable differences in community approaches including the following: amount of revenue generated, service eligibility criterion, type of services covered, and management infrastructure. Critical policy questions surrounding equity issues within and across states are raised as communities create these alternative funding mechanisms.","Koumoutzis, Athena; Stemen, Sara E; Maharjan, Renusha; Heston-Mullins, Jennifer; Mayberry, Pamela S; Applebaum, Robert",Journal of applied gerontology : the official journal of the Southern Gerontological Society,378,25
61405,61405,61405,Using Learning Experience Design to Optimize Digital Instruction During COVID-19 and Beyond.,18.367981,0.41064444,2020-12-10,,"Shehab, Nadine; Lovegrove, Maribeth; Budnitz, Daniel S",JAMA internal medicine,378,16
61661,61661,61661,From academic publication to science dissemination.,18.77552,0.36275983,2021,"INTRODUCTION Diagnostic metagenomics and its associated trail of publications are spreading across the world. Multiple clinical labs in the United States, Europe, and Asia have gone to considerable lengths to optimize and validate a range of protocols for agnostically detecting viral, bacterial, fungal, and eukaryotic parasite nucleic acid across a range of patient specimens to aid in diagnosis for particularly recalcitrant cases. Others see a role for diagnostic metagenomics as a frontline diagnostic to replace other microbiological testing. Areas covered: There are considerable barriers to adoption for diagnostic metagenomics, including analytical sensitivity, interpretation, actionability, turnaround time, antimicrobial susceptibility, clinical utility, laboratory workflow, trial comparators, cost, and reimbursement. Expert commentary: Metagenomics is unlikely to become 'one test to rule them all' any time soon, not least because it is not indicative of historical infection like some of the highest volume tests in the clinical virology lab, viral serologies. The high cost and low marginal utility compared to 'standard of care' diagnostics have forced metagenomics to be mostly used for last-ditch cases. However, waiting for such patients to declare themselves as being diagnostically challenging in turn likely lessens the diagnostic yield and actionability of the information. Significant reductions in the cost of metagenomic sequencing are required for it to move up in the diagnostic pipeline. This review covers these associated obstacles of metagenomics, arguing for a parsimonious role in last-ditch diagnostics and awaiting the answer of many outstanding questions regarding its adoption.","Greninger, Alexander L",Expert review of molecular diagnostics,378,31
62383,62383,62383,Virtual bedside concerts for patients with COVID-19: a trio of perspectives.,18.297232,0.05947474,2020-11-02,"Anastomotic leaks and bleeding are the two most feared major complications in patients undergoing laparoscopic gastric bypass (LRYGB). This study was designed to evaluate if there is a clinical correlation between abnormal vital signs and postoperative leaks and bleeding. After IRB approval and adherence to HIPAA guidelines, a retrospective review of medical records was performed on 518 patients who underwent LRYGB between October 2002 and October 2006. Vital signs from each patient were monitored hourly. Eight patients out of 518 (1.54%) were discovered to have anastomotic leak. A marked increase in heart rate up to 120 bpm at 20 h after surgery occurred in five of eight patients (62.5%). Of the eight patients who had a leak, seven (87.5%) experienced sustained tachycardia above 120 bpm. On the other hand, 20 patients out of 518 (3.86%) were discovered to have postoperative bleeding. A gradual rather than a dramatic increase in heart rate was recorded in 17 of 20 patients (85%) starting 8 h after surgery. Five patients (25%) had unsustained tachycardia above 120 bpm. Twelve patients in this group (60%) were seen to have cyclical tachycardia that never exceeded 120 bpm at any point during hospitalization. Marginal hypotension was found in seven patients (35%) in this group. Sustained tachycardia with a heart rate exceeding 120 bpm appears to be an indicator of anastomotic leak. Tachycardia less than 120 bpm that has occurred in a cyclical pattern strongly pointed toward postoperative bleeding. Anastomotic leaks and bleeding are the two most feared major complications in patients undergoing LRYGB. This study was designed to evaluate if there is a clinical correlation between abnormal vital signs and postoperative leaks and bleeding.","Bellorin, Omar; Abdemur, Abraham; Sucandy, Iswanto; Szomstein, Samuel; Rosenthal, Raul J",Obesity surgery,378,1
62684,62684,62684,Obtaining tissues and organs for transplantation and coronavirus infections: a scoping review.,18.612818,0.3619619,2021,"The COVID-19 pandemic is a global contagion of unprecedented proportions and health, economic, and social consequences. As with many health problems, its impact is uneven. This article argues the COVID-19 pandemic is a global health injustice due to moral failures of national governments and international organizations to prepare for, prevent and control it. Global and national health communities had a moral obligation to act in accordance with the current state of knowledge of pandemic preparedness. This obligation-a positive duty to develop and implement systems to reduce threats to and safeguard individuals' and, communities' abilities to flourish-stems from theories of global health justice and governance. The COVID-19 pandemic revealed and amplified the fragility and deficiencies in our global and domestic health institutions and systems. Moving forward, positive public health ethics is needed to set ethical standards for building and operating robust public health systems for resilient individuals and communities.","Prah Ruger, Jennifer",The American journal of bioethics : AJOB,378,1
63239,63239,63239,COVID-19: Mandatory institutional isolation v. voluntary home self-isolation.,18.687622,0.28536645,2020-04-23,"BACKGROUND & AIMS TQ-A3334, a selective, oral toll-like receptor (TLR)-7 agonist, is being developed to treat chronic hepatitis B (CHB). This study evaluated the safety, pharmacokinetics (PK), and pharmacodynamics (PD) of TQ-A3334 in healthy participants. RESEARCH DESIGN AND METHODS The effects of a single-ascending dose of TQ-A3334 (0.2-1.8 mg) combined with food (1.2 mg) were evaluated in 48 healthy participants. RESULTS No serious adverse events or discontinuations occurred in the study. The most common adverse reactions were lymphocyte count decreased and headache, which were generally consistent with IFN-α exposure and the mechanism of action of a TLR7 agonist. TQ-A3334 was rapidly absorbed, with a time to maximum plasma concentration of 0.42-0.5 h. Systemic exposure (Cmax and AUC) to TQ-A3334 increased with a slight saturation proportion to dose. Food reduced the exposure of TQ-A3334. The concentrations of MCP-1, ISG-15, MX-1, and OAS-1 were observed to be slightly dose-dependent, ranging from 1.0 to 1.8 mg TQ-A3334. CONCLUSIONS Oral doses of 0.2-1.8 mg appeared to be safe and tolerated. PD activity was seen at doses ranging from 1.0 to 1.8 mg, indicating its possible future use to treat CHB.","Zhang, Hong; Hu, Yue; Wu, Min; Liu, Jingrui; Li, Xiaojiao; Zhu, Xiaoxue; Li, Cuiyun; Chen, Hong; Liu, Chengjiao; Niu, Junqi; Ding, Yanhua",Expert opinion on investigational drugs,378,1
