,title_x,publish_time_x,abstract,authors,journal,url,category
191284,Early clinical predictors of severe acute respiratory syndrome in the emergency department.,2004,"In this work we have shown that astrovirus infection induces apoptosis of Caco-2 cells, since fragmentation of cellular DNA, cleavage of cellular proteins which are substrate of activated caspases, and a change in the mitochondrial transmembrane potential occur upon virus infection. The human astrovirus Yuc8 polyprotein capsid precursor VP90 is initially processed to yield VP70, and we have shown that this processing is trypsin independent and occurs intracellularly through four cleavages at its carboxy-terminal region. We further showed that VP90-VP70 processing is mediated by caspases, since it was blocked by the pancaspase inhibitor benzyloxycarbonyl-Val-Ala-Asp fluoromethylketone (z-VAD-fmk), and it was promoted by the apoptosis inducer TNF-related apoptosis-inducing ligand (TRAIL). Although the cell-associated virus produced in the presence of these compounds was not affected, the release of infectious virus to the cell supernatant was drastically reduced in the presence of z-VAD-fmk and increased by TRAIL, indicating that VP90-VP70 cleavage is important for the virus particles to be released from the cell. This is the first report that describes the induction and utilization of caspase activity by a virus to promote processing of the capsid precursor and dissemination of the viral particles.","Méndez, Ernesto; Salas-Ocampo, Elizabeth; Arias, Carlos F",Journal of virology,https://www.ncbi.nlm.nih.gov/pubmed/15280469/,374
191356,Coronavirus genomic-sequence variations and the epidemiology of the severe acute respiratory syndrome.,2003,,"Wing, Y K; Leung, C M",Hong Kong medical journal = Xianggang yi xue za zhi,https://www.ncbi.nlm.nih.gov/pubmed/22865219/,374
192764,Comparison of the clinical manifestations of severe acute respiratory syndrome and Mycoplasma pneumoniae pneumonia.,2004,"Toronto, in the province of Ontario, Canada was one of the cities severely impacted by Severe Acute Respiratory Syndrome (SARS). SARS required the health care system to respond quickly and efficiently. This paper describes the situation and response at a large public academic aged care centre.","Goldhar, Jodeme; Adie, Clare; Webb, Nancy; Harrison, Laurie",Australian health review : a publication of the Australian Hospital Association,https://www.ncbi.nlm.nih.gov/pubmed/15368814/,374
194811,Metered-dose inhaler with spacer instead of nebulizer during the outbreak of severe acute respiratory syndrome in Singapore.,2009,"The etiology of multiple sclerosis is an elusive field due to the lack of the usual cause-effect relationship model to explain a disease. In fact, with all the current evidence we start thinking in multiple sclerosis as a multi-factorial disease, where an infective agent on a genetically permissive host can lead to inflammation, demyelination and ultimately to neurological damage with dire consequences for the patients. This review will focus on the role of viruses in multiple sclerosis etiology and give some insight regarding this complicated issue.","Gutiérrez, José; Koppel, Barbara; Kleiman, Anne; Akfirat, Gokhan",Revista medica del Instituto Mexicano del Seguro Social,https://www.ncbi.nlm.nih.gov/pubmed/19263668/,374
194986,"Outbreak of severe acute respiratory syndrome in southern Taiwan, 2003.",2005,"The aim of this study was to investigate the prevalence and seasonal distribution of respiratory viruses in pediatric and adult outpatients and inpatients who were admitted to hospital with the symptoms of upper and lower respiratory tract infections, during a 12-year period. A total of 5102 clinical samples (4372 nasopharyngeal swabs, 316 bronchoalveolar lavages, 219 transtracheal aspirates, 163 nasopharyngeal aspirates, 20 sputum, 10 nasal swabs) examined in our laboratory between January 1st 2002 and July 17th 2014, were evaluated retrospectively. Of the specimens, 1107 (21.7%) were obtained from outpatients and 3995 (78.3%) from hospitalized patients. Of the patients, 2851 (55.9%) were male and 2251 (44.1%) were female, while 1233 (24.2%) were adults and 3869 (75.8%) were children (age range: 1 day - 93 years; median: 3 years). Respiratory samples were investigated for the presence of respiratory syncytial virus (RSV), influenza virus type A and B (INF-A, INF-B), adenovirus (AdV), parainfluenza viruses (PIV types 1-4), human rhinoviruses (HRV), human coronaviruses (HCoV), human metapneumovirus (HMPV) and human bocavirus (HBoV). All specimens were tested by both direct immunofluorescence antibody (DFA) and shell vial cell culture (SVCC) methods. In DFA assay the samples were initially screened by fluorescent-labeled polyclonal antibodies, and the positive ones were typed by using monoclonal antibodies (Light Diagnostics, Merck Millipore, USA). In SVCC, HEp-2, MDCK, A-549 and Vero cell lines were used for the isolation of viruses. In addition to these methods, real-time multiplex PCR methods (RealAccurate®, Respiratory RT PCR, PathoFinder, Netherlands and Seeplex® RV15 ACE Detection, Seegene, South Korea) were used for the detection of respiratory viruses in samples (n= 2104) obtained from 2007 to 2014. Respiratory viruses were detected in a total of 1705 (33.4%) patients, of them 967 (19%) were male and 738 (14.4%) were female. Three hundred and eighteen (18.6%) of the 1705 patients were infected with multiple respiratory viruses. The most frequently observed co-infections were RSV+INF-A (40/318; 12.6%), and RSV+PIV (33/318; 10.4%). The rate of positivity for the respiratory viruses in pediatric and adult groups were 35.4% (1369/3869) and 27.3% (336/1233), respectively (p< 0.000). The most frequently detected virus in pediatric group was RSV (336/1369; 24.5%), followed by influenza viruses (314/1369; 22.9%), PIV (197/1369; 14.4%), HRV (118/1369; 8.6%), AdV (75/1369; 5.5%) and the others (49/1369; 3.6%). On the other hand the most frequently detected virus in adult group was influenza viruses (181/336; 53.8%) followed by AdV (37/336; 11%), RSV (24/336; 7.1%), PIV (24/336; 7.1%), HRV (23/336; 6.8%) and the others (9/336; 2.7%). The rate of multiple virus infections in pediatric and adult groups were 7.2% (280/3869) and 3% (38/1233), respectively. Most of the coinfections (280/318; 88%) were detected in children. Respiratory viruses were detected positive in 40.2% (445/1107) of outpatients, and in 31.5% (1260/3995) of inpatients (p< 0.000). The most frequent viruses detected in pediatric outpatients and inpatients were HRV and RSV, respectively, while influenza viruses were the first in line among both adult outpatients and inpatients. During the study period, a PIV-3 outbreak (n= 96) have emerged between December 2004-April 2005, and an influenza A (H1N1)pdm09 outbreak (n= 207) between November 2009-January 2010. When the seasonal distribution was considered, the isolation rates of 1705 respiratory viruses in winter, spring, summer and autumn were 44.4%, 27%, 8.3% and 20.3%, respectively. RSV was most frequently detected from December to March, influenza viruses from November to March, HRV from December to June, and mixed infections from January to February. In conclusion, the data of our study obtained in about 12-year period indicated that the prevalence of respiratory viruses in acute respiratory infections is 33.4%, and they typically active during the months of winter and early spring in our region.","Çiçek, Candan; Arslan, Ayşe; Karakuş, Haydar Soydaner; Yalaz, Mehmet; Saz, Eylem Ulaş; Pullukçu, Hüsnü; Çok, Gürsel",Mikrobiyoloji bulteni,https://www.ncbi.nlm.nih.gov/pubmed/26167819/,374
195121,Clinical characteristics of fatal patients with severe acute respiratory syndrome in a medical center in Taipei.,2003,"Translational readthrough-promoting drugs enhance the incorporation of amino acids at stop codons and can thus bypass premature termination during protein synthesis. The polymerase (Pol) proteins of Moloney murine leukemia virus (MoMLV) are synthesized as a large Gag–Pol fusion protein, formed by the readthrough of a stop codon at the end of the gag ORF. The downstream pol ORF lacks its own start codon, and Pol protein synthesis is wholly dependent on translation of the upstream gag gene and the readthrough event for expression. Here, we explored the effects of readthrough-promoting drugs – aminoglycoside antibiotics and the small molecule ataluren – on the efficiency of readthrough of the stop codon in the context of the MoMLV genome. We showed that these compounds increased readthrough of the stop codon at the MoMLV gag–pol junction in vivo above the already high basal level and that the resulting elevated gag–pol readthrough had deleterious effects on virus replication. We also showed that readthrough efficiency could be driven to even higher levels in vitro, and that the combination of the small molecules and the RNA structure at the MoMLV stop codon could achieve extremely high readthrough efficiencies.","Green, Lisa; Goff, Stephen P",The Journal of general virology,https://www.ncbi.nlm.nih.gov/pubmed/26382736/,374
195153,Clinical brief: severe acute respiratory syndrome (SARS).,2003,"Approximately 1.2 million Vietnamese live in the United States. Health care providers need to understand that this population differs greatly from other cultures depending on gender, religion, generation, reason for migration, enclave identity, educational level, and language preference. This article will explore the history, communication practices, biocultural ecology, and health care principles among this population.","Purnell, Larry Dale",Urologic nursing,https://www.ncbi.nlm.nih.gov/pubmed/18335701/,374
195457,"Severe acute respiratory syndrome (SARS), a zoonotic infection with rapid spread: are we ready for the coming ones?",2003,"Predictions for acute care in the upcoming months are difficult. There will be challenges: there always are and that to a degree is what makes working in acute care so fulfilling. However, even the most adaptive and innovative acute care systems will toil when these challenges become overwhelming. Back in 2015, the then SAM President Mark Holland described a ""perfect storm"" of events that could lead to a challenging winter period. It was as predicted; but this storm continues to evolve and has not yet reached its perfected chaotic peak.","Lovell, B",Acute medicine,https://www.ncbi.nlm.nih.gov/pubmed/34190734/,374
196676,Digestive system manifestations in patients with severe acute respiratory syndrome.,2003,,"Ni Bhuachalla, C; Murphy, N; O'Sullivan, M; O' Mahony, M; Buckley, C; Foley-Nolan, C; Murray, D; Brennan, A; Sheahan, A",Irish medical journal,https://www.ncbi.nlm.nih.gov/pubmed/32818367/,374
197224,Severe acute respiratory syndrome in Singapore.,2004,,"Gassama-Sow, Amy; Aïdara-Kane, Awa; Raked, Nabil; Denis, François; Ploy, Marie-Cécile",Emerging infectious diseases,https://www.ncbi.nlm.nih.gov/pubmed/15338548/,374
197503,Clinical manifestations of two cases with severe acute respiratory syndrome (SARS) in I-Lan County.,2004,"In today's world the increased potential of terrorist attacks places unique burdens and consequences on health care workers. Hospitals and hospital personnel must now be prepared to react immediately to such events. They must also implement, in advance, policies to protect their own health care personnel while providing care to victims. In this review, we discuss the four major forms of mass casualty terrorism (biological, chemical, nuclear, and thermomechanical) including clinical signs and symptoms for each, the impact on health care personnel, and special considerations for children. We will then outline key principles of hospital preparation with regard to paediatrics in anticipation of such emergencies.","Chung, S; Shannon, M",Archives of disease in childhood,https://www.ncbi.nlm.nih.gov/pubmed/16301559/,374
198176,Laboratory-acquired severe acute respiratory syndrome.,2004,"At the end of May 2015, an imported case of Middle East respiratory syndrome coronavirus (MERS-CoV) infection was confirmed in China. The patient is in a stable condition and is still undergoing treatment. In this report, we summarise the preliminary findings for this imported case and the results of contact tracing. We identified 78 close contacts and after 14 days of monitoring and isolation, none of the contacts presented symptoms and all tested negative for MERS-CoV.","Wu, J; Yi, L; Zou, L; Zhong, H; Liang, L; Song, T; Song, Y; Su, J; Ke, C",Euro surveillance : bulletin Europeen sur les maladies transmissibles = European communicable disease bulletin,https://www.ncbi.nlm.nih.gov/pubmed/26111235/,374
198843,Critically ill patients with severe acute respiratory syndrome.,2003,"Before the emergence of severe acute respiratory syndrome (SARS) coronavirus (SARS-CoV) in 2003, only 12 other animal or human coronaviruses were known. The discovery of this virus was soon followed by the discovery of the civet and bat SARS-CoV and the human coronaviruses NL63 and HKU1. Surveillance of coronaviruses in many animal species has increased the number on the list of coronaviruses to at least 36. The explosive nature of the first SARS epidemic, the high mortality, its transient reemergence a year later, and economic disruptions led to a rush on research of the epidemiological, clinical, pathological, immunological, virological, and other basic scientific aspects of the virus and the disease. This research resulted in over 4,000 publications, only some of the most representative works of which could be reviewed in this article. The marked increase in the understanding of the virus and the disease within such a short time has allowed the development of diagnostic tests, animal models, antivirals, vaccines, and epidemiological and infection control measures, which could prove to be useful in randomized control trials if SARS should return. The findings that horseshoe bats are the natural reservoir for SARS-CoV-like virus and that civets are the amplification host highlight the importance of wildlife and biosecurity in farms and wet markets, which can serve as the source and amplification centers for emerging infections.","Cheng, Vincent C C; Lau, Susanna K P; Woo, Patrick C Y; Yuen, Kwok Yung",Clinical microbiology reviews,https://www.ncbi.nlm.nih.gov/pubmed/17934078/,374
199605,Reply to Qin et al,2020,,,Diabetes,https://www.ncbi.nlm.nih.gov/pubmed/23792732/,374
200260,Mapping the incidence of the COVID-19 hotspot in Iran - Implications for Travellers,2020,No abstract provided.,"Rocke, J; Evans, C; Kumar, B N",The Medical journal of Malaysia,https://www.ncbi.nlm.nih.gov/pubmed/34558554/,374
203044,Hydroxychloroquine and Chloroquine,2020,"Background: On 31 December 2019 an outbreak of COVID-19 in Wuhan, China, was reported. The outbreak spread rapidly to other Chinese cities and multiple countries. This study described the spatio-temporal pattern and measured the spatial association of the early stages of the COVID-19 epidemic in mainland China from 16 January-06 February 2020.","Kang, DaYun Choi Hyunho Kim JongHun Choi Jungsoon",International Journal of Infectious Diseases,,374
203380,Accuracy of the Polymerase Chain Reaction (PCR) test in the diagnosis of acute respiratory syndrome due to coronavirus: a systematic review and meta-analysis,2020,"Context: A relevant portion of COVID-19 patients develop severe disease with negative outcomes. Several biomarkers have been proposed to predict COVID-19 severity, but no definite interpretative criteria have been established to date for stratifying risk. Objective: To evaluate six serum biomarkers (C-reactive protein, lactate dehydrogenase, D-dimer, albumin, ferritin and cardiac troponin T) for predicting COVID-19 severity and to define related cut-offs able to aid clinicians in risk stratification of hospitalized patients. Design: A retrospective study of 427 COVID-19 patients was performed. Patients were divided into groups based on their clinical outcome: non-survivors vs. survivors and patients admitted to intensive care unit vs. others. ROC curves and likelihood ratios were employed to define predictive cut-offs for evaluated markers. Results: Marker concentrations at peak were significantly different between groups for both selected outcomes. At univariate logistic regression analysis, all parameters were significantly associated with higher odds of death and intensive care. At the multivariate analysis, high concentrations of lactate dehydrogenase and low concentrations of albumin in serum remained significantly associated with higher odds of death, while only low lactate dehydrogenase activities remained associated with lower odds of intensive care admission. The best cut-offs for death prediction were >731 U/L for lactate dehydrogenase and &#8804;18 g/L for albumin, while a lactate dehydrogenase activity <425 U/L was associated with a negative likelihood ratio of 0.10 for intensive treatment. Conclusions: Our study identifies which biochemistry tests represent major predictors of COVID-19 severity and defines the best cut-offs for their use.","Aloisio, Elena; Chibireva, Mariia; Serafini, Ludovica; Pasqualetti, Sara; Falvella, Felicia S; Dolci, Alberto; Panteghini, Mauro",Arch. pathol. lab. med. (1976),,374
204681,Assessing the impact of varying levels of case detection and contact tracing on COVID-19 transmission in Canada during lifting of restrictive closures using a dynamic compartmental model,2020,,"García-Alegría, J; Gómez-Huelgas, R",Rev. clin. esp. (Ed. impr.),,374
205995,Reply,2020,"Objetivo: refletir sobre as contribuições da Teoria Ambientalista na pandemia do novo Coronavírus Método: estudo teórico-reflexivo, sustentado em revisão narrativa e na Teoria Ambientalista, sobre as formas de prestação de cuidados e organização dos serviços de saúde durante a pandemia do novo Coronavírus Resultados: os conceitos Ambiente e Saúde-Doença revelaram-se fundamentais para se pensar a (re)organização dos serviços de saúde e dos domicílios, como formas de cuidado e controle ambiental Complementarmente, os conceitos Enfermagem e Sociedade, permitiram refletir sobre a necessidade de incluir novas formas de cuidado, que considerem a utilização das tecnologias e dos ambientes virtuais, para alcançar a população Conclusão: foi possível visualizar as articulações entre os conceitos expostos pela Teoria Ambientalista e a pandemia do novo Coronavírus, mostrando a atualidade da relação destes (AU) Objective:to reflect on the contributions of the Environmental Theory in the new Coronavirus pandemic Method: theoretical-reflectivestudy,supported bya narrative review and the Environmental Theory, on the waysof providing care and organization of health services during the pandemic of the new Coronavirus Results: the concepts Environment and Health-Disease proved to be fundamental to think about the (re) organization of health services and households, as forms of care and environmental control In addition, the concepts of Nursing and Society, allowed reflection on the need to include new forms of care, which consider the use of technologies and virtual environments, to reach the population Conclusion: it was possible to visualize the articulations between the concepts exposed by the Environmental Theory and the pandemic of the new Coronavirus, showing the currentness of their relationship (AU) Objetivo: reflexionar sobre los aportes de la Teoría Ambiental en la pandemia del nuevo Coronavirus Método: estudio teórico-reflexivo,respaldado por unarevisión narrativa y la Teoría Ambiental, sobre las formas debrindaratención y organización de los servicios de salud durante la pandemia del nuevo Coronavirus Resultados: los conceptos Medio Ambiente y Salud-Enfermedad resultaron fundamentales para pensar la (re) organización de los servicios de salud y los hogares, como formas de cuidado y control ambiental Además, los conceptos de Enfermería y Sociedad, permitieron reflexionar sobre la necesidad de incluir nuevas formas de atención, que consideren el uso de tecnologías y entornos virtuales, para llegar a la población Conclusión: fue posible visualizar las articulaciones entre los conceptos expuestos por la Teoría Ambiental y la pandemia del nuevo Coronavirus, mostrando la actualidad de su relación (AU)","Tavares, Diogo Henrique Gabatz Ruth Irmgard Bartschi Cordeiro Franciele Roberta Laroque Mariana Fosenca Perboni Jéssica Siqueira",J. nurs. health,,374
209490,Cutaneous Vasculitis in a Patient With COVID-19,2020,"Background: Researchers and scientists experienced the spread and aid recovery of the COVID-19 pandemic with a condition of great uncertainty With limited understanding of SARS-CoV-2, current attempts at controlling its spread are focused on the suppressing approach (to reduce a sustained endogenous transmission) and the mitigating approach (to reduce the growth rate of the epidemic) On the one hand, while there has been no firm explanation, many governments have considered immunity passport and herd immunity for paths out of restrictive physical distancing measures imposed to control the spread of SARS-CoV-2 but were not successful Purpose of Review: Herein, we attempted to systematize the lessons and shreds of evidence related to the spectrum of illness, the physiological mechanisms of host susceptibility, herd immunity, immunity passport, gender disparities, and severe challenges and uncertainties posed by the COVID-19 pandemic We hope that the insights provided in this review will help raise the effectiveness of the treatment policies and preventive measures required to end the pandemic Recent Findings: The use of immunity passports is suggested to certify an individual at low risk of acquiring or transmitting SARS-CoV-2 But, an individual might nevertheless carry the virus at similar levels and for a similar duration to those previously uninfected, with an unchanged potential for transmission Vaccine-induced herd immunity is a complex issue inherent to a vaccine and the population receiving the vaccine The central epidemiological questions about are as follows: what proportion of the population should be vaccinated to meet elimination (in a local program), eradication (in a global program) or a defined level of control? How is this affected by demographic factors (such as gender)? What is the best age at which to immunize? Besides, although age-dependent mortality risk is estimated to be higher for men and older people, such interpretation across gender, age groups, and countries, however, must be accepted with caution at present Summary: COVID-19 has taught us that health is the basis of global wealth and international solidarity is an essential response and a superior approach to isolationism Hence, we must be clear about what the alternatives are when evaluating the merits of different ways of tackling this pandemic both in the short term as well as in the long term","Sisay, T.; Tolessa, T.",Risk Management &amp; Healthcare Policy,,374
