,title_x,publish_time_x,abstract,authors,journal,url,category
41643,Multiple drugs: Enteroccocus faecalis empyema and off-label use: case report,2020-10-31,"BACKGROUND: In Kuwait, as in much of the world, COVID-19 epidemic has been spreading since February 2020. The government of Kuwait has taken several measures to minimize virus spread. The epidemic and measures to contain it will likely psychologically influence individuals. This study investigated the prevalence of anxiety and depression symptoms in Kuwaiti nationals and expats. The study’s secondary aim was to identify the association between sociodemographic characteristics and physical activity (PA) engagement, with psychological disorders such as anxiety and depression during the COVID-19 pandemic in Kuwait. A two-section survey was used to examine sociodemographic characteristics and PA engagement, and generalized anxiety (GAD-7) and depression symptoms (PHQ-9). RESULTS: Results of this study indicated that 53.7% and 59.6% of the respondents experienced anxiety and depression. The multiple regression models significantly predicted anxiety and depression (P < 0.001). In addition, PA, gender, education, and age were significantly associated with anxiety (P < .05), while PA, gender, age, and marital status were significantly associated with depression (P < .05). CONCLUSIONS: Findings suggest that the COVID-19 outbreak may have a greater psychological impact on women, younger individuals, married people, and individuals with a bachelor’s degree. However, regular PA appears to be an important immediate and long-term factor in reducing symptoms of anxiety and depression during an epidemic. SUPPLEMENTARY INFORMATION: The online version contains supplementary material available at 10.1186/s43045-020-00065-6.","Alsharji, Khaled E.",Middle East Curr Psychiatry,https://www.ncbi.nlm.nih.gov/pmc/articles/PMC7607368/,519
41644,Lopinavir/ritonavir: Hyperlipidaemia following off-label use: case report,2020-10-31,"COVID-19 surprised the whole world by its quick and sudden spread. Coronavirus pushes all community sectors: government, industry, academia, and nonprofit organizations to take forward steps to stop and control this pandemic. It is evident that IT-based solutions are urgent. This study is a small step in this direction, where health information is monitored and collected continuously. In this work, we build a network of smart nodes where each node comprises a Radio-Frequency Identification (RFID) tag, reduced function RFID reader (RFRR), and sensors. The smart nodes are grouped in clusters, which are constructed periodically. The RFRR reader of the clusterhead collects data from its members, and once it is close to the primary reader, it conveys its data and so on. This approach reduces the primary RFID reader’s burden by receiving data from the clusterheads only instead of reading every tag when they pass by its vicinity. Besides, this mechanism reduces the channel access congestion; thus, it reduces the interference significantly. Furthermore, to protect the exchanged data from potential attacks, two levels of security algorithms, including an AES 128 bit with hashing, have been implemented. The proposed scheme has been validated via mathematical modeling using Integer programming, simulation, and prototype experimentation. The proposed technique shows low data delivery losses and a significant drop in transmission delay compared to contemporary approaches.","Abuelkhail, Abdulrahman; Baroudi, Uthman; Raad, Muhammad; Sheltami, Tarek",Wireless Netw,https://www.ncbi.nlm.nih.gov/pmc/articles/PMC7607371/,519
41783,Hydroxychloroquine: QTc prolongation following off-label use: case report,2020-11-07,,,Reactions Weekly,https://www.ncbi.nlm.nih.gov/pmc/articles/PMC7644395/,519
42018,Azithromycin/hydroxychloroquine: Methemoglobinemia following off-label use: case report,2020-11-14,"Belief in astrology remains strong even today, and one of the explanations why some people endorse paranormal explanations is the individual differences in analytical thinking. Therefore, the main aim of this paper was to determine the effects of priming an analytical or intuitive thinking style on the credulity of participants. In two experiments (N = 965), analytic thinking was induced and the source of fake profile (astrological reading vs. psychological testing) was manipulated and participants’ prior paranormal beliefs, anomalous explanation, cognitive reflection, and depression were measured. Although analytic thinking was proved to be hard to induce experimentally, the results showed that analytic thinking predicts credulity and belief in the paranormal was linked with experiencing more anomalous experiences and more paranormal explanations. The more people were able to think analytically, the less credulous they were as reflected in the lower acceptance of fake profile as accurate.","Ballová Mikušková, Eva; Čavojová, Vladimíra",Front Psychol,https://www.ncbi.nlm.nih.gov/pmc/articles/PMC7593255/,519
42323,Azithromycin/hydroxychloroquine: Cardiac disorder followed by off-label use: case report,2020-11-21,"ABSTRACT: To identify novel adenosine receptor (AR) ligands based on the chalcone scaffold, herein the synthesis, characterization and in vitro and in silico evaluation of 33 chalcones (15–36 and 37–41) and structurally related compounds (42–47) are reported. These compounds were characterized by radioligand binding and GTP shift assays to determine the degree and type of binding affinity, respectively, against rat (r) A(1) and A(2A) ARs. The chalcone derivatives 24, 29, 37 and 38 possessed selective A(1) affinity below 10 µM, and thus, are the most active compounds of the present series; compound 38 was the most potent selective A(1) AR antagonist (K(i) (r) = 1.6 µM). The structure–affinity relationships (SAR) revealed that the NH(2)-group at position C3 of ring A of the chalcone scaffold played a key role in affinity, and also, the Br-atom at position C3′ on benzylidene ring B. Upon in vitro and in silico evaluation, the novel C3 amino-substituted chalcone derivative 38—that contains an α,ß-unsaturated carbonyl system and easily allows structural modification—may possibly be a synthon in future drug discovery. GRAPHIC ABSTRACT: C3 amino-substituted chalcone derivative (38) with C3′ Br substitution on benzylidene ring B possesses selective adenosine rA(1) receptor affinity in micromolar range. [Image: see text] ELECTRONIC SUPPLEMENTARY MATERIAL: The online version of this article (10.1007/s11696-020-01414-9) contains supplementary material, which is available to authorized users.","Janse van Rensburg, Helena D.; Legoabe, Lesetja J.; Terre’Blanche, Gisella",Chem Zvesti,https://www.ncbi.nlm.nih.gov/pmc/articles/PMC7670844/,519
42329,"Enoxaparin sodium/methylprednisolone: Cytomegalovirus reactivation, gastrointestinal haemorrhage and off-label use: case report",2020-11-21,"A hospital-based cross-sectional study was conducted at Khartoum state to investigate the variation of antibody responses to Plasmodium falciparum 19-kDa C-terminal region of merozoite surface protein 1 antigen and the variation of human IL4 polymorphism with parasitaemia. Measurements of natural acquisition of anti-Plasmodium falciparum MSP1-19 IgG, IgG1 and IgG3 antibodies were performed using ELISA. Molecular characterization of IL4vntr polymorphism was achieved. We were able to detect a statistically significant negative correlation between parasitaemia and different age groups (r = − 0.262 and p value = 0.043) and with anti-P.fMSP1-19 IgG1 (r = − 0.418, p value = 0.047). Anti-P.fMSP1-19 IgG showed a significant difference among age groups (p < 0.001). Only anti-P.fMSP1-19 IgG showed a significant association with general appearance (p value < 0.001). The mean for total anti-P.fMSP1-19 IgG3 was statistically significantly higher in females compared to males (p value < 0.001). There was no significant difference in the distribution of human IL4 vntr genotypic and allelic frequencies between cases and control group as well as among different clinical manifestation.We concluded that IgG1 levels to MSP1-19 were found to be negatively correlated with parasitaemia and anti-PfMSP1-19 IgG was significantly increased in ill and severely ill with age considered as a cofactor. Further studies are needed to ascertain the role of IgG and IgG1 in protection and to investigate the IgG and subclasses’ response against other antigenic markers. These findings are valuable for advancing vaccine development by providing evidence supporting merozoite antigens as targets of protective immunity in humans.","Abushama, Hind M.; AbdelRahman, Inas A.; Ali, Hiba; Mowia, Tasneem; Mousa, Faisal; Abdelhamid, Muzamil M.; ElHassan, Ibrahim M.",J Parasit Dis,https://www.ncbi.nlm.nih.gov/pmc/articles/PMC7671181/,519
42330,Multiple drugs: Lymphocytopenia and off-label use: case report,2020-11-21,,"Danilewitz, Marlon",Acad Psychiatry,https://www.ncbi.nlm.nih.gov/pmc/articles/PMC7671183/,519
42333,Azithromycin/hydroxychloroquine: Torsade-de-pointes following off-label use: case report,2020-11-21,,,Am J Cardiovasc Drugs,https://www.ncbi.nlm.nih.gov/pmc/articles/PMC7671825/,519
43023,"Ceftriaxone/hydroxychloroquine/tocilizumab: QT prolongation, torsade-de-pointes and off label use: case report",2020-12-05,,"Slinger, Paula",BDJ In Pract,https://www.ncbi.nlm.nih.gov/pmc/articles/PMC7720254/,519
43028,Sarilumab: Thrombocytopenia during an off-label use: case report,2020-12-05,,"Bradbury, Sarah",BDJ In Pract,https://www.ncbi.nlm.nih.gov/pmc/articles/PMC7720260/,519
43072,Hydroxychloroquine: Electrical storm and QT interval prolongation following off-label use: case report,2020-12-12,"BACKGROUND: Since the COVID-19 pandemic, thousands of medical procedures and appointments have been cancelled or delayed. The long-term effects of these drastic measures directly on brain tumour patients and their caregivers are unknown. The purpose of this study is to better understand how COVID-19 has affected this vulnerable population on a global scale. METHODS: An online 79-question survey was developed by the IBTA, in conjunction with the SNO COVID-19 Task Force. The survey was sent to over 120 brain tumour charities and not-for-profits worldwide and disseminated to brain tumour patients and caregivers. All responses were subdivided by patient vs caregiver and by geographical region. RESULTS: In total, 1989 participants completed the survey from 33 countries, including 1459 patients and 530 caregivers. There were no significant differences in COVID-19 testing rates (p = 0.662) or the number of positive cases for brain tumour patients between regions (p = 0.1068). Caregivers were significantly more anxious than patients (p = < 0.0001). Patients from the Americas were most likely to have lost their jobs due to the pandemic, practiced self-isolation, and received telehealth services (p = < 0.0001). Patients from Europe experienced the most treatment delays (p = 0.0031). Healthcare providers were ranked as the most trusted source of information. CONCLUSIONS: As a result of COVID-19, brain tumour patients and caregivers have experienced significant stress and anxiety. Healthcare professionals, brain tumour charities, and not-for-profits must ensure that they continue to provide accessible, high-quality care, information, and support in the age of COVID-19.","Voisin, Mathew; Oliver, Kathy; Farrimond, Stu; Chee, Tess; Zadeh, Gelareh",Neuro Oncol,https://www.ncbi.nlm.nih.gov/pmc/articles/PMC7650325/,519
44231,Hydroxychloroquine: Cardiac toxicity following off-label use: case report,2021-01-02,"BACKGROUND: Tocilizumab (TCZ) is a monoclonal antibody against the interleuikin-6 receptor which is potentially beneficial in COVID-19 induced cytokine release syndrome (CRS). However, there are limited studies showing anti-inflammatory effect and clinical benefit of TCZ in COVID-19 patients. This retrospective study examines treatment responses of criteria based TCZ therapy for SARS-CoV-2 respiratory infection for ICU vs. non-ICU patients. METHODS: We established institutional criteria to identify patients at risk of CRS from COVID-19. Patients were included if they received at least 1 dose of TCZ and were admitted for at least 72 hours. Primary endpoint was to assess clinical improvement (CI) at the end of admission. CI was defined by extubation, downgrade from ICU, discharged or improvement in Clinical Ordinal Scale by 2. Secondary endpoint of the study was to assess inpatient mortality (IM) and risk factors associated with IM. Subgroup analysis included impact of early (< 96 hours) vs late (≥ 96 hours) TCZ therapy on IM. RESULTS: Between March 25 to May 6, 2020, 170 patients met criteria and received TCZ. There were 83 non-ICU patients and 87 in the ICU. Forty five patients needed invasive mechanical ventilation (IMV). ICU patients tended to be obese, receive 2 doses of TCZ and have longer length of stay. Overall CI was seen in 71% of patients. CI was higher in non-ICU vs ICU patients (85.5% vs 57.5%, P=0.002). Overall IM was 18.8%; however, IM was lower in non-ICU vs ICU patients (8.4% vs 28.7%, P=0.0014). IM was higher in patients on IMV vs. non-IMV (30% vs 15.4%, P=0.03). Risk factors of ICU admission, BMI ≥ 30 kg/m2 and AKI were associated with higher risk of IM. Many IM patients were made comfort care. No differences were observed in early vs late TCZ therapy on inpatient mortality, but there was a trend toward lower mortality with early TCZ. COS Review of Tocilizumab Patients [Image: see text] CONCLUSION: TCZ is an effective treatment option in patients with SARS-CoV-2 patients at risk of CRS. Patients receiving TCZ in non-ICU setting had a better response to treatment compared to ICU patients. Obesity and AKI were associated with higher risk of mortality, but there was no statistical difference in early vs late therapy. Further studies with control group and larger sample size are warranted. DISCLOSURES: All Authors: No reported disclosures","Vyas, Nikunj M; Hou, Cindy; Levin, Todd P; Fussa, Mark; DeRose, Joseph; Condoluci, Mark; Williams, James; Ghayad, Zeina; Barnish, Michael; Ali, Shereef N; Kerr, Kathryn H; Scheiblein, Scott W; Fryckberg, Anthony J; Chauhan, Gauri",Open Forum Infect Dis,https://www.ncbi.nlm.nih.gov/pmc/articles/PMC7777636/,519
44236,Hydroxychloroquine: Haemolysis following off-label use: case report,2021-01-02,"BACKGROUND: An increased appreciation for vaccines could be expected due to COVID-19. However, surveys show a polarization in opinions with about 20% of Americans preemptively rejecting any COVID-19 vaccine, partly due to inconsistent risk communication. While Health Care Professionals (HCPs) will be heavily relied upon to encourage uptake of a COVID-19 vaccine and 70% of Americans receive their vaccine information from HCPs, 84% also rely on peer networks. Understanding that HCPs have an important, but not exclusive, influence on health decision making can signal a new approach. This study provides data on where women, the main decision-makers regarding immunization in most families access information about vaccination. METHODS: Through an online survey conducted in UK, Brazil, Germany, Italy and Canada from 10 to 19-March 2020, we collected data on where, and from whom, women aged 25–54 years access information about vaccination. We set 1000 respondents/country quotas to reflect regional differences with data weighted as necessary. RESULTS: 5,036 women who met inclusion criteria responded: from the UK (1,003), Brazil (1,002), Germany (1,008), Italy (1,007), and Canada (1,016). Though most likely to receive vaccination info via their HCP: in Germany, women are least likely to be influenced by HCPs, with those aged 25–34 years more likely to turn to family members or online sources; in the UK, they are more likely to find info via a health authority’s website; and in Brazil, they are more likely to see info in traditional media and on Facebook. Only 50% ranked vaccine efficacy and disease risk in the Top 5 factors influencing their vaccine decisions, alongside the opinion of an HCP, recommendation of a Public Health Authority and impact of the disease. CONCLUSION: HCPs, families and peers are important sources of info regarding vaccination. COVID-19 is unlikely to improve vaccine confidence as the issue becomes increasingly polarized and communications more inconsistent. We can respond by investing in health promotion and harmonized communications through peer networks. Since caregivers, their families and peers have increased weight in vaccination decisions, then they should have increased weight in preventive health strategies. DISCLOSURES: Ivo Vojtek, PharmD, PhD, MSc, FRSM, RPh, GSK Vaccines (Employee, Shareholder) Vanessa Palsenbarg, MA, GSK Vaccines (Employee, Shareholder) Joe Smyser, PhD, Public Good Project (Board Member, Employee)","Vojtek, Ivo; Palsenbarg, Vanessa; Smyser, Joe",Open Forum Infect Dis,https://www.ncbi.nlm.nih.gov/pmc/articles/PMC7777688/,519
44240,Azithromycin/hydroxychloroquine/lopinavir/ritonavir: Brugada-like ECG pattern following off-label use: case report,2021-01-02,"BACKGROUND: VA conducts annual surveillance for seasonal influenza. VA’s large elderly population is at higher risk for influenza complications, including hospitalization and death. Herein we summarize VA’s 2019-20 national surveillance data for influenza activity and vaccinations. METHODS: Influenza telephone triage, influenza-like-illness (ILI) encounters and antiviral prescriptions plus outpatient visits, laboratory testing (antibody tests excluded), hospitalizations and deaths for influenza were obtained from VA data sources (9/29/19-5/16/20) and compared to prior seasons and national CDC FluView data. Influenza vaccinations were captured starting 8/1/2019. Vaccination rates were calculated based on VA users during the fiscal year. RESULTS: Surveillance metrics are presented (Table). ILI visits ranged from 0.9%-3.1% during the season. Influenza activity peaked during 2020 Weeks 6-7 and dropped rapidly beginning in Week 12, matching trends reported by CDC for influenza activity (Figure 1). Testing revealed 23,357 influenza positives out of 162,102 tests performed (14.4%). 17% of laboratory-confirmed influenza cases were hospitalized (compared to 23% during the prior season) with a median length of 3 days. Total influenza positives, telephone triage encounters, outpatient visits and antiviral use were higher than the prior season, whereas coded hospitalizations and deaths were fewer (Table, Figure 2). Table. VA Influenza Surveillance Measures, 2014-2015 through 2019-2020 Seasons. [Image: see text] Figure 1. Comparison of select VA and CDC Influenza Indicators. Influenza positive laboratory tests and % positive (top) and influenza hospitalizations (bottom), by Season. [Image: see text] Figure 2. Comparison of Key VA Influenza Indicators, by Season. [Image: see text] CONCLUSION: The 2019-20 influenza season was of moderate severity when compared to prior seasons and continues to track well with national CDC data. Overall, vaccination levels have increased modestly and high-dose/adjuvanted vaccine administration increased from 6 to 26% of total vaccine given over the seasons evaluated. Influenza activity dropped precipitously after Week 12 even though testing for influenza remained high in the setting of COVID-19. This may have been influenced by widespread social distancing and masking measures adopted in response to COVID-19. DISCLOSURES: All Authors: No reported disclosures","Lucero-Obusan, Cynthia; Schirmer, Patricia; Oda, Gina; Holodniy, Mark",Open Forum Infect Dis,https://www.ncbi.nlm.nih.gov/pmc/articles/PMC7777730/,519
44256,Clarithromycin/hydroxychloroquine/methylprednisolone: Off-label use and multivessel spontaneous coronary artery dissection: case report,2021-01-02,"BACKGROUND: While several studies have explored hospitalization risk factors with the novel coronavirus (COVID-19) infection, the risk of poor outcomes during hospitalization has primarily relied upon laboratory or hospital-acquired data. Our goal was to identify clinical characteristics associated with intubation or death within 7 days of admission. METHODS: The first 436 patients admitted to the University of Colorado Hospital (Denver metropolitan area) with confirmed CoVID-19 were included. Demographics, comorbidities, and select medications were collected by chart abstraction. Missing height for calculating body mass index (BMI) was imputed using the median height for patients’ sex and race/ethnicity. Adjusted odds ratios (aOR) were estimated using multivariable logistic regression and a minimax concave penalty (MCP) regularized logistic regression explored prediction. RESULTS: Participants had a mean(SD) age 55(17), BMI 30.9(8.2), 55% were male and 80% were ethnic/racial minorities. Unadjusted comparisons by outcome are shown (Table 1). Male sex (aOR: 1.60, 95% CI (1.02, 2.54)), increasing age (aOR: 1.25(1.08, 1.47); per 10 years), higher BMI (aOR 1.03(1.00, 1.06) and poorly controlled diabetes (hemoglobin A1C ≥8) (aOR 2.33(1.27, 4.27) were significantly (p< 0.05) associated with greater odds of intubation or death. Minority status tended to be associated with higher odds (aOR:1.8(1.01,3.36); p=0.052). Surprisingly, need for hospital interpreter was associated with decreased odds (OR: 0.58(0.35, 0.95)) of intubation/death. Our final MCP model included indicators of A1C≥8, age >65, sex and minority status, but predicted intubation/death only slightly better than random chance (AUC= 0.61(0.56, 0.67)). Table 1. Patient Characteristics Stratified by Intubation and/or Death Within One Week of Admission (n=436) [Image: see text] CONCLUSION: In a hospitalized patient cohort with COVID-19, male sex, poorly controlled diabetes, increasing age and BMI were significantly associated with early intubation or death. These results complement larger cohort studies, and highlight risk differences across metropolitan areas with varying COVID-19 prevalence, demographics, and comorbid disease burden. Notably, our predictive model had limited success, which may suggest unmeasured factors also contribute to disease severity differences. DISCLOSURES: All Authors: No reported disclosures","Windham, Samuel L; Wilson, Melissa P; Fling, Connor; Sheneman, David W; Wand, Taylor; Babcock, Lyndsey; Delson, Samantha; Erlandson, Kristine M",Open Forum Infect Dis,https://www.ncbi.nlm.nih.gov/pmc/articles/PMC7777818/,519
44265,Tocilizumab: Progression of multiple myeloma following off-label use: case report,2021-01-02,"BACKGROUND: Severe acute respiratory syndrome coronavirus 2 (SARS-CoV-2) is a novel coronavirus that causes coronavirus disease of 2019 (COVID-19) and has been reported in > 98,000 children in the U.S (5% of reported cases) as of early June 2020. Most published literature focuses on adults with COVID-19, but little is understood on the impact of SARS-CoV-2 in children. We created a database for children with COVID-19 at Children’s Hospital Colorado (CHCO), a large tertiary care pediatric hospital, to better understand the epidemiology and clinical outcomes of this disease in children. METHODS: We retrospectively reviewed the medical records of all pediatric and youth patients with positive SARS-CoV-2 PCR test results from March-May 2020. Univariate logistic regression models were used to identify predictors of hospital admission, need for critical care, and need for respiratory support among symptomatic patients, with p-values < 0.05 considered statistically significant. RESULTS: We identified 246 patients with SARS-CoV-2 (age range: 17 days-25 years). We noted a Hispanic predominance with 68% of all patients with SARS-CoV-2 identifying as Hispanic or Latino, compared to 29% among all CHCO visits in 2019 (Figure 1). The most common symptoms at presentation were fever, cough, or shortness of breath in 94% of symptomatic patients. Sixty-eight patients (28%) were admitted, of which 7 (10%) required admission to the pediatric intensive care unit (PICU) for symptomatic COVID-19 disease (Figure 2). Age 0–3 months, certain symptoms at presentation, and several types of underlying medical conditions were predictors for both hospital admission and need for respiratory support (Figure 3). Initial and peak C-reactive protein (CRP) values were predictors for PICU admission with median peaks of 24.8mg/dL vs. 2.0mg/dL among PICU vs. non-PICU patients (OR 1.27, p=0.004). [Image: see text] [Image: see text] Figure 3: Predictors for Admission and Respiratory Support Requirement in CHCO Patients with SARS-CoV-2 [Image: see text] CONCLUSION: There is a wide spectrum of illness in children with SARS-CoV-2, ranging from asymptomatic to critical illness. Hispanic ethnicity was disproportionately represented in our cohort, which requires further evaluation. We found that young age, comorbid conditions, and CRP appear to be risk factors for severe disease in children. DISCLOSURES: Kelly E. Graff, MD, BioFire Diagnostics, LLC (Grant/Research Support)","Graff, Kelly E; Silveira, Lori; Jarjour, Jane; Curran-Hays, Shane; Carpenter, Lauren; Pickard, Kasey; Mattiucci, Michael; Smith-Anderson, Christiana; Abuogi, Lisa",Open Forum Infect Dis,https://www.ncbi.nlm.nih.gov/pmc/articles/PMC7777880/,519
