,index,Unnamed: 0,title_x,x,y,publish_time_x,abstract,authors,journal,category,cluster
219398,219398,219398,New development and update on China Bioanalysis Forum,11.072743,3.8809566,2021,"Background: DKA associated with SGLT2 inhibitors also known as Euglycemic DKA (EDKA) is a rare condition characterized by milder degrees of hyperglycemia with a blood glucose level &amp;lt;200 mg/dl. Unfortunately, this unusual feature can often lead to missed or delayed diagnosis with potential life-threatening outcomes. Clinical Case: The patient is a 53-year-old Caucasian male with PMH of type 2 diabetes mellitus treating with Metformin and Empagliflozin. He presented to the emergency room with shortness of breath, flu-like symptoms, and decreased oral intake for a couple of days. Vital signs at presentation were: Temperature 98.2 °F, pulse rate 108 beats/min, respiratory rate 28 breaths/min, and blood pressure 134/72 mmHg. He was alert but ill-looking, moderately dehydrated with dry mucus membranes. The rest of the physical examination was unremarkable at the time of admission. In the initial blood work, sugar was found to be mildly elevated (163mg/dl), and hemoconcentration besides mild pre-renal acute kidney injury was detected. He was also found infected by the COVID-19 virus without hypoxemia or signs of pneumonia. Arterial blood gases showed metabolic acidosis with an elevated anion gap (PH 7.21, CO2 39.93mmHg, HCO3− 10mEq/L, anion gap 21mEq/L). Urine analysis was positive for ketones and glucose. After ruling out other causes of metabolic acidosis by screening for alcohols, salicylates, acetaminophen, lactic acid, and urine toxicology;the diagnosis of EDKA was made. He was treated with a 3L bolus of IV normal saline and an insulin drip with dextrose solution started as per the protocol based on his glucose levels and promptly admitted to the intensive care unit (ICU). Serial blood tests showed gradual resolution of ketoacidosis and anion gap normalized after 36 hours when insulin drip was stopped and replaced by subcutaneous insulin therapy. Conclusion: SGLT2 inhibitors increase the urinary excretion rate of glucose and subsequent fall in plasma glucose level. Thus, In the absence of exogenous insulin use, increase glucagon release resulting in upregulation of lipolysis and activation of the ketogenesis. Factors such as low oral intake, concurrent infection, and alcohol use can also exacerbate the process. Timely diagnosis of EDKA can be a challenge for physicians unfamiliar with this class of medications, additionally, ketone studies and blood gas analyses are not part of the routine workup for diabetic patients in the emergency department. We recommend all first-line care providers to consider ketosis in ill patients with diabetes and metabolic acidosis, despite the normal or near-normal serum glucose levels. EDKA is mainly a diagnosis of exclusion, but treatment is not different from DKA;correcting dehydration by using intravenous fluids and then, initiating insulin drip along with dextrose-containing solutions, and frequent monitoring of serum anion gap.","TakallooBakhtiari, Asieh Butina Julio Piedra Funderburk Sheri A. Gillis Brundavanam Hari V.",Journal of the Endocrine Society,492,24
220497,220497,220497,Daily briefing: Hope and caution greet coronavirus vaccine trial results,11.338449,4.048206,2020,,"Pascual-Prieto, J; Narváez-Palazón, C; Porta-Etessam, J; Gómez-de-Liaño, R",Arch. Soc. Esp. Oftalmol,492,1
220498,220498,220498,Daily briefing: Hope and caution greet coronavirus vaccine trial results,11.243294,3.9931562,2020,,"Pascual-Prieto, J; Narváez-Palazón, C; Porta-Etessam, J; Gómez-de-Liaño, R",Arch Soc Esp Oftalmol,492,33
220634,220634,220634,My triplets had coronavirus anxiety - so I taught them how to do science,11.5747595,3.6550007,2020,,"Cunningham, Chinazo O; Diaz, Chanelle; Slawek, Deepika E",Ann Intern Med,492,33
221741,221741,221741,Von Viren und Tieren,11.378652,3.7783449,2020,"At the international level, the enormous demand to manage the COVID-19 pandemic has posed a challenge both in the provision of personnel and in supplies and sanitary material. There is no precedent or publication related to the management and leadership of nursing services in Spain within the emergency plan for the COVID-19 pandemic. This article describes the experience of the Hospital Clinico de Barcelona in the current extraordinary circumstances that undoubtedly constitute a nursing management of enormous magnitude and unprecedented due to the high number of people affected and the extraordinary risk of healthcare personnel. Following national and international guidelines to alleviate the pandemic, protect health and prevent the spread of the outbreak. The ability to work as a team, emotional management and respect for organizational decisions have made it possible to face the challenges that the pandemic has put in place and that the Nursing Department can lead in a calm and orderly manner the different actions to perform. Lastly, it will be necessary to continue with an in-depth analysis of the situation and of the actions carried out in order to identify the areas for improvement as well as to evaluate the overall nature of the process.","Estalella, Gemma Martinez; Zabalegui, Adelaida; Guerra, Sonia Sevilla",Enferm. clin. (Ed. impr.),492,1
225041,225041,225041,The statistical physics of discovering exogenous and endogenous factors in a chain of events,11.373543,3.7331502,2020-03-02,"An ongoing global pandemic of viral pneumonia (coronavirus disease [COVID-19]), due to the virus SARS-CoV-2, has infected millions of people and remains a threat to many more. Most critically ill patients have respiratory failure and there is an international effort to understand mechanisms and predictors of disease severity. Coagulopathy, characterized by elevations in D-dimer and fibrin(ogen) degradation products (FDPs), is associated with critical illness and mortality in patients with COVID-19. Furthermore, increasing reports of microvascular and macrovascular thrombi suggest that hemostatic imbalances may contribute to the pathophysiology of SARS-CoV-2 infection. We review the laboratory and clinical findings of patients with COVID-19-associated coagulopathy, and prior studies of hemostasis in other viral infections and acute respiratory distress syndrome. We hypothesize that an imbalance between coagulation and inflammation may result in a hypercoagulable state. Although thrombosis initiated by the innate immune system is hypothesized to limit SARS-CoV-2 dissemination, aberrant activation of this system can cause endothelial injury resulting in loss of thromboprotective mechanisms, excess thrombin generation, and dysregulation of fibrinolysis and thrombosis. The role various components including neutrophils, neutrophil extracellular traps, activated platelets, microparticles, clotting factors, inflammatory cytokines, and complement play in this process remains an area of active investigation and ongoing clinical trials target these different pathways in COVID-19.","Colling, Meaghan E; Kanthi, Yogendra",Vasc Med,492,2
226485,226485,226485,What about rheumatic diseases and Covid-19?,11.430369,3.941808,2021,,"Kumar, Manish Bhukya Muralidhar Nayak Anshuman Sachin","Modeling, Simulation and Optimization",492,26
227060,227060,227060,Vet practices to remain open during lockdown,11.386928,4.028751,2020,"For a decade, Feeding America's Map the Meal Gap (MMG) has provided sub-state-level estimates of food insecurity for both the full-population and for children. Along with being extensively used by food banks, it is widely used by state- and local-governments to help plan responses to food insecurity in their communities. In this paper, we describe the methods underpinning MMG, detail the approach Feeding America has used to make projections about the geography of food insecurity in 2020, and how food insecurity rates may have changed due to COVID-19 since 2018. We project an increase of 17 million Americans who are food insecure in 2020 but this aggregate increase masks substantial geographic variation found in MMG.","Gundersen, Craig; Hake, Monica; Dewey, Adam; Engelhard, Emily",,492,21
227181,227181,227181,A leading coronavirus vaccine trial is on hold: scientists react,11.466287,3.9092379,2020,"This paper demonstrates that transportation networks may be used to assess and predict the regional risk of COVID-19 infection from the outbreak. We use China's high-speed rail (HSR) network at the scale of prefecture level to assess, based on a probabilistic risk model, the risk of COVID-19 infection from Wuhan to the country's 31 province-level regions at the early stage of domestic spread. We find that the high-risk regions are mainly distributed along the southern half of Beijing-Hong Kong HSR line, where a large number of infection cases have been confirmed at the early stage. Furthermore, the two components of the infection risk, namely, the probability (proxied by the region's correlation with Wuhan through HSR) and the impact (proxied by the region's population with mobility), can play different roles in the risk ranking for different regions. For public health administrators, these findings may be used for better decision making, including the preparation of emergency plans and supplies, and the allocation of limited resources, before the extensive spread of the epidemic. Moreover, the administrators should adopt different intervention measures for different regions, so as to better mitigate the epidemic spread according to their own risk scenarios with respect to the probability of occurring and, once occurred, the impact.","Li, Tao; Rong, Lili; Zhang, Anming",,492,24
228339,228339,228339,Concerns raised about vital UK infections survey,11.504476,3.8370912,2020,"The global pandemic of coronavirus disease 2019 (COVID-19) highlights the shortcomings of the current testing paradigm for viral disease diagnostics. Here, we report a stepwise protocol for an RNA-extraction-free nano-amplified colorimetric test for rapid and naked-eye molecular diagnosis of COVID-19. The test employs a unique dual-prong approach that integrates nucleic acid (NA) amplification and plasmonic sensing for point-of-care detection of severe acute respiratory syndrome coronavirus 2 (SARS-CoV-2), with a sample-to-assay response time of <1 h. The RNA-extraction-free nano-amplified colorimetric test utilizes plasmonic gold nanoparticles capped with antisense oligonucleotides (ASOs) as a colorimetric reporter to detect the amplified nucleic acid from the COVID-19 causative virus, SARS-CoV-2. The ASOs are specific for the SARS-CoV-2 N-gene, and binding of the ASOs to their target sequence results in the aggregation of the plasmonic gold nanoparticles. This highly specific agglomeration step leads to a change in the plasmonic response of the nanoparticles. Furthermore, when tested using clinical samples, the accuracy, sensitivity and specificity of the test were found to be >98.4%, >96.6% and 100%, respectively, with a detection limit of 10 copies/µL. The test can easily be adapted to diagnose other viral infections with a simple modification of the ASOs and primer sequences. It also provides a low-cost, rapid approach requiring minimal instrumentation that can be used as a screening tool for the diagnosis of COVID-19 at point-of-care settings in resource-poor situations. The colorimetric readout of the test can even be monitored using a handheld optical reader to obtain a quantitative response. Therefore, we anticipate that this protocol will be widely useful for the development of biosensors for the molecular diagnostics of COVID-19 and other infectious diseases.","Alafeef, Maha; Moitra, Parikshit; Dighe, Ketan; Pan, Dipanjan",Nat. Protoc,492,22
228557,228557,228557,Daily briefing: Evidence that cats (but not dogs) can be infected with the coronavirus,11.509521,3.9398215,2020,"The outbreak of coronavirus disease 2019 (COVID-19) on the cruise ship Diamond Princess docked at Yokohama, Japan was highlighted due to its number of cases in the early stage of the global epidemic when the picture of the virus itself, as well as epidemiological characteristics, were being established We conducted an observational epidemiological study of the outbreak, focusing on a total of 403 individuals who developed a fever of ≥ 37 5°C from 20 January to 22 February 2020 Quarantine measures are also discussed with a descriptive method Of a total of 3,711 individuals (2,031 males) from 57 countries, 2,666 (71 8%) and 1,045 (28 2%) were passengers and crew with mean age of 66 0 (range: 2-98) and 36 6 (range: 19-64), respectively Among 403 febrile individuals, 165 passengers and 58 crew members were diagnosed as laboratory-confirmed COVID-19 cases Until 6 February, the number of confirmed cases was three or less per day However, distribution of thermometers on 7 February revealed 43 confirmed cases, and it then started decreasing The outbreak was initiated from decks for passengers and expanded to areas for crew As of 17 March, when more than14 days had passed after disembarkation of all passengers and crew, there was no report of forming a cluster of infections in Japan from them At the time of the initiation of quarantine, the outbreak had already expanded to most of the decks from those for passengers, and the results might suggest the contribution of the set of quarantine measures in unprecedented challenges of the control operation","Tsuboi, Motoyuki; Hachiya, Masahiko; Noda, Shinichiro; Iso, Hiroyasu; Umeda, Tamami",Global Health &amp; Medicine,492,33
231685,231685,231685,Daily briefing: A radical proposal to infect healthy people with the coronavirus to test vaccines,11.530798,3.649678,2020,"Whether we realize it or not, the faster and rapid development of technology has an impact on the faster and faster progress in the world of education. During the current covid-19 pandemic, much needed online learning tools, the concept of home-schooling has never been mainstream in the national education discourse. Because the teaching system has been changed through online learning, there is a need for the development of learning tools for teachers to be able to continue delivering material to their students. This study aims to develop online learning tools based on demonstration models on effective heat transfer material during the covid-19 pandemic. The development of this research uses the ADDIE model with stages of development: 1. Analysis, 2. Design, 3. Develop, 4. Implement, 5. Evaluate. Learning tools are made online to make it easier for teachers and students to carry out teaching and learning activities during online learning. Validation was carried out by 3 experts, namely media experts, material experts, learning experts and tested on students. The results of the analysis of the validation of material experts obtained an average percentage of 86.80 % in the very high category, the results of the analysis of learning experts obtained an average percentage of 88,70 % with a very high category, the results of the analysis of the media expert obtained a percentage of 86,70 % with a very high. The subject was tried in class XI high school. Data collection instruments using a questionnaire through the Google form. From the results of the development of online learning tools based on online demonstrations on heat transfer material obtained learning tools (Free Learning Implementation Plan, Worksheet and online media) have been tested for eligibility by experts and field trials with good criteria and are suitable for use.","Serevina, V.; Priane, W. T.",Journal of Physics: Conference Series,492,33
232034,232034,232034,Daily briefing: How desperate measures might shorten the coronavirus vaccine timeline - and at what risk,11.330175,3.5398247,2020,,"Baker, Edward L; Murphy, Susan A",J Public Health Manag Pract,492,33
233969,233969,233969,"Evaluation of oxidative stress level: total antioxidant capacity, total oxidant status and glutathione activity in patients with Covid-19",11.1763935,3.8934884,2021,"Introduction: The coronavirus disease COVID-19 is considered a pandemic disease that has developed rapidly all over the world. As of today, it is unclear whether immunosuppression confers an increased risk for pulmonary complications, or conversely, whether it can be a protective factor with respect to a cytokine storm. Case description: We report the case of a 55-year-old male patient with granulomatosis with polyangiitis treated with rituximab who was infected with COVID-19 pneumonia. To the best of our knowledge, only 1 case has been reported in the literature with similar characteristics. The patient had a non-classic evolution of clinical symptoms with persistent fever and viral shedding, in addition to a negative serology. Conclusion: This case emphasizes the management and immunity response to COVID-19 pneumonia in such patients. Data are still needed regarding patients who have prolonged B-cell depletion, which may put the patient at a higher risk for reinfection. LEARNING POINTS: Demonstration of the immunity response to COVID-19 pneumonia in an immunosuppressed patient.To highlight the management and evolution of such rare cases during this pandemic.","Daniel, Pascale; Raad, Marc; Waked, Rami; Choucair, Jacques; Riachy, Moussa; Haddad, Fady",Eur J Case Rep Intern Med,492,26
234886,234886,234886,"Return to the lab: scientists face shiftwork, masks and distancing as coronavirus lockdowns ease",11.268156,3.7739704,2020,,"DeWit, A.",Asia-Pacific Journal-Japan Focus,492,33
235908,235908,235908,Hopes rise for coronavirus drug remdesivir,11.440475,3.6572642,2020,"BACKGROUND: There are significant concerns about mental health problems occurring due to the coronavirus disease 2019 (COVID-19) pandemic. To date, there has been limited empirical investigation about thoughts of suicide and self-harm during the COVID-19 pandemic. METHODS: A national survey was conducted May 2020 to investigate the association between mental health symptoms, social isolation, and financial stressors during the COVID-19 pandemic and thoughts of suicide and self-harm. A total of 6607 US adults completed an online survey; survey criteria included an age minimum of 22 years old and reported annual gross income of $75,000 or below. Statistical raking procedures were conducted to more precisely weight the sample using US Census data on age, geographic region, sex, race, and ethnicity. RESULTS: COVID-19-related stress symptoms, loneliness, and financial strain were associated with thoughts of suicide/self-harm in multivariable logistic regression analyses, as were younger age, being a military veteran, past homelessness, lifetime severe mental illness, current depressive symptoms, alcohol misuse, and having tested positive for COVID-19. Greater social support was inversely related to thoughts of suicide/self-harm whereas running out of money for basic needs (e.g., food), housing instability (e.g., delaying rent), and filing for unemployment or disability were positively related. CONCLUSIONS: Public health interventions to decrease risk of suicide and self-harm in the wake of the COVID-19 pandemic should address pandemic-related stress, social isolation, and financial strain experienced including food insecurity, job loss, and risk of eviction/homelessness.","Elbogen, Eric B; Lanier, Megan; Blakey, Shannon M; Wagner, H Ryan; Tsai, Jack",Depress. anxiety,492,33
236839,236839,236839,"‘Influence of conflicts of interest on public positions in the COVID-19 era, the case of Gilead Sciences’ by Roussel and Raoult (2020)",11.216042,3.7928734,2020,"The viral infection caused by SARS-CoV-2 has increased the mortality rate and engaged several adverse effects on the affected individuals. Currently available antiviral drugs have found to be unsuccessful in the treatment of COVID-19 patients. The demand for efficient antiviral drugs has created a huge burden on physicians and health workers. Plasma therapy seems to be less accomplishable due to insufficient donors to donate plasma and low recovery rate from viral infection. Repurposing of antivirals has been evolved as a suitable strategy in the current treatment and preventive measures. The concept of drug repurposing represents new experimental approaches for effective therapeutic benefits. Besides, SARS-CoV-2 exhibits several complications such as lung damage, blood clot formation, respiratory illness and organ failures in most of the patients. Based on the accumulation of data, sulfated marine polysaccharides have exerted successful inhibition of virus entry, attachment and replication with known or unknown possible mechanisms against deadly animal and human viruses so far. Since the virus entry into the host cells is the key process, the prevention of such entry mechanism makes any antiviral strategy effective. Enveloped viruses are more sensitive to polyanions than non-enveloped viruses. Besides, the viral infection caused by RNA virus types embarks severe oxidative stress in the human body that leads to malfunction of tissues and organs. In this context, polysaccharides play a very significant role in providing shielding effect against the virus due to their polyanionic rich features and a molecular weight that hinders their reactive surface glycoproteins. Significantly the functional groups especially sulfate, sulfate pattern and addition, uronic acids, monosaccharides, glycosidic linkage and high molecular weight have greater influence in the antiviral activity. Moreover, they are very good antioxidants that can reduce the free radical generation and provokes intracellular antioxidant enzymes. Additionally, polysaccharides enable a host-virus immune response, activate phagocytosis and stimulate interferon systems. Therefore, polysaccharides can be used as candidate drugs, adjuvants in vaccines or combination with other antivirals, antioxidants and immune-activating nutritional supplements and antiviral materials in healthcare products to prevent SARS-CoV-2 infection.","Andrew, Monic; Jayaraman, Gurunathan",Carbohydr Res,492,16
236848,236848,236848,Rare case of COVID-19 presenting as acute abdomen and sepsis,11.355157,4.1394176,2020,"This technical report describes a dynamic causal model of the spread of coronavirus through a population. The model is based upon ensemble or population dynamics that generate outcomes, like new cases and deaths over time. The purpose of this model is to quantify the uncertainty that attends predictions of relevant outcomes. By assuming suitable conditional dependencies, one can model the effects of interventions (e.g., social distancing) and differences among populations (e.g., herd immunity) to predict what might happen in different circumstances. Technically, this model leverages state-of-the-art variational (Bayesian) model inversion and comparison procedures, originally developed to characterise the responses of neuronal ensembles to perturbations. Here, this modelling is applied to epidemiological populations to illustrate the kind of inferences that are supported and how the model per se can be optimised given timeseries data. Although the purpose of this paper is to describe a modelling protocol, the results illustrate some interesting perspectives on the current pandemic; for example, the nonlinear effects of herd immunity that speak to a self-organised mitigation process.","Friston, Karl J.; Parr, Thomas; Zeidman, Peter; Razi, Adeel; Flandin, Guillaume; Daunizeau, Jean; Hulme, Oliver J.; Billig, Alexander J.; Litvak, Vladimir; Moran, Rosalyn J.; Price, Cathy J.; Lambert, Christian",,492,10
236849,236849,236849,Rare case of COVID-19 presenting as acute abdomen and sepsis,11.120912,3.9677134,2020,,"Park, Elyse R; Sylvia, Louisa G; Streck, Joanna M; Luberto, Christina M; Stanton, Amelia M; Perez, Giselle K; Baim, Margaret; Bliss, Cayley C; Convery, Mary Susan; Crute, Sydney; Denninger, John W; Donelan, Karen; Dossett, Michelle L; Fava, Maurizio; Fredriksson, Stacie; Fricchione, Gregory; George, Nevita; Hall, Daniel L; Hart, Betsy Remington; Herman, John; Hirschberg, April; Holt, Daphne; Looby, Sara E; Malloy, Laura; Meek, Jocelyn; Mehta, Darshan H; Millstein, Rachel A; Mizrach, Helen; Rosa, Katherine; Slawsby, Ellen; Stupinski, A Clare; Traeger, Lara; Vanderkruik, Rachel; Vogeli, Christine; Wilhelm, Sabine",Gen. hosp. psychiatr,492,16
