,index,Unnamed: 0,title_x,x,y,publish_time_x,abstract,authors,journal,category,cluster
297593,297593,297593,Self-Collected Oral Fluid and Nasal Swab Specimens Demonstrate Comparable Sensitivity to Clinician-Collected Nasopharyngeal Swab Specimens for the Detection of SARS-CoV-2,11.283992,12.058598,2020,"This study aimed to determine the relationship between acute stress and quality of life and explore their influencing factors on health care workers A descriptive cross-sectional study was conducted, and a sample of 525 health care workers was recruited from 15 hospitals through a convenient sampling method Participants completed an online self-report questionnaire to assess their acute stress and quality of life Descriptive and multiple linear regression statistics were used for this analysis The results regarding acute stress responses varied significantly among the differences in marital status, physical activity, work status, perceived risk of contracting COVID-19, and the expected duration of the pandemic Moreover, a younger age, lack of physical activity, being a front-line medical staff, and higher acute stress scores indicated a worse quality of life Healthcare workers' acute stress was negatively correlated with their quality of life Therefore, the authorities should pay special attention to health care workers' mental health and provide them with timely protection during the pandemic","Zhang, L.; Ji, R.; Ji, Y.; Liu, M.; Wang, R.; Xu, C.",Frontiers in Psychology,500,1
308770,308770,308770,Genomic Evidence of In-Flight Transmission of SARS-CoV-2 Despite Predeparture Testing,11.560832,12.223116,2021,"We add a simple dynamic process for adaptive “social distancing” measures to a standard SIR model of the COVID pandemic With a limited attention span and in the absence of a consistent long-term strategy against the pandemic, this process leads to a sweeping of an instability, i e fluctuations in the effective reproduction number around its bifurcation value of Reff=1 While mitigating the pandemic in the short-run, this process remains intrinsically fragile and does not constitute a sustainable strategy that societies could follow for an extended period of time","Lux, Thomas",Physica A: Statistical Mechanics and its Applications,500,13
311654,311654,311654,SARS-CoV-2 epidemic in African countries-are we losing perspective?,11.5744095,12.173959,2020,"Bordetella species cause respiratory infections in both humans and animals Bordetella bronchiseptica (B bronchiseptica) infection is an uncommon pathogen in humans The clinical spectrum of infections with SARS-CoV-2 includes viral pneumonia of variable severity, with some patients developing acute respiratory distress syndrome (ARDS), requiring mechanical ventilation support Transplant patients with coronavirus disease (COVID-19) infection have high mortality Bacterial coinfection, including pneumonia, have been described in patients with COVID-19 We present a renal transplant patient with COVID-19 pneumonia who developed B bronchiseptica superinfection and had a rapid clinical and radiological response to azithromycin treatment","Nagarakanti, S.; Bishburg, E.",Cureus,500,16
311878,311878,311878,Evaluation of four laboratory-based SARS-CoV-2 IgG antibody immunoassays,11.423118,11.9693,2021,"Owing to the rapid spread of the severe acute respiratory syndrome coronavirus 2 (SARS-CoV-2) pandemic worldwide, individuals experience considerable psychological distress daily. The present study aimed to clarify the prevalence of psychological distress and determine the population most affected by risk factors such as the pandemic, socioeconomic status (SES), and lifestyle-related factors causing psychological distress in the early phases of the pandemic in Japan. This study was conducted via a web-based survey using quota sampling to ensure representativeness of the Japanese population aged 20-64 years. A cross-sectional study of 11,342 participants (5,734 males and 5,608 females) was conducted using a self-administered questionnaire that included the Japanese version of the Kessler 6 Psychological Distress Scale (K6) and questions related to the pandemic, SES, and lifestyle. The prevalence of psychological distress, represented by a K6 score of 5 or more, was 50.3% among males and 52.6% among females. Both males and females with annual household incomes less than 2 million yen and males aged in their twenties had significantly higher K6 scores than those with annual household incomes above 2 million yen and males aged over 30 years. Binary logistic regression analyses found pandemic-related factors such as medical history, inability to undergo clinical tests immediately, having trouble in daily life, unavailability of groceries, new work style, and vague anxiety; SES-related factors such as lesser income; and lifestyle-related factors such as insufficient rest, sleep, and nutritious meals to be significantly related to psychological distress. Psychological distress was more prevalent among people with low income and in younger generations than among other groups. There is an urgent need to provide financial, medical, and social support to those affected by the coronavirus disease 2019 (COVID-19) pandemic.","Nagasu, Miwako; Muto, Kaori; Yamamoto, Isamu",PLoS One,500,12
319080,319080,319080,Notice of Retraction: Effectiveness of Surgical and Cotton Masks in Blocking SARS-CoV-2,11.413936,12.299863,2020,,"Karadag, Ayse Serap Kayıran Melek Aslan Wollina Uwe",Clinics in Dermatology,500,29
319081,319081,319081,Notice of Retraction: Effectiveness of Surgical and Cotton Masks in Blocking SARS-CoV-2,11.392114,12.21029,2020,"Candida auris is a novel and major fungal pathogen that has triggered several outbreaks in the last decade. The few drugs available to treat fungal diseases, the fact that this yeast has a high rate of multidrug resistance and the occurrence of misleading identifications, and the ability of forming biofilms (naturally more resistant to drugs) has made treatments of C. auris infections highly difficult. This review intends to quickly illustrate the main issues in C. auris identification, available treatments and the associated mechanisms of resistance, and the novel and alternative treatment and drugs (natural and synthetic) that have been recently reported.","Cernáková, Lucia; Roudbary, Maryam; Brás, Susana; Tafaj, Silva; Rodrigues, Célia F",Int. j. mol. sci. (Online),500,29
319082,319082,319082,Notice of Retraction: Effectiveness of Surgical and Cotton Masks in Blocking SARS-CoV-2,11.17793,12.119233,2020,"Candida auris is a novel and major fungal pathogen that has triggered several outbreaks in the last decade. The few drugs available to treat fungal diseases, the fact that this yeast has a high rate of multidrug resistance and the occurrence of misleading identifications, and the ability of forming biofilms (naturally more resistant to drugs) has made treatments of C. auris infections highly difficult. This review intends to quickly illustrate the main issues in C. auris identification, available treatments and the associated mechanisms of resistance, and the novel and alternative treatment and drugs (natural and synthetic) that have been recently reported.","Cernáková, Lucia; Roudbary, Maryam; Brás, Susana; Tafaj, Silva; Rodrigues, Célia F",Int. j. mol. sci. (Online),500,20
319146,319146,319146,Rapid Screening Evaluation of SARS-CoV-2 IgG Assays Using Z-Scores to Standardize Results,11.413849,12.310567,2020,"Background COVID-19 pandemic has caused a global lockdown that has abruptly shut down core businesses and caused a worldwide recession The forecast for a smooth transition for the agri-food and drink industry is, at best, alarming Given that COVID-19 shutdown multiple core services (such as aviation, food services, supply chains, and export and import markets), there is an enormous deficiency in critical information to inform priority decision making for companies where this uncertainly is likely to impact negatively upon recovery Scope and approach The current article investigates potential innovations within the era of the COVID-19 crisis after framing them within the four issues of the food sector (food safety, bioactive food compounds, food security, and sustainability) that are directly affected by the pandemic The prospect of foreseen innovations to disrupt the food sector during lockdown periods and the post-COVID-19 era is also discussed Key findings and conclusions Internet and Communication Technologies, blockchain in the food supply chain and other Industry 4 0 applications, as well as approaches that redefine the way we consume food (e g , lab-grown meat, plant-based alternatives of meat, and valorization of a vast range of bioresources), are the innovations with the highest potential in the new era There is also an equally pressing need to exploit social marketing to understand attitudes, perceptions, and barriers that influence the behavior change of consumers and the agri-food industry Subsequently, this change will contribute to adapting to new norms forged by the COVID-19 pandemic, where there is a significant gap in knowledge for decision making","Galanakis, Charis M.; Rizou, Myrto Aldawoud Turki M. S.; Ucak, Ilknur Rowan Neil J.",Trends in Food Science &amp; Technology,500,30
321382,321382,321382,Implication of SARS-CoV-2 evolution in the sensitivity of RT-qPCR diagnostic assays,11.487613,12.045402,2020,,"Baudouin, C",J Fr Ophtalmol,500,1
322423,322423,322423,Performance Evaluation of Serial SARS-CoV-2 Rapid Antigen Testing During a Nursing Home Outbreak,11.141103,12.074458,2021,"We describe an introduction of clade GH severe acute respiratory syndrome coronavirus 2 causing a fourth wave of coronavirus disease in Hong Kong. The virus has an ORF3a-Q57H mutation, causing truncation of ORF3b. This virus evades induction of cytokine, chemokine, and interferon-stimulated gene expression in primary human respiratory cells.","Chu, Daniel K W; Hui, Kenrie P Y; Gu, Haogao; Ko, Ronald L W; Krishnan, Pavithra; Ng, Daisy Y M; Liu, Gigi Y Z; Wan, Carrie K C; Cheung, Man-Chun; Ng, Ka-Chun; Nicholls, John M; Tsang, Dominic N C; Peiris, Malik; Chan, Michael C W; Poon, Leo L M",Emerg Infect Dis,500,1
322424,322424,322424,Performance Evaluation of Serial SARS-CoV-2 Rapid Antigen Testing During a Nursing Home Outbreak,11.105552,12.096974,2021,"This short reflection argues that, in the face of natural crises that occur in the world, responsible Christian speech requires a much fuller and more thickly textured understanding of creation than is often presented Reading the Bible leads us to avoid speculating on the origins or purposes of such crises Rather, it bears witness to the divine promise of hope in the healing justice of God, and calls human persons and human communities to participate in that justice through responsible action © The Author(s) 2020","Brett, M.; Goroncy, J.",Theology,500,1
324113,324113,324113,Disparities in Age-specific Morbidity and Mortality From SARS-CoV-2 in China and the Republic of Korea,11.359711,12.015409,2020,"The ongoing SARS-CoV-2 (Covid-19) pandemic has ushered an unforeseen level of global health and economic burden. As a respiratory infection, Covid-19 is known to have a dominant airborne transmission modality, wherein fluid flow plays a central role. Quantification of complex non-intuitive dynamics and transport of pathogen laden respiratory particles in indoor flows has been of specific interest. Here we present a Lagrangian computational approach towards quantification of human-to-human exposure quantifiers, and identification of pathways by which flow organizes transmission. We develop a Lagrangian viral exposure index in a parametric form, accounting for key parameters such as building and layout, ventilation, occupancy, biological variables. We also employ a Lagrangian computation of the Finite Time Lyapunov Exponent field to identify hidden patterns of transport. A systematic parametric study comprising a set of 120 simulations, yielding a total of 1,320 different exposure index computations are presented. Results from these simulations enable: (a) understanding the otherwise hidden ways in which air flow organizes the long-range transport of such particles; and (b) translating the micro-particle transport data into a quantifier for understanding infection exposure risks.","Wilson, Joseph; Miller, Shelly L; Mukherjee, Debanjan",,500,4
324114,324114,324114,Disparities in Age-specific Morbidity and Mortality From SARS-CoV-2 in China and the Republic of Korea,11.247832,12.11181,2020,"Coronavirus disease 2019 (COVID-19) is a global pandemic. Although much has been learned about the novel coronavirus since its emergence, there are many open questions related to tracking its spread, describing symptomology, predicting the severity of infection, and forecasting healthcare utilization. Free-text clinical notes contain critical information for resolving these questions. Data-driven, automatic information extraction models are needed to use this text-encoded information in large-scale studies. This work presents a new clinical corpus, referred to as the COVID-19 Annotated Clinical Text (CACT) Corpus, which comprises 1,472 notes with detailed annotations characterizing COVID-19 diagnoses, testing, and clinical presentation. We introduce a span-based event extraction model that jointly extracts all annotated phenomena, achieving high performance in identifying COVID-19 and symptom events with associated assertion values (0.83-0.97 F1 for events and 0.73-0.79 F1 for assertions). Our span-based event extraction model outperforms an extractor built on MetaMapLite for the identification of symptoms with assertion values. In a secondary use application, we predicted COVID-19 test results using structured patient data (e.g. vital signs and laboratory results) and automatically extracted symptom information, to explore the clinical presentation of COVID-19. Automatically extracted symptoms improve COVID-19 prediction performance, beyond structured data alone.","Lybarger, Kevin; Ostendorf, Mari; Thompson, Matthew; Yetisgen, Meliha",J Biomed Inform,500,2
324115,324115,324115,Disparities in Age-specific Morbidity and Mortality From SARS-CoV-2 in China and the Republic of Korea,11.159828,12.042334,2020,"Coronavirus disease 2019 (COVID-19) is a global pandemic. Although much has been learned about the novel coronavirus since its emergence, there are many open questions related to tracking its spread, describing symptomology, predicting the severity of infection, and forecasting healthcare utilization. Free-text clinical notes contain critical information for resolving these questions. Data-driven, automatic information extraction models are needed to use this text-encoded information in large-scale studies. This work presents a new clinical corpus, referred to as the COVID-19 Annotated Clinical Text (CACT) Corpus, which comprises 1,472 notes with detailed annotations characterizing COVID-19 diagnoses, testing, and clinical presentation. We introduce a span-based event extraction model that jointly extracts all annotated phenomena, achieving high performance in identifying COVID-19 and symptom events with associated assertion values (0.83-0.97 F1 for events and 0.73-0.79 F1 for assertions). In a secondary use application, we explored the prediction of COVID-19 test results using structured patient data (e.g. vital signs and laboratory results) and automatically extracted symptom information. The automatically extracted symptoms improve prediction performance, beyond structured data alone.","Lybarger, Kevin; Ostendorf, Mari; Thompson, Matthew; Yetisgen, Meliha",,500,20
325319,325319,325319,Academician Cong Bin: Autopsy of SARS-CoV-2 infection is needed to be strengthened,11.068113,12.137019,2020,,"Wesemann, U; Hadjamu, N; Willmund, G; Dolff, S; Vonderlin, N; Wakili, R; Vogel, J; Rassaf, T; Siebermair, J",Psychol Med,500,32
330081,330081,330081,"Seroprevalence of MERS-CoV in healthy adults in western Saudi Arabia, 2011-2016",11.561491,12.355764,2020,"An emerging class of cellular inhibitory proteins has been identified that targets viral glycoproteins. These include the membrane-associated RING-CH (MARCH) family of E3 ubiquitin ligases that, among other functions, downregulate cell surface proteins involved in adaptive immunity. The RING-CH domain of MARCH proteins is thought to function by catalyzing the ubiquitination of the cytoplasmic tails (CTs) of target proteins, leading to their degradation. MARCH proteins have recently been reported to target retroviral envelope glycoproteins (Env) and vesicular stomatitis virus G glycoprotein (VSV-G). However, the mechanism of antiviral activity remains poorly defined. Here we show that MARCH8 antagonizes the full-length forms of HIV-1 Env, VSV-G, Ebola virus glycoprotein (EboV-GP), and the spike (S) protein of severe acute respiratory syndrome coronavirus 2 (SARS-CoV-2), thereby impairing the infectivity of virions pseudotyped with these viral glycoproteins. This MARCH8-mediated targeting of viral glycoproteins requires the E3 ubiquitin ligase activity of the RING-CH domain. We observe that MARCH8 protein antagonism of VSV-G is CT dependent. In contrast, MARCH8-mediated targeting of HIV-1 Env, EboV-GP, and SARS-CoV-2 S protein by MARCH8 does not require the CT, suggesting a novel mechanism of MARCH-mediated antagonism of these viral glycoproteins. Confocal microscopy data demonstrate that MARCH8 traps the viral glycoproteins in an intracellular compartment. We observe that the endogenous expression of MARCH8 in several relevant human cell types is rapidly inducible by type I interferon. These results help to inform the mechanism by which MARCH proteins exert their antiviral activity and provide insights into the role of cellular inhibitory factors in antagonizing the biogenesis, trafficking, and virion incorporation of viral glycoproteins.IMPORTANCE Viral envelope glycoproteins are an important structural component on the surfaces of enveloped viruses that direct virus binding and entry and also serve as targets for the host adaptive immune response. In this study, we investigate the mechanism of action of the MARCH family of cellular proteins that disrupt the trafficking and virion incorporation of viral glycoproteins across several virus families. This research provides novel insights into how host cell factors antagonize viral replication, perhaps opening new avenues for therapeutic intervention in the replication of a diverse group of highly pathogenic enveloped viruses.","Lun, Cheng Man; Waheed, Abdul A; Majadly, Ahlam; Powell, Nicole; Freed, Eric O",mBio (Online),500,26
332727,332727,332727,Investigating Carbon Emissions from Electricity Generation and GDP Nexus Using Maximum Entropy Bootstrap: Evidence from Oil-Producing Countries in the Middle East,11.213271,12.432147,2021,,,Australian Endodontic Journal,500,20
338535,338535,338535,Performance of SARS-CoV-2 antibody assays in different stages of the infection: Comparison of commercial ELISA and rapid tests,11.582421,12.005241,2020,"While terms such as ‘essential’ and ‘nonessential’ used amidst the COVID-19 pandemic may serve a practical purpose, they also pose a risk of obstructing our view of the harmful indirect health consequences of this crisis SARS-CoV-2 cases and deaths in children are minimal compared to adults, but the pandemic impacts other ‘essential’ aspects of children’s health including child development and the associated areas of paediatric behaviour, mental health, and maltreatment Alongside the management of severe SARS-CoV-2 cases in emergency rooms and intensive care units, continuing to care for children with developmental disabilities must also be concurrently championed as ‘essential’ during this crisis The potentially devastating lifelong effects of the pandemic and isolation on an already vulnerable population demand that action be taken now Video conferences and phone calls are ‘essential’ instruments we can use to continue to provide quality care for our patients","Fung, Alastair; Ricci, M. Florencia",Paediatrics &amp; Child Health,500,2
338536,338536,338536,Performance of SARS-CoV-2 antibody assays in different stages of the infection: Comparison of commercial ELISA and rapid tests,11.433126,11.937446,2020,"OBJECTIVE: To determine the association of epilepsy with incident dementia we conducted a nation-wide retrospective data-linkage, cohort study, to examine whether the association varies according to dementia subtypes and investigate whether risk factors modify the association. METHODS: We used linked health data from hospitalisation, mortality records and primary care consultations to follow-up 563,151 Welsh residents from their 60 th birthday to estimate dementia rate and associated risk factors. Dementia, epilepsy and covariates (medication, smoking, comorbidities) were classified using previously validated code lists. We studied rate of dementia and dementia subtypes in people with epilepsy (PWE) and without using (stratified) Kaplan-Meier plots and flexible parametric survival models. RESULTS: PWE had a 2.5 (95% CI 2.3 to 2.6) times higher hazard of incident dementia, a 1.6 (95% CI 1.4 to 1.8) times higher hazard of incident Alzheimers disease (AD), and a 3.1 (95% CI 2.8 to 3.4) times higher hazard of incident Vascular dementia (VaD). A history of stroke modified the increased incidence in PWE. PWE who were first diagnosed at age 25 years or younger had a similar dementia rate compared to those diagnosed later in life. PWE who had ever been prescribed sodium valproate compared those who had not, were at higher risk of dementia (HR: 1.6; 99% CI: 1.4 to 1.9) and VaD (HR: 1.7; 99% CI: 1.4 to 2.1), but not AD (HR: 1.2; 99% CI: 0.9 to 1.5). CONCLUSION: People with epilepsy, compared to those without epilepsy, have an increased dementia risk.","Schnier, Christian; Duncan, Susan; Wilkinson, Tim; Mbizvo, Gashirai K; Chin, Richard F M",Neurology,500,31
344462,344462,344462,Field performance and public health response using the BinaxNOW TM Rapid SARS-CoV-2 antigen detection assay during community-based testing,11.3713875,12.00173,2020,"Background: There are preliminary studies about the association between COVID-19 and ABO phenotypes and the results are controversial There are only two studies which investigated the association of Rh blood groups in addition to ABO with COVID-19;however, in the statistical analysis ABO and Rh blood groups have been considered separately Therefore, the present case-control study was performed to determine the association of COVID-19 with ABO blood groups considering the Rh blood groups simultaneously The study was conducted in Kunduz COVID-19 treatment specific center, Spin-Zar Hospital (Kunduz Province, North East Afghanistan) A total of 301 confirmed COVID-19 cases and 1039 healthy blood donors as control group were included in the study Results: The Rh− phenotype strongly increased the risk of COVID-19 (OR = 2 97, 95% CI 1 86–3 89, P &lt; 0 001) Although blood group A increased the risk of developing COVID-19, the association did not reach statistical significance In analysis of the combination phenotypes, the A− blood group remarkably increased the risk of COVID-19 (OR = 7 24, 95% CI 3 62–14 4, P &lt; 0 001) Multivariate analysis revealed that the interaction of Rh and ABO is significant (P &lt; 0 013) Conclusion: These findings indicate that susceptibility to COVID-19 is strongly associated with A− blood group [ABSTRACT FROM AUTHOR] Copyright of Egyptian Journal of Medical Human Genetics is the property of Egyptian Society of Human Genetics and its content may not be copied or emailed to multiple sites or posted to a listserv without the copyright holder's express written permission However, users may print, download, or email articles for individual use This abstract may be abridged No warranty is given about the accuracy of the copy Users should refer to the original published version of the material for the full abstract (Copyright applies to all Abstracts )","Saify, Khyber Alborz Mohammad Sarwar Saadat Mostafa",Egyptian Journal of Medical Human Genetics,500,20
345761,345761,345761,Comparative evaluation of four rapid SARS-CoV-2 antigen detection tests using universal transport medium,11.576934,12.144133,2020,"Abstract Abolition is both a vision and a practice As abolitionists, we envision a world without prisons We must also make that world together Abolition is thus more than an ideological commitment to the absence of prisons Abolition is presence, as Ruth Wilson Gilmore reminds us It is the presence of life-giving institutions It is our presence with one another, as we enact and explore in this article As co-authors, we have been journeying together at Florida State University for nearly a year Our work has shapeshifted through the COVID pandemic and in the wake of the Tallahassee Police Department murders of Mychael Johnson and Tony McDade We open this article on these grounds, honoring the people have fought before us and all who fight in their legacy We also stretch back into the violent histories that fill our present, and reflect in succession on the intimate work of building the world otherwise Our prison nation may govern through erasure and abandonment, but the prison is in fact everywhere That means that abolition must be everywhere, too This ethnography is our work to create it Through it, we hope to support you in making your own abolitionist futures in real time","Burns, Devin; Dominguez, Lauren; Gordon, Rebekah; McTighe, Laura; Moss, Lydia; Rosario, Gabriela",Journal for the Anthropology of North America,500,23
